title,release_date,price,game_url,genres
Tales of Anturia: Farathan,2026,Indefinido,https://store.steampowered.com/app/1558030/Tales_of_Anturia_Farathan/?snr=1_7_7_popularcomingsoon_150_22,"RPG, Mundo Aberto, Boa Trama, Você Decide, Um Jogador, Fantasia Sombria, Enredo Rico, Vários Finais, Não Linear, Medieval, Terceira Pessoa, RPG de Ação, Realístico, Espada, CRPG, Escolha a sua Aventura, Personalização de Personagem, Sombrio, Demônios, 3D"
For The Hive,dezembro de 2026,Indefinido,https://store.steampowered.com/app/1747630/For_The_Hive/?snr=1_7_7_popularcomingsoon_150_22,"Acesso Antecipado, Exploração, Sobrevivência, Faça o que Quiser, Natureza, Hack and Slash, Escolha a sua Aventura, Diplomacia, Construção de Bases, RPG de Ação, Ação / Aventura, Personalização de Personagem, Estratégia, RPG, Primeira Pessoa, 3D, Mundo Aberto, Ação, Casual, Simulação"
Lair Land Story 2: Mist of Sea,2026,Indefinido,https://store.steampowered.com/app/1749810/Lair_Land_Story_2_Mist_of_Sea/?snr=1_7_7_popularcomingsoon_150_22,"Aventura, Simulador de Encontros, Simulação, Estratégia, 2D, JRPG, Romance Visual, RPG, Indie"
Dungeons of the Amber Griffin,2026,Indefinido,https://store.steampowered.com/app/1764280/Dungeons_of_the_Amber_Griffin/?snr=1_7_7_popularcomingsoon_150_22,"Explorador de Calabouços, RPG, Coleção de Criaturas, Subterrâneo, Mágica, Quebra-Cabeça, RPG de Ação, Fantasia, Movimento em Grade, Objetos Ocultos, Fantasia Sombria, Boa Trama, Exploração, Medieval, CRPG, Ação, Primeira Pessoa, Realístico, 3D, Vikings"
Demi and the Fractured Dream,2026,Indefinido,https://store.steampowered.com/app/1725710/Demi_and_the_Fractured_Dream/?snr=1_7_7_popularcomingsoon_150_22,"Ação, Aventura, Fantasia, Um Jogador, Combate, Indie"
SUMMER ROAD 10-Minute Auto Roguelite,2026,Indefinido,https://store.steampowered.com/app/2073980/SUMMER_ROAD_10Minute_Auto_Roguelite/?snr=1_7_7_popularcomingsoon_150_22,"Batalha Automática, Roguelite, Fofo, RPG, Casual, Curta-Metragem, Roguelike de Ação, Personalização de Personagem, Um Jogador, Multijogador Assíncrono, Visão Superior, 3D, Aventura, Controle, Você Decide, Atmosférico, Gerenciamento de Inventário, Hack and Slash, Progressão Ociosa, Cartunizado"
NAME OF THE WILL,2026,Indefinido,https://store.steampowered.com/app/2079920/NAME_OF_THE_WILL/?snr=1_7_7_popularcomingsoon_150_22,"Terror Psicológico, Boa Trama, Mistério, Cultos, Desenhado à Mão, Você Decide, Comovente, Aventura, Vários Finais, Sombrio, Atmosférico, Surrealista, 2D, Apontar e Clicar, Thriller, Distópico, Um Jogador, Estilizado, Indie, Câmera Lateral"
DROSS,2026,Indefinido,https://store.steampowered.com/app/2083940/DROSS/?snr=1_7_7_popularcomingsoon_150_22,"Roguelite, Cooperativo On-line, Tiro com Saques, RPG de Ação, Saques, Tiro de Tiozão, Jogador X Ambiente (PvE), Roguelike, Terror, Roguelike de Ação, Geração Procedural, Ação, Estilizado, Tiro, Alienígenas, Ficção Científica, Cooperativo, Simulador Imersivo, Tiro em Arena, Primeira Pessoa"
Devices Tycoon,2026,Indefinido,https://store.steampowered.com/app/2085660/Devices_Tycoon/?snr=1_7_7_popularcomingsoon_150_22,"Simulação, Estratégia, Faça o que Quiser, Capitalismo, Realístico, Simulador de Vida Real, Estratégia em Tempo Real (RTS), Gerenciamento de Tempo, 2D, Isométrico, Troca, Estilizado, Gerenciamento, Desenvolvimento de Jogos, Moderno, Economia, Jogador X Ambiente (PvE), Seis Graus de Liberdade, Inteligência Artificial, Pontos, Pontos, Pontos!"
Road Kings,2026,Indefinido,https://store.steampowered.com/app/2141130/Road_Kings/?snr=1_7_7_popularcomingsoon_150_22,"Aventura, Simulação, Simulador Automobilístico, Corredor, Gerenciamento de Tempo, 3D, Primeira Pessoa, Realístico, Terceira Pessoa, Gerenciamento, Transportes, Mundo Aberto, Relaxante, Gerenciamento de Inventário, Física, Multijogador, Jogador X Ambiente (PvE), Jogador x Jogador (PvP), Um Jogador, Direção"
Our Life: Now & Forever,2026,Free,https://store.steampowered.com/app/1622130/Our_Life_Now__Forever/?snr=1_7_7_popularcomingsoon_150_22,"Romance Visual, Personalização de Personagem, LGBTQIA+, Romance, Você Decide, Ficção Interativa, Do Bem, Escolha a sua Aventura, Aconchegante, Relaxante, Fofo, Vários Finais, Colorido, Comovente, Comédia, Simulador Imersivo, Não Linear, Um Jogador, Casual, Protagonista Mulher"
EDEN.schemata();,2026,Indefinido,https://store.steampowered.com/app/1630450/EDENschemata/?snr=1_7_7_popularcomingsoon_150_22,"Aventura, Steampunk, Mistério, Vários Finais, Desenhado à Mão, Exploração, Ficção Interativa, Objetos Ocultos, Cyberpunk, Fofo, Indie, Ficção Científica, História em Quadrinhos, Desenho Animado, Um Jogador, Romance Visual"
Jianghu Simulator,2026,Indefinido,https://store.steampowered.com/app/1633850/Jianghu_Simulator/?snr=1_7_7_popularcomingsoon_150_22,"Acesso Antecipado, RPG, Estratégia, Artes Marciais, Mundo Aberto, Indie, Compatível com Mods, Faça o que Quiser, Estratégia em Tempo Real com Ação, Personalização de Personagem, Boa Trama, Um Jogador, Aventura, Anime, Visão Superior, Gerenciamento de Recursos, RPG de Estratégia, Terceira Pessoa, Gerenciamento, Combate"
SILENT HILL: Townfall,2026,Indefinido,https://store.steampowered.com/app/1636440/SILENT_HILL_Townfall/?snr=1_7_7_popularcomingsoon_150_22,"Ação, Aventura, Terror Psicológico, Terror, Ação / Aventura, Primeira Pessoa, Exploração, Terror de Sobrevivência, 3D, Cinematográfico, Violento, Psicológico, Atmosférico, Anos 90, Um Jogador, Boa Trama, Vários Finais"
Cognition Method,2026,Indefinido,https://store.steampowered.com/app/1636620/Cognition_Method/?snr=1_7_7_popularcomingsoon_150_22,"Exploração, Primeira Pessoa, Quebra-Cabeça, Simulador de Caminhada, 3D, Terror, Terror Psicológico, Surrealista, Linear, Boa Trama, Vários Finais, Ação, Estilizado, Ficção Científica, Espacial, Psicodélico, Atmosférico, Investigação, Psicológico, Física"
Generation Ship,2026,Indefinido,https://store.steampowered.com/app/1638030/Generation_Ship/?snr=1_7_7_popularcomingsoon_150_22,"Simulador de Colônias, Construção de Cidades, Gerenciamento de Recursos, Simulação, Gerenciamento, Construção, Estratégia, Espacial, Simulador Espacial, Construção de Bases, Sobrevivência, Indie, Naves Espaciais, Simulador de Vida Real, Faça o que Quiser, Ficção Científica, Voo, Exploração, 3D, Um Jogador"
Nowhere Manor,4º trimestre de 2026,Indefinido,https://store.steampowered.com/app/2017120/Nowhere_Manor/?snr=1_7_7_popularcomingsoon_150_22,"Fantasia Sombria, Demônios, Desenhado à Mão, Gótico, Vários Finais, Romance Visual, Boa Trama, Atmosférico, Estilizado, Sombrio, Enredo Rico, Escolha a sua Aventura, Ficção Interativa, Você Decide, Psicodélico, Mistério, Indie, Distópico, Aventura, 2D"
CALX,2026,Indefinido,https://store.steampowered.com/app/2022640/CALX/?snr=1_7_7_popularcomingsoon_150_22,"Ação / Aventura, Combate, Exploração, Hack and Slash, Terceira Pessoa, Atmosférico, Minimalista, Um Jogador, Comovente, Plataforma 3D, Ação, Tiro, Metroidvania, Aventura, Personalização de Personagem, Surrealista, Ficção Científica, Plataforma, Linear, 3D"
"Springs, Eternal",2026,Indefinido,https://store.steampowered.com/app/3677850/Springs_Eternal/?snr=1_7_7_popularcomingsoon_150_22,"Aventura, Atmosférico, Exploração, Não Linear, Primeira Pessoa, Boa Trama, Comovente, Simulador de Caminhada, Retrô, 3D, Psicológico, Rico em Diálogos, Romance, Indie, Mistério, Investigação, Sobrenatural, Estilizado, Engraçado, Natureza"
Laws of Nadragia,2026,Indefinido,https://store.steampowered.com/app/1993410/Laws_of_Nadragia/?snr=1_7_7_popularcomingsoon_150_22,"Gráficos Pixelados, Aventura, Detetive, Investigação, Romance Visual, Boa Trama, Apontar e Clicar, Mistério, Crime, Engraçado, Isométrico, CRPG, Medieval, 2D, Steampunk, Você Decide, Vários Finais, Não Linear, Simulação, Fantasia"
Orc Warchief: Prologue,2026,,https://store.steampowered.com/app/2003070/Orc_Warchief_Prologue/?snr=1_7_7_popularcomingsoon_150_22,"Exploração, Estratégia em Tempo Real com Ação, Tática em Tempo Real, Construção de Cidades, Simulador de Colônias, Estratégia, Estratégia em Tempo Real (RTS), RPG de Estratégia, 3D, Construção de Bases, Boa Trama, Fantasia Sombria, Economia, Fantasia, Gerenciamento, Construção, Fabricação, Sobrevivência, Gerenciamento de Recursos, Um Jogador"
"Cook, Serve, Delicious: Re-Mustard!",2026,Indefinido,https://store.steampowered.com/app/2139040/Cook_Serve_Delicious_ReMustard/?snr=1_7_7_popularcomingsoon_150_22,"Casual, Gerenciamento de Tempo, Culinária, Simulação, Digitação, Engraçado, Cooperativo, Campanha Cooperativa, Gerenciamento, Arcade, 2D, Colorido, Ação, Fofo, Desenhado à Mão, Simulador de Vida Real, Controle, Não Linear, Cooperativo Local, Um Jogador"
Forgotten house,2026,Indefinido,https://store.steampowered.com/app/2111430/Forgotten_house/?snr=1_7_7_popularcomingsoon_150_22,"Terror, Aventura, Terror de Sobrevivência, Atmosférico, Sombrio, Furtivo, Quebra-Cabeça, Exploração, Objetos Ocultos, Câmera Lateral, 2D, Gráficos Pixelados, Estilizado, Vários Finais, Protagonista Mulher, Mistério, Terror Psicológico, Fofo, Um Jogador, Indie"
KVLT,2026,Indefinido,https://store.steampowered.com/app/2113960/KVLT/?snr=1_7_7_popularcomingsoon_150_22,"Tiro em Primeira Pessoa (FPS), Tiro de Tiozão, Tiro, Lovecraftiano, Um Jogador, Violência Detalhada, Sobrenatural, Retrô, Segunda Guerra Mundial, 3D, Primeira Pessoa, Terror, Subterrâneo, Linear, Ação, Fantasia Sombria, Sombrio, Velha-Guarda, Indie, Mágica"
Red Rebellion,2026,Indefinido,https://store.steampowered.com/app/2114160/Red_Rebellion/?snr=1_7_7_popularcomingsoon_150_22,"Aventura, Romance Visual, Boa Trama, Medieval, Protagonista Mulher, Histórico, Romance, Quebra-Cabeça, LGBTQIA+, Lobos, Fantasia, Espionagem, Comovente, Você Decide, Ficção Interativa, Anime, Mistério, Rico em Diálogos, Baseado em Texto, Casual"
Tenebris Somnia,2026,Indefinido,https://store.steampowered.com/app/2121510/Tenebris_Somnia/?snr=1_7_7_popularcomingsoon_150_22,"Terror de Sobrevivência, Aventura, Gráficos Pixelados, Cinematográfico, Terceira Pessoa, Anos 80, Atmosférico, Boa Trama, Terror, Quebra-Cabeça, Protagonista Mulher, Velha-Guarda, 2D, Exploração, FMV, Um Jogador, Sombrio, Retrô, Terror Psicológico, Apontar e Clicar"
Eternal Remnant,2026,Indefinido,https://store.steampowered.com/app/1946380/Eternal_Remnant/?snr=1_7_7_popularcomingsoon_150_22,"Aventura, RPG, Indie, Boa Trama, Comovente, Exploração, JRPG, 2D, Controle, Linear, Combate em Turnos, Gráficos Pixelados, Fantasia, Atmosférico, Combate, Um Jogador, RPG de Grupos, Estratégia em Turnos, Explorador de Calabouços, Arco e Flecha"
DearMyFriend,2026,Indefinido,https://store.steampowered.com/app/1953430/DearMyFriend/?snr=1_7_7_popularcomingsoon_150_22,"Gráficos Pixelados, RPG de Ação, Protagonista Mulher, Boa Trama, Exploração, RPG, Explorador de Calabouços, Ação, Ação / Aventura, Aventura, História em Quadrinhos, Um Jogador, JRPG, Distópico, Indie"
Space Scavenger 2,2026,Indefinido,https://store.steampowered.com/app/1962010/Space_Scavenger_2/?snr=1_7_7_popularcomingsoon_150_22,"Acesso Antecipado, Roguelike de Ação, Controle com Alavanca Dupla, 2,5D, Um Jogador, Visão Superior, Alta Rejogabilidade, Colorido, Cooperativo Local, Tela Dividida, Espacial, Roguelike, SHMUP com Visão Superior, Geração Procedural, Estilizado, Viagem no Tempo, Aventura, Ação, Exploração, Ficção Científica"
Dr. Emmerson's Nocturnes,2026,,https://store.steampowered.com/app/2361560/Dr_Emmersons_Nocturnes/?snr=1_7_7_popularcomingsoon_150_22,"Terror Psicológico, Lovecraftiano, Boa Trama, Terror, Romance Visual, Atmosférico, Ficção Interativa, Mistério, Apontar e Clicar, Aventura, Simulador de Caminhada, Casual, 3D, Baseado em Texto, Primeira Pessoa, Realístico, RV, Escolha a sua Aventura, Um Jogador, Narrativa"
Hollow Home,2026,Indefinido,https://store.steampowered.com/app/2362070/Hollow_Home/?snr=1_7_7_popularcomingsoon_150_22,"RPG, Narrativa, Guerra, Comovente, Atmosférico, Boa Trama, Aventura, Você Decide, Isométrico, Vários Finais, CRPG, Sobrevivência, Rico em Diálogos, Um Jogador, Político, Indie, Fabricação, Exploração, Histórico, Ação / Aventura"
METRO PENGUIN EUTOPIA,2026,Indefinido,https://store.steampowered.com/app/2364190/METRO_PENGUIN_EUTOPIA/?snr=1_7_7_popularcomingsoon_150_22,"RPG, Aventura, RPG de Estratégia, 2D, Comédia, Pós-Apocalíptico, Subterrâneo, Atmosférico, Combate em Turnos, Vários Finais, Protagonista Mulher, Boa Trama, Você Decide, Um Jogador, Indie, Tática por Turnos, Exploração, Escolha a sua Aventura"
Let's Build a Dungeon,2026,Indefinido,https://store.steampowered.com/app/2365790/Lets_Build_a_Dungeon/?snr=1_7_7_popularcomingsoon_150_22,"Gerenciamento, Tática em Tempo Real, Construção, Construção de Cidades, Plataforma 2D, Desenvolvimento de Jogos, Programação, Simulador de Vida Real, Estratégia, 2D, Casual, Fofo, Software, Simulação, Gráficos Pixelados, Retrô, RPG, Anos 90, Um Jogador, Faça o que Quiser"
Mariachi Legends,4º trimestre de 2026,Indefinido,https://store.steampowered.com/app/2376260/Mariachi_Legends/?snr=1_7_7_popularcomingsoon_150_22,"Metroidvania, Gráficos Pixelados, Indie, Ação / Aventura, Combate, Ação, Sobrenatural, Detetive, Enredo Rico, Plataforma 2D, Aventura, Plataforma, Câmera Lateral, Hack and Slash, 2D, Mágica, Boa Trama, Um Jogador, Violento, Nudez"
Not Only Nine,4º trimestre de 2026,Indefinido,https://store.steampowered.com/app/2377160/Not_Only_Nine/?snr=1_7_7_popularcomingsoon_150_22,"Romance Visual, Comovente, Simulador de Caminhada, Trilha Sonora, Boa Trama, Atmosférico, Retrô, Gatos, Enredo Rico, Anime, JRPG, RPG, Ficção Científica, Aconchegante, Combate em Turnos, Do Bem, Comédia, Eventos Rápidos, Relaxante, Você Decide"
Cozy Dungeons,2026,Indefinido,https://store.steampowered.com/app/2377600/Cozy_Dungeons/?snr=1_7_7_popularcomingsoon_150_22,"Construção, Aventura, Ação / Aventura, RPG, Relaxante, Casual, Aconchegante, Simulação, Explorador de Calabouços, Simulador de Vida Real, Um Jogador, Desenho Animado, Boa Trama, Colorido, Para Toda a Família, Fantasia, Fofo, Medieval, Personalização de Personagem, Estilizado"
TankRat,2026,Indefinido,https://store.steampowered.com/app/1637460/TankRat/?snr=1_7_7_popularcomingsoon_150_22,"Ação, Aventura, Tanques, Pós-Apocalíptico, Combate, Combate com Veículos, Boa Trama, Tiro, Terceira Pessoa, Exploração, Tiro em Terceira Pessoa, 3D, Cinematográfico, Distópico, Atmosférico, Futurista, Um Jogador, Ação / Aventura, Controle, Robôs"
Kanun 1919,2026,Indefinido,https://store.steampowered.com/app/2502870/Kanun_1919/?snr=1_7_7_popularcomingsoon_150_22,"Aventura, Quebra-Cabeça, Atmosférico, Boa Trama, Sombrio, Controle, Terror, Câmera Lateral, Indie, 2D, Ação, Um Jogador, Ação / Aventura, Estilizado, História Alternativa, Distópico, Primeira Guerra Mundial, Exploração, Plataforma 2D, Plataforma"
S: Lost Chapters,2026,Indefinido,https://store.steampowered.com/app/2506890/S_Lost_Chapters/?snr=1_7_7_popularcomingsoon_150_22,"Ação, Aventura, Exploração, Primeira Pessoa, Terror, Indie, Sombrio, Psicológico, Terror Psicológico, Sobrevivência, Terror de Sobrevivência, Violência Detalhada, Violento, Um Jogador, Mundo Aberto, Jump Scare"
Thalassophobia,2026,Indefinido,https://store.steampowered.com/app/2507690/Thalassophobia/?snr=1_7_7_popularcomingsoon_150_22,"Simulação, Terror, Realístico, Subaquático, Terror de Sobrevivência, Cooperativo On-line, RPG de Grupos, Primeira Pessoa, 3D, Simulador Imersivo, Casual, Objetos Ocultos, Natureza, Naval, Futurista, Investigação, Jogador X Ambiente (PvE), Inteligência Artificial, Ação, Luta 3D"
Beyond The Plastic Wall,2026,Indefinido,https://store.steampowered.com/app/2418040/Beyond_The_Plastic_Wall/?snr=1_7_7_popularcomingsoon_150_22,"Aventura, Ficção Interativa, Simulador de Caminhada, Exploração, 2,5D, 3D, Gráficos Pixelados, Estilizado, Atmosférico, Cyberpunk, Comovente, Você Decide, Protagonista Mulher, Linear, Vários Finais, Boa Trama, Um Jogador, Quebra-Cabeça, Mistério, Pós-Apocalíptico"
HARUKA: Beyond the Stars,2026,Indefinido,https://store.steampowered.com/app/2425200/HARUKA_Beyond_the_Stars/?snr=1_7_7_popularcomingsoon_150_22,"Ação, RPG, JRPG, RPG de Ação, Plataforma 3D, 3D, História em Quadrinhos, Ficção Científica, Pós-Apocalíptico, Espacial, Gatos, Futurista, Boa Trama, Um Jogador, Fofo"
Paris Transylvania,2026,Indefinido,https://store.steampowered.com/app/2459560/Paris_Transylvania/?snr=1_7_7_popularcomingsoon_150_22,"Montagem de Decks, Roguelike, Roguelite, Pinball, Em Turnos, Estratégia, Morte Permanente, Alta Rejogabilidade, RPG, Combate em Turnos, Montagem de Decks Roguelike, Cartas, Um Jogador, Física, Batalha com Cartas, Arcade, Fantasia, Indie, Casual, Jogo de Tabuleiro"
Magic Wands Workshop,2026,Indefinido,https://store.steampowered.com/app/3407480/Magic_Wands_Workshop/?snr=1_7_7_popularcomingsoon_150_23,"Mágica, Simulação, Apontar e Clicar, Fabricação, Um Jogador, Indie, Relaxante, Gerenciamento, Simulador de Vida Real, Casual, Faça o que Quiser, Gerenciamento de Recursos, Troca, Fantasia, Atmosférico, Simulador Imersivo, Construção, Colorido, Para Toda a Família, Capitalismo"
Simulario,2026,Indefinido,https://store.steampowered.com/app/3343970/Simulario/?snr=1_7_7_popularcomingsoon_150_23,"Simulação, Casual, Faça o que Quiser, Destruição, Arcade, Relaxante, Plataforma, Gráficos Pixelados, Tiro, Plataforma 2D, Simulador Imersivo, Voxel, Mandando Bala, 2D, SHMUP com Visão Superior, Realístico, Direção, Voo, Estrada de Terra, Tanques"
Severed Love,2026,Indefinido,https://store.steampowered.com/app/3412110/Severed_Love/?snr=1_7_7_popularcomingsoon_150_23,"Otome, Terror Psicológico, Romance Visual, Protagonista Mulher, Anime, Terror de Sobrevivência, Apontar e Clicar, Mistério, Thriller, Detetive, Aventura, Sombrio, Escolha a sua Aventura, Humor Ácido, Vários Finais, Boa Trama, Romance, Atmosférico, Cinematográfico, Desenhado à Mão"
UNDERGROUNDED,2026,Indefinido,https://store.steampowered.com/app/3076910/UNDERGROUNDED/?snr=1_7_7_popularcomingsoon_150_23,"Apontar e Clicar, Exploração, Escolha a sua Aventura, Retrô, Objetos Ocultos, Quebra-Cabeça, Arcade, Colete Tudo, 2D, Isométrico, Histórico, Linear, Rico em Diálogos, Boa Trama, Engraçado, Você Decide, Mistério, Atmosférico, Aventura, RPG"
Dragon Shelter,2026,Indefinido,https://store.steampowered.com/app/2712590/Dragon_Shelter/?snr=1_7_7_popularcomingsoon_150_23,"Simulação, Do Bem, Dragões, Rural, Gerenciamento, Fofo, Fantasia, Exploração, Coleção de Criaturas, Simulador Rural, Simulador de Vida Real, 3D, Colorido, Fabricação, Para Toda a Família, Um Jogador, Natureza, Casual, Relaxante, Aconchegante"
Resonance: A Plague Tale Legacy,2026,Indefinido,https://store.steampowered.com/app/2713000/Resonance_A_Plague_Tale_Legacy/?snr=1_7_7_popularcomingsoon_150_23,"Ação, Aventura, Ação / Aventura, Quebra-Cabeça, Calabouço Misterioso, Colorido, Terceira Pessoa, Atmosférico, Comovente, Fantasia, Histórico, Lógica, Enredo Rico, Medieval, Mistério, Mitologia, Sobrenatural, Combate, Protagonista Mulher, Jogador X Ambiente (PvE)"
Raiders Rise,2026,Free,https://store.steampowered.com/app/3376580/Raiders_Rise/?snr=1_7_7_popularcomingsoon_150_23,"Roguelike de Ação, Ação, Cooperativo On-line, Controle com Alavanca Dupla, SHMUP com Visão Superior, Jogador x Jogador (PvP), Jogador X Ambiente (PvE), Roguelike, Tiro em Arena, Multijogador, Sobrevivência, 3D, Visão Superior, Mandando Bala, eSports, Ficção Científica, Estratégia, Aventura, RPG, Cyberpunk"
The Retrospection Of Tomorrow,Q4 2026,Indefinido,https://store.steampowered.com/app/3376860/The_Retrospection_Of_Tomorrow/?snr=1_7_7_popularcomingsoon_150_23,"Viagem no Tempo, Thriller, Protagonista Mulher, Otome, Ficção Científica, Filosófico, Mistério, Romance Visual, Simulador de Encontros, RPG, Boa Trama, Romance, Aventura, Comovente, Detetive, Lógica, Vários Finais, Sombrio, Moderno, Terror Psicológico"
Killer Chat! - Expanded Edition,2026,Indefinido,https://store.steampowered.com/app/3378100/Killer_Chat__Expanded_Edition/?snr=1_7_7_popularcomingsoon_150_23,"Simulador de Encontros, Simulação, Romance, Romance Visual, Terror, Terror Psicológico, Personalização de Personagem, Sombrio, Otome, LGBTQIA+, Escolha a sua Aventura, Simulador Imersivo, Ficção Interativa, Humor Ácido, Atmosférico, Primeira Pessoa, Comédia, Crime, Vários Finais, Boa Trama"
RPG Chess,2026,Indefinido,https://store.steampowered.com/app/3383450/RPG_Chess/?snr=1_7_7_popularcomingsoon_150_23,"RPG, Xadrez, Combate em Turnos, Jogo de Tabuleiro, RPG Tático, Multijogador, Competitivo, Estratégia em Turnos, Jogo de Mesa, Visão Superior, 3D, Roguelite, Estilizado, Estratégia, Jogador x Jogador (PvP), Tático, Um Jogador, Tática por Turnos, Aventura, Casual"
Planet Party Time,2026,Free,https://store.steampowered.com/app/3384570/Planet_Party_Time/?snr=1_7_7_popularcomingsoon_150_23,"Simulador de Vida Real, RPG, Espacial, Multijogador, Reúna a Galera, Editor de Níveis, Fofo, Mundo Aberto, Construção, Competitivo, Fabricação, Agricultura, Pesca, Casual, Simulador Rural, Cooperativo, Personalização de Personagem, Relaxante, Multijogador Massivo, Simulação"
Broken Relic,2026,Indefinido,https://store.steampowered.com/app/3384820/Broken_Relic/?snr=1_7_7_popularcomingsoon_150_23,"Apontar e Clicar, Comédia, Aventura, Fantasia, Boa Trama, 2D, Quebra-Cabeça, Gráficos Pixelados, Dragões, Um Jogador, Paródia, Engraçado, Retrô, Indie, Medieval, Lógica, Mágica, Velha-Guarda, Colorido, Fantasia Sombria"
My Fairy Princess,2026,Indefinido,https://store.steampowered.com/app/3387240/My_Fairy_Princess/?snr=1_7_7_popularcomingsoon_150_23,"Simulador de Vida Real, Protagonista Mulher, RPG, Você Decide, Anime, Vários Finais, Simulador de Encontros, Simulação, RPG de Estratégia, JRPG, Boa Trama, Exploração, Gerenciamento de Tempo, Fantasia, Relaxante, Casual, Um Jogador, Aventura, Ação / Aventura, 2D"
Moon River,2026,Free,https://store.steampowered.com/app/3392490/Moon_River/?snr=1_7_7_popularcomingsoon_150_23,"Gratuito para Jogar, Indie, Gráficos Pixelados, Atmosférico, RPG, Exploração, Aventura, Casual, Abstrato, Música, Simulador de Caminhada, Um Jogador, 2D, Colorido, Comovente, Mistério, Natureza, Sombrio, Curta-Metragem, Rico em Diálogos"
AION 2,2026,Free,https://store.steampowered.com/app/3393110/AION_2/?snr=1_7_7_popularcomingsoon_150_23,"Gratuito para Jogar, Multijogador Massivo, MMORPG, Aventura, RPG, Mundo Aberto, Ação, Personalização de Personagem, Jogador X Ambiente (PvE), Fantasia, Jogador x Jogador (PvP), Exploração, Fabricação, Troca, Combate, Ação / Aventura, 3D, Terceira Pessoa, Baseado em Classes, Colete Tudo"
Anime Shop Simulator ✨,2026,Indefinido,https://store.steampowered.com/app/3393280/Anime_Shop_Simulator/?snr=1_7_7_popularcomingsoon_150_23,"Simulação, Anime, Cooperativo On-line, Cartas, Casual, Gerenciamento, Simulador de Vida Real, Primeira Pessoa, Um Jogador, Simulador Imersivo, Jogo de Cartas, Gerenciamento de Lojas, Jogador x Jogador (PvP), Cooperativo, 3D, Colete Tudo, Multijogador, Simulador de Emprego, Aventura, Aconchegante"
Dicewood,2026,Indefinido,https://store.steampowered.com/app/3393850/Dicewood/?snr=1_7_7_popularcomingsoon_150_23,"Coleção de Criaturas, Dados, Fantasia Sombria, Mistério, Gatos, Roguelike, Montagem de Decks, Batalha com Cartas, Sombrio, Terror, Gráficos Pixelados, Estratégia, Fofo, Um Jogador, Sobrenatural, Cartas, Aventura, Combate em Turnos, Explorador de Calabouços, Casual"
Above Land: Rhapsody,2026,Indefinido,https://store.steampowered.com/app/3500460/Above_Land_Rhapsody/?snr=1_7_7_popularcomingsoon_150_23,"Roguelike de Ação, Roguelite, RPG de Ação, Cooperativo On-line, Cooperativo, Hack and Slash, Terceira Pessoa, Jogador X Ambiente (PvE), Fantasia, Aventura, Estilizado, Ação, RPG, Multijogador, Um Jogador, 3D, Personalização de Personagem, Pesca, Comédia, Saques"
DO NOT PLAY,2026,Indefinido,https://store.steampowered.com/app/3502970/DO_NOT_PLAY/?snr=1_7_7_popularcomingsoon_150_23,"Aventura, Casual, Apontar e Clicar, Simulador Imersivo, 2D, Terror, Indie, Um Jogador, Ação"
Medieval Horse Dealer Simulator,2026,Indefinido,https://store.steampowered.com/app/3503710/Medieval_Horse_Dealer_Simulator/?snr=1_7_7_popularcomingsoon_150_23,"Simulação, Simulador Imersivo, Cavalos, Medieval, Economia, Gerenciamento, Simulador de Vida Real, Simulador Rural, Rural, Construção, Fabricação, Gerenciamento de Recursos, Gerenciamento de Inventário, Gerenciamento de Tempo, Construção de Bases, Mineração, Troca, Realístico, Um Jogador, Primeira Pessoa"
Arctic Drive,2026,Indefinido,https://store.steampowered.com/app/4009490/Arctic_Drive/?snr=1_7_7_popularcomingsoon_150_23,"Direção, Sobrevivência, Boa Trama, Multijogador, Simulador Automobilístico, Exploração, Pós-Apocalíptico, Aventura, Primeira Pessoa, Simulação, Corrida, Faça o que Quiser, Personalização de Personagem, Construção de Bases, 3D, Neve, Mundo Aberto, Controle, Transportes, Ação"
Small Kingdoms,2026,Indefinido,https://store.steampowered.com/app/2533000/Small_Kingdoms/?snr=1_7_7_popularcomingsoon_150_23,"Grande Estratégia, Estratégia em Tempo Real (RTS), 4X, Estratégia, Medieval, Jogo de Guerra, Fantasia, Simulação, Tático, Guerra, Combate, Geração Procedural, Gerenciamento de Recursos, Um Jogador, Construção de Cidades, Militar, Simulador de Colônias, Histórico, Construção de Bases, Retrô"
