title,release_date,price,game_url,genres
goblinAmerica,4º trimestre de 2025,Indefinido,https://store.steampowered.com/app/1944040/goblinAmerica/?snr=1_7_7_popularcomingsoon_150_14,"Exploração, Tiro em Primeira Pessoa (FPS), Tiro de Tiozão, Capitalismo, Simulador Imersivo, Jogador X Ambiente (PvE), Enredo Rico, Tiro, RPG de Ação, 3D, Primeira Pessoa, Terror, Surrealista, Subterrâneo, Vários Finais, Não Linear, Boa Trama, Ação, Colorido, Fantasia Sombria"
深渊奇境,2025,Indefinido,https://store.steampowered.com/app/1985940/Abyss_Fantasia/?snr=1_7_7_popularcomingsoon_150_14,"RPG, Aventura, Desenhado à Mão, Fantasia, Combate em Turnos, Estilizado, Vários Finais, Um Jogador, Indie, Cartas, Simulador Imersivo"
Laws of Nadragia,2025,Indefinido,https://store.steampowered.com/app/1993410/Laws_of_Nadragia/?snr=1_7_7_popularcomingsoon_150_14,"Gráficos Pixelados, Aventura, Detetive, Investigação, Romance Visual, Boa Trama, Apontar e Clicar, Mistério, Crime, Engraçado, Isométrico, CRPG, Medieval, 2D, Steampunk, Você Decide, Vários Finais, Não Linear, Simulação, Fantasia"
SUMMER ROAD 10-Minute Auto Roguelite,2025,Indefinido,https://store.steampowered.com/app/2073980/SUMMER_ROAD_10Minute_Auto_Roguelite/?snr=1_7_7_popularcomingsoon_150_14,"Batalha Automática, Roguelite, Fofo, Roguelike de Ação, Curta-Metragem, Multijogador Assíncrono, RPG, Um Jogador, Visão Superior, Casual, Personalização de Personagem, Protagonista Mulher, 3D, Aventura, Controle, Você Decide, Atmosférico, Gerenciamento de Inventário, Hack and Slash, Incremental"
Galaxy Princess Zorana,2025,Indefinido,https://store.steampowered.com/app/3069630/Galaxy_Princess_Zorana/?snr=1_7_7_popularcomingsoon_150_14,"Simulador Político, Romance Visual, Diplomacia, Protagonista Mulher, Simulador de Vida Real, Você Decide, Fantasia, RPG, Anime, Estratégia, Boa Trama, LGBTQIA+, Simulação, Vários Finais, Ficção Científica, Futurista, Alienígenas, Um Jogador, Indie"
A Week in the Life of Asocial Giraffe,2025,Indefinido,https://store.steampowered.com/app/3071440/A_Week_in_the_Life_of_Asocial_Giraffe/?snr=1_7_7_popularcomingsoon_150_14,"Comédia, Apontar e Clicar, Quebra-Cabeça, Engraçado, 2D, Desenho Animado, Fofo, Aventura, Do Bem, Desenhado à Mão, Boa Trama, Casual, Linear, Indie, Um Jogador, Para Toda a Família, Furtivo"
Karting of Banban,2025,Indefinido,https://store.steampowered.com/app/3248310/Karting_of_Banban/?snr=1_7_7_popularcomingsoon_150_14,"Corrida, Arcade, 3D, Corrida com Combate, Terror, Ação, Cartunizado, Aventura, Colorido, Casual, Multijogador, Fofo, Multijogador Local, Física, Comédia, Direção, Estilizado, Ação / Aventura, Psicodélico, Para Toda a Família"
Pinbleton Park,2025,Indefinido,https://store.steampowered.com/app/3323970/Pinbleton_Park/?snr=1_7_7_popularcomingsoon_150_14,"Aventura, Ação / Aventura, Arcade, Colete Tudo, Coleção de Criaturas, Exploração, Metroidvania, 3D, Anime, Colorido, Fofo, Estilizado, Terceira Pessoa, Investigação, Mágica, Mitologia, Natureza, Relaxante, Gerenciamento de Inventário, Anos 90"
UMAMI,4º trimestre de 2025,Indefinido,https://store.steampowered.com/app/3669360/UMAMI/?snr=1_7_7_popularcomingsoon_150_14,"Quebra-Cabeça, Relaxante, Fofo, Do Bem, 3D, Desenhado à Mão, Culinária, Lógica, Aconchegante, Colorido, Casual, Física, Nostalgia, Para Toda a Família, Atmosférico, Um Jogador, Colete Tudo, Apontar e Clicar, Objetos Ocultos, Só Mouse"
Nano Neighbors,2025,Indefinido,https://store.steampowered.com/app/3590780/Nano_Neighbors/?snr=1_7_7_popularcomingsoon_150_14,"Incremental, Simulador de Vida Real, Relaxante, Fofo, 2D, Automação, Colorido, Simulador de Encontros, Casual, Construção, Roguelite, Gráficos Pixelados, Apontar e Clicar, Simulação, Personalização de Personagem, Anime, Ficção Científica, Gerenciamento de Recursos, Cooperativo On-line, Um Jogador"
World's Worst Handyman,2025,Indefinido,https://store.steampowered.com/app/1333930/Worlds_Worst_Handyman/?snr=1_7_7_popularcomingsoon_150_14,"Engraçado, Furtivo, Física, Comédia, Ação / Aventura, Simulação, Aventura, Fofo, Colorido, Paródia, Memes, Ação, Quebra-Cabeça, Estilizado, Para Toda a Família, Cartunizado, Destruição, Boa Trama, Exploração, Faça o que Quiser"
VUP-Simulator,2025,Indefinido,https://store.steampowered.com/app/1352140/VUPSimulator/?snr=1_7_7_popularcomingsoon_150_14,"Simulação, Gerenciamento de Tempo, Simulador de Vida Real, CRPG, Anime, RPG, Fofo, Desenho Animado, Compatível com Mods, Nudez, Baseado em Classes, Acesso Antecipado, Gerenciamento de Recursos, Você Decide, Um Jogador, Gerenciamento"
Black Gold: Oil Drilling Simulator,2025,Indefinido,https://store.steampowered.com/app/1473260/Black_Gold_Oil_Drilling_Simulator/?snr=1_7_7_popularcomingsoon_150_14,"Ação, Simulação, Economia, Construção, Gerenciamento, Faça o que Quiser, Sobrevivência, Primeira Pessoa, Realístico, Atmosférico, Histórico, Indie, Você Decide, Fabricação, Gerenciamento de Recursos, Um Jogador"
There's no way that tsundere girl I met in the infirmary will be my girlfriend,Q4 2025,Indefinido,https://store.steampowered.com/app/1553640/Theres_no_way_that_tsundere_girl_I_met_in_the_infirmary_will_be_my_girlfriend/?snr=1_7_7_popularcomingsoon_150_14,"Nudez, Conteúdo Sexual, Hentai, Anime, Para Adultos, Romance Visual, Tiro em Primeira Pessoa (FPS), Impróprio para o Local de Trabalho, Jogo de Palavras, Um Jogador, Fofo, Vários Finais, RPG, Casual, Ação, Simulação, Drama, Desenho Animado, 2D, Baseado em Texto"
Mythos: Build & Survive,2025,Indefinido,https://store.steampowered.com/app/1570220/Mythos_Build__Survive/?snr=1_7_7_popularcomingsoon_150_14,"Mitologia, Estratégia em Tempo Real (RTS), Construção de Cidades, Medieval, Fantasia, Relaxante, Construção de Bases, Sobrevivência, Gerenciamento de Recursos, Casual, Simulação, Estratégia, Vikings, Colorido, Fabricação, Gerenciamento, Faça o que Quiser, Visão Superior, Jogo de Guerra, Um Jogador"
Agent 64: Spies Never Die,2025,Indefinido,https://store.steampowered.com/app/1574480/Agent_64_Spies_Never_Die/?snr=1_7_7_popularcomingsoon_150_14,"Tiro em Primeira Pessoa (FPS), Retrô, Exploração, Conspiração, Tiro de Tiozão, Tela Dividida, Velha-Guarda, Anos 90, Furtivo, Hacker, Assalto, Ação, Tiro, Multijogador Local, Cooperativo Local, Primeira Pessoa, Linear, Um Jogador, Ação / Aventura, Aventura"
Morgenstern,2025,Indefinido,https://store.steampowered.com/app/1627210/Morgenstern/?snr=1_7_7_popularcomingsoon_150_14,"Roguelike de Ação, Cooperativo On-line, Hack and Slash, Multijogador, Soulslike, Jogador X Ambiente (PvE), Fantasia, RPG de Ação, Alta Rejogabilidade, Terceira Pessoa, 3D, Controle, Cooperativo, RPG, Personalização de Personagem, Jogador x Jogador (PvP), Ação, Fantasia Sombria, Medieval, Aventura"
Windswept,2025,Indefinido,https://store.steampowered.com/app/1660960/Windswept/?snr=1_7_7_popularcomingsoon_150_14,"Plataforma 2D, Plataforma, Difícil, Aventura, Plataforma de Precisão, Gráficos Pixelados, Indie, Ação, Fofo, Cooperativo, Retrô, 2D, Um Jogador, Ritmo Rápido, Cooperativo Local, Colorido, Kickstarter, Colete Tudo, Multijogador Local, Ação / Aventura"
Pax Autocratica,Q4 2025,Indefinido,https://store.steampowered.com/app/1067360/Pax_Autocratica/?snr=1_7_7_popularcomingsoon_150_14,"Ação / Aventura, Multijogador, RPG de Ação, Simulador Político, Simulador de Colônias, Roguelite, Construção de Bases, Militar, Estratégia, Humor Ácido, Cooperativo On-line, Mechas, Roguelike de Ação, 3D, Cooperativo, Alienígenas, Jogador X Ambiente (PvE), Jogador x Jogador (PvP), Um Jogador, Ação"
Dark Moon,2025,Indefinido,https://store.steampowered.com/app/1105330/Dark_Moon/?snr=1_7_7_popularcomingsoon_150_14,"Gerenciamento, Construção de Bases, Economia, Simulador de Colônias, Gerenciamento de Recursos, Você Decide, Sombrio, Exploração, Pós-Apocalíptico, Estratégia, Estratégia em Tempo Real (RTS), Sobrevivência, Espacial, Ficção Científica, Um Jogador, Atmosférico, Indie, Simulação, Ritmo Rápido, Arcade"
Last Moon,2025,Indefinido,https://store.steampowered.com/app/1108600/Last_Moon/?snr=1_7_7_popularcomingsoon_150_14,"Aventura, Ação, Um Jogador, RPG, 2D, Fantasia, RPG de Ação, Gráficos Pixelados, Indie, Exploração, Fofo, Colorido, Atmosférico, Retrô, Soulslike, Desenhado à Mão, Mundo Aberto, Trilha Sonora Boa, Metroidvania, Controle"
Neverlooted Dungeon,2025,Indefinido,https://store.steampowered.com/app/1171980/Neverlooted_Dungeon/?snr=1_7_7_popularcomingsoon_150_14,"Explorador de Calabouços, Simulador Imersivo, Física, Fantasia Sombria, RPG, Primeira Pessoa, Atmosférico, Quebra-Cabeça, Um Jogador, Imersivo, Fantasia, Humor Ácido, Alta Rejogabilidade, Não Linear, Exploração, Faça o que Quiser, Terror, Furtivo, Indie, Retrô"
Zodiac Legion,4º trimestre de 2025,Indefinido,https://store.steampowered.com/app/812910/Zodiac_Legion/?snr=1_7_7_popularcomingsoon_150_14,"Tática por Turnos, Tático, Personalização de Personagem, Morte Permanente, Construção de Bases, Estratégia em Turnos, RPG Tático, Jogo de Guerra, Estratégia, Combate em Turnos, Compatível com Mods, Geração Procedural, Faça o que Quiser, Fantasia, RPG, RPG de Estratégia, Um Jogador, 2,5D, Acesso Antecipado, Difícil"
Star Ores Inc.,4º trimestre de 2025,Indefinido,https://store.steampowered.com/app/3613270/Star_Ores_Inc/?snr=1_7_7_popularcomingsoon_150_14,"Gerenciamento, Simulação, Automação, Construção, Gerenciamento de Recursos, Um Jogador, Exploração, Relaxante, Espacial, Faça o que Quiser, Indie, Para Toda a Família, Controle, Primeira Pessoa, Construção de Bases, Mineração, Futurista, Casual, Ficção Científica, 3D"
Haunted Room! Urami-chan,Q4 2025,Indefinido,https://store.steampowered.com/app/3818090/Haunted_Room_Uramichan/?snr=1_7_7_popularcomingsoon_150_14,"Câmera Lateral, Ficção Interativa, Protagonista Mulher, Aventura, 2D, Fofo, Controle, Anime, Desenhado à Mão, Gatos, Comédia, Anos 80, Retrô, Um Jogador"
687 Days on Mars,2025,Indefinido,https://store.steampowered.com/app/3850980/687_Days_on_Mars/?snr=1_7_7_popularcomingsoon_150_14,"Simulação, Gerenciamento de Recursos, Aventura, Construção de Bases, Casual, Ficção Científica, Sobrevivência, Ação, Marte, Colorido, Simulador de Vida Real, Faça o que Quiser, Simulador Imersivo, Primeira Pessoa, Ação / Aventura, Simulador de Caminhada, Exploração, Simulador de Epidemias, Futurista, Simulador de Colônias"
holoVillage: Our Cozy Days,December 2025,Indefinido,https://store.steampowered.com/app/3856280/holoVillage_Our_Cozy_Days/?snr=1_7_7_popularcomingsoon_150_14,"Aventura, RPG de Ação, Construção de Cidades, Colete Tudo, Objetos Ocultos, Exploração, 3D, Fofo, Anime, Estilizado, Um Jogador, Sobrevivência, Construção de Bases, Fantasia, Combate, Controle, Saques, Mágica, Terceira Pessoa, Construção"
IT Specialist Simulator,Q4 2025,Indefinido,https://store.steampowered.com/app/3266090/IT_Specialist_Simulator/?snr=1_7_7_popularcomingsoon_150_14,"Simulação, Educativo, Simulador Imersivo, Programação, Gerenciamento, Casual, Faça o que Quiser, Primeira Pessoa, 3D, Realístico, Relaxante, Para Toda a Família, Simulador de Emprego, Um Jogador, Hardware, Eletrônico, Engraçado, Gerenciamento de Inventário, Indie, Quebra-Cabeça"
Piñata Go Boom,2025,Indefinido,https://store.steampowered.com/app/3269180/Piata_Go_Boom/?snr=1_7_7_popularcomingsoon_150_14,"Casual, Estratégia, Simulação, Clique e Clique, Arcade, Gerenciamento, Incremental, 2D, Gráficos Pixelados, Relaxante, Economia, Minimalista, Visão Superior, Indie, Colorido, Um Jogador, Colete Tudo, Saques, Explorador de Calabouços, Simulador de Emprego"
SpaceCraft,2025,Indefinido,https://store.steampowered.com/app/3276050/SpaceCraft/?snr=1_7_7_popularcomingsoon_150_14,"Acesso Antecipado, Ficção Científica, Espacial, Aventura, Mundo Aberto, Faça o que Quiser, Simulação, Exploração, Um Jogador, Multijogador, Simulador Espacial, Fabricação, Primeira Pessoa, Construção de Bases, Jogador x Jogador (PvP), Cooperativo, Multijogador Massivo, Automação, Jogador X Ambiente (PvE), Gerenciamento de Recursos"
Drone Sector,2025,Indefinido,https://store.steampowered.com/app/3279440/Drone_Sector/?snr=1_7_7_popularcomingsoon_150_14,"Simulação, Um Jogador, Militar, Guerra, Ação, Tático, Combate, Tiro, Moderno, 3D, Visão Superior, Voo, Combate com Veículos, Ficção Científica, Tática em Tempo Real, Jogo de Guerra, Gerenciamento, Roguelike, Estratégia, Estratégia em Tempo Real (RTS)"
Horizon Walker,2025,Free,https://store.steampowered.com/app/3279780/Horizon_Walker/?snr=1_7_7_popularcomingsoon_150_14,Sem gênero
Mistfall Hunter,2025,Indefinido,https://store.steampowered.com/app/3282300/Mistfall_Hunter/?snr=1_7_7_popularcomingsoon_150_14,"Tiro de Extração, Multijogador, Ação / Aventura, Medieval, Cooperativo On-line, Soulslike, Tiro em Terceira Pessoa, Jogador x Jogador (PvP), Jogador X Ambiente (PvE), Sombrio, Combate, Tático, Sobrevivência, Fantasia Sombria, Competitivo, Tiro com Saques, Saques, Aventura, Atmosférico, 3D"
NIGHT STRIKER GEAR,2025,Indefinido,https://store.steampowered.com/app/3290390/NIGHT_STRIKER_GEAR/?snr=1_7_7_popularcomingsoon_150_14,"Ação, Arcade, Tiro, Mandando Bala, Terceira Pessoa, Gráficos Pixelados, Anos 80, Anos 90, Ficção Científica, Retrô, Futurista, Um Jogador, Tiro sobre Trilhos"
Styx: Blades of Greed,Q4 2025,Indefinido,https://store.steampowered.com/app/3290690/Styx_Blades_of_Greed/?snr=1_7_7_popularcomingsoon_150_14,"Ação, Aventura, Furtivo, Um Jogador, Violento, Atmosférico, Boa Trama, Terceira Pessoa, Assassino, Fantasia Sombria, Parkour"
Easy Delivery Co.,2025,Indefinido,https://store.steampowered.com/app/3293010/Easy_Delivery_Co/?snr=1_7_7_popularcomingsoon_150_14,"Direção, Um Jogador, Relaxante, Mundo Aberto, Fofo, Exploração, Simulador Automobilístico, Ficção Interativa, Boa Trama, Simulação, Corrida, Física, Arcade, 3D, Tela Dividida, Neve, Atmosférico, Controle, Casual, Gráficos Pixelados"
The Sisterhood Pasture: Cozy Folklore Farming,2025,Indefinido,https://store.steampowered.com/app/3297080/The_Sisterhood_Pasture_Cozy_Folklore_Farming/?snr=1_7_7_popularcomingsoon_150_14,"Casual, Aconchegante, Simulador Rural, Protagonista Mulher, Simulador de Vida Real, Gráficos Pixelados, Simulador Imersivo, 2D, Fofo, Colorido, Drama, Simulação, Culinária, Romance, Gatos, Moderno, Boa Trama, Combate, Um Jogador, Multijogador"
Sleep Well Cemetery,2025,Indefinido,https://store.steampowered.com/app/3301350/Sleep_Well_Cemetery/?snr=1_7_7_popularcomingsoon_150_14,"Sobrevivência, Zumbis, Tiro em Primeira Pessoa (FPS), Construção de Bases, Hack and Slash, Defesa de Torres, RPG de Ação, Estratégia, Voxel, Humor Ácido, Terror, Ação, Pós-Apocalíptico, Gerenciamento, Direção, Medieval, Furtivo, Agricultura, Simulação, Construção"
As Long As You're Here,Q4 2025,Indefinido,https://store.steampowered.com/app/3309750/As_Long_As_Youre_Here/?snr=1_7_7_popularcomingsoon_150_14,"Aventura, Boa Trama, Simulador de Caminhada, Primeira Pessoa, Protagonista Mulher, Comovente, Exploração, Mistério, Drama, Atmosférico, Um Jogador, Narrativa, 3D, Estilizado, Surrealista, Curta-Metragem, Indie, Minimalista, Romance Visual"
CloverPit,2025,Indefinido,https://store.steampowered.com/app/3314790/CloverPit/?snr=1_7_7_popularcomingsoon_150_14,"Roguelite, Roguelike, Apostas, Estratégia, 3D, Primeira Pessoa, Terror Psicológico, Terror, Humor Ácido, Surrealista, Vários Finais, Sombrio, Psicológico, Física, Um Jogador, Gerenciamento de Recursos, Geração Procedural, Indie, Simulação"
Crimson Desert,2025,Indefinido,https://store.steampowered.com/app/3321460/Crimson_Desert/?snr=1_7_7_popularcomingsoon_150_14,"Ação, Mundo Aberto, Aventura, Combate, Um Jogador, Dragões, Exploração, Escolha a sua Aventura, Boa Trama, Ação / Aventura, Cavalos, 3D, Terceira Pessoa, Jogador X Ambiente (PvE), Medieval, Primeira Pessoa, Fantasia, Violência Detalhada, Violento, RPG"
Blippo+,2025,Indefinido,https://store.steampowered.com/app/3323850/Blippo/?snr=1_7_7_popularcomingsoon_150_14,"Casual, FMV, Cinematográfico, Gráficos Pixelados, Psicodélico, Realístico, Estilizado, Anos 80, Anos 90, Comédia, Engraçado, LGBTQIA+, Ficção Científica, Surrealista, Subterrâneo, Boa Trama, Filosófico, Um Jogador, Baseado em Texto, Indie"
MeteoriteFall,Q4 2025,Indefinido,https://store.steampowered.com/app/3324610/MeteoriteFall/?snr=1_7_7_popularcomingsoon_150_14,"Hentai, Gráficos Pixelados, JRPG, Pós-Apocalíptico, RPG, Simulador de Encontros, Boa Trama, Detetive, Culinária, Conteúdo Sexual, 2D, Combate em Turnos, Estratégia em Turnos, Fofo, Explorador de Calabouços, Ficção Científica, Anime, Um Jogador, Aventura, Construção de Bases"
Raiders of Blackveil,Q4 2025,Indefinido,https://store.steampowered.com/app/3352240/Raiders_of_Blackveil/?snr=1_7_7_popularcomingsoon_150_14,"Roguelike de Ação, Roguelite, Multijogador, Saques, Visão Superior, Cooperativo On-line, Alta Rejogabilidade, Explorador de Calabouços, Indie, Acesso Antecipado, RPG, Roguelike, Ação, Difícil, Isométrico, Atmosférico, Jogador X Ambiente (PvE), Fantasia, Gerenciamento de Inventário, RPG de Ação"
Prolegomena To a Hyperdimensional Interface That Will Be Able to Manifest From Three-Minute Interchanges,2025,Indefinido,https://store.steampowered.com/app/3358590/Prolegomena_To_a_Hyperdimensional_Interface_That_Will_Be_Able_to_Manifest_From_ThreeMinute_Interchanges/?snr=1_7_7_popularcomingsoon_150_14,"Escolha a sua Aventura, Aventura, Ficção Interativa, 2D, Você Decide, Filosófico, Um Jogador, Indie"
Shard Squad,2025,Indefinido,https://store.steampowered.com/app/3363560/Shard_Squad/?snr=1_7_7_popularcomingsoon_150_14,"Roguelike de Ação, Chuva de Balas, Coleção de Criaturas, Roguelite, Roguelike, Gráficos Pixelados, Fofo, Cooperativo, Ação, Casual, Jogador X Ambiente (PvE), 2D, Aventura, Fantasia, Indie, Para Toda a Família, Combate, Um Jogador"
The Jackbox Party Pack 11,Q4 2025,Indefinido,https://store.steampowered.com/app/3364070/The_Jackbox_Party_Pack_11/?snr=1_7_7_popularcomingsoon_150_14,"Casual, Estratégia, Reúna a Galera, Jogo de Tabuleiro, Perguntas e Respostas, 2D, Cartunizado, Colorido, Fofo, Comédia, Cooperativo, Para Toda a Família, Multijogador, Multijogador Local, Fantasia, Em Grupos, Engraçado, Cooperativo On-line, Cooperativo Local, Jogador x Jogador (PvP)"
Dream Garden,2025,Indefinido,https://store.steampowered.com/app/3367600/Dream_Garden/?snr=1_7_7_popularcomingsoon_150_14,"Faça o que Quiser, Construção, Design e Ilustração, Relaxante, Simulação, Aconchegante, Casual, Natureza, Indie, Simulador Imersivo, Fofo, Atmosférico, Colorido, Minimalista, Estilizado, 3D, Visão Superior, Um Jogador, Música, Para Toda a Família"
TouHou Legend of Fairy Souls,Q4 2025,Indefinido,https://store.steampowered.com/app/2287780/TouHou_Legend_of_Fairy_Souls/?snr=1_7_7_popularcomingsoon_150_15,"Acesso Antecipado, Roguelite, Roguelike de Ação, Gráficos Pixelados, SHMUP com Visão Superior, Mandando Bala, Hack and Slash, Porradaria, RPG de Ação, Ação / Aventura, Roguelike, Protagonista Mulher, 2,5D, Fofo, Visão Superior, Ação, Mágica, Fé, Aventura, Combate"
Dragonfall,Q4 2025,Indefinido,https://store.steampowered.com/app/2295150/Dragonfall/?snr=1_7_7_popularcomingsoon_150_15,"Acesso Antecipado, Sobrevivência em Mundo Aberto, Sobrevivência, Terror, Mundo Aberto, Tiro, Fabricação, Ação, Terror de Sobrevivência, Construção de Bases, Aventura, Dragões, Tiro em Primeira Pessoa (FPS), Gerenciamento de Inventário, Gerenciamento de Recursos, Cooperativo On-line, Ação / Aventura, Fantasia, 3D, Exploração"
Infinitum: The Backrooms Story,Q4 2025,Indefinido,https://store.steampowered.com/app/2302120/Infinitum_The_Backrooms_Story/?snr=1_7_7_popularcomingsoon_150_15,"Acesso Antecipado, Terror, Multijogador, Cooperativo On-line, Exploração, Ação, Aventura, Terror de Sobrevivência, Cooperativo, Simulação, Realístico, Narração Dinâmica, Personalização de Personagem, Mundo Aberto, Sobrevivência, Não Linear, Vários Finais, Terror Psicológico, Fabricação, Construção"
Full Fathom,2025,Indefinido,https://store.steampowered.com/app/2302470/Full_Fathom/?snr=1_7_7_popularcomingsoon_150_15,"Terror de Sobrevivência, Submarino, Subaquático, Exploração, Mundo Aberto, Terror Psicológico, Terror, Atmosférico, Sobrevivência, Gerenciamento de Recursos, Não Linear, Aventura, Pós-Apocalíptico, Ação / Aventura, Primeira Pessoa, Gerenciamento de Inventário, Anos 90, História Alternativa, Lovecraftiano, Thriller"
Bladesong,2025,Indefinido,https://store.steampowered.com/app/2305640/Bladesong/?snr=1_7_7_popularcomingsoon_150_15,"Gerenciamento de Lojas, Fabricação, Medieval, Realístico, RPG, Um Jogador, Dungeons & Dragons, 3D, Atmosférico, Imersivo, Histórico, Espada, Design e Ilustração, Alta Rejogabilidade, Física, Simulação, Fantasia Sombria, Gerenciamento, Boa Trama, Mágica"
Swordai,2025,Indefinido,https://store.steampowered.com/app/2321890/Swordai/?snr=1_7_7_popularcomingsoon_150_15,"Espada, Explorador de Calabouços, Tiro de Extração, Jogador x Jogador (PvP), Multijogador, Saques, Ação, Combate, Luta, Primeira Pessoa, Cooperativo, Realístico, Battle Royale, Medieval, RPG de Ação, Jogador X Ambiente (PvE), Fantasia Sombria, 3D, Um Jogador, Cooperativo On-line"
The Lacerator,2025,Indefinido,https://store.steampowered.com/app/2339330/The_Lacerator/?snr=1_7_7_popularcomingsoon_150_15,"Terror de Sobrevivência, Terror, Assassino, Sobrevivência, Comédia, Vários Finais, Não Linear, Exploração, Gerenciamento de Inventário, Metroidvania, Anos 80, Sombrio, Retrô, Ação / Aventura, Quebra-Cabeça, Terceira Pessoa, Objetos Ocultos, Ação, 3D, Engraçado"
文字遊戯(日本語版),2025,Indefinido,https://store.steampowered.com/app/2343610/_/?snr=1_7_7_popularcomingsoon_150_15,"Minimalista, Indie, Gráficos Pixelados, RPG, Boa Trama, Quebra-Cabeça, Aventura, Escolha a sua Aventura, JRPG, Exploração, 2D, Estilizado, Baseado em Texto, Noir, Dragões, Atmosférico, Mágica, Movimento em Grade, Narração, Linear"
Looking For Fael,2025,Indefinido,https://store.steampowered.com/app/2521170/Looking_For_Fael/?snr=1_7_7_popularcomingsoon_150_15,"Aventura, Quebra-Cabeça, Apontar e Clicar, Exploração, Objetos Ocultos, Primeira Pessoa, Atmosférico, Investigação, Lógica, Mistério, Ciência, Ficção Científica, Surrealista, Enredo Rico, Narração, Não Linear, Um Jogador, Indie"
BREAK ARTS III,2025,Indefinido,https://store.steampowered.com/app/2522430/BREAK_ARTS_III/?snr=1_7_7_popularcomingsoon_150_15,"Ação, Corrida, Tiro, Mechas, Robôs, Fabricação, Ficção Científica, Futurista, Esportes, Terceira Pessoa, Personalização de Personagem, Abstrato, Tático, Controle, Cooperativo On-line, Um Jogador, Multijogador, Jogador x Jogador (PvP), Cooperativo, Combate com Veículos"
AETHUS,2025,Indefinido,https://store.steampowered.com/app/2541530/AETHUS/?snr=1_7_7_popularcomingsoon_150_15,"Sobrevivência, Mineração, Construção de Bases, Boa Trama, Exploração, Fabricação, Automação, Narrativa, Sobrevivência em Mundo Aberto, Construção, Ficção Científica, Gerenciamento de Recursos, Um Jogador, Estratégia, Simulador de Colônias, Estilizado, Simulação, 2,5D, Protagonista Mulher, Visão Superior"
Fatal Run 2089,2025,Indefinido,https://store.steampowered.com/app/2542310/Fatal_Run_2089/?snr=1_7_7_popularcomingsoon_150_15,"Corrida, Roguelike de Ação, Corrida com Combate, Tiro em Terceira Pessoa, Roguelite, Direção, Jogador X Ambiente (PvE), Arcade, 3D, História em Quadrinhos, Terceira Pessoa, Cyberpunk, Pós-Apocalíptico, Controle, Ação, Combate com Veículos, Realístico, Distópico, Estrada de Terra, Ficção Científica"
Legends Of Elementia,2025,Indefinido,https://store.steampowered.com/app/2543660/Legends_Of_Elementia/?snr=1_7_7_popularcomingsoon_150_15,"Roguelike de Ação, Metroidvania, Roguevania, Plataforma 2D, Hack and Slash, Roguelite, Jogador X Ambiente (PvE), Plataforma, Luta 2D, RPG de Ação, RPG, Ação / Aventura, 2,5D, 2D, Relaxante, Ação, Mundo Aberto, Controle, Colorido, Gráficos Pixelados"
Section Six Requiem,2025,Free,https://store.steampowered.com/app/2551590/Section_Six_Requiem/?snr=1_7_7_popularcomingsoon_150_15,"Montagem de Decks Roguelike, Boa Trama, Cartas, Batalha com Cartas, Montagem de Decks, Mistério, Surrealista, Distópico, Roguelike, Anime, RPG de Estratégia, Estratégia em Turnos, Estratégia, Exploração, RPG, Lovecraftiano, Combate em Turnos, Moderno, 2D, Transumanismo"
Million Depth,2025,Indefinido,https://store.steampowered.com/app/2555950/Million_Depth/?snr=1_7_7_popularcomingsoon_150_15,"Roguelike, Vários Finais, Morte Permanente, Gráficos Pixelados, 2D, Estratégia, Roguelike de Ação, Exploração, Ficção Científica, Roguelite, Fabricação, Atmosférico, Ação, Subterrâneo, Controle, Um Jogador, Drama, Indie"
The Scramble Vice,2025,Indefinido,https://store.steampowered.com/app/2559370/The_Scramble_Vice/?snr=1_7_7_popularcomingsoon_150_15,"Ação, Robôs, Protagonista Mulher, Gráficos Pixelados, Mechas, Combate com Veículos, Câmera Lateral, Tanques, Plataforma, Plataforma 2D, Indie, 2D, Anime, Luta Espetacular, Um Jogador"
Farmer's Dynasty 2,2025,Indefinido,https://store.steampowered.com/app/2569670/Farmers_Dynasty_2/?snr=1_7_7_popularcomingsoon_150_15,"Acesso Antecipado, Aventura, Casual, RPG, Simulação, Simulador Rural, Simulador de Vida Real, Faça o que Quiser, Exploração, Simulador Imersivo, Gerenciamento de Tempo, 3D, Colorido, Primeira Pessoa, Agricultura, Atmosférico, Construção, Para Toda a Família, Pesca, Moderno"
