title,release_date,price,game_url,genres
Cats and Seek: Tokyo,"27 Apr, 2025",Free,https://store.steampowered.com/app/2925320/Cats_and_Seek_Tokyo/?snr=1_7_7_popularcomingsoon_150_1,"Casual, Gatos, Objetos Ocultos, Apontar e Clicar, Exploração, Clique e Clique, Colete Tudo, Coleção de Criaturas, Quebra-Cabeça, 2D, Fofo, Engraçado, Simulação, Colorido, Desenhado à Mão, Minimalista, Para Toda a Família, Comédia, Aventura, Desenho Animado"
Exorcist Simulator,"27 Apr, 2025",Indefinido,https://store.steampowered.com/app/2487140/Exorcist_Simulator/?snr=1_7_7_popularcomingsoon_150_1,"Terror, Cooperativo On-line, Multijogador, Terror Psicológico, Sobrenatural, Primeira Pessoa, Sombrio, Demônios, Mistério, Realístico, Lovecraftiano, Atmosférico, Simulação, 3D, Ação, Aventura, Cooperativo, Multijogador Local, Detetive, Investigação"
Kingdom's Deck,"27 Apr, 2025",Indefinido,https://store.steampowered.com/app/2655590/Kingdoms_Deck/?snr=1_7_7_popularcomingsoon_150_1,"Construção de Cidades, Construção de Bases, Cartas, Montagem de Decks Roguelike, Simulador de Colônias, Simulação, Sobrevivência, Jogo de Guerra, Defesa de Torres, Tática por Turnos, Gerenciamento, Roguelike, Gerenciamento de Recursos, Estratégia, Estratégia em Turnos, RPG, Construção, Medieval, Colorido, Fantasia"
Private Military Manager: Tactical Auto Battler,"27 Apr, 2025",Indefinido,https://store.steampowered.com/app/2564320/Private_Military_Manager_Tactical_Auto_Battler/?snr=1_7_7_popularcomingsoon_150_1,"Gerenciamento, Estratégia, Simulação, Tático, Batalha Automática, Gerenciamento de Tempo, Economia, Tática por Turnos, Jogador X Ambiente (PvE), Militar, Guerra, 3D, Combate, Um Jogador, Acesso Antecipado, Anos 90"
V Rising - Eternal Dominance Pack,"28 Apr, 2025",Indefinido,https://store.steampowered.com/app/3604340/V_Rising__Eternal_Dominance_Pack/?snr=1_7_7_popularcomingsoon_150_1,"Sobrevivência, Mundo Aberto, Construção de Bases, Multijogador, Vampiros, Fabricação, Cooperativo On-line, Jogador x Jogador (PvP), Jogador X Ambiente (PvE), Construção, Hack and Slash, Multijogador Massivo, Faça o que Quiser, Exploração, Ação, Aventura, Fantasia Sombria, Ação / Aventura, Um Jogador, Cooperativo"
Crusader Kings III: Khans of the Steppe,"28 Apr, 2025",Indefinido,https://store.steampowered.com/app/3315510/Crusader_Kings_III_Khans_of_the_Steppe/?snr=1_7_7_popularcomingsoon_150_1,"Estratégia, Medieval, Simulação, Grande Estratégia, RPG, Histórico, Gerenciamento, Personalização de Personagem, Simulador de Vida Real, Estratégia em Tempo Real (RTS), Faça o que Quiser, Você Decide, Guerra, Um Jogador, 4X, Político, Economia, Compatível com Mods, Multijogador, Tempo Real com Pausa"
Badlands Crew,"28 Apr, 2025",Indefinido,https://store.steampowered.com/app/2078230/Badlands_Crew/?snr=1_7_7_popularcomingsoon_150_1,"Estratégia, Combate com Veículos, Construção, Indie, Pós-Apocalíptico, Jogo de Guerra, Ação, Simulação, Mandando Bala, Mundo Aberto, Tática em Tempo Real, Faça o que Quiser, Direção, Um Jogador, Jogador X Ambiente (PvE), Roguelite, Aventura, Exploração, Terceira Pessoa, Personalização de Personagem"
Castle Craft,"28 Apr, 2025",Indefinido,https://store.steampowered.com/app/2086680/Castle_Craft/?snr=1_7_7_popularcomingsoon_150_1,"Acesso Antecipado, Voxel, Sobrevivência, Terceira Pessoa, Mágica, Ação, Construção de Cidades, Hack and Slash, Medieval, Construção de Bases, Faça o que Quiser, Estratégia, Simulação, Construção, RPG, Física, Defesa de Torres, Tempo Real, Destruição, Um Jogador"
Warfare Legacy Collection,"28 Apr, 2025",Indefinido,https://store.steampowered.com/app/2745870/Warfare_Legacy_Collection/?snr=1_7_7_popularcomingsoon_150_1,"Estratégia, Primeira Guerra Mundial, Câmera Lateral, Ação, Tático, Segunda Guerra Mundial, Militar, Remake, Retrô, 2D, Histórico, Guerra, Um Jogador, Casual, Alta Rejogabilidade, Curta-Metragem, Tática em Tempo Real, Visão Superior, Linear, Defesa de Torres"
Icaria,"28 Apr, 2025",Indefinido,https://store.steampowered.com/app/2613890/Icaria/?snr=1_7_7_popularcomingsoon_150_1,"Acesso Antecipado, Automação, Construção de Bases, Programação, Simulação, Faça o que Quiser, Gerenciamento de Recursos, Construção, Fabricação, Simulador de Colônias, Geração Procedural, Voxel, Exploração, Mundo Aberto, Robôs, Sobrevivência, 3D, Estratégia, Ficção Científica, Movimento em Grade"
Wuthering Waves,"28 Apr, 2025",Free,https://store.steampowered.com/app/3513350/Wuthering_Waves/?snr=1_7_7_popularcomingsoon_150_1,"Mundo Aberto, Ação, Anime, Gratuito para Jogar, Aventura, RPG, Boa Trama, Combate, Soulslike, Exploração, 3D, Um Jogador, Terceira Pessoa, Pós-Apocalíptico, Multijogador, Cooperativo, Roguelike de Ação, Trilha Sonora Boa, Hack and Slash, Fofo"
Eydigard,"29 Apr, 2025",Indefinido,https://store.steampowered.com/app/2472010/Eydigard/?snr=1_7_7_popularcomingsoon_150_1,"Acesso Antecipado, RPG, Exploração, Aventura, Mundo Aberto, Escolha a sua Aventura, Fabricação, RPG de Ação, Ação / Aventura, Soulslike, Cooperativo On-line, Boa Trama, Você Decide, Sobrevivência, Jogador X Ambiente (PvE), Personalização de Personagem, Enredo Rico, Terceira Pessoa, Histórico, Fantasia"
SubwaySim 2,"29 Apr, 2025",Indefinido,https://store.steampowered.com/app/2707070/SubwaySim_2/?snr=1_7_7_popularcomingsoon_150_1,"Simulação, Realístico, Trens, Primeira Pessoa, 3D, Terceira Pessoa, Controle, Compatível com Mods, Um Jogador, Subterrâneo"
Wartales - The Beast Hunt,"29 Apr, 2025",Indefinido,https://store.steampowered.com/app/3559560/Wartales__The_Beast_Hunt/?snr=1_7_7_popularcomingsoon_150_1,"RPG, Mundo Aberto, Estratégia em Turnos, RPG de Grupos, Medieval, Aventura, Cooperativo, Combate em Turnos, Estratégia, Multijogador, Um Jogador, RPG Tático, Exploração, Faça o que Quiser, Sobrevivência, Em Turnos, Violento, Indie, Cooperativo On-line, Boa Trama"
The Lost Glitches,"29 Apr, 2025",Free,https://store.steampowered.com/app/2782830/The_Lost_Glitches/?snr=1_7_7_popularcomingsoon_150_1,"Estratégia, Jogo de Cartas, Gratuito para Jogar, Montagem de Decks, RPG Tático, Jogador x Jogador (PvP), Cyberpunk, Batalha com Cartas, Estratégia em Turnos, RPG, Cartas, Tática por Turnos, RPG de Estratégia, Estilizado, Combate em Turnos, Boa Trama, Ação, Futurista, Anime, Colorido"
Baldur's Gate: Reflections Of Myth & Valor,"29 Apr, 2025",Indefinido,https://store.steampowered.com/app/2488970/Baldurs_Gate_Reflections_Of_Myth__Valor/?snr=1_7_7_popularcomingsoon_150_1,"Aventura, RPG"
Deadzone: Rogue,"29 Apr, 2025",Indefinido,https://store.steampowered.com/app/3228590/Deadzone_Rogue/?snr=1_7_7_popularcomingsoon_150_1,"Acesso Antecipado, Ação, Roguelike, Geração Procedural, Tiro, Ficção Científica, Cooperativo On-line, Jogador X Ambiente (PvE), Roguelike de Ação, Explorador de Calabouços, Tiro em Primeira Pessoa (FPS), Tiro com Saques, Roguelite, Primeira Pessoa, Saques, Atmosférico, Sombrio, Futurista, Espacial, Combate"
Beastkin ☆ Training ~The Trials of a Beastkin Noblewoman~,"29 Apr, 2025",Indefinido,https://store.steampowered.com/app/2939800/Beastkin__Training_The_Trials_of_a_Beastkin_Noblewoman/?snr=1_7_7_popularcomingsoon_150_1,"Casual, Fofo, Romance, Simulador de Encontros, Aventura, Anime, Romance Visual, Colorido, Ficção Interativa, Fantasia, Demônios, Mágica, Exploração, Drama, Protagonista Mulher, Um Jogador"
Crime Scene Technician,April 2025,Indefinido,https://store.steampowered.com/app/1555960/Crime_Scene_Technician/?snr=1_7_7_popularcomingsoon_150_1,"Exploração, Simulador Imersivo, Quebra-Cabeça, Crime, Detetive, Investigação, Simulador de Vida Real, 3D, Você Decide, Narração, Simulação, Casual, Boa Trama, Realístico, Lógica, Thriller, Atmosférico, Indie, Mistério, Um Jogador"
GeoGuessr Steam Edition,April 2025,Free,https://store.steampowered.com/app/3478870/GeoGuessr_Steam_Edition/?snr=1_7_7_popularcomingsoon_150_1,"Acesso Antecipado, Ação, Jogador x Jogador (PvP), Competitivo, Cooperativo On-line, Exploração, Quebra-Cabeça, Perguntas e Respostas, Multijogador, Casual, Para Toda a Família, Educativo, 2D, 3D, Colorido, Detetive, Natureza, Personalização de Personagem, Combate, Baseado em Equipes"
Astral Ascent - The Outer Reaches,April 2025,Indefinido,https://store.steampowered.com/app/3372880/Astral_Ascent__The_Outer_Reaches/?snr=1_7_7_popularcomingsoon_150_1,"Ação, Aventura, Indie"
MotoGP™25,"30 Apr, 2025",Indefinido,https://store.steampowered.com/app/3077390/MotoGP25/?snr=1_7_7_popularcomingsoon_150_1,"Corrida, Esportes, Simulação, eSports, Realístico, Tela Dividida, Engraçado, Motocicletas, Bicicletas (e Motocicletas), Jogador x Jogador (PvP), Personalização de Personagem, Controle, Física, Jogador X Ambiente (PvE), Primeira Pessoa, Terceira Pessoa, Multijogador, Um Jogador, Multijogador Local, Direção"
Veloria: The Knot of Candles,"30 Apr, 2025",Indefinido,https://store.steampowered.com/app/2859860/Veloria_The_Knot_of_Candles/?snr=1_7_7_popularcomingsoon_150_1,"RPG, Quebra-Cabeça, Anime, Boa Trama, Thriller, Terror, Simulador de Encontros, Terror Psicológico, Protagonista Mulher, Aventura, JRPG, Otome, Gráficos Pixelados, Simulação, Vários Finais, Explorador de Calabouços, Simulador de Epidemias, Drama, Mistério, Plataforma com Quebra-Cabeça"
gogh: Focus with Your Avatar,"30 Apr, 2025",Indefinido,https://store.steampowered.com/app/3213850/gogh_Focus_with_Your_Avatar/?snr=1_7_7_popularcomingsoon_150_1,"Personalização de Personagem, Aconchegante, Fofo, Utilitários, Anime, Relaxante, 3D, Coleção de Criaturas, Gerenciamento de Tempo, Faça o que Quiser, Simulação, Casual, Atmosférico, Indie, Um Jogador, História em Quadrinhos, Construção"
Skin Deep,"30 Apr, 2025",Indefinido,https://store.steampowered.com/app/301280/Skin_Deep/?snr=1_7_7_popularcomingsoon_150_1,"Tiro em Primeira Pessoa (FPS), Simulador Imersivo, Furtivo, Ficção Científica, Faça o que Quiser, Exploração, Tiro, Primeira Pessoa, Ação, Espacial, Tático, Atmosférico, Futurista, Um Jogador, Imersivo, Indie, Violento, Aventura, Velha-Guarda, Sobrevivência"
Haunted House Renovator,"30 Apr, 2025",Indefinido,https://store.steampowered.com/app/1917850/Haunted_House_Renovator/?snr=1_7_7_popularcomingsoon_150_1,"Casual, Simulação, Design e Ilustração, Primeira Pessoa, Aventura, Relaxante, Terror, Construção, Investigação, Indie, Exploração, Atmosférico, Sobrenatural, Simulador Imersivo, Você Decide, Um Jogador, Alta Rejogabilidade, Mágica, Engraçado, Faça o que Quiser"
KIBORG,"30 Apr, 2025",Indefinido,https://store.steampowered.com/app/2405060/KIBORG/?snr=1_7_7_popularcomingsoon_150_1,"RPG de Ação, Roguelike de Ação, Porradaria, Hack and Slash, Difícil, Terceira Pessoa, Combate, Tiro, Violento, Robôs, Geração Procedural, Roguelike, Um Jogador, Jogo de Ação Focado em Personagem, 3D, Artes Marciais, Cyberpunk, Você Decide, Ação, Violência Detalhada"
StarVaders,"30 Apr, 2025",Indefinido,https://store.steampowered.com/app/2097570/StarVaders/?snr=1_7_7_popularcomingsoon_150_1,"Tática por Turnos, Montagem de Decks, Ficção Científica, Cartas, Estratégia, Roguelite, Estratégia em Turnos, Difícil, Em Turnos, Movimento em Grade, Roguelike, 2D, Montagem de Decks Roguelike, Jogo de Tabuleiro, Anime, Fofo, Mechas, Combate em Turnos, Tático, Colorido"
Moroi,"30 Apr, 2025",Indefinido,https://store.steampowered.com/app/2518410/Moroi/?snr=1_7_7_popularcomingsoon_150_1,"Aventura, Ação, Ação / Aventura, Hack and Slash, Isométrico, Boa Trama, Atmosférico, Fantasia Sombria, Violento, Alta Rejogabilidade, Violência Detalhada, Indie, Um Jogador"
Conquest Dark,"30 Apr, 2025",Indefinido,https://store.steampowered.com/app/3238670/Conquest_Dark/?snr=1_7_7_popularcomingsoon_150_1,"Ação, RPG de Ação, RPG, Roguelike de Ação, Roguelite, Roguelike, Isométrico, Fantasia Sombria, História Alternativa, Medieval, Acesso Antecipado, Fantasia, Indie, Violento, Mitologia, Sombrio, Chuva de Balas, Controle, Linear, Nudez"
Diplomacy is Not an Option: Shareware,"30 Apr, 2025",Free,https://store.steampowered.com/app/3043710/Diplomacy_is_Not_an_Option_Shareware/?snr=1_7_7_popularcomingsoon_150_1,"Estratégia, Construção de Cidades, Simulador de Colônias, Estratégia em Tempo Real (RTS), Defesa de Torres, Construção de Bases, Construção, 3D, Medieval, Gerenciamento, Estratégia em Tempo Real com Ação, Sobrevivência, Economia, Tático, Guerra, Gerenciamento de Recursos, Um Jogador, Combate, Fantasia, Mágica"
WAGON,"30 Apr, 2025",Indefinido,https://store.steampowered.com/app/2458920/WAGON/?snr=1_7_7_popularcomingsoon_150_1,"Cartas, Montagem de Decks, Terror, Gerenciamento, Sobrevivência, Gerenciamento de Recursos, Estratégia, Sombrio, Simulação, Construção de Cidades, Jogo de Mesa, Roguelite, 3D, Estilizado, Um Jogador, Primeira Pessoa, Solitário, Construção, Velho Oeste, Atmosférico"
Rebellion GODSOUL: Awakening,"1 May, 2025",Indefinido,https://store.steampowered.com/app/1213300/Rebellion_GODSOUL_Awakening/?snr=1_7_7_popularcomingsoon_150_1,"Acesso Antecipado, RPG, JRPG, Batalha com Cartas, RPG de Grupos, Estratégia em Turnos, Romance Visual, Combate em Turnos, Anime, Boa Trama, Simulador de Encontros, Fofo, Mitologia, Memes, Cyberpunk, Montagem de Decks, Estratégia, Colorido, Um Jogador, Indie"
Stickman Strikes: Conquer Fantasy World,"1 May, 2025",Indefinido,https://store.steampowered.com/app/2924170/Stickman_Strikes_Conquer_Fantasy_World/?snr=1_7_7_popularcomingsoon_150_1,"RPG, Ação, Acesso Antecipado, Luta 3D, RPG de Ação, Faça o que Quiser, Plataforma 3D, Luta Espetacular, 3D, Visão Superior, Estilizado, Medieval, Fantasia, Boa Trama, Conversas, Mundo Aberto, Combate, Aventura, Hack and Slash, Um Jogador"
Little Sim World,"1 May, 2025",Indefinido,https://store.steampowered.com/app/1429880/Little_Sim_World/?snr=1_7_7_popularcomingsoon_150_1,"Simulador de Vida Real, Simulador de Encontros, Personalização de Personagem, Simulação, RPG, 2D, Relaxante, Visão Superior, Fofo, Você Decide, Mundo Aberto, Casual, Colorido, Aventura, Um Jogador, Indie, Aconchegante, Acesso Antecipado, Simulador Imersivo, Anime"
"Back from the other world, I missed love.","1 May, 2025",Indefinido,https://store.steampowered.com/app/2998600/Back_from_the_other_world_I_missed_love/?snr=1_7_7_popularcomingsoon_150_1,"Ficção Interativa, Simulador de Encontros, Romance, Casual, Romance Visual, Vários Finais, FMV, Um Jogador, RPG, Indie, Conteúdo Sexual, LGBTQIA+"
E-Commerce Simulator 2025,"1 May, 2025",Indefinido,https://store.steampowered.com/app/3291290/ECommerce_Simulator_2025/?snr=1_7_7_popularcomingsoon_150_1,"Casual, Simulação, Simulador de Vida Real, Indie, 3D, Primeira Pessoa, Realístico, Economia, Controle, Mundo Aberto, Um Jogador, Gerenciamento, Troca"
despelote,"1 May, 2025",Indefinido,https://store.steampowered.com/app/2367820/despelote/?snr=1_7_7_popularcomingsoon_150_1,"Aventura, Futebol, Comovente, Faça o que Quiser, Boa Trama, Ficção Interativa, Exploração, Simulador Imersivo, 3D, Cinematográfico, História em Quadrinhos, Primeira Pessoa, Desenhado à Mão, Estilizado, Estrangeiro, Conversas, Engraçado, Simulador de Caminhada, Um Jogador, Esportes"
To Pixelia,"1 May, 2025",Indefinido,https://store.steampowered.com/app/1954160/To_Pixelia/?snr=1_7_7_popularcomingsoon_150_1,"Simulador de Vida Real, Gráficos Pixelados, Mundo Aberto, Simulador Rural, Relaxante, Simulador de Encontros, Faça o que Quiser, Gerenciamento, Casual, Escolha a sua Aventura, Simulador Imersivo, Exploração, Simulação, Personalização de Personagem, Atmosférico, Um Jogador, Romance, RPG, Culinária, 2D"
FREERIDE,"1 May, 2025",Indefinido,https://store.steampowered.com/app/1597910/FREERIDE/?snr=1_7_7_popularcomingsoon_150_1,"RPG, Boa Trama, Você Decide, Aventura, Alta Rejogabilidade, Vários Finais, Engraçado, Terror Psicológico, Comovente, Exploração, Fofo, Não Linear, Comédia, Colorido, Atmosférico, Mistério, Um Jogador, Indie, Sobrenatural, 3D"
Shotgun Cop Man,"1 May, 2025",Indefinido,https://store.steampowered.com/app/2966850/Shotgun_Cop_Man/?snr=1_7_7_popularcomingsoon_150_1,"Ação, Plataforma de Precisão, Tiro, Arcade, Compatível com Mods, Minimalista, Plataforma, Plataforma 2D, Câmera Lateral, Controle com Alavanca Dupla, 2D, Abstrato, Estilizado, Combate, Controle, Editor de Níveis, Um Jogador, Comédia, Engraçado, Indie"
The Horror at Highrook,"1 May, 2025",Indefinido,https://store.steampowered.com/app/2836860/The_Horror_at_Highrook/?snr=1_7_7_popularcomingsoon_150_1,"Terror, Mistério, Lovecraftiano, Investigação, Não Linear, Jogo de Tabuleiro, Cartas, Boa Trama, RPG, 2D, História em Quadrinhos, Fabricação, Visão Superior, Simulação, Desenhado à Mão, Estilizado, Fantasia Sombria, Gótico, Atmosférico, RPG de Grupos"
Farm Your Friends,"1 May, 2025",Indefinido,https://store.steampowered.com/app/1285270/Farm_Your_Friends/?snr=1_7_7_popularcomingsoon_150_1,"Ação, Indie, Multijogador, Cooperativo, Jogador x Jogador (PvP), Controle, Casual, Local para 4 Jogadores, Simulação, Simulador Rural, Cartunizado, Colorido, Fofo, Comédia, Engraçado, Multijogador Local, Competitivo, Ritmo Rápido, Rural, Alta Rejogabilidade"
Liquor Store Simulator,"2 May, 2025",Indefinido,https://store.steampowered.com/app/3124550/Liquor_Store_Simulator/?snr=1_7_7_popularcomingsoon_150_1,"Simulação, Gerenciamento, Economia, Um Jogador, Troca, Simulador Imersivo, Indie, Primeira Pessoa, Realístico, Gerenciamento de Recursos, Casual, Acesso Antecipado, Simulador de Vida Real, Capitalismo, Design e Ilustração, Faça o que Quiser, Para Toda a Família, Atmosférico, Relaxante, 3D"
Maze Mice,"2 May, 2025",Indefinido,https://store.steampowered.com/app/3385370/Maze_Mice/?snr=1_7_7_popularcomingsoon_150_1,"Acesso Antecipado, Roguelike de Ação, Parar o Tempo, Chuva de Balas, Manipulação de Tempo, Roguelite, Arcade, Fofo, Relaxante, Tático, Roguelike, Retrô, Jogador X Ambiente (PvE), Gráficos Pixelados, Gatos, Visão Superior, Ação, 2D, Velha-Guarda, Um Jogador"
Sirocco,"2 May, 2025",Free,https://store.steampowered.com/app/2790090/Sirocco/?snr=1_7_7_popularcomingsoon_150_1,"Acesso Antecipado, MOBA, Competitivo, Estratégia, Jogador x Jogador (PvP), Roguelike de Ação, Chuva de Balas, Baseado em Equipes, Ação, Pós-Apocalíptico, Combate Naval, Controle, Gratuito para Jogar, Visão Superior, Naval, Multijogador, Capitalismo, Fantasia, Piratas, Cooperativo On-line"
100 Aztec Cats,"4 May, 2025",Indefinido,https://store.steampowered.com/app/3051050/100_Aztec_Cats/?snr=1_7_7_popularcomingsoon_150_1,"Gratuito para Jogar, Casual, Gatos, Objetos Ocultos, Quebra-Cabeça, Aconchegante, Do Bem, Relaxante, Fofo, Coleção de Criaturas, Desenhado à Mão, Indie, Minimalista, Cartunizado, Apontar e Clicar, Um Jogador, Colete Tudo, Pontos, Pontos, Pontos!, Exploração, Para Toda a Família"
Stellaris: BioGenesis,"5 May, 2025","R$89,99",https://store.steampowered.com/app/3417840/Stellaris_BioGenesis/?snr=1_7_7_popularcomingsoon_150_1,"Espacial, Estratégia, Grande Estratégia, Ficção Científica, 4X, Exploração, Faça o que Quiser, Simulação, Multijogador, Um Jogador, Tempo Real com Pausa, Compatível com Mods, Gerenciamento, Diplomacia, Militar, Futurista, Alta Rejogabilidade, Trilha Sonora Boa, Geração Procedural, Atmosférico"
Best Served Cold,"5 May, 2025",Indefinido,https://store.steampowered.com/app/3218530/Best_Served_Cold/?snr=1_7_7_popularcomingsoon_150_1,"Romance Visual, Detetive, Boa Trama, Você Decide, Conversas, Aconchegante, Investigação, Ficção Interativa, Atmosférico, Aventura, RPG, Fantasia, Simulação, Relaxante, Indie, Escolha a sua Aventura, Desenhado à Mão, Comovente, LGBTQIA+, Romance"
Knights of the Crusades,"5 May, 2025",Indefinido,https://store.steampowered.com/app/3440120/_Knights_of_the_Crusades/?snr=1_7_7_popularcomingsoon_150_1,"Acesso Antecipado, Faça o que Quiser, Grande Estratégia, Estratégia em Tempo Real (RTS), Construção de Cidades, Estratégia, Simulação, Jogo de Guerra, Estratégia em Tempo Real com Ação, Medieval, Construção de Bases, Um Jogador, Indie, Ação, 4X, Tática em Tempo Real, Fabricação, Diplomacia, Sobrevivência, Guerra"
Knights of the Crusades,5/mai./2025,Indefinido,https://store.steampowered.com/app/3440120/_Knights_of_the_Crusades/?snr=1_7_7_popularcomingsoon_150_2,"Acesso Antecipado, Faça o que Quiser, Grande Estratégia, Estratégia em Tempo Real (RTS), Construção de Cidades, Estratégia, Simulação, Jogo de Guerra, Estratégia em Tempo Real com Ação, Medieval, Construção de Bases, Um Jogador, Indie, Ação, 4X, Tática em Tempo Real, Fabricação, Diplomacia, Sobrevivência, Guerra"
Riot Control Simulator: Rookie Day,"May 6, 2025",Free,https://store.steampowered.com/app/2535680/Riot_Control_Simulator_Rookie_Day/?snr=1_7_7_popularcomingsoon_150_2,"Ação, Simulação, Combate, Inteligência Artificial, Conversas, Combate em Turnos, Um Jogador, 3D, Ação / Aventura, Capitalismo, Casual, Indie, Crime, Primeira Pessoa, Simulador de Emprego, Militar, Político, Simulador Político, Realístico, Tático"
Savara,"May 6, 2025",Indefinido,https://store.steampowered.com/app/3021630/Savara/?snr=1_7_7_popularcomingsoon_150_2,"Roguelike de Ação, Soulslike, Explorador de Calabouços, RPG, Ação, Roguelite, Um Jogador, Difícil, Alta Rejogabilidade, Hack and Slash, RPG de Ação, Protagonista Mulher, Indie, Combate, Fantasia, Jogador X Ambiente (PvE), 3D, Roguelike, Aventura, Ação / Aventura"
Bygone Dreams: Prophecy,"May 6, 2025",Free,https://store.steampowered.com/app/3493780/Bygone_Dreams_Prophecy/?snr=1_7_7_popularcomingsoon_150_2,"Ação, Aventura, RPG, RPG de Ação, Ação / Aventura, Um Jogador, 3D, Combate, Fabricação, Fantasia, Mágica, Jogador X Ambiente (PvE), Soulslike, Boa Trama, Terceira Pessoa, Surrealista, Trilha Sonora, Gratuito para Jogar"
Captain Blood,"May 6, 2025",Indefinido,https://store.steampowered.com/app/3040220/Captain_Blood/?snr=1_7_7_popularcomingsoon_150_2,"Ação, Aventura, Hack and Slash, Piratas, Velha-Guarda, Cinematográfico, Combate, Violento, Ação / Aventura, 3D, Um Jogador, Terceira Pessoa, Engraçado, Espada, Colorido, Estilizado, Navegação, Boa Trama, Gerenciamento de Tempo, História em Quadrinhos"
Hordes of Hunger,"May 6, 2025",Indefinido,https://store.steampowered.com/app/2157710/Hordes_of_Hunger/?snr=1_7_7_popularcomingsoon_150_2,"Acesso Antecipado, Medieval, Roguelike de Ação, Hack and Slash, Roguelite, Arcade, Fantasia Sombria, Ação, Roguelike, 3D, Protagonista Mulher, Luta Espetacular, Jogador X Ambiente (PvE), Chuva de Balas, Casual, Terceira Pessoa, Geração Procedural, Combate, RPG de Ação, Terror"
Trench Tales,"May 6, 2025",Indefinido,https://store.steampowered.com/app/2214220/Trench_Tales/?snr=1_7_7_popularcomingsoon_150_2,"Acesso Antecipado, Jogador X Ambiente (PvE), Tiro em Terceira Pessoa, Tiro, Soulslike, Ação / Aventura, Mundo Aberto, 3D, Um Jogador, Guerra, Terror, Surrealista, Boa Trama, Ação, Combate, Realístico, Demônios, Mágica, Fantasia Sombria, Drama"
Among Us 3D,"May 6, 2025",Indefinido,https://store.steampowered.com/app/3168600/Among_Us_3D/?snr=1_7_7_popularcomingsoon_150_2,"3D, Casual, Estratégia, Desenho Animado, Primeira Pessoa, Cartunizado, Colorido, Engraçado, Terror, Psicológico, Ficção Científica, Espacial, Sobrevivência, Multijogador, Jogador x Jogador (PvP), Conversas, Cooperativo, Cooperativo On-line, Minijogos, Em Grupos"
Age of Empires II: DE - The Three Kingdoms,"May 6, 2025",$16.99,https://store.steampowered.com/app/3080080/Age_of_Empires_II_DE__The_Three_Kingdoms/?snr=1_7_7_popularcomingsoon_150_2,Estratégia
Deck of Haunts,"May 7, 2025",Indefinido,https://store.steampowered.com/app/3179730/Deck_of_Haunts/?snr=1_7_7_popularcomingsoon_150_2,"Roguelite, Montagem de Decks, Construção de Bases, Batalha com Cartas, Estratégia, Tática por Turnos, Construção de Cidades, Simulação, Construção, Cartas, Terror, Jogo de Divindade, Roguelike, Defesa de Torres, Isométrico, 2,5D, Terror Psicológico, Gótico, Estilizado, Editor de Níveis"
Survival Machine,"May 7, 2025",Indefinido,https://store.steampowered.com/app/1601330/Survival_Machine/?snr=1_7_7_popularcomingsoon_150_2,"Sobrevivência em Mundo Aberto, Sobrevivência, Cooperativo On-line, Aventura, Cooperativo, Fabricação, Acesso Antecipado, Construção de Bases, Construção, Mundo Aberto, Faça o que Quiser, Um Jogador, Multijogador, Zumbis, Ação, Engraçado, Relaxante, Indie, Exploração, Casual"
RailGods of Hysterra,"May 7, 2025",Indefinido,https://store.steampowered.com/app/3201910/RailGods_of_Hysterra/?snr=1_7_7_popularcomingsoon_150_2,"Acesso Antecipado, Sobrevivência, Construção de Bases, Lovecraftiano, Fabricação, Multijogador, Exploração, Cooperativo On-line, Jogador X Ambiente (PvE), Construção, Faça o que Quiser, Ação, Hack and Slash, Um Jogador, Aventura, Ação / Aventura, Geração Procedural, Fantasia Sombria, Atmosférico, Terror"
Ithya: Magic Studies,"May 7, 2025",Indefinido,https://store.steampowered.com/app/3330250/Ithya_Magic_Studies/?snr=1_7_7_popularcomingsoon_150_2,"Casual, Aconchegante, Utilitários, Incremental, Apontar e Clicar, Coleção de Criaturas, Música, Personalização de Personagem, Relaxante, Desenhado à Mão, Simulador de Vida Real, Medieval, Para Toda a Família, Protagonista Mulher, Fantasia, Mágica, Atmosférico, Um Jogador, Ambiente, Do Bem"
