title,release_date,price,game_url,genres
Battle Vision Network,2025,Indefinido,https://store.steampowered.com/app/2216850/Battle_Vision_Network/?snr=1_7_7_popularcomingsoon_150_14,"Ação, Estratégia, Quebra-Cabeça, Jogador x Jogador (PvP), Multijogador, Tática por Turnos, Combate em Turnos, Estratégia em Turnos, Batalha com Cartas, Competitivo, Casual, Jogo de Cartas, 2D, 3D, Indie, Fantasia, Colorido, Desenhado à Mão, Ficção Científica, Estilizado"
ENDALOR,2025,Indefinido,https://store.steampowered.com/app/2265990/ENDALOR/?snr=1_7_7_popularcomingsoon_150_14,"Acesso Antecipado, Sobrevivência em Mundo Aberto, Sobrevivência, Cooperativo On-line, Mundo Aberto, Multijogador, Ação, Construção, Medieval, Construção de Bases, RPG, Fabricação, Soulslike, Cooperativo, Aventura, Ação / Aventura, Faça o que Quiser, Exploração, Indie, Terceira Pessoa"
TouHou Legend of Fairy Souls,Q4 2025,Indefinido,https://store.steampowered.com/app/2287780/TouHou_Legend_of_Fairy_Souls/?snr=1_7_7_popularcomingsoon_150_14,"Acesso Antecipado, Roguelite, Roguelike de Ação, Gráficos Pixelados, SHMUP com Visão Superior, Mandando Bala, Hack and Slash, Porradaria, RPG de Ação, Ação / Aventura, Roguelike, Protagonista Mulher, 2,5D, Fofo, Visão Superior, Ação, Mágica, Fé, Aventura, Combate"
Dewdrop Dynasty,2025,Indefinido,https://store.steampowered.com/app/1444080/Dewdrop_Dynasty/?snr=1_7_7_popularcomingsoon_150_14,"Metroidvania, Aventura, Exploração, Plataforma, Gráficos Pixelados, Indie, Engraçado, Mundo Aberto, Ação, Enredo Rico, Alta Rejogabilidade, Para Toda a Família, Fofo, 2D, Boa Trama, Não Linear, Tiro, Um Jogador, Natureza, Dinossauros"
Algolemeth,2025,Indefinido,https://store.steampowered.com/app/2731030/Algolemeth/?snr=1_7_7_popularcomingsoon_150_14,"RPG, Automação, Explorador de Calabouços, Lógica, RPG de Grupos, Fantasia, Tática por Turnos, RPG Tático, Velha-Guarda, Um Jogador, Minimalista, Indie, Gráficos Pixelados, 2D, Anos 80, Geração Procedural"
100 Cats Beijing,2025,,https://store.steampowered.com/app/2796360/100_Cats_Beijing/?snr=1_7_7_popularcomingsoon_150_14,"Gatos, Objetos Ocultos, Quebra-Cabeça, Aconchegante, Casual, Do Bem, Relaxante, Fofo, Coleção de Criaturas, Desenhado à Mão, Minimalista, Cartunizado, Apontar e Clicar, Um Jogador, Colete Tudo, Indie, Exploração, Corrida Contra o Tempo, Pontos, Pontos, Pontos!, Gratuito para Jogar"
全速以赴,2025,Indefinido,https://store.steampowered.com/app/2799820/FSA_DRIVING/?snr=1_7_7_popularcomingsoon_150_14,"Corrida, Um Jogador, Mundo Aberto, Ação, Arcade, Relaxante, Gerenciamento de Recursos, Exploração, Direção, Transportes, Simulador Automobilístico, Casual, Simulação, 3D, Realístico, Moderno, Controle, Física"
KILL THE WITCH,2025,Indefinido,https://store.steampowered.com/app/2878760/KILL_THE_WITCH/?snr=1_7_7_popularcomingsoon_150_14,"Plataforma 2D, Soulslike, Jogador X Ambiente (PvE), Plataforma, 2D, Fofo, Cyberpunk, Terror Psicológico, Boa Trama, Ação, Gráficos Pixelados, Anime, Ficção Científica, Comovente, Retrô, Sombrio, Combate, Um Jogador, Trilha Sonora, Indie"
Total World Liberation,2025,Indefinido,https://store.steampowered.com/app/2177230/Total_World_Liberation/?snr=1_7_7_popularcomingsoon_150_14,"Mundo Aberto, Sobrevivência, Construção de Bases, Automação, Estratégia em Turnos, Estratégia, Fabricação, Simulador de Colônias, Exploração, Tática por Turnos, Simulador Imersivo, Em Turnos, Combate em Turnos, Furtivo, Construção, Pós-Apocalíptico, Isométrico, 3D, Militar, Guerra"
HYPERBEAT,2025,Indefinido,https://store.steampowered.com/app/2263360/HYPERBEAT/?snr=1_7_7_popularcomingsoon_150_14,"Ritmo, 3D, Colorido, Estilizado, Editor de Níveis, Um Jogador, Indie, Ação, Arcade"
Poke ALL Toads,2025,Indefinido,https://store.steampowered.com/app/2302320/Poke_ALL_Toads/?snr=1_7_7_popularcomingsoon_150_14,"Quebra-Cabeça, Lógica, Estratégia, Aventura, Visão Superior, Desenho Animado, 2D, Fofo, Cartunizado, Colorido, Engraçado, Gráficos Pixelados, Plataforma com Quebra-Cabeça, Fantasia, Protagonista Mulher, Gerenciamento de Recursos, Um Jogador, Indie, Ação / Aventura, Sokoban"
Mainland,2025,Indefinido,https://store.steampowered.com/app/2304360/Mainland/?snr=1_7_7_popularcomingsoon_150_14,"Estratégia, Medieval, RPG, Mundo Aberto, Campanha Cooperativa, Ação, Guerra, Simulação, Faça o que Quiser, Grande Estratégia, RPG de Estratégia, RPG de Ação, Jogo de Guerra, Tática em Tempo Real, Cooperativo, Terceira Pessoa, Militar, Histórico, Combate, Personalização de Personagem"
Ribby: The Game,2025,Indefinido,https://store.steampowered.com/app/1742740/Ribby_The_Game/?snr=1_7_7_popularcomingsoon_150_14,"LGBTQIA+, Escolha a sua Aventura, RPG de Ação, Romance Visual, Exploração, Colete Tudo, Simulador de Caminhada, Protagonista Mulher, RPG, 2D, Fofo, Engraçado, Surrealista, Você Decide, Conversas, Vários Finais, Boa Trama, Gráficos Pixelados, Combate em Turnos, Comédia"
The Touhou Empires,2025,Indefinido,https://store.steampowered.com/app/1761210/The_Touhou_Empires/?snr=1_7_7_popularcomingsoon_150_14,"Estratégia, Estratégia em Tempo Real (RTS), Simulação, Tática em Tempo Real, 3D, Fofo, Visão Superior, Multijogador, Jogador x Jogador (PvP), Tático, Mágica, Protagonista Mulher, Indie, Um Jogador, Fé, Construção de Bases, Anime"
SysAdmin Odyssey - Back to the office,2025,Indefinido,https://store.steampowered.com/app/1794240/SysAdmin_Odyssey__Back_to_the_office/?snr=1_7_7_popularcomingsoon_150_14,"Simulação, Simulador Imersivo, Gerenciamento de Tempo, Software, Indie, Faça o que Quiser, Primeira Pessoa, Simulador de Vida Real, 3D, Um Jogador, Gerenciamento de Recursos, Realístico, Gerenciamento, Educativo, Aventura, Tutorial, Atmosférico, Quebra-Cabeça, Simulador de Colônias, Lógica"
Guns Undarkness,2025,Indefinido,https://store.steampowered.com/app/1801140/Guns_Undarkness/?snr=1_7_7_popularcomingsoon_150_14,"RPG, JRPG, RPG de Grupos, CRPG, Terceira Pessoa, Ficção Científica, Cyberpunk, Pós-Apocalíptico, Um Jogador, Indie, Furtivo, Combate em Turnos, Atmosférico, Controle, Mistério, Mechas, Trilha Sonora Boa, Hentai, Humor Pesado, Impróprio para o Local de Trabalho"
Demon Spore,2025,Indefinido,https://store.steampowered.com/app/1808160/Demon_Spore/?snr=1_7_7_popularcomingsoon_150_14,"Roguelike de Ação, Controle com Alavanca Dupla, SHMUP com Visão Superior, Ação, Roguelite, Geração Procedural, Chuva de Balas, Atmosférico, Tiro, Difícil, Terror, Roguelike, Cooperativo Local, Morte Permanente, Explorador de Calabouços, Visão Superior, Local para 4 Jogadores, Lovecraftiano, Terror de Sobrevivência, Alta Rejogabilidade"
Alice is Dead: Hearts and Diamonds,2025,Indefinido,https://store.steampowered.com/app/1826770/Alice_is_Dead_Hearts_and_Diamonds/?snr=1_7_7_popularcomingsoon_150_14,"Apontar e Clicar, Noir, Mistério, Romance Visual, Remake, Ficção Interativa, Detetive, Quebra-Cabeça, Psicodélico, Fantasia Sombria, Boa Trama, Investigação, Crime, Desenhado à Mão, Assassino, 2D, Enredo Rico, Colorido, Nostalgia, Fantasia"
RoadOut,2025,Indefinido,https://store.steampowered.com/app/1829270/RoadOut/?snr=1_7_7_popularcomingsoon_150_14,"Gráficos Pixelados, RPG de Ação, Ação, Indie, Visão Superior, 2D, Ação / Aventura, Colorido, Protagonista Mulher, Cyberpunk, Futurista, Tiro, Pós-Apocalíptico, Ficção Científica, Um Jogador, Aventura, Corrida com Combate, Exploração, Combate com Veículos, RPG"
Mira and the Legend of the Djinns,2025,Indefinido,https://store.steampowered.com/app/1927360/Mira_and_the_Legend_of_the_Djinns/?snr=1_7_7_popularcomingsoon_150_14,"Metroidvania, Plataforma, Gráficos Pixelados, Combate, Mitologia, Comovente, Ação, Aventura, 2D, RPG, Plataforma 2D, Atmosférico, Ação / Aventura, Plataforma com Quebra-Cabeça, Câmera Lateral, Fantasia, Mistério, Controle, Um Jogador, Soulslike"
Wrekless™,2025,Indefinido,https://store.steampowered.com/app/1931930/Wrekless/?snr=1_7_7_popularcomingsoon_150_14,"Acesso Antecipado, Esportes, Skate, Multijogador, Editor de Níveis, Cooperativo On-line, Personalização de Personagem, Patinação (e Skate), Indie, Jogador x Jogador (PvP), Construção, Arcade, 3D, Terceira Pessoa, Controle, Não Linear, Cartunizado, Física, Um Jogador, Colorido"
Laws of Nadragia,2025,Indefinido,https://store.steampowered.com/app/1993410/Laws_of_Nadragia/?snr=1_7_7_popularcomingsoon_150_14,"Gráficos Pixelados, Aventura, Detetive, Investigação, Romance Visual, Boa Trama, Apontar e Clicar, Mistério, Crime, Engraçado, Isométrico, CRPG, Medieval, 2D, Steampunk, Você Decide, Vários Finais, Não Linear, Simulação, Fantasia"
Lost In The Open,2025,Indefinido,https://store.steampowered.com/app/2027380/Lost_In_The_Open/?snr=1_7_7_popularcomingsoon_150_14,"Estratégia, RPG Tático, Roguelike, Tática por Turnos, 2,5D, RPG, Morte Permanente, Em Turnos, Movimento em Grade, Estratégia em Turnos, Tático, Combate em Turnos, RPG de Estratégia, Fantasia Sombria, Geração Procedural, Medieval, Desenhado à Mão, Atmosférico, Um Jogador, Alta Rejogabilidade"
Hexxen: Hunters,2025,Indefinido,https://store.steampowered.com/app/2100400/Hexxen_Hunters/?snr=1_7_7_popularcomingsoon_150_14,"RPG, Você Decide, Personalização de Personagem, Boa Trama, Geração Procedural, Combate em Turnos, Aventura, CRPG, Fantasia, Romance, Estratégia, Baseado em Classes, Fantasia Sombria, Campanha Cooperativa, Um Jogador, Combate, Controle, Furtivo, Mundo Aberto, Exploração"
Drone Sector,2025,Indefinido,https://store.steampowered.com/app/3279440/Drone_Sector/?snr=1_7_7_popularcomingsoon_150_14,"Simulação, Um Jogador, Militar, Guerra, Ação, Tático, Combate, Tiro, Moderno, 3D, Visão Superior, Voo, Combate com Veículos, Ficção Científica, Tática em Tempo Real, Jogo de Guerra, Gerenciamento, Roguelike, Estratégia, Estratégia em Tempo Real (RTS)"
There is NO PLAN B,2025,Indefinido,https://store.steampowered.com/app/2928190/There_is_NO_PLAN_B/?snr=1_7_7_popularcomingsoon_150_14,"Anime, Futurista, Detetive, Mistério, Aventura, Boa Trama, Romance Visual, Apontar e Clicar, Engraçado, Cyberpunk, Escolha a sua Aventura, Crime, Baseado em Texto, Um Jogador, Protagonista Mulher, Quebra-Cabeça, Vários Finais"
BatteryNote,2025,Indefinido,https://store.steampowered.com/app/3005930/BatteryNote/?snr=1_7_7_popularcomingsoon_150_14,"Aventura, Romance Visual, Escolha a sua Aventura, 2D, Gráficos Pixelados, Anos 90, Ficção Científica, Retrô, Robôs, Baseado em Texto, Vários Finais, Boa Trama, Você Decide, Um Jogador, Distópico, Futurista"
Live Lens Bodycam,2025,Indefinido,https://store.steampowered.com/app/3055480/Live_Lens_Bodycam/?snr=1_7_7_popularcomingsoon_150_14,"Ação, Aventura, Simulação, Tiro, Ação / Aventura, Tiro em Primeira Pessoa (FPS), 3D, Realístico, Conspiração, Militar, Furtivo, Sobrevivência, Tático, Personalização de Armas, Combate, Mundo Aberto, Jogador X Ambiente (PvE), Jogador x Jogador (PvP), Cooperativo, Campanha Cooperativa"
Utawarerumono: ZAN,2025,Indefinido,https://store.steampowered.com/app/3074840/Utawarerumono_ZAN/?snr=1_7_7_popularcomingsoon_150_14,"Porradaria, Musou, JRPG, Hack and Slash, Luta Espetacular, Anime, Cooperativo, Ficção Científica, Mitologia, Fantasia, Enredo Rico, Estrangeiro, 3D, RPG de Ação, Agricultura, Ação, Dinossauros, Aventura, Terceira Pessoa, RPG"
Título não disponível,Data não informada,Indefinido,https://store.steampowered.com/app/2521800/VRSO_Bare_Knuckle_Fighting/?snr=1_7_7_popularcomingsoon_150_14,Sem gênero
Beyond the Curtains,2025,Indefinido,https://store.steampowered.com/app/2648940/Beyond_the_Curtains/?snr=1_7_7_popularcomingsoon_150_14,"Simulador de Vida Real, Atmosférico, Relaxante, Casual, Simulação, Indie, Fofo, Anime, Boa Trama, Um Jogador, Acesso Antecipado, Isométrico, Para Toda a Família, Compatível com Mods, Incremental, Conteúdo Sexual, Terror Psicológico, Nudez"
Strange Jigsaws,2025,Indefinido,https://store.steampowered.com/app/2702170/Strange_Jigsaws/?snr=1_7_7_popularcomingsoon_150_14,"Aventura, Casual, Quebra-Cabeça, 2D, Abstrato, Colorido, Minimalista, Para Toda a Família, Lógica, Indie, Relaxante, Um Jogador"
Family Land - Farmer Simulator,2025,Indefinido,https://store.steampowered.com/app/2334600/Family_Land__Farmer_Simulator/?snr=1_7_7_popularcomingsoon_150_14,"Simulação, Casual, Simulador Rural, Simulador de Vida Real, Faça o que Quiser, Simulador Imersivo, Gerenciamento de Tempo, 3D, Primeira Pessoa, Realístico, Agricultura, EUA, Atmosférico, Construção, Capitalismo, Economia, Para Toda a Família, Gerenciamento, Moderno, Natureza"
SKY THE SCRAPER,2025,Indefinido,https://store.steampowered.com/app/2387430/SKY_THE_SCRAPER/?snr=1_7_7_popularcomingsoon_150_14,"RPG de Ação, Ação / Aventura, Simulador de Vida Real, Geração Procedural, Vários Finais, Aventura, Gerenciamento, Boa Trama, Simulação, Ação, Moderno, Um Jogador, Escolha a sua Aventura, 2D, Gráficos Pixelados, Retrô, Velha-Guarda, Tutorial, Controle, Baseado em Classes"
VISK,2025,Indefinido,https://store.steampowered.com/app/2405640/VISK/?snr=1_7_7_popularcomingsoon_150_14,"Terror, Cooperativo On-line, Multijogador, Mundo Aberto, Cooperativo, Exploração, Primeira Pessoa, Atmosférico, Terror Psicológico, Mistério, Sobrenatural, Aventura, Sombrio, Surrealista, Vários Finais, 3D, Um Jogador, Indie, Simulador de Caminhada, Objetos Ocultos"
世界岛 · 宅急送,2025,Indefinido,https://store.steampowered.com/app/2480100/Dino_Ramen_Express/?snr=1_7_7_popularcomingsoon_150_14,"Aventura, RPG, Fofo, Simulação, Voxel, Tiro em Primeira Pessoa (FPS), Casual, Construção, Corrida, Ação / Aventura, Simulador de Vida Real, Simulador Imersivo, Tiro, Inteligência Artificial, Explorador de Calabouços, 3D, Primeira Pessoa, Terceira Pessoa, Fabricação, Relaxante"
Bosslife Office Manager,4º trimestre de 2025,Indefinido,https://store.steampowered.com/app/3202250/Bosslife_Office_Manager/?snr=1_7_7_popularcomingsoon_150_14,"Gerenciamento, Economia, Desenvolvimento de Jogos, Simulação, Casual, Fabricação, Visão Superior, Um Jogador, 3D, Construção, Engraçado, Fofo, Ação, Simulador de Vida Real, Simulador Imersivo, Tiro em Terceira Pessoa, Isométrico, Colorido"
Karting of Banban,2025,Indefinido,https://store.steampowered.com/app/3248310/Karting_of_Banban/?snr=1_7_7_popularcomingsoon_150_14,"Corrida, Arcade, 3D, Corrida com Combate, Terror, Ação, Cartunizado, Aventura, Colorido, Casual, Multijogador, Fofo, Multijogador Local, Física, Comédia, Direção, Estilizado, Ação / Aventura, Psicodélico, Para Toda a Família"
Moldwasher,Q4 2025,Indefinido,https://store.steampowered.com/app/3688130/Moldwasher/?snr=1_7_7_popularcomingsoon_150_14,"Simulação, Arcade, Simulador Imersivo, 2D, Isométrico, Fofo, Gráficos Pixelados, Anos 90, Para Toda a Família, Zumbis, Velha-Guarda, Indie, Casual, Relaxante, Retrô, Comédia, Um Jogador, Aconchegante"
Mech Havoc,2025,Indefinido,https://store.steampowered.com/app/3237920/Mech_Havoc/?snr=1_7_7_popularcomingsoon_150_14,"Mechas, SHMUP com Visão Superior, Ficção Científica, Destruição, Tático, Tiro, Controle com Alavanca Dupla, Robôs, Combate com Veículos, Física, Atmosférico, Arcade, Ação, Visão Superior, Tanques, Cyberpunk, Indie, 2D, Gráficos Pixelados, Um Jogador"
The Good Dog: Chasing Shadows,2025,Indefinido,https://store.steampowered.com/app/3208910/The_Good_Dog_Chasing_Shadows/?snr=1_7_7_popularcomingsoon_150_14,"Terror, Cachorros, Exploração, Sobrenatural, Mistério, Terror de Sobrevivência, Quebra-Cabeça, Jogador X Ambiente (PvE), Ação / Aventura, 3D, Terceira Pessoa, Você Decide, Vários Finais, Ação, Mundo Aberto, Boa Trama, Realístico, Aventura, Investigação, Sombrio"
of the Devil - Episode 2,2025,Indefinido,https://store.steampowered.com/app/3124590/of_the_Devil__Episode_2/?snr=1_7_7_popularcomingsoon_150_14,"Romance Visual, Protagonista Mulher, História em Quadrinhos, Noir, Cyberpunk, Detetive, Humor Ácido, Enredo Rico, Transumanismo, Você Decide, Conversas, Linear, Boa Trama, Anime, Colorido, Distópico, Lógica, Ficção Científica, Thriller, Atmosférico"
Red Rocket Defencism,2025,Indefinido,https://store.steampowered.com/app/2854440/Red_Rocket_Defencism/?snr=1_7_7_popularcomingsoon_150_14,"Defesa de Torres, Estratégia, Construção de Cidades, Minimalista, Roguelite, Construção de Bases, Batalha Automática, Montagem de Decks, Estratégia em Tempo Real com Ação, Estratégia em Tempo Real (RTS), Tática em Tempo Real, Roguelike, Construção, Distópico, Colorido, Visão Superior, Ação, Simulação, Histórico, Estilizado"
Food Devils,Q4 2025,Indefinido,https://store.steampowered.com/app/2861730/Food_Devils/?snr=1_7_7_popularcomingsoon_150_14,"Anime, RPG Tático, Personalização de Personagem, Roguelite, JRPG, RPG de Grupos, Tática por Turnos, Estratégia em Turnos, RPG de Estratégia, Boa Trama, 2,5D, Você Decide, RPG, Estratégia, Colorido, Fantasia, Combate em Turnos, Aventura, Fantasia Sombria, Vários Finais"
Decktamer,2025,Indefinido,https://store.steampowered.com/app/2870340/Decktamer/?snr=1_7_7_popularcomingsoon_150_14,"Montagem de Decks Roguelike, Estratégia, Combate em Turnos, Coleção de Criaturas, Montagem de Decks, Estratégia em Turnos, Cartas, Batalha com Cartas, 2D, Fantasia, Desenhado à Mão, Controle, Um Jogador"
Pinbleton Park,2025,Indefinido,https://store.steampowered.com/app/3323970/Pinbleton_Park/?snr=1_7_7_popularcomingsoon_150_14,"Aventura, Ação / Aventura, Arcade, Colete Tudo, Coleção de Criaturas, Exploração, Metroidvania, 3D, Anime, Colorido, Fofo, Estilizado, Terceira Pessoa, Investigação, Mágica, Mitologia, Natureza, Relaxante, Gerenciamento de Inventário, Anos 90"
Homura Hime,2025,Indefinido,https://store.steampowered.com/app/1820000/Homura_Hime/?snr=1_7_7_popularcomingsoon_150_14,"Luta Espetacular, Hack and Slash, Chuva de Balas, RPG de Ação, Luta 3D, Protagonista Mulher, Jogo de Ação Focado em Personagem, 3D, Fofo, Boa Trama, Ação, Anime, Atmosférico, Um Jogador, Indie, Soulslike, Remake, Hentai, Vikings, Conteúdo Sexual"
SOVIET SPOOKY TALES: Green Eyes,2025,Indefinido,https://store.steampowered.com/app/3150620/SOVIET_SPOOKY_TALES_Green_Eyes/?snr=1_7_7_popularcomingsoon_150_14,"Romance Visual, Terror, Gráficos Pixelados, Anos 80, Aventura, Velha-Guarda, Anime, Comédia, Não Linear, Vários Finais, Indie, Um Jogador, Ficção Interativa, 2D"
Pebbles Quest,2025,Free,https://store.steampowered.com/app/3002610/Pebbles_Quest/?snr=1_7_7_popularcomingsoon_150_14,"Aventura, Engraçado, Vários Finais, Escolha a sua Aventura, Comédia, Ficção Interativa, Medieval, Memes, Casual, Para Toda a Família, Desenhado à Mão, Apontar e Clicar, Um Jogador, Você Decide, 2D, Ação, Indie, Gratuito para Jogar"
ELEMASTA -エレマスタ-,2025,Indefinido,https://store.steampowered.com/app/2923500/ELEMASTA/?snr=1_7_7_popularcomingsoon_150_14,"RPG, JRPG, Plataforma 2D, Gráficos Pixelados, Fantasia, Mundo Aberto, Um Jogador"
Game Cafe,2025,Indefinido,https://store.steampowered.com/app/2051890/Game_Cafe/?snr=1_7_7_popularcomingsoon_150_15,"Acesso Antecipado, Casual, Cartas, Jogo de Mesa, Jogo de Tabuleiro, Multijogador, Jogador x Jogador (PvP), 3D, Primeira Pessoa"
Grand Arms: March of the Red Dragon,2025,Indefinido,https://store.steampowered.com/app/2056130/Grand_Arms_March_of_the_Red_Dragon/?snr=1_7_7_popularcomingsoon_150_15,"RPG Tático, Tática por Turnos, Tática em Tempo Real, Batalha Automática, RPG de Estratégia, Estratégia em Turnos, JRPG, Personalização de Personagem, RPG, Estratégia, 2,5D, Histórico, Você Decide, Vários Finais, Boa Trama, Combate em Turnos, Gerenciamento, Medieval, Tático, Um Jogador"
Kitsune: The Journey of Adashino,2025,Indefinido,https://store.steampowered.com/app/2065580/Kitsune_The_Journey_of_Adashino/?snr=1_7_7_popularcomingsoon_150_15,"Exploração, Atmosférico, Plataforma 3D, Objetos Ocultos, Ação / Aventura, 3D, Indie, Terror, Boa Trama, Desenhado à Mão, Fantasia, Aventura, Um Jogador, Colorido, Fantasia Sombria, Retrô, Protagonista Mulher"
Ragtag Heroes : CO-OP Deckbuilder,2025,Indefinido,https://store.steampowered.com/app/2067070/Ragtag_Heroes__COOP_Deckbuilder/?snr=1_7_7_popularcomingsoon_150_15,"Cooperativo, Montagem de Decks Roguelike, Roguelite, Montagem de Decks, Um Jogador, RPG, Cartas, Multijogador, Combate em Turnos, Cooperativo On-line, Aventura, Estratégia, Fantasia, Em Turnos, Estratégia em Turnos, 3D, Roguelike, RPG de Grupos, Tática por Turnos, Cooperativo Local"
Reclaim The Sea,2025,Indefinido,https://store.steampowered.com/app/2096860/Reclaim_The_Sea/?snr=1_7_7_popularcomingsoon_150_15,"Estratégia, Roguelike, Um Jogador, Gráficos Pixelados, Difícil, 2D, Geração Procedural, Alta Rejogabilidade, Roguelite, Fantasia, Piratas, Tempo Real com Pausa, Tática em Tempo Real, Morte Permanente, Steampunk, Visão Superior, Aventura, RPG, Simulação, Naval"
THE STARBITES,2025,Indefinido,https://store.steampowered.com/app/2199080/THE_STARBITES/?snr=1_7_7_popularcomingsoon_150_15,"RPG, Estratégia em Turnos, Tática por Turnos, 3D, Anime, Fantasia, Robôs, Espacial, Boa Trama, Combate em Turnos, JRPG, Escolha a sua Aventura, RPG Tático, Exploração, Colorido, Estilizado, Visão Superior, Ficção Científica, Mechas, Futurista"
Hoglands,Q4 2025,Indefinido,https://store.steampowered.com/app/2210240/Hoglands/?snr=1_7_7_popularcomingsoon_150_15,"Câmera Lateral, Exploração, Construção de Cidades, Faça o que Quiser, Defesa de Torres, Plataforma, Estratégia em Tempo Real (RTS), Personalização de Personagem, RPG, Estratégia, 2D, Construção de Bases, Mundo Aberto, Ação, Gerenciamento, Medieval, Fantasia, Atmosférico, Construção, Fabricação"
Battle Vision Network,2025,Indefinido,https://store.steampowered.com/app/2216850/Battle_Vision_Network/?snr=1_7_7_popularcomingsoon_150_15,"Ação, Estratégia, Quebra-Cabeça, Jogador x Jogador (PvP), Multijogador, Tática por Turnos, Combate em Turnos, Estratégia em Turnos, Batalha com Cartas, Competitivo, Casual, Jogo de Cartas, 2D, 3D, Indie, Fantasia, Colorido, Desenhado à Mão, Ficção Científica, Estilizado"
The World Well: Blood of Caro,2025,Indefinido,https://store.steampowered.com/app/2648900/The_World_Well_Blood_of_Caro/?snr=1_7_7_popularcomingsoon_150_15,"Romance Visual, Protagonista Mulher, Distópico, Vampiros, Aventura, Fantasia, 2D, Robôs, Ficção Interativa, História Alternativa, Indie, Violento, Violência Detalhada, Boa Trama, Drama, Um Jogador, Anime"
Ghost Keeper,2025,Indefinido,https://store.steampowered.com/app/2708880/Ghost_Keeper/?snr=1_7_7_popularcomingsoon_150_15,"Demônios, Estratégia, Humor Pesado, Quebra-Cabeça, Estratégia em Tempo Real (RTS), Sobrenatural, Protagonista Vilão, 3D, Isométrico, Humor Ácido, Engraçado, Casual, Relaxante, Terror, Narração, Estilizado, Gerenciamento, Atmosférico, Gerenciamento de Recursos, Um Jogador"
GROWTH EXPERIMENT,2025,Indefinido,https://store.steampowered.com/app/2745510/GROWTH_EXPERIMENT/?snr=1_7_7_popularcomingsoon_150_15,"Um Jogador, Simulação, Indie, Atmosférico, Vários Finais, Escolha a sua Aventura, Romance Visual, Simulador Imersivo, Gerenciamento, Boa Trama, 2D, Aventura, Simulador de Encontros"
Saborus,2025,Indefinido,https://store.steampowered.com/app/2768030/Saborus/?snr=1_7_7_popularcomingsoon_150_15,"Ação, Aventura, Furtivo, Atmosférico, Terror, Sombrio, Mistério, Quebra-Cabeça, Terceira Pessoa, Um Jogador, Ação / Aventura, Indie, 3D, Plataforma 3D, Exploração, Sátira, Terror de Sobrevivência, Conspiração, Experimental, Político"
Infinity: HexaDome Tactics,2025,Indefinido,https://store.steampowered.com/app/1498550/Infinity_HexaDome_Tactics/?snr=1_7_7_popularcomingsoon_150_15,"Em Turnos, Estratégia, Tática por Turnos, Estratégia em Turnos, Ação, Esportes, Tático, Engraçado, Multijogador, Combate em Turnos, Jogo de Tabuleiro, Ficção Científica, Jogador x Jogador (PvP), Um Jogador, Personalização de Personagem, 3D, Competitivo, Colorido, Futurista, Jogo de Mesa"
Celestial Empire: Prologue,2025,Free,https://store.steampowered.com/app/1509970/Celestial_Empire_Prologue/?snr=1_7_7_popularcomingsoon_150_15,"Estratégia, Construção de Cidades, Simulador de Colônias, Simulação, Gerenciamento, Construção, Histórico, Construção de Bases, 3D, Realístico, Fantasia, Economia, Mitologia, Relaxante, Sobrevivência, Movimento em Grade, Gerenciamento de Recursos, Um Jogador, Estratégia em Tempo Real (RTS), Simulador Imersivo"
Dinos Reborn,2025,Indefinido,https://store.steampowered.com/app/1522360/Dinos_Reborn/?snr=1_7_7_popularcomingsoon_150_15,"Sobrevivência em Mundo Aberto, Tiro em Primeira Pessoa (FPS), Dinossauros, Mundo Aberto, Sobrevivência, Exploração, Caça, Indie, Um Jogador, Ação / Aventura, 3D, Primeira Pessoa, RPG, Boa Trama, Faça o que Quiser, Ação, Construção de Bases, Realístico, Aventura, Ficção Científica"
Mythos: Build & Survive,2025,Indefinido,https://store.steampowered.com/app/1570220/Mythos_Build__Survive/?snr=1_7_7_popularcomingsoon_150_15,"Mitologia, Estratégia em Tempo Real (RTS), Construção de Cidades, Medieval, Fantasia, Relaxante, Construção de Bases, Sobrevivência, Gerenciamento de Recursos, Casual, Simulação, Estratégia, Vikings, Colorido, Fabricação, Gerenciamento, Faça o que Quiser, Visão Superior, Jogo de Guerra, Um Jogador"
Lock & Key: A Magical Girl Mystery,2025,Indefinido,https://store.steampowered.com/app/1803850/Lock__Key_A_Magical_Girl_Mystery/?snr=1_7_7_popularcomingsoon_150_15,"Casual, Romance Visual, LGBTQIA+, 2D, Mistério, Protagonista Mulher, Vários Finais, Boa Trama, Um Jogador"
