title,release_date,price,game_url,genres
Dr.Mememe want to sleep,2026,Indefinido,https://store.steampowered.com/app/3386670/DrMememe_want_to_sleep/?snr=1_7_7_popularcomingsoon_150_20,"Isométrico, Fofo, Relaxante, Boa Trama, Colorido, Incremental, Casual, Automação, Clique e Clique, Um Jogador, Simulação, Protagonista Mulher, 3D, Baseado em Texto, Conversas, Anime, Para Toda a Família, Atmosférico, Apontar e Clicar, Humor Ácido"
Severed Love,2026,Indefinido,https://store.steampowered.com/app/3412110/Severed_Love/?snr=1_7_7_popularcomingsoon_150_20,"Otome, Terror Psicológico, Romance Visual, Protagonista Mulher, Anime, Terror de Sobrevivência, Apontar e Clicar, Mistério, Thriller, Detetive, Aventura, Sombrio, Escolha a sua Aventura, Humor Ácido, Vários Finais, Boa Trama, Romance, Atmosférico, Cinematográfico, Desenhado à Mão"
Disc Creatures WORLD,2026,Indefinido,https://store.steampowered.com/app/3440740/Disc_Creatures_WORLD/?snr=1_7_7_popularcomingsoon_150_20,"RPG, JRPG, Coleção de Criaturas, Um Jogador, Colete Tudo, 2D, Gráficos Pixelados, Combate em Turnos, Visão Superior, Indie, Retrô, Comédia, Boa Trama"
Harrowlands,2026,Indefinido,https://store.steampowered.com/app/3460400/Harrowlands/?snr=1_7_7_popularcomingsoon_150_20,"Acesso Antecipado, Construção de Bases, Construção de Cidades, Estratégia, Sobrevivência, Simulador de Colônias, Exploração, Geração Procedural, Gerenciamento, Enredo Rico, Fantasia, Simulação, Medieval, Visão Superior, RPG de Estratégia, Compatível com Mods, Pós-Apocalíptico, RPG Tático, Gerenciamento de Recursos, Fabricação"
Aeterna Lucis,2026,Indefinido,https://store.steampowered.com/app/2710920/Aeterna_Lucis/?snr=1_7_7_popularcomingsoon_150_20,"Metroidvania, Plataforma, Ação / Aventura, 2D, Exploração, Desenhado à Mão, Soulslike, Um Jogador, Plataforma de Precisão, Aventura, Ação, Anime, Atmosférico, Câmera Lateral, Fantasia, Mágica, Trilha Sonora, Combate, Controle, Plataforma com Quebra-Cabeça"
Bestiario,Q4 2026,Indefinido,https://store.steampowered.com/app/2760720/Bestiario/?snr=1_7_7_popularcomingsoon_150_20,"Um Jogador, JRPG, Anime, Romance Visual, Boa Trama, Velha-Guarda, RPG de Grupos, Comovente, Romance, Conversas, Combate em Turnos, Retrô, Você Decide, Narração Dinâmica, Gráficos Pixelados, RPG, Mitologia, LGBTQIA+, Vários Finais, Trilha Sonora"
Wax Heads,2026,Indefinido,https://store.steampowered.com/app/2769240/Wax_Heads/?snr=1_7_7_popularcomingsoon_150_20,"Você Decide, Conversas, Estilizado, Exploração, Aventura, Indie, Apontar e Clicar, Quebra-Cabeça, Um Jogador, Boa Trama, 2D, Colorido, Ficção Interativa, Romance Visual, Baseado em Texto, Subterrâneo, Detetive, História em Quadrinhos, Engraçado, Enredo Rico"
Aquapark Tycoon,2026,Indefinido,https://store.steampowered.com/app/2819470/Aquapark_Tycoon/?snr=1_7_7_popularcomingsoon_150_20,"Simulação, Construção, Faça o que Quiser, Gerenciamento, Para Toda a Família, Relaxante, Economia, Construção de Cidades, Gerenciamento de Tempo, Cartunizado, Colorido, Gerenciamento de Recursos, Jogo de Divindade, Fofo, 3D, Editor de Níveis, Simulador Imersivo, Estilizado, Capitalismo, Cooperativo"
THE LIFT: Supernatural Handyman Simulator,2026,Indefinido,https://store.steampowered.com/app/3283240/THE_LIFT_Supernatural_Handyman_Simulator/?snr=1_7_7_popularcomingsoon_150_20,"Simulação, Primeira Pessoa, Ficção Científica, Um Jogador, Atmosférico, Construção, Exploração, Boa Trama, Aventura, Fabricação, Simulador Imersivo, Enredo Rico, Mistério, Sobrenatural, Gerenciamento de Recursos, 3D, Imersivo, Relaxante, Faça o que Quiser, Quebra-Cabeça"
Dungeon Treaders,2026,Indefinido,https://store.steampowered.com/app/4165660/Dungeon_Treaders/?snr=1_7_7_popularcomingsoon_150_20,"Explorador de Calabouços, RPG, Velha-Guarda, Movimento em Grade, Estilizado, RPG de Grupos, Um Jogador"
Mixed Spirits: Bartender Simulator,2026,Indefinido,https://store.steampowered.com/app/3891400/Mixed_Spirits_Bartender_Simulator/?snr=1_7_7_popularcomingsoon_150_20,"Simulação, Casual, Aconchegante, Simulador de Emprego, Gerenciamento de Lojas, Gerenciamento, Indie, Do Bem, Economia, Simulador de Passatempo, Simulador de Vida Real, Para Toda a Família, Apontar e Clicar, Gerenciamento de Recursos, Conversas, Relaxante, Estratégia, Fofo, Um Jogador, Eventos Rápidos"
Next In Line: Supermarket,2026,Indefinido,https://store.steampowered.com/app/3894830/Next_In_Line_Supermarket/?snr=1_7_7_popularcomingsoon_150_20,"Simulação, Casual, Simulador de Emprego, Gerenciamento de Lojas, Do Bem, Aconchegante, Simulador de Vida Real, Fofo, Estratégia, Colorido, Para Toda a Família, Gerenciamento, Troca, Simulador Imersivo, Gerenciamento de Recursos, Capitalismo, Relaxante, Faça o que Quiser, Eventos Rápidos, Um Jogador"
Nothing To Declare,2026,Indefinido,https://store.steampowered.com/app/3894850/Nothing_To_Declare/?snr=1_7_7_popularcomingsoon_150_20,"Simulação, Casual, Simulador de Emprego, Do Bem, Voo, Fofo, Eventos Rápidos, Relaxante, Colorido, Objetos Ocultos, Para Toda a Família, Simulador Imersivo, Aconchegante, Simulador de Vida Real, Indie, Estratégia, Engraçado, Um Jogador, Apontar e Clicar, Você Decide"
Might & Magic Fates TCG,2026,Indefinido,https://store.steampowered.com/app/3918850/Might__Magic_Fates_TCG/?snr=1_7_7_popularcomingsoon_150_20,"Estratégia, Gratuito para Jogar, Cartas, Montagem de Decks, Batalha com Cartas, Jogo de Cartas, Estratégia em Turnos, Fantasia, Tática por Turnos, Colorido, Jogador x Jogador (PvP), 2D, 3D, Combate em Turnos, Estilizado, Multijogador, Troca, Um Jogador, Mágica, Visão Superior"
Ugoku Sushi Bar,2026,Indefinido,https://store.steampowered.com/app/3938640/Ugoku_Sushi_Bar/?snr=1_7_7_popularcomingsoon_150_20,"Casual, Culinária, Simulação, Simulador de Emprego, Anime, Aconchegante, Estratégia, Fofo, Gerenciamento, Ambiente, Relaxante, Do Bem, Minijogos, Simulador Imersivo, Indie, Gerenciamento de Inventário, 2D, Para Toda a Família, Apontar e Clicar, Cartunizado"
Lootbane,2026,Indefinido,https://store.steampowered.com/app/3950440/Lootbane/?snr=1_7_7_popularcomingsoon_150_20,"Saques, RPG de Ação, RPG, Roguelite, Gerenciamento de Inventário, Batalha Automática, Explorador de Calabouços, Gráficos Pixelados, RPG de Estratégia, Roguelike, RPG de Grupos, Roguelike de Ação, Indie, Aventura, Hack and Slash, Minimalista, Medieval, Fantasia Sombria, Calabouço Misterioso, Exploração"
Another Hero's Adventure,2026,Indefinido,https://store.steampowered.com/app/3956640/Another_Heros_Adventure/?snr=1_7_7_popularcomingsoon_150_20,"RPG, Aventura, Indie, Estratégia, Estratégia em Turnos, Artes Marciais, Vários Finais, Gráficos Pixelados, 2D, Anime, Drama, Furtivo, Escolha a sua Aventura, Em Turnos, Um Jogador, Boa Trama, Mundo Aberto, Simulação, Conteúdo Sexual, RPG Maker"
In Falsus,2026,Indefinido,https://store.steampowered.com/app/3971950/In_Falsus/?snr=1_7_7_popularcomingsoon_150_20,"Ritmo, Música, Anime, Ação, Montagem de Decks, Fabricação, Boa Trama, Protagonista Mulher, Comovente, Narrativa, Indie, Grade Hexagonal, Linear, Um Jogador, 2D, Ficção Científica, Romance Visual"
Armaphract,Q4 2026,Indefinido,https://store.steampowered.com/app/4001820/Armaphract/?snr=1_7_7_popularcomingsoon_150_20,"Estratégia, Estratégia em Tempo Real (RTS), Tática em Tempo Real, Tempo Real com Pausa, Tanques, Jogo de Guerra, Simulação, Tático, Militar, Ação, Estratégia em Tempo Real com Ação, Visão Superior, Combate com Veículos, Um Jogador, 3D, Estilizado, Distópico"
Chronoscript: The Endless End,2026,Indefinido,https://store.steampowered.com/app/4018380/Chronoscript_The_Endless_End/?snr=1_7_7_popularcomingsoon_150_20,"Ação, Metroidvania, Aventura, 2D, Ação / Aventura, Roguelike de Ação, RPG, Desenhado à Mão, Fantasia Sombria, Morte Permanente, Um Jogador, 3D, RPG de Ação, Soulslike, Vampiros, Plataforma"
Rizz Dungeon: Skeleton Key to My Heart,2026,Indefinido,https://store.steampowered.com/app/4029090/Rizz_Dungeon_Skeleton_Key_to_My_Heart/?snr=1_7_7_popularcomingsoon_150_20,"Coleção de Criaturas, RPG, Explorador de Calabouços, Jogador X Ambiente (PvE), Protagonista Mulher, RPG de Grupos, LGBTQIA+, Romance, Aventura, Fofo, Engraçado, Combate em Turnos, Colorido, Gráficos Pixelados, Boa Trama, Fantasia, Memes, Nostalgia, Comédia, Do Bem"
大千世界2 The Stupendous World,2026,Indefinido,https://store.steampowered.com/app/4030970/2_The_Stupendous_World/?snr=1_7_7_popularcomingsoon_150_20,"RPG, Aventura, Estratégia, Mundo Aberto, Um Jogador, Combate em Turnos, Estratégia em Turnos, Gráficos Pixelados, RPG de Grupos, RPG de Estratégia, Indie, 2D, Drama, Enredo Rico, Boa Trama"
配信少女ノ裏垢迷宮,2026,Indefinido,https://store.steampowered.com/app/4078190/_/?snr=1_7_7_popularcomingsoon_150_20,"Plataforma 2D, RPG, Romance Visual, Design e Ilustração, RPG de Grupos, JRPG, Protagonista Mulher, Fofo, 2D, Aventura, Terror Psicológico, Baseado em Texto, Boa Trama, Anime, Colorido, Psicodélico, Mistério, Psicológico, Atmosférico, Um Jogador"
Poppy Playtime - Chapter 5,2026,Indefinido,https://store.steampowered.com/app/4100940/Poppy_Playtime__Chapter_5/?snr=1_7_7_popularcomingsoon_150_20,"Terror, Um Jogador, Quebra-Cabeça, Primeira Pessoa, Terror de Sobrevivência, Sombrio, Mistério, Terror Psicológico, Sobrevivência, Indie, Aventura, Ação, Thriller, Enredo Rico, Anos 80, Atmosférico, Cartunizado, Ação / Aventura, Física, Jump Scare"
Eternity Breaker,2026,Indefinido,https://store.steampowered.com/app/4125860/Eternity_Breaker/?snr=1_7_7_popularcomingsoon_150_20,"RPG Tático, RPG, Tática por Turnos, Estratégia, Roguelite, Simulação, RPG de Estratégia, Estratégia em Turnos, JRPG, Roguelike, 2,5D, Gráficos Pixelados, Indie, Fantasia Sombria, Fantasia, Tático, Anos 90, Um Jogador"
Boba Cafe Simulator,2026,Indefinido,https://store.steampowered.com/app/3683770/Boba_Cafe_Simulator/?snr=1_7_7_popularcomingsoon_150_20,"Simulador Imersivo, Fabricação, Simulador de Vida Real, Simulação, 3D, Culinária, Um Jogador, Cooperativo, RPG, Cooperativo On-line, Multijogador, Casual, Realístico, Primeira Pessoa, Construção, Relaxante, Engraçado, Atmosférico, Gerenciamento, Economia"
The Last Gas Station,2026,Indefinido,https://store.steampowered.com/app/3690030/The_Last_Gas_Station/?snr=1_7_7_popularcomingsoon_150_20,"Gerenciamento de Lojas, Aconchegante, Mistério, Gerenciamento, Colorido, Casual, Investigação, Fofo, Aventura, Gráficos Pixelados, Simulação, Simulador de Emprego, Exploração, Atmosférico, Sobrevivência, Um Jogador, Construção, Câmera Lateral, Apontar e Clicar, Você Decide"
The Secret of Weepstone,2026,Indefinido,https://store.steampowered.com/app/3702100/The_Secret_of_Weepstone/?snr=1_7_7_popularcomingsoon_150_20,"Explorador de Calabouços, CRPG, Sombrio, Jogo de Mesa, Dados, RPG de Grupos, Terror, Velha-Guarda, Fantasia Sombria, Combate em Turnos, Aventura, Dungeons & Dragons, 2,5D, Exploração, Estilizado, Anos 80, Boa Trama, Jogador X Ambiente (PvE), Fantasia, RPG"
WORLD OF DOGS,2026,Indefinido,https://store.steampowered.com/app/3703360/WORLD_OF_DOGS/?snr=1_7_7_popularcomingsoon_150_20,"Simulador Imersivo, Mundo Aberto, Jogador X Ambiente (PvE), Jogador x Jogador (PvP), Indie, Violência Detalhada, Aventura, Ação, Violento, Tiro em Primeira Pessoa (FPS), Tiro com Saques"
Heroes of Might and Magic: Olden Era,2026,Indefinido,https://store.steampowered.com/app/3105440/Heroes_of_Might_and_Magic_Olden_Era/?snr=1_7_7_popularcomingsoon_150_21,"Estratégia, Estratégia em Turnos, Simulação, Tático, Grande Estratégia, 4X, Fantasia Sombria, Histórico, Multijogador, Guerra, Gerenciamento, Faça o que Quiser, Em Turnos, Um Jogador, Cooperativo, Compatível com Mods, Militar, Economia, Diplomacia, Alta Rejogabilidade"
Dark Queen of Samobor,2026,Indefinido,https://store.steampowered.com/app/3106050/Dark_Queen_of_Samobor/?snr=1_7_7_popularcomingsoon_150_21,"Cinematográfico, Câmera Lateral, 2,5D, Ação / Aventura, Plataforma com Quebra-Cabeça, Atmosférico, Hack and Slash, Estilizado, Boa Trama, Fantasia Sombria, Um Jogador, Gótico, Narração, Mitologia, Medieval, Linear, Colorido, Enredo Rico, Mágica, Sombrio"
Word Game World,2026,Indefinido,https://store.steampowered.com/app/3114370/Word_Game_World/?snr=1_7_7_popularcomingsoon_150_21,"Jogo de Palavras, Minimalista, Editor de Níveis, Baseado em Texto, Simulação, Quebra-Cabeça, RPG, Noir, Ficção Interativa, Estilizado, Educativo, Gráficos Pixelados, Exploração, Estratégia, Um Jogador, Colorido, Simulador de Encontros, Programação, Soletração, Desenvolvimento de Jogos"
"Warhammer 40,000: Boltgun 2",2026,Indefinido,https://store.steampowered.com/app/3115160/Warhammer_40000_Boltgun_2/?snr=1_7_7_popularcomingsoon_150_21,"Ação, Tiro de Tiozão, Tiro em Primeira Pessoa (FPS), Retrô, Primeira Pessoa, Violento, Tiro, Violência Detalhada, Um Jogador, Terror, Tiro em Arena, Velha-Guarda, Anos 90, Atmosférico, Sangue, Demônios, Difícil, Ficção Científica, Gráficos Pixelados, Warhammer 40K"
Scriptorium: Master of Manuscripts,2026,Indefinido,https://store.steampowered.com/app/3119540/Scriptorium_Master_of_Manuscripts/?snr=1_7_7_popularcomingsoon_150_21,"Design e Ilustração, Casual, Medieval, Simulação, Estilizado, Colorido, Simulador Imersivo, 2D, Gerenciamento de Lojas, Economia, Fofo, Relaxante, Engraçado, Gerenciamento de Recursos, Um Jogador, Indie, Atmosférico, Do Bem, Aconchegante, Para Toda a Família"
Moon Princess,2026,Indefinido,https://store.steampowered.com/app/3123130/Moon_Princess/?snr=1_7_7_popularcomingsoon_150_21,"Simulação, Casual, Estratégia, RPG, Simulador de Vida Real, JRPG, Romance Visual, 2D, Anime, Simulador de Encontros, Combate em Turnos, Desenhado à Mão, Drama, Indie, Protagonista Mulher, Relaxante, Enredo Rico, Artes Marciais, Vários Finais, Boa Trama"
Far Far West,2026,Indefinido,https://store.steampowered.com/app/3124540/Far_Far_West/?snr=1_7_7_popularcomingsoon_150_21,"Acesso Antecipado, Cooperativo On-line, Jogador X Ambiente (PvE), Tiro em Primeira Pessoa (FPS), Multijogador, Ação, Tiro, Cooperativo, Velho Oeste, Robôs, Tiro de Extração, Comédia, Combate, Saques, Difícil, Primeira Pessoa, Ação / Aventura, Ficção Científica, Sobrevivência, Mágica"
Shadow Project,2026,Indefinido,https://store.steampowered.com/app/3143530/Shadow_Project/?snr=1_7_7_popularcomingsoon_150_21,"Terror, Tiro em Primeira Pessoa (FPS), Atmosférico, Um Jogador, Boa Trama, Terror Psicológico, Simulador Imersivo, Linear, Militar, Realístico, Jogador X Ambiente (PvE), Ação / Aventura, Tiro, Primeira Pessoa, Enredo Rico, Você Decide, Tiro com Saques, Ação, Guerra Fria, Aventura"
Usagi Shima: Bunny Island,2026,Indefinido,https://store.steampowered.com/app/3144010/Usagi_Shima_Bunny_Island/?snr=1_7_7_popularcomingsoon_150_21,"Do Bem, Fofo, Relaxante, Casual, Coleção de Criaturas, Colorido, Simulação, Desenhado à Mão, Aconchegante, Faça o que Quiser, Para Toda a Família, Gerenciamento, Construção, Um Jogador, 2D, Natureza, Isométrico, Alta Rejogabilidade, Fabricação, Incremental"
ノナプルナイン：アシンプトート,2026,Indefinido,https://store.steampowered.com/app/3145650/_/?snr=1_7_7_popularcomingsoon_150_21,"Exploração, Câmera Lateral, Aventura, Romance Visual, Protagonista Mulher, Apontar e Clicar, Boa Trama, Colorido, Ficção Científica, Filosófico, Um Jogador"
Feudums,2026,Free,https://store.steampowered.com/app/473750/Feudums/?snr=1_7_7_popularcomingsoon_150_21,"Estratégia, Simulação, Grande Estratégia, Estratégia em Turnos, 4X, Medieval, Multijogador Massivo, Alta Rejogabilidade, Jogador x Jogador (PvP), Compatível com Mods, Construção de Cidades, Grade Hexagonal, Simulador Político, Diplomacia, Guerra, Economia, Colorido, Incremental, Multijogador, Um Jogador"
Animas,2026,Indefinido,https://store.steampowered.com/app/3325720/Animas/?snr=1_7_7_popularcomingsoon_150_21,"Terror Psicológico, Atmosférico, Primeira Pessoa, Boa Trama, Indie, Sombrio, Um Jogador, Terror, Simulador de Caminhada, Exploração, Aventura, Mistério, Para Adultos, Narração, 3D, Imersivo, Realístico, Sobrenatural, Ficção Interativa, Não Linear"
Airport Control 25,2026,Indefinido,https://store.steampowered.com/app/3328490/Airport_Control_25/?snr=1_7_7_popularcomingsoon_150_21,"Simulação, Estratégia, Simulador Imersivo, Voo, Gerenciamento, Tática em Tempo Real, Transportes, Jatos, Gerenciamento de Tempo, Um Jogador, 3D, Realístico, Editor de Níveis, Cooperativo, Cooperativo On-line, Multijogador, Gerenciamento de Recursos"
Tales of Tuscany,2026,Indefinido,https://store.steampowered.com/app/3334170/Tales_of_Tuscany/?snr=1_7_7_popularcomingsoon_150_21,"Aventura, RPG, RPG de Grupos, Chuva de Balas, Escolha a sua Aventura, Coleção de Criaturas, Exploração, Gráficos Pixelados, Comédia, Para Toda a Família, Engraçado, Enredo Rico, Boa Trama, Mágica, Você Decide, Combate em Turnos, Medieval, Natureza, Personalização de Personagem, Vários Finais"
Tsarevna,2026,Indefinido,https://store.steampowered.com/app/3348640/Tsarevna/?snr=1_7_7_popularcomingsoon_150_21,"Ação / Aventura, Hack and Slash, Fantasia Sombria, Protagonista Mulher, Um Jogador, Ação, Aventura, Atmosférico, Exploração, Fantasia, Boa Trama, Combate, Terceira Pessoa, Mitologia, Trilha Sonora, Mágica, Espada, Luta Espetacular, 3D, Jogo de Ação Focado em Personagem"
Skill Eater,2026,Indefinido,https://store.steampowered.com/app/3348920/Skill_Eater/?snr=1_7_7_popularcomingsoon_150_21,"Roguelike, Roguelite, RPG, Em Turnos, Anime, Fantasia, Um Jogador, Fofo, Combate em Turnos"
A Planet Full of Cats,2026,Indefinido,https://store.steampowered.com/app/3355100/A_Planet_Full_of_Cats/?snr=1_7_7_popularcomingsoon_150_21,"Gatos, Objetos Ocultos, Metroidvania, Do Bem, Aconchegante, Ficção Científica, Exploração, Casual, Relaxante, Quebra-Cabeça, Aventura, Desenhado à Mão, Apontar e Clicar, Narrativa, Coleção de Criaturas, Colete Tudo, Fofo, Um Jogador, Cartunizado, Para Toda a Família"
PRAGMATA,2026,Indefinido,https://store.steampowered.com/app/3357650/PRAGMATA/?snr=1_7_7_popularcomingsoon_150_21,"Fofo, Engraçado, Ação, Aventura, Ficção Científica, Tiro em Terceira Pessoa, Ação / Aventura, Futurista, 3D, Terceira Pessoa, Robôs, Hacker, Um Jogador, Boa Trama, Realístico, Inteligência Artificial, Jogador X Ambiente (PvE), Terror Psicológico, Protagonista Mulher, Espacial"
The Retrospection Of Tomorrow,Q4 2026,Indefinido,https://store.steampowered.com/app/3376860/The_Retrospection_Of_Tomorrow/?snr=1_7_7_popularcomingsoon_150_21,"Viagem no Tempo, Thriller, Protagonista Mulher, Otome, Ficção Científica, Filosófico, Mistério, Romance Visual, Simulador de Encontros, RPG, Boa Trama, Romance, Aventura, Drama, Comovente, Detetive, Lógica, Vários Finais, Sombrio, Moderno"
Killer Chat! - Expanded Edition,2026,Indefinido,https://store.steampowered.com/app/3378100/Killer_Chat__Expanded_Edition/?snr=1_7_7_popularcomingsoon_150_21,"Simulador de Encontros, Simulação, Romance, Romance Visual, Terror, Terror Psicológico, Sombrio, Personalização de Personagem, Otome, Escolha a sua Aventura, LGBTQIA+, Simulador Imersivo, Ficção Interativa, Humor Ácido, Atmosférico, Primeira Pessoa, Comédia, Crime, Vários Finais, Boa Trama"
Age of History 2: Definitive Edition,2026,Indefinido,https://store.steampowered.com/app/3381680/Age_of_History_2_Definitive_Edition/?snr=1_7_7_popularcomingsoon_150_21,"Simulador Político, Jogo de Guerra, Faça o que Quiser, Diplomacia, Político, Guerra, Primeira Guerra Mundial, Segunda Guerra Mundial, Jogador x Jogador (PvP), Estratégia em Turnos, Estratégia, Grande Estratégia, 2D, História Alternativa, Histórico, Mundo Aberto, Simulação, Compatível com Mods, Multijogador, Um Jogador"
Planet Party Time,2026,Free,https://store.steampowered.com/app/3384570/Planet_Party_Time/?snr=1_7_7_popularcomingsoon_150_21,"Simulador de Vida Real, RPG, Espacial, Multijogador, Reúna a Galera, Editor de Níveis, Fofo, Mundo Aberto, Construção, Competitivo, Fabricação, Agricultura, Pesca, Casual, Simulador Rural, Cooperativo, Personalização de Personagem, Relaxante, Multijogador Massivo, Simulação"
Dicewood,2026,Indefinido,https://store.steampowered.com/app/3393850/Dicewood/?snr=1_7_7_popularcomingsoon_150_21,"Coleção de Criaturas, Dados, Fantasia Sombria, Mistério, Gatos, Roguelike, Montagem de Decks, Batalha com Cartas, Sombrio, Terror, Gráficos Pixelados, Estratégia, Fofo, Um Jogador, Sobrenatural, Cartas, Aventura, Combate em Turnos, Explorador de Calabouços, Casual"
Puni the Florist,2026,Indefinido,https://store.steampowered.com/app/3396290/Puni_the_Florist/?snr=1_7_7_popularcomingsoon_150_21,"Aconchegante, Do Bem, Casual, Simulação, Relaxante, Fofo, Desenhado à Mão, Design e Ilustração, Gerenciamento, Apontar e Clicar, Boa Trama, Fantasia, Simulador de Vida Real, Engraçado, Faça o que Quiser, Protagonista Mulher, Para Toda a Família, Natureza, Anime, Gerenciamento de Lojas"
Buster Jam,2026,Indefinido,https://store.steampowered.com/app/3399240/Buster_Jam/?snr=1_7_7_popularcomingsoon_150_21,"Minijogos, Desenho Animado, Engraçado, Arcade, Anos 90, Ação, Desenhado à Mão, Casual, Boa Trama, Ação / Aventura, 2D, Colorido, Estilizado, Para Toda a Família, Aventura, Linear, Um Jogador, Indie"
HellSlave II: Judgment of the Archon,2026,Indefinido,https://store.steampowered.com/app/3399900/HellSlave_II_Judgment_of_the_Archon/?snr=1_7_7_popularcomingsoon_150_21,"RPG, Explorador de Calabouços, Fantasia Sombria, Combate em Turnos, Demônios, Indie, Velha-Guarda, Visão Superior, Desenhado à Mão, Um Jogador, Baseado em Classes, Linear, Gerenciamento de Tempo, Exploração, Enredo Rico, Estratégia em Turnos, Tática por Turnos, História em Quadrinhos, 2D, Ação"
JOIN US,2026,Indefinido,https://store.steampowered.com/app/3401960/JOIN_US/?snr=1_7_7_popularcomingsoon_150_21,"Simulação, Sobrevivência, RPG, Mundo Aberto, Construção de Bases, Fabricação, Multijogador, Cooperativo On-line, Realístico, Morte Permanente, Faça o que Quiser, Terror, 3D, Cooperativo, RPG de Ação, Exploração, Economia, Simulador Imersivo, Tiro em Terceira Pessoa, Ação / Aventura"
Someone's Inside Me,2026,Indefinido,https://store.steampowered.com/app/3404880/Someones_Inside_Me/?snr=1_7_7_popularcomingsoon_150_21,"Multijogador, Terror, Estratégia, Humor Pesado, Sobrevivência, Terror Psicológico, Ação / Aventura, Cooperativo, Humor Ácido, Cooperativo On-line, Terror de Sobrevivência, Ficção Científica, 3D, Engraçado, Primeira Pessoa, Paródia, Gerenciamento de Tempo, Thriller, Battle Royale, Surrealista"
Psycho-Sleuth,2026,Indefinido,https://store.steampowered.com/app/3432860/PsychoSleuth/?snr=1_7_7_popularcomingsoon_150_21,"Romance Visual, Detetive, Boa Trama, Mistério, Terror Psicológico, Humor Ácido, Anime, Aventura, Sombrio, Terror, Quebra-Cabeça, Thriller, Psicológico, Exploração, Atmosférico, Ficção Científica, Engraçado, Lógica, Drama, Hack and Slash"
Dinoblade,2026,Indefinido,https://store.steampowered.com/app/3440070/Dinoblade/?snr=1_7_7_popularcomingsoon_150_21,"Dinossauros, RPG de Ação, Soulslike, Ação, Combate, RPG, Um Jogador, 3D, Terceira Pessoa, Fantasia, Jogador X Ambiente (PvE), Mágica, Linear, Realístico, Fantasia Sombria, Aventura, Violento, Natureza, Multijogador, Hentai"
Rootbound,2026,Indefinido,https://store.steampowered.com/app/3453490/Rootbound/?snr=1_7_7_popularcomingsoon_150_21,"Um Jogador, Física, Exploração, Mistério, Fofo, 3D, Quebra-Cabeça, Ação / Aventura, Isométrico, Colorido, Fantasia, Estilizado, Mundo Aberto, Narração, Construção de Bases, Aventura, Simulador Imersivo, Gráficos Pixelados, Controle, Hack and Slash"
Lacey's Flash Games,2026,Indefinido,https://store.steampowered.com/app/3459340/Laceys_Flash_Games/?snr=1_7_7_popularcomingsoon_150_21,"Terror Psicológico, Terror, Um Jogador, Fofo, Apontar e Clicar, Sombrio, 2D, Boa Trama, Humor Ácido, Protagonista Mulher, Psicológico, Estilizado, Psicodélico, Ação, Ação / Aventura, Aventura, Você Decide, Mistério, Clique e Clique, Escolha a sua Aventura"
Dead Watch,2026,Indefinido,https://store.steampowered.com/app/3464670/Dead_Watch/?snr=1_7_7_popularcomingsoon_150_21,"Manipulação de Tempo, Mistério, Terror Psicológico, Exploração, Aventura, Fuja da Sala, Indie, RPG, Boa Trama, Detetive, Quebra-Cabeça, Anime, Comédia, Primeira Pessoa, Estilizado, Um Jogador, Terror, Simulação, Protagonista Mulher, Viagem no Tempo"
Valkyrie Iteration: Mecha Pilot Raising Pocket Simulator,2026,Indefinido,https://store.steampowered.com/app/3466240/Valkyrie_Iteration_Mecha_Pilot_Raising_Pocket_Simulator/?snr=1_7_7_popularcomingsoon_150_21,"Simulação, Aventura, Gerenciamento de Tempo, Romance Visual, Anime, Gráficos Pixelados, Mechas, Atmosférico, Sombrio, Ficção Científica, Psicológico, Retrô, Romance, Guerra, Futurista, Pós-Apocalíptico, Você Decide, Vários Finais, Roguelite, Simulador de Vida Real"
Dungeons Deep,2026,Indefinido,https://store.steampowered.com/app/2636460/Dungeons_Deep/?snr=1_7_7_popularcomingsoon_150_21,"Ação, Aventura, RPG, Soulslike, RPG de Ação, Combate, Roguelike de Ação, Hack and Slash, Explorador de Calabouços, Ação / Aventura, Terceira Pessoa, Fantasia Sombria, Fantasia, Cooperativo, Medieval, Jogador X Ambiente (PvE), Terror, Zumbis, Exploração, Roguelike"
Onimusha: Way of the Sword,2026,Indefinido,https://store.steampowered.com/app/2638890/Onimusha_Way_of_the_Sword/?snr=1_7_7_popularcomingsoon_150_21,"Ação, RPG de Ação, Ação / Aventura, Um Jogador, Luta Espetacular, Espada, Fantasia Sombria, Violência Detalhada, Violento, Terror de Sobrevivência, Terror, Soulslike, Hack and Slash, Mistério, Realístico, 3D"
