title,release_date,price,game_url,genres
Hillshade Farm,January 2026,Indefinido,https://store.steampowered.com/app/3585520/Hillshade_Farm/?snr=1_7_7_popularcomingsoon_150_15,"Simulação, Simulador Rural, Simulador de Vida Real, Casual, Mundo Aberto, Relaxante, Fabricação, Construção, Economia, Gerenciamento de Recursos, Exploração, Física, Simulador Imersivo, Natureza, Agricultura, Realístico, Um Jogador, Rural, Acesso Antecipado, RPG"
Emberbane,January 2026,Indefinido,https://store.steampowered.com/app/2085310/Emberbane/?snr=1_7_7_popularcomingsoon_150_15,"Metroidvania, Plataforma, Difícil, 2D, Indie, Gráficos Pixelados, Ação, Um Jogador, Mundo Aberto, Exploração, Enredo Rico, Boa Trama, Plataforma de Precisão, Plataforma 2D, Ação / Aventura, Controle, Jogo de Ação Focado em Personagem, Vários Finais, Fantasia Sombria, Câmera Lateral"
Lost Isle,January 2026,Indefinido,https://store.steampowered.com/app/1531180/Lost_Isle/?snr=1_7_7_popularcomingsoon_150_15,"Acesso Antecipado, Primeira Pessoa, Medieval, Aventura, Mundo Aberto, Multijogador Massivo, Sobrevivência, Multijogador, Fabricação, Jogador x Jogador (PvP), Exploração, Faça o que Quiser, Hack and Slash, Construção de Bases, Gerenciamento de Recursos, Ação, Fantasia Sombria, Jogador X Ambiente (PvE), Combate, RPG"
Elengard: Ascension,January 2026,Indefinido,https://store.steampowered.com/app/2017480/Elengard_Ascension/?snr=1_7_7_popularcomingsoon_150_15,"RPG, Combate, Mágica, Fantasia, Medieval, Personalização de Personagem, Estratégia, RPG de Grupos, Boa Trama, Terceira Pessoa, Você Decide, RPG de Estratégia, Tempo Real com Pausa, Um Jogador, Tático, Bom Roteiro, CRPG, RPG de Ação, Ação, Aventura"
SECTOR ZERO,January 2026,Indefinido,https://store.steampowered.com/app/2352050/SECTOR_ZERO/?snr=1_7_7_popularcomingsoon_150_15,"Primeira Pessoa, Física, Boa Trama, Terror, Lovecraftiano, Protagonista Vilão, Furtivo, Cinematográfico, Ficção Científica, Plataforma com Quebra-Cabeça, Lógica, Ação / Aventura, Atmosférico, 3D, Robôs, Aventura, Exploração, Espacial, Um Jogador, Futurista"
SSR Wives: The Murder Of My Winter Crush,January 2026,Indefinido,https://store.steampowered.com/app/2880000/SSR_Wives_The_Murder_Of_My_Winter_Crush/?snr=1_7_7_popularcomingsoon_150_15,"Ação / Aventura, Terror de Sobrevivência, Anime, Romance Visual, Gerenciamento de Inventário, Exploração, Boa Trama, Vários Finais, Mistério, Um Jogador, Retrô, 3D, Ação, Combate, Metroidvania, Aventura, Atmosférico, Gerenciamento de Recursos, Violência Detalhada, Indie"
CrocApoca!! Crocodile maiden at the End of the World,January 2026,Indefinido,https://store.steampowered.com/app/1294620/CrocApoca_Crocodile_maiden_at_the_End_of_the_World/?snr=1_7_7_popularcomingsoon_150_15,"Romance Visual, Romance, Drama, Para Adultos, Anime, Engraçado, Conteúdo Sexual, Boa Trama, Alta Rejogabilidade, Fofo, Nudez, Você Decide, Comédia, Relaxante, Protagonista Mulher, Hentai, Simulador de Encontros, Impróprio para o Local de Trabalho, Aventura, LGBTQIA+"
Halcyon Days at Taoyuan,January 2026,Indefinido,https://store.steampowered.com/app/2678830/Halcyon_Days_at_Taoyuan/?snr=1_7_7_popularcomingsoon_150_15,"Simulação, Simulador Rural, Exploração, Coleção de Criaturas, CRPG, Gráficos Pixelados, Indie, Agricultura, Fabricação, Drama, Histórico, Culinária, Casual, RPG, Pesca, Boa Trama, Mundo Aberto, Um Jogador"
Strategos,January 2026,Indefinido,https://store.steampowered.com/app/3064810/Strategos/?snr=1_7_7_popularcomingsoon_150_15,"Estratégia, Histórico, Jogo de Guerra, Tática em Tempo Real, Estratégia em Tempo Real (RTS), Roma, Guerra, Tático, Militar, Simulação, Tática por Turnos, Jogo de Mesa, Medieval, Jogador X Ambiente (PvE), Realístico, Cinematográfico, Colorido, 3D, Atmosférico, Desenhado à Mão"
Jackal,January 2026,Indefinido,https://store.steampowered.com/app/3124230/Jackal/?snr=1_7_7_popularcomingsoon_150_15,"Violento, SHMUP com Visão Superior, Impiedoso, Parar o Tempo, Tiro, Visão Superior, Humor Ácido, Ação, Combate, Narração, Violência Detalhada, Noir, Jogador X Ambiente (PvE), Retrô, Estilizado, Ritmo Rápido, Crime, Sangue, Drama, Geração Procedural"
Dice A Million,January 2026,Indefinido,https://store.steampowered.com/app/3430340/Dice_A_Million/?snr=1_7_7_popularcomingsoon_150_15,"Dados, Roguelike, Montagem de Decks Roguelike, Montagem de Decks, Um Jogador, Alta Rejogabilidade, Casual, Gráficos Pixelados, Estratégia, Roguelite, Explorador de Calabouços, Em Turnos, Abstrato, Geração Procedural, Relaxante, Difícil, Engraçado, Psicodélico, 2D, Arcade"
NAMAKORIUM (ナマコリウム),January 2026,Indefinido,https://store.steampowered.com/app/3866920/NAMAKORIUM/?snr=1_7_7_popularcomingsoon_150_15,"Estratégia, Casual, Simulação, Apontar e Clicar, Plataforma 3D, Tática em Tempo Real, Exploração, 2D, 3D, Fofo, Anime, Relaxante, Para Toda a Família, Construção, Subaquático, Estratégia em Tempo Real (RTS), Engraçado, Natureza, Cooperativo On-line, Atmosférico"
War of Banners,January 2026,Indefinido,https://store.steampowered.com/app/3869940/War_of_Banners/?snr=1_7_7_popularcomingsoon_150_15,"Estratégia, RPG, Medieval, Guerra, Mundo Aberto, Simulação, Estratégia em Tempo Real (RTS), Aventura, 2,5D, Isométrico, Tática em Tempo Real, Cavalos, Faça o que Quiser, Personalização de Personagem, Histórico, Violência Detalhada, Indie, Grande Estratégia, RPG de Estratégia, Jogo de Guerra"
Breath of Life,January 2026,Indefinido,https://store.steampowered.com/app/3981950/Breath_of_Life/?snr=1_7_7_popularcomingsoon_150_15,"Protagonista Mulher, RPG, Fantasia Sombria, Hack and Slash, Ação, Ação / Aventura, Soulslike, Personalização de Personagem, RPG de Ação, 3D, Terceira Pessoa, Enredo Rico, Espada, Zumbis, Fantasia, Realístico, Saques, Terror, Atmosférico, Um Jogador"
Tearscape,"Feb 2, 2026",Indefinido,https://store.steampowered.com/app/3216340/Tearscape/?snr=1_7_7_popularcomingsoon_150_15,"Ação, Soulslike, Metroidvania, Fantasia Sombria, 2D, Gótico, Visão Superior, Gráficos Pixelados, Aventura, Exploração, Combate, Cooperativo Local, Cooperativo, Ação / Aventura, Plataforma 2D, Um Jogador, Indie, Controle, RPG, RPG de Ação"
MENACE,"Feb 5, 2026",Indefinido,https://store.steampowered.com/app/2432860/MENACE/?snr=1_7_7_popularcomingsoon_150_15,"Estratégia, RPG, Personalização de Personagem, Você Decide, Boa Trama, Combate em Turnos, CRPG, Alienígenas, Terror, Ficção Científica, Fantasia Sombria, Aventura, Estratégia em Turnos, Tático, Tática por Turnos, Em Turnos, Um Jogador, RPG Tático, Combate, Baseado em Classes"
Unemployment Simulator 2018,"Feb 5, 2026",Indefinido,https://store.steampowered.com/app/3252360/Unemployment_Simulator_2018/?snr=1_7_7_popularcomingsoon_150_15,"Roguelite, Boa Trama, Simulação, Sobrevivência, Um Jogador, Atmosférico, Aventura, Vários Finais, Indie, Mistério, Casual, Quebra-Cabeça, 2D, Comédia, Gráficos Pixelados, Câmera Lateral, Surrealista, Humor Pesado, Simulador de Vida Real, Retrô"
DRAGON QUEST VII Reimagined,"Feb 5, 2026",$59.99,https://store.steampowered.com/app/2499860/DRAGON_QUEST_VII_Reimagined/?snr=1_7_7_popularcomingsoon_150_15,"RPG, 3D, JRPG, Fofo, Combate, Um Jogador, Viagem no Tempo, Em Turnos, Combate em Turnos, Dragões, Nostalgia, RPG de Grupos, Fantasia, Remake, Protagonista Mudo, Comovente, Boa Trama, Atmosférico, Mágica, Aventura"
Deus Ex Remastered,"Feb 5, 2026",$26.99,https://store.steampowered.com/app/3131640/Deus_Ex_Remastered/?snr=1_7_7_popularcomingsoon_150_15,"Ação, Conspiração, RPG, Aventura, Velha-Guarda, Distópico, Cyberpunk, Simulador Imersivo, Atmosférico, Futurista, Noir, Sombrio, RPG de Ação, Tiro em Primeira Pessoa (FPS), Ação / Aventura, 3D, Anos 90, Inteligência Artificial, Drama, Enredo Rico"
MY HERO ACADEMIA: All’s Justice,"Feb 5, 2026",$59.99,https://store.steampowered.com/app/2362050/MY_HERO_ACADEMIA_Alls_Justice/?snr=1_7_7_popularcomingsoon_150_15,"Ação, Luta 3D, 3D, Anime, Jogador x Jogador (PvP), Um Jogador, Multijogador, Mundo Aberto"
Nioh 3,"Feb 6, 2026",$69.99,https://store.steampowered.com/app/3681010/Nioh_3/?snr=1_7_7_popularcomingsoon_150_15,Sem gênero
Mewgenics,"Feb 10, 2026",Indefinido,https://store.steampowered.com/app/686060/Mewgenics/?snr=1_7_7_popularcomingsoon_150_15,"Tática por Turnos, Roguelite, RPG, Estratégia em Turnos, Combate em Turnos, Humor Ácido, Fofo, Engraçado, História em Quadrinhos, 2D, Terror, Pós-Apocalíptico, Surrealista, Gatos, Você Decide, Não Linear, Cartunizado, Mágica, Ficção Científica, Tático"
Fun with Ragdolls Plus,"Feb 10, 2026",Indefinido,https://store.steampowered.com/app/2270540/Fun_with_Ragdolls_Plus/?snr=1_7_7_popularcomingsoon_150_15,"Ação, Aventura, Simulação, Ação / Aventura, Plataforma, Faça o que Quiser, Plataforma 3D, Tiro em Terceira Pessoa, 3D, Cinematográfico, Colorido, Terceira Pessoa, Tela Dividida, Construção, Comédia, Comovente, Para Toda a Família, Engraçado, Robôs, Jogador x Jogador (PvP)"
Yakuza Kiwami 3 & Dark Ties,"Feb 11, 2026",$59.99,https://store.steampowered.com/app/3937550/Yakuza_Kiwami_3__Dark_Ties/?snr=1_7_7_popularcomingsoon_150_15,"Ação, Aventura, RPG, Ação / Aventura, Porradaria, RPG de Ação, Mundo Aberto, Crime, Combate, Boa Trama, Drama, Artes Marciais, Engraçado, Atmosférico, Violento, Um Jogador, Sombrio, Simulador de Encontros, JRPG, Realístico"
Welcome to Doll Town,"Feb 13, 2026",Indefinido,https://store.steampowered.com/app/3204320/Welcome_to_Doll_Town/?snr=1_7_7_popularcomingsoon_150_15,"Terror, Aventura, Atmosférico, Ação, Anime, Gótico, Tiro em Terceira Pessoa, Ação / Aventura, Exploração, Objetos Ocultos, 3D, Terceira Pessoa, Gatos, Sombrio, Humor Ácido, Demônios, Drama, Comovente, Investigação, Lógica"
High On Life 2,"Feb 13, 2026",Indefinido,https://store.steampowered.com/app/2069250/High_On_Life_2/?snr=1_7_7_popularcomingsoon_150_15,"Ação, Aventura, Um Jogador, Tiro em Primeira Pessoa (FPS), Ação / Aventura, 3D, Tiro, Comédia, Primeira Pessoa, Ficção Científica, Alienígenas, Humor Ácido, Futurista, Espacial, Combate, Controle, Jogador X Ambiente (PvE), Violento"
ASTROBOTANICA,"Feb 16, 2026",Indefinido,https://store.steampowered.com/app/2720920/ASTROBOTANICA/?snr=1_7_7_popularcomingsoon_150_15,"Sobrevivência em Mundo Aberto, Escolha a sua Aventura, Mitologia, Simulador Rural, Natureza, História Alternativa, Ciência, Um Jogador, Quebra-Cabeça, Alienígenas, Primeira Pessoa, Sobrevivência, Mundo Aberto, Exploração, Construção de Bases, Fabricação, Aventura, Faça o que Quiser, Ação, Acesso Antecipado"
Placid Plastic Deck - A Quiet Quest,"Feb 17, 2026",Indefinido,https://store.steampowered.com/app/2510020/Placid_Plastic_Deck__A_Quiet_Quest/?snr=1_7_7_popularcomingsoon_150_15,"Boa Trama, Você Decide, 2D, Engraçado, RPG, Vários Finais, Montagem de Decks, Coleção de Criaturas, 3D, Batalha com Cartas, Cartas, Narração, Fofo, Visão Superior, Protagonista Mulher, Surrealista, Velha-Guarda, Aventura, Relaxante, Atmosférico"
Weeny Wise,"Feb 18, 2026",Indefinido,https://store.steampowered.com/app/2820270/Weeny_Wise/?snr=1_7_7_popularcomingsoon_150_15,"Aventura, Cooperativo, Plataforma com Quebra-Cabeça, Tela Dividida, Atmosférico, Campanha Cooperativa, Cooperativo Local, Boa Trama, Cooperativo On-line, Fantasia, Exploração, Multijogador, Multijogador Local, Enredo Rico, Plataforma, Protagonista Mulher, Furtivo, Mágica, 2,5D, Estilizado"
SealChain: Call of Blood,"Feb 20, 2026",Indefinido,https://store.steampowered.com/app/2652600/SealChain_Call_of_Blood/?snr=1_7_7_popularcomingsoon_150_15,"Montagem de Decks Roguelike, Roguelike, Lovecraftiano, RPG, Gerenciamento de Inventário, Chuva de Balas, Personalização de Armas, Porradaria, Roguelike de Ação, Um Jogador, Mod, Montagem de Decks, Mandando Bala, Ação, Roguelite, Gráficos Pixelados, Indie, Visão Superior, Alta Rejogabilidade, Terror"
Tides of Tomorrow 🌊,"Feb 24, 2026",Indefinido,https://store.steampowered.com/app/2678080/Tides_of_Tomorrow/?snr=1_7_7_popularcomingsoon_150_15,"Multijogador Assíncrono, Escolha a sua Aventura, Exploração, Ação / Aventura, Pós-Apocalíptico, Boa Trama, Narração, Você Decide, Vários Finais, Conversas, Colorido, Distópico, Navegação, Aventura, Multijogador, Um Jogador, Naval, Primeira Pessoa, 3D, Estilizado"
Resident Evil Requiem,"Feb 27, 2026",$69.99,https://store.steampowered.com/app/3764200/Resident_Evil_Requiem/?snr=1_7_7_popularcomingsoon_150_15,Sem gênero
Harbor,"Feb 27, 2026",Indefinido,https://store.steampowered.com/app/2714930/Harbor/?snr=1_7_7_popularcomingsoon_150_15,"Acesso Antecipado, Construção, Pós-Apocalíptico, Jogador x Jogador (PvP), Sobrevivência, Sobrevivência em Mundo Aberto, Tiro, Mundo Aberto, Multijogador, Primeira Pessoa, Exploração, Tiro em Primeira Pessoa (FPS), Tática em Tempo Real, Direção, Ação / Aventura, Ação, Realístico, Atmosférico, Aventura, Objetos Ocultos"
Tomboy Adventure 2,February 2026,Indefinido,https://store.steampowered.com/app/2896630/Tomboy_Adventure_2/?snr=1_7_7_popularcomingsoon_150_15,"Fofo, Anime, Comédia, Relaxante, Romance, Personalização de Personagem, RV, Casual, Um Jogador, Romance Visual, Primeira Pessoa, Simulador de Encontros, Objetos Ocultos, Simulador de Caminhada, Exploração, Conversas, Engraçado, Atmosférico, 3D, Aventura"
Seclusa,February 2026,Indefinido,https://store.steampowered.com/app/2116610/Seclusa/?snr=1_7_7_popularcomingsoon_150_15,"Relaxante, Aconchegante, Casual, Faça o que Quiser, Apontar e Clicar, Natureza, Colete Tudo, Atmosférico, Simulador de Emprego, Ambiente, Simulação, Gatos, Minijogos, Cartas, Para Toda a Família, Não Linear, Estilizado, Edição de Fotos, Um Jogador, 3D"
Island of Hearts,February 2026,Indefinido,https://store.steampowered.com/app/3794770/Island_of_Hearts/?snr=1_7_7_popularcomingsoon_150_15,"Simulação, Simulador de Encontros, RPG, Simulador Imersivo, Drama, Romance Visual, Comovente, Romance, Vários Finais, Boa Trama, Aventura, FMV, Casual, Eventos Rápidos, RPG de Estratégia, Você Decide, Fofo, Surrealista, Estratégia, Mistério"
The Legend of Khiimori,"Mar 3, 2026",Indefinido,https://store.steampowered.com/app/2697000/The_Legend_of_Khiimori/?snr=1_7_7_popularcomingsoon_150_15,"Acesso Antecipado, Histórico, Cavalos, Exploração, Sobrevivência, Natureza, Mundo Aberto, Mitologia, Simulação, Simulador de Vida Real, Aventura, Protagonista Mulher, Fofo, Transportes, Realístico, 3D, Terceira Pessoa, Um Jogador, Controle, Relaxante"
Deliria,"Mar 5, 2026",Indefinido,https://store.steampowered.com/app/3725650/Deliria/?snr=1_7_7_popularcomingsoon_150_16,"Ação, Aventura, RPG, RPG de Ação, Ação / Aventura, Faça o que Quiser, Tiro, Chuva de Balas, Escolha a sua Aventura, Exploração, Hack and Slash, Soulslike, Tiro em Terceira Pessoa, 3D, Cinematográfico, Colorido, Realístico, Terceira Pessoa, Construção, Fabricação"
Age of Barbarians Chronicles,"Mar 5, 2026",Indefinido,https://store.steampowered.com/app/1753500/Age_of_Barbarians_Chronicles/?snr=1_7_7_popularcomingsoon_150_16,"Ação, Aventura, RPG, Luta 2D, RPG de Ação, Porradaria, Explorador de Calabouços, 2,5D, Isométrico, Anos 80, Atmosférico, Fantasia, Velha-Guarda, Espada, Hack and Slash, Combate, Protagonista Mulher, Mundo Aberto, Cooperativo, Cooperativo Local"
Monster Hunter Stories 3: Twisted Reflection,"Mar 13, 2026",$69.99,https://store.steampowered.com/app/2852190/Monster_Hunter_Stories_3_Twisted_Reflection/?snr=1_7_7_popularcomingsoon_150_16,"RPG, JRPG, Coleção de Criaturas, Exploração, Cartunizado, Aventura, Personalização de Personagem, Dragões"
Altiros,"Mar 15, 2026",Free,https://store.steampowered.com/app/744200/Altiros/?snr=1_7_7_popularcomingsoon_150_16,"Faça o que Quiser, Construção de Bases, Voxel, Fabricação, Ação / Aventura, LGBTQIA+, Mundo Aberto, Construção, Casual, Fofo, Terceira Pessoa, Exploração, Engraçado, Personalização de Personagem, Anime, Colorido, Para Toda a Família, Sobrevivência, Ação, Aventura"
DYNASTY WARRIORS 3: Complete Edition Remastered,"Mar 19, 2026",Indefinido,https://store.steampowered.com/app/3841510/DYNASTY_WARRIORS_3_Complete_Edition_Remastered/?snr=1_7_7_popularcomingsoon_150_16,"Luta Espetacular, RPG, Estratégia, Hack and Slash, Jogo de Guerra, Artes Marciais, RPG de Ação, Ação, 3D, Terceira Pessoa, Histórico, Espada, Controle, Vários Finais, Boa Trama, Tático, Guerra, Cinematográfico, Um Jogador, Musou"
MOUSE: P.I. For Hire,"Mar 19, 2026",Indefinido,https://store.steampowered.com/app/2416450/MOUSE_PI_For_Hire/?snr=1_7_7_popularcomingsoon_150_16,"Ação, Cartunizado, Tiro em Primeira Pessoa (FPS), Tiro de Tiozão, Tiro, Primeira Pessoa, Desenhado à Mão, Velha-Guarda, Retrô, Indie, Noir, Um Jogador, Combate, Boa Trama, Estilizado, Violência Detalhada, Violento, Desenho Animado, Sangue, Multijogador"
Crimson Desert,"Mar 19, 2026",$69.99,https://store.steampowered.com/app/3321460/Crimson_Desert/?snr=1_7_7_popularcomingsoon_150_16,Sem gênero
COPA CITY,"Mar 26, 2026",Indefinido,https://store.steampowered.com/app/2210520/COPA_CITY/?snr=1_7_7_popularcomingsoon_150_16,"3D, Estratégia, Futebol, Esportes, Simulação, Grande Estratégia, Colorido, Tática em Tempo Real, Simulador Imersivo, Você Decide, Para Toda a Família, Gerenciamento, Atmosférico, Construção, Gerenciamento de Recursos, Gerenciamento de Inventário, Construção de Cidades, Economia, Capitalismo, Gerenciamento de Tempo"
007 First Light,"Mar 27, 2026",$69.99,https://store.steampowered.com/app/3768760/007_First_Light/?snr=1_7_7_popularcomingsoon_150_16,"Um Jogador, Ação, Aventura, Ação / Aventura, 3D, Tiro em Terceira Pessoa, Furtivo, Terceira Pessoa, Atmosférico, Cinematográfico, Boa Trama, Exploração, Direção, Controle, Combate, Conversas, Tiro, Simulador Imersivo, Realístico, Enredo Rico"
Bargan's Treasure,Q1 2026,Indefinido,https://store.steampowered.com/app/3133210/Bargans_Treasure/?snr=1_7_7_popularcomingsoon_150_16,"Aventura, Quebra-Cabeça, Exploração, 3D, Terceira Pessoa, Mistério, Natureza, Narração, Indie, Sobrenatural, Um Jogador"
Deep Pixel Melancholy,Q1 2026,Indefinido,https://store.steampowered.com/app/3694190/Deep_Pixel_Melancholy/?snr=1_7_7_popularcomingsoon_150_16,"Romance Visual, Você Decide, Escolha a sua Aventura, Boa Trama, Gráficos Pixelados, Enredo Rico, 2D, Atmosférico, Psicológico, Comovente, Ficção Interativa, Ficção Científica, Viagem no Tempo, Vários Finais, Narração, Não Linear, Objetos Ocultos, Relaxante, Casual, Simulador de Emprego"
My Axion Shop,Q1 2026,Indefinido,https://store.steampowered.com/app/3734580/My_Axion_Shop/?snr=1_7_7_popularcomingsoon_150_16,"Simulação, Ação, Simulador de Emprego, Colete Tudo, Saques, Casual, Simulador Imersivo, Gerenciamento de Lojas, Gerenciamento de Tempo, Gerenciamento, Simulador de Vida Real, Economia, Estilizado, Capitalismo, Relaxante, Fofo, Um Jogador, 3D, Primeira Pessoa, Montagem de Decks"
Comatose,Q1 2026,Indefinido,https://store.steampowered.com/app/3301370/Comatose/?snr=1_7_7_popularcomingsoon_150_16,"Aventura, Terror Psicológico, Ação, Terror de Sobrevivência, Terror, Gerenciamento de Recursos, Tiro, Tiro em Primeira Pessoa (FPS), Primeira Pessoa, Protagonista Mulher, Violento, Retrô, Velha-Guarda, Boa Trama, Vários Finais, Um Jogador"
Vital Shell,Q1 2026,Indefinido,https://store.steampowered.com/app/3741860/Vital_Shell/?snr=1_7_7_popularcomingsoon_150_16,"Mechas, RPG, Roguelike de Ação, Roguelite, Chuva de Balas, SHMUP com Visão Superior, Tiro em Arena, Ação, Visão Superior, Jogador X Ambiente (PvE), Arcade, Roguelike, 3D, Estilizado, Sombrio, Combate, Um Jogador, Controle, Atmosférico, Pontos, Pontos, Pontos!"
CAPTURED 2,Q1 2026,Indefinido,https://store.steampowered.com/app/3390880/CAPTURED_2/?snr=1_7_7_popularcomingsoon_150_16,"Ação, Ação / Aventura, Quebra-Cabeça, Exploração, Objetos Ocultos, Simulador Imersivo, Primeira Pessoa, Realístico, Anos 90, Atmosférico, Terror, Mistério, Psicológico, Terror Psicológico, Surrealista, Terror de Sobrevivência, Geração Procedural, Um Jogador, Fuja da Sala"
Nomori,Q1 2026,Indefinido,https://store.steampowered.com/app/2932680/Nomori/?snr=1_7_7_popularcomingsoon_150_16,"Manipulação de Tempo, Do Bem, Plataforma com Quebra-Cabeça, Surrealista, Física, Fofo, Exploração, Quebra-Cabeça, Relaxante, Terceira Pessoa, Para Toda a Família, Colorido, Atmosférico, Protagonista Mulher, Natureza, Não Linear, Aventura, Boa Trama, Um Jogador, Estilizado"
Lovish,Q1 2026,Indefinido,https://store.steampowered.com/app/2959010/Lovish/?snr=1_7_7_popularcomingsoon_150_16,"Aventura, Plataforma de Precisão, Plataforma com Quebra-Cabeça, Plataforma 2D, Plataforma, Ação / Aventura, Combate, 2D, Fofo, Paródia, Engraçado, Ação, Gráficos Pixelados, Anime, Cartunizado, Fantasia, Comédia, Indie, Retrô, Um Jogador"
Bosslife Office Manager,Q1 2026,Indefinido,https://store.steampowered.com/app/3202250/Bosslife_Office_Manager/?snr=1_7_7_popularcomingsoon_150_16,"Gerenciamento, Economia, Desenvolvimento de Jogos, Simulação, Casual, Fabricação, Visão Superior, Um Jogador, 3D, Construção, Engraçado, Fofo, Ação, Simulador de Vida Real, Simulador Imersivo, Tiro em Terceira Pessoa, Isométrico, Colorido, Inteligência Artificial, Gerenciamento de Lojas"
Dress the Duel,Q1 2026,Indefinido,https://store.steampowered.com/app/3227040/Dress_the_Duel/?snr=1_7_7_popularcomingsoon_150_16,"Montagem de Decks Roguelike, Estratégia, Roguelike, Protagonista Mulher, 2D, Montagem de Decks, Batalha com Cartas, Fantasia, Você Decide, Um Jogador, Cartas"
Football Story,Q1 2026,Indefinido,https://store.steampowered.com/app/757550/Football_Story/?snr=1_7_7_popularcomingsoon_150_16,"RPG, Gráficos Pixelados, Futebol, Personalização de Personagem, Exploração, Engraçado, Esportes, CRPG, Jogador X Ambiente (PvE), Escolha a sua Aventura, Boa Trama, Simulador de Vida Real, Atmosférico, Enredo Rico, Baseado em Equipes, Aventura, Casual, Simulação, 2D, Controle"
Endless Tactics,Q1 2026,Indefinido,https://store.steampowered.com/app/2873070/Endless_Tactics/?snr=1_7_7_popularcomingsoon_150_16,"Mechas, Jogo de Guerra, Roguelite, Saques, Alta Rejogabilidade, Estratégia, Mineração, Gráficos Pixelados, Tático, Um Jogador, Estratégia em Turnos, Tática por Turnos, RPG Tático, Guerra, 2D, Sobrevivência, Geração Procedural, Ficção Científica, Combate em Turnos, Roguelike"
Mama's Sleeping Angels,Q1 2026,Indefinido,https://store.steampowered.com/app/2918310/Mamas_Sleeping_Angels/?snr=1_7_7_popularcomingsoon_150_16,"Terror, Multijogador, Geração Procedural, Aventura, Exploração, Você Decide, Sobrenatural, Protagonista Mulher, Primeira Pessoa, Surrealista, Comédia, Plataforma, Estilizado, Sombrio, Baseado em Equipes, Demônios, Mágica, Retrô, Um Jogador, Furtivo"
LOVE ETERNAL,Q1 2026,Indefinido,https://store.steampowered.com/app/3010610/LOVE_ETERNAL/?snr=1_7_7_popularcomingsoon_150_16,"Plataforma de Precisão, Protagonista Mulher, Atmosférico, Sombrio, Boa Trama, Gráficos Pixelados, Plataforma, Cinematográfico, Terror, Aventura, Surrealista, Plataforma com Quebra-Cabeça, Plataforma 2D, Um Jogador, 2D, Ação, Terror Psicológico, Mistério, Retrô, Psicodélico"
The Remake of the End of the Greatest RPG of All Time,Q1 2026,Indefinido,https://store.steampowered.com/app/2809660/The_Remake_of_the_End_of_the_Greatest_RPG_of_All_Time/?snr=1_7_7_popularcomingsoon_150_16,"Aventura, Ficção Interativa, JRPG, Plataforma 3D, Objetos Ocultos, RPG Tático, 3D, Colorido, Gráficos Pixelados, Anos 90, Atmosférico, Fantasia, Investigação, Retrô, Combate, FMV, Linear, Boa Trama, Combate em Turnos, Um Jogador"
FUR Squadron Phoenix,Q1 2026,Indefinido,https://store.steampowered.com/app/2674650/FUR_Squadron_Phoenix/?snr=1_7_7_popularcomingsoon_150_16,"Ação, Roguelike, Arcade, Tiro, Mandando Bala, Voo, Tiro sobre Trilhos, 3D, Retrô, Boa Trama, Jogador X Ambiente (PvE), Linear, Controle, Combate com Veículos, Roguelite, Um Jogador, Colorido, Estilizado, Anos 90, Ficção Científica"
RoadOut,Q1 2026,Indefinido,https://store.steampowered.com/app/1829270/RoadOut/?snr=1_7_7_popularcomingsoon_150_16,"Um Jogador, Saques, Exploração, 2,5D, Corrida com Combate, Explorador de Calabouços, Corrida, Vários Finais, Tiro, RPG de Ação, Ação / Aventura, Personalização de Personagem, Protagonista Mulher, RPG, Visão Superior, Pós-Apocalíptico, Cyberpunk, Combate com Veículos, Ação, Gráficos Pixelados"
EXONAUTIS,Q1 2026,Indefinido,https://store.steampowered.com/app/3474620/EXONAUTIS/?snr=1_7_7_popularcomingsoon_150_16,"Acesso Antecipado, Gerenciamento de Recursos, Mundo Aberto, Ficção Científica, Alienígenas, Primeira Pessoa, Simulador Imersivo, 3D, Um Jogador, Colorido, Estilizado, Exploração, Faça o que Quiser, Aventura, Atmosférico, Sobrevivência em Mundo Aberto, Gerenciamento de Inventário, Sobrevivência, Terror, Subaquático"
Kijutsu Rider,Q1 2026,Indefinido,https://store.steampowered.com/app/3474960/Kijutsu_Rider/?snr=1_7_7_popularcomingsoon_150_16,"Ação, Ação / Aventura, Hack and Slash, Luta Espetacular, Anime, Terceira Pessoa, Aventura, Super-Heróis, Jogo de Ação Focado em Personagem, 3D, Futurista, Pós-Apocalíptico, Robôs, Ficção Científica, Combate, Controle, Jogador X Ambiente (PvE), Um Jogador"
仅你一人,Q1 2026,Indefinido,https://store.steampowered.com/app/3604510/_/?snr=1_7_7_popularcomingsoon_150_16,"CRPG, Clique e Clique, Ficção Interativa, Jogo de Palavras, Romance Visual, RPG, Simulador de Encontros, Protagonista Mulher, 2D, Fofo, LGBTQIA+, Romance, Boa Trama, Casual, Otome, Anime, Drama, Comovente, Sátira, Um Jogador"
