title,release_date,price,game_url,genres
Winemaker Simulator,Q3 2026,Indefinido,https://store.steampowered.com/app/3875670/Winemaker_Simulator/?snr=1_7_7_popularcomingsoon_150_8,"Simulação, Simulador Rural, Medieval, Realístico, Simulador de Vida Real, Relaxante, Agricultura, Fabricação, 3D, Colorido, Cinematográfico, Atmosférico, Natureza, Mundo Aberto, Acesso Antecipado, Indie, Primeira Pessoa, Controle, Um Jogador, Física"
Nothing To Declare,Q3 2026,Indefinido,https://store.steampowered.com/app/3894850/Nothing_To_Declare/?snr=1_7_7_popularcomingsoon_150_8,"Simulação, Casual, Simulador de Emprego, Voo, Do Bem, Fofo, Eventos Rápidos, Relaxante, Colorido, Objetos Ocultos, Para Toda a Família, Simulador Imersivo, Aconchegante, Simulador de Vida Real, Indie, Estratégia, Engraçado, Um Jogador, Apontar e Clicar, Você Decide"
Valken,Q3 2026,Indefinido,https://store.steampowered.com/app/4619040/Valken/?snr=1_7_7_popularcomingsoon_150_8,"Ação, Aventura, Ação / Aventura, Tiro, Tiro em Primeira Pessoa (FPS), Jogo de Guerra, Simulador Imersivo, Tiro em Terceira Pessoa, Primeira Pessoa, 3D, Terceira Pessoa, Realístico, Investigação, Violência Detalhada, Violento, Guerra, Terror, Militar, Tático, Zumbis"
Witch Shop Simulator,Q3 2026,Free,https://store.steampowered.com/app/4660170/Witch_Shop_Simulator/?snr=1_7_7_popularcomingsoon_150_8,"Simulação, Gerenciamento de Lojas, Casual, Fabricação, Física, Gerenciamento, 3D, Primeira Pessoa, Engraçado, Colorido, Fantasia, Gratuito para Jogar, Indie, Mágica, Cooperativo, Cooperativo On-line, Um Jogador, Culinária, Aconchegante"
Archon Soul,Q3 2026,Indefinido,https://store.steampowered.com/app/4252700/Archon_Soul/?snr=1_7_7_popularcomingsoon_150_8,"Montagem de Decks Roguelike, Dados, Batalha com Cartas, Em Turnos, Estratégia, Fantasia, Mágica, Montagem de Decks, Tático, Você Decide, Alta Rejogabilidade, Roguelite, Cartas, Tática por Turnos, Roguelike, Fantasia Sombria, 2D, Jogador X Ambiente (PvE), Um Jogador"
The Alighieri Circle: Dante's Bloodline,Q3 2026,Indefinido,https://store.steampowered.com/app/4262620/The_Alighieri_Circle_Dantes_Bloodline/?snr=1_7_7_popularcomingsoon_150_8,"Aventura, Boa Trama, Atmosférico, Lovecraftiano, Terror Psicológico, Cultos, Um Jogador, Exploração, Sombrio, Primeira Pessoa, Mistério, Investigação, Thriller, Psicológico, Linear, Realístico, Simulador de Caminhada, Cinematográfico, Conspiração, Terror"
"Your Painting, Sir",3º trimestre de 2026,Indefinido,https://store.steampowered.com/app/4117830/Your_Painting_Sir/?snr=1_7_7_popularcomingsoon_150_9,"Simulação, Quebra-Cabeça, Comédia, Relaxante, Apontar e Clicar, Design e Ilustração, Gráficos Pixelados, Compatível com Mods, Engraçado, Indie, Casual, Cartunizado, Um Jogador, 2D, Investigação, Tutorial, Moderno, Memes, Linear"
Some of You May Die,3º trimestre de 2026,Indefinido,https://store.steampowered.com/app/4124920/Some_of_You_May_Die/?snr=1_7_7_popularcomingsoon_150_9,"Estratégia, Batalha Automática, Jogador x Jogador (PvP), Roguelike, Multijogador, Gráficos Pixelados, Fantasia, Mágica, Violência Detalhada, Violento, Um Jogador"
BLACKWOOD,3º trimestre de 2026,Indefinido,https://store.steampowered.com/app/3639070/BLACKWOOD/?snr=1_7_7_popularcomingsoon_150_9,"Ação, Luta 3D, Ação / Aventura, Porradaria, Ficção Interativa, Tiro, Colete Tudo, Exploração, Mandando Bala, Tiro em Terceira Pessoa, 3D, Cinematográfico, Realístico, Terceira Pessoa, Assassinos, Atmosférico, Capitalismo, Comédia, Destruição, Economia"
Replay Value: Second Hand Games,3º trimestre de 2026,Indefinido,https://store.steampowered.com/app/3683940/Replay_Value_Second_Hand_Games/?snr=1_7_7_popularcomingsoon_150_9,"Simulador de Emprego, Troca, Gerenciamento de Lojas, Organização, Do Bem, Aconchegante, Casual, Jogos, Simulador de Passatempo, Simulação, Relaxante, Economia, Colorido, Nostalgia, Gerenciamento de Inventário, Alta Rejogabilidade, Retrô, Para Toda a Família, Estratégia, Simulador Imersivo"
Deep Pixel Melancholy,3º trimestre de 2026,Indefinido,https://store.steampowered.com/app/3694190/Deep_Pixel_Melancholy/?snr=1_7_7_popularcomingsoon_150_9,"Romance Visual, Você Decide, Escolha a sua Aventura, Boa Trama, Gráficos Pixelados, Enredo Rico, 2D, Atmosférico, Psicológico, Comovente, Ficção Interativa, Ficção Científica, Viagem no Tempo, Vários Finais, Não Linear, Objetos Ocultos, Relaxante, Casual, Simulador de Emprego, RPG"
The Devil's Due,3º trimestre de 2026,Indefinido,https://store.steampowered.com/app/3699850/The_Devils_Due/?snr=1_7_7_popularcomingsoon_150_9,"Montagem de Decks Roguelike, Pôquer, Humor Pesado, Roguelite, Batalha com Cartas, Jogo de Cartas, Cartas, Roguelike, Estratégia, Tática por Turnos, 2,5D, Desenhado à Mão, Demônios, Um Jogador, Indie, Velho Oeste"
Título não disponível,Data não informada,Indefinido,https://store.steampowered.com/app/3725830/Citrus_Summer/?snr=1_7_7_popularcomingsoon_150_9,Sem gênero
Bruisers 2D Boxing,3º trimestre de 2026,Indefinido,https://store.steampowered.com/app/3740090/Bruisers_2D_Boxing/?snr=1_7_7_popularcomingsoon_150_9,"Acesso Antecipado, RPG, Boxe, Esportes, 2D, Gráficos Pixelados, Luta 2D, Crime, Jogos de Azar, Controle, Retrô, Arcade, Sombrio, Gerenciamento, Personalização de Personagem, Escolha a sua Aventura, Realístico, Combate, Cinematográfico, Você Decide"
SpiritVale,3º trimestre de 2026,,https://store.steampowered.com/app/3767850/SpiritVale/?snr=1_7_7_popularcomingsoon_150_9,"Acesso Antecipado, Multijogador Massivo, RPG de Ação, Baseado em Classes, Fantasia, Mágica, Cooperativo, Fabricação, Personalização de Personagem, Jogador X Ambiente (PvE), Cartunizado, Fofo, Exploração, RPG, Ação / Aventura, Explorador de Calabouços, Cooperativo On-line, Saques, Indie, Combate"
DungeonBox,3º trimestre de 2026,Indefinido,https://store.steampowered.com/app/3788110/DungeonBox/?snr=1_7_7_popularcomingsoon_150_9,"Casual, Escolha a sua Aventura, 2D, Comédia, Você Decide, Multijogador, Cooperativo On-line, Reúna a Galera, Engraçado, Em Grupos, RPG de Grupos, Indie, Jogador x Jogador (PvP), Fantasia, Aventura, RPG, Jogo de Mesa"
Tiny Delivery,3º trimestre de 2026,Indefinido,https://store.steampowered.com/app/3812830/Tiny_Delivery/?snr=1_7_7_popularcomingsoon_150_9,"Aventura, Exploração, Indie, Quebra-Cabeça, Fofo, Comovente, Relaxante, Atmosférico, Estilizado, Física, 3D, Patinação (e Skate), Linear, Visão Superior, Isométrico, Natureza, Um Jogador, Casual, Simulador de Caminhada, Plataforma 3D"
Flipping is Hard,setembro de 2026,Indefinido,https://store.steampowered.com/app/3826670/Flipping_is_Hard/?snr=1_7_7_popularcomingsoon_150_9,"Difícil, Plataforma de Precisão, Cooperativo On-line, Física, Terror Psicológico, Boa Trama, Soulslike, Plataforma 3D, Alta Rejogabilidade, Ação, Plataforma, Um Jogador, Aventura, Parkour, Multijogador, Filosófico, Terceira Pessoa, Engraçado, Humor Ácido, Simulação"
Antivirus Survivors 2003 Professional,3º trimestre de 2026,Indefinido,https://store.steampowered.com/app/3832490/Antivirus_Survivors_2003_Professional/?snr=1_7_7_popularcomingsoon_150_9,"Paraíso de Balas, Ação, Abstrato, Roguelike de Ação, Explorador de Calabouços, Roguelite, Arcade, 2D, Pontos, Pontos, Pontos!, Inferno de Balas, Um Jogador, Gráficos Pixelados, Combate, Jogador X Ambiente (PvE), Anos 90, Casual, Visão Superior, RPG, Controle, Retrô"
PLATONICA SPACE,3º trimestre de 2026,Indefinido,https://store.steampowered.com/app/3846480/PLATONICA_SPACE/?snr=1_7_7_popularcomingsoon_150_9,"Aventura, Atmosférico, 3D, Objetos Ocultos, Protagonista Mulher, Mistério, Indie, Simulador de Caminhada, Um Jogador"
War of Banners,3º trimestre de 2026,Indefinido,https://store.steampowered.com/app/3869940/War_of_Banners/?snr=1_7_7_popularcomingsoon_150_9,"Estratégia, Tática por Turnos, Mundo Aberto, Medieval, Combate em Turnos, Tático, RPG, Guerra, Personalização de Personagem, Faça o que Quiser, Simulação, Morte Permanente, Compatível com Mods, Aventura, Visão Superior, Cavalos, Indie, RPG de Estratégia, Um Jogador, RPG Tático"
Winemaker Simulator,3º trimestre de 2026,Indefinido,https://store.steampowered.com/app/3875670/Winemaker_Simulator/?snr=1_7_7_popularcomingsoon_150_9,"Simulação, Simulador Rural, Medieval, Realístico, Simulador de Vida Real, Relaxante, Agricultura, Fabricação, 3D, Colorido, Cinematográfico, Atmosférico, Natureza, Mundo Aberto, Acesso Antecipado, Indie, Primeira Pessoa, Controle, Um Jogador, Física"
Nothing To Declare,3º trimestre de 2026,Indefinido,https://store.steampowered.com/app/3894850/Nothing_To_Declare/?snr=1_7_7_popularcomingsoon_150_9,"Simulação, Casual, Simulador de Emprego, Voo, Do Bem, Fofo, Eventos Rápidos, Relaxante, Colorido, Objetos Ocultos, Para Toda a Família, Simulador Imersivo, Aconchegante, Simulador de Vida Real, Indie, Estratégia, Engraçado, Um Jogador, Apontar e Clicar, Você Decide"
Bones and Coins,Q3 2026,Indefinido,https://store.steampowered.com/app/4134650/Bones_and_Coins/?snr=1_7_7_popularcomingsoon_150_9,"Incremental, Batalha Automática, Explorador de Calabouços, RPG de Grupos, Saques, Progressão Ociosa, Estratégia, RPG, Montagem de Decks, RPG de Estratégia, Medieval, Fantasia Sombria, Hack and Slash, Casual, Simulação, Troca, Gerenciamento de Recursos, Combate, Só Mouse, Ação"
Tsumamigui 3,Q3 2026,Indefinido,https://store.steampowered.com/app/4142530/Tsumamigui_3/?snr=1_7_7_popularcomingsoon_150_9,"Aventura, Apontar e Clicar, Exploração, Anime, Romance, Vários Finais, Um Jogador"
Finding Polka,Q3 2026,Indefinido,https://store.steampowered.com/app/4161140/Finding_Polka/?snr=1_7_7_popularcomingsoon_150_9,"Do Bem, Aconchegante, Relaxante, Exploração, Objetos Ocultos, Para Toda a Família, Atmosférico, Desenhado à Mão, Cachorros, Aventura, Simulador de Caminhada, Fofo, Isométrico, Engraçado, Protagonista Mulher, Um Jogador, Casual, Cartunizado, Desenho Animado, Indie"
Survival Log,Q3 2026,Indefinido,https://store.steampowered.com/app/4164790/Survival_Log/?snr=1_7_7_popularcomingsoon_150_9,"Simulação, Sobrevivência, Gerenciamento de Recursos, Zumbis, Construção de Bases, Roguelite, Gerenciamento de Inventário, Gerenciamento de Tempo, Simulador de Vida Real, Pós-Apocalíptico, Estratégia, Boa Trama, Fabricação, Exploração, Simulador de Epidemias, Atmosférico, Aventura, Um Jogador, RPG, 2,5D"
Crimson Banner: War of Liberation,Q3 2026,Indefinido,https://store.steampowered.com/app/4168190/Crimson_Banner_War_of_Liberation/?snr=1_7_7_popularcomingsoon_150_9,"Tática por Turnos, Jogo de Guerra, Segunda Guerra Mundial, Militar, Guerra Fria, Guerra, Estratégia em Turnos, Jogo de Mesa, Jogo de Tabuleiro, Grande Estratégia, Estratégia, 2D, Histórico, Simulação, Tático, Grade Hexagonal, Um Jogador, Acesso Antecipado"
CELESTAY Craft&Slowlife,Q3 2026,Indefinido,https://store.steampowered.com/app/4183770/CELESTAY_CraftSlowlife/?snr=1_7_7_popularcomingsoon_150_9,"Casual, Utilitários, Progressão Ociosa, 2D, Fofo, Gráficos Pixelados, Pós-Apocalíptico, Relaxante, Retrô, Atmosférico, Indie, Construção, Linear, Boa Trama, Gerenciamento de Recursos, Um Jogador"
Ultrapool,Q3 2026,Indefinido,https://store.steampowered.com/app/4195110/Ultrapool/?snr=1_7_7_popularcomingsoon_150_9,"Roguelite, Bilhar, Arcade, Roguelike, Estratégia, 2D, História em Quadrinhos, Fofo, Montagem de Decks, Casual, Colorido, Estilizado, Física, Gerenciamento de Inventário, Um Jogador, Indie, Anime, Cartunizado, Visão Superior, Velha-Guarda"
IGNOBLE,Q3 2026,Indefinido,https://store.steampowered.com/app/4216180/IGNOBLE/?snr=1_7_7_popularcomingsoon_150_9,"Roguelite, Incremental, Indie, Ação, Simulação, Aventura, Estratégia, Violência Detalhada, Casual, Progressão Ociosa, Um Jogador, Porradaria"
Crusader Kings III: By God Alone,Coming soon,$43.99,https://store.steampowered.com/app/4232900/Crusader_Kings_III_By_God_Alone/?snr=1_7_7_popularcomingsoon_150_9,"Estratégia, RPG, Simulação"
Path of Idle: Old Gods Rising,Q3 2026,Indefinido,https://store.steampowered.com/app/4243990/Path_of_Idle_Old_Gods_Rising/?snr=1_7_7_popularcomingsoon_150_9,"RPG, Estratégia, Progressão Ociosa, Aventura, Casual, Saques, Indie, 2D, Desenho Animado, Combate, Um Jogador, Incremental, Desenhado à Mão, Fantasia Sombria, Batalha Automática, RPG de Estratégia, Automação, Gerenciamento de Recursos, Hack and Slash"
Dungeon Brawls,Q3 2026,Indefinido,https://store.steampowered.com/app/4246640/Dungeon_Brawls/?snr=1_7_7_popularcomingsoon_150_9,"Aventura, Ação, RPG, Ação / Aventura, Roguelike, Roguelike de Ação, Cartunizado, Fantasia, Protagonista Mulher, Boa Trama, Um Jogador, Multijogador"
Echoes of Mora,Q3 2026,Indefinido,https://store.steampowered.com/app/3129050/Echoes_of_Mora/?snr=1_7_7_popularcomingsoon_150_9,"Boa Trama, Subaquático, Objetos Ocultos, Aconchegante, Exploração, Comovente, Mistério, RV, Aventura, Quebra-Cabeça, Atmosférico, Ficção Interativa, Vários Finais, Protagonista Mulher, Estilizado, Colorido, Viagem no Tempo, Um Jogador, Primeira Pessoa, 3D"
Pocket Legend : Inventory Roguelike Deckbuilder,Q3 2026,Indefinido,https://store.steampowered.com/app/3129790/Pocket_Legend__Inventory_Roguelike_Deckbuilder/?snr=1_7_7_popularcomingsoon_150_9,"Gerenciamento de Inventário, Alta Rejogabilidade, Estratégia em Turnos, Montagem de Decks Roguelike, Estratégia, Batalha com Cartas, Indie, Montagem de Decks, Cartas, Em Turnos, Um Jogador, 2D, Fantasia, Roguelike, Roguelite"
Sagas of Lumin,Q3 2026,Indefinido,https://store.steampowered.com/app/3130220/Sagas_of_Lumin/?snr=1_7_7_popularcomingsoon_150_9,"Acesso Antecipado, Dragões, RPG de Ação, Ação, Aventura, RPG, Ação / Aventura, Coleção de Criaturas, Exploração, Terceira Pessoa, Atmosférico, Sombrio, Fantasia, Mágica, Steampunk, Você Decide, Voo, Cinematográfico, Realístico, Mundo Aberto"
Solaria,Q3 2026,Indefinido,https://store.steampowered.com/app/3130880/Solaria/?snr=1_7_7_popularcomingsoon_150_9,"Sobrevivência em Mundo Aberto, Mundo Aberto, Sobrevivência, Fabricação, Construção, Tiro em Terceira Pessoa, RPG, Um Jogador, Construção de Bases, Personalização de Personagem, Tiro, 3D, Realístico, Terceira Pessoa, Natureza, Jogador X Ambiente (PvE), Ficção Científica, Futurista, Inteligência Artificial, Automação"
My Infamous Dungeon,Q3 2026,Indefinido,https://store.steampowered.com/app/3136320/My_Infamous_Dungeon/?snr=1_7_7_popularcomingsoon_150_9,"Estratégia, Protagonista Vilão, Construção de Bases, Roguelite, Gerenciamento, RPG, Jogo de Divindade, Defesa de Torres, Batalha Automática, Roguelike, Colorido, Isométrico, Comédia, Demônios, Dragões, Fantasia, Gerenciamento de Recursos, Um Jogador, Indie"
Pao Pao,Q3 2026,Indefinido,https://store.steampowered.com/app/3024130/Pao_Pao/?snr=1_7_7_popularcomingsoon_150_9,"Acesso Antecipado, Cooperativo, Mundo Aberto, Simulador Imersivo, Gerenciamento, Culinária, Faça o que Quiser, Exploração, Pesca, Simulador de Vida Real, Reúna a Galera, Personalização de Personagem, Fofo, Aventura, Engraçado, Relaxante, Simulador Rural, Gerenciamento de Tempo, Casual, Gerenciamento de Recursos"
Shutter Story,Q3 2026,Indefinido,https://store.steampowered.com/app/3798860/Shutter_Story/?snr=1_7_7_popularcomingsoon_150_9,"Aventura, Terror, Edição de Fotos, Terror Psicológico, Software, Simulador de Caminhada, Primeira Pessoa, Investigação, Ficção Interativa, Objetos Ocultos, 3D, Estilizado, Surrealista, Sombrio, Demônios, Mistério, Boa Trama, Você Decide, Um Jogador, Vários Finais"
Lootbound,Q3 2026,Indefinido,https://store.steampowered.com/app/3091140/Lootbound/?snr=1_7_7_popularcomingsoon_150_9,"Estratégia, Roguelike, Combate em Turnos, Gerenciamento de Inventário, Gráficos Pixelados, Explorador de Calabouços, Roguelite, RPG, Estratégia em Turnos, Saques, Personalização de Personagem, Em Turnos, RPG de Estratégia, Aventura, Fantasia, Você Decide, Geração Procedural, Um Jogador, Tático, Casual"
Mystical Tactics,Q3 2026,Indefinido,https://store.steampowered.com/app/2850600/Mystical_Tactics/?snr=1_7_7_popularcomingsoon_150_9,"Estratégia, Tática por Turnos, RPG Tático, Roguelike, Estratégia em Turnos, Combate em Turnos, Roguelite, RPG, Gráficos Pixelados, Fantasia, Geração Procedural, Em Turnos, RPG de Estratégia, RPG de Grupos, 2,5D, Alta Rejogabilidade, Grade Hexagonal, Um Jogador, Personalização de Personagem, Tático"
Lost in the Roots,Q3 2026,Indefinido,https://store.steampowered.com/app/2872240/Lost_in_the_Roots/?snr=1_7_7_popularcomingsoon_150_9,"Terror Psicológico, Apontar e Clicar, Boa Trama, Aventura, Atmosférico, Sombrio, Comovente, Câmera Lateral, Colorido, Desenhado à Mão, Investigação, Exploração, 2D, FMV, Cinematográfico, Romance Visual, Cartunizado, Desenho Animado, Ficção Científica, Terceira Pessoa"
Separated,Q3 2026,Indefinido,https://store.steampowered.com/app/2976110/Separated/?snr=1_7_7_popularcomingsoon_150_9,"Cooperativo On-line, Terror, Multijogador, Quebra-Cabeça, Jogador X Ambiente (PvE), Cooperativo, Furtivo, Ação, Sobrenatural, Atmosférico, Sombrio, Thriller, Inteligência Artificial, Não Linear, Indie, Fuja da Sala, Acesso Antecipado, Primeira Pessoa, 3D, Realístico"
RANGER COMMANDO,Q3 2026,Indefinido,https://store.steampowered.com/app/2549980/RANGER_COMMANDO/?snr=1_7_7_popularcomingsoon_150_9,"Violento, SHMUP com Visão Superior, Roguelike de Ação, Tiro em Terceira Pessoa, Tiro, Destruição, Morte Permanente, 3D, Isométrico, Visão Superior, Tático, Furtivo, Ação, Controle, Geração Procedural, Militar, Anos 80, Violência Detalhada, Um Jogador, Indie"
Draco and the Seven Scales,Q3 2026,Indefinido,https://store.steampowered.com/app/2559690/Draco_and_the_Seven_Scales/?snr=1_7_7_popularcomingsoon_150_9,"Exploração, Explorador de Calabouços, Quebra-Cabeça, Navegação, Jogador X Ambiente (PvE), RPG de Ação, 2D, Visão Superior, Controle, Combate Naval, Ação, Gráficos Pixelados, Piratas, Aventura, Retrô, Combate, Um Jogador, Indie, Anime, Minimalista"
Desktop Explorer,Q3 2026,Indefinido,https://store.steampowered.com/app/2527160/Desktop_Explorer/?snr=1_7_7_popularcomingsoon_150_9,"Terror Psicológico, Apontar e Clicar, Anos 90, Quebra-Cabeça, Detetive, Investigação, Simulação, Aventura, Ficção Interativa, Mistério, Baseado em Texto, Exploração, Simulador Imersivo, Gráficos Pixelados, Atmosférico, 2D, Romance Visual, 3D, Colorido, Estilizado"
Alpha Nomos,Q3 2026,Indefinido,https://store.steampowered.com/app/2529960/Alpha_Nomos/?snr=1_7_7_popularcomingsoon_150_9,"Ação, Ritmo, Hack and Slash, Roguelike de Ação, Aventura, Terceira Pessoa, Um Jogador, 3D, Estilizado, Indie, Pós-Apocalíptico, Musical Procedural, Roguelike, Roguelite, Cartunizado, Atmosférico, Música, Fantasia Sombria, Combate, Luta"
Prelude Dark Pain,Q3 2026,Indefinido,https://store.steampowered.com/app/2479090/Prelude_Dark_Pain/?snr=1_7_7_popularcomingsoon_150_9,"Acesso Antecipado, Estratégia em Turnos, Tática por Turnos, RPG Tático, Fantasia Sombria, RPG, Um Jogador, Estratégia, Você Decide, Combate em Turnos, 2D, JRPG, Boa Trama, Fantasia, Isométrico, Medieval, RPG de Estratégia, Em Turnos, Indie, Aventura"
The Chronos Event,Q3 2026,Indefinido,https://store.steampowered.com/app/2477470/The_Chronos_Event/?snr=1_7_7_popularcomingsoon_150_9,"Roguelike de Ação, Ação, Roguelite, Um Jogador, Roguelike, Protagonista Mulher, Tiro, Difícil, Tiro com Saques, Inferno de Balas, Morte Permanente, Alta Rejogabilidade, Tiro em Terceira Pessoa, Atmosférico, Acesso Antecipado, Ritmo Rápido, Manipulação de Tempo, Viagem no Tempo, Terceira Pessoa, Aventura"
Deeper Still,Q3 2026,Indefinido,https://store.steampowered.com/app/2484890/Deeper_Still/?snr=1_7_7_popularcomingsoon_150_9,"Violento, Ação, Violência Detalhada, Surrealista, Simulador Imersivo, Indie, Tiro em Primeira Pessoa (FPS), Terror Psicológico, Psicodélico, Ritmo Rápido, Tiro, Primeira Pessoa, Distópico, Retrô, Pós-Apocalíptico, Trilha Sonora, Gráficos Pixelados, Um Jogador, Capitalismo, Humor Ácido"
isekizima: Ruins and Tails Journey,Q3 2026,Indefinido,https://store.steampowered.com/app/2686820/isekizima_Ruins_and_Tails_Journey/?snr=1_7_7_popularcomingsoon_150_9,"Fofo, Desenhado à Mão, Anime, Plataforma 2D, Gatos, Protagonista Mulher, Boa Trama, Exploração, Ação / Aventura, Aventura, Ação, Plataforma, 2D, Metroidvania, Trilha Sonora, Engraçado, Combate, RPG de Ação, Um Jogador, Mágica"
Soggy Beans,Q3 2026,Indefinido,https://store.steampowered.com/app/2636430/Soggy_Beans/?snr=1_7_7_popularcomingsoon_150_9,"Progressão Ociosa, Coleção de Criaturas, Colete Tudo, Companheiro de Área de Trabalho, Subaquático, Do Bem, Simulação, Relaxante, Fofo, Aconchegante, Natureza, Casual, 2D, Anime, Colorido, Para Toda a Família, Atmosférico, Um Jogador, Indie, Cartunizado"
Flow Of War,Q3 2026,Indefinido,https://store.steampowered.com/app/2637210/Flow_Of_War/?snr=1_7_7_popularcomingsoon_150_9,"Estratégia, Estratégia em Tempo Real com Ação, Estratégia em Tempo Real (RTS), Batalha Automática, Defesa de Torres, Construção de Bases, Automação, Geração Procedural, Medieval, Tática em Tempo Real, Gráficos Pixelados, 2D, Visão Superior, Construção, Simulador Rural, Fantasia Sombria, Demônios, Mágica, Guerra, Mineração"
Emery Hearts,Q3 2026,Indefinido,https://store.steampowered.com/app/2732480/Emery_Hearts/?snr=1_7_7_popularcomingsoon_150_9,"Ação, RPG, RPG de Ação, Aventura, Ação / Aventura, Quebra-Cabeça, JRPG, Exploração, Fantasia, Indie, Um Jogador, Boa Trama, Colorido, 3D, Controle, Soulslike"
Dumbriel: Magnificent Adventure in Hell,Q3 2026,Indefinido,https://store.steampowered.com/app/2500690/Dumbriel_Magnificent_Adventure_in_Hell/?snr=1_7_7_popularcomingsoon_150_10,"Metroidvania, Soulslike, Plataforma, Indie, Difícil, 2D, Aventura, Fabricação, Ação / Aventura, Um Jogador, Exploração, Desenhado à Mão, Combate, Ação, Física, Atmosférico, Fantasia, Comovente, Roguelite, Anime"
Ant Colony: Wild Forest,Q3 2026,Indefinido,https://store.steampowered.com/app/1238190/Ant_Colony_Wild_Forest/?snr=1_7_7_popularcomingsoon_150_10,"Casual, 2D, Estratégia, Isométrico, Economia, Construção, Simulação, Visão Superior, Simulador de Colônias, Construção de Bases, Gerenciamento de Recursos, Construção de Cidades, Coleção de Criaturas, Estratégia em Tempo Real (RTS), Inteligência Artificial, Simulador Imersivo, Subterrâneo, Desenho Animado, 4X, Ação"
Mandate Order,Q3 2026,Indefinido,https://store.steampowered.com/app/1733690/Mandate_Order/?snr=1_7_7_popularcomingsoon_150_10,"Estratégia, Construção de Cidades, Simulação, Indie, Construção, Jogo de Guerra, Histórico, Militar, Construção de Bases, Gerenciamento de Recursos, Estratégia em Tempo Real (RTS), Um Jogador, Gerenciamento, Medieval, Faça o que Quiser, Guerra, Grande Estratégia, 4X, RPG de Estratégia, Simulador Político"
Road Diner Simulator,Q3 2026,Indefinido,https://store.steampowered.com/app/1747470/Road_Diner_Simulator/?snr=1_7_7_popularcomingsoon_150_10,"Casual, Simulação, Arcade, Simulador de Vida Real, Faça o que Quiser, Simulador Imersivo, Gerenciamento de Tempo, 3D, Primeira Pessoa, Atmosférico, Construção, Culinária, Fabricação, Economia, Para Toda a Família, Engraçado, Gerenciamento, Relaxante, Construção de Bases, Você Decide"
Valken,3º trimestre de 2026,Indefinido,https://store.steampowered.com/app/4619040/Valken/?snr=1_7_7_popularcomingsoon_150_10,"Ação, Aventura, Ação / Aventura, Tiro, Tiro em Primeira Pessoa (FPS), Jogo de Guerra, Simulador Imersivo, Tiro em Terceira Pessoa, Primeira Pessoa, 3D, Terceira Pessoa, Realístico, Investigação, Violência Detalhada, Violento, Guerra, Terror, Militar, Tático, Zumbis"
Witch Shop Simulator,3º trimestre de 2026,,https://store.steampowered.com/app/4660170/Witch_Shop_Simulator/?snr=1_7_7_popularcomingsoon_150_10,"Simulação, Gerenciamento de Lojas, Casual, Fabricação, Física, Gerenciamento, 3D, Primeira Pessoa, Engraçado, Colorido, Fantasia, Gratuito para Jogar, Indie, Mágica, Cooperativo, Cooperativo On-line, Um Jogador, Culinária, Aconchegante"
EVE Vanguard,Q3 2026,Indefinido,https://store.steampowered.com/app/1872800/EVE_Vanguard/?snr=1_7_7_popularcomingsoon_150_10,"Ficção Científica, Tiro de Extração, Personalização de Armas, Atmosférico, Fabricação, Saques, Jogador X Ambiente (PvE), Jogador x Jogador (PvP), Personalização de Personagem, Mineração, Tiro, Ação, Multijogador, Cooperativo, Tiro em Primeira Pessoa (FPS), Exploração, Cooperativo On-line, Futurista, 3D, Aventura"
moorestech,Q3 2026,Indefinido,https://store.steampowered.com/app/1958160/moorestech/?snr=1_7_7_popularcomingsoon_150_10,"RPG, Automação, Fofo, Protagonista Mulher, Simulação, Boa Trama, Anime, Mod, Fabricação, Construção, Multijogador, Ficção Científica, Um Jogador, Indie, Estratégia, Futurista, Mundo Aberto, 3D, Cooperativo"
Elation For The Wonder Box 6000,Q3 2026,Indefinido,https://store.steampowered.com/app/2154780/Elation_For_The_Wonder_Box_6000/?snr=1_7_7_popularcomingsoon_150_10,"Primeira Pessoa, Surrealista, Boa Trama, Humor Pesado, Aventura, Retrô, Indie, Ficção Interativa, Anos 90, Rico em Diálogos, Mundo Aberto, Abstrato, Atmosférico, Investigação, Sátira, Capitalismo, Psicodélico, Um Jogador, Desenhado à Mão, Comédia"
LIFTED,Q3 2026,Indefinido,https://store.steampowered.com/app/2184020/LIFTED/?snr=1_7_7_popularcomingsoon_150_10,"Boa Trama, Aventura, Fofo, Engraçado, Cinematográfico, Plataforma, Assalto, Um Jogador, Quebra-Cabeça, Colorido, Ação, 2,5D, Ação / Aventura, Indie, Viagem no Tempo, Plataforma com Quebra-Cabeça, Exploração, Trilha Sonora Boa, Bonito, Aconchegante"
