title,release_date,price,game_url,genres
Altiros,"Mar 15, 2026",Free,https://store.steampowered.com/app/744200/Altiros/?snr=1_7_7_popularcomingsoon_150_21,"Faça o que Quiser, Construção de Bases, Voxel, Fabricação, Ação / Aventura, LGBTQIA+, Mundo Aberto, Construção, Casual, Fofo, Terceira Pessoa, Exploração, Engraçado, Personalização de Personagem, Anime, Colorido, Para Toda a Família, Sobrevivência, Ação, Aventura"
COPA CITY,"Mar 26, 2026",Indefinido,https://store.steampowered.com/app/2210520/COPA_CITY/?snr=1_7_7_popularcomingsoon_150_21,"3D, Estratégia, Futebol, Esportes, Simulação, Grande Estratégia, Colorido, Tática em Tempo Real, Simulador Imersivo, Você Decide, Para Toda a Família, Gerenciamento, Atmosférico, Construção, Gerenciamento de Recursos, Gerenciamento de Inventário, Construção de Cidades, Economia, Capitalismo, Gerenciamento de Tempo"
007 First Light,"Mar 27, 2026",$69.99,https://store.steampowered.com/app/3768760/007_First_Light/?snr=1_7_7_popularcomingsoon_150_21,"Um Jogador, Ação, Aventura, Ação / Aventura, 3D, Tiro em Terceira Pessoa, Terceira Pessoa, Atmosférico, Furtivo, Boa Trama, Cinematográfico, Exploração, Direção, Controle, Combate, Conversas, Tiro, Simulador Imersivo, Realístico, Enredo Rico"
EXONAUTIS,Q1 2026,Indefinido,https://store.steampowered.com/app/3474620/EXONAUTIS/?snr=1_7_7_popularcomingsoon_150_21,"Acesso Antecipado, Gerenciamento de Recursos, Mundo Aberto, Ficção Científica, Alienígenas, Primeira Pessoa, Simulador Imersivo, 3D, Um Jogador, Colorido, Estilizado, Exploração, Faça o que Quiser, Aventura, Atmosférico, Sobrevivência em Mundo Aberto, Gerenciamento de Inventário, Sobrevivência, Terror, Subaquático"
Idlemancer,Q1 2026,Indefinido,https://store.steampowered.com/app/3507960/Idlemancer/?snr=1_7_7_popularcomingsoon_150_21,"Incremental, Simulação, Batalha Automática, Clique e Clique, Multijogador Assíncrono, Jogador x Jogador (PvP), Mágica, RPG de Estratégia, Roguelike, 2D, Montagem de Decks, Gráficos Pixelados, Retrô, Tático, Um Jogador, Cartas, Roguelite, Gerenciamento de Recursos, Fofo, Multijogador"
Golel,Q1 2026,Indefinido,https://store.steampowered.com/app/2577730/Golel/?snr=1_7_7_popularcomingsoon_150_21,"CRPG, Explorador de Calabouços, Em Turnos, Personalização de Personagem, RPG, 3D, Primeira Pessoa, RV, Boa Trama, Combate em Turnos, Realístico, Fantasia Sombria, Demônios, Fantasia, Mágica, Medieval, Atmosférico, Movimento em Grade, Um Jogador, Indie"
Lootbound,Q1 2026,Indefinido,https://store.steampowered.com/app/3091140/Lootbound/?snr=1_7_7_popularcomingsoon_150_21,"Tática por Turnos, Fantasia Sombria, Gráficos Pixelados, Explorador de Calabouços, RPG de Estratégia, Sombrio, Aventura, 2D, Jogo de Mesa, Gerenciamento de Inventário, Roguelike, Roguelite, Saques, Subterrâneo, Um Jogador, Estratégia, RPG, Personalização de Personagem, Estratégia em Turnos, Atmosférico"
Mama's Sleeping Angels,Q1 2026,Indefinido,https://store.steampowered.com/app/2918310/Mamas_Sleeping_Angels/?snr=1_7_7_popularcomingsoon_150_21,"Terror, Multijogador, Geração Procedural, Aventura, Exploração, Você Decide, Sobrenatural, Protagonista Mulher, Primeira Pessoa, Surrealista, Comédia, Plataforma, Estilizado, Sombrio, Baseado em Equipes, Demônios, Mágica, Retrô, Um Jogador, Furtivo"
Wildaria,Q1 2026,Indefinido,https://store.steampowered.com/app/1965550/Wildaria/?snr=1_7_7_popularcomingsoon_150_22,"Acesso Antecipado, Coleção de Criaturas, Gráficos Pixelados, Aventura, Mundo Aberto, RPG, Exploração, Um Jogador, Ação, Relaxante, Indie, RPG de Ação, Geração Procedural, 2D, Faça o que Quiser, Fantasia, Fofo, Trilha Sonora, Atmosférico, Casual"
魔女酒馆 Witches Tavern,Q1 2026,Indefinido,https://store.steampowered.com/app/1979290/_Witches_Tavern/?snr=1_7_7_popularcomingsoon_150_22,"Simulação, Estratégia, RPG, Casual, Simulador Rural, Construção de Cidades, Simulador de Encontros, JRPG, RPG de Estratégia, Tiro em Primeira Pessoa (FPS), 2,5D, 2D, Anime, Fofo, Colorido, Primeira Pessoa, Medieval, Drama, Histórico, Construção"
Tabletop Tavern,March 2026,Indefinido,https://store.steampowered.com/app/3337380/Tabletop_Tavern/?snr=1_7_7_popularcomingsoon_150_22,"Estratégia, Estratégia em Tempo Real (RTS), Tática em Tempo Real, Roguelite, Jogo de Guerra, Roguelike, Medieval, Histórico, Fantasia, Jogo de Mesa, Isométrico, Minimalista, Gerenciamento, Combate, 3D, Vários Finais, Não Linear, Gerenciamento de Recursos, Um Jogador, Atmosférico"
Fight Life: Vanguard,Q1 2026,Indefinido,https://store.steampowered.com/app/2927700/Fight_Life_Vanguard/?snr=1_7_7_popularcomingsoon_150_22,"Tática por Turnos, RPG, Fantasia Sombria, Estratégia, Em Turnos, RPG de Estratégia, Fantasia, Mágica, Combate em Turnos, Estratégia em Turnos, Um Jogador, Gráficos Pixelados, Grade Hexagonal, 2D, Anime, Visão Superior, Desenhado à Mão, Retrô, Medieval, Isométrico"
No Vacation for an Executioner,March 2026,Indefinido,https://store.steampowered.com/app/2949120/No_Vacation_for_an_Executioner/?snr=1_7_7_popularcomingsoon_150_22,"Terror, Terror de Sobrevivência, Ação, Aventura, Retrô, Distópico, Indie, RPG, Mistério, Vários Finais, Um Jogador, Thriller, 3D, Soulslike, Ação / Aventura, Fantasia Sombria, RPG de Ação, Controle, Plataforma 3D, Terceira Pessoa"
Eternal Palace Sakura,Q1 2026,Indefinido,https://store.steampowered.com/app/2991310/Eternal_Palace_Sakura/?snr=1_7_7_popularcomingsoon_150_22,"Protagonista Mulher, Ação, Anime, Fofo, Roguelite, Roguelike de Ação, RPG de Ação, Explorador de Calabouços, 3D, Desenho Animado, Terceira Pessoa, Estilizado, História em Quadrinhos, Fantasia, Ninja, Espada, Luta 3D, Saques, Jogador X Ambiente (PvE), Combate"
The Perfect Pencil,Q1 2026,Indefinido,https://store.steampowered.com/app/1858810/The_Perfect_Pencil/?snr=1_7_7_popularcomingsoon_150_22,"Um Jogador, Sombrio, Narração, Ação / Aventura, Terror, Boa Trama, Metroidvania, Desenhado à Mão, Plataforma 2D, Atmosférico, Psicológico, Exploração, Enredo Rico, Vários Finais, Você Decide, Ação, Comovente, Engraçado, Aventura, Narração Dinâmica"
Fate Trigger,Q1 2026,Free,https://store.steampowered.com/app/3092530/Fate_Trigger/?snr=1_7_7_popularcomingsoon_150_22,"Tiro, Sobrevivência, Battle Royale, Anime, Tiro de Heróis, Ação, MOBA, Tiro em Terceira Pessoa, Gratuito para Jogar, Tática em Tempo Real, Cartunizado, Tiro em Arena, Ação / Aventura, Cooperativo, Multijogador Massivo, Terceira Pessoa, Cooperativo On-line, Baseado em Equipes, Tático, Conteúdo Sexual"
Cavescape,March 2026,Indefinido,https://store.steampowered.com/app/3094540/Cavescape/?snr=1_7_7_popularcomingsoon_150_22,"Gráficos Pixelados, Aventura, Exploração, Mineração, Explorador de Calabouços, Plataforma, Geração Procedural, 2D, Anões, Cooperativo On-line, Ação, Faça o que Quiser, Subterrâneo, Cooperativo, Chuva de Balas, Um Jogador, Campanha Cooperativa, Alta Rejogabilidade, Sobrevivência, Estilizado"
Arms of God,Q1 2026,Indefinido,https://store.steampowered.com/app/3100310/Arms_of_God/?snr=1_7_7_popularcomingsoon_150_22,"Roguelike de Ação, Um Jogador, Chuva de Balas, Visão Superior, Roguelike, Sobrevivência, Tiro em Arena, SHMUP com Visão Superior, Alta Rejogabilidade, Roguelite, RPG, Ação, Controle, Combate, Casual, RPG de Ação, 3D, Geração Procedural, Fantasia Sombria, Violência Detalhada"
Desktop Raid,Q1 2026,Indefinido,https://store.steampowered.com/app/3122460/Desktop_Raid/?snr=1_7_7_popularcomingsoon_150_22,"RPG, Incremental, Coleção de Criaturas, Clique e Clique, Saques, Casual, Gráficos Pixelados, Aventura, Exploração, Fantasia, Artes Marciais, Mágica, Apontar e Clicar, Fofo, Batalha Automática, 2D, Anime, Desenho Animado, Fabricação, Engraçado"
Sagas of Lumin,Q1 2026,Indefinido,https://store.steampowered.com/app/3130220/Sagas_of_Lumin/?snr=1_7_7_popularcomingsoon_150_22,"Acesso Antecipado, Dragões, RPG de Ação, Ação, Aventura, RPG, Ação / Aventura, Coleção de Criaturas, Exploração, Terceira Pessoa, Atmosférico, Sombrio, Fantasia, Mágica, Steampunk, Você Decide, Voo, Cinematográfico, Realístico, Mundo Aberto"
Anomaly President,Q1 2026,Indefinido,https://store.steampowered.com/app/3156330/Anomaly_President/?snr=1_7_7_popularcomingsoon_150_22,"Acesso Antecipado, Um Jogador, Ação, Roguelike de Ação, Roguelite, Fabricação, Humor Pesado, Tático, Construção de Bases, Personalização de Personagem, Hack and Slash, Político, Aventura, Roguelike, Construção de Cidades, Controle, 2,5D, Gráficos Pixelados, Simulador de Colônias, Coleção de Criaturas"
Sister Ray,Q1 2026,Indefinido,https://store.steampowered.com/app/3200290/Sister_Ray/?snr=1_7_7_popularcomingsoon_150_22,"RPG, Boa Trama, Câmera Lateral, Você Decide, Sobrevivência, Detetive, Aventura, Para Adultos, Um Jogador, Apontar e Clicar, Anos 90, Atmosférico, Mundo Aberto, Colorido, Drama, Comovente, Investigação, Psicológico, Protagonista Mulher, Surrealista"
The Weeping Swan: Ten Days of the City's Fall,March 2026,Indefinido,https://store.steampowered.com/app/3220060/The_Weeping_Swan_Ten_Days_of_the_Citys_Fall/?snr=1_7_7_popularcomingsoon_150_22,"Drama, Ficção Interativa, Vários Finais, Histórico, Anime, Boa Trama, Jogo de Palavras, Romance Visual, Um Jogador, Guerra, Romance, Aventura, Sobrevivência, RPG, Estratégia, Simulador de Encontros, 2D, Exploração, Narração, Terror Psicológico"
Skeleseller,Q1 2026,Indefinido,https://store.steampowered.com/app/3226210/Skeleseller/?snr=1_7_7_popularcomingsoon_150_22,"Estratégia, Incremental, Casual, Batalha Automática, Simulação, 2D, Relaxante, Linear, Colorido, Indie, Gráficos Pixelados, Fantasia, Um Jogador, Gerenciamento"
Dress the Duel,Q1 2026,Indefinido,https://store.steampowered.com/app/3227040/Dress_the_Duel/?snr=1_7_7_popularcomingsoon_150_22,"Montagem de Decks Roguelike, Estratégia, Roguelike, Protagonista Mulher, 2D, Montagem de Decks, Batalha com Cartas, Fantasia, Você Decide, Um Jogador, Cartas"
Sakichan - Track Of Fury,Q1 2026,Indefinido,https://store.steampowered.com/app/3282110/Sakichan__Track_Of_Fury/?snr=1_7_7_popularcomingsoon_150_22,"Ação, Conteúdo Sexual, Nudez, Anime, Luta, Um Jogador, Protagonista Mulher, Fofo, Ritmo Rápido, Personalização de Personagem, Plataforma 3D, Corrida, Corrida com Combate, Para Adultos, Plataforma, 3D, Impróprio para o Local de Trabalho, Mechas, Estilizado, Hentai"
Kijutsu Rider,Q1 2026,Indefinido,https://store.steampowered.com/app/3474960/Kijutsu_Rider/?snr=1_7_7_popularcomingsoon_150_22,"Ação, Ação / Aventura, Hack and Slash, Luta Espetacular, Anime, Terceira Pessoa, Aventura, Super-Heróis, Jogo de Ação Focado em Personagem, 3D, Futurista, Pós-Apocalíptico, Robôs, Ficção Científica, Combate, Controle, Jogador X Ambiente (PvE), Um Jogador"
Gambonanza,Q1 2026,Indefinido,https://store.steampowered.com/app/3509230/Gambonanza/?snr=1_7_7_popularcomingsoon_150_22,"Um Jogador, Xadrez, Jogo de Tabuleiro, Roguelike, Montagem de Decks Roguelike, Montagem de Decks, Gráficos Pixelados, Estratégia, Casual, Alta Rejogabilidade, Roguelite, Difícil, Tática por Turnos, 2D, Estilizado, Anos 80, Retrô, Tático, Inteligência Artificial, Você Decide"
Clawsome,Q1 2026,Indefinido,https://store.steampowered.com/app/3517880/Clawsome/?snr=1_7_7_popularcomingsoon_150_22,"Casual, Relaxante, Fofo, Do Bem, Simulação, Um Jogador, Colete Tudo, Indie, Atmosférico, Colorido, Aconchegante, Coleção de Criaturas, Para Toda a Família, Estilizado, Isométrico, Engraçado, Arcade, Controle, Cartunizado, 3D"
Demon Bluff,Q1 2026,Indefinido,https://store.steampowered.com/app/3522600/Demon_Bluff/?snr=1_7_7_popularcomingsoon_150_22,"Roguelike, Cartas, Dedução Social, Quebra-Cabeça, Estratégia, Mistério, Fantasia, Casual, Roguelite, Fofo, Psicológico, Sombrio, Um Jogador, 2D, Atmosférico, Demônios, Investigação, Indie, Montagem de Decks Roguelike"
Agefield High: Rock the School,Q1 2026,Indefinido,https://store.steampowered.com/app/3562580/Agefield_High_Rock_the_School/?snr=1_7_7_popularcomingsoon_150_22,"Aventura, Ação, Mundo Aberto, Terceira Pessoa, Atmosférico, Comédia, Exploração, Engraçado, Humor Ácido, Boa Trama, Um Jogador, Sátira, Faça o que Quiser, Não Linear, Colorido, Vários Finais, Ação / Aventura, Conteúdo Sexual, Indie, Para Adultos"
Chained Beasts,Q1 2026,Indefinido,https://store.steampowered.com/app/3569420/Chained_Beasts/?snr=1_7_7_popularcomingsoon_150_22,"Roguelike de Ação, Cooperativo, Multijogador, Hack and Slash, Visão Superior, Roguelite, Jogador X Ambiente (PvE), Engraçado, Cooperativo On-line, Medieval, Ação, Espada, 3D, Roma, Porradaria, Morte Permanente, Difícil, Combate, Local para 4 Jogadores, Cooperativo Local"
MyRobot,Q1 2026,Indefinido,https://store.steampowered.com/app/3597510/MyRobot/?snr=1_7_7_popularcomingsoon_150_22,"Ação, Aventura, Simulação, RPG, Ação / Aventura, Exploração, Simulador Imersivo, 3D, Anime, Primeira Pessoa, Inteligência Artificial, Comovente, Engraçado, Mistério, Robôs, Um Jogador, Fofo, Indie, Casual"
Tiny Shop: make it cozy,Q1 2026,Indefinido,https://store.steampowered.com/app/3649680/Tiny_Shop_make_it_cozy/?snr=1_7_7_popularcomingsoon_150_22,"Aconchegante, Faça o que Quiser, Construção, Atmosférico, Casual, Gerenciamento, Relaxante, Indie, Fofo, Estilizado, Simulador Imersivo, Exploração, Gatos, Desenhado à Mão, Colorido, Para Toda a Família, Personalização de Personagem, Economia, Comovente, Simulador de Emprego"
Quartermaster,Q1 2026,Indefinido,https://store.steampowered.com/app/3657070/Quartermaster/?snr=1_7_7_popularcomingsoon_150_22,"Simulação, Estratégia, Construção de Bases, Construção, Gerenciamento, Faça o que Quiser, Um Jogador, Gerenciamento de Recursos, Construção de Cidades, Engraçado, Cartunizado, Militar, Comédia, Economia, Ciência, Isométrico, Simulador de Vida Real, Casual, Relaxante, Ficção Científica"
Battlestar Galactica: Scattered Hopes,Q1 2026,Indefinido,https://store.steampowered.com/app/2535950/Battlestar_Galactica_Scattered_Hopes/?snr=1_7_7_popularcomingsoon_150_22,"Estratégia, Estratégia em Tempo Real (RTS), Roguelite, Alta Rejogabilidade, Boa Trama, Difícil, Tático, Gerenciamento de Recursos, Roguelike, Exploração, Tempo Real com Pausa, Simulador Espacial, Espacial, Ficção Científica, Tática em Tempo Real, Ação, Simulação, Sobrevivência, Sombrio, Um Jogador"
RANGER COMMANDO,Q1 2026,Indefinido,https://store.steampowered.com/app/2549980/RANGER_COMMANDO/?snr=1_7_7_popularcomingsoon_150_22,"Violento, SHMUP com Visão Superior, Tiro em Terceira Pessoa, Tiro, Destruição, Morte Permanente, 3D, Isométrico, Visão Superior, Tático, Furtivo, Ação, Controle, Geração Procedural, Militar, Anos 80, Violência Detalhada, Um Jogador, Indie, Combate"
SacriFire,Q1 2026,Indefinido,https://store.steampowered.com/app/1661330/SacriFire/?snr=1_7_7_popularcomingsoon_150_22,"JRPG, RPG, Gráficos Pixelados, Boa Trama, Anime, Tática por Turnos, Um Jogador, 2D, Explorador de Calabouços, Indie, Cyberpunk, Fantasia, Demônios, Ficção Científica, Combate em Turnos, 3D, 2,5D"
Cosminers,Q1 2026,Indefinido,https://store.steampowered.com/app/1690100/Cosminers/?snr=1_7_7_popularcomingsoon_150_22,"Roguelike de Ação, Roguelite, Simulador Espacial, Tiro, Jogador X Ambiente (PvE), Gerenciamento, Tiro em Primeira Pessoa (FPS), Exploração, Construção, Cooperativo On-line, Ficção Científica, Geração Procedural, Automação, Espacial, Simulador de Colônias, Defesa de Torres, Construção de Bases, Combate, Sobrevivência, Indie"
Crown of Greed,Q1 2026,Indefinido,https://store.steampowered.com/app/1697870/Crown_of_Greed/?snr=1_7_7_popularcomingsoon_150_22,"Estratégia, Simulação, Construção de Cidades, Fantasia, Estratégia em Tempo Real (RTS), Economia, Construção, RPG de Estratégia, 3D, Histórico, Atmosférico, Simulador de Colônias, Mágica, Fantasia Sombria, Fabricação, Medieval, Ficção Científica, Tática em Tempo Real, Simulador Imersivo, Jogo de Guerra"
Shadows of Chroma Tower,March 2026,Indefinido,https://store.steampowered.com/app/2713380/Shadows_of_Chroma_Tower/?snr=1_7_7_popularcomingsoon_150_22,"Um Jogador, Ação, RPG de Ação, Multijogador, Battle Royale, Explorador de Calabouços, Jogador X Ambiente (PvE), Cooperativo, Hack and Slash, Tiro de Extração, Fabricação, Primeira Pessoa, Cooperativo On-line, Fantasia, Saques, Medieval, Gerenciamento de Inventário, Estilizado, Personalização de Personagem, 3D"
TIC-TAC: Twelve o'clock,Q1 2026,Indefinido,https://store.steampowered.com/app/1490020/TICTAC_Twelve_oclock/?snr=1_7_7_popularcomingsoon_150_22,"Terror, Indie, Ação, Sombrio, Atmosférico, Aventura, Primeira Pessoa, Terror de Sobrevivência, Sobrevivência, 3D, Demônios, Sobrenatural, Um Jogador, Boa Trama, Jogador X Ambiente (PvE), Ação / Aventura"
The Chronos Event,Q1 2026,Indefinido,https://store.steampowered.com/app/2477470/The_Chronos_Event/?snr=1_7_7_popularcomingsoon_150_22,"Roguelike de Ação, Ação, Roguelite, Um Jogador, Roguelike, Protagonista Mulher, Tiro, Difícil, Tiro com Saques, Chuva de Balas, Morte Permanente, Alta Rejogabilidade, Tiro em Terceira Pessoa, Atmosférico, Acesso Antecipado, Ritmo Rápido, Manipulação de Tempo, Viagem no Tempo, Terceira Pessoa, Aventura"
Nomori,Q1 2026,Indefinido,https://store.steampowered.com/app/2932680/Nomori/?snr=1_7_7_popularcomingsoon_150_22,"Manipulação de Tempo, Do Bem, Plataforma com Quebra-Cabeça, Surrealista, Física, Fofo, Exploração, Quebra-Cabeça, Relaxante, Terceira Pessoa, Para Toda a Família, Colorido, Atmosférico, Protagonista Mulher, Natureza, Não Linear, Aventura, Boa Trama, Um Jogador, Estilizado"
Solateria,Q1 2026,Indefinido,https://store.steampowered.com/app/2947280/Solateria/?snr=1_7_7_popularcomingsoon_150_22,"Metroidvania, Soulslike, Difícil, Desenhado à Mão, 2D, Exploração, Boa Trama, Fantasia Sombria, Plataforma, Ação, Aventura, Plataforma 2D, Indie, Combate, Vários Finais, Controle, Atmosférico, Um Jogador, Sombrio, Enredo Rico"
POLYARIS,Q1 2026,Indefinido,https://store.steampowered.com/app/2979810/POLYARIS/?snr=1_7_7_popularcomingsoon_150_22,"Sobrevivência em Mundo Aberto, Sobrevivência, Um Jogador, Primeira Pessoa, Exploração, Geração Procedural, Atmosférico, Fabricação, Faça o que Quiser, Ação, Mundo Aberto, Gerenciamento de Inventário, Simulação, Terror de Sobrevivência, Saques, Pós-Apocalíptico, Esqui, Neve, Construção de Bases, Pesca"
Voidling Bound,Q1 2026,Indefinido,https://store.steampowered.com/app/2004680/Voidling_Bound/?snr=1_7_7_popularcomingsoon_150_22,"Ação, Coleção de Criaturas, Jogador X Ambiente (PvE), Tiro em Terceira Pessoa, Aventura, Um Jogador, RPG, RPG de Ação, Ficção Científica, Combate, Terceira Pessoa, Tiro, Espacial, Plataforma 3D, Exploração, Controle, Anos 90, Personalização de Personagem, Colorido, Cartunizado"
"Cook, Serve, Delicious: Re-Mustard!",Q1 2026,Indefinido,https://store.steampowered.com/app/2139040/Cook_Serve_Delicious_ReMustard/?snr=1_7_7_popularcomingsoon_150_22,"Casual, Gerenciamento de Tempo, Culinária, Simulação, Digitação, Engraçado, Cooperativo, Campanha Cooperativa, Gerenciamento, Arcade, 2D, Colorido, Ação, Fofo, Desenhado à Mão, Simulador de Vida Real, Controle, Não Linear, Cooperativo Local, Um Jogador"
Fall of an Empire,Q1 2026,Indefinido,https://store.steampowered.com/app/1830290/Fall_of_an_Empire/?snr=1_7_7_popularcomingsoon_150_22,"Estratégia, Grande Estratégia, Roma, Simulação, RPG, 4X, Guerra, Protagonista Vilão, Economia, Um Jogador, Estratégia em Tempo Real (RTS), Militar, Atmosférico, Sobrevivência, Política, Simulador Político, Boa Trama, Combate, Realístico, Enredo Rico"
Nocturne,Q1 2026,Indefinido,https://store.steampowered.com/app/1374860/Nocturne/?snr=1_7_7_popularcomingsoon_150_22,"Ritmo, RPG, Boa Trama, JRPG, Narrativa, Fantasia, Exploração, Aventura, Estilizado, Jogador X Ambiente (PvE), Enredo Rico, 2D, Fofo, Anime, Gráficos Pixelados, Comovente, Colorido, Minimalista, Retrô, Distópico"
SELINI,Q1 2026,Indefinido,https://store.steampowered.com/app/1434050/SELINI/?snr=1_7_7_popularcomingsoon_150_22,"Atmosférico, Mistério, Psicológico, Robôs, Exploração, Metroidvania, Câmera Lateral, Plataforma com Quebra-Cabeça, Quebra-Cabeça, Plataforma, Aventura, Ação / Aventura, 2,5D, Cyberpunk, Pós-Apocalíptico, Controle, Vários Finais, Não Linear, Boa Trama, Ação"
Fallen Tear: The Ascension,Q1 2026,Indefinido,https://store.steampowered.com/app/1446900/Fallen_Tear_The_Ascension/?snr=1_7_7_popularcomingsoon_150_22,"Mundo Aberto, Boa Trama, Fantasia Sombria, Exploração, Ação / Aventura, Metroidvania, Aventura, Soulslike, RPG, Controle, Um Jogador, Ação, Plataforma, Plataforma 2D, Câmera Lateral, Plataforma com Quebra-Cabeça, Difícil, JRPG, 2D, Indie"
Ant Colony: Wild Forest,Q1 2026,Indefinido,https://store.steampowered.com/app/1238190/Ant_Colony_Wild_Forest/?snr=1_7_7_popularcomingsoon_150_22,"Inteligência Artificial, Estratégia, Simulação, Simulador de Colônias, Construção de Bases, Mineração, Construção de Cidades, Estratégia em Tempo Real (RTS), 4X, Construção, Gerenciamento de Recursos, Relaxante, Gerenciamento, Exploração, Incremental, Explorador de Calabouços, Defesa de Torres, Tutorial, Geração Procedural, 2,5D"
Football Story,Q1 2026,Indefinido,https://store.steampowered.com/app/757550/Football_Story/?snr=1_7_7_popularcomingsoon_150_22,"RPG, Gráficos Pixelados, Futebol, Personalização de Personagem, Exploração, Engraçado, Esportes, CRPG, Jogador X Ambiente (PvE), Escolha a sua Aventura, Boa Trama, Simulador de Vida Real, Atmosférico, Enredo Rico, Baseado em Equipes, Aventura, Casual, Simulação, 2D, Controle"
Little Nemo and the Guardians of Slumberland,Q1 2026,Indefinido,https://store.steampowered.com/app/2074630/Little_Nemo_and_the_Guardians_of_Slumberland/?snr=1_7_7_popularcomingsoon_150_22,"Exploração, Ação, Metroidvania, Plataforma 2D, Plataforma, Aventura, Ação / Aventura, 2D, Fofo, Controle, Colorido, Para Toda a Família, Indie, Anos 80, Anos 90, Retrô, Um Jogador"
Iron Frontier,March 2026,Indefinido,https://store.steampowered.com/app/2131290/Iron_Frontier/?snr=1_7_7_popularcomingsoon_150_22,"Montagem de Decks, Militar, Estratégia em Tempo Real (RTS), Estratégia, 2D, Construção de Bases, Tempo Real, Estratégia em Tempo Real com Ação, Guerra, Um Jogador, Tanques, Tática em Tempo Real, Jogo de Guerra, Defesa de Torres, Difícil, Alta Rejogabilidade, Batalha Automática, Cartas, Roguelike, Ação"
Mini Tank Mayhem,Q1 2026,Indefinido,https://store.steampowered.com/app/2096260/Mini_Tank_Mayhem/?snr=1_7_7_popularcomingsoon_150_22,"Montagem de Decks, Defesa de Torres, Estratégia, Roguelike, Cartas, Roguelite, 3D, Estratégia em Turnos, Tático, Tanques, Para Toda a Família, Fofo, Alienígenas, Tática por Turnos, Jogo de Guerra, 2,5D, Cartunizado, Combate em Turnos, Um Jogador, Desenho Animado"
Glaciered,Q1 2026,Indefinido,https://store.steampowered.com/app/2052300/Glaciered/?snr=1_7_7_popularcomingsoon_150_22,"RPG, Ação, RPG de Ação, Ação / Aventura, Soulslike, 3D, Terceira Pessoa, Subaquático, Exploração, Realístico, Ficção Científica, Fantasia, Pós-Apocalíptico, Natureza, Indie, Jogador X Ambiente (PvE), Um Jogador, Atmosférico, Hack and Slash, Aventura"
Demon Bluff,1º trimestre de 2026,Indefinido,https://store.steampowered.com/app/3522600/Demon_Bluff/?snr=1_7_7_popularcomingsoon_150_23,"Roguelike, Cartas, Dedução Social, Quebra-Cabeça, Estratégia, Mistério, Fantasia, Casual, Roguelite, Fofo, Psicológico, Sombrio, Um Jogador, 2D, Atmosférico, Demônios, Investigação, Indie, Montagem de Decks Roguelike"
Agefield High: Rock the School,1º trimestre de 2026,Indefinido,https://store.steampowered.com/app/3562580/Agefield_High_Rock_the_School/?snr=1_7_7_popularcomingsoon_150_23,"Aventura, Ação, Mundo Aberto, Terceira Pessoa, Atmosférico, Comédia, Exploração, Engraçado, Humor Ácido, Boa Trama, Um Jogador, Sátira, Faça o que Quiser, Não Linear, Colorido, Vários Finais, Ação / Aventura, Conteúdo Sexual, Indie, Para Adultos"
Chained Beasts,1º trimestre de 2026,Indefinido,https://store.steampowered.com/app/3569420/Chained_Beasts/?snr=1_7_7_popularcomingsoon_150_23,"Roguelike de Ação, Cooperativo, Multijogador, Hack and Slash, Visão Superior, Roguelite, Jogador X Ambiente (PvE), Engraçado, Cooperativo On-line, Medieval, Ação, Espada, 3D, Roma, Porradaria, Morte Permanente, Difícil, Combate, Local para 4 Jogadores, Cooperativo Local"
MyRobot,1º trimestre de 2026,Indefinido,https://store.steampowered.com/app/3597510/MyRobot/?snr=1_7_7_popularcomingsoon_150_23,"Ação, Aventura, Simulação, RPG, Ação / Aventura, Exploração, Simulador Imersivo, 3D, Anime, Primeira Pessoa, Inteligência Artificial, Comovente, Engraçado, Mistério, Robôs, Um Jogador, Fofo, Indie, Casual"
Tiny Shop: make it cozy,1º trimestre de 2026,Indefinido,https://store.steampowered.com/app/3649680/Tiny_Shop_make_it_cozy/?snr=1_7_7_popularcomingsoon_150_23,"Aconchegante, Faça o que Quiser, Construção, Atmosférico, Casual, Gerenciamento, Relaxante, Indie, Fofo, Estilizado, Simulador Imersivo, Exploração, Gatos, Desenhado à Mão, Colorido, Para Toda a Família, Personalização de Personagem, Economia, Comovente, Simulador de Emprego"
Quartermaster,1º trimestre de 2026,Indefinido,https://store.steampowered.com/app/3657070/Quartermaster/?snr=1_7_7_popularcomingsoon_150_23,"Simulação, Estratégia, Construção de Bases, Construção, Gerenciamento, Faça o que Quiser, Um Jogador, Gerenciamento de Recursos, Construção de Cidades, Engraçado, Cartunizado, Militar, Comédia, Economia, Ciência, Isométrico, Simulador de Vida Real, Casual, Relaxante, Ficção Científica"
