title,release_date,price,game_url,genres
SELINI,Q1 2026,Indefinido,https://store.steampowered.com/app/1434050/SELINI/?snr=1_7_7_popularcomingsoon_150_13,"Exploração, Metroidvania, Câmera Lateral, Plataforma com Quebra-Cabeça, Quebra-Cabeça, Plataforma, Ação / Aventura, 2,5D, Sombrio, Pós-Apocalíptico, Um Jogador, Não Linear, Boa Trama, Ação, Atmosférico, Mistério, Cyberpunk, Controle, Distópico, Aventura"
Dewdrop Dynasty,Q1 2026,Indefinido,https://store.steampowered.com/app/1444080/Dewdrop_Dynasty/?snr=1_7_7_popularcomingsoon_150_13,"Metroidvania, Aventura, Exploração, Gráficos Pixelados, Plataforma, Indie, Mundo Aberto, Engraçado, Ação, Enredo Rico, Para Toda a Família, Alta Rejogabilidade, Fofo, 2D, Boa Trama, Não Linear, Tiro, Um Jogador, Natureza, Dinossauros"
Fallen Tear: The Ascension,Q1 2026,Indefinido,https://store.steampowered.com/app/1446900/Fallen_Tear_The_Ascension/?snr=1_7_7_popularcomingsoon_150_13,"Mundo Aberto, Boa Trama, Fantasia Sombria, Exploração, Ação / Aventura, Metroidvania, Aventura, Soulslike, RPG, Controle, Um Jogador, Ação, Plataforma, Plataforma 2D, Câmera Lateral, Plataforma com Quebra-Cabeça, Difícil, JRPG, 2D, Indie"
Mad King Redemption,Q1 2026,Indefinido,https://store.steampowered.com/app/2369580/Mad_King_Redemption/?snr=1_7_7_popularcomingsoon_150_14,"Acesso Antecipado, Roguelike de Ação, Arcade, Câmera Lateral, Porradaria, Roguelite, 2,5D, Gráficos Pixelados, Controle, Hack and Slash, Ação, Fantasia Sombria, Aventura, Multijogador Local, Velha-Guarda, Cooperativo Local, Jogador X Ambiente (PvE), Retrô, Ação / Aventura, Indie"
Re:Night,Q1 2026,Indefinido,https://store.steampowered.com/app/2372240/ReNight/?snr=1_7_7_popularcomingsoon_150_14,"Montagem de Decks Roguelike, Tática por Turnos, RPG Tático, Batalha com Cartas, Roguelite, Cartas, Estratégia em Turnos, Jogo de Tabuleiro, RPG de Estratégia, Roguelike, Combate em Turnos, Estratégia, RPG, 2D, Montagem de Decks, Fantasia, Tático, Fantasia Sombria, Um Jogador, Indie"
The Bornless,Q1 2026,Indefinido,https://store.steampowered.com/app/2411280/The_Bornless/?snr=1_7_7_popularcomingsoon_150_14,"Terror, Tiro em Primeira Pessoa (FPS), Multijogador, Tiro, Ação, Terror de Sobrevivência, Demônios, Atmosférico, Aventura, Ação / Aventura, Primeira Pessoa, Jogador x Jogador (PvP), Terror Psicológico, Fantasia Sombria, Combate, Cooperativo On-line, Um Jogador, Baseado em Equipes, Cooperativo, Battle Royale"
Breathedge 2,Q1 2026,Indefinido,https://store.steampowered.com/app/2412960/Breathedge_2/?snr=1_7_7_popularcomingsoon_150_14,"Sobrevivência, Aventura, Primeira Pessoa, Ação, RPG, Um Jogador, Simulação, Sobrevivência em Mundo Aberto, Espacial, Faça o que Quiser, Ação / Aventura, Exploração, Simulador Imersivo, Construção, Fabricação, Engraçado, Atmosférico, Mundo Aberto, Construção de Bases, Automação"
Final Sentence,Q1 2026,Indefinido,https://store.steampowered.com/app/2413950/Final_Sentence/?snr=1_7_7_popularcomingsoon_150_14,"Digitação, Simulação, Terror, Sobrevivência, Battle Royale, Multijogador, Jogador x Jogador (PvP), Terror de Sobrevivência, Terror Psicológico, Thriller, Atmosférico, Baseado em Texto, Noir, Indie, 3D, Educativo, Distópico"
Above the Snow,Q1 2026,Indefinido,https://store.steampowered.com/app/2423760/Above_the_Snow/?snr=1_7_7_popularcomingsoon_150_14,"Atmosférico, Gerenciamento, Simulação, Construção, Construção de Cidades, Simulador Imersivo, Estratégia, Gerenciamento de Recursos, Visão Superior, Natureza, Boa Trama, Você Decide, Neve, Simulador de Colônias, Estilizado, Exploração, Um Jogador, 3D, Gerenciamento de Tempo, Casual"
Ant Colony: Wild Forest,Q1 2026,Indefinido,https://store.steampowered.com/app/1238190/Ant_Colony_Wild_Forest/?snr=1_7_7_popularcomingsoon_150_14,"Casual, Inteligência Artificial, 2D, Isométrico, 4X, Estratégia, Visão Superior, Construção, Simulação, Simulador de Colônias, Construção de Bases, Economia, Gerenciamento de Recursos, Construção de Cidades, Coleção de Criaturas, Estratégia em Tempo Real (RTS), Simulador Imersivo, Subterrâneo, Desenho Animado, Relaxante"
Humanica,1º trimestre de 2026,Indefinido,https://store.steampowered.com/app/2112740/Humanica/?snr=1_7_7_popularcomingsoon_150_14,"Construção de Cidades, Simulação, Sobrevivência, Gerenciamento, Estilizado, Estratégia, Colorido, Construção de Bases, Gerenciamento de Recursos, Simulador de Colônias, Histórico, Atmosférico, Construção, Relaxante, Faça o que Quiser, Geração Procedural, Natureza, Mundo Aberto, Medieval, Grade Hexagonal"
LIFTED,1º trimestre de 2026,Indefinido,https://store.steampowered.com/app/2184020/LIFTED/?snr=1_7_7_popularcomingsoon_150_14,"Boa Trama, Aventura, Fofo, Engraçado, Cinematográfico, Plataforma, Assalto, Um Jogador, Quebra-Cabeça, Colorido, Ação, 2,5D, Ação / Aventura, Indie, Viagem no Tempo, Plataforma com Quebra-Cabeça, Exploração, Trilha Sonora Boa, Bonito, Aconchegante"
High Times - Dating/Cooking Sim,1º trimestre de 2026,Indefinido,https://store.steampowered.com/app/2251220/High_Times__DatingCooking_Sim/?snr=1_7_7_popularcomingsoon_150_14,"Simulação, Casual, Simulador de Encontros, Romance Visual, Culinária, Você Decide, Romance, Desenho Animado, Anime, Vários Finais, LGBTQIA+, Colorido, Fofo, História em Quadrinhos, Comédia, Drama, Comovente, Boa Trama, Memes, Gerenciamento"
Frontier Paladin,1º trimestre de 2026,Indefinido,https://store.steampowered.com/app/2804970/Frontier_Paladin/?snr=1_7_7_popularcomingsoon_150_14,"Construção de Bases, Soulslike, RPG, Defesa de Torres, Ação, Aventura, Estratégia"
The Remake of the End of the Greatest RPG of All Time,1º trimestre de 2026,Indefinido,https://store.steampowered.com/app/2809660/The_Remake_of_the_End_of_the_Greatest_RPG_of_All_Time/?snr=1_7_7_popularcomingsoon_150_14,"Aventura, Ficção Interativa, JRPG, Plataforma 3D, Objetos Ocultos, RPG Tático, 3D, Colorido, Gráficos Pixelados, Anos 90, Atmosférico, Fantasia, Investigação, Retrô, Combate, FMV, Linear, Boa Trama, Combate em Turnos, Um Jogador"
Citystate Metropolis,1º trimestre de 2026,Indefinido,https://store.steampowered.com/app/2828020/Citystate_Metropolis/?snr=1_7_7_popularcomingsoon_150_14,"Simulação, Construção de Cidades, Construção, Faça o que Quiser, Um Jogador, Estratégia, Gerenciamento, Economia, Realístico, Casual, Transportes, Mundo Aberto, Atmosférico, Capitalismo, Futurista, Compatível com Mods, Acesso Antecipado, Geração Procedural, Relaxante"
SimplePlanes 2,março de 2026,Indefinido,https://store.steampowered.com/app/2840470/SimplePlanes_2/?snr=1_7_7_popularcomingsoon_150_14,"Simulação, Voo, Faça o que Quiser, Construção, Mundo Aberto, Destruição, Multijogador, Militar, Simulador Automobilístico, Cooperativo, Animação e Modelagem, Tiro, Corrida com Combate, Exploração, Automação, Corrida, Combate com Veículos, Direção, Programação, Um Jogador"
Slay the Spire 2,março de 2026,Indefinido,https://store.steampowered.com/app/2868840/Slay_the_Spire_2/?snr=1_7_7_popularcomingsoon_150_14,"Estratégia, Cartas, Roguelike, Batalha com Cartas, Montagem de Decks, Explorador de Calabouços, Combate em Turnos, Roguelite, Montagem de Decks Roguelike, 2D, Indie, Fantasia, Um Jogador, Difícil, Geração Procedural, Alta Rejogabilidade, Só Mouse"
KILL THE WITCH,1º trimestre de 2026,Indefinido,https://store.steampowered.com/app/2878760/KILL_THE_WITCH/?snr=1_7_7_popularcomingsoon_150_14,"Acesso Antecipado, Plataforma 2D, Soulslike, Jogador X Ambiente (PvE), Plataforma, 2D, Fofo, Cyberpunk, Terror Psicológico, Boa Trama, Ação, Gráficos Pixelados, Anime, Ficção Científica, Comovente, Retrô, Sombrio, Combate, Um Jogador, Trilha Sonora"
Fractured Mind,1º trimestre de 2026,,https://store.steampowered.com/app/2885330/Fractured_Mind/?snr=1_7_7_popularcomingsoon_150_14,"Ação, Terror, Aventura, Terror Psicológico, Simulação, Tiro, Surrealista, Tiro em Primeira Pessoa (FPS), Simulador Imersivo, 3D, Primeira Pessoa, Cinematográfico, Realístico, Drama, Comovente, Psicológico, Sombrio, Boa Trama, Um Jogador, Acesso Antecipado"
Pieced Together,1º trimestre de 2026,Indefinido,https://store.steampowered.com/app/2891370/Pieced_Together/?snr=1_7_7_popularcomingsoon_150_14,"Aconchegante, Quebra-Cabeça, Relaxante, Protagonista Mulher, Indie, Boa Trama, 2D, Fofo, Casual, Simulação, Colorido, Desenhado à Mão, Estilizado, Para Toda a Família, Drama, Atmosférico, Anos 90, Investigação, Um Jogador, Comovente"
Mama's Sleeping Angels,1º trimestre de 2026,Indefinido,https://store.steampowered.com/app/2918310/Mamas_Sleeping_Angels/?snr=1_7_7_popularcomingsoon_150_14,"Terror, Multijogador, Geração Procedural, Aventura, Exploração, Você Decide, Sobrenatural, Protagonista Mulher, Primeira Pessoa, Surrealista, Comédia, Plataforma, Estilizado, Sombrio, Baseado em Equipes, Demônios, Mágica, Retrô, Um Jogador, Furtivo"
Unfriendly Friend,1º trimestre de 2026,Indefinido,https://store.steampowered.com/app/2938980/Unfriendly_Friend/?snr=1_7_7_popularcomingsoon_150_14,"Violência Detalhada, Terror Psicológico, Terror, JRPG, Violento, Boa Trama, Romance Visual, Sombrio, 2D, Indie, Estilizado, RPG, Atmosférico, Desenhado à Mão, Protagonista Mulher, Você Decide, Quebra-Cabeça, Anime, Comovente, Um Jogador"
Solateria,1º trimestre de 2026,Indefinido,https://store.steampowered.com/app/2947280/Solateria/?snr=1_7_7_popularcomingsoon_150_14,"Metroidvania, Soulslike, Difícil, Desenhado à Mão, 2D, Exploração, Boa Trama, Fantasia Sombria, Plataforma, Ação, Aventura, Plataforma 2D, Indie, Combate, Vários Finais, Controle, Atmosférico, Um Jogador, Sombrio, Enredo Rico"
No Vacation for an Executioner,março de 2026,Indefinido,https://store.steampowered.com/app/2949120/No_Vacation_for_an_Executioner/?snr=1_7_7_popularcomingsoon_150_14,"Terror, Terror de Sobrevivência, Ação, Aventura, Retrô, Distópico, Indie, RPG, Mistério, Vários Finais, Um Jogador, Thriller, 3D, Soulslike, Ação / Aventura, Fantasia Sombria, RPG de Ação, Controle, Plataforma 3D, Terceira Pessoa"
DrainSim,março de 2026,Indefinido,https://store.steampowered.com/app/2963800/DrainSim/?snr=1_7_7_popularcomingsoon_150_14,"Casual, Simulação, Relaxante, Primeira Pessoa, Faça o que Quiser, Subaquático, 3D, Realístico, Simulador Imersivo, Física, Linear, Natureza, Atmosférico, EUA, Um Jogador, Colorido, Engraçado, Boa Trama, Aconchegante, Do Bem"
Starsand Island,1º trimestre de 2026,Indefinido,https://store.steampowered.com/app/2966320/Starsand_Island/?snr=1_7_7_popularcomingsoon_150_14,"RPG, Simulador de Vida Real, Simulador Rural, Construção, Casual, Faça o que Quiser, Simulação, Fabricação, Relaxante, Desenho Animado, Plataforma 3D, Exploração, Simulador Imersivo, 3D, Anime, Drama, Comovente, Atmosférico, Subaquático, Culinária"
Anomaly President,1º trimestre de 2026,Indefinido,https://store.steampowered.com/app/3156330/Anomaly_President/?snr=1_7_7_popularcomingsoon_150_14,"Acesso Antecipado, Um Jogador, Ação, Roguelike de Ação, Roguelite, Fabricação, Humor Pesado, Tático, Construção de Bases, Personalização de Personagem, Hack and Slash, Político, Aventura, Roguelike, Construção de Cidades, Controle, 2,5D, Gráficos Pixelados, Simulador de Colônias, Coleção de Criaturas"
Insider Trading,1º trimestre de 2026,Indefinido,https://store.steampowered.com/app/3166810/Insider_Trading/?snr=1_7_7_popularcomingsoon_150_14,"Estratégia, Montagem de Decks Roguelike, Apostas, Montagem de Decks, Um Jogador, Roguelike, Em Turnos, Alta Rejogabilidade, Roguelite, Capitalismo, Você Decide, Casual, Batalha Automática, Difícil, Gráficos Pixelados, 2D, Indie, Estratégia em Turnos, Geração Procedural, Retrô"
Título não disponível,Data não informada,Indefinido,https://store.steampowered.com/app/3180410/Project_Songbird/?snr=1_7_7_popularcomingsoon_150_14,Sem gênero
Cat Island Petrichor,1º trimestre de 2026,Indefinido,https://store.steampowered.com/app/3181890/Cat_Island_Petrichor/?snr=1_7_7_popularcomingsoon_150_14,"Aventura, Simulador de Caminhada, Simulador de Vida Real, Exploração, Simulador Imersivo, 3D, Fofo, Terceira Pessoa, Comovente, Relaxante, Casual, RPG, Atmosférico, Boa Trama, Controle, Mundo Aberto, Nudez, Um Jogador, Conteúdo Sexual, Gatos"
春秋异闻录,1º trimestre de 2026,Indefinido,https://store.steampowered.com/app/3201830/The_Hidden_Scrolls/?snr=1_7_7_popularcomingsoon_150_14,"Tática por Turnos, Fantasia Sombria, Roguelite, Explorador de Calabouços, Estratégia em Turnos, RPG de Estratégia, RPG de Grupos, Combate em Turnos, Estratégia, RPG, Roguelike, 2D, Histórico, Desenhado à Mão, Estilizado, Câmera Lateral, Indie, Plataforma 2D, Mitologia, Um Jogador"
Lil Gator Game: In the Dark,1º trimestre de 2026,Indefinido,https://store.steampowered.com/app/3205060/Lil_Gator_Game_In_the_Dark/?snr=1_7_7_popularcomingsoon_150_14,"Casual, Aconchegante, Indie, Fofo, Relaxante, Do Bem, Para Toda a Família, Aventura, Engraçado, Curta-Metragem, Colorido, LGBTQIA+, Plataforma 3D, 3D, Colete Tudo, Terceira Pessoa, Um Jogador, Ação / Aventura, Comédia, RPG"
Título não disponível,Data não informada,Indefinido,https://store.steampowered.com/app/3216800/MRK_BORG_Heresy_Supreme/?snr=1_7_7_popularcomingsoon_150_14,Sem gênero
Super Woden: Rally Edge,1º trimestre de 2026,Indefinido,https://store.steampowered.com/app/3218630/Super_Woden_Rally_Edge/?snr=1_7_7_popularcomingsoon_150_14,"Corrida, Esportes, Direção, Jogador x Jogador (PvP), Arcade, 2,5D, 3D, História em Quadrinhos, Visão Superior, Tela Dividida, Terceira Pessoa, Colorido, Estilizado, Economia, Anos 80, Anos 90, Retrô, Velha-Guarda, Gerenciamento de Recursos, Local para 4 Jogadores"
The Weeping Swan: Ten Days of the City's Fall,março de 2026,Indefinido,https://store.steampowered.com/app/3220060/The_Weeping_Swan_Ten_Days_of_the_Citys_Fall/?snr=1_7_7_popularcomingsoon_150_14,"Drama, Ficção Interativa, Vários Finais, Histórico, Anime, Boa Trama, Jogo de Palavras, Romance Visual, Um Jogador, Guerra, Romance, Aventura, Sobrevivência, RPG, Estratégia, Simulador de Encontros, 2D, Exploração, Narração, Terror Psicológico"
Peregrino,março de 2026,Indefinido,https://store.steampowered.com/app/3268150/Peregrino/?snr=1_7_7_popularcomingsoon_150_14,"RPG, Fantasia Sombria, Isométrico, Terror de Sobrevivência, Estratégia, Gerenciamento de Inventário, Gerenciamento, Atmosférico, Exploração, Gótico, Lovecraftiano, Um Jogador, Aventura, RPG de Ação, Estilizado, Fabricação, Boa Trama, Indie, Sombrio, Morte Permanente"
Sakichan - Track Of Fury,1º trimestre de 2026,Indefinido,https://store.steampowered.com/app/3282110/Sakichan__Track_Of_Fury/?snr=1_7_7_popularcomingsoon_150_14,"Ação, Conteúdo Sexual, Nudez, Anime, Luta, Protagonista Mulher, Um Jogador, Fofo, Ritmo Rápido, Personalização de Personagem, Plataforma 3D, Corrida, Corrida com Combate, Para Adultos, Plataforma, 3D, Impróprio para o Local de Trabalho, Mechas, Estilizado, Hentai"
Mistfall Hunter,março de 2026,Indefinido,https://store.steampowered.com/app/3282300/Mistfall_Hunter/?snr=1_7_7_popularcomingsoon_150_14,"Tiro de Extração, Ação / Aventura, Multijogador, Soulslike, Medieval, Jogador X Ambiente (PvE), Cooperativo On-line, Jogador x Jogador (PvP), Combate, Sombrio, Sobrevivência, Tático, Fantasia Sombria, Tiro em Terceira Pessoa, Saques, Competitivo, Aventura, Atmosférico, Tiro com Saques, 3D"
Panzer Strike,1º trimestre de 2026,Indefinido,https://store.steampowered.com/app/3305930/Panzer_Strike/?snr=1_7_7_popularcomingsoon_150_14,"Estratégia, Estratégia em Tempo Real (RTS), Segunda Guerra Mundial, Guerra, Multijogador, Tático, Simulação, Histórico, Militar, Um Jogador, Tática em Tempo Real, Isométrico, Ação, Jogo de Guerra, Tempo Real, Atmosférico, Realístico, Combate, Jogador x Jogador (PvP), Tanques"
Factory Town 2: Paradise,1º trimestre de 2026,Indefinido,https://store.steampowered.com/app/3312130/Factory_Town_2_Paradise/?snr=1_7_7_popularcomingsoon_150_14,"Simulação, Automação, Construção de Cidades, Fabricação, Construção, Estratégia, Construção de Bases, Economia, Gerenciamento, Trens, Simulador de Colônias, Faça o que Quiser, Relaxante, 3D, Gerenciamento de Recursos, Natureza, Colorido, Visão Superior, Transportes, Personalização de Personagem"
s&box,Q1 2026,Free,https://store.steampowered.com/app/590830/sbox/?snr=1_7_7_popularcomingsoon_150_14,"Ação, Casual, Faça o que Quiser, Tiro, Plataforma 3D, Tiro em Primeira Pessoa (FPS), Tiro em Terceira Pessoa, 3D, Primeira Pessoa, Estilizado, Terceira Pessoa, Construção, Desenvolvimento de Jogos, Engraçado, Jogador x Jogador (PvP), Construção de Bases, Personalização de Personagem, Combate, Fabricação, Editor de Níveis"
Fate Trigger,Q1 2026,Free,https://store.steampowered.com/app/3092530/Fate_Trigger/?snr=1_7_7_popularcomingsoon_150_14,"Tiro, Sobrevivência, Battle Royale, Anime, Tiro de Heróis, MOBA, Ação, Tiro em Terceira Pessoa, Gratuito para Jogar, Tática em Tempo Real, Cartunizado, Tiro em Arena, Ação / Aventura, Cooperativo, Multijogador Massivo, Terceira Pessoa, Cooperativo On-line, Baseado em Equipes, Tático, Conteúdo Sexual"
Shadows of Chroma Tower,March 2026,Indefinido,https://store.steampowered.com/app/2713380/Shadows_of_Chroma_Tower/?snr=1_7_7_popularcomingsoon_150_14,"Um Jogador, Ação, RPG de Ação, Multijogador, Explorador de Calabouços, Battle Royale, Jogador X Ambiente (PvE), Cooperativo, Hack and Slash, Tiro de Extração, Fabricação, Primeira Pessoa, Cooperativo On-line, Fantasia, Saques, Medieval, Gerenciamento de Inventário, Estilizado, Personalização de Personagem, 3D"
Roadside Research,Q1 2026,Indefinido,https://store.steampowered.com/app/3643170/Roadside_Research/?snr=1_7_7_popularcomingsoon_150_14,"Acesso Antecipado, Cooperativo On-line, Simulador Imersivo, Alienígenas, Engraçado, EUA, Primeira Pessoa, Simulador de Vida Real, Simulação, Gerenciamento, Personalização de Personagem, Multijogador, Comédia, Cooperativo, Economia, Ficção Científica, Um Jogador, Faça o que Quiser, Casual, Física"
World In The Abyss,"Apr 15, 2026",Indefinido,https://store.steampowered.com/app/3676080/World_In_The_Abyss/?snr=1_7_7_popularcomingsoon_150_14,"Acesso Antecipado, Sobrevivência em Mundo Aberto, Sobrevivência, Cooperativo, Mundo Aberto, Fabricação, Construção de Bases, Aventura, Subaquático, Multijogador, Construção, Ação / Aventura, Tiro, Ação, Faça o que Quiser, Exploração, Pós-Apocalíptico, Tiro em Terceira Pessoa, Realístico, Terceira Pessoa"
Cthulhu: The Cosmic Abyss,"Apr 16, 2026",Indefinido,https://store.steampowered.com/app/2760560/Cthulhu_The_Cosmic_Abyss/?snr=1_7_7_popularcomingsoon_150_14,"Aventura, Boa Trama, Atmosférico, Terror Psicológico, Um Jogador, Lovecraftiano, Exploração, Sombrio, Primeira Pessoa, Mistério, Você Decide, Investigação, Detetive, Vários Finais, Thriller, Ficção Científica, Narração, Violência Detalhada, Violento"
Clockwork Ambrosia,"Apr 22, 2026",Indefinido,https://store.steampowered.com/app/896010/Clockwork_Ambrosia/?snr=1_7_7_popularcomingsoon_150_14,"Exploração, Metroidvania, Plataforma 2D, Plataforma, Tiro, Parkour, Atmosférico, Controle, Ação / Aventura, Robôs, Protagonista Mulher, Steampunk, Natureza, 2D, Personalização de Armas, Retrô, Não Linear, Futurista, Ação, Gráficos Pixelados"
Shadow mate ~小さな竜と適合者~,April 2026,Indefinido,https://store.steampowered.com/app/2603850/Shadow_mate/?snr=1_7_7_popularcomingsoon_150_14,"Ação, Fantasia Sombria, Ação / Aventura, Terror, Aventura, 3D, RPG de Ação, Plataforma 3D, Soulslike, Dragões, Fantasia, Exploração, Anime, Fofo, Desenho Animado, Terceira Pessoa, Cinematográfico, Desenvolvimento de Jogos, Zumbis, Sombrio"
The Witch's Fairy Tale,"Apr 30, 2026",Indefinido,https://store.steampowered.com/app/3233860/The_Witchs_Fairy_Tale/?snr=1_7_7_popularcomingsoon_150_14,"RPG, Ação, Roguelike de Ação, Mágica, 2D, Combate, Desenhado à Mão, Fofo, Fantasia, Indie, Boa Trama, Protagonista Mulher, Um Jogador"
Besmirch,"May 11, 2026",Indefinido,https://store.steampowered.com/app/3670630/Besmirch/?snr=1_7_7_popularcomingsoon_150_14,"Simulador Rural, Terror, Gerenciamento, RPG, Você Decide, Fé, Exploração, Mundo Aberto, Terror de Sobrevivência, Um Jogador, Hack and Slash, Gráficos Pixelados, Rural, Sombrio, Furtivo, Combate, Explorador de Calabouços, Demônios, Abstrato, Ação / Aventura"
Paralives,"May 25, 2026",Indefinido,https://store.steampowered.com/app/1118520/Paralives/?snr=1_7_7_popularcomingsoon_150_14,"Simulação, Simulador de Vida Real, Personalização de Personagem, Construção, Mundo Aberto, Indie, Um Jogador, Faça o que Quiser, Relaxante, Casual, LGBTQIA+, Fofo, Para Toda a Família, Acesso Antecipado, Realístico, Aconchegante, Compatível com Mods, Simulador Imersivo, Atmosférico"
Rancher: A new life,May 2026,Indefinido,https://store.steampowered.com/app/2665250/Rancher_A_new_life/?snr=1_7_7_popularcomingsoon_150_14,"Simulação, Simulador Imersivo, Simulador Rural, Casual, Simulador de Vida Real, Relaxante, Primeira Pessoa, Realístico, Construção, Agricultura, Natureza, Estrada de Terra, Direção, Cachorros, Culinária, Pesca, Moderno, Fabricação, Luta Livre, 3D"
Rancher: A new life,maio de 2026,Indefinido,https://store.steampowered.com/app/2665250/Rancher_A_new_life/?snr=1_7_7_popularcomingsoon_150_15,"Simulação, Simulador Imersivo, Simulador Rural, Casual, Simulador de Vida Real, Relaxante, Primeira Pessoa, Realístico, Construção, Agricultura, Natureza, Estrada de Terra, Direção, Cachorros, Culinária, Pesca, Moderno, Fabricação, Luta Livre, 3D"
Mars Tactics,May 2026,Indefinido,https://store.steampowered.com/app/1727760/Mars_Tactics/?snr=1_7_7_popularcomingsoon_150_15,"Estratégia, RPG, Estratégia em Turnos, Tático, Guerra, Em Turnos, Tática por Turnos, Ficção Científica, Combate em Turnos, Difícil, Personalização de Personagem, Futurista, Espacial, Ação, Um Jogador, Compatível com Mods, Alienígenas, Morte Permanente, Atmosférico, Grade Hexagonal"
Brigador Killers,Data não informada,Indefinido,https://store.steampowered.com/app/903930/Brigador_Killers/?snr=1_7_7_popularcomingsoon_150_15,"Cyberpunk, Ação, Ficção Científica, Distópico, Isométrico, Destruição, Capitalismo, Tiro, Ação / Aventura, Mechas, Assassino, Furtivo, SHMUP com Visão Superior, Combate com Veículos, Tanques, Trilha Sonora, Um Jogador, Violência Detalhada, Indie, Controle com Alavanca Dupla"
Burlesque,Q2 2026,Indefinido,https://store.steampowered.com/app/506640/Burlesque/?snr=1_7_7_popularcomingsoon_150_15,"Aventura, Indie, Casual, Nudez"
Adventures of Ruby Rabbit,Q2 2026,Indefinido,https://store.steampowered.com/app/1205570/Adventures_of_Ruby_Rabbit/?snr=1_7_7_popularcomingsoon_150_15,"Roguelike de Ação, SHMUP com Visão Superior, Chuva de Balas, Mandando Bala, Explorador de Calabouços, Roguelite, Porradaria, Tiro, Ação / Aventura, Roguelike, Protagonista Mulher, 2,5D, Visão Superior, Fofo, Engraçado, Ação, Gráficos Pixelados, Aventura, Um Jogador, Cooperativo"
Bobo Bay,Q2 2026,Indefinido,https://store.steampowered.com/app/1889810/Bobo_Bay/?snr=1_7_7_popularcomingsoon_150_15,"Coleção de Criaturas, Fofo, Relaxante, Gerenciamento, Faça o que Quiser, Simulação, Corrida, Casual, Protagonista Mulher, Exploração, Retrô, Natureza, Velha-Guarda, Simulador de Vida Real, Colorido, 3D, Aventura, Terceira Pessoa, Um Jogador, Aconchegante"
Insect Worlds,Q2 2026,Indefinido,https://store.steampowered.com/app/1008340/Insect_Worlds/?snr=1_7_7_popularcomingsoon_150_15,"Exploração, Mundo Aberto, Educativo, Natureza, Faça o que Quiser, Simulação, Cooperativo, Para Toda a Família, Jogo de Cartas, Coleção de Criaturas, Luta Espetacular, Realístico, Atmosférico, Aventura, Ficção Interativa, Jogador x Jogador (PvP), Ação / Aventura, Simulador de Colônias, Sobrevivência, Editor de Níveis"
Redemption of the Damned,Q2 2026,Indefinido,https://store.steampowered.com/app/1620420/Redemption_of_the_Damned/?snr=1_7_7_popularcomingsoon_150_15,"Terror, Atmosférico, Terror de Sobrevivência, Tiro em Primeira Pessoa (FPS), Um Jogador, Sombrio, Sobrevivência, Primeira Pessoa, Morte Permanente, Medieval, Mitologia, Vampiros, Tiro, Ação, Aventura, Indie, Terror Psicológico"
Robo Frenzy,Q2 2026,Indefinido,https://store.steampowered.com/app/2324550/Robo_Frenzy/?snr=1_7_7_popularcomingsoon_150_15,"Duelo contra Chefões, Coleção de Criaturas, Faça o que Quiser, Hack and Slash, Personalização de Personagem, Porradaria, Robôs, Jogador X Ambiente (PvE), Desenhado à Mão, 2D, História em Quadrinhos, Engraçado, Ação, Colorido, Estilizado, Fabricação, Desenho Animado, Anos 90, Um Jogador, Combate"
TIC-TAC: Twelve o'clock,Q2 2026,Indefinido,https://store.steampowered.com/app/1490020/TICTAC_Twelve_oclock/?snr=1_7_7_popularcomingsoon_150_15,"Estratégia, Terror, Ação, Indie, Sombrio, Atmosférico, Primeira Pessoa, Terror de Sobrevivência, Aventura, Sobrevivência, 3D, Demônios, Sobrenatural, Um Jogador, Boa Trama, Ação / Aventura, Jogador X Ambiente (PvE), Multijogador, Tiro, Crime"
Not Only Nine,Q2 2026,Indefinido,https://store.steampowered.com/app/2377160/Not_Only_Nine/?snr=1_7_7_popularcomingsoon_150_15,"Romance Visual, Comovente, Simulador de Caminhada, Trilha Sonora, Boa Trama, Atmosférico, Retrô, Gatos, Enredo Rico, Anime, JRPG, RPG, Ficção Científica, Aconchegante, Combate em Turnos, Do Bem, Comédia, Eventos Rápidos, Relaxante, Você Decide"
