title,release_date,price,game_url,genres
ELDRIMAR,2025,Indefinido,https://store.steampowered.com/app/2349420/ELDRIMAR/?snr=1_7_7_popularcomingsoon_150_21,"Acesso Antecipado, Boa Trama, Soulslike, Enredo Rico, Fantasia Sombria, Sombrio, Fantasia, RPG de Ação, Atmosférico, Primeira Pessoa, Aventura, RPG, Demônios, Mundo Aberto, Mágica, CRPG, Ação / Aventura, Ação, Medieval, Zumbis"
Primal Planet,2025,Indefinido,https://store.steampowered.com/app/2350270/Primal_Planet/?snr=1_7_7_popularcomingsoon_150_21,"Boa Trama, Metroidvania, Plataforma 2D, Ação / Aventura, Gráficos Pixelados, Plataforma, Câmera Lateral, Cooperativo Local, Exploração, Cooperativo, Aventura, Dinossauros, Combate, 2D, Natureza, Atmosférico, Para Toda a Família, Fabricação, Comovente, Controle"
DRIFT ISLAND,2025,Indefinido,https://store.steampowered.com/app/2353690/DRIFT_ISLAND/?snr=1_7_7_popularcomingsoon_150_21,"Corrida, Simulador Automobilístico, Mundo Aberto, Direção, Multijogador, Física, Simulação, Realístico, Controle, Simulador Imersivo, Jogador x Jogador (PvP), Um Jogador, 3D, Primeira Pessoa, RV"
METRO PENGUIN EUTOPIA,2025,Indefinido,https://store.steampowered.com/app/2364190/METRO_PENGUIN_EUTOPIA/?snr=1_7_7_popularcomingsoon_150_21,"RPG, Aventura, RPG de Estratégia, 2D, Comédia, Pós-Apocalíptico, Subterrâneo, Atmosférico, Combate em Turnos, Vários Finais, Protagonista Mulher, Boa Trama, Você Decide, Um Jogador, Indie, Tática por Turnos, Exploração, Escolha a sua Aventura"
Lumines Arise,2025,Indefinido,https://store.steampowered.com/app/2370000/Lumines_Arise/?snr=1_7_7_popularcomingsoon_150_21,"Casual, Arcade, Quebra-Cabeça, Combinar 3, 3D, Abstrato, Psicodélico, Estilizado, RV, Comovente, Lógica, Surrealista, Jogador x Jogador (PvP), Controle, Pontos, Pontos, Pontos!, Multijogador, Um Jogador, Multijogador Local"
Neo Junk City,Q4 2025,Indefinido,https://store.steampowered.com/app/2378230/Neo_Junk_City/?snr=1_7_7_popularcomingsoon_150_21,"Apontar e Clicar, JRPG, RPG, CRPG, Ficção Científica, Enredo Rico, Boa Trama, RPG de Ação, Gráficos Pixelados, Explorador de Calabouços, Engraçado, Corrida, Você Decide, RPG Tático, Aventura, Cartunizado, Retrô, Comédia, Colorido, 2D"
Rockbeasts,2025,Indefinido,https://store.steampowered.com/app/1445880/Rockbeasts/?snr=1_7_7_popularcomingsoon_150_22,"RPG, Gerenciamento, Você Decide, Boa Trama, Aventura, Gerenciamento de Recursos, Ficção Interativa, Comédia, Escolha a sua Aventura, Romance Visual, Vários Finais, Anos 90, Rock, Desenho Animado, Personalização de Personagem, Gerenciamento de Inventário, Ritmo, Um Jogador, Simulação, 2D"
Junxions,2025,Indefinido,https://store.steampowered.com/app/1447250/Junxions/?snr=1_7_7_popularcomingsoon_150_22,"Estratégia, Simulação, Construção de Cidades, Construção, Gerenciamento, Faça o que Quiser, Economia, Gerenciamento de Recursos, Compatível com Mods, Realístico, Casual, Mod, Mundo Aberto, Transportes, Um Jogador, Alta Rejogabilidade, Moderno, Tempo Real com Pausa, Para Toda a Família, Engraçado"
Black Gold: Oil Drilling Simulator,2025,Indefinido,https://store.steampowered.com/app/1473260/Black_Gold_Oil_Drilling_Simulator/?snr=1_7_7_popularcomingsoon_150_22,"Ação, Simulação, Economia, Construção, Gerenciamento, Faça o que Quiser, Sobrevivência, Primeira Pessoa, Realístico, Atmosférico, Histórico, Indie, Você Decide, Fabricação, Gerenciamento de Recursos, Um Jogador"
The Inspector,2025,Indefinido,https://store.steampowered.com/app/1482690/The_Inspector/?snr=1_7_7_popularcomingsoon_150_22,"Aventura, Atmosférico, Boa Trama, Simulador de Caminhada, Primeira Pessoa, Aconchegante, Mistério, Um Jogador, Exploração, Comovente, Relaxante, Curta-Metragem, Drama, Estilizado, Para Adultos, Protagonista Mulher, Narração, Mundo Aberto, Colorido, Quebra-Cabeça"
Nivalis,2025,Indefinido,https://store.steampowered.com/app/1488490/Nivalis/?snr=1_7_7_popularcomingsoon_150_22,"Cyberpunk, Simulação, Simulador de Vida Real, Simulador Imersivo, Atmosférico, Gerenciamento, Simulador Rural, Pesca, Relaxante, Culinária, RPG, Romance, Gerenciamento de Inventário, Boa Trama, Gerenciamento de Tempo, Colete Tudo, Gerenciamento de Recursos, Faça o que Quiser, Mundo Aberto, Aventura"
Capital Command,2025,Indefinido,https://store.steampowered.com/app/1490930/Capital_Command/?snr=1_7_7_popularcomingsoon_150_22,"Espacial, Ficção Científica, Estratégia, Simulação, Estratégia em Tempo Real (RTS), Grande Estratégia, 4X, Guerra, Tático, Faça o que Quiser, Militar, Exploração, Compatível com Mods, Gerenciamento, Um Jogador, Futurista, Tempo Real com Pausa, Alta Rejogabilidade, Geração Procedural, Atmosférico"
Forgotten Fragments,2025,Indefinido,https://store.steampowered.com/app/1492090/Forgotten_Fragments/?snr=1_7_7_popularcomingsoon_150_22,"Plataforma com Quebra-Cabeça, Cooperativo Local, Gráficos Pixelados, Aventura, Fantasia, Indie, 2D, Campanha Cooperativa, Quebra-Cabeça, Plataforma, Plataforma 2D, Protagonista Mulher, Retrô, Ação, Multijogador Local, Cooperativo, Multijogador, Um Jogador, Plataforma de Precisão, Física"
Eastern Tactics,2025,Indefinido,https://store.steampowered.com/app/1497910/Eastern_Tactics/?snr=1_7_7_popularcomingsoon_150_22,"Estratégia, RPG, Estratégia em Turnos, Tática por Turnos, RPG Tático, JRPG, RPG de Estratégia, Boa Trama, Indie, História Alternativa, Você Decide, Enredo Rico, Tático, Combate em Turnos, Estilizado, Anime, Drama, Retrô, Velha-Guarda, Um Jogador"
Liegecraft,2025,Indefinido,https://store.steampowered.com/app/1503170/Liegecraft/?snr=1_7_7_popularcomingsoon_150_22,"Acesso Antecipado, RPG, Estratégia em Turnos, Medieval, Faça o que Quiser, 4X, Boa Trama, Você Decide, RPG de Estratégia, Estratégia, História Alternativa, Combate em Turnos, Diplomacia, Economia, Gerenciamento, Grade Hexagonal, Um Jogador, Visão Superior, Em Turnos, Estilizado"
Agent 64: Spies Never Die,2025,Indefinido,https://store.steampowered.com/app/1574480/Agent_64_Spies_Never_Die/?snr=1_7_7_popularcomingsoon_150_22,"Tiro em Primeira Pessoa (FPS), Retrô, Exploração, Conspiração, Tiro de Tiozão, Tela Dividida, Velha-Guarda, Anos 90, Furtivo, Hacker, Assalto, Ação, Tiro, Multijogador Local, Cooperativo Local, Primeira Pessoa, Linear, Um Jogador, Ação / Aventura, Aventura"
Bittersweet Birthday,2025,Indefinido,https://store.steampowered.com/app/1581100/Bittersweet_Birthday/?snr=1_7_7_popularcomingsoon_150_22,"Boa Trama, Difícil, Atmosférico, Ação, Gráficos Pixelados, Aventura, Colorido, Terror Psicológico, Soulslike, 2D, Controle, Um Jogador, Ação / Aventura, RPG de Ação"
Beneath,2025,Indefinido,https://store.steampowered.com/app/1593230/Beneath/?snr=1_7_7_popularcomingsoon_150_22,"Personalização de Armas, Terror, Terror de Sobrevivência, Tiro, Terror Psicológico, Ação / Aventura, Aventura, Combate, Tiro em Primeira Pessoa (FPS), Violência Detalhada, Violento, Atmosférico, Ação, Sombrio, Boa Trama, Um Jogador, Lovecraftiano, Controle, Cinematográfico, Primeira Pessoa"
Silly Polly Beast,2025,Indefinido,https://store.steampowered.com/app/1598780/Silly_Polly_Beast/?snr=1_7_7_popularcomingsoon_150_22,"Combate, Terror de Sobrevivência, Protagonista Mulher, Boa Trama, Demônios, Tiro, Anime, Sombrio, Um Jogador, Luta Espetacular, SHMUP com Visão Superior, Ação / Aventura, Estilizado, Drama, Aventura, 3D, Ação, Atmosférico, Terror, Violência Detalhada"
Wagotabi: A Japanese Journey,2025,Indefinido,https://store.steampowered.com/app/2701720/Wagotabi_A_Japanese_Journey/?snr=1_7_7_popularcomingsoon_150_22,"Educativo, Estrangeiro, Digitação, Exploração, Anime, RPG, JRPG, Conversas, Casual, Simulador Imersivo, Aventura, Alta Rejogabilidade, Fofo, Imersivo, Boa Trama, Colorido, Um Jogador, Relaxante, Simulação, Quebra-Cabeça"
THRASHER,2025,Indefinido,https://store.steampowered.com/app/2702300/THRASHER/?snr=1_7_7_popularcomingsoon_150_22,"Ação, Corrida, Arcade, Psicodélico, Atmosférico, Corredor, Sombrio, RV, 3D, Corrida com Combate, Ação / Aventura, Ficção Científica, Colorido, Estilizado, Fantasia Sombria, Fantasia, Terror, Surrealista, Sobrevivência, Um Jogador"
ALL WILL FALL: Physics-Based Survival City Builder,2025,Indefinido,https://store.steampowered.com/app/2706020/ALL_WILL_FALL_PhysicsBased_Survival_City_Builder/?snr=1_7_7_popularcomingsoon_150_22,"Simulação, Simulador de Colônias, Física, Alta Rejogabilidade, Construção de Bases, Faça o que Quiser, Gerenciamento, Sobrevivência em Mundo Aberto, Sobrevivência, Estratégia, Um Jogador, Automação, Construção, Gerenciamento de Recursos, Pós-Apocalíptico, Construção de Cidades, Atmosférico, Economia, Político, 3D"
Whirlight - No Time To Trip,2025,Indefinido,https://store.steampowered.com/app/2706980/Whirlight__No_Time_To_Trip/?snr=1_7_7_popularcomingsoon_150_22,"Aventura, Casual, Apontar e Clicar, Anos 90, Comédia, Surrealista, Cartunizado, Colorido, Engraçado, 2D, Para Toda a Família, Quebra-Cabeça, Boa Trama, Retrô, Atmosférico, Viagem no Tempo, Desenho Animado, Um Jogador, Ficção Científica, Protagonista Mulher"
Delverium,2025,Indefinido,https://store.steampowered.com/app/2710040/Delverium/?snr=1_7_7_popularcomingsoon_150_22,"Sobrevivência em Mundo Aberto, Sobrevivência, Simulador Rural, Faça o que Quiser, Aventura, Multijogador, Geração Procedural, Gráficos Pixelados, Fabricação, Construção, Exploração, Mundo Aberto, Cooperativo, Cooperativo On-line, 2D, RPG, Um Jogador, Cooperativo Local, Ação, Atmosférico"
Star Birds,2025,Indefinido,https://store.steampowered.com/app/2719750/Star_Birds/?snr=1_7_7_popularcomingsoon_150_22,"Colorido, Gerenciamento de Recursos, Construção de Bases, Estilizado, Automação, Minimalista, Casual, Construção, Fabricação, Roguelite, Relaxante, Simulação, Gerenciamento, Espacial, Ciência, Construção de Cidades, Colete Tudo, 3D, Estratégia, Um Jogador"
Grand Emprise 2: Portals Apart,2025,Indefinido,https://store.steampowered.com/app/2722610/Grand_Emprise_2_Portals_Apart/?snr=1_7_7_popularcomingsoon_150_22,"Aventura, Fabricação, Sobrevivência, Sobrevivência em Mundo Aberto, Ação / Aventura, Soulslike, RPG, Exploração, Construção de Bases, Mundo Aberto, Automação, Gerenciamento de Recursos, Ação, Fantasia, Linear, Jogador X Ambiente (PvE), Um Jogador, Simulação, Combate, Sequência"
EVERYBODY'S GOLF HOT SHOTS,2025,Indefinido,https://store.steampowered.com/app/2730810/EVERYBODYS_GOLF_HOT_SHOTS/?snr=1_7_7_popularcomingsoon_150_22,"Esportes, 3D, Golfe, Um Jogador, Multijogador"
Edge of Memories,Q4 2025,Indefinido,https://store.steampowered.com/app/2738170/Edge_of_Memories/?snr=1_7_7_popularcomingsoon_150_22,"RPG, Ação, JRPG, Um Jogador, Boa Trama, Fantasia, Anime, RPG de Ação, Aventura, Terceira Pessoa, 3D, Exploração, Protagonista Mulher, Comovente, Atmosférico, Combate, Trilha Sonora"
The House of Tesla,2025,Indefinido,https://store.steampowered.com/app/2738230/The_House_of_Tesla/?snr=1_7_7_popularcomingsoon_150_22,"Aventura, Quebra-Cabeça, Apontar e Clicar, Estratégia, Objetos Ocultos, Grande Estratégia, Clique e Clique, Exploração, 3D, Primeira Pessoa, Detetive, Drama, Mistério, Para Toda a Família, Retrô, Mágica, Lógica, Um Jogador, Boa Trama, Indie"
Mecha Simultactics,2025,Free,https://store.steampowered.com/app/2738660/Mecha_Simultactics/?snr=1_7_7_popularcomingsoon_150_22,"Tática por Turnos, Estratégia, Jogador x Jogador (PvP), Mechas, Estratégia em Turnos, Simulação, Luta Espetacular, Faça o que Quiser, Gráficos Pixelados, Competitivo, Isométrico, Multijogador, Anime, Movimento em Grade, Ação, Combate, Combate em Turnos, Luta 3D, Luta 2D, Cinematográfico"
The Transylvania Adventure of Simon Quest,2025,Indefinido,https://store.steampowered.com/app/2749920/The_Transylvania_Adventure_of_Simon_Quest/?snr=1_7_7_popularcomingsoon_150_22,"Ação, Aventura, RPG de Ação, Ação / Aventura, Plataforma, Metroidvania, Plataforma 2D, Câmera Lateral, 2D, Gráficos Pixelados, Anos 90, Humor Pesado, Demônios, Cachorros, Gótico, Terror, Velha-Guarda, Retrô, Controle, Vários Finais"
GOALS,2025,Free,https://store.steampowered.com/app/2753000/GOALS/?snr=1_7_7_popularcomingsoon_150_22,"Esportes, Gratuito para Jogar, Futebol, eSports, Multijogador, Competitivo, Jogador x Jogador (PvP), Tático, Gerenciamento, Protagonista Mulher, 3D, Realístico, Estilizado, Personalização de Personagem, Para Toda a Família, Baseado em Equipes, Controle, Gerenciamento de Inventário, Geração Procedural, Um Jogador"
Vikings Dynasty,2025,Indefinido,https://store.steampowered.com/app/2753930/Vikings_Dynasty/?snr=1_7_7_popularcomingsoon_150_22,"Ação, Aventura, RPG, Simulação, Vikings, Faça o que Quiser, Mundo Aberto, Exploração, Sobrevivência, Simulador Imersivo, Construção de Bases, 3D, Primeira Pessoa, Realístico, Terceira Pessoa, Atmosférico, Construção, Medieval, Gerenciamento, Fabricação"
MARVEL Cosmic Invasion,2025,Indefinido,https://store.steampowered.com/app/2753970/MARVEL_Cosmic_Invasion/?snr=1_7_7_popularcomingsoon_150_22,"Porradaria, Arcade, Super-Heróis, Gráficos Pixelados, Cooperativo, Câmera Lateral, Retrô, Ação / Aventura, História em Quadrinhos, Ação, 2D, Casual, Colorido, Para Toda a Família, Anos 90, Cooperativo Local, Cooperativo On-line, Multijogador, Multijogador Local, Aventura"
Aces of Thunder,2025,Indefinido,https://store.steampowered.com/app/2754090/Aces_of_Thunder/?snr=1_7_7_popularcomingsoon_150_22,"Simulação, RV, Ação, Voo, Combate, 3D, Primeira Pessoa, Realístico, Histórico, Militar, Segunda Guerra Mundial, Guerra, Jogador x Jogador (PvP), Cooperativo, Multijogador, Cooperativo On-line, Um Jogador, Tiro"
Mars Attracts,2025,Indefinido,https://store.steampowered.com/app/2760580/Mars_Attracts/?snr=1_7_7_popularcomingsoon_150_22,"Acesso Antecipado, Simulação, Casual, Construção, Faça o que Quiser, Construção de Cidades, Estratégia, Gerenciamento, Gerenciamento de Recursos, Gerenciamento de Tempo, Construção de Bases, Jogo de Divindade, Engraçado, Simulador de Colônias, Cartunizado, Economia, Relaxante, Capitalismo, Humor Ácido, Comédia"
SCP,2025,Free,https://store.steampowered.com/app/2768300/SCP/?snr=1_7_7_popularcomingsoon_150_22,"Terror de Sobrevivência, Ação, Multijogador, Aventura, Casual, Um Jogador, RPG de Ação, Tiro, Terror Psicológico, Ação / Aventura, Tiro com Saques, Jogador X Ambiente (PvE), Tiro em Terceira Pessoa, Realístico, Boa Trama, Sombrio, RPG, Faça o que Quiser, Tiro em Primeira Pessoa (FPS), Exploração"
PANZERKAMPF®,2025,Free,https://store.steampowered.com/app/2771910/PANZERKAMPF/?snr=1_7_7_popularcomingsoon_150_22,"Estratégia, Ação, Gratuito para Jogar, Multijogador Massivo, Tanques, Segunda Guerra Mundial, Guerra, Tático, Tiro, Jogador x Jogador (PvP), Tiro em Terceira Pessoa, Primeira Pessoa, Guerra Fria, Histórico, Você Decide, Jogador X Ambiente (PvE), Física"
Moves Of The Diamond Hand,2025,Indefinido,https://store.steampowered.com/app/2778210/Moves_Of_The_Diamond_Hand/?snr=1_7_7_popularcomingsoon_150_22,"Acesso Antecipado, RPG, Aventura, CRPG, Dados, RPG de Estratégia, Ficção Interativa, Primeira Pessoa, Atmosférico, Mistério, Estilizado, Exploração, Simulador Imersivo, Noir, Psicodélico, Distópico, Conspiração, Cyberpunk, Jogo de Tabuleiro, Enredo Rico"
PIGGY ONE SUPER SPARK,2025,Indefinido,https://store.steampowered.com/app/2780230/PIGGY_ONE_SUPER_SPARK/?snr=1_7_7_popularcomingsoon_150_22,"Gráficos Pixelados, Ação, Boa Trama, Plataforma 2D, Anime, Câmera Lateral, Indie, Aventura, Plataforma, Ação / Aventura, 2D, Fofo, Cyberpunk, Protagonista Mulher, Anos 90, Um Jogador, Ficção Científica, Linear, Pós-Apocalíptico, Futurista"
Infinity Knights: Xross,December 2025,Indefinido,https://store.steampowered.com/app/2784920/Infinity_Knights_Xross/?snr=1_7_7_popularcomingsoon_150_22,"Campanha Cooperativa, Boa Trama, Exploração, Hack and Slash, Explorador de Calabouços, 2,5D, Jogador X Ambiente (PvE), RPG, JRPG, Ação / Aventura, Tela Dividida, Visão Superior, Dragões, Engraçado, Controle, Não Linear, Baseado em Equipes, Ação, Manipulação de Tempo, Gráficos Pixelados"
SWAPMEAT,2025,Indefinido,https://store.steampowered.com/app/2790700/SWAPMEAT/?snr=1_7_7_popularcomingsoon_150_22,"Roguelike de Ação, Cooperativo, Ação, Tiro em Terceira Pessoa, Multijogador, Roguelite, Terceira Pessoa, Jogador X Ambiente (PvE), Ficção Científica, Tiro, Espacial, Roguelike, Engraçado, Humor Ácido, Saques, 3D, Futurista, Colorido, Comédia, Cyberpunk"
The Midnight Walkers,Q4 2025,Indefinido,https://store.steampowered.com/app/2795540/The_Midnight_Walkers/?snr=1_7_7_popularcomingsoon_150_22,"Indie, Zumbis, Terror, Tiro de Extração, Pós-Apocalíptico, Explorador de Calabouços, Tiro em Primeira Pessoa (FPS), Ação, RPG, RPG de Ação, Baseado em Equipes, Jogador x Jogador (PvP), Jogador X Ambiente (PvE), Cooperativo On-line, Multijogador, Um Jogador, Tiro, Primeira Pessoa, Sombrio, Realístico"
Thief VR: Legacy of shadow,2025,Indefinido,https://store.steampowered.com/app/2800080/Thief_VR_Legacy_of_shadow/?snr=1_7_7_popularcomingsoon_150_22,"Aventura, Ação, Ação / Aventura, Exploração, 3D, Primeira Pessoa, RV, Arco e Flecha, Assassino, Assalto, Investigação, Enredo Rico, Mistério, Furtivo, Seis Graus de Liberdade, Combate, Protagonista Mulher, Boa Trama, Um Jogador, Conspiração"
PAGER,2025,Indefinido,https://store.steampowered.com/app/2810550/PAGER/?snr=1_7_7_popularcomingsoon_150_22,"Terror Psicológico, Terror, Simulador de Caminhada, Primeira Pessoa, Exploração, Quebra-Cabeça, 3D, Simulador Imersivo, Surrealista, Atmosférico, Humor Ácido, Simulação, Psicológico, Filosófico, Aventura, Estilizado, Gráficos Pixelados, Distópico, Lógica, Você Decide"
Aquapark Tycoon,2025,Indefinido,https://store.steampowered.com/app/2819470/Aquapark_Tycoon/?snr=1_7_7_popularcomingsoon_150_22,"Simulação, Construção, Faça o que Quiser, Gerenciamento, Para Toda a Família, Relaxante, Economia, Construção de Cidades, Gerenciamento de Tempo, Cartunizado, Colorido, Gerenciamento de Recursos, Jogo de Divindade, Fofo, 3D, Editor de Níveis, Simulador Imersivo, Estilizado, Capitalismo, Cooperativo"
Weeny Wise,2025,Indefinido,https://store.steampowered.com/app/2820270/Weeny_Wise/?snr=1_7_7_popularcomingsoon_150_22,"Aventura, Cooperativo, Plataforma com Quebra-Cabeça, Tela Dividida, Atmosférico, Campanha Cooperativa, Cooperativo Local, Boa Trama, Cooperativo On-line, Fantasia, Exploração, Multijogador, Multijogador Local, Enredo Rico, Protagonista Mulher, Plataforma, Furtivo, Mágica, 2,5D, Estilizado"
A Gentlemen's Dispute,2025,Indefinido,https://store.steampowered.com/app/2820700/A_Gentlemens_Dispute/?snr=1_7_7_popularcomingsoon_150_22,"Ação, Multijogador, Casual, Engraçado, Luta, Em Grupos, Física, Destruição, Combate, Comédia, Jogador x Jogador (PvP), Terceira Pessoa, Montagem de Decks, Cartunizado, Colorido, Reúna a Galera, Estratégia, Arcade, Multijogador Local, Para Toda a Família"
Category 6,2025,Indefinido,https://store.steampowered.com/app/2823820/Category_6/?snr=1_7_7_popularcomingsoon_150_22,"Sobrevivência em Mundo Aberto, Sobrevivência, Fabricação, Exploração, Mundo Aberto, Terror de Sobrevivência, Construção, Aventura, Pós-Apocalíptico, Atmosférico, Faça o que Quiser, Primeira Pessoa, Ação / Aventura, Pesca, Ação, RPG, Um Jogador, Morte Permanente, Natureza, Estilizado"
黑巢：蛇之契约,2025,Indefinido,https://store.steampowered.com/app/2825330/_/?snr=1_7_7_popularcomingsoon_150_22,"RPG, Anime, 2D, Casual, Simulador de Encontros, Boa Trama, Fofo, Simulador de Vida Real, Aventura, Ficção Interativa, Humor Ácido, Cartas, JRPG, Batalha com Cartas, Tática por Turnos, Gerenciamento de Tempo, Medieval, Fantasia Sombria, Fantasia, Distópico"
The Relic: First Guardian,2025,Indefinido,https://store.steampowered.com/app/2827820/The_Relic_First_Guardian/?snr=1_7_7_popularcomingsoon_150_22,"RPG, Fantasia Sombria, Soulslike, 3D, Terceira Pessoa, RPG de Ação, Cinematográfico, Espada, Combate, Exploração, Ação / Aventura, Ação, Hack and Slash, Fantasia, Aventura, Mitologia, Um Jogador, Violento"
House Builder 2,2025,Indefinido,https://store.steampowered.com/app/2827960/House_Builder_2/?snr=1_7_7_popularcomingsoon_150_22,"Simulação, Casual, Construção, Cooperativo On-line, Primeira Pessoa, Multijogador, Faça o que Quiser, Simulador Imersivo, Design e Ilustração, Relaxante, Cooperativo, Um Jogador, Indie, Economia, Educativo, Para Toda a Família, 3D, Engraçado, Realístico, Colorido"
MOTORSLICE,2025,Indefinido,https://store.steampowered.com/app/2830030/MOTORSLICE/?snr=1_7_7_popularcomingsoon_150_22,"Parkour, Atmosférico, Ação / Aventura, Anime, Um Jogador, Terceira Pessoa, Protagonista Mulher, Hack and Slash, Pós-Apocalíptico, Ação, Ficção Científica, Plataforma, Estilizado, Robôs, 3D, Combate, Sombrio, Simulador de Encontros, Exploração, Aventura"
Blightstone,2025,Indefinido,https://store.steampowered.com/app/2832280/Blightstone/?snr=1_7_7_popularcomingsoon_150_22,"Fantasia Sombria, Tático, RPG Tático, Tática por Turnos, Roguelite, Em Turnos, Fantasia, Estratégia em Turnos, Roguelike, RPG, Estratégia, Isométrico, 2,5D, Enredo Rico, Pós-Apocalíptico, Você Decide, Atmosférico, Combate, Controle, Não Linear"
Drunken Rogue,2025,Indefinido,https://store.steampowered.com/app/2836990/Drunken_Rogue/?snr=1_7_7_popularcomingsoon_150_22,"RPG, Montagem de Decks, Cartas, Engraçado, Fofo, RPG de Estratégia, Roguelike, Batalha com Cartas, Roguelite, Exploração, 2D, Comédia, Sobrevivência, Fantasia, Vários Finais, Protagonista Mulher, Você Decide, Um Jogador, Indie, Estratégia"
SimplePlanes 2,2025,Indefinido,https://store.steampowered.com/app/2840470/SimplePlanes_2/?snr=1_7_7_popularcomingsoon_150_22,"Simulação, Voo, Construção, Faça o que Quiser, Mundo Aberto, Multijogador, Destruição, Militar, Simulador Automobilístico, Animação e Modelagem, Cooperativo, Tiro, Exploração, Corrida com Combate, Automação, Combate com Veículos, Direção, Programação, Um Jogador, Segunda Guerra Mundial"
Moves Of The Diamond Hand,2025,Indefinido,https://store.steampowered.com/app/2778210/Moves_Of_The_Diamond_Hand/?snr=1_7_7_popularcomingsoon_150_23,"Acesso Antecipado, RPG, Aventura, CRPG, Dados, RPG de Estratégia, Ficção Interativa, Primeira Pessoa, Atmosférico, Mistério, Estilizado, Exploração, Simulador Imersivo, Noir, Psicodélico, Distópico, Conspiração, Cyberpunk, Jogo de Tabuleiro, Enredo Rico"
ピギーワン SUPER SPARK,2025,Indefinido,https://store.steampowered.com/app/2780230/PIGGY_ONE_SUPER_SPARK/?snr=1_7_7_popularcomingsoon_150_23,"Gráficos Pixelados, Ação, Boa Trama, Plataforma 2D, Anime, Câmera Lateral, Indie, Aventura, Plataforma, Ação / Aventura, 2D, Fofo, Cyberpunk, Protagonista Mulher, Anos 90, Um Jogador, Ficção Científica, Linear, Pós-Apocalíptico, Futurista"
Infinity Knights: Xross,dezembro de 2025,Indefinido,https://store.steampowered.com/app/2784920/Infinity_Knights_Xross/?snr=1_7_7_popularcomingsoon_150_23,"Campanha Cooperativa, Boa Trama, Exploração, Hack and Slash, Explorador de Calabouços, 2,5D, Jogador X Ambiente (PvE), RPG, JRPG, Ação / Aventura, Tela Dividida, Visão Superior, Dragões, Engraçado, Controle, Não Linear, Baseado em Equipes, Ação, Manipulação de Tempo, Gráficos Pixelados"
SWAPMEAT,2025,Indefinido,https://store.steampowered.com/app/2790700/SWAPMEAT/?snr=1_7_7_popularcomingsoon_150_23,"Roguelike de Ação, Cooperativo, Ação, Tiro em Terceira Pessoa, Multijogador, Roguelite, Terceira Pessoa, Jogador X Ambiente (PvE), Ficção Científica, Tiro, Espacial, Roguelike, Engraçado, Humor Ácido, Saques, 3D, Futurista, Colorido, Comédia, Cyberpunk"
The Midnight Walkers,4º trimestre de 2025,Indefinido,https://store.steampowered.com/app/2795540/The_Midnight_Walkers/?snr=1_7_7_popularcomingsoon_150_23,"Indie, Zumbis, Terror, Tiro de Extração, Pós-Apocalíptico, Explorador de Calabouços, Tiro em Primeira Pessoa (FPS), Ação, RPG, RPG de Ação, Baseado em Equipes, Jogador x Jogador (PvP), Jogador X Ambiente (PvE), Cooperativo On-line, Multijogador, Um Jogador, Tiro, Primeira Pessoa, Sombrio, Realístico"
Thief VR: Legacy of shadow,2025,Indefinido,https://store.steampowered.com/app/2800080/Thief_VR_Legacy_of_shadow/?snr=1_7_7_popularcomingsoon_150_23,"Aventura, Ação, Ação / Aventura, Exploração, 3D, Primeira Pessoa, RV, Arco e Flecha, Assassino, Assalto, Investigação, Enredo Rico, Mistério, Furtivo, Seis Graus de Liberdade, Combate, Protagonista Mulher, Boa Trama, Um Jogador, Conspiração"
PAGER,2025,Indefinido,https://store.steampowered.com/app/2810550/PAGER/?snr=1_7_7_popularcomingsoon_150_23,"Terror Psicológico, Terror, Simulador de Caminhada, Primeira Pessoa, Exploração, Quebra-Cabeça, 3D, Simulador Imersivo, Surrealista, Atmosférico, Humor Ácido, Simulação, Psicológico, Filosófico, Aventura, Estilizado, Gráficos Pixelados, Distópico, Lógica, Você Decide"
Aquapark Tycoon,2025,Indefinido,https://store.steampowered.com/app/2819470/Aquapark_Tycoon/?snr=1_7_7_popularcomingsoon_150_23,"Simulação, Construção, Faça o que Quiser, Gerenciamento, Para Toda a Família, Relaxante, Economia, Construção de Cidades, Gerenciamento de Tempo, Cartunizado, Colorido, Gerenciamento de Recursos, Jogo de Divindade, Fofo, 3D, Editor de Níveis, Simulador Imersivo, Estilizado, Capitalismo, Cooperativo"
