title,release_date,price,game_url,genres
World of Magic: Rise of Magic,December 2025,Indefinido,https://store.steampowered.com/app/3004280/World_of_Magic_Rise_of_Magic/?snr=1_7_7_popularcomingsoon_150_13,"RPG, Mundo Aberto, Medieval, Boa Trama, Você Decide, Mágica, RPG de Ação, Terceira Pessoa, Ação / Aventura, Ação, Tiro de Heróis, Tiro em Terceira Pessoa, JRPG, Terror, Um Jogador, Guerra, Fabricação, Aventura, Sombrio, Enredo Rico"
Isekai Adventurer Guild,Q4 2025,Indefinido,https://store.steampowered.com/app/3614160/Isekai_Adventurer_Guild/?snr=1_7_7_popularcomingsoon_150_14,"Estratégia, Aventura, Simulação, Estratégia em Turnos, RPG de Estratégia, Roguelike, RPG de Grupos, JRPG, Plataforma 2D, Roguelite, Explorador de Calabouços, 2D, Isométrico, Gráficos Pixelados, Fofo, Anime, Medieval, Fantasia, Mágica, Jogador X Ambiente (PvE)"
Brush Burial: Gutter World,Q4 2025,Indefinido,https://store.steampowered.com/app/3594120/Brush_Burial_Gutter_World/?snr=1_7_7_popularcomingsoon_150_14,"Simulador Imersivo, Assassino, Artes Marciais, Crime, Gótico, Tiro de Tiozão, Parkour, Tiro, Exploração, Fofo, Atmosférico, Assalto, Furtivo, LGBTQIA+, Protagonista Mulher, Porradaria, Fantasia Sombria, Tiro em Primeira Pessoa (FPS), Primeira Pessoa, Gráficos Pixelados"
Pacific Drive: Whispers in the Woods,2025,Indefinido,https://store.steampowered.com/app/3594760/Pacific_Drive_Whispers_in_the_Woods/?snr=1_7_7_popularcomingsoon_150_14,"Indie, Ação, Aventura, Simulação, Corrida, Terror"
Steel Artery: Train City Builder,Q4 2025,Indefinido,https://store.steampowered.com/app/3602030/Steel_Artery_Train_City_Builder/?snr=1_7_7_popularcomingsoon_150_14,"Construção de Cidades, Simulador de Colônias, Trens, Construção de Bases, Gerenciamento de Recursos, Gráficos Pixelados, Estratégia, Gerenciamento, 2D, Fantasia, Construção, Simulação, Steampunk, Economia, Atmosférico, Um Jogador, Manipulação de Tempo, Indie, Sobrevivência, Faça o que Quiser"
Leaf Blower Co.,2025,Indefinido,https://store.steampowered.com/app/3571710/Leaf_Blower_Co/?snr=1_7_7_popularcomingsoon_150_14,"Casual, Simulação, Relaxante, Um Jogador, Simulador Imersivo, 3D, Colorido, Primeira Pessoa, Terceira Pessoa, Indie, Atmosférico, Para Toda a Família, Física, Simulador de Vida Real"
Toy Smash Kaboom!,2025,Indefinido,https://store.steampowered.com/app/3573070/Toy_Smash_Kaboom/?snr=1_7_7_popularcomingsoon_150_14,"Batalha Automática, Multijogador Assíncrono, Montagem de Decks Roguelike, Gerenciamento de Inventário, Estratégia, Jogador x Jogador (PvP), Desenho Animado, Anime, Indie, Roguelike, Roguelite, Um Jogador, Multijogador, LEGO, Casual, Batalha com Cartas, Engraçado, Jogo de Mesa, Cartas, Colorido"
Valkyrie Iteration: Mecha Pilot Raising Pocket Simulator,2025,Indefinido,https://store.steampowered.com/app/3466240/Valkyrie_Iteration_Mecha_Pilot_Raising_Pocket_Simulator/?snr=1_7_7_popularcomingsoon_150_14,"Simulação, Aventura, Gerenciamento de Tempo, Romance Visual, Anime, Gráficos Pixelados, Mechas, Atmosférico, Sombrio, Ficção Científica, Psicológico, Retrô, Guerra, Romance, Futurista, Pós-Apocalíptico, Você Decide, Vários Finais, Roguelite, Simulador de Vida Real"
Mike goes on hike,Q4 2025,Indefinido,https://store.steampowered.com/app/912000/Mike_goes_on_hike/?snr=1_7_7_popularcomingsoon_150_14,"Simulação, Aventura, Simulador de Caminhada, Sobrevivência, Exploração, Atmosférico, Um Jogador, Relaxante, Primeira Pessoa, Para Toda a Família, Boa Trama, Estilizado, Comovente, Comédia, Linear, Vários Finais, Você Decide, Multijogador, Cooperativo, Indie"
The Way of Wrath,2025,Indefinido,https://store.steampowered.com/app/969330/The_Way_of_Wrath/?snr=1_7_7_popularcomingsoon_150_14,"RPG, Personalização de Personagem, Você Decide, Boa Trama, Combate em Turnos, Dungeons & Dragons, CRPG, Aventura, Romance, Fantasia, Estratégia, Estratégia em Turnos, Mundo Aberto, Fantasia Sombria, Um Jogador, Campanha Cooperativa, Baseado em Classes, RPG de Estratégia, Combate, RPG de Grupos"
ALARA Prime,2025,Free,https://store.steampowered.com/app/971700/ALARA_Prime/?snr=1_7_7_popularcomingsoon_150_14,"Tiro em Primeira Pessoa (FPS), Tiro em Arena, Jogador x Jogador (PvP), Primeira Pessoa, Competitivo, Gratuito para Jogar, Multijogador, Tático, Tiro, Baseado em Equipes, Ação, Ficção Científica, Realístico, Futurista, Combate, 3D, Furtivo, Violento, Controle, Cyberpunk"
Dark Deception Chapter 5,2025,Indefinido,https://store.steampowered.com/app/1019932/Dark_Deception_Chapter_5/?snr=1_7_7_popularcomingsoon_150_14,"Ação, Aventura, Indie, RPG, Terror, Terror de Sobrevivência"
Lunars,Q4 2025,Indefinido,https://store.steampowered.com/app/1031080/Lunars/?snr=1_7_7_popularcomingsoon_150_14,"Em Grupos, Multijogador, Multijogador Local, Jogador x Jogador (PvP), Colorido, Reúna a Galera, Ação, Para Toda a Família, Plataforma, Local para 4 Jogadores, Colete Tudo, Corrida, Battle Royale, Ritmo, Plataforma 3D, Gatos, Dragões, Você Decide, Controle, Tática por Turnos"
FortressCraft : Phoenix,Q4 2025,Indefinido,https://store.steampowered.com/app/1038080/FortressCraft__Phoenix/?snr=1_7_7_popularcomingsoon_150_14,"Acesso Antecipado, Estratégia, Simulador de Colônias, Faça o que Quiser, 3D, Colorido, Primeira Pessoa, Voxel, Atmosférico, Construção, Fabricação, Fantasia, Futurista, Relaxante, Ficção Científica, Espacial, Automação, Construção de Bases, Personalização de Personagem, Compatível com Mods"
'83,Q4 2025,Indefinido,https://store.steampowered.com/app/1059220/83/?snr=1_7_7_popularcomingsoon_150_14,"Ação, Guerra Fria, Violento, Violência Detalhada, Simulação, Tiro em Primeira Pessoa (FPS), Estratégia, Multijogador Massivo, Realístico, Acesso Antecipado, Guerra, Tiro, Primeira Pessoa, Militar, Tático, História Alternativa, Multijogador"
Pax Autocratica,4º trimestre de 2025,Indefinido,https://store.steampowered.com/app/1067360/Pax_Autocratica/?snr=1_7_7_popularcomingsoon_150_14,"Ação / Aventura, RPG de Ação, Simulador Político, Simulador de Colônias, Roguelite, Construção de Bases, Militar, Estratégia, Humor Ácido, Mechas, Roguelike de Ação, 3D, Alienígenas, Jogador X Ambiente (PvE), Um Jogador, Ação, Primeira Pessoa, Simulador Espacial, Faça o que Quiser, Exploração"
DRACU-RIOT!,Q4 2025,Indefinido,https://store.steampowered.com/app/1340140/DRACURIOT/?snr=1_7_7_popularcomingsoon_150_14,"Romance Visual, Anime, Boa Trama, Romance, Vampiros, Colorido, Comédia, Vários Finais, Drama, Comovente, Fantasia, Engraçado, Você Decide, Fofo, Aventura, Um Jogador, Escolha a sua Aventura"
Detained: Too Good for School,2025,Indefinido,https://store.steampowered.com/app/1394650/Detained_Too_Good_for_School/?snr=1_7_7_popularcomingsoon_150_14,"Ação, Porradaria, RPG de Ação, Protagonista Mulher, Mundo Aberto, Crime, 2D, Desenhado à Mão, Boa Trama, Fofo, Aventura, RPG, Simulação, Indie, Acesso Antecipado, Anime, Um Jogador, Vários Finais, Kickstarter, Financiado Colaborativamente"
Nivalis,2025,Indefinido,https://store.steampowered.com/app/1488490/Nivalis/?snr=1_7_7_popularcomingsoon_150_14,"Cyberpunk, Simulador de Vida Real, Simulação, Simulador Imersivo, Atmosférico, Gerenciamento, Simulador Rural, Pesca, Relaxante, Culinária, RPG, Romance, Gerenciamento de Inventário, Boa Trama, Gerenciamento de Tempo, Colete Tudo, Gerenciamento de Recursos, Faça o que Quiser, Mundo Aberto, Aventura"
Capital Command,2025,Indefinido,https://store.steampowered.com/app/1490930/Capital_Command/?snr=1_7_7_popularcomingsoon_150_14,"Espacial, Ficção Científica, Estratégia, Simulação, Estratégia em Tempo Real (RTS), Grande Estratégia, 4X, Guerra, Tático, Faça o que Quiser, Militar, Exploração, Compatível com Mods, Gerenciamento, Um Jogador, Futurista, Tempo Real com Pausa, Alta Rejogabilidade, Geração Procedural, Atmosférico"
ROUTINE,Q4 2025,Indefinido,https://store.steampowered.com/app/606160/ROUTINE/?snr=1_7_7_popularcomingsoon_150_14,"Um Jogador, Ação, Terror Psicológico, Cyberpunk, Violento, Terror de Sobrevivência, Ficção Científica, Atmosférico, Aventura, Sombrio, Terror, Simulador de Caminhada, Exploração, Primeira Pessoa, Furtivo, Boa Trama, Alienígenas, Quebra-Cabeça, Tiro em Primeira Pessoa (FPS), 3D"
eSports Manager,Q4 2025,Indefinido,https://store.steampowered.com/app/643370/eSports_Manager/?snr=1_7_7_popularcomingsoon_150_14,"eSports, Gerenciamento, Gerenciamento de Recursos, Simulação, Estratégia, Esportes, Tático, Tática por Turnos, Estratégia em Turnos, Compatível com Mods, Um Jogador, Indie, Faça o que Quiser, Acesso Antecipado, Visão Superior, 2D, Baseado em Texto, Ação"
Dark Moon,2025,Indefinido,https://store.steampowered.com/app/1105330/Dark_Moon/?snr=1_7_7_popularcomingsoon_150_14,"Gerenciamento, Construção de Bases, Economia, Simulador de Colônias, Gerenciamento de Recursos, Você Decide, Sombrio, Exploração, Pós-Apocalíptico, Estratégia, Estratégia em Tempo Real (RTS), Sobrevivência, Espacial, Ficção Científica, Um Jogador, Atmosférico, Indie, Simulação, Ritmo Rápido, Arcade"
Dead Static Drive,2025,Indefinido,https://store.steampowered.com/app/1166940/Dead_Static_Drive/?snr=1_7_7_popularcomingsoon_150_14,"Indie, Ação, Aventura, Violento, Lovecraftiano, 3D, Sobrenatural, Isométrico, Terror de Sobrevivência, Controle, Protagonista Mulher, RPG de Ação, CRPG, Colorido, Fantasia Sombria, Demônios, Personalização de Personagem, Você Decide, RPG, Roguelike"
I Am Jesus Christ,4º trimestre de 2025,Indefinido,https://store.steampowered.com/app/1198970/I_Am_Jesus_Christ/?snr=1_7_7_popularcomingsoon_150_14,"Simulação, Aventura, Indie, Casual, Ação, Ficção Interativa, Histórico, Realístico, Primeira Pessoa, Mundo Aberto, Um Jogador, Atmosférico, Boa Trama, Relaxante, Jogo de Divindade, Ação / Aventura, Fé, Simulador de Vida Real, Exploração, Simulador Imersivo"
Skate Story,2025,Indefinido,https://store.steampowered.com/app/1263240/Skate_Story/?snr=1_7_7_popularcomingsoon_150_14,"Indie, Aventura, Ação, Esportes, RPG, Skate, Atmosférico"
Dark Fracture,2025,Indefinido,https://store.steampowered.com/app/1268790/Dark_Fracture/?snr=1_7_7_popularcomingsoon_150_14,"Terror, Terror Psicológico, Indie, Aventura, Ação, Thriller, Lovecraftiano, Terror de Sobrevivência, Primeira Pessoa, Exploração, Sombrio, Atmosférico, Simulador de Caminhada, Psicológico, Sobrenatural, Simulação, Surrealista, Ação / Aventura, Violência Detalhada, Demônios"
Gecko Gods,Q4 2025,Indefinido,https://store.steampowered.com/app/1290760/Gecko_Gods/?snr=1_7_7_popularcomingsoon_150_14,"Ação, Aventura, Plataforma, Plataforma com Quebra-Cabeça, Indie, 3D, Estilizado, Atmosférico, Histórico, Natureza, Mistério, Mundo Aberto, Plataforma 3D, Um Jogador, Fofo, Quebra-Cabeça, Exploração, Para Toda a Família, Relaxante, Controle"
Everstorm,2025,Free,https://store.steampowered.com/app/1292510/Everstorm/?snr=1_7_7_popularcomingsoon_150_14,"Acesso Antecipado, Tiro de Extração, Battle Royale, MOBA, Roguelite, Explorador de Calabouços, Baseado em Classes, Multijogador, Estratégia, Jogador x Jogador (PvP), Gratuito para Jogar, Roguelike, Roguelike de Ação, Hack and Slash, RPG, Chuva de Balas, Cooperativo On-line, Visão Superior, Saques, Fantasia"
息风谷战略,4º trimestre de 2025,Indefinido,https://store.steampowered.com/app/2646320/WindStop_Strategy/?snr=1_7_7_popularcomingsoon_150_14,"RPG, RPG de Estratégia, Compatível com Mods, Boa Trama, Simulador de Encontros, Estratégia, Um Jogador, Tática por Turnos, Drama, 2,5D, Artes Marciais, 2D, Editor de Níveis, Vários Finais, Personalização de Personagem, Clique e Clique, Desenho Animado, Mistério, Comovente, Estratégia em Turnos"
Dead Weight,4º trimestre de 2025,Indefinido,https://store.steampowered.com/app/2646720/Dead_Weight/?snr=1_7_7_popularcomingsoon_150_14,"Estratégia, Combate em Turnos, RPG, Alta Rejogabilidade, Em Turnos, Estratégia em Turnos, Tático, Gráficos Pixelados, Aventura, Roguelike, Tática por Turnos, Faça o que Quiser, Roguelite, RPG Tático, Um Jogador, Fantasia Sombria, Piratas, Indie, Steampunk, Isométrico"
Shuffle Waifu Cafe,2025,Indefinido,https://store.steampowered.com/app/2649320/Shuffle_Waifu_Cafe/?snr=1_7_7_popularcomingsoon_150_14,"Hentai, Anime, Impróprio para o Local de Trabalho, Conteúdo Sexual, Simulador de Encontros, Casual, Combinar 3, Clique e Clique, Fofo, Relaxante, Culinária, Gerenciamento, Fantasia, Engraçado, Indie, Para Adultos, Protagonista Mulher, 2D, Simulação, Um Jogador"
Responding,2025,Indefinido,https://store.steampowered.com/app/2658040/Responding/?snr=1_7_7_popularcomingsoon_150_14,"Acesso Antecipado, Ação, Aventura, Simulação, Casual, Ação / Aventura, Faça o que Quiser, Crime, Detetive, Tiro, Exploração, Mundo Aberto, Simulador Imersivo, Simulador Médico, Investigação, Primeira Pessoa, Realístico, Terceira Pessoa, Personalização de Personagem, Personalização de Armas"
Runehaven,2025,Indefinido,https://store.steampowered.com/app/2676030/Runehaven/?snr=1_7_7_popularcomingsoon_150_14,"Explorador de Calabouços, Roguelike, Voxel, Mágica, Roguelike de Ação, Roguelite, Jogador X Ambiente (PvE), Calabouço Misterioso, Destruição, RPG, Arco e Flecha, Primeira Pessoa, Subterrâneo, Morte Permanente, Saques, Espada, 3D, Gráficos Pixelados, Medieval, Hack and Slash"
桃源村日志（Halcyon Days at Taoyuan）,2025,Indefinido,https://store.steampowered.com/app/2678830/Halcyon_Days_at_Taoyuan/?snr=1_7_7_popularcomingsoon_150_14,"Simulação, Simulador Rural, Exploração, Coleção de Criaturas, CRPG, Gráficos Pixelados, Indie, Agricultura, Fabricação, Drama, Histórico, Culinária, Casual, RPG, Pesca, Boa Trama, Mundo Aberto, Um Jogador"
MONOWAVE,2025,Indefinido,https://store.steampowered.com/app/2680440/MONOWAVE/?snr=1_7_7_popularcomingsoon_150_14,"Aventura, Quebra-Cabeça, Plataforma, Fofo, 2D, Exploração, Aconchegante, Plataforma com Quebra-Cabeça, Ação / Aventura, Câmera Lateral, Comovente, Controle, Desenhado à Mão, Ação, Cartunizado, Um Jogador, Colorido, Casual, Do Bem, Atmosférico"
Extinction Day,4º trimestre de 2025,Indefinido,https://store.steampowered.com/app/2682380/Extinction_Day/?snr=1_7_7_popularcomingsoon_150_14,"Simulador de Epidemias, Estratégia, Tempo Real com Pausa, Jogo de Divindade, Pós-Apocalíptico, Difícil, Atmosférico, Simulação, Faça o que Quiser, 3D, Destruição, Simulador Político, Gerenciamento, Gerenciamento de Recursos, Um Jogador, Sombrio, Indie, Alta Rejogabilidade, Acesso Antecipado, Grande Estratégia"
isekizima: Ruins and Tails Journey,2025,Indefinido,https://store.steampowered.com/app/2686820/isekizima_Ruins_and_Tails_Journey/?snr=1_7_7_popularcomingsoon_150_14,"Fofo, Ação / Aventura, Gatos, Protagonista Mulher, Boa Trama, Anime, Câmera Lateral, Trilha Sonora, Plataforma 2D, Exploração, Um Jogador, Aventura, Ação, Plataforma, RPG de Ação, Atmosférico, Trilha Sonora Boa"
Eternity's Echo: Patient Zero,4º trimestre de 2025,Indefinido,https://store.steampowered.com/app/2688960/Eternitys_Echo_Patient_Zero/?snr=1_7_7_popularcomingsoon_150_14,"Terror, Ação, Terror de Sobrevivência, Primeira Pessoa, Um Jogador, Aventura, Atmosférico, Terror Psicológico, Violento, Boa Trama, Quebra-Cabeça, Tiro em Primeira Pessoa (FPS), Exploração, Tiro, Sobrenatural, Tiro de Heróis, Metroidvania, Ação / Aventura, Thriller, Protagonista Mulher"
ALL WILL FALL: Physics-Based Survival City Builder,2025,Indefinido,https://store.steampowered.com/app/2706020/ALL_WILL_FALL_PhysicsBased_Survival_City_Builder/?snr=1_7_7_popularcomingsoon_150_14,"Simulação, Simulador de Colônias, Física, Alta Rejogabilidade, Construção de Bases, Faça o que Quiser, Gerenciamento, Sobrevivência em Mundo Aberto, Sobrevivência, Estratégia, Um Jogador, Automação, Construção, Gerenciamento de Recursos, Pós-Apocalíptico, Construção de Cidades, Atmosférico, Economia, Político, 3D"
Ghost Keeper,2025,Indefinido,https://store.steampowered.com/app/2708880/Ghost_Keeper/?snr=1_7_7_popularcomingsoon_150_14,"Demônios, Estratégia, Humor Pesado, Quebra-Cabeça, Estratégia em Tempo Real (RTS), Sobrenatural, Protagonista Vilão, 3D, Isométrico, Humor Ácido, Engraçado, Casual, Relaxante, Terror, Narração, Estilizado, Gerenciamento, Atmosférico, Gerenciamento de Recursos, Um Jogador"
Legends of Dragaea: Idle Dungeons,2025,Indefinido,https://store.steampowered.com/app/2712380/Legends_of_Dragaea_Idle_Dungeons/?snr=1_7_7_popularcomingsoon_150_14,"Automação, RPG, Saques, Indie, Incremental, Relaxante, Um Jogador, Aventura, Retrô, Gerenciamento de Inventário, Explorador de Calabouços, Batalha Automática, RPG de Grupos, Personalização de Personagem, JRPG, Primeira Pessoa, Fantasia, Mágica, Minimalista, Simulação"
MARVEL Cosmic Invasion,2025,Indefinido,https://store.steampowered.com/app/2753970/MARVEL_Cosmic_Invasion/?snr=1_7_7_popularcomingsoon_150_14,"Porradaria, Arcade, Super-Heróis, Gráficos Pixelados, Cooperativo, Câmera Lateral, Retrô, Ação / Aventura, Ação, História em Quadrinhos, 2D, Casual, Colorido, Para Toda a Família, Anos 90, Cooperativo Local, Cooperativo On-line, Multijogador, Multijogador Local, Aventura"
Chaos Front,2025,Indefinido,https://store.steampowered.com/app/2770330/Chaos_Front/?snr=1_7_7_popularcomingsoon_150_14,"Tática por Turnos, RPG Tático, Em Turnos, Estratégia em Turnos, RPG de Grupos, RPG de Estratégia, Grande Estratégia, JRPG, Estratégia, RPG, 2D, Mechas, Combate em Turnos, Mundo Aberto, Gráficos Pixelados, Anime, Espacial, Ficção Científica, Guerra, Um Jogador"
Modulus,4º trimestre de 2025,Indefinido,https://store.steampowered.com/app/2779120/Modulus/?snr=1_7_7_popularcomingsoon_150_14,"Acesso Antecipado, Automação, Construção de Bases, Faça o que Quiser, Estratégia, Fabricação, Mundo Aberto, Simulação, Um Jogador, Construção, Gerenciamento, Sobrevivência, Quebra-Cabeça, Lógica, Atmosférico, Construção de Cidades, LEGO, 3D, Gerenciamento de Recursos, Futurista"
キメキャワ♥限界ビートちゃん!!,2025,Indefinido,https://store.steampowered.com/app/2780040/KimekyawaGenkaiBeatchan/?snr=1_7_7_popularcomingsoon_150_14,"Casual, Indie, Ação, Música, Ritmo, Anime, Protagonista Mulher, Fofo, Um Jogador, 2D, Desenho Animado, Psicodélico"
AirBoost Airship Knight,Q4 2025,Indefinido,https://store.steampowered.com/app/2325390/AirBoost_Airship_Knight/?snr=1_7_7_popularcomingsoon_150_14,"Anime, Protagonista Mulher, Fofo, Gráficos Pixelados, Colorido, Ação / Aventura, Câmera Lateral, Porradaria, Ação, Plataforma 2D, Aventura, Combate, Linear, Plataforma, 2D, Comédia, Fantasia, Relaxante, Pós-Apocalíptico, Controle"
CASSETTE BOY,2025,Indefinido,https://store.steampowered.com/app/2334330/CASSETTE_BOY/?snr=1_7_7_popularcomingsoon_150_14,"Ação, Aventura, RPG de Ação, Ação / Aventura, Quebra-Cabeça, Soulslike, Exploração, 2,5D, Fofo, Gráficos Pixelados, Voxel, Anos 90, Ficção Científica, Velha-Guarda, Fantasia, Retrô, Saques, Gatos, Atmosférico, Controle"
ELDRIMAR,2025,Indefinido,https://store.steampowered.com/app/2349420/ELDRIMAR/?snr=1_7_7_popularcomingsoon_150_14,"Acesso Antecipado, Boa Trama, Soulslike, Enredo Rico, Fantasia Sombria, Sombrio, Fantasia, RPG de Ação, Atmosférico, Primeira Pessoa, Aventura, RPG, Demônios, Mundo Aberto, Mágica, CRPG, Ação / Aventura, Ação, Medieval, Zumbis"
Anseion - Fantasy MMORPG,December 2025,Free,https://store.steampowered.com/app/2351990/Anseion__Fantasy_MMORPG/?snr=1_7_7_popularcomingsoon_150_14,"Multijogador Massivo, RPG, MMORPG, Gratuito para Jogar, Mundo Aberto, Gráficos Pixelados, 2D, RPG de Ação, Fantasia, Exploração, Ação, Personalização de Personagem, Indie, Jogador x Jogador (PvP), Aventura, Jogador X Ambiente (PvE), Hack and Slash, Fabricação, Multijogador, Visão Superior"
Project: Mist,Q4 2025,Indefinido,https://store.steampowered.com/app/2383130/Project_Mist/?snr=1_7_7_popularcomingsoon_150_14,"Acesso Antecipado, Terror, Terror de Sobrevivência, Mundo Aberto, Pós-Apocalíptico, Sobrevivência em Mundo Aberto, Multijogador, Tiro, Ação, Construção, Fabricação, Simulação, Realístico, Atmosférico, Sombrio, Exploração, Ação / Aventura, Sobrevivência, Aventura, Culinária"
Espiocracy,2025,Indefinido,https://store.steampowered.com/app/1670650/Espiocracy/?snr=1_7_7_popularcomingsoon_150_15,"Faça o que Quiser, Diplomacia, RPG de Estratégia, Estratégia, Simulação, Grande Estratégia, Guerra Fria, 4X, Histórico, Político, Simulador Político, Guerra, Tático, Militar, Estratégia em Tempo Real (RTS), Construção, Multijogador, Segunda Guerra Mundial, História Alternativa, Tempo Real com Pausa"
Eternity Egg,2025,Indefinido,https://store.steampowered.com/app/1670690/Eternity_Egg/?snr=1_7_7_popularcomingsoon_150_15,"Acesso Antecipado, Plataforma 3D, Surrealista, Terror, Atmosférico, Velha-Guarda, Retrô, 3D, Plataforma, Aventura, Não Linear, Exploração, Metroidvania, Soulslike, Combate, Fantasia Sombria, Estilizado, Fofo, Distópico, Um Jogador"
Out of Action,2025,Indefinido,https://store.steampowered.com/app/1670780/Out_of_Action/?snr=1_7_7_popularcomingsoon_150_15,"Indie, Tiro em Primeira Pessoa (FPS), Jogador x Jogador (PvP), Cyberpunk, Tiro, Primeira Pessoa, Ação, Parar o Tempo, Personalização de Armas, Distópico, Ficção Científica, Sombrio, Futurista, Combate, Multijogador, Um Jogador, Anime, Personalização de Personagem, Jogador X Ambiente (PvE), Estilizado"
Fragile Existence,2025,Indefinido,https://store.steampowered.com/app/1672320/Fragile_Existence/?snr=1_7_7_popularcomingsoon_150_15,"Estratégia, Simulação, Grande Estratégia, Espacial, 4X, Ficção Científica, Gerenciamento, Multijogador, Tático, Guerra, Faça o que Quiser, Estratégia em Tempo Real (RTS), Compatível com Mods, Cooperativo, Um Jogador, Tempo Real com Pausa, Atmosférico, Alta Rejogabilidade, Economia, Histórico"
Showa American Story,Q4 2025,Indefinido,https://store.steampowered.com/app/1687540/Showa_American_Story/?snr=1_7_7_popularcomingsoon_150_15,"Aventura, Ação, RPG, Ação / Aventura, RPG de Ação, Anos 80, JRPG, Protagonista Mulher, 3D, Terceira Pessoa, Zumbis, Humor Ácido, Retrô, Boa Trama, Motocicletas, Ficção Científica, EUA, Um Jogador, Comédia, Drama"
ExeKiller,2025,Indefinido,https://store.steampowered.com/app/1701840/ExeKiller/?snr=1_7_7_popularcomingsoon_150_15,"Ação, Pós-Apocalíptico, Velho Oeste, Combate com Veículos, Boa Trama, Exploração, Ação / Aventura, Tiro em Primeira Pessoa (FPS), Vários Finais, Investigação, Aventura, Direção, Ficção Científica, Um Jogador, Furtivo, Personalização de Personagem, Tiro, Primeira Pessoa, Conversas, 3D"
Cleared Hot,2025,Indefinido,https://store.steampowered.com/app/1710820/Cleared_Hot/?snr=1_7_7_popularcomingsoon_150_15,"Voo, Combate com Veículos, Anos 80, Um Jogador, Ação, Isométrico, Militar, Jogo de Guerra, SHMUP com Visão Superior, Nostalgia, Controle com Alavanca Dupla, Retrô, 3D, Visão Superior, Tiro, Controle, Tático, Física, Guerra, Anos 90"
A Sister's Journey,2025,Indefinido,https://store.steampowered.com/app/1730790/A_Sisters_Journey/?snr=1_7_7_popularcomingsoon_150_15,"Metroidvania, Plataforma de Precisão, Ação, Mandando Bala, Exploração, Difícil, Aventura, Gráficos Pixelados, Boa Trama, Atmosférico, Fantasia, Um Jogador, Colorido, Fofo, Plataforma, Combate, Câmera Lateral, Indie, Plataforma 2D, Ação / Aventura"
Sealed Gate,2025,Indefinido,https://store.steampowered.com/app/1736200/Sealed_Gate/?snr=1_7_7_popularcomingsoon_150_15,"Acesso Antecipado, Fabricação, Multijogador Massivo, Gráficos Pixelados, 2D, MMORPG, Visão Superior, Fantasia, Boa Trama, Mundo Aberto, Medieval, Drama, Aventura, RPG, Mágica, Personalização de Personagem, Exploração, Explorador de Calabouços, CRPG, Troca"
Lair Land Story 2: Mist of Sea,2025,Indefinido,https://store.steampowered.com/app/1749810/Lair_Land_Story_2_Mist_of_Sea/?snr=1_7_7_popularcomingsoon_150_15,"Aventura, Simulador de Encontros, Simulação, Estratégia, 2D, JRPG, Romance Visual, RPG, Indie"
Away From Life,Q4 2025,Indefinido,https://store.steampowered.com/app/1755080/Away_From_Life/?snr=1_7_7_popularcomingsoon_150_15,"Exploração, Tiro em Primeira Pessoa (FPS), Faça o que Quiser, Construção, Fabricação, Sobrevivência, Jogador x Jogador (PvP), Construção de Bases, Subaquático, Primeira Pessoa, Mundo Aberto, Ação, Simulação, Realístico, Aventura, Gerenciamento de Recursos, Cooperativo, Multijogador, Cooperativo On-line, Um Jogador"
Farm Renovator,2025,Indefinido,https://store.steampowered.com/app/1779610/Farm_Renovator/?snr=1_7_7_popularcomingsoon_150_15,"Simulação, Simulador Rural, Agricultura, Primeira Pessoa, Relaxante, Gerenciamento de Recursos, Simulador Imersivo, Construção, Faça o que Quiser, EUA, Realístico, Estratégia, 3D, Gerenciamento, Boa Trama, Mundo Aberto, Fabricação, Casual, Exploração, Simulador Automobilístico"
Life After End,2025,Indefinido,https://store.steampowered.com/app/1792390/Life_After_End/?snr=1_7_7_popularcomingsoon_150_15,"Tiro com Saques, Tiro em Primeira Pessoa (FPS), Sobrevivência, Fabricação, Natureza, Jogador x Jogador (PvP), Jogador X Ambiente (PvE), Construção de Bases, Física, Tiro, Personalização de Personagem, 3D, Primeira Pessoa, Pós-Apocalíptico, Personalização de Armas, Baseado em Equipes, Mundo Aberto, Simulação, Ação, Realístico"
