title,release_date,price,game_url,genres
Insider Trading,Q1 2026,Indefinido,https://store.steampowered.com/app/3166810/Insider_Trading/?snr=1_7_7_popularcomingsoon_150_14,"Estratégia, Montagem de Decks Roguelike, Apostas, Montagem de Decks, Um Jogador, Roguelike, Em Turnos, Alta Rejogabilidade, Roguelite, Capitalismo, Você Decide, Casual, Batalha Automática, Difícil, Gráficos Pixelados, 2D, Indie, Estratégia em Turnos, Geração Procedural, Retrô"
Packmates,Q1 2026,Indefinido,https://store.steampowered.com/app/3171540/Packmates/?snr=1_7_7_popularcomingsoon_150_14,"Acesso Antecipado, Roguelike de Ação, Gerenciamento de Inventário, Cooperativo On-line, Sobrevivência, Ação, Gráficos Pixelados, Chuva de Balas, Roguelite, Fantasia, Jogador X Ambiente (PvE), 2,5D, RPG, Aventura, Multijogador, Roguelike, Saques, Combate, Visão Superior, Cooperativo"
The Hidden Scrolls,Q1 2026,Indefinido,https://store.steampowered.com/app/3201830/The_Hidden_Scrolls/?snr=1_7_7_popularcomingsoon_150_14,"Tática por Turnos, Fantasia Sombria, Roguelite, Explorador de Calabouços, Estratégia em Turnos, RPG de Estratégia, RPG de Grupos, Combate em Turnos, Estratégia, RPG, Roguelike, 2D, Histórico, Desenhado à Mão, Estilizado, Câmera Lateral, Indie, Plataforma 2D, Mitologia, Um Jogador"
Lil Gator Game: In the Dark,Q1 2026,Indefinido,https://store.steampowered.com/app/3205060/Lil_Gator_Game_In_the_Dark/?snr=1_7_7_popularcomingsoon_150_14,"Casual, Aconchegante, Indie, Fofo, Relaxante, Do Bem, Para Toda a Família, Aventura, Engraçado, Curta-Metragem, Colorido, LGBTQIA+, Plataforma 3D, 3D, Colete Tudo, Terceira Pessoa, Um Jogador, Ação / Aventura, Comédia, RPG"
Mad King Redemption,Q1 2026,Indefinido,https://store.steampowered.com/app/2369580/Mad_King_Redemption/?snr=1_7_7_popularcomingsoon_150_14,"Acesso Antecipado, Roguelike de Ação, Arcade, Câmera Lateral, Porradaria, Roguelite, 2,5D, Gráficos Pixelados, Controle, Hack and Slash, Ação, Fantasia Sombria, Aventura, Multijogador Local, Velha-Guarda, Cooperativo Local, Jogador X Ambiente (PvE), Retrô, Ação / Aventura, Indie"
Re:Night,Q1 2026,Indefinido,https://store.steampowered.com/app/2372240/ReNight/?snr=1_7_7_popularcomingsoon_150_14,"Montagem de Decks Roguelike, Tática por Turnos, RPG Tático, Batalha com Cartas, Roguelite, Cartas, Estratégia em Turnos, Jogo de Tabuleiro, RPG de Estratégia, Roguelike, Combate em Turnos, Estratégia, RPG, 2D, Montagem de Decks, Fantasia, Tático, Fantasia Sombria, Um Jogador, Indie"
Underboard,Q1 2026,Indefinido,https://store.steampowered.com/app/2376610/Underboard/?snr=1_7_7_popularcomingsoon_150_14,"Batalha Automática, Roguelike, Tática por Turnos, RPG de Estratégia, Explorador de Calabouços, Saques, Estratégia, Alta Rejogabilidade, Tático, RPG de Grupos, Um Jogador, Estratégia em Turnos, Geração Procedural, Roguelite, RPG, Gerenciamento de Recursos, Indie, RPG Tático, Jogador X Ambiente (PvE), Visão Superior"
The Bornless,Q1 2026,Indefinido,https://store.steampowered.com/app/2411280/The_Bornless/?snr=1_7_7_popularcomingsoon_150_14,"Terror, Tiro em Primeira Pessoa (FPS), Multijogador, Tiro, Ação, Terror de Sobrevivência, Demônios, Atmosférico, Aventura, Ação / Aventura, Primeira Pessoa, Jogador x Jogador (PvP), Terror Psicológico, Fantasia Sombria, Combate, Cooperativo On-line, Um Jogador, Baseado em Equipes, Cooperativo, Battle Royale"
Breathedge 2,Q1 2026,Indefinido,https://store.steampowered.com/app/2412960/Breathedge_2/?snr=1_7_7_popularcomingsoon_150_14,"Sobrevivência, Aventura, Primeira Pessoa, Ação, RPG, Um Jogador, Simulação, Sobrevivência em Mundo Aberto, Espacial, Faça o que Quiser, Ação / Aventura, Exploração, Simulador Imersivo, Construção, Fabricação, Engraçado, Atmosférico, Mundo Aberto, Construção de Bases, Automação"
Final Sentence,Q1 2026,Indefinido,https://store.steampowered.com/app/2413950/Final_Sentence/?snr=1_7_7_popularcomingsoon_150_14,"Digitação, Simulação, Terror, Sobrevivência, Battle Royale, Multijogador, Jogador x Jogador (PvP), Terror de Sobrevivência, Terror Psicológico, Thriller, Atmosférico, Baseado em Texto, Noir, Indie, 3D, Educativo, Distópico"
Dimhaven - The Lost Source,Q1 2026,Indefinido,https://store.steampowered.com/app/2458980/Dimhaven__The_Lost_Source/?snr=1_7_7_popularcomingsoon_150_14,"Aventura, Quebra-Cabeça, Primeira Pessoa, Mistério, Simulador de Caminhada, Boa Trama, Exploração, Detetive, Atmosférico, Humor Ácido, Drama, Apontar e Clicar, Comovente, Protagonista Mulher, Investigação, Relaxante, Sombrio, Estilizado, Retrô, Surrealista"
The Chronos Event,Q1 2026,Indefinido,https://store.steampowered.com/app/2477470/The_Chronos_Event/?snr=1_7_7_popularcomingsoon_150_14,"Roguelike de Ação, Ação, Roguelite, Um Jogador, Roguelike, Protagonista Mulher, Tiro, Difícil, Tiro com Saques, Chuva de Balas, Morte Permanente, Alta Rejogabilidade, Tiro em Terceira Pessoa, Atmosférico, Acesso Antecipado, Ritmo Rápido, Manipulação de Tempo, Viagem no Tempo, Terceira Pessoa, Aventura"
T.K. Punk - G.O.L.D,Q1 2026,Indefinido,https://store.steampowered.com/app/2505590/TK_Punk__GOLD/?snr=1_7_7_popularcomingsoon_150_14,"História Alternativa, RPG de Estratégia, Romance Visual, Gerenciamento de Tempo, Boa Trama, Gerenciamento de Recursos, Estratégia, RPG, Anime, JRPG, Cyberpunk, Estratégia em Turnos, Tática por Turnos, Você Decide, Vários Finais, Estilizado, Combate em Turnos, Um Jogador, Histórico, Fantasia"
Shadows of the Afterland,Q1 2026,Indefinido,https://store.steampowered.com/app/2506100/Shadows_of_the_Afterland/?snr=1_7_7_popularcomingsoon_150_14,"Aventura, Apontar e Clicar, Protagonista Mulher, Velha-Guarda, Fantasia, Comédia, Gráficos Pixelados, Quebra-Cabeça, 2D, Sobrenatural, Boa Trama, Exploração, Fantasia Sombria, Casual, Humor Ácido, Colorido, Engraçado, Investigação, Detetive, Um Jogador"
ALL WILL FALL: Physics-Based Survival City Builder,Q1 2026,Indefinido,https://store.steampowered.com/app/2706020/ALL_WILL_FALL_PhysicsBased_Survival_City_Builder/?snr=1_7_7_popularcomingsoon_150_14,"Simulação, Simulador de Colônias, Física, Alta Rejogabilidade, Construção de Bases, Faça o que Quiser, Gerenciamento, Sobrevivência em Mundo Aberto, Sobrevivência, Estratégia, Um Jogador, Automação, Construção, Gerenciamento de Recursos, Pós-Apocalíptico, Construção de Cidades, Atmosférico, Economia, Político, 3D"
Shadows of Chroma Tower,March 2026,Indefinido,https://store.steampowered.com/app/2713380/Shadows_of_Chroma_Tower/?snr=1_7_7_popularcomingsoon_150_14,"Um Jogador, Ação, RPG de Ação, Multijogador, Explorador de Calabouços, Battle Royale, Jogador X Ambiente (PvE), Cooperativo, Hack and Slash, Tiro de Extração, Fabricação, Primeira Pessoa, Cooperativo On-line, Fantasia, Saques, Medieval, Gerenciamento de Inventário, Estilizado, Personalização de Personagem, 3D"
The Last Winter Knight,Q1 2026,Indefinido,https://store.steampowered.com/app/2768420/The_Last_Winter_Knight/?snr=1_7_7_popularcomingsoon_150_14,"Romance Visual, Gótico, Mistério, Romance, Escolha a sua Aventura, Atmosférico, Fantasia Sombria, Medieval, Boa Trama, Enredo Rico, Apontar e Clicar, Drama, Desenhado à Mão, Terror, Aventura, Neve, Fantasia, Sobrenatural, Um Jogador, 2D"
Beetleball,March 2026,Indefinido,https://store.steampowered.com/app/2776270/Beetleball/?snr=1_7_7_popularcomingsoon_150_14,"Baseado em Classes, Baseado em Equipes, Fofo, Esportes, eSports, Jogador x Jogador (PvP), Multijogador, Futebol, Basquete, Parkour, Plataforma 3D, Física, Natureza, Cooperativo On-line, Reúna a Galera, Para Toda a Família, 3D, Terceira Pessoa, Memes, Tiro em Arena"
SHRIMP GAME,Q1 2026,Indefinido,https://store.steampowered.com/app/2824880/SHRIMP_GAME/?snr=1_7_7_popularcomingsoon_150_14,"Mechas, Tiro em Terceira Pessoa, Explorador de Calabouços, Soulslike, Cooperativo On-line, Mundo Aberto, Subaquático, Exploração, Jogador x Jogador (PvP), Multijogador, Chuva de Balas, Personalização de Personagem, Tiro com Saques, Engraçado, Lovecraftiano, Enredo Rico, Baseado em Classes, Submarino, Retrô, RPG de Ação"
Citystate Metropolis,Q1 2026,Indefinido,https://store.steampowered.com/app/2828020/Citystate_Metropolis/?snr=1_7_7_popularcomingsoon_150_14,"Simulação, Construção de Cidades, Construção, Faça o que Quiser, Um Jogador, Estratégia, Gerenciamento, Economia, Realístico, Casual, Transportes, Mundo Aberto, Atmosférico, Capitalismo, Futurista, Compatível com Mods, Acesso Antecipado, Geração Procedural, Relaxante"
SimplePlanes 2,March 2026,Indefinido,https://store.steampowered.com/app/2840470/SimplePlanes_2/?snr=1_7_7_popularcomingsoon_150_14,"Simulação, Voo, Faça o que Quiser, Construção, Mundo Aberto, Destruição, Multijogador, Militar, Simulador Automobilístico, Cooperativo, Animação e Modelagem, Tiro, Corrida com Combate, Exploração, Automação, Corrida, Combate com Veículos, Direção, Programação, Um Jogador"
Slay the Spire 2,March 2026,Indefinido,https://store.steampowered.com/app/2868840/Slay_the_Spire_2/?snr=1_7_7_popularcomingsoon_150_14,"Estratégia, Cartas, Roguelike, Batalha com Cartas, Montagem de Decks, Explorador de Calabouços, Combate em Turnos, Roguelite, Montagem de Decks Roguelike, 2D, Indie, Fantasia, Um Jogador, Difícil, Geração Procedural, Alta Rejogabilidade, Só Mouse"
KILL THE WITCH,Q1 2026,Indefinido,https://store.steampowered.com/app/2878760/KILL_THE_WITCH/?snr=1_7_7_popularcomingsoon_150_14,"Acesso Antecipado, Plataforma 2D, Soulslike, Jogador X Ambiente (PvE), Plataforma, 2D, Fofo, Cyberpunk, Terror Psicológico, Boa Trama, Ação, Gráficos Pixelados, Anime, Ficção Científica, Comovente, Retrô, Sombrio, Combate, Um Jogador, Trilha Sonora"
Fractured Mind,Q1 2026,Free,https://store.steampowered.com/app/2885330/Fractured_Mind/?snr=1_7_7_popularcomingsoon_150_14,"Ação, Terror, Aventura, Terror Psicológico, Simulação, Tiro, Surrealista, Tiro em Primeira Pessoa (FPS), Simulador Imersivo, 3D, Primeira Pessoa, Cinematográfico, Realístico, Drama, Comovente, Psicológico, Sombrio, Boa Trama, Um Jogador, Acesso Antecipado"
Pieced Together,Q1 2026,Indefinido,https://store.steampowered.com/app/2891370/Pieced_Together/?snr=1_7_7_popularcomingsoon_150_14,"Aconchegante, Quebra-Cabeça, Relaxante, Protagonista Mulher, Indie, Boa Trama, 2D, Fofo, Casual, Simulação, Colorido, Desenhado à Mão, Estilizado, Para Toda a Família, Drama, Atmosférico, Anos 90, Investigação, Um Jogador, Comovente"
House Of Decay,Q1 2026,Indefinido,https://store.steampowered.com/app/2899350/House_Of_Decay/?snr=1_7_7_popularcomingsoon_150_14,"Metroidvania, Plataforma 3D, Colete Tudo, Exploração, Retrô, Demônios, Plataforma, Terceira Pessoa, Ação / Aventura, Fofo, Hack and Slash, 3D, Velha-Guarda, Estilizado, Colorido, Gráficos Pixelados, Aventura, Linear, Mágica, Psicodélico"
Mama's Sleeping Angels,Q1 2026,Indefinido,https://store.steampowered.com/app/2918310/Mamas_Sleeping_Angels/?snr=1_7_7_popularcomingsoon_150_14,"Terror, Multijogador, Geração Procedural, Aventura, Exploração, Você Decide, Sobrenatural, Protagonista Mulher, Primeira Pessoa, Surrealista, Comédia, Plataforma, Estilizado, Sombrio, Baseado em Equipes, Demônios, Mágica, Retrô, Um Jogador, Furtivo"
Solateria,Q1 2026,Indefinido,https://store.steampowered.com/app/2947280/Solateria/?snr=1_7_7_popularcomingsoon_150_14,"Metroidvania, Soulslike, Difícil, Desenhado à Mão, 2D, Exploração, Boa Trama, Fantasia Sombria, Plataforma, Ação, Aventura, Plataforma 2D, Indie, Combate, Vários Finais, Controle, Atmosférico, Um Jogador, Sombrio, Enredo Rico"
No Vacation for an Executioner,March 2026,Indefinido,https://store.steampowered.com/app/2949120/No_Vacation_for_an_Executioner/?snr=1_7_7_popularcomingsoon_150_14,"Terror, Terror de Sobrevivência, Ação, Aventura, Retrô, Distópico, Indie, RPG, Mistério, Vários Finais, Um Jogador, Thriller, 3D, Soulslike, Ação / Aventura, Fantasia Sombria, RPG de Ação, Controle, Plataforma 3D, Terceira Pessoa"
DrainSim,March 2026,Indefinido,https://store.steampowered.com/app/2963800/DrainSim/?snr=1_7_7_popularcomingsoon_150_14,"Casual, Simulação, Relaxante, Primeira Pessoa, Faça o que Quiser, Subaquático, 3D, Realístico, Simulador Imersivo, Física, Linear, Natureza, Atmosférico, EUA, Um Jogador, Colorido, Engraçado, Boa Trama, Aconchegante, Do Bem"
Starsand Island,Q1 2026,Indefinido,https://store.steampowered.com/app/2966320/Starsand_Island/?snr=1_7_7_popularcomingsoon_150_14,"RPG, Simulador de Vida Real, Simulador Rural, Construção, Casual, Faça o que Quiser, Simulação, Fabricação, Relaxante, Desenho Animado, Plataforma 3D, Exploração, Simulador Imersivo, 3D, Anime, Drama, Comovente, Atmosférico, Subaquático, Culinária"
Separated,Q1 2026,Indefinido,https://store.steampowered.com/app/2976110/Separated/?snr=1_7_7_popularcomingsoon_150_14,"Cooperativo On-line, Terror, Quebra-Cabeça, Multijogador, Jogador X Ambiente (PvE), Cooperativo, Furtivo, Ação, Sobrenatural, Atmosférico, Sombrio, Thriller, Inteligência Artificial, Não Linear, Indie, Fuja da Sala, Acesso Antecipado, Objetos Ocultos, Primeira Pessoa, 3D"
POLYARIS,Q1 2026,Indefinido,https://store.steampowered.com/app/2979810/POLYARIS/?snr=1_7_7_popularcomingsoon_150_14,"Sobrevivência em Mundo Aberto, Um Jogador, Primeira Pessoa, Mundo Aberto, Exploração, Atmosférico, Sobrevivência, Ação, Faça o que Quiser, Fabricação, Simulação, Gerenciamento de Inventário, Saques, Neve, Esqui, Naval, Pesca, Realístico, Simulador de Caminhada, Pós-Apocalíptico"
Rita,Q1 2026,Indefinido,https://store.steampowered.com/app/2984850/Rita/?snr=1_7_7_popularcomingsoon_150_14,"Aventura, Quebra-Cabeça, Boa Trama, Jogo de Palavras, Aconchegante, Do Bem, Exploração, Fofo, Metroidvania, 3D, Protagonista Mulher, Plataforma com Quebra-Cabeça, Colorido, Para Toda a Família, Relaxante, Um Jogador, Cartunizado, Comovente, Indie, Casual"
HYPNOSYNC,Q1 2026,Free,https://store.steampowered.com/app/2986590/HYPNOSYNC/?snr=1_7_7_popularcomingsoon_150_14,"Ritmo, Arcade, 2D, Fofo, Psicodélico, Engraçado, Música, Anime, Cartunizado, Gratuito para Jogar, Indie, Ação, Simulação, Um Jogador, Conteúdo Sexual, Para Adultos, Colorido, Protagonista Mulher, Difícil, Hentai"
Eternal Palace Sakura,Q1 2026,Indefinido,https://store.steampowered.com/app/2991310/Eternal_Palace_Sakura/?snr=1_7_7_popularcomingsoon_150_14,"Roguelite, Anime, Hack and Slash, Explorador de Calabouços, Protagonista Mulher, Ação, Ritmo Rápido, Jogo de Ação Focado em Personagem, Geração Procedural, Alta Rejogabilidade, 3D, Fantasia, Combate, Indie, Ação / Aventura, Terceira Pessoa, Roguelike de Ação, Controle, RPG de Ação, Fofo"
Master of Piece,Q1 2026,Indefinido,https://store.steampowered.com/app/3009310/Master_of_Piece/?snr=1_7_7_popularcomingsoon_150_14,"Montagem de Decks Roguelike, Batalha Automática, Estratégia em Turnos, Montagem de Decks, Jogo de Mesa, Acesso Antecipado, Estratégia, Jogo de Tabuleiro, Medieval, Roguelite, Combate em Turnos, Roguelike, Fantasia Sombria, Cartas, Batalha com Cartas, Você Decide, Tática por Turnos, Fantasia, Atmosférico, Sombrio"
Pao Pao,Q1 2026,Indefinido,https://store.steampowered.com/app/3024130/Pao_Pao/?snr=1_7_7_popularcomingsoon_150_14,"Cooperativo, Mundo Aberto, Simulador Imersivo, Gerenciamento, Culinária, Faça o que Quiser, Exploração, Pesca, Simulador de Vida Real, Reúna a Galera, Personalização de Personagem, Fofo, Aventura, Engraçado, Relaxante, Simulador Rural, Gerenciamento de Tempo, Casual, Gerenciamento de Recursos, Construção"
Battlestar Galactica: Scattered Hopes,Q1 2026,Indefinido,https://store.steampowered.com/app/2535950/Battlestar_Galactica_Scattered_Hopes/?snr=1_7_7_popularcomingsoon_150_14,"Estratégia, Estratégia em Tempo Real (RTS), Roguelite, Alta Rejogabilidade, Boa Trama, Difícil, Tático, Gerenciamento de Recursos, Roguelike, Exploração, Tempo Real com Pausa, Simulador Espacial, Espacial, Ficção Científica, Tática em Tempo Real, Simulação, Ação, Sobrevivência, Sombrio, Um Jogador"
Crystalfall,Q1 2026,Free,https://store.steampowered.com/app/2574970/Crystalfall/?snr=1_7_7_popularcomingsoon_150_14,"Ação, Aventura, Gratuito para Jogar, RPG de Ação, RPG, Hack and Slash, Explorador de Calabouços, Isométrico, Fantasia, Steampunk, Pós-Apocalíptico, Saques, Personalização de Personagem, Fabricação, Gerenciamento de Inventário, Um Jogador, Multijogador, Terceira Pessoa, Troca, Fantasia Sombria"
Golel,Q1 2026,Indefinido,https://store.steampowered.com/app/2577730/Golel/?snr=1_7_7_popularcomingsoon_150_14,"CRPG, Explorador de Calabouços, Em Turnos, Personalização de Personagem, RPG, 3D, Primeira Pessoa, RV, Boa Trama, Combate em Turnos, Realístico, Fantasia Sombria, Demônios, Fantasia, Mágica, Medieval, Atmosférico, Movimento em Grade, Um Jogador, Indie"
Highreach,Q1 2026,Indefinido,https://store.steampowered.com/app/2620450/Highreach/?snr=1_7_7_popularcomingsoon_150_14,"Acesso Antecipado, Jogador X Ambiente (PvE), Mundo Aberto, Boa Trama, Geração Procedural, Sobrevivência, Indie, Exploração, Simulador de Colônias, Construção de Bases, RPG de Ação, Ação / Aventura, RPG, 3D, Terceira Pessoa, Surrealista, Narração, Medieval, Construção, Fabricação"
FUR Squadron Phoenix,Q1 2026,Indefinido,https://store.steampowered.com/app/2674650/FUR_Squadron_Phoenix/?snr=1_7_7_popularcomingsoon_150_14,"Ação, Roguelike, Arcade, Tiro, Mandando Bala, Voo, Tiro sobre Trilhos, 3D, Retrô, Boa Trama, Jogador X Ambiente (PvE), Linear, Controle, Combate com Veículos, Roguelite, Um Jogador, Colorido, Estilizado, Anos 90, Ficção Científica"
Extinction Day,Q1 2026,Indefinido,https://store.steampowered.com/app/2682380/Extinction_Day/?snr=1_7_7_popularcomingsoon_150_14,"Estratégia em Tempo Real (RTS), Estratégia, Grande Estratégia, Gerenciamento de Recursos, Tempo Real com Pausa, Gerenciamento, Destruição, Atmosférico, Simulador de Epidemias, Pós-Apocalíptico, Difícil, Simulação, Faça o que Quiser, 3D, Um Jogador, Sombrio, Indie, Alta Rejogabilidade, Simulador Político, Tática em Tempo Real"
Restore Your Island,Q1 2026,Indefinido,https://store.steampowered.com/app/2698420/Restore_Your_Island/?snr=1_7_7_popularcomingsoon_150_14,"Simulação, Exploração, Simulador Imersivo, Relaxante, Casual, Economia, Simulador de Vida Real, Fofo, Cachorros, Engraçado, Boa Trama, Colorido, Realístico, Para Toda a Família, Atmosférico, Primeira Pessoa, Um Jogador, Aventura, 3D, Indie"
High Times - Dating/Cooking Sim,Q1 2026,Indefinido,https://store.steampowered.com/app/2251220/High_Times__DatingCooking_Sim/?snr=1_7_7_popularcomingsoon_150_14,"Simulação, Casual, Simulador de Encontros, Romance Visual, Culinária, Você Decide, Romance, Desenho Animado, Anime, Vários Finais, LGBTQIA+, Colorido, Fofo, História em Quadrinhos, Comédia, Drama, Comovente, Boa Trama, Memes, Gerenciamento"
Wish Upon A Llama,Q1 2026,Indefinido,https://store.steampowered.com/app/2262630/Wish_Upon_A_Llama/?snr=1_7_7_popularcomingsoon_150_14,"RPG, Simulação, Fofo, 2D, Aconchegante, Boa Trama, Simulador de Vida Real, Simulador de Emprego, Relaxante, Simulador de Encontros, Exploração, Simulador Rural, Personalização de Personagem, Romance, Visão Superior, Gráficos Pixelados, Natureza, Protagonista Mulher, Um Jogador, Simulador Imersivo"
Battlestar Galactica: Scattered Hopes,1º trimestre de 2026,Indefinido,https://store.steampowered.com/app/2535950/Battlestar_Galactica_Scattered_Hopes/?snr=1_7_7_popularcomingsoon_150_15,"Estratégia, Estratégia em Tempo Real (RTS), Roguelite, Alta Rejogabilidade, Boa Trama, Difícil, Tático, Gerenciamento de Recursos, Roguelike, Exploração, Tempo Real com Pausa, Simulador Espacial, Espacial, Ficção Científica, Tática em Tempo Real, Simulação, Ação, Sobrevivência, Sombrio, Um Jogador"
Crystalfall,1º trimestre de 2026,,https://store.steampowered.com/app/2574970/Crystalfall/?snr=1_7_7_popularcomingsoon_150_15,"Ação, Aventura, Gratuito para Jogar, RPG de Ação, RPG, Hack and Slash, Explorador de Calabouços, Isométrico, Fantasia, Steampunk, Pós-Apocalíptico, Saques, Personalização de Personagem, Fabricação, Gerenciamento de Inventário, Um Jogador, Multijogador, Terceira Pessoa, Troca, Fantasia Sombria"
Golel,1º trimestre de 2026,Indefinido,https://store.steampowered.com/app/2577730/Golel/?snr=1_7_7_popularcomingsoon_150_15,"CRPG, Explorador de Calabouços, Em Turnos, Personalização de Personagem, RPG, 3D, Primeira Pessoa, RV, Boa Trama, Combate em Turnos, Realístico, Fantasia Sombria, Demônios, Fantasia, Mágica, Medieval, Atmosférico, Movimento em Grade, Um Jogador, Indie"
Highreach,1º trimestre de 2026,Indefinido,https://store.steampowered.com/app/2620450/Highreach/?snr=1_7_7_popularcomingsoon_150_15,"Acesso Antecipado, Jogador X Ambiente (PvE), Mundo Aberto, Boa Trama, Geração Procedural, Sobrevivência, Indie, Exploração, Simulador de Colônias, Construção de Bases, RPG de Ação, Ação / Aventura, RPG, 3D, Terceira Pessoa, Surrealista, Narração, Medieval, Construção, Fabricação"
FUR Squadron Phoenix,1º trimestre de 2026,Indefinido,https://store.steampowered.com/app/2674650/FUR_Squadron_Phoenix/?snr=1_7_7_popularcomingsoon_150_15,"Ação, Roguelike, Arcade, Tiro, Mandando Bala, Voo, Tiro sobre Trilhos, 3D, Retrô, Boa Trama, Jogador X Ambiente (PvE), Linear, Controle, Combate com Veículos, Roguelite, Um Jogador, Colorido, Estilizado, Anos 90, Ficção Científica"
Extinction Day,1º trimestre de 2026,Indefinido,https://store.steampowered.com/app/2682380/Extinction_Day/?snr=1_7_7_popularcomingsoon_150_15,"Estratégia em Tempo Real (RTS), Estratégia, Grande Estratégia, Gerenciamento de Recursos, Tempo Real com Pausa, Gerenciamento, Destruição, Atmosférico, Simulador de Epidemias, Pós-Apocalíptico, Difícil, Simulação, Faça o que Quiser, 3D, Um Jogador, Sombrio, Indie, Alta Rejogabilidade, Simulador Político, Tática em Tempo Real"
Restore Your Island,1º trimestre de 2026,Indefinido,https://store.steampowered.com/app/2698420/Restore_Your_Island/?snr=1_7_7_popularcomingsoon_150_15,"Simulação, Exploração, Simulador Imersivo, Relaxante, Casual, Economia, Simulador de Vida Real, Fofo, Cachorros, Engraçado, Boa Trama, Colorido, Realístico, Para Toda a Família, Atmosférico, Primeira Pessoa, Um Jogador, Aventura, 3D, Indie"
Task Force Admiral - Vol.1: American Carrier Battles,Q1 2026,Indefinido,https://store.steampowered.com/app/1281220/Task_Force_Admiral__Vol1_American_Carrier_Battles/?snr=1_7_7_popularcomingsoon_150_15,"Naval, Tático, Militar, Combate Naval, Histórico, Simulação, Estratégia em Tempo Real (RTS), Estratégia, Jogador X Ambiente (PvE), Segunda Guerra Mundial, Estratégia em Tempo Real com Ação, Grande Estratégia, Combate com Veículos, Gerenciamento, Realístico, Tática em Tempo Real, 3D, Educativo, Tempo Real, Jogo de Guerra"
Gecko Gods,Q1 2026,Indefinido,https://store.steampowered.com/app/1290760/Gecko_Gods/?snr=1_7_7_popularcomingsoon_150_15,"Ação, Aventura, Plataforma, Plataforma com Quebra-Cabeça, Indie, 3D, Estilizado, Atmosférico, Histórico, Natureza, Mistério, Mundo Aberto, Plataforma 3D, Um Jogador, Fofo, Quebra-Cabeça, Exploração, Para Toda a Família, Relaxante, Controle"
Gothic 1 Remake,Q1 2026,Indefinido,https://store.steampowered.com/app/1297900/Gothic_1_Remake/?snr=1_7_7_popularcomingsoon_150_15,"RPG, Ação, Aventura, Exploração, Realístico, RPG de Ação, Atmosférico, 3D, Terceira Pessoa, Fantasia Sombria, Fantasia, Gótico, Mágica, Medieval, Combate, Fabricação, Boa Trama, Um Jogador, Remake, Mundo Aberto"
Faraway Lands: Rise of Yokai,Q1 2026,Indefinido,https://store.steampowered.com/app/1303940/Faraway_Lands_Rise_of_Yokai/?snr=1_7_7_popularcomingsoon_150_15,"Construção de Cidades, Simulador de Colônias, Construção de Bases, Estratégia, Sobrevivência, Gerenciamento, Defesa de Torres, Simulação, Construção, Fantasia, Faça o que Quiser, Câmera Lateral, Mitologia, Ninja, Exploração, Atmosférico, Medieval, Aventura, Um Jogador, Gráficos Pixelados"
Spark in the Dark,March 2026,Indefinido,https://store.steampowered.com/app/1315180/Spark_in_the_Dark/?snr=1_7_7_popularcomingsoon_150_15,"Explorador de Calabouços, Aventura, RPG, Fantasia Sombria, Ação, Isométrico, Difícil, Soulslike, Subterrâneo, Atmosférico, Fantasia, Sombrio, Exploração, RPG de Ação, Terror de Sobrevivência, Calabouço Misterioso, 3D, Morte Permanente, Um Jogador, Indie"
Mad King Redemption,1º trimestre de 2026,Indefinido,https://store.steampowered.com/app/2369580/Mad_King_Redemption/?snr=1_7_7_popularcomingsoon_150_15,"Acesso Antecipado, Roguelike de Ação, Arcade, Câmera Lateral, Porradaria, Roguelite, 2,5D, Gráficos Pixelados, Controle, Hack and Slash, Ação, Fantasia Sombria, Aventura, Multijogador Local, Velha-Guarda, Cooperativo Local, Jogador X Ambiente (PvE), Retrô, Ação / Aventura, Indie"
Re:Night,1º trimestre de 2026,Indefinido,https://store.steampowered.com/app/2372240/ReNight/?snr=1_7_7_popularcomingsoon_150_15,"Montagem de Decks Roguelike, Tática por Turnos, RPG Tático, Batalha com Cartas, Roguelite, Cartas, Estratégia em Turnos, Jogo de Tabuleiro, RPG de Estratégia, Roguelike, Combate em Turnos, Estratégia, RPG, 2D, Montagem de Decks, Fantasia, Tático, Fantasia Sombria, Um Jogador, Indie"
Underboard,1º trimestre de 2026,Indefinido,https://store.steampowered.com/app/2376610/Underboard/?snr=1_7_7_popularcomingsoon_150_15,"Batalha Automática, Roguelike, Tática por Turnos, RPG de Estratégia, Explorador de Calabouços, Saques, Estratégia, Alta Rejogabilidade, Tático, RPG de Grupos, Um Jogador, Estratégia em Turnos, Geração Procedural, Roguelite, RPG, Gerenciamento de Recursos, Indie, RPG Tático, Jogador X Ambiente (PvE), Visão Superior"
