title,release_date,price,game_url,genres
World of Stickman Classic RTS,2025,Indefinido,https://store.steampowered.com/app/1922500/World_of_Stickman_Classic_RTS/?snr=1_7_7_popularcomingsoon_150_14,"Ação, Estratégia em Tempo Real (RTS), Estratégia, Histórico, Simulação, Atmosférico, Mitologia, Jogador x Jogador (PvP), Editor de Níveis, Construção de Bases, Troca, Gerenciamento de Recursos, Um Jogador, Multijogador Massivo, Indie, Fantasia, Boa Trama, Épico"
The Adventures Of Bryan Scott,December 2025,Indefinido,https://store.steampowered.com/app/1926720/The_Adventures_Of_Bryan_Scott/?snr=1_7_7_popularcomingsoon_150_14,"Aventura, Apontar e Clicar, 2D, Desenhado à Mão, Desenho Animado, Comédia, Boa Trama, Retrô, Um Jogador, Narração, Indie, Quebra-Cabeça, Velha-Guarda, Atmosférico"
Bits & Bops,Q4 2025,Indefinido,https://store.steampowered.com/app/1929290/Bits__Bops/?snr=1_7_7_popularcomingsoon_150_14,"Ritmo, Música, Ação, Minijogos, Pontos, Pontos, Pontos!, Desenho Animado, Do Bem, Fofo, Engraçado, 2D, Colorido, Desenhado à Mão, Controle, Tutorial, Linear, Casual, Comédia, Cartunizado, Um Jogador, Gatos"
Wrekless™,2025,Indefinido,https://store.steampowered.com/app/1931930/Wrekless/?snr=1_7_7_popularcomingsoon_150_14,"Acesso Antecipado, Esportes, Skate, Multijogador, Editor de Níveis, Cooperativo On-line, Personalização de Personagem, Patinação (e Skate), Indie, Jogador x Jogador (PvP), Construção, Arcade, 3D, Terceira Pessoa, Controle, Não Linear, Cartunizado, Física, Um Jogador, Colorido"
SOPA - Tale of the Stolen Potato,2025,Indefinido,https://store.steampowered.com/app/1935330/SOPA__Tale_of_the_Stolen_Potato/?snr=1_7_7_popularcomingsoon_150_14,"Indie, Cinematográfico, Para Toda a Família, Estilizado, Engraçado, Surrealista, Fofo, Comovente, Boa Trama, Colorido, Terceira Pessoa, Atmosférico, Anos 90, Culinária, Narrativa, Conversas, Aconchegante, Quebra-Cabeça, 3D, Aventura"
OPUS: Prism Peak,2025,Indefinido,https://store.steampowered.com/app/1947910/OPUS_Prism_Peak/?snr=1_7_7_popularcomingsoon_150_14,"Boa Trama, Você Decide, Aventura, Comovente, Protagonista Mulher, Anime, Vários Finais, Narrativa, Terceira Pessoa, Romance Visual, Um Jogador, Trilha Sonora, Exploração, Relaxante, Atmosférico, Música, Ficção Interativa, Simulador de Caminhada, Natureza, Indie"
SUFFOCATE,2025,Indefinido,https://store.steampowered.com/app/1965270/SUFFOCATE/?snr=1_7_7_popularcomingsoon_150_14,"Terror, Terror de Sobrevivência, Sobrenatural, Zumbis, Quebra-Cabeça, Conteúdo Sexual, Um Jogador, Sombrio, Terror Psicológico, Atmosférico, Furtivo, Primeira Pessoa, Boa Trama, Aventura, Ação, Exploração, Violento, Simulador de Caminhada, Simulador Imersivo, Fé"
Pizza Slice,2025,Indefinido,https://store.steampowered.com/app/1385290/Pizza_Slice/?snr=1_7_7_popularcomingsoon_150_14,"Simulação, Indie, Culinária, 3D, Estratégia, Para Toda a Família, Um Jogador, Economia, Simulador de Vida Real, Engraçado, Realístico, Gerenciamento de Recursos, Relaxante, Gerenciamento, Primeira Pessoa, Simulador Imersivo, Multijogador, Casual"
Detained: Too Good for School,2025,Indefinido,https://store.steampowered.com/app/1394650/Detained_Too_Good_for_School/?snr=1_7_7_popularcomingsoon_150_14,"Ação, Porradaria, RPG de Ação, Protagonista Mulher, Mundo Aberto, Crime, 2D, Desenhado à Mão, Boa Trama, Fofo, Aventura, RPG, Simulação, Indie, Acesso Antecipado, Anime, Um Jogador, Vários Finais, Kickstarter, Financiado Colaborativamente"
Sand,2025,Indefinido,https://store.steampowered.com/app/1431300/Sand/?snr=1_7_7_popularcomingsoon_150_14,"Acesso Antecipado, Tiro, Multijogador, Jogador x Jogador (PvP), Piratas, Saques, Baseado em Equipes, Pós-Apocalíptico, Atmosférico, Exploração, Cooperativo On-line, Sobrevivência em Mundo Aberto, Combate com Veículos, Steampunk, Mundo Aberto, Tiro em Primeira Pessoa (FPS), Jogador X Ambiente (PvE), Primeira Pessoa, Transportes, Aventura"
Junxions,2025,Indefinido,https://store.steampowered.com/app/1447250/Junxions/?snr=1_7_7_popularcomingsoon_150_14,"Estratégia, Simulação, Construção de Cidades, Construção, Gerenciamento, Faça o que Quiser, Economia, Gerenciamento de Recursos, Compatível com Mods, Realístico, Casual, Mod, Mundo Aberto, Transportes, Um Jogador, Alta Rejogabilidade, Moderno, Tempo Real com Pausa, Para Toda a Família, Engraçado"
Neverlooted Dungeon,2025,Indefinido,https://store.steampowered.com/app/1171980/Neverlooted_Dungeon/?snr=1_7_7_popularcomingsoon_150_14,"Explorador de Calabouços, Simulador Imersivo, Física, Fantasia Sombria, RPG, Primeira Pessoa, Atmosférico, Quebra-Cabeça, Um Jogador, Imersivo, Fantasia, Humor Ácido, Alta Rejogabilidade, Não Linear, Exploração, Faça o que Quiser, Terror, Furtivo, Indie, Retrô"
I Am Jesus Christ,Q4 2025,Indefinido,https://store.steampowered.com/app/1198970/I_Am_Jesus_Christ/?snr=1_7_7_popularcomingsoon_150_14,"Simulação, Aventura, Indie, Casual, Ação, Ficção Interativa, Histórico, Realístico, Primeira Pessoa, Mundo Aberto, Um Jogador, Atmosférico, Boa Trama, Relaxante, Jogo de Divindade, Ação / Aventura, Fé, Simulador de Vida Real, Exploração, Simulador Imersivo"
Deathground,2025,Indefinido,https://store.steampowered.com/app/1200770/Deathground/?snr=1_7_7_popularcomingsoon_150_14,"Acesso Antecipado, Terror, Terror de Sobrevivência, Dinossauros, Jogador X Ambiente (PvE), Caça, Furtivo, Sobrevivência, Hacker, Ação / Aventura, Primeira Pessoa, 3D, Terror Psicológico, Ação, Baseado em Equipes, Thriller, Atmosférico, Fabricação, Aventura, Física"
Dark Fracture,2025,Indefinido,https://store.steampowered.com/app/1268790/Dark_Fracture/?snr=1_7_7_popularcomingsoon_150_14,"Terror, Terror Psicológico, Indie, Aventura, Ação, Thriller, Lovecraftiano, Terror de Sobrevivência, Primeira Pessoa, Exploração, Sombrio, Atmosférico, Simulador de Caminhada, Psicológico, Sobrenatural, Simulação, Surrealista, Ação / Aventura, Violência Detalhada, Demônios"
Space Chef,2025,Indefinido,https://store.steampowered.com/app/1272290/Space_Chef/?snr=1_7_7_popularcomingsoon_150_14,"Cartunizado, Colorido, Combate, Um Jogador, Gerenciamento de Recursos, Relaxante, Desenhado à Mão, RPG, Culinária, Exploração, Espacial, Simulador de Vida Real, Fabricação, Aventura, Sobrevivência, Gerenciamento, Construção de Bases, Alienígenas, Mundo Aberto, Ficção Científica"
Jupiter Moons: Mecha🦾,2025,Indefinido,https://store.steampowered.com/app/1288540/Jupiter_Moons_Mecha/?snr=1_7_7_popularcomingsoon_150_14,"Montagem de Decks Roguelike, Mechas, Montagem de Decks, Cartas, Gerenciamento de Inventário, Batalha com Cartas, Roguelite, Estratégia, Ficção Científica, RPG, Roguelike, Combate em Turnos, RPG Tático, Explorador de Calabouços, Personalização de Personagem, Um Jogador, RPG de Estratégia, Espacial, 2D, Estratégia em Turnos"
Gecko Gods,Q4 2025,Indefinido,https://store.steampowered.com/app/1290760/Gecko_Gods/?snr=1_7_7_popularcomingsoon_150_14,"Ação, Aventura, Plataforma, Plataforma com Quebra-Cabeça, Indie, 3D, Estilizado, Atmosférico, Histórico, Natureza, Mistério, Mundo Aberto, Plataforma 3D, Um Jogador, Fofo, Quebra-Cabeça, Exploração, Para Toda a Família, Relaxante, Controle"
Título não disponível,Data não informada,Indefinido,https://store.steampowered.com/app/2521800/VRSO_Bare_Knuckle_Fighting/?snr=1_7_7_popularcomingsoon_150_14,Sem gênero
Berserk B.I.T.S,Q4 2025,Indefinido,https://store.steampowered.com/app/2348540/Berserk_BITS/?snr=1_7_7_popularcomingsoon_150_14,"Incremental, Simulador Rural, Construção de Bases, Batalha Automática, Construção, Gerenciamento, Economia, Automação, 2D, Casual, Rural, Simulação, Gráficos Pixelados, Gerenciamento de Recursos, Um Jogador, Estratégia, Capitalismo, Fofo, Indie, Natureza"
ELDRIMAR,2025,Indefinido,https://store.steampowered.com/app/2349420/ELDRIMAR/?snr=1_7_7_popularcomingsoon_150_14,"Acesso Antecipado, Boa Trama, Soulslike, Enredo Rico, Fantasia Sombria, Sombrio, Fantasia, RPG de Ação, Atmosférico, Primeira Pessoa, Aventura, RPG, Demônios, Mundo Aberto, Mágica, CRPG, Ação / Aventura, Ação, Medieval, Zumbis"
Outside the Blocks,2025,Indefinido,https://store.steampowered.com/app/2350220/Outside_the_Blocks/?snr=1_7_7_popularcomingsoon_150_14,"Faça o que Quiser, Construção de Cidades, Design e Ilustração, Construção, Medieval, Natureza, Construção de Bases, 3D, Tempo Real, Fofo, Histórico, Relaxante, Geração Procedural, Casual, Simulação, Realístico, Editor de Níveis, Atmosférico, Um Jogador, Aconchegante"
Anseion - Fantasy MMORPG,dezembro de 2025,,https://store.steampowered.com/app/2351990/Anseion__Fantasy_MMORPG/?snr=1_7_7_popularcomingsoon_150_14,"Multijogador Massivo, RPG, MMORPG, Gratuito para Jogar, Mundo Aberto, Gráficos Pixelados, 2D, RPG de Ação, Fantasia, Exploração, Ação, Personalização de Personagem, Indie, Jogador x Jogador (PvP), Aventura, Jogador X Ambiente (PvE), Hack and Slash, Fabricação, Multijogador, Visão Superior"
Finely Diced,2025,Indefinido,https://store.steampowered.com/app/2357970/Finely_Diced/?snr=1_7_7_popularcomingsoon_150_14,"Roguelite, Gerenciamento de Inventário, Montagem de Decks Roguelike, Gerenciamento de Recursos, Estratégia, Roguelike, Montagem de Decks, Só Mouse, Gerenciamento, Indie, Alta Rejogabilidade, Minimalista, Um Jogador, Difícil, Jogo de Tabuleiro, Estratégia em Turnos, Culinária, Gráficos Pixelados, Batalha com Cartas, Psicodélico"
Montaro 2,4º trimestre de 2025,Indefinido,https://store.steampowered.com/app/2368490/Montaro_2/?snr=1_7_7_popularcomingsoon_150_14,"Ação, Comédia, Furtivo, Quebra-Cabeça, Memes, Exploração, Faça o que Quiser, Fofo, Casual, Indie, 2D, Gráficos Pixelados, Anime, Colorido, Um Jogador, Cachorros, Engraçado"
港警成雙：來自城寨 Dual Fire Walled City,Q4 2025,Indefinido,https://store.steampowered.com/app/3918200/_Dual_Fire_Walled_City/?snr=1_7_7_popularcomingsoon_150_14,"Cooperativo, Aventura, Tela Dividida, Crime, Boa Trama, Cooperativo Local, Cooperativo On-line, 3D, Terceira Pessoa, Ação / Aventura, Indie, Multijogador, Multijogador Local"
Panzer Strike,Q4 2025,Indefinido,https://store.steampowered.com/app/3305930/Panzer_Strike/?snr=1_7_7_popularcomingsoon_150_14,"Estratégia, Estratégia em Tempo Real (RTS), Segunda Guerra Mundial, Guerra, Multijogador, Tático, Simulação, Histórico, Militar, Um Jogador, Tática em Tempo Real, Isométrico, Ação, Jogo de Guerra, Tempo Real, Atmosférico, Realístico, Combate, Jogador x Jogador (PvP), Tanques"
Cosmic Fear,2025,Indefinido,https://store.steampowered.com/app/3306920/Cosmic_Fear/?snr=1_7_7_popularcomingsoon_150_14,"Exploração, Ação / Aventura, Lovecraftiano, Alienígenas, Simulador de Caminhada, Primeira Pessoa, Detetive, Terror, Terror Psicológico, Enredo Rico, Controle, Narração, Vários Finais, Boa Trama, Aventura, Realístico, Um Jogador, Atmosférico, Ficção Científica, Terror de Sobrevivência"
As Long As You're Here,Q4 2025,Indefinido,https://store.steampowered.com/app/3309750/As_Long_As_Youre_Here/?snr=1_7_7_popularcomingsoon_150_14,"Aventura, Boa Trama, Simulador de Caminhada, Primeira Pessoa, Protagonista Mulher, Comovente, Exploração, Mistério, Drama, Atmosférico, Um Jogador, Narrativa, 3D, Estilizado, Surrealista, Curta-Metragem, Indie, Minimalista, Romance Visual"
MeteoriteFall,Q4 2025,Indefinido,https://store.steampowered.com/app/3324610/MeteoriteFall/?snr=1_7_7_popularcomingsoon_150_14,"Hentai, Gráficos Pixelados, JRPG, Pós-Apocalíptico, RPG, Simulador de Encontros, Boa Trama, Detetive, Culinária, Conteúdo Sexual, 2D, Combate em Turnos, Estratégia em Turnos, Fofo, Explorador de Calabouços, Ficção Científica, Anime, Um Jogador, Aventura, Construção de Bases"
PIGFACE,2025,Indefinido,https://store.steampowered.com/app/3341650/PIGFACE/?snr=1_7_7_popularcomingsoon_150_14,"Tiro, Ritmo Rápido, Tiro em Primeira Pessoa (FPS), Primeira Pessoa, Simulador Imersivo, Ação / Aventura, Protagonista Mulher, 3D, Terror, Ação, Violência Detalhada, Tático, Retrô, Anos 90, Combate, Um Jogador, Violento, Indie, Para Adultos, Acesso Antecipado"
Ghostwriter Workshop,2025,Indefinido,https://store.steampowered.com/app/3342800/Ghostwriter_Workshop/?snr=1_7_7_popularcomingsoon_150_14,"Aventura, Fofo, Gráficos Pixelados, Jogo de Palavras, Engraçado, Objetos Ocultos, Apontar e Clicar, Colete Tudo, Escolha a sua Aventura, 2D, Comédia, Drama, Romance, Atmosférico, Controle, Boa Trama, Você Decide, Um Jogador, Indie"
Raiders of Blackveil,Q4 2025,Indefinido,https://store.steampowered.com/app/3352240/Raiders_of_Blackveil/?snr=1_7_7_popularcomingsoon_150_14,"Roguelike de Ação, Roguelite, Multijogador, Saques, Visão Superior, Cooperativo On-line, Alta Rejogabilidade, Explorador de Calabouços, Indie, Acesso Antecipado, RPG, Roguelike, Ação, Difícil, Isométrico, Atmosférico, Jogador X Ambiente (PvE), Fantasia, Gerenciamento de Inventário, RPG de Ação"
Comic Book Store Simulator,Q4 2025,Indefinido,https://store.steampowered.com/app/3354220/Comic_Book_Store_Simulator/?snr=1_7_7_popularcomingsoon_150_14,"Simulação, Faça o que Quiser, Gerenciamento de Tempo, 3D, Primeira Pessoa, Realístico, Comédia, Economia, Engraçado, Gerenciamento, Conversas, Gerenciamento de Inventário, Não Linear, Física, Gerenciamento de Recursos, Tutorial, Um Jogador, Casual, Indie"
Cozy,2025,Free,https://store.steampowered.com/app/3357050/Cozy/?snr=1_7_7_popularcomingsoon_150_14,"Construção, Fabricação, Pesca, Natureza, Faça o que Quiser, Simulador Rural, Simulador de Vida Real, Simulador de Encontros, 3D, Fofo, Mundo Aberto, Casual, Relaxante, Simulação, RPG, Aventura, Agricultura, Cooperativo, Cooperativo On-line, Multijogador"
Prolegomena To a Hyperdimensional Interface That Will Be Able to Manifest From Three-Minute Interchanges,2025,Indefinido,https://store.steampowered.com/app/3358590/Prolegomena_To_a_Hyperdimensional_Interface_That_Will_Be_Able_to_Manifest_From_ThreeMinute_Interchanges/?snr=1_7_7_popularcomingsoon_150_14,"Escolha a sua Aventura, Aventura, Ficção Interativa, 2D, Você Decide, Filosófico, Um Jogador, Indie"
Shard Squad,2025,Indefinido,https://store.steampowered.com/app/3363560/Shard_Squad/?snr=1_7_7_popularcomingsoon_150_14,"Roguelike de Ação, Chuva de Balas, Coleção de Criaturas, Roguelite, Roguelike, Gráficos Pixelados, Fofo, Cooperativo, Ação, Casual, Jogador X Ambiente (PvE), 2D, Aventura, Fantasia, Indie, Para Toda a Família, Combate, Um Jogador"
The Jackbox Party Pack 11,Q4 2025,Indefinido,https://store.steampowered.com/app/3364070/The_Jackbox_Party_Pack_11/?snr=1_7_7_popularcomingsoon_150_14,"Casual, Estratégia, Reúna a Galera, Jogo de Tabuleiro, Perguntas e Respostas, 2D, Cartunizado, Colorido, Fofo, Comédia, Cooperativo, Para Toda a Família, Multijogador, Multijogador Local, Fantasia, Em Grupos, Engraçado, Cooperativo On-line, Cooperativo Local, Jogador x Jogador (PvP)"
Fish Stick Protocol,2025,Indefinido,https://store.steampowered.com/app/3367500/Fish_Stick_Protocol/?snr=1_7_7_popularcomingsoon_150_14,"Cooperativo On-line, Ação, Multijogador, Cooperativo, Engraçado, Terror, Exploração, Ação / Aventura, Saques, Comédia, Geração Procedural, Primeira Pessoa, Estilizado, Humor Pesado, Terceira Pessoa, Humor Ácido, Personalização de Personagem, Física, Cartunizado, Colete Tudo"
Backrooms,2025,Free,https://store.steampowered.com/app/3370270/Backrooms/?snr=1_7_7_popularcomingsoon_150_14,"Exploração, Jogador X Ambiente (PvE), Simulador de Caminhada, Terror, Primeira Pessoa, 3D, Terror Psicológico, Ação, Relaxante, Casual, Multijogador, Realístico, Aventura, Atmosférico, Sobrevivência, Sombrio, Sobrenatural, Terror de Sobrevivência, Cooperativo, Cooperativo On-line"
You Sure You Wanna Drink This?,Q4 2025,Indefinido,https://store.steampowered.com/app/3371070/You_Sure_You_Wanna_Drink_This/?snr=1_7_7_popularcomingsoon_150_14,"Quebra-Cabeça, Fofo, Ficção Interativa, Clique e Clique, Protagonista Mulher, Combate em Turnos, Cartunizado, Apontar e Clicar, Casual, Jogo de Palavras, 2D, Detetive, Relaxante, Um Jogador, Fantasia, Drama, Desenho Animado, Cachorros, Indie"
Beyond Sandbox,Q4 2025,Indefinido,https://store.steampowered.com/app/3385970/Beyond_Sandbox/?snr=1_7_7_popularcomingsoon_150_14,"RV, Física, Faça o que Quiser, Compatível com Mods, Imersivo, Multijogador, Violência Detalhada, Ação, Tiro, Violento, Jogador x Jogador (PvP), Indie, Simulação, Acesso Antecipado, Tiro em Primeira Pessoa (FPS), Realístico, Jogador X Ambiente (PvE), Militar, Ação / Aventura, Zumbis"
Clawed,Q4 2025,Indefinido,https://store.steampowered.com/app/3394840/Clawed/?snr=1_7_7_popularcomingsoon_150_14,"Dinossauros, Terror de Sobrevivência, Ação / Aventura, Tiro, Cooperativo, Cooperativo On-line, Ação, Aventura, Terror, Tiro em Terceira Pessoa, Um Jogador, Realístico, Atmosférico, Thriller, Combate, Controle, Gerenciamento de Inventário, Jogador X Ambiente (PvE), Multijogador, 3D"
Dead Format,2025,Indefinido,https://store.steampowered.com/app/3399290/Dead_Format/?snr=1_7_7_popularcomingsoon_150_14,"Terror de Sobrevivência, Terror Psicológico, Terror, Um Jogador, Sobrevivência, Ação, Boa Trama, Mistério, Anos 90, Atmosférico, 3D, Violento, Primeira Pessoa, Sombrio, Anos 80"
PowerWash Simulator 2,2025,Indefinido,https://store.steampowered.com/app/2968420/PowerWash_Simulator_2/?snr=1_7_7_popularcomingsoon_150_15,"Casual, Simulação, Relaxante, Multijogador Local, Faça o que Quiser, Multijogador, Cooperativo Local, Cooperativo On-line, Primeira Pessoa, Simulador Imersivo, 3D, Para Toda a Família, Tela Dividida, Colorido, Realístico, Atmosférico, Um Jogador, Cooperativo, Engraçado, Boa Trama"
Dollhouse of Dead,Q4 2025,Indefinido,https://store.steampowered.com/app/2977810/Dollhouse_of_Dead/?snr=1_7_7_popularcomingsoon_150_15,"Cooperativo On-line, Terror, Engraçado, Comédia, Atmosférico, Cooperativo, Multijogador, Ação / Aventura, Ação, Terror de Sobrevivência, Terror Psicológico, Surrealista, Geração Procedural, Realístico, Thriller, Fabricação, Física, 3D, Sombrio, Aventura"
WARNO - SOUTHAG,2025,Indefinido,https://store.steampowered.com/app/2978630/WARNO__SOUTHAG/?snr=1_7_7_popularcomingsoon_150_15,"Estratégia, Ação, Indie, Simulação"
Dark Deception Chapter 5,2025,Indefinido,https://store.steampowered.com/app/1019932/Dark_Deception_Chapter_5/?snr=1_7_7_popularcomingsoon_150_15,"Ação, Aventura, Indie, RPG, Terror, Terror de Sobrevivência"
'83,Q4 2025,Indefinido,https://store.steampowered.com/app/1059220/83/?snr=1_7_7_popularcomingsoon_150_15,"Ação, Guerra Fria, Violento, Violência Detalhada, Simulação, Tiro em Primeira Pessoa (FPS), Multijogador Massivo, Estratégia, Realístico, Acesso Antecipado, Guerra, Tiro, Primeira Pessoa, Militar, História Alternativa, Tático, Multijogador"
Pax Autocratica,Q4 2025,Indefinido,https://store.steampowered.com/app/1067360/Pax_Autocratica/?snr=1_7_7_popularcomingsoon_150_15,"Ação / Aventura, RPG de Ação, Simulador Político, Simulador de Colônias, Roguelite, Construção de Bases, Militar, Estratégia, Humor Ácido, Mechas, Roguelike de Ação, 3D, Alienígenas, Jogador X Ambiente (PvE), Um Jogador, Ação, Primeira Pessoa, Simulador Espacial, Faça o que Quiser, Exploração"
Theropods,Q4 2025,Indefinido,https://store.steampowered.com/app/1091870/Theropods/?snr=1_7_7_popularcomingsoon_150_15,"Aventura, Protagonista Mulher, Apontar e Clicar, Dinossauros, Gráficos Pixelados, Indie, Quebra-Cabeça, Um Jogador, Colorido, 2D, Retrô, Trilha Sonora Boa, Velha-Guarda, Ficção Científica, Boa Trama"
Rune Fencer Illyia,2025,Indefinido,https://store.steampowered.com/app/1104600/Rune_Fencer_Illyia/?snr=1_7_7_popularcomingsoon_150_15,"Ação, Aventura, Metroidvania, Ação / Aventura, Plataforma, Exploração, Hack and Slash, Câmera Lateral, Soulslike, 2D, Atmosférico, Sombrio, Fantasia Sombria, Fantasia, Difícil, Espada, Combate, Fofo, Mágica, Controle"
Dynasty of the Sands,2025,Indefinido,https://store.steampowered.com/app/1143070/Dynasty_of_the_Sands/?snr=1_7_7_popularcomingsoon_150_15,"Gerenciamento de Recursos, Construção de Bases, Construção de Cidades, Estratégia, Simulação, Sobrevivência, Um Jogador, Economia, Estratégia em Tempo Real (RTS), Faça o que Quiser, Indie, Construção, Automação, Fabricação, Mitologia, Grande Estratégia, Atmosférico, Fantasia, Realístico, Casual"
Dead Static Drive,2025,Indefinido,https://store.steampowered.com/app/1166940/Dead_Static_Drive/?snr=1_7_7_popularcomingsoon_150_15,"Indie, Ação, Aventura, Violento, Lovecraftiano, 3D, Sobrenatural, Isométrico, Terror de Sobrevivência, Controle, Protagonista Mulher, RPG de Ação, CRPG, Colorido, Fantasia Sombria, Demônios, Personalização de Personagem, Você Decide, RPG, Roguelike"
Ammossum,Q4 2025,Indefinido,https://store.steampowered.com/app/2659600/Ammossum/?snr=1_7_7_popularcomingsoon_150_15,"Roguelike, Combate, Alta Rejogabilidade, Um Jogador, Ação / Aventura, Estilizado, Roguelike de Ação, Explorador de Calabouços, Física, Ação, Roguelite, Trens, Velho Oeste, 3D, Personalização de Armas, Engraçado, Câmera Lateral, Zumbis, Difícil, Violência Detalhada"
Rancher: A new life,2025,Indefinido,https://store.steampowered.com/app/2665250/Rancher_A_new_life/?snr=1_7_7_popularcomingsoon_150_15,"Simulação, Simulador Imersivo, Simulador Rural, Casual, Simulador de Vida Real, Relaxante, Primeira Pessoa, Realístico, Construção, Agricultura, Natureza, Estrada de Terra, Direção, Cachorros, Culinária, Pesca, Moderno, Fabricação, Luta Livre, 3D"
STARVEIL PROTOCOL A.A.A.,2025,Indefinido,https://store.steampowered.com/app/2666160/STARVEIL_PROTOCOL_AAA/?snr=1_7_7_popularcomingsoon_150_15,"Aventura, RPG, Ficção Interativa, Estratégia em Turnos, Jogo de Mesa, Tática por Turnos, 2D, Gráficos Pixelados, Anime, Drama, Espacial, Futurista, Atmosférico, Ficção Científica, Protagonista Mulher, Um Jogador, Indie"
桃源村日志（Halcyon Days at Taoyuan）,2025,Indefinido,https://store.steampowered.com/app/2678830/Halcyon_Days_at_Taoyuan/?snr=1_7_7_popularcomingsoon_150_15,"Simulação, Simulador Rural, Exploração, Coleção de Criaturas, CRPG, Gráficos Pixelados, Indie, Agricultura, Fabricação, Drama, Histórico, Culinária, Casual, RPG, Pesca, Boa Trama, Mundo Aberto, Um Jogador"
MONOWAVE,2025,Indefinido,https://store.steampowered.com/app/2680440/MONOWAVE/?snr=1_7_7_popularcomingsoon_150_15,"Aventura, Quebra-Cabeça, Plataforma, Fofo, 2D, Exploração, Aconchegante, Plataforma com Quebra-Cabeça, Ação / Aventura, Câmera Lateral, Comovente, Controle, Desenhado à Mão, Ação, Um Jogador, Cartunizado, Colorido, Do Bem, Para Toda a Família, Atmosférico"
Extinction Day,Q4 2025,Indefinido,https://store.steampowered.com/app/2682380/Extinction_Day/?snr=1_7_7_popularcomingsoon_150_15,"Simulador de Epidemias, Estratégia, Tempo Real com Pausa, Jogo de Divindade, Pós-Apocalíptico, Difícil, Atmosférico, Simulação, Faça o que Quiser, 3D, Destruição, Simulador Político, Gerenciamento, Gerenciamento de Recursos, Um Jogador, Sombrio, Indie, Acesso Antecipado, Alta Rejogabilidade, Grande Estratégia"
GODBREAKERS,2025,Indefinido,https://store.steampowered.com/app/2687400/GODBREAKERS/?snr=1_7_7_popularcomingsoon_150_15,"Roguelike de Ação, Cooperativo On-line, Difícil, Luta Espetacular, Ritmo Rápido, Roguelite, Terceira Pessoa, Ação, Ficção Científica, Jogo de Ação Focado em Personagem, Combate, Hack and Slash, Alta Rejogabilidade, Roguelike, Multijogador, Atmosférico, Saques, RPG de Ação, Cooperativo, Personalização de Personagem"
Eternity's Echo: Patient Zero,Q4 2025,Indefinido,https://store.steampowered.com/app/2688960/Eternitys_Echo_Patient_Zero/?snr=1_7_7_popularcomingsoon_150_15,"Terror, Ação, Terror de Sobrevivência, Primeira Pessoa, Um Jogador, Aventura, Atmosférico, Terror Psicológico, Violento, Boa Trama, Quebra-Cabeça, Tiro em Primeira Pessoa (FPS), Exploração, Tiro, Sobrenatural, Tiro de Heróis, Metroidvania, Ação / Aventura, Thriller, Protagonista Mulher"
Usual June,2025,Indefinido,https://store.steampowered.com/app/2702430/Usual_June/?snr=1_7_7_popularcomingsoon_150_15,"Ação, Ação / Aventura, 3D, Terceira Pessoa, Combate, Hack and Slash, Boa Trama, Colorido, Estilizado, Conspiração, Controle, Aventura, Humor Pesado, Engraçado, Mistério, Detetive, Sobrenatural, Você Decide, Conversas, LGBTQIA+"
ALL WILL FALL: Physics-Based Survival City Builder,2025,Indefinido,https://store.steampowered.com/app/2706020/ALL_WILL_FALL_PhysicsBased_Survival_City_Builder/?snr=1_7_7_popularcomingsoon_150_15,"Simulação, Simulador de Colônias, Física, Alta Rejogabilidade, Construção de Bases, Faça o que Quiser, Gerenciamento, Sobrevivência em Mundo Aberto, Sobrevivência, Estratégia, Um Jogador, Automação, Construção, Gerenciamento de Recursos, Pós-Apocalíptico, Construção de Cidades, Atmosférico, Economia, Político, 3D"
Whirlight - No Time To Trip,2025,Indefinido,https://store.steampowered.com/app/2706980/Whirlight__No_Time_To_Trip/?snr=1_7_7_popularcomingsoon_150_15,"Aventura, Casual, Apontar e Clicar, Anos 90, Comédia, Surrealista, Cartunizado, Colorido, Engraçado, 2D, Para Toda a Família, Quebra-Cabeça, Boa Trama, Retrô, Atmosférico, Viagem no Tempo, Desenho Animado, Um Jogador, Ficção Científica, Protagonista Mulher"
Delverium,2025,Indefinido,https://store.steampowered.com/app/2710040/Delverium/?snr=1_7_7_popularcomingsoon_150_15,"Sobrevivência em Mundo Aberto, Sobrevivência, Simulador Rural, Faça o que Quiser, Aventura, Multijogador, Explorador de Calabouços, Geração Procedural, Gráficos Pixelados, Fabricação, Construção, Exploração, Construção de Bases, Mundo Aberto, Cooperativo, Cooperativo On-line, Cooperativo Local, 2D, RPG, Atmosférico"
