title,release_date,price,game_url,genres
Second Sun,2025,Indefinido,https://store.steampowered.com/app/2085620/Second_Sun/?snr=1_7_7_popularcomingsoon_150_20,"Um Jogador, Indie, Sobrenatural, Tiro de Tiozão, Tiro em Primeira Pessoa (FPS), RPG, Tiro com Saques, Ação / Aventura, Baseado em Classes, Mundo Aberto, Jogador X Ambiente (PvE), Aventura, Tiro, Estilizado, Saques, Exploração, Personalização de Personagem, Geração Procedural, Ação, Demônios"
Lost and Found Co.,2025,Indefinido,https://store.steampowered.com/app/2101390/Lost_and_Found_Co/?snr=1_7_7_popularcomingsoon_150_20,"Objetos Ocultos, Do Bem, Aconchegante, Casual, Coleção de Criaturas, Relaxante, Quebra-Cabeça, Fofo, Colorido, Desenhado à Mão, Aventura, Apontar e Clicar, Para Toda a Família, Um Jogador, 2D, Engraçado, Anime, Boa Trama, Atmosférico, Isométrico"
Kritter: Defend Together,2025,Indefinido,https://store.steampowered.com/app/2103950/Kritter_Defend_Together/?snr=1_7_7_popularcomingsoon_150_20,"Roguelike de Ação, Ação, Cooperativo, Defesa de Torres, Cooperativo Local, Mandando Bala, Roguelite, Construção de Bases, Cooperativo On-line, Controle, SHMUP com Visão Superior, Controle com Alavanca Dupla, Hack and Slash, Tiro com Saques, Indie, Roguelike, Explorador de Calabouços, Personalização de Personagem, Isométrico, Ficção Científica"
Salvus: Aries,2025,Indefinido,https://store.steampowered.com/app/2104400/Salvus_Aries/?snr=1_7_7_popularcomingsoon_150_20,"Otome, Romance, Romance Visual, Protagonista Mulher, Fantasia, Ficção Interativa, Simulação, Boa Trama, Anime, Aventura, Escolha a sua Aventura, Você Decide, Fofo, Narração, 2D, Clique e Clique, Colorido, Um Jogador, Indie"
Forgotten house,2025,Indefinido,https://store.steampowered.com/app/2111430/Forgotten_house/?snr=1_7_7_popularcomingsoon_150_20,"Gráficos Pixelados, Ação, Terror de Sobrevivência, Vários Finais, Furtivo, Atmosférico, Câmera Lateral, Objetos Ocultos, Terror, Terror Psicológico, Exploração, Quebra-Cabeça, Um Jogador, Plataforma com Quebra-Cabeça, Sombrio, Protagonista Mulher, Plataforma, 2D, Indie"
BrokenLore: UNFOLLOW,2025,Indefinido,https://store.steampowered.com/app/2133830/BrokenLore_UNFOLLOW/?snr=1_7_7_popularcomingsoon_150_20,"Psicodélico, Terror, Sombrio, Terror Psicológico, Atmosférico, Mistério, Realístico, Um Jogador, Ação, Boa Trama, Primeira Pessoa, Vários Finais, LGBTQIA+, Sobrevivência, Surrealista, Furtivo, Terror de Sobrevivência, Crime, Demônios, Aventura"
WorldShards,2025,,https://store.steampowered.com/app/2156390/WorldShards/?snr=1_7_7_popularcomingsoon_150_20,"Simulador Rural, Ação / Aventura, Exploração, Fabricação, Natureza, Aventura, Simulação, Relaxante, Multijogador, Cooperativo On-line, RPG, MMORPG, Personalização de Personagem, Mundo Aberto, RPG de Ação, Simulador Imersivo, Simulador de Vida Real, Mágica, Mistério, Cooperativo"
Decks of the Damned,4º trimestre de 2025,Indefinido,https://store.steampowered.com/app/2159900/Decks_of_the_Damned/?snr=1_7_7_popularcomingsoon_150_20,"Cartas, Gerenciamento, Batalha com Cartas, Sobrevivência, Roguelite, Solitário, Estratégia, 2D, Um Jogador, Jogo de Mesa, Montagem de Decks, Simulação, Fantasia, Fabricação, Batalha Automática, Fantasia Sombria, Vampiros, Gráficos Pixelados, Exploração, Indie"
Streets of Rogue 2,2025,Indefinido,https://store.steampowered.com/app/2165810/Streets_of_Rogue_2/?snr=1_7_7_popularcomingsoon_150_20,"Simulação, Mundo Aberto, RPG, Faça o que Quiser, Roguelike de Ação, Sobrevivência em Mundo Aberto, Multijogador, Construção de Bases, Exploração, Roguelike, Personalização de Personagem, Cooperativo On-line, Um Jogador, Geração Procedural, 2D, Sobrevivência, Cooperativo Local, Aventura, Fabricação, Colorido"
Título não disponível,Data não informada,Indefinido,https://store.steampowered.com/app/2173460/Echoes_of_the_Living/?snr=1_7_7_popularcomingsoon_150_20,Sem gênero
Sunkissed City,2025,Indefinido,https://store.steampowered.com/app/2175840/Sunkissed_City/?snr=1_7_7_popularcomingsoon_150_20,"Simulador de Vida Real, Simulador Rural, Mundo Aberto, Faça o que Quiser, Simulação, Exploração, Personalização de Personagem, RPG, Gráficos Pixelados, Casual, Colorido, Culinária, Fabricação, Pesca, Romance, Compatível com Mods, Cooperativo, Cooperativo Local, Multijogador Local, 2D"
Gilded Destiny,2025,Indefinido,https://store.steampowered.com/app/2189430/Gilded_Destiny/?snr=1_7_7_popularcomingsoon_150_20,"Estratégia, Simulação, Grande Estratégia, Histórico, Gerenciamento, 4X, Guerra, Faça o que Quiser, Economia, Compatível com Mods, Tático, Militar, História Alternativa, Mundo Aberto, Um Jogador, Gerenciamento de Recursos, Tempo Real com Pausa, Diplomacia, Estratégia em Tempo Real (RTS), Alta Rejogabilidade"
Exiler,2025,Indefinido,https://store.steampowered.com/app/2197240/Exiler/?snr=1_7_7_popularcomingsoon_150_20,"Desenhado à Mão, Terror, Câmera Lateral, Quebra-Cabeça, Ficção Interativa, Gerenciamento de Tempo, Design e Ilustração, Detetive, Apontar e Clicar, 2D, Objetos Ocultos, Terror Psicológico, Narração, Casual, Estilizado, Demônios, Lovecraftiano, Furtivo, Atmosférico, Mistério"
Adaptory,2025,Indefinido,https://store.steampowered.com/app/2201620/Adaptory/?snr=1_7_7_popularcomingsoon_150_20,"Simulação, Simulador de Colônias, Construção de Bases, Boa Trama, Indie, Sobrevivência, Geração Procedural, Gerenciamento de Recursos, Automação, 2D, Um Jogador, Ficção Científica, Colorido, Gerenciamento, Compatível com Mods, Construção, Exploração, Ciência, Física, Tutorial"
Total Chaos,Q4 2025,Indefinido,https://store.steampowered.com/app/2208350/Total_Chaos/?snr=1_7_7_popularcomingsoon_150_20,"Ação, Terror Psicológico, Aventura, Atmosférico, Terror, Ação / Aventura, Exploração, Tiro em Primeira Pessoa (FPS), Primeira Pessoa, Realístico, Fabricação, Sombrio, Saques, Mistério, Psicológico, Sobrenatural, Surrealista, Pós-Apocalíptico, RPG de Ação, 3D"
Hoglands,Q4 2025,Indefinido,https://store.steampowered.com/app/2210240/Hoglands/?snr=1_7_7_popularcomingsoon_150_20,"Câmera Lateral, Exploração, Construção de Cidades, Faça o que Quiser, Defesa de Torres, Plataforma, Estratégia em Tempo Real (RTS), Personalização de Personagem, RPG, Estratégia, 2D, Construção de Bases, Mundo Aberto, Ação, Gerenciamento, Medieval, Fantasia, Atmosférico, Construção, Fabricação"
Tiny Lands 2,2025,Indefinido,https://store.steampowered.com/app/2213330/Tiny_Lands_2/?snr=1_7_7_popularcomingsoon_150_20,"Relaxante, Quebra-Cabeça, Apontar e Clicar, Objetos Ocultos, Fofo, Casual, Aventura, Não Linear, Para Toda a Família, Colete Tudo, Colorido, Tela Dividida, Realístico, Plataforma 3D, Visão 3D, Atmosférico, Engraçado, 3D, Cooperativo Local, Cinematográfico"
Voice of Belldona,2025,Indefinido,https://store.steampowered.com/app/2223420/Voice_of_Belldona/?snr=1_7_7_popularcomingsoon_150_20,"Montagem de Decks Roguelike, Indie, Anime, Hentai, Impróprio para o Local de Trabalho, Um Jogador, Tiro em Primeira Pessoa (FPS), Montagem de Decks, RPG, Cartas, Boa Trama, Simulador de Encontros, Roguelike, Roguelite, JRPG, Estratégia em Turnos, Casual, Tática por Turnos, Combate em Turnos, Aventura"
Nomad Drive,2025,Indefinido,https://store.steampowered.com/app/2223980/Nomad_Drive/?snr=1_7_7_popularcomingsoon_150_20,"Realístico, Fabricação, Direção, Sobrevivência, Multijogador, Geração Procedural, Simulador Automobilístico, Pós-Apocalíptico, Exploração, Escolha a sua Aventura, Simulação, Aventura, Construção de Bases, Faça o que Quiser, Física, Atmosférico, Primeira Pessoa, Gerenciamento, Culinária, 3D"
Glory To The Heroes,Q4 2025,Indefinido,https://store.steampowered.com/app/2239670/Glory_To_The_Heroes/?snr=1_7_7_popularcomingsoon_150_20,"Acesso Antecipado, Ação, Simulação, Jogo de Guerra, Tiro, Tiro em Primeira Pessoa (FPS), Primeira Pessoa, Realístico, Guerra, Cinematográfico, Militar, Tático, Combate, Jogador x Jogador (PvP), Jogador X Ambiente (PvE), Baseado em Equipes, Multijogador Massivo, Personalização de Personagem, Multijogador, Violento"
UNBEATABLE,2025,Indefinido,https://store.steampowered.com/app/2240620/UNBEATABLE/?snr=1_7_7_popularcomingsoon_150_20,"Ritmo, Anime, Protagonista Mulher, Música, Boa Trama, Exploração, LGBTQIA+, Arcade, Romance Visual, Aventura, Desenhado à Mão, Colorido, Anos 90, Você Decide, 3D, Um Jogador, 2D, Ação / Aventura, Controle, Conversas"
Arcticide,2025,Indefinido,https://store.steampowered.com/app/2259590/Arcticide/?snr=1_7_7_popularcomingsoon_150_20,"Acesso Antecipado, Tiro em Primeira Pessoa (FPS), Sobrevivência, Exploração, Roguelike de Ação, Atmosférico, Pós-Apocalíptico, Geração Procedural, Um Jogador, Terror de Sobrevivência, Simulador Imersivo, Tático, Tiro, Personalização de Armas, Roguelike, Roguelite, Ficção Científica, Explorador de Calabouços, Furtivo, Ação"
Wish Upon A Llama,2025,Indefinido,https://store.steampowered.com/app/2262630/Wish_Upon_A_Llama/?snr=1_7_7_popularcomingsoon_150_20,"RPG, Simulação, Fofo, 2D, Aconchegante, Boa Trama, Simulador de Vida Real, Simulador de Emprego, Relaxante, Simulador de Encontros, Exploração, Simulador Rural, Personalização de Personagem, Romance, Visão Superior, Gráficos Pixelados, Natureza, Protagonista Mulher, Um Jogador, Simulador Imersivo"
Ascendance,2025,Indefinido,https://store.steampowered.com/app/2275750/Ascendance/?snr=1_7_7_popularcomingsoon_150_20,"Acesso Antecipado, Estratégia, 4X, Grande Estratégia, Estratégia em Tempo Real (RTS), Simulação, Espacial, Ficção Científica, Mundo Aberto, Gerenciamento de Recursos, Automação, Exploração, Futurista, Economia, Gerenciamento, Tático, Você Decide, Compatível com Mods, Diplomacia, 3D"
Styx: Blades of Greed,4º trimestre de 2025,Indefinido,https://store.steampowered.com/app/3290690/Styx_Blades_of_Greed/?snr=1_7_7_popularcomingsoon_150_21,"Ação, Aventura, Furtivo, Um Jogador, Violento, Atmosférico, Boa Trama, Terceira Pessoa, Assassino, Fantasia Sombria, Parkour"
Easy Delivery Co.,2025,Indefinido,https://store.steampowered.com/app/3293010/Easy_Delivery_Co/?snr=1_7_7_popularcomingsoon_150_21,"Direção, Um Jogador, Relaxante, Mundo Aberto, Fofo, Exploração, Simulador Automobilístico, Ficção Interativa, Boa Trama, Simulação, Corrida, Física, Arcade, 3D, Tela Dividida, Neve, Atmosférico, Controle, Casual, Gráficos Pixelados"
The Sisterhood Pasture: Cozy Folklore Farming,2025,Indefinido,https://store.steampowered.com/app/3297080/The_Sisterhood_Pasture_Cozy_Folklore_Farming/?snr=1_7_7_popularcomingsoon_150_21,"Casual, Aconchegante, Simulador Rural, Protagonista Mulher, Simulador de Vida Real, Gráficos Pixelados, Simulador Imersivo, 2D, Fofo, Colorido, Drama, Simulação, Culinária, Romance, Gatos, Moderno, Boa Trama, Combate, Um Jogador, Multijogador"
Sleep Well Cemetery,2025,Indefinido,https://store.steampowered.com/app/3301350/Sleep_Well_Cemetery/?snr=1_7_7_popularcomingsoon_150_21,"Sobrevivência, Zumbis, Tiro em Primeira Pessoa (FPS), Construção de Bases, Hack and Slash, Defesa de Torres, RPG de Ação, Estratégia, Voxel, Humor Ácido, Terror, Ação, Pós-Apocalíptico, Gerenciamento, Direção, Medieval, Furtivo, Agricultura, Simulação, Construção"
As Long As You're Here,4º trimestre de 2025,Indefinido,https://store.steampowered.com/app/3309750/As_Long_As_Youre_Here/?snr=1_7_7_popularcomingsoon_150_21,"Aventura, Boa Trama, Simulador de Caminhada, Primeira Pessoa, Protagonista Mulher, Comovente, Exploração, Mistério, Drama, Atmosférico, Um Jogador, Narrativa, 3D, Estilizado, Surrealista, Curta-Metragem, Indie, Minimalista, Romance Visual"
CloverPit,2025,Indefinido,https://store.steampowered.com/app/3314790/CloverPit/?snr=1_7_7_popularcomingsoon_150_21,"Roguelite, Roguelike, Apostas, Estratégia, 3D, Primeira Pessoa, Terror Psicológico, Terror, Humor Ácido, Surrealista, Vários Finais, Sombrio, Psicológico, Física, Um Jogador, Gerenciamento de Recursos, Geração Procedural, Indie, Simulação"
Crimson Desert,2025,Indefinido,https://store.steampowered.com/app/3321460/Crimson_Desert/?snr=1_7_7_popularcomingsoon_150_21,"Ação, Mundo Aberto, Aventura, Combate, Um Jogador, Dragões, Exploração, Escolha a sua Aventura, Boa Trama, Ação / Aventura, Cavalos, 3D, Terceira Pessoa, Jogador X Ambiente (PvE), Medieval, Primeira Pessoa, Fantasia, Violência Detalhada, Violento, RPG"
Blippo+,2025,Indefinido,https://store.steampowered.com/app/3323850/Blippo/?snr=1_7_7_popularcomingsoon_150_21,"Casual, FMV, Cinematográfico, Gráficos Pixelados, Psicodélico, Realístico, Estilizado, Anos 80, Anos 90, Comédia, Engraçado, LGBTQIA+, Ficção Científica, Surrealista, Subterrâneo, Boa Trama, Filosófico, Um Jogador, Baseado em Texto, Indie"
落星,4º trimestre de 2025,Indefinido,https://store.steampowered.com/app/3324610/MeteoriteFall/?snr=1_7_7_popularcomingsoon_150_21,"Hentai, Gráficos Pixelados, JRPG, Pós-Apocalíptico, RPG, Simulador de Encontros, Boa Trama, Detetive, Culinária, Conteúdo Sexual, 2D, Combate em Turnos, Estratégia em Turnos, Fofo, Explorador de Calabouços, Ficção Científica, Anime, Um Jogador, Aventura, Construção de Bases"
Raiders of Blackveil,4º trimestre de 2025,Indefinido,https://store.steampowered.com/app/3352240/Raiders_of_Blackveil/?snr=1_7_7_popularcomingsoon_150_21,"Roguelike de Ação, Roguelite, Multijogador, Saques, Visão Superior, Cooperativo On-line, Alta Rejogabilidade, Explorador de Calabouços, Indie, Acesso Antecipado, RPG, Roguelike, Ação, Difícil, Isométrico, Atmosférico, Jogador X Ambiente (PvE), Fantasia, Gerenciamento de Inventário, RPG de Ação"
プロレゴメナ およそ3分間の交信の先に現れるであろうきわめて超次元的なインターフェースのための序論,2025,Indefinido,https://store.steampowered.com/app/3358590/Prolegomena_To_a_Hyperdimensional_Interface_That_Will_Be_Able_to_Manifest_From_ThreeMinute_Interchanges/?snr=1_7_7_popularcomingsoon_150_21,"Escolha a sua Aventura, Aventura, Ficção Interativa, 2D, Você Decide, Filosófico, Um Jogador, Indie"
Shard Squad,2025,Indefinido,https://store.steampowered.com/app/3363560/Shard_Squad/?snr=1_7_7_popularcomingsoon_150_21,"Roguelike de Ação, Chuva de Balas, Coleção de Criaturas, Roguelite, Roguelike, Gráficos Pixelados, Fofo, Cooperativo, Ação, Casual, Jogador X Ambiente (PvE), 2D, Aventura, Fantasia, Indie, Para Toda a Família, Combate, Um Jogador"
The Jackbox Party Pack 11,4º trimestre de 2025,Indefinido,https://store.steampowered.com/app/3364070/The_Jackbox_Party_Pack_11/?snr=1_7_7_popularcomingsoon_150_21,"Casual, Estratégia, Reúna a Galera, Jogo de Tabuleiro, Perguntas e Respostas, 2D, Cartunizado, Colorido, Fofo, Comédia, Cooperativo, Para Toda a Família, Multijogador, Multijogador Local, Fantasia, Em Grupos, Engraçado, Cooperativo On-line, Cooperativo Local, Jogador x Jogador (PvP)"
Dream Garden,2025,Indefinido,https://store.steampowered.com/app/3367600/Dream_Garden/?snr=1_7_7_popularcomingsoon_150_21,"Faça o que Quiser, Construção, Design e Ilustração, Relaxante, Simulação, Aconchegante, Casual, Natureza, Indie, Simulador Imersivo, Fofo, Atmosférico, Colorido, Minimalista, Estilizado, 3D, Visão Superior, Um Jogador, Música, Para Toda a Família"
Backrooms,2025,Free,https://store.steampowered.com/app/3370270/Backrooms/?snr=1_7_7_popularcomingsoon_150_21,"Exploração, Jogador X Ambiente (PvE), Simulador de Caminhada, Terror, Primeira Pessoa, 3D, Terror Psicológico, Ação, Relaxante, Casual, Multijogador, Realístico, Aventura, Atmosférico, Sobrevivência, Sombrio, Sobrenatural, Terror de Sobrevivência, Cooperativo, Cooperativo On-line"
The Way of the Tray: Japanese Restaurant Simulator 🍙,2025,Indefinido,https://store.steampowered.com/app/3373830/The_Way_of_the_Tray_Japanese_Restaurant_Simulator/?snr=1_7_7_popularcomingsoon_150_21,"Culinária, Simulação, Gráficos Pixelados, Cartunizado, Simulador de Emprego, Engraçado, 2D, Gerenciamento de Tempo, Comédia, Gerenciamento, Colorido, Roguelite, Casual, Desenho Animado, Boa Trama, Estratégia, Física, Um Jogador, Para Toda a Família, Visão Superior"
Beyond Sandbox,Q4 2025,Indefinido,https://store.steampowered.com/app/3385970/Beyond_Sandbox/?snr=1_7_7_popularcomingsoon_150_21,"RV, Física, Faça o que Quiser, Compatível com Mods, Imersivo, Multijogador, Violência Detalhada, Ação, Tiro, Violento, Jogador x Jogador (PvP), Indie, Simulação, Acesso Antecipado, Tiro em Primeira Pessoa (FPS), Realístico, Jogador X Ambiente (PvE), Militar, Ação / Aventura, Zumbis"
我的恋爱逃生攻略 Love to Live,2025,Indefinido,https://store.steampowered.com/app/3389200/_Love_to_Live/?snr=1_7_7_popularcomingsoon_150_21,"RPG, Simulador de Encontros, Ficção Interativa, Protagonista Mulher, Romance Visual, Boa Trama, Romance, Vários Finais, CRPG, Detetive, Mistério, Anime, Drama, Espacial, Otome, Comovente, Baseado em Texto, Conversas, Linear, Um Jogador"
CAPTURED 2,Q4 2025,Indefinido,https://store.steampowered.com/app/3390880/CAPTURED_2/?snr=1_7_7_popularcomingsoon_150_21,"Ação, Ação / Aventura, Quebra-Cabeça, Exploração, Objetos Ocultos, Simulador Imersivo, Primeira Pessoa, Realístico, Anos 90, Atmosférico, Terror, Mistério, Psicológico, Terror Psicológico, Surrealista, Terror de Sobrevivência, Geração Procedural, Um Jogador, Fuja da Sala"
Ramen Shop Simulator,Q4 2025,Indefinido,https://store.steampowered.com/app/3393720/Ramen_Shop_Simulator/?snr=1_7_7_popularcomingsoon_150_21,"Gerenciamento de Tempo, Simulação, Gerenciamento, Inteligência Artificial, Fabricação, Simulador de Vida Real, 3D, Culinária, Atmosférico, Gerenciamento de Inventário, Gerenciamento de Recursos, Um Jogador"
Dead Format,2025,Indefinido,https://store.steampowered.com/app/3399290/Dead_Format/?snr=1_7_7_popularcomingsoon_150_21,"Terror de Sobrevivência, Terror Psicológico, Terror, Um Jogador, Sobrevivência, Ação, Boa Trama, Mistério, Anos 90, Atmosférico, 3D, Violento, Primeira Pessoa, Sombrio, Anos 80"
Cooking Clash,2025,Indefinido,https://store.steampowered.com/app/3399680/Cooking_Clash/?snr=1_7_7_popularcomingsoon_150_21,"RPG, Culinária, RV, Primeira Pessoa, Simulação, Comédia, Desenho Animado, 3D, Casual, Simulador de Vida Real, Para Toda a Família, Fabricação, Gerenciamento de Tempo, Anime, Cartunizado, Fofo, Colorido, Construção, Relaxante, Gerenciamento de Inventário"
Abyss Ring,Q4 2025,Indefinido,https://store.steampowered.com/app/3401570/Abyss_Ring/?snr=1_7_7_popularcomingsoon_150_21,"RPG, Ação, Roguelike, Roguelike de Ação, Explorador de Calabouços, Hack and Slash, 3D, Primeira Pessoa, Realístico, Cinematográfico, Sobrevivência, Terror de Sobrevivência, Sombrio, Fantasia Sombria, Fantasia, Roma, Medieval, Subterrâneo, Culinária, Mitologia"
Spiritbound: The Goddess's Quest,2025,Indefinido,https://store.steampowered.com/app/3421410/Spiritbound_The_Goddesss_Quest/?snr=1_7_7_popularcomingsoon_150_21,"Impróprio para o Local de Trabalho, Hentai, Para Adultos, Casual, RPG, Ficção Interativa, Exploração, Gráficos Pixelados, Drama, Fantasia, Investigação, Protagonista Mulher, Indie, Linear, Um Jogador"
Terra Firma 2,2025,Indefinido,https://store.steampowered.com/app/3422270/Terra_Firma_2/?snr=1_7_7_popularcomingsoon_150_21,"Simulação, Faça o que Quiser, Jogo de Divindade, Relaxante, Um Jogador, Indie, Natureza, Estratégia, Atmosférico, Construção, Acesso Antecipado, Física, Ciência, Para Toda a Família, Casual, Destruição, Mundo Aberto, Realístico, Quebra-Cabeça, Agricultura"
Frozen Ship,Q4 2025,Indefinido,https://store.steampowered.com/app/3423990/Frozen_Ship/?snr=1_7_7_popularcomingsoon_150_21,"Acesso Antecipado, Neve, Sobrevivência, Atmosférico, Aventura, Pós-Apocalíptico, Exploração, Economia, Geração Procedural, Gerenciamento de Recursos, Ação, Construção de Bases, Estratégia, Fabricação, Construção, Um Jogador, Distópico, Objetos Ocultos, Ação / Aventura, Gerenciamento"
LOVE Hotel Simulator 🏩,2025,Indefinido,https://store.steampowered.com/app/3426430/LOVE_Hotel_Simulator/?snr=1_7_7_popularcomingsoon_150_21,"Simulador Imersivo, Faça o que Quiser, Construção, Gerenciamento de Recursos, Gerenciamento, Física, Realístico, Você Decide, Moderno, Boa Trama, 3D, Casual, Primeira Pessoa, Mundo Aberto, Simulação, Estratégia, RPG, Gratuito para Jogar, Um Jogador, Simulador de Vida Real"
Food Wagon,2025,Indefinido,https://store.steampowered.com/app/3434130/Food_Wagon/?snr=1_7_7_popularcomingsoon_150_21,"Roguelike de Ação, Culinária, Ação / Aventura, Anime, Protagonista Mulher, 3D, Fofo, Ação, Controle, Jogador X Ambiente (PvE), Colorido, Estilizado, Roguelite, Fantasia, Aventura, Medieval, Combate, Um Jogador"
project; VIRAI: DOOMER’s LIFE ESCAPE,Q4 2025,Indefinido,https://store.steampowered.com/app/3434180/project_VIRAI_DOOMERs_LIFE_ESCAPE/?snr=1_7_7_popularcomingsoon_150_21,"Terror Psicológico, Boa Trama, Simulador de Vida Real, Terror, Anime, Protagonista Mulher, Romance Visual, Vários Finais, Você Decide, Atmosférico, 2D, Thriller, Drama, Simulação, Aventura, Casual, Sombrio, Comovente, Gerenciamento, Escolha a sua Aventura"
Contraband Police - Crimson Fall,Q4 2025,Indefinido,https://store.steampowered.com/app/3439880/Contraband_Police__Crimson_Fall/?snr=1_7_7_popularcomingsoon_150_21,"Mundo Aberto, Simulação, Ação, Primeira Pessoa, Um Jogador, Vários Finais, Realístico, Anos 80, Simulador Automobilístico, Tiro em Primeira Pessoa (FPS), Boa Trama, Gerenciamento, Sobrevivência, Detetive, Simulador Imersivo, Ação / Aventura, Física, Destruição, Atmosférico, Indie"
Drunkard Simulator,2025,Indefinido,https://store.steampowered.com/app/3440390/Drunkard_Simulator/?snr=1_7_7_popularcomingsoon_150_21,"Indie, Ação, Simulação, Acesso Antecipado, Personalização de Personagem, Gerenciamento, Comédia, Cooperativo, Direção, Multijogador, Física, Ação / Aventura, Mundo Aberto, Faça o que Quiser, Escolha a sua Aventura, Simulador Imersivo, Engraçado, Sobrevivência, RPG, Culinária"
Withering Realms,Q4 2025,Indefinido,https://store.steampowered.com/app/3441990/Withering_Realms/?snr=1_7_7_popularcomingsoon_150_21,"RPG, Ação, Terror, Soulslike, RPG de Ação, 3D, Terror de Sobrevivência, Mistério, Noir, Personalização de Personagem, Protagonista Mulher, Indie, Vários Finais, Boa Trama, Um Jogador"
Sora no Kiseki the 1st,2025,Indefinido,https://store.steampowered.com/app/3447040/Sora_no_Kiseki_the_1st/?snr=1_7_7_popularcomingsoon_150_21,"RPG, JRPG, RPG de Ação, Ficção Interativa, RPG de Grupos, Romance Visual, Tática por Turnos, 3D, Fofo, Anime, Romance, Fantasia, Mágica, Protagonista Mulher, Boa Trama, Um Jogador, Em Turnos, Bom Roteiro, Sequência"
恋爱泡馍！青春老陕：Shannxi Love Story,2025,Indefinido,https://store.steampowered.com/app/3453470/Shannxi_Love_Story/?snr=1_7_7_popularcomingsoon_150_21,"RPG, Casual, Simulador de Encontros, Romance Visual, Jogo de Palavras, 2D, Anime, Fofo, Drama, Indie, Simulação, Comovente, Relaxante, Boa Trama, Um Jogador"
Harrowlands,2025,Indefinido,https://store.steampowered.com/app/3460400/Harrowlands/?snr=1_7_7_popularcomingsoon_150_21,"Acesso Antecipado, Construção de Bases, Construção de Cidades, Estratégia, Sobrevivência, Simulador de Colônias, Exploração, Geração Procedural, Gerenciamento, Enredo Rico, Fantasia, Simulação, Medieval, Visão Superior, RPG de Estratégia, Compatível com Mods, Pós-Apocalíptico, RPG Tático, Gerenciamento de Recursos, Fabricação"
Sani Yang's Laboratory,Q4 2025,Indefinido,https://store.steampowered.com/app/3464370/Sani_Yangs_Laboratory/?snr=1_7_7_popularcomingsoon_150_21,"Simulação, Simulador de Encontros, Romance Visual, 2D, 3D, Anime, Cartunizado, Fofo, Baseado em Texto, Drama, Comovente, Fantasia, Gerenciamento, Romance, Boa Trama, Você Decide, Um Jogador, Aventura"
Wall World 2,2025,Indefinido,https://store.steampowered.com/app/3467710/Wall_World_2/?snr=1_7_7_popularcomingsoon_150_21,"Roguelite, Mineração, Gráficos Pixelados, Defesa de Torres, Roguelike, Estratégia, Exploração, Geração Procedural, Ação / Aventura, Ação, Gerenciamento, Alienígenas, Mechas, Combate, Câmera Lateral, Ficção Científica, 2D, Gerenciamento de Recursos, Um Jogador, Aventura"
Ember and Blade,2025,Indefinido,https://store.steampowered.com/app/3470500/Ember_and_Blade/?snr=1_7_7_popularcomingsoon_150_21,"Roguelite, Sobrevivência, Hack and Slash, RPG de Ação, RPG, Chuva de Balas, Ação / Aventura, Boa Trama, Mitologia, Fantasia Sombria, Atmosférico, Isométrico, Colorido, Estilizado, Difícil, Combate, Ação, Alta Rejogabilidade, Um Jogador, Controle"
Brno Transit,Q4 2025,Indefinido,https://store.steampowered.com/app/3476880/Brno_Transit/?snr=1_7_7_popularcomingsoon_150_21,"Terror Psicológico, Trens, Subterrâneo, Exploração, Apontar e Clicar, Direção, Terror, Atmosférico, Mistério, Primeira Pessoa, Retrô, 3D, Simulação, Simulador de Vida Real, Aventura, Casual, Sombrio, Transportes, Gráficos Pixelados, Psicológico"
Okko The Exiled,2025,Indefinido,https://store.steampowered.com/app/3479420/Okko_The_Exiled/?snr=1_7_7_popularcomingsoon_150_21,"Câmera Lateral, Ação, Plataforma 2D, Plataforma, Ação / Aventura, Aventura, 2D, Controle, Boa Trama, Gráficos Pixelados, Fantasia Sombria, Indie, Fantasia, Retrô, Combate, Um Jogador"
Honey Trap Escape ~ Family of Villains and the Cage ~,2025,Indefinido,https://store.steampowered.com/app/3481240/Honey_Trap_Escape__Family_of_Villains_and_the_Cage/?snr=1_7_7_popularcomingsoon_150_21,"Hentai, Conteúdo Sexual, RPG, Para Adultos, Impróprio para o Local de Trabalho, Casual, JRPG, Explorador de Calabouços, Anime, Colorido, Indie, Um Jogador, 2D, História em Quadrinhos"
