title,release_date,price,game_url,genres
GROWTH EXPERIMENT,2025,Indefinido,https://store.steampowered.com/app/2745510/GROWTH_EXPERIMENT/?snr=1_7_7_popularcomingsoon_150_7,"Um Jogador, Simulação, Indie, Atmosférico, Vários Finais, Escolha a sua Aventura, Romance Visual, Simulador Imersivo, Gerenciamento, Boa Trama, 2D, Aventura, Simulador de Encontros"
Aces of Thunder,2025,Indefinido,https://store.steampowered.com/app/2754090/Aces_of_Thunder/?snr=1_7_7_popularcomingsoon_150_7,"Simulação, RV, Ação, Voo, Combate, 3D, Primeira Pessoa, Realístico, Histórico, Militar, Segunda Guerra Mundial, Guerra, Jogador x Jogador (PvP), Cooperativo, Multijogador, Cooperativo On-line, Um Jogador, Tiro"
Hibernaculum,Q4 2025,Indefinido,https://store.steampowered.com/app/2789020/Hibernaculum/?snr=1_7_7_popularcomingsoon_150_7,"RPG, Explorador de Calabouços, Gráficos Pixelados, Terror, Exploração, Atmosférico, CRPG, Terror de Sobrevivência, Quebra-Cabeça, Cyberpunk, Estratégia em Turnos, Hack and Slash, RPG Tático, 2D, Mistério, Primeira Pessoa, Anos 80, Sombrio, RPG de Estratégia, Gerenciamento"
Paris Transylvania,2025,Indefinido,https://store.steampowered.com/app/2459560/Paris_Transylvania/?snr=1_7_7_popularcomingsoon_150_7,"Montagem de Decks, Roguelike, Roguelite, Pinball, Em Turnos, Estratégia, Morte Permanente, 2,5D, Alta Rejogabilidade, RPG, Combate em Turnos, Montagem de Decks Roguelike, Cartas, Um Jogador, Física, Batalha com Cartas, Arcade, Fantasia, Indie, Casual"
Bylina,2025,Indefinido,https://store.steampowered.com/app/2461440/Bylina/?snr=1_7_7_popularcomingsoon_150_7,"Ação, RPG, RPG de Ação, Humor Ácido, Ação / Aventura, Hack and Slash, Mitologia, Um Jogador, Visão Superior, Combate, Colorido, Violência Detalhada, Violento, Fabricação, 3D, Fantasia, Aventura, Comédia, Boa Trama, Trilha Sonora Boa"
Sky Harvest,2025,Indefinido,https://store.steampowered.com/app/2482840/Sky_Harvest/?snr=1_7_7_popularcomingsoon_150_7,"RPG, Simulador Rural, Simulador de Vida Real, Exploração, Relaxante, Agricultura, Fabricação, Faça o que Quiser, Pesca, Simulador de Encontros, Construção, Culinária, Mundo Aberto, Romance, Personalização de Personagem, 3D, Fofo, Boa Trama, Capitalismo, Terceira Pessoa"
A Story in Bronze Ware,2025,Indefinido,https://store.steampowered.com/app/2483660/A_Story_in_Bronze_Ware/?snr=1_7_7_popularcomingsoon_150_7,"Estratégia, RPG, Simulação, Simulador Rural, Estratégia em Turnos, Construção de Cidades, Simulador de Vida Real, Jogo de Guerra, 2,5D, Militar, Fabricação, Drama, Histórico, Construção, Guerra, História Alternativa, Gerenciamento, Economia, Boa Trama, Construção de Bases"
House 2,Q4 2025,Indefinido,https://store.steampowered.com/app/2586440/House_2/?snr=1_7_7_popularcomingsoon_150_7,"Terror, Atmosférico, Aventura, Violência Detalhada, Violento, Indie, Ação, Terror Psicológico, Protagonista Mulher, Não Linear, Cartunizado, Ação / Aventura, Desenhado à Mão, Estilizado, Um Jogador, Vários Finais, Enredo Rico, Roguelike, Roguelike de Ação, Terror de Sobrevivência"
Pure Badminton,December 2025,Indefinido,https://store.steampowered.com/app/2591310/Pure_Badminton/?snr=1_7_7_popularcomingsoon_150_7,"Esportes, Simulação, Realístico, 3D, Controle, Um Jogador, Multijogador, Simulador Imersivo, Tático, Inteligência Artificial, Personalização de Personagem, Indie, Você Decide, Jogador X Ambiente (PvE), Jogador x Jogador (PvP), Tela Dividida, Cooperativo, Cooperativo Local, Multijogador Local, Tênis"
Love Nest,2025,Indefinido,https://store.steampowered.com/app/2595110/Love_Nest/?snr=1_7_7_popularcomingsoon_150_7,"Simulador de Encontros, Terror Psicológico, Boa Trama, Fuja da Sala, Fofo, Romance, Ficção Interativa, Quebra-Cabeça, RPG, Exploração, Clique e Clique, Romance Visual, Narração Dinâmica, 2D, Vários Finais, Anime, Desenho Animado, Drama, Atmosférico, Comovente"
Terminator: Survivors,2025,Indefinido,https://store.steampowered.com/app/2617340/Terminator_Survivors/?snr=1_7_7_popularcomingsoon_150_7,"Ação, Aventura, Sobrevivência, Mundo Aberto, Multijogador, Primeira Pessoa, Um Jogador, Cooperativo, Fabricação, Faça o que Quiser, Acesso Antecipado, Sobrevivência em Mundo Aberto, Atmosférico, Construção de Bases, Exploração, Tiro em Primeira Pessoa (FPS), Pós-Apocalíptico, Cooperativo On-line, RPG, Tiro"
Forsaken Realms: Vahrin's Call,2025,Indefinido,https://store.steampowered.com/app/951770/Forsaken_Realms_Vahrins_Call/?snr=1_7_7_popularcomingsoon_150_7,"RPG de Ação, RPG, Estilizado, Fantasia, Boa Trama, Ação / Aventura, Exploração, Personalização de Personagem, Jogador X Ambiente (PvE), Ação, Aventura, Mágica, Terceira Pessoa, Controle, Fantasia Sombria, Medieval, Atmosférico, Combate, Um Jogador, Hack and Slash"
The Way of Wrath,2025,Indefinido,https://store.steampowered.com/app/969330/The_Way_of_Wrath/?snr=1_7_7_popularcomingsoon_150_7,"RPG, Personalização de Personagem, Você Decide, Boa Trama, Combate em Turnos, Dungeons & Dragons, CRPG, Aventura, Romance, Fantasia, Estratégia, Estratégia em Turnos, Mundo Aberto, Fantasia Sombria, Um Jogador, Campanha Cooperativa, Baseado em Classes, RPG de Estratégia, Combate, RPG de Grupos"
Dark Deception Chapter 5,2025,Indefinido,https://store.steampowered.com/app/1019932/Dark_Deception_Chapter_5/?snr=1_7_7_popularcomingsoon_150_7,"Ação, Aventura, Indie, RPG, Terror, Terror de Sobrevivência, Um Jogador"
Lunars,4º trimestre de 2025,Indefinido,https://store.steampowered.com/app/1031080/Lunars/?snr=1_7_7_popularcomingsoon_150_7,"Em Grupos, Multijogador, Multijogador Local, Jogador x Jogador (PvP), Colorido, Reúna a Galera, Ação, Para Toda a Família, Plataforma, Local para 4 Jogadores, Colete Tudo, Corrida, Battle Royale, Ritmo, Plataforma 3D, Gatos, Dragões, Controle, Você Decide, Tática por Turnos"
Pax Autocratica,4º trimestre de 2025,Indefinido,https://store.steampowered.com/app/1067360/Pax_Autocratica/?snr=1_7_7_popularcomingsoon_150_7,"Simulador de Colônias, Roguelite, Construção de Bases, Fabricação, Roguelike de Ação, Gerenciamento, Automação, Jogador X Ambiente (PvE), Ficção Científica, Primeira Pessoa, Militar, Humor Ácido, Personalização de Personagem, Simulador Político, Exploração, Simulação, Ação, Um Jogador, Mechas, Controle"
Out of Action,2025,Indefinido,https://store.steampowered.com/app/1670780/Out_of_Action/?snr=1_7_7_popularcomingsoon_150_7,"Indie, Tiro em Primeira Pessoa (FPS), Jogador x Jogador (PvP), Cyberpunk, Tiro, Primeira Pessoa, Ação, Parar o Tempo, Personalização de Armas, Distópico, Ficção Científica, Sombrio, Futurista, Combate, Multijogador, Um Jogador, Anime, Personalização de Personagem, Jogador X Ambiente (PvE), Estilizado"
MIO: Memories in Orbit,2025,Indefinido,https://store.steampowered.com/app/1672810/MIO_Memories_in_Orbit/?snr=1_7_7_popularcomingsoon_150_7,"Metroidvania, Exploração, Plataforma, Ação / Aventura, Um Jogador, Atmosférico, Indie, 2D, Colorido, Robôs, Desenhado à Mão, Soulslike, Combate, Futurista, Plataforma 2D, Difícil, Ficção Científica, Plataforma de Precisão, Mistério, Impiedoso"
Dead Format,Q4 2025,Indefinido,https://store.steampowered.com/app/3399290/Dead_Format/?snr=1_7_7_popularcomingsoon_150_7,"Terror de Sobrevivência, Terror Psicológico, Terror, Um Jogador, Sobrevivência, Ação, Boa Trama, Mistério, Anos 90, Atmosférico, 3D, Violento, Primeira Pessoa, Sombrio, Anos 80"
CASSETTE BOY,2025,Indefinido,https://store.steampowered.com/app/2334330/CASSETTE_BOY/?snr=1_7_7_popularcomingsoon_150_7,"Ação, Aventura, RPG de Ação, Ação / Aventura, Quebra-Cabeça, Soulslike, Exploração, 2,5D, Fofo, Gráficos Pixelados, Voxel, Anos 90, Ficção Científica, Velha-Guarda, Fantasia, Retrô, Saques, Gatos, Atmosférico, Controle"
ALARA Prime,2025,Free,https://store.steampowered.com/app/971700/ALARA_Prime/?snr=1_7_7_popularcomingsoon_150_7,"Tiro em Primeira Pessoa (FPS), Tiro em Arena, Jogador x Jogador (PvP), Primeira Pessoa, Competitivo, Gratuito para Jogar, Multijogador, Tático, Tiro, Baseado em Equipes, Ação, Ficção Científica, Realístico, Futurista, Combate, 3D, Furtivo, Violento, Controle, Cyberpunk"
World of Magic: Rise of Magic,"Jan 5, 2026",Indefinido,https://store.steampowered.com/app/3004280/World_of_Magic_Rise_of_Magic/?snr=1_7_7_popularcomingsoon_150_7,"RPG, Mundo Aberto, Medieval, Boa Trama, Você Decide, Mágica, RPG de Ação, Terceira Pessoa, Ação / Aventura, Ação, Tiro de Heróis, Tiro em Terceira Pessoa, JRPG, Terror, Um Jogador, Guerra, Fabricação, Aventura, Sombrio, Enredo Rico"
DuneCrawl,"Jan 5, 2026",Indefinido,https://store.steampowered.com/app/1833200/DuneCrawl/?snr=1_7_7_popularcomingsoon_150_7,"Cooperativo On-line, Mundo Aberto, Campanha Cooperativa, Multijogador Local, Cooperativo, Cooperativo Local, Local para 4 Jogadores, Tiro, Aventura, RPG, RPG de Ação, Ação / Aventura, Visão Superior, Explorador de Calabouços, Estilizado, Isométrico, Hack and Slash, Colorido, 3D, Combate com Veículos"
StarRupture,"Jan 6, 2026",Indefinido,https://store.steampowered.com/app/1631270/StarRupture/?snr=1_7_7_popularcomingsoon_150_7,"Acesso Antecipado, Sobrevivência, Construção de Bases, Sobrevivência em Mundo Aberto, Mundo Aberto, Cooperativo, Simulação, Aventura, Exploração, Tiro, Multijogador, Fabricação, Faça o que Quiser, Automação, Ficção Científica, Simulador de Colônias, Simulador Imersivo, Um Jogador, Ação, Cooperativo On-line"
Feed the Reactor,"Jan 6, 2026",Indefinido,https://store.steampowered.com/app/4009730/Feed_the_Reactor/?snr=1_7_7_popularcomingsoon_150_7,"Estratégia, Clique e Clique, Incremental, Casual, Batalha Automática, Simulação, Gerenciamento, 2D, Terror, Relaxante, Vários Finais, Desenhado à Mão, Gráficos Pixelados, Ficção Científica, Mistério, Retrô, Um Jogador"
Kejora,"Jan 7, 2026",Indefinido,https://store.steampowered.com/app/1410400/Kejora/?snr=1_7_7_popularcomingsoon_150_7,"Protagonista Mulher, Desenhado à Mão, Quebra-Cabeça, Plataforma com Quebra-Cabeça, Aventura, Plataforma 2D, Indie, Comovente, Plataforma, Câmera Lateral, Ficção Interativa, Romance Visual, 2D, Boa Trama, Um Jogador, Atmosférico, Sombrio, Cartunizado, Anime, Thriller"
Ancient Farm,"Jan 8, 2026",Indefinido,https://store.steampowered.com/app/1933930/Ancient_Farm/?snr=1_7_7_popularcomingsoon_150_8,"Casual, Simulação, Simulador Rural, Faça o que Quiser, Simulador de Vida Real, Simulador Imersivo, Exploração, Agricultura, Economia, Para Toda a Família, Cavalos, Gerenciamento, Medieval, Natureza, Construção, Mundo Aberto, Gerenciamento de Recursos, Um Jogador, 3D, Rural"
Pathologic 3,"Jan 9, 2026",Indefinido,https://store.steampowered.com/app/3199650/Pathologic_3/?snr=1_7_7_popularcomingsoon_150_8,"Terror Psicológico, Terror, Terror de Sobrevivência, Boa Trama, Atmosférico, Psicológico, Remake, Aventura, RPG, Simulação, Primeira Pessoa, Você Decide, Surrealista, Simulador Imersivo, Detetive, Distópico, Sobrevivência, Lovecraftiano, Mundo Aberto, Difícil"
Frostrain 2,"Jan 9, 2026",Indefinido,https://store.steampowered.com/app/3690490/Frostrain_2/?snr=1_7_7_popularcomingsoon_150_8,"Estratégia, Simulação, Roguelike, Montagem de Decks, Indie, Montagem de Decks Roguelike, Pós-Apocalíptico, Trens, Gerenciamento, Exploração, Escolha a sua Aventura, Neve, 2D, Geração Procedural, Um Jogador, Batalha Automática, Relaxante"
Moving Simulator,"Jan 9, 2026",Indefinido,https://store.steampowered.com/app/3525060/Moving_Simulator/?snr=1_7_7_popularcomingsoon_150_8,"Simulação, Física, Simulador de Vida Real, Direção, Gerenciamento, Economia, Faça o que Quiser, Transportes, Relaxante, Capitalismo, Mundo Aberto, Simulador Imersivo, Indie, Realístico, Primeira Pessoa, Gerenciamento de Recursos, Um Jogador, Casual, 3D, Gerenciamento de Inventário"
Streetdog BMX,"Jan 14, 2026",Indefinido,https://store.steampowered.com/app/2707870/Streetdog_BMX/?snr=1_7_7_popularcomingsoon_150_8,"Esportes, Ciclismo, BMX, Arcade, Personalização de Personagem, 3D, Terceira Pessoa, Controle, Colorido, Indie, Não Linear, Física, Um Jogador"
The Legend of Heroes: Trails beyond the Horizon,"Jan 15, 2026",Indefinido,https://store.steampowered.com/app/3316940/The_Legend_of_Heroes_Trails_beyond_the_Horizon/?snr=1_7_7_popularcomingsoon_150_8,Sem gênero
One Turn Kill,"Jan 16, 2026",Indefinido,https://store.steampowered.com/app/3151270/One_Turn_Kill/?snr=1_7_7_popularcomingsoon_150_8,"Estratégia, Cartas, Montagem de Decks, Gráficos Pixelados, Batalha com Cartas, Solitário, 2D, Ficção Científica, Jogador X Ambiente (PvE), Protagonista Mulher, Um Jogador"
BrokenLore: UNFOLLOW,"Jan 16, 2026",Indefinido,https://store.steampowered.com/app/2133830/BrokenLore_UNFOLLOW/?snr=1_7_7_popularcomingsoon_150_8,"Psicodélico, Terror, Sombrio, Terror Psicológico, Atmosférico, Mistério, Realístico, Um Jogador, Ação, Boa Trama, Primeira Pessoa, Vários Finais, LGBTQIA+, Sobrevivência, Surrealista, Furtivo, Terror de Sobrevivência, Crime, Demônios, Aventura"
Kin and Quarry,"Jan 16, 2026",Indefinido,https://store.steampowered.com/app/3505770/Kin_and_Quarry/?snr=1_7_7_popularcomingsoon_150_8,"Incremental, Clique e Clique, 2,5D, Mineração, Casual, Gráficos Pixelados, Indie, Fantasia, Automação, Um Jogador, Roguelike, Roguelite, Fofo, Jogador X Ambiente (PvE), Subterrâneo"
Lunar Ascendant,"Jan 16, 2026",Indefinido,https://store.steampowered.com/app/2547090/Lunar_Ascendant/?snr=1_7_7_popularcomingsoon_150_8,"Escolha a sua Aventura, Simulador Político, Romance Visual, Simulador Imersivo, Ficção Interativa, Simulador de Colônias, Economia, Política, Político, Diplomacia, Inteligência Artificial, Gerenciamento, Apontar e Clicar, Simulador Espacial, Estratégia, Baseado em Texto, Boa Trama, Você Decide, Vários Finais, Futurista"
Kaiju Cracking Corporation,"Jan 17, 2026",Indefinido,https://store.steampowered.com/app/3586410/Kaiju_Cracking_Corporation/?snr=1_7_7_popularcomingsoon_150_8,"Simulação, Estratégia, Faça o que Quiser, Simulador Imersivo, Desenho Animado, Drama, Editor de Níveis, Indie, Um Jogador"
On-Together: Virtual Co-Working,"Jan 19, 2026",Indefinido,https://store.steampowered.com/app/3707400/OnTogether_Virtual_CoWorking/?snr=1_7_7_popularcomingsoon_150_8,"Simulador Imersivo, Coleção de Criaturas, Design e Ilustração, Utilitários, Educativo, Pesca, Simulador de Vida Real, Personalização de Personagem, Terceira Pessoa, 3D, Fofo, Relaxante, Casual, Simulação, Anime, Colorido, Para Toda a Família, Atmosférico, Cooperativo, Cooperativo On-line"
Cooking Simulator 2: Better Together,"Jan 20, 2026",Indefinido,https://store.steampowered.com/app/2455360/Cooking_Simulator_2_Better_Together/?snr=1_7_7_popularcomingsoon_150_8,"Simulação, Multijogador, Faça o que Quiser, Culinária, Um Jogador, Simulador Imersivo, Primeira Pessoa, Colorido, Alta Rejogabilidade, RPG, Para Toda a Família, Personalização de Personagem, Relaxante, Cooperativo, Destruição, Física, Do Bem, Casual, Colete Tudo, Engraçado"
It Consumes,"Jan 21, 2026",Indefinido,https://store.steampowered.com/app/2371060/It_Consumes/?snr=1_7_7_popularcomingsoon_150_8,"Roguelike de Ação, Tiro em Arena, Tiro de Tiozão, Chuva de Balas, Tiro em Primeira Pessoa (FPS), Mandando Bala, Roguelite, Arcade, Jogador X Ambiente (PvE), Tiro, 3D, Primeira Pessoa, Ação, Estilizado, Demônios, Lovecraftiano, Atmosférico, Sobrevivência, Sombrio, Combate"
LORT,"Jan 21, 2026",Indefinido,https://store.steampowered.com/app/2956680/LORT/?snr=1_7_7_popularcomingsoon_150_8,"Acesso Antecipado, Roguelike de Ação, Cooperativo On-line, Tiro em Terceira Pessoa, Multijogador, Roguelite, Ação, Um Jogador, Cooperativo, Engraçado, Difícil, Jogador X Ambiente (PvE), Geração Procedural, 3D, Tiro com Saques, Terceira Pessoa, Você Decide, Controle, Fantasia, Mágica"
Exotica 2: Pet Shop Simulator,"Jan 21, 2026",Indefinido,https://store.steampowered.com/app/2824380/Exotica_2_Pet_Shop_Simulator/?snr=1_7_7_popularcomingsoon_150_8,"Simulação, Casual, Para Toda a Família, Aventura, Fofo, Relaxante, Educativo, Simulador de Vida Real, Colorido, Engraçado, Simulador Imersivo, Primeira Pessoa, Realístico, Construção, Gatos, Cachorros, Economia, Natureza, Comovente, 3D"
Tailside: Cozy Cafe Sim,"Jan 21, 2026",Indefinido,https://store.steampowered.com/app/2922570/Tailside_Cozy_Cafe_Sim/?snr=1_7_7_popularcomingsoon_150_8,"Aconchegante, Relaxante, Casual, Simulação, Simulador de Vida Real, Gerenciamento, Culinária, Gerenciamento de Lojas, Faça o que Quiser, Construção, Fabricação, Colorido, Para Toda a Família, Um Jogador, Gráficos Pixelados, Gerenciamento de Recursos, Desenhado à Mão, Aventura, Fantasia, Comédia"
DYNASTY WARRIORS: ORIGINS Visions of Four Heroes,"Jan 22, 2026",$34.99,https://store.steampowered.com/app/4038930/DYNASTY_WARRIORS_ORIGINS_Visions_of_Four_Heroes/?snr=1_7_7_popularcomingsoon_150_8,"Hack and Slash, Luta Espetacular, RPG, Jogo de Guerra, Artes Marciais, Estratégia, RPG de Ação, Musou, Simulador de Encontros, Histórico, Terceira Pessoa, 3D, Ação, Espada, Controle, Vários Finais, Boa Trama, Um Jogador, Tático, Guerra"
SEGA FOOTBALL CLUB CHAMPIONS,"Jan 22, 2026",Free,https://store.steampowered.com/app/3271000/SEGA_FOOTBALL_CLUB_CHAMPIONS/?snr=1_7_7_popularcomingsoon_150_8,"Simulação, Esportes, 2D, 3D, Realístico, Futebol, Moderno, Jogador X Ambiente (PvE), Jogador x Jogador (PvP), Personalização de Personagem, Controle, Tutorial, Um Jogador, Multijogador, Gratuito para Jogar, Multijogador Assíncrono"
Nova Roma,"Jan 22, 2026",Indefinido,https://store.steampowered.com/app/2426530/Nova_Roma/?snr=1_7_7_popularcomingsoon_150_8,"Estratégia, Simulação, Construção de Cidades, Estratégia em Tempo Real (RTS), Construção de Bases, Construção, Gerenciamento, Faça o que Quiser, Gerenciamento de Recursos, Simulador de Colônias, Mundo Aberto, Economia, Sobrevivência, Casual, Um Jogador, Tempo Real com Pausa, Compatível com Mods, Alta Rejogabilidade, Realístico, Mod"
Perfect Tides: Station to Station,"Jan 22, 2026",Indefinido,https://store.steampowered.com/app/2088810/Perfect_Tides_Station_to_Station/?snr=1_7_7_popularcomingsoon_150_8,"Apontar e Clicar, Gráficos Pixelados, Romance, Cartunizado, Boa Trama, Fofo, Comovente, Protagonista Mulher, Filosófico, Comédia, Exploração, Narrativa, Cinematográfico, Aventura, Histórico, Simulador de Encontros, Romance Visual, Retrô, Ficção Interativa, Conversas"
Hermit and Pig,"Jan 22, 2026",Indefinido,https://store.steampowered.com/app/2408350/Hermit_and_Pig/?snr=1_7_7_popularcomingsoon_150_8,"RPG, Aventura, Combate em Turnos, Boa Trama, Gráficos Pixelados, Exploração, Conspiração, Comédia, Engraçado, Colorido, 2D, Natureza, Mistério, Estilizado, Terror, Conversas, Um Jogador, Trilha Sonora, JRPG, Fofo"
Escape from Ever After,"Jan 23, 2026",Indefinido,https://store.steampowered.com/app/1996390/Escape_from_Ever_After/?snr=1_7_7_popularcomingsoon_150_8,"RPG de Ação, Colorido, Combate em Turnos, Terceira Pessoa, RPG, JRPG, Trilha Sonora, Boa Trama, Aventura, Gerenciamento de Tempo, Um Jogador, Estratégia em Turnos, Fantasia Sombria, RPG de Grupos, Fantasia, RPG de Estratégia, Estratégia, Escolha a sua Aventura, Tática por Turnos, Comédia"
Dreadway,"Jan 26, 2026",Indefinido,https://store.steampowered.com/app/3215820/Dreadway/?snr=1_7_7_popularcomingsoon_150_8,"Terror Psicológico, Cooperativo On-line, Atmosférico, Ação / Aventura, Aventura, Terror, Multijogador, Geração Procedural, Gerenciamento de Recursos, Fabricação, Pós-Apocalíptico, Objetos Ocultos, Thriller, Ação, Cooperativo, Sobrevivência, Baseado em Equipes, Primeira Pessoa, Gerenciamento de Inventário, Comédia"
Chromatic Conundrum,"Jan 26, 2026",Indefinido,https://store.steampowered.com/app/3081690/Chromatic_Conundrum/?snr=1_7_7_popularcomingsoon_150_8,"Quebra-Cabeça, Plataforma, Primeira Pessoa, Atmosférico, Ficção Científica, Física, Plataforma com Quebra-Cabeça, Plataforma 3D, Aventura, Abstrato, Minimalista, Colorido, Estilizado, Futurista, 3D, Linear, Um Jogador, Indie"
THE SPIRIT LIFT,"Jan 27, 2026",Indefinido,https://store.steampowered.com/app/1727590/THE_SPIRIT_LIFT/?snr=1_7_7_popularcomingsoon_150_8,"Montagem de Decks Roguelike, Cartas, Roguelike, Roguelite, Batalha com Cartas, Estratégia, Terror, Montagem de Decks, Combate em Turnos, Aventura, 2D, Um Jogador, Geração Procedural, 3D, Terror Psicológico, Mistério, Terror de Sobrevivência, Sobrenatural, Tática por Turnos, Boa Trama"
Car Service Together,"Jan 28, 2026",Indefinido,https://store.steampowered.com/app/3501070/Car_Service_Together/?snr=1_7_7_popularcomingsoon_150_8,"Corrida, Simulação, Simulador Automobilístico, Casual, Tiro em Primeira Pessoa (FPS), Realístico, Automação, Direção, Para Toda a Família, Gerenciamento, Relaxante, Física, Cooperativo, Gerenciamento de Recursos, Multijogador, Cooperativo On-line, Um Jogador, Acesso Antecipado, Indie"
Steel Century Groove,"Jan 28, 2026",Indefinido,https://store.steampowered.com/app/1858950/Steel_Century_Groove/?snr=1_7_7_popularcomingsoon_150_8,"Ritmo, Mechas, JRPG, Boa Trama, Música, Aventura, Comédia, LGBTQIA+, Anime, RPG, Ação, Colorido, Musical Procedural, Romance Visual, Um Jogador, Estilizado, RPG de Ação, Ação / Aventura, Ficção Científica, Robôs"
Dark Auction,"Jan 29, 2026",Indefinido,https://store.steampowered.com/app/2363180/Dark_Auction/?snr=1_7_7_popularcomingsoon_150_8,"Aventura, Mistério, 3D, 2D, Boa Trama, Romance Visual, Escolha a sua Aventura, Sombrio, Um Jogador"
ROMANCE OF THE THREE KINGDOMS 8 REMAKE: Destiny and Strategy Expansion Pack,"Jan 29, 2026",Indefinido,https://store.steampowered.com/app/3652820/ROMANCE_OF_THE_THREE_KINGDOMS_8_REMAKE_Destiny_and_Strategy_Expansion_Pack/?snr=1_7_7_popularcomingsoon_150_8,"Tática por Turnos, Jogo de Guerra, Militar, Simulador Imersivo, Estratégia, Diplomacia, Estratégia em Turnos, Estratégia em Tempo Real (RTS), Grande Estratégia, Personalização de Personagem, Simulação, Histórico, História Alternativa, Boa Trama, Tático, Gerenciamento de Recursos, Um Jogador, Alta Rejogabilidade, Viciante, Épico"
The Midnight Walkers,"Jan 29, 2026",Indefinido,https://store.steampowered.com/app/2795540/The_Midnight_Walkers/?snr=1_7_7_popularcomingsoon_150_8,"Acesso Antecipado, Ação, Tiro de Extração, Indie, Zumbis, Terror, Explorador de Calabouços, Baseado em Classes, Pós-Apocalíptico, Tiro em Primeira Pessoa (FPS), RPG, RPG de Ação, Jogador x Jogador (PvP), Baseado em Equipes, Cooperativo On-line, Jogador X Ambiente (PvE), Multijogador, Um Jogador, Tiro, Primeira Pessoa"
I Hate This Place,"Jan 29, 2026",Indefinido,https://store.steampowered.com/app/2604490/I_Hate_This_Place/?snr=1_7_7_popularcomingsoon_150_8,"Terror de Sobrevivência, História em Quadrinhos, Isométrico, Fabricação, Sobrevivência, Furtivo, Terror, Exploração, Aventura, Ação / Aventura, Quebra-Cabeça, Mistério, Estilizado, Sobrenatural, Psicodélico, Humor Ácido, Anos 80, Atmosférico, Demônios, Surrealista"
CODE VEIN II,"Jan 29, 2026",$69.99,https://store.steampowered.com/app/2362060/CODE_VEIN_II/?snr=1_7_7_popularcomingsoon_150_8,"Ação, RPG, Soulslike, RPG de Ação, Um Jogador, JRPG, Anime, Personalização de Personagem, Vampiros, Simulador de Encontros, Cooperativo On-line, Mundo Aberto, Boa Trama, Protagonista Mulher"
True Vikings,"Jan 30, 2026",Indefinido,https://store.steampowered.com/app/2996650/True_Vikings/?snr=1_7_7_popularcomingsoon_150_8,"RPG, Aventura, Simulação, Roguelite, 2D, Desenhado à Mão, Baseado em Texto, Boa Trama, Vários Finais, Atmosférico, Histórico, Sombrio, Medieval, Combate, Morte Permanente, Combate em Turnos, Um Jogador, Casual, Violento, Tática por Turnos"
Vampires: Bloodlord Rising,"Jan 30, 2026",Indefinido,https://store.steampowered.com/app/2191500/Vampires_Bloodlord_Rising/?snr=1_7_7_popularcomingsoon_150_8,"Acesso Antecipado, Um Jogador, Boa Trama, Sobrevivência, Aventura, Simulação, Simulador de Vida Real, Faça o que Quiser, Atmosférico, Fantasia, 3D, Ação, Construção de Bases, Gótico, Construção, Jogador X Ambiente (PvE), Ação / Aventura, Vampiros, RPG de Ação, Mundo Aberto"
The 9th Charnel,"Jan 30, 2026",Indefinido,https://store.steampowered.com/app/2005690/The_9th_Charnel/?snr=1_7_7_popularcomingsoon_150_8,"Terror de Sobrevivência, Terror, Boa Trama, Atmosférico, Quebra-Cabeça, Furtivo, Terror Psicológico, Linear, Primeira Pessoa, Um Jogador, Realístico, Tiro, Psicodélico, Lovecraftiano, Simulador de Caminhada, Demônios, Sombrio, Aventura, Ação, Tiro em Primeira Pessoa (FPS)"
Prophecy of Ashen,"Jan 31, 2026",Indefinido,https://store.steampowered.com/app/3508730/Prophecy_of_Ashen/?snr=1_7_7_popularcomingsoon_150_8,"RPG, CRPG, Mágica, Tática por Turnos, RPG Tático, Estratégia em Turnos, 2D, Fantasia Sombria, RPG de Grupos, RPG de Estratégia, Dragões, Boa Trama, Combate em Turnos, Vários Finais, Você Decide, Gráficos Pixelados, Medieval, Drama, Sombrio, Aventura"
Run TavernQuest,January 2026,Indefinido,https://store.steampowered.com/app/808610/Run_TavernQuest/?snr=1_7_7_popularcomingsoon_150_8,"Escolha a sua Aventura, Comédia, Ficção Interativa, Baseado em Texto, Engraçado, Você Decide, Narração Dinâmica, Narração, Boa Trama, Fantasia, Medieval, Aventura, Anos 80, Retrô, Indie, Sátira, Velha-Guarda, Um Jogador, RPG, Apontar e Clicar"
Halcyon Days at Taoyuan,January 2026,Indefinido,https://store.steampowered.com/app/2678830/Halcyon_Days_at_Taoyuan/?snr=1_7_7_popularcomingsoon_150_8,"Simulação, Simulador Rural, Exploração, Coleção de Criaturas, CRPG, Gráficos Pixelados, Indie, Agricultura, Fabricação, Drama, Histórico, Culinária, Casual, RPG, Pesca, Boa Trama, Mundo Aberto, Um Jogador"
