title,release_date,price,game_url,genres
Psychotic Bathtub,2026,Indefinido,https://store.steampowered.com/app/2517080/Psychotic_Bathtub/?snr=1_7_7_popularcomingsoon_150_21,"Desenhado à Mão, Design e Ilustração, Estilizado, Terror Psicológico, Comédia, Você Decide, Vários Finais, Romance Visual, Boa Trama, Ficção Interativa, Sombrio, Humor Ácido, Apontar e Clicar, 2D, Atmosférico, Drama, Comovente, Exploração, Escolha a sua Aventura, Psicológico"
Bestiario,Q4 2026,Indefinido,https://store.steampowered.com/app/2760720/Bestiario/?snr=1_7_7_popularcomingsoon_150_21,"Um Jogador, JRPG, Anime, Romance Visual, Boa Trama, Velha-Guarda, RPG de Grupos, Comovente, Romance, Conversas, Combate em Turnos, Retrô, Você Decide, Narração Dinâmica, Gráficos Pixelados, RPG, Mitologia, LGBTQIA+, Vários Finais, Trilha Sonora"
Whirlight - No Time To Trip,2026,Indefinido,https://store.steampowered.com/app/2706980/Whirlight__No_Time_To_Trip/?snr=1_7_7_popularcomingsoon_150_21,"Aventura, Casual, Apontar e Clicar, Anos 90, Comédia, Surrealista, Cartunizado, Colorido, Engraçado, 2D, Para Toda a Família, Quebra-Cabeça, Boa Trama, Retrô, Atmosférico, Viagem no Tempo, Desenho Animado, Um Jogador, Ficção Científica, Protagonista Mulher"
Wonderia,2026,Indefinido,https://store.steampowered.com/app/2593340/Wonderia/?snr=1_7_7_popularcomingsoon_150_21,"Aventura, Sobrevivência em Mundo Aberto, Cooperativo On-line, Faça o que Quiser, Sobrevivência, 2D, Fabricação, Exploração, Construção, Geração Procedural, Mineração, RPG, Simulador Rural, Relaxante, Mundo Aberto, Fofo, Colorido, Personalização de Personagem, Um Jogador, Acesso Antecipado"
Mystic Land: The Search for Maphaldo,2026,Indefinido,https://store.steampowered.com/app/2513200/Mystic_Land_The_Search_for_Maphaldo/?snr=1_7_7_popularcomingsoon_150_21,"RPG, RPG de Grupos, CRPG, Explorador de Calabouços, 2D, Desenhado à Mão, Gráficos Pixelados, Anos 90, Fantasia, Mágica, Medieval, Velha-Guarda, Retrô, Você Decide, Controle, Boa Trama, Combate em Turnos, Um Jogador, Indie"
NO STRAIGHT ROADS 2,2026,Indefinido,https://store.steampowered.com/app/3758980/NO_STRAIGHT_ROADS_2/?snr=1_7_7_popularcomingsoon_150_21,"Ação, Aventura, Ritmo, Plataforma 3D, 3D, Um Jogador, Controle"
Folder Dungeon,2026,Indefinido,https://store.steampowered.com/app/2853830/Folder_Dungeon/?snr=1_7_7_popularcomingsoon_150_21,"Roguelike, Explorador de Calabouços, Combate em Turnos, RPG, Gerenciamento de Inventário, Exploração, Hacker, Casual, Estratégia, Fantasia, Minimalista, Anos 80, Colorido, Roguelike Tradicional, 2D, Aventura, Geração Procedural, Combate, Simulação, Baseado em Classes"
Food Devils,2026,Indefinido,https://store.steampowered.com/app/2861730/Food_Devils/?snr=1_7_7_popularcomingsoon_150_21,"Anime, RPG Tático, Roguelite, Personalização de Personagem, Fantasia Sombria, Escolha a sua Aventura, JRPG, Pós-Apocalíptico, RPG de Grupos, Estratégia, Boa Trama, Estratégia em Turnos, Tática por Turnos, Tático, Colorido, RPG de Estratégia, Construção de Bases, Movimento em Grade, Visão Superior, RPG"
Exovia,2026,Indefinido,https://store.steampowered.com/app/3144430/Exovia/?snr=1_7_7_popularcomingsoon_150_21,"Simulador Espacial, Automação, Faça o que Quiser, Construção, Relaxante, Mineração, Espacial, Exploração, Gerenciamento, Fabricação, Física, Simulação, 2D, Ficção Científica, Atmosférico, Futurista, Um Jogador, Estilizado"
Rolling Thunder: Vietnam,2026,Indefinido,https://store.steampowered.com/app/3153900/Rolling_Thunder_Vietnam/?snr=1_7_7_popularcomingsoon_150_21,"Acesso Antecipado, Tiro, Realístico, Ação, Tiro em Primeira Pessoa (FPS), Guerra, Multijogador, Multijogador Massivo, Jogador x Jogador (PvP), Baseado em Equipes, Simulação, Simulador Imersivo, Jogo de Guerra, 3D, Primeira Pessoa, Histórico, Militar, Tático, Combate, Combate com Veículos"
Octopus City Blues,2026,Indefinido,https://store.steampowered.com/app/1192230/Octopus_City_Blues/?snr=1_7_7_popularcomingsoon_150_21,"Exploração, Escolha a sua Aventura, Vários Finais, Boa Trama, Você Decide, Aventura, Ficção Interativa, Surrealista, Conspiração, Sombrio, Humor Ácido, Terror, Apontar e Clicar, Lovecraftiano, Cyberpunk, Um Jogador, Controle, Gráficos Pixelados, Simulação, 2D"
Spirit of Midnight,2026,Indefinido,https://store.steampowered.com/app/1141060/Spirit_of_Midnight/?snr=1_7_7_popularcomingsoon_150_21,"Relaxante, Fofo, Aventura, Apontar e Clicar, Mistério, Engraçado, Exploração, Para Toda a Família, Gatos, Quebra-Cabeça, Indie, Boa Trama, Casual, Paródia, Ficção Interativa, Sobrenatural, 2D, Cartunizado, Colorido, Estilizado"
Soul Devourer,2026,Indefinido,https://store.steampowered.com/app/2530620/Soul_Devourer/?snr=1_7_7_popularcomingsoon_150_21,"Metroidvania, Ação, Anime, Terror, Sombrio, Combate, Boa Trama, Exploração, Aventura, Plataforma, Soulslike, 2D, Protagonista Mulher, Desenhado à Mão, Atmosférico, Zumbis, Câmera Lateral, Um Jogador, Não Linear, Indie"
ARCHETYPE BLUE,2026,Indefinido,https://store.steampowered.com/app/2541560/ARCHETYPE_BLUE/?snr=1_7_7_popularcomingsoon_150_21,"Colorido, Montagem de Decks Roguelike, Estratégia em Turnos, Cartas, Fantasia Sombria, Romance Visual, Engraçado, Lógica, Gerenciamento, Combate, Um Jogador, Baseado em Classes, RPG de Grupos, Montagem de Decks, Protagonista Mulher, Batalha com Cartas, Roguelike, Roguelite, Tática por Turnos, Estratégia"
Demi and the Fractured Dream,2026,Indefinido,https://store.steampowered.com/app/1725710/Demi_and_the_Fractured_Dream/?snr=1_7_7_popularcomingsoon_150_21,"Ação, Aventura, Fantasia, Um Jogador, Combate, Indie"
Determinant,2026,Indefinido,https://store.steampowered.com/app/1445480/Determinant/?snr=1_7_7_popularcomingsoon_150_22,"Sobrevivência em Mundo Aberto, Sobrevivência, Fabricação, Construção de Bases, Física, Exploração, Ficção Científica, Aventura, Mundo Aberto, Tiro em Primeira Pessoa (FPS), 3D, Primeira Pessoa, Realístico, Futurista, Construção, Combate, Um Jogador, Simulação, Atmosférico, Mistério"
Good Heavens!,2026,Indefinido,https://store.steampowered.com/app/1617120/Good_Heavens/?snr=1_7_7_popularcomingsoon_150_22,"Sobrevivência, Sobrevivência em Mundo Aberto, Mundo Aberto, Multijogador, Cooperativo On-line, Cooperativo, Acesso Antecipado, Construção de Bases, Faça o que Quiser, Aventura, Fabricação, Construção, Exploração, RPG, 2D, Difícil, Visão Superior, Um Jogador, Ação, Geração Procedural"
Sealed Gate,2026,Indefinido,https://store.steampowered.com/app/1736200/Sealed_Gate/?snr=1_7_7_popularcomingsoon_150_22,"Acesso Antecipado, Fabricação, Multijogador Massivo, Gráficos Pixelados, 2D, MMORPG, Visão Superior, Fantasia, Boa Trama, Mundo Aberto, Medieval, Drama, Aventura, RPG, Mágica, Personalização de Personagem, Exploração, Explorador de Calabouços, CRPG, Troca"
Feudums,2026,Free,https://store.steampowered.com/app/473750/Feudums/?snr=1_7_7_popularcomingsoon_150_22,"Estratégia, Simulação, Grande Estratégia, Estratégia em Turnos, 4X, Medieval, Multijogador Massivo, Alta Rejogabilidade, Jogador x Jogador (PvP), Compatível com Mods, Construção de Cidades, Grade Hexagonal, Simulador Político, Diplomacia, Guerra, Economia, Colorido, Incremental, Multijogador, Um Jogador"
Ardenfall,2026,Indefinido,https://store.steampowered.com/app/1154960/Ardenfall/?snr=1_7_7_popularcomingsoon_150_22,"RPG, Primeira Pessoa, Política, Mágica, Atmosférico, Explorador de Calabouços, Mundo Aberto, Medieval, Personalização de Personagem, Você Decide, Faça o que Quiser, Exploração, Furtivo, Aventura, Ação, Fantasia, Vários Finais, RPG de Ação, Um Jogador, CRPG"
Tales of Anturia: Farathan,2026,Indefinido,https://store.steampowered.com/app/1558030/Tales_of_Anturia_Farathan/?snr=1_7_7_popularcomingsoon_150_22,"RPG, Mundo Aberto, Boa Trama, Você Decide, Um Jogador, Fantasia Sombria, Enredo Rico, Vários Finais, Não Linear, Medieval, Terceira Pessoa, RPG de Ação, Realístico, Espada, CRPG, Escolha a sua Aventura, Personalização de Personagem, Sombrio, Demônios, 3D"
Furcifer's Fungeon,2026,Indefinido,https://store.steampowered.com/app/1700930/Furcifers_Fungeon/?snr=1_7_7_popularcomingsoon_150_22,"Roguelike de Ação, Chuva de Balas, SHMUP com Visão Superior, Difícil, Alta Rejogabilidade, Explorador de Calabouços, Ação / Aventura, Visão Superior, Roguelite, Aventura, Fantasia, RPG, Um Jogador, Gráficos Pixelados, Combate, Ação, 2D, Roguelike, RPG de Ação, Retrô"
The Pope: Power & Sin,2026,Indefinido,https://store.steampowered.com/app/1253800/The_Pope_Power__Sin/?snr=1_7_7_popularcomingsoon_150_22,"Simulação, Estratégia, Aventura, RPG, Indie, Simulador Político, Diplomacia, Conspiração, Vários Finais, Gerenciamento, Conversas, Boa Trama, Humor Pesado, Faça o que Quiser, Casual, Um Jogador, Político, Alta Rejogabilidade, Atmosférico, Política"
Besmirch,2026,Indefinido,https://store.steampowered.com/app/3670630/Besmirch/?snr=1_7_7_popularcomingsoon_150_22,"Você Decide, Exploração, Simulador Rural, Terror de Sobrevivência, Gráficos Pixelados, RPG, Gerenciamento, Furtivo, Sobrevivência em Mundo Aberto, 2D, Roguelike, Rural, Sombrio, Um Jogador, Retrô, Roguelike Tradicional, Simulação, Fé, Mundo Aberto, Sobrevivência"
Sobakistan: The Land of Dogs,2026,Indefinido,https://store.steampowered.com/app/3742720/Sobakistan_The_Land_of_Dogs/?snr=1_7_7_popularcomingsoon_150_22,"Boa Trama, Exploração, Gráficos Pixelados, Político, Você Decide, Distópico, Comovente, Narração, Guerra Fria, Vários Finais, Surrealista, Atmosférico, Visão Superior, Aventura, Escolha a sua Aventura, Um Jogador, Fofo, Quebra-Cabeça, Psicológico, RPG"
Rootbound,2026,Indefinido,https://store.steampowered.com/app/3453490/Rootbound/?snr=1_7_7_popularcomingsoon_150_22,"Um Jogador, Física, Exploração, Mistério, Fofo, 3D, Quebra-Cabeça, Ação / Aventura, Isométrico, Colorido, Fantasia, Estilizado, Mundo Aberto, Narração, Construção de Bases, Aventura, Simulador Imersivo, Gráficos Pixelados, Controle, Hack and Slash"
Musgro Farm,2026,Indefinido,https://store.steampowered.com/app/2954590/Musgro_Farm/?snr=1_7_7_popularcomingsoon_150_22,"Gerenciamento, Simulação, Estratégia, Automação, Construção de Cidades, Construção de Bases, Gerenciamento de Recursos, Rural, Incremental, Lógica, Economia, Simulador Rural, Construção, Transportes, Do Bem, Indie, Culinária, Casual, Visão Superior, Um Jogador"
Little Herbal Baker,2026,Indefinido,https://store.steampowered.com/app/3019200/Little_Herbal_Baker/?snr=1_7_7_popularcomingsoon_150_22,"Casual, Simulação, RPG, Fofo, Simulador de Vida Real, Aconchegante, 2D, Simulador Rural, Gráficos Pixelados, Indie, Acesso Antecipado, Relaxante, Visão Superior, Um Jogador"
Generation Ship,2026,Indefinido,https://store.steampowered.com/app/1638030/Generation_Ship/?snr=1_7_7_popularcomingsoon_150_22,"Simulador de Colônias, Construção de Cidades, Gerenciamento de Recursos, Simulação, Gerenciamento, Construção, Estratégia, Espacial, Simulador Espacial, Construção de Bases, Sobrevivência, Indie, Naves Espaciais, Simulador de Vida Real, Faça o que Quiser, Ficção Científica, Voo, Exploração, 3D, Um Jogador"
Deer & Boy,2026,Indefinido,https://store.steampowered.com/app/1803140/Deer__Boy/?snr=1_7_7_popularcomingsoon_150_22,"Aventura, Plataforma, Fofo, Boa Trama, Cinematográfico, Furtivo, Quebra-Cabeça, Comovente, Natureza, Atmosférico, Um Jogador, 2,5D, Estilizado, Mágica, Câmera Lateral, Plataforma 2D, Ação / Aventura, Mistério, Plataforma com Quebra-Cabeça, Ação"
Ending Tau,2026,Indefinido,https://store.steampowered.com/app/2087880/Ending_Tau/?snr=1_7_7_popularcomingsoon_150_22,"Roguelike de Ação, Exploração, Hack and Slash, Soulslike, Roguelite, Roguelike, Gráficos Pixelados, Personalização de Personagem, Estilizado, Visão Superior, História Alternativa, Ação, Controle, Atmosférico, Combate, Um Jogador, Indie, RPG, Geração Procedural, Alta Rejogabilidade"
Almost My Floor: Duality,2026,Indefinido,https://store.steampowered.com/app/2068190/Almost_My_Floor_Duality/?snr=1_7_7_popularcomingsoon_150_22,"Terror, Sátira, Detetive, Psicológico, Você Decide, Boa Trama, Thriller, Romance Visual, Furtivo, Terror Psicológico, Humor Ácido, Vários Finais, Sombrio, Mistério, Aventura, Ação / Aventura, Não Linear, Ação, Zumbis, Lovecraftiano"
Changer Seven,2026,Indefinido,https://store.steampowered.com/app/2069330/Changer_Seven/?snr=1_7_7_popularcomingsoon_150_22,"Super-Heróis, Cinematográfico, Combate, Boa Trama, Ação, Um Jogador, Aventura, Ação / Aventura, Exploração, Terceira Pessoa, Comovente, Engraçado, Espada, Controle, Protagonista Mulher, 3D, Tutorial, Indie, Jogo de Ação Focado em Personagem, Plataforma 3D"
FortressCraft : Phoenix,Q4 2026,Indefinido,https://store.steampowered.com/app/1038080/FortressCraft__Phoenix/?snr=1_7_7_popularcomingsoon_150_22,"Acesso Antecipado, Estratégia, Simulador de Colônias, Faça o que Quiser, 3D, Colorido, Primeira Pessoa, Voxel, Atmosférico, Construção, Fabricação, Fantasia, Futurista, Relaxante, Ficção Científica, Espacial, Automação, Construção de Bases, Personalização de Personagem, Compatível com Mods"
Knights Province,December 2026,Indefinido,https://store.steampowered.com/app/1026220/Knights_Province/?snr=1_7_7_popularcomingsoon_150_22,"Estratégia, Medieval, Construção de Cidades, Indie, Estratégia em Tempo Real (RTS), Um Jogador"
Dosa Divas,2026,Indefinido,https://store.steampowered.com/app/2950710/Dosa_Divas/?snr=1_7_7_popularcomingsoon_150_22,"RPG, Combate em Turnos, 3D, Colorido, JRPG, Engraçado, Comovente, Mechas, Futurista, Um Jogador, Exploração, Fabricação, Relaxante, Estilizado, Pesca, Protagonista Mulher, Boa Trama, Narrativa, Ação / Aventura, Cartunizado"
Just A Shadow Game,2026,Indefinido,https://store.steampowered.com/app/3040930/Just_A_Shadow_Game/?snr=1_7_7_popularcomingsoon_150_22,"Batalha com Cartas, Sombrio, Montagem de Decks, Roguelite, Psicológico, Cartas, Boa Trama, Estratégia, Difícil, Terror, Explorador de Calabouços, Demônios, Batalha Automática, Roguelike, Terror Psicológico, Construção de Bases, Alta Rejogabilidade, Você Decide, Combate em Turnos, Montagem de Decks Roguelike"
Fay Keeper,2026,Indefinido,https://store.steampowered.com/app/3088760/Fay_Keeper/?snr=1_7_7_popularcomingsoon_150_22,"RPG, Coleção de Criaturas, Combate em Turnos, Colete Tudo, Gráficos Pixelados, Difícil, Mitologia, Anime, Um Jogador, 2D, Aventura, Estratégia, RPG de Grupos, Fofo, Em Turnos, Exploração, Fantasia, Boa Trama, Retrô, JRPG"
Rune Fencer Illyia,2026,Indefinido,https://store.steampowered.com/app/1104600/Rune_Fencer_Illyia/?snr=1_7_7_popularcomingsoon_150_22,"Ação, Aventura, Metroidvania, Ação / Aventura, Plataforma, Exploração, Hack and Slash, Câmera Lateral, Soulslike, 2D, Atmosférico, Sombrio, Fantasia Sombria, Fantasia, Difícil, Espada, Combate, Fofo, Mágica, Controle"
HyperCore : Rhythm Bullet Hell,2026,Indefinido,https://store.steampowered.com/app/1112390/HyperCore__Rhythm_Bullet_Hell/?snr=1_7_7_popularcomingsoon_150_22,"Ação, Multijogador, Indie, Ritmo, Mandando Bala, Música, Ritmo Rápido, Chuva de Balas, Difícil, Arcade, Musical Procedural, Corrida Contra o Tempo, Impiedoso, Multijogador Local, Colorido, Jogador x Jogador (PvP), Futurista, Um Jogador, Ficção Científica, Pontos, Pontos, Pontos!"
Ten Thousand Coins: The Golden Merchant,2026,Indefinido,https://store.steampowered.com/app/1157900/Ten_Thousand_Coins_The_Golden_Merchant/?snr=1_7_7_popularcomingsoon_150_22,"Troca, Boa Trama, Gerenciamento de Recursos, Economia, Roguelite, Você Decide, Anime, Combate em Turnos, Protagonista Mulher, Fantasia, RPG, Estratégia, Gerenciamento, Gerenciamento de Lojas, RPG de Estratégia, Isométrico, Mistério, Um Jogador, Desenhado à Mão, 2D"
Imperial Grace,2026,Indefinido,https://store.steampowered.com/app/1652580/Imperial_Grace/?snr=1_7_7_popularcomingsoon_150_22,"Otome, LGBTQIA+, Romance Visual, Você Decide, Estratégia, Romance, Boa Trama, Personalização de Personagem, Protagonista Mulher, Gerenciamento, Vários Finais, Escolha a sua Aventura, Político, Ficção Interativa, Gerenciamento de Recursos, Medieval, Aventura, RPG, Simulador de Encontros, Desenhado à Mão"
Laws of Nadragia,2026,Indefinido,https://store.steampowered.com/app/1993410/Laws_of_Nadragia/?snr=1_7_7_popularcomingsoon_150_22,"Gráficos Pixelados, Aventura, Detetive, Investigação, Romance Visual, Boa Trama, Apontar e Clicar, Mistério, Crime, Engraçado, Isométrico, CRPG, Medieval, 2D, Steampunk, Você Decide, Vários Finais, Não Linear, Simulação, Fantasia"
ChainStaff,2026,Indefinido,https://store.steampowered.com/app/2976260/ChainStaff/?snr=1_7_7_popularcomingsoon_150_22,"Ação, Combate, Plataforma 2D, Câmera Lateral, Metroidvania, Retrô, Ficção Científica, Estilizado, Desenhado à Mão, Mandando Bala, Psicodélico, Surrealista, 2D, Atmosférico, Linear, Um Jogador, Alienígenas, Difícil, Plataforma, Violento"
Haunted Lands,2026,Indefinido,https://store.steampowered.com/app/2980900/Haunted_Lands/?snr=1_7_7_popularcomingsoon_150_22,"Plataforma 2D, Um Jogador, Mandando Bala, Difícil, Câmera Lateral, Ação, Aventura, Retrô, Plataforma, Gráficos Pixelados, Terror, Demônios, Velha-Guarda, Zumbis, Mágica, Tiro, Sombrio, Lobisomens, Sobrenatural, Combate"
The Enigma Cases,2026,Indefinido,https://store.steampowered.com/app/3062170/The_Enigma_Cases/?snr=1_7_7_popularcomingsoon_150_22,"Acesso Antecipado, Aventura, Simulação, Quebra-Cabeça, Romance Visual, Objetos Ocultos, Exploração, Simulador Imersivo, 3D, Primeira Pessoa, Detetive, Realístico, Baseado em Texto, Cinematográfico, Atmosférico, Drama, Comovente, Filosófico, Thriller, Mistério"
Blightstone,2026,Indefinido,https://store.steampowered.com/app/2832280/Blightstone/?snr=1_7_7_popularcomingsoon_150_22,"Fantasia Sombria, Tático, RPG Tático, Tática por Turnos, Roguelite, Em Turnos, Fantasia, Estratégia em Turnos, Roguelike, RPG, Estratégia, Isométrico, 2,5D, Enredo Rico, Pós-Apocalíptico, Você Decide, Atmosférico, Combate, Controle, Não Linear"
Headlice,2026,Indefinido,https://store.steampowered.com/app/2851800/Headlice/?snr=1_7_7_popularcomingsoon_150_22,"Protagonista Vilão, Destruição, Sátira, Um Jogador, Física, Terror, Humor Pesado, Anos 90, Capitalismo, Violência Detalhada, Terceira Pessoa, Ação, 3D, Plataforma, Estilizado, Cartunizado, Distópico, Combate, Paródia, Realístico"
Pool of Madness,2026,Free,https://store.steampowered.com/app/2873750/Pool_of_Madness/?snr=1_7_7_popularcomingsoon_150_22,"Acesso Antecipado, Jogador x Jogador (PvP), Simulação, Roguelite, Roguelike, Um Jogador, Humor Ácido, Roguelike de Ação, Estratégia, Sombrio, Lovecraftiano, Controle, Terror, Bilhar, Primeira Pessoa, Geração Procedural, Boa Trama, 3D, Cooperativo Local, Multijogador Local"
Kernel Hearts,2026,Indefinido,https://store.steampowered.com/app/2902170/Kernel_Hearts/?snr=1_7_7_popularcomingsoon_150_22,"Hack and Slash, RPG de Ação, Cooperativo On-line, Multijogador, Roguelike de Ação, Ação, Anime, Roguelite, RPG, Roguelike, Indie, Cooperativo, Ação / Aventura, Protagonista Mulher, Terceira Pessoa, 3D, Estilizado, Romance Visual, Difícil, Colorido"
SOVIET SPOOKY TALES: Green Eyes,2026,Indefinido,https://store.steampowered.com/app/3150620/SOVIET_SPOOKY_TALES_Green_Eyes/?snr=1_7_7_popularcomingsoon_150_22,"Romance Visual, Terror, Gráficos Pixelados, Anos 80, Aventura, Velha-Guarda, Anime, Comédia, Não Linear, Vários Finais, Indie, Um Jogador, Ficção Interativa, 2D"
MARINES VS GOD,2026,Indefinido,https://store.steampowered.com/app/3209950/MARINES_VS_GOD/?snr=1_7_7_popularcomingsoon_150_22,"Tiro de Extração, Jogador x Jogador (PvP), Jogador X Ambiente (PvE), Tiro em Terceira Pessoa, Multijogador, Pós-Apocalíptico, Tiro, Cooperativo On-line, Sobrevivência, Ficção Científica, Atmosférico, Fabricação, Ação, Gerenciamento de Inventário, Terceira Pessoa, Futurista, Mundo Aberto, Combate, Realístico, Personalização de Personagem"
Nightmare Circus,2026,Indefinido,https://store.steampowered.com/app/3227900/Nightmare_Circus/?snr=1_7_7_popularcomingsoon_150_22,"Plataforma, Ação / Aventura, 3D, Fofo, Visão Superior, Boa Trama, Vários Finais, Ação, Cartunizado, Exploração, Colorido, Fantasia Sombria, Fantasia, Mistério, Aventura, Combate, Indie, Um Jogador"
Wild Terrain,2026,Indefinido,https://store.steampowered.com/app/3301300/Wild_Terrain/?snr=1_7_7_popularcomingsoon_150_22,"Aventura, Exploração, Terceira Pessoa, Um Jogador, 3D, Natureza, Indie, Mundo Aberto, Faça o que Quiser, Casual, Atmosférico, Aconchegante, Relaxante, Comovente, Física, Gatos, Cachorros, Do Bem, Cinematográfico, Fofo"
People of Note,2026,Indefinido,https://store.steampowered.com/app/1626170/People_of_Note/?snr=1_7_7_popularcomingsoon_150_22,"RPG, Boa Trama, JRPG, RPG de Grupos, Combate em Turnos, Fantasia, Estilizado, Protagonista Mulher, Colorido, Um Jogador, 3D"
Legends of Astravia,2026,Indefinido,https://store.steampowered.com/app/1233680/Legends_of_Astravia/?snr=1_7_7_popularcomingsoon_150_22,"Acesso Antecipado, Exploração, JRPG, RPG de Grupos, RPG, Linear, Boa Trama, Combate em Turnos, Colorido, Gráficos Pixelados, Mágica, Fantasia, Atmosférico, Drama, Aventura, Anos 90, Velha-Guarda, Retrô, Um Jogador, Nostalgia"
Heart Of Muriet,2026,Indefinido,https://store.steampowered.com/app/1368160/Heart_Of_Muriet/?snr=1_7_7_popularcomingsoon_150_22,"Construção de Bases, Estratégia, Mágica, Atmosférico, Ação, Simulação, 4X, Medieval, Exploração, Estratégia em Tempo Real (RTS), Simulador de Colônias, Fantasia, Editor de Níveis, Construção, Gerenciamento, Um Jogador, Natureza, Gerenciamento de Recursos, Voxel, Sobrevivência"
Skyclimbers,2026,Indefinido,https://store.steampowered.com/app/1362000/Skyclimbers/?snr=1_7_7_popularcomingsoon_150_22,"Acesso Antecipado, Construção de Cidades, Sobrevivência em Mundo Aberto, Coleção de Criaturas, RPG de Ação, Construção, Sobrevivência, Construção de Bases, Mundo Aberto, Anime, Simulação, Estratégia, RPG, Fabricação, Personalização de Personagem, Terceira Pessoa, Jogador x Jogador (PvP), 3D, Estratégia em Tempo Real com Ação, Multijogador"
Mayhem Brawler II: Best of Both Worlds,2026,Indefinido,https://store.steampowered.com/app/1826380/Mayhem_Brawler_II_Best_of_Both_Worlds/?snr=1_7_7_popularcomingsoon_150_22,"Um Jogador, Ação, Cooperativo On-line, Porradaria, Arcade, Retrô, Aventura, Roguelike de Ação, Manipulação de Tempo, Vários Finais, 2D, Câmera Lateral, Roguelite, Cooperativo, Cooperativo Local, Multijogador, Multijogador Local, Anos 90, Desenhado à Mão, História em Quadrinhos"
Dungeons of the Amber Griffin,2026,Indefinido,https://store.steampowered.com/app/1764280/Dungeons_of_the_Amber_Griffin/?snr=1_7_7_popularcomingsoon_150_22,"Explorador de Calabouços, RPG, Coleção de Criaturas, Subterrâneo, Velha-Guarda, Mágica, Quebra-Cabeça, RPG de Ação, Fantasia, Movimento em Grade, Soulslike, Retrô, Objetos Ocultos, Demônios, Fantasia Sombria, Boa Trama, Exploração, Medieval, CRPG, Combate"
Dread Pilots,2026,Indefinido,https://store.steampowered.com/app/1766500/Dread_Pilots/?snr=1_7_7_popularcomingsoon_150_22,"Roguelike de Ação, Mandando Bala, RPG de Estratégia, Espacial, Você Decide, Explorador de Calabouços, Roguelite, Ficção Científica, RPG, Sobrevivência, Visão Superior, Ação, Narração Dinâmica, Colorido, Fabricação, Fantasia Sombria, Distópico, Saques, Combate com Veículos, 2,5D"
Donjon: The Dark Fantasy,2026,Indefinido,https://store.steampowered.com/app/3934590/Donjon_The_Dark_Fantasy/?snr=1_7_7_popularcomingsoon_150_22,"RPG, Fantasia Sombria, Aventura, Simulador Imersivo, Mundo Aberto, Exploração, RPG de Ação, CRPG, Sombrio, Explorador de Calabouços, 3D, Retrô, Atmosférico, Vários Finais, Mágica, Medieval, Fantasia, Combate, Boa Trama, Não Linear"
The 9th Charnel,2026,Indefinido,https://store.steampowered.com/app/2005690/The_9th_Charnel/?snr=1_7_7_popularcomingsoon_150_22,"Terror de Sobrevivência, Terror, Boa Trama, Atmosférico, Quebra-Cabeça, Furtivo, Terror Psicológico, Linear, Primeira Pessoa, Um Jogador, Realístico, Tiro, Psicodélico, Lovecraftiano, Simulador de Caminhada, Demônios, Sombrio, Aventura, Ação, Tiro em Primeira Pessoa (FPS)"
The Dark Rites of Arkham,2026,Indefinido,https://store.steampowered.com/app/3566870/The_Dark_Rites_of_Arkham/?snr=1_7_7_popularcomingsoon_150_22,"Aventura, Apontar e Clicar, Exploração, 2D, Gráficos Pixelados, Detetive, Fantasia Sombria, Investigação, Mistério, Sombrio, Terror, Violência Detalhada, Velha-Guarda, Boa Trama, Um Jogador, Lovecraftiano"
Serial World,2026,Indefinido,https://store.steampowered.com/app/2979500/Serial_World/?snr=1_7_7_popularcomingsoon_150_22,"Fantasia, JRPG, Roguelite, Roguelike, Montagem de Decks, Coleção de Criaturas, Cartas, Fofo, Controle, Combate em Turnos, 3D, Engraçado, Colorido, Para Toda a Família, RPG, Aventura, Você Decide, Comédia, Estratégia em Turnos, Tático"
Legends of Astravia,2026,Indefinido,https://store.steampowered.com/app/1233680/Legends_of_Astravia/?snr=1_7_7_popularcomingsoon_150_23,"Acesso Antecipado, Exploração, JRPG, RPG de Grupos, RPG, Linear, Boa Trama, Combate em Turnos, Colorido, Gráficos Pixelados, Mágica, Fantasia, Atmosférico, Drama, Aventura, Anos 90, Velha-Guarda, Retrô, Um Jogador, Nostalgia"
