title,release_date,price,game_url,genres
Call of Duty®: Black Ops 7,"Nov 14, 2025",$69.99,https://store.steampowered.com/app/3606480/Call_of_Duty_Black_Ops_7/?snr=1_7_7_popularcomingsoon_150_7,Sem gênero
Where Winds Meet,"Nov 14, 2025",Free,https://store.steampowered.com/app/3564740/Where_Winds_Meet/?snr=1_7_7_popularcomingsoon_150_7,"Ação, Aventura, RPG, Ação / Aventura, Mundo Aberto, RPG de Ação, Boa Trama, MMORPG, Faça o que Quiser, 3D, Histórico, História Alternativa, Jogador x Jogador (PvP), Atmosférico, Drama, Um Jogador, Cooperativo, Furtivo, Cooperativo On-line, Multijogador"
UMAMI,"Nov 17, 2025",Indefinido,https://store.steampowered.com/app/3669360/UMAMI/?snr=1_7_7_popularcomingsoon_150_7,"Quebra-Cabeça, Relaxante, Fofo, Do Bem, 3D, Desenhado à Mão, Culinária, Lógica, Aconchegante, Colorido, Casual, Física, Nostalgia, Para Toda a Família, Atmosférico, Um Jogador, Colete Tudo, Apontar e Clicar, Objetos Ocultos, Só Mouse"
The Berlin Apartment,"Nov 17, 2025",Indefinido,https://store.steampowered.com/app/2280430/The_Berlin_Apartment/?snr=1_7_7_popularcomingsoon_150_7,"Indie, Primeira Pessoa, Cartunizado, Boa Trama, 3D, Atmosférico, Um Jogador, Simulador de Caminhada, Mistério, Aventura, Exploração, Colorido, Estilizado, Drama, Narração, Linear, Histórico, Casual, Curta-Metragem, Para Toda a Família"
Solo Leveling: ARISE OVERDRIVE,"Nov 17, 2025",$39.99,https://store.steampowered.com/app/2373990/Solo_Leveling_ARISE_OVERDRIVE/?snr=1_7_7_popularcomingsoon_150_7,"Ação, RPG de Ação, Cooperativo On-line, Boa Trama, Combate, Anime, Um Jogador, RPG, Jogador X Ambiente (PvE), Hack and Slash, Controle, Cooperativo, Cartunizado, Terceira Pessoa, Moderno, Fantasia, Multijogador, 3D, Jogador x Jogador (PvP), Soulslike"
Unmourned,"Nov 17, 2025",Indefinido,https://store.steampowered.com/app/3528970/Unmourned/?snr=1_7_7_popularcomingsoon_150_7,"Terror Psicológico, Terror, Terror de Sobrevivência, Ação, Exploração, Aventura, Calabouço Misterioso, Ação / Aventura, Simulador de Caminhada, Cinematográfico, Realístico, Enredo Rico, Mistério, Sobrenatural, Um Jogador, Psicológico, Surrealista, Drama, Atmosférico, Thriller"
Peace Island,"Nov 17, 2025",Indefinido,https://store.steampowered.com/app/1753870/Peace_Island/?snr=1_7_7_popularcomingsoon_150_7,"Acesso Antecipado, Aventura, RPG, Indie, Casual, Gatos, Mundo Aberto, Boa Trama, Exploração, História Alternativa, Bonito, Natureza, Protagonista Mulher"
Morsels,"Nov 18, 2025",Indefinido,https://store.steampowered.com/app/1719040/Morsels/?snr=1_7_7_popularcomingsoon_150_7,"Roguelike de Ação, Gráficos Pixelados, Ação, Controle com Alavanca Dupla, Fantasia Sombria, Gatos, Desenho Animado, Velha-Guarda, Roguelike, 2D, Roguelite, Indie, Visão Superior, Combate, Chuva de Balas, Controle, Um Jogador"
SpongeBob SquarePants: Titans of the Tide,"Nov 18, 2025",$35.99,https://store.steampowered.com/app/2479650/SpongeBob_SquarePants_Titans_of_the_Tide/?snr=1_7_7_popularcomingsoon_150_7,"Para Toda a Família, Boa Trama, Plataforma 3D, Ação, Plataforma com Quebra-Cabeça, Aventura, Colete Tudo, Plataforma, 3D, Terceira Pessoa, Engraçado, Narração, Comédia, Desenho Animado, Um Jogador"
Demonschool,"Nov 19, 2025",Indefinido,https://store.steampowered.com/app/1900250/Demonschool/?snr=1_7_7_popularcomingsoon_150_7,"Combate em Turnos, Isométrico, JRPG, Aventura, Tático, Comédia, Tática por Turnos, Boa Trama, Humor Ácido, Psicodélico, Um Jogador, Comovente, Mistério, Estratégia em Turnos, Romance Visual, Colorido, Anime, Estratégia, RPG, Quebra-Cabeça"
R-Type Delta: HD Boosted,"Nov 20, 2025",Indefinido,https://store.steampowered.com/app/3072620/RType_Delta_HD_Boosted/?snr=1_7_7_popularcomingsoon_150_7,"Ação, Tiro, Mandando Bala, Plataforma 2D, 2D, Futurista, Controle, Um Jogador, Vários Finais, 3D, Ficção Científica, Cinematográfico, Alienígenas, Mechas, Retrô, Robôs"
Outlaws + Handful of Missions: Remaster,"Nov 20, 2025",$29.99,https://store.steampowered.com/app/3366780/Outlaws__Handful_of_Missions_Remaster/?snr=1_7_7_popularcomingsoon_150_7,"Tiro de Tiozão, Tiro em Primeira Pessoa (FPS), Velho Oeste, Ação, Mandando Bala, Jogador x Jogador (PvP), Aventura, Tiro, Ação / Aventura, 2D, 3D, Controle, Linear, Violento, Primeira Pessoa, Cartunizado, Anos 90, EUA, Multijogador, Um Jogador"
Effulgence RPG,"Nov 20, 2025",Indefinido,https://store.steampowered.com/app/3302080/Effulgence_RPG/?snr=1_7_7_popularcomingsoon_150_7,"RPG, Retrô, Aventura, Em Turnos, RPG de Grupos, Fabricação, Velha-Guarda, Ficção Científica, Atmosférico, Saques, Vários Finais, Ambiente, Tática por Turnos, Indie, Gerenciamento de Inventário, Gerenciamento de Recursos, Minimalista, Um Jogador, Controle, 2,5D"
The Art of Reflection,"Nov 24, 2025",Indefinido,https://store.steampowered.com/app/2290770/The_Art_of_Reflection/?snr=1_7_7_popularcomingsoon_150_7,"Plataforma com Quebra-Cabeça, Primeira Pessoa, Quebra-Cabeça, Exploração, Surrealista, Não Linear, Plataforma 3D, Um Jogador, Lógica, Abstrato, Minimalista, Atmosférico, Colorido, 3D, Aventura, Controle, Indie"
Constance,"Nov 24, 2025",Indefinido,https://store.steampowered.com/app/2313700/Constance/?snr=1_7_7_popularcomingsoon_150_7,"Metroidvania, Plataforma, 2D, Ação, Um Jogador, Aventura, Desenhado à Mão, Indie, Comovente, Mistério, Exploração, Atmosférico, Não Linear, Boa Trama, Psicológico, Mundo Aberto, Fofo, Controle, Protagonista Mulher, Câmera Lateral"
Project Motor Racing,"Nov 25, 2025",$59.99,https://store.steampowered.com/app/299970/Project_Motor_Racing/?snr=1_7_7_popularcomingsoon_150_7,"Simulação, Corrida, Realístico, Simulador Imersivo, Primeira Pessoa, Direção, Compatível com Mods, Simulador Automobilístico, Física, Multijogador, RV, Um Jogador, Terceira Pessoa, Terror Psicológico"
Seven Seas: Adventures,"Nov 25, 2025",Indefinido,https://store.steampowered.com/app/2128430/Seven_Seas_Adventures/?snr=1_7_7_popularcomingsoon_150_7,"Acesso Antecipado, Piratas, Mundo Aberto, RPG, Naval, Escolha a sua Aventura, Aventura, Faça o que Quiser, Ação, Estratégia, Simulador de Colônias, RPG de Estratégia, Exploração, Simulador Imersivo, Terceira Pessoa, Capitalismo, Visão Superior, Construção, Combate Naval, 3D"
Fantasy World Manager,November 2025,Indefinido,https://store.steampowered.com/app/3447280/Fantasy_World_Manager/?snr=1_7_7_popularcomingsoon_150_7,"Jogo de Divindade, Faça o que Quiser, Gerenciamento, Simulação, Construção de Cidades, Fantasia, 2D, Geração Procedural, Simulador de Vida Real, Gráficos Pixelados, Fofo, Anos 90, Atmosférico, Relaxante, Construção de Bases, Estratégia, Personalização de Personagem, Indie, RPG, Editor de Níveis"
Kingdoms of the Dump,November 2025,Indefinido,https://store.steampowered.com/app/2159270/Kingdoms_of_the_Dump/?snr=1_7_7_popularcomingsoon_150_7,"RPG, JRPG, Gráficos Pixelados, Fantasia, Retrô, Um Jogador"
CrocApoca!! Crocodile maiden at the End of the World,November 2025,Indefinido,https://store.steampowered.com/app/1294620/CrocApoca_Crocodile_maiden_at_the_End_of_the_World/?snr=1_7_7_popularcomingsoon_150_7,"Romance Visual, Romance, Drama, Para Adultos, Anime, Engraçado, Conteúdo Sexual, Boa Trama, Alta Rejogabilidade, Fofo, Nudez, Você Decide, Comédia, Relaxante, Protagonista Mulher, Hentai, Simulador de Encontros, Impróprio para o Local de Trabalho, Aventura, LGBTQIA+"
Clockwork Ambrosia,November 2025,Indefinido,https://store.steampowered.com/app/896010/Clockwork_Ambrosia/?snr=1_7_7_popularcomingsoon_150_7,"Exploração, Metroidvania, Plataforma 2D, Plataforma, Tiro, Parkour, Atmosférico, Controle, Ação / Aventura, Robôs, Protagonista Mulher, Steampunk, Natureza, 2D, Personalização de Armas, Retrô, Não Linear, Futurista, Ação, Gráficos Pixelados"
Restaurats,November 2025,Indefinido,https://store.steampowered.com/app/2870920/Restaurats/?snr=1_7_7_popularcomingsoon_150_7,"Casual, Cooperativo, Culinária, Roguelite, Simulação, Engraçado, Estratégia, Simulador Imersivo, Gerenciamento, Sátira, Comédia, Gerenciamento de Tempo, Terceira Pessoa, Ação, Controle, 3D, Construção de Bases, Multijogador, Gerenciamento de Recursos, RPG"
My Little Puppy,November 2025,Indefinido,https://store.steampowered.com/app/2102040/My_Little_Puppy/?snr=1_7_7_popularcomingsoon_150_7,"Aventura, Cachorros, Comovente, Boa Trama, Colorido, Fofo, Atmosférico, Um Jogador, Exploração, 3D, Estilizado, Natureza, Engraçado, Relaxante, Ação / Aventura, Para Toda a Família, Linear, Fantasia, Plataforma 3D, Gatos"
Clockwork Ambrosia,novembro de 2025,Indefinido,https://store.steampowered.com/app/896010/Clockwork_Ambrosia/?snr=1_7_7_popularcomingsoon_150_8,"Exploração, Metroidvania, Plataforma 2D, Plataforma, Tiro, Parkour, Atmosférico, Controle, Ação / Aventura, Robôs, Protagonista Mulher, Steampunk, Natureza, 2D, Personalização de Armas, Retrô, Não Linear, Futurista, Ação, Gráficos Pixelados"
Alchemy Factory,November 2025,Indefinido,https://store.steampowered.com/app/3669570/Alchemy_Factory/?snr=1_7_7_popularcomingsoon_150_8,"Automação, Medieval, Estratégia, Faça o que Quiser, Construção, Casual, Um Jogador, Multijogador, Fabricação, Construção de Bases, Primeira Pessoa, 3D, Simulação, Gerenciamento de Recursos, Cooperativo, Cooperativo On-line, Indie, Lógica"
Free For Fall,November 2025,Indefinido,https://store.steampowered.com/app/3691910/Free_For_Fall/?snr=1_7_7_popularcomingsoon_150_8,"Multijogador, Em Grupos, Engraçado, Plataforma, Cooperativo On-line, Casual, Arcade, Plataforma 3D, Plataforma de Precisão, 3D, Colorido, Terceira Pessoa, Parkour, Jogador x Jogador (PvP), Personalização de Personagem, Indie, Você Decide, Para Toda a Família, Competitivo"
World of Magic: Rise of Magic,November 2025,Indefinido,https://store.steampowered.com/app/3004280/World_of_Magic_Rise_of_Magic/?snr=1_7_7_popularcomingsoon_150_8,"RPG, Mundo Aberto, Medieval, Boa Trama, Você Decide, Mágica, RPG de Ação, Terceira Pessoa, Ação / Aventura, Ação, Tiro de Heróis, Tiro em Terceira Pessoa, JRPG, Terror, Um Jogador, Guerra, Fabricação, Aventura, Sombrio, Enredo Rico"
Long Drive North: Co-Op RV Simulator,November 2025,Indefinido,https://store.steampowered.com/app/3179350/Long_Drive_North_CoOp_RV_Simulator/?snr=1_7_7_popularcomingsoon_150_8,"Acesso Antecipado, Sobrevivência, Sobrevivência em Mundo Aberto, Mundo Aberto, Exploração, Atmosférico, Um Jogador, Simulador Automobilístico, Primeira Pessoa, Aventura, Fabricação, Direção, Cooperativo, Faça o que Quiser, Simulação, Corrida, Pós-Apocalíptico, Realístico, Tiro, Construção"
DSS 2: War Industry,November 2025,Indefinido,https://store.steampowered.com/app/3582440/DSS_2_War_Industry/?snr=1_7_7_popularcomingsoon_150_8,"Jogo de Guerra, Construção de Cidades, Medieval, Economia, Estratégia em Tempo Real (RTS), Grande Estratégia, Estratégia, Voxel, 3D, Mundo Aberto, Geração Procedural, Simulação, Fantasia, Tático, Gerenciamento de Recursos, Cooperativo, Cooperativo Local, Multijogador, Um Jogador, Multijogador Local"
Disney Dreamlight Valley: Wishblossom Ranch,November 2025,Indefinido,https://store.steampowered.com/app/3979520/Disney_Dreamlight_Valley_Wishblossom_Ranch/?snr=1_7_7_popularcomingsoon_150_8,"Ação, Aventura, RPG, Casual, Simulação"
City Car Driving 2.0,November 2025,Indefinido,https://store.steampowered.com/app/2327720/City_Car_Driving_20/?snr=1_7_7_popularcomingsoon_150_8,"Simulação, Simulador Automobilístico, Corrida, 3D, Faça o que Quiser, Realístico, Primeira Pessoa, Direção, Terceira Pessoa, Mundo Aberto, Atmosférico, Controle, Indie, Física, Tutorial, Um Jogador, RV, Multijogador, Gratuito para Jogar"
Corner Shop: NightShift,November 2025,Indefinido,https://store.steampowered.com/app/3306990/Corner_Shop_NightShift/?snr=1_7_7_popularcomingsoon_150_8,"Aventura, Terror, Terror Psicológico, Atmosférico, Primeira Pessoa, Um Jogador, Exploração, Thriller, Indie, Simulação, Simulador de Caminhada, Realístico, Boa Trama, 3D, Sombrio, Psicodélico, Narração, Gerenciamento de Tempo, Narrativa, Simulador Imersivo"
Game Of Fate 3：Clash Of Crowns,November 2025,Indefinido,https://store.steampowered.com/app/3406910/Game_Of_Fate_3Clash_Of_Crowns/?snr=1_7_7_popularcomingsoon_150_8,"FMV, Simulador Imersivo, Cinematográfico, Primeira Pessoa, Enredo Rico, Escolha a sua Aventura, Simulador de Encontros, Simulação, Ficção Interativa, Boa Trama, Aventura, Plataforma com Quebra-Cabeça, Drama, Mistério, Lógica, Vários Finais, RPG, Detetive, Comovente, Um Jogador"
Quarantine Zone: The Last Check,November 2025,Indefinido,https://store.steampowered.com/app/3419520/Quarantine_Zone_The_Last_Check/?snr=1_7_7_popularcomingsoon_150_8,"Zumbis, Simulação, Pós-Apocalíptico, Um Jogador, Você Decide, Realístico, Primeira Pessoa, 3D, Militar, Atmosférico, Humor Ácido, Gerenciamento de Recursos, Simulador Imersivo, Gerenciamento, EUA, Construção de Bases, Simulador de Vida Real, Drama, Comovente, Construção"
Automaton Heart,"Dec 1, 2025",Indefinido,https://store.steampowered.com/app/3070020/Automaton_Heart/?snr=1_7_7_popularcomingsoon_150_8,"Aventura, Ação, Tiro em Terceira Pessoa, RPG, Tiro, RPG de Ação, 3D, Abstrato, Psicodélico, Estilizado, Terceira Pessoa, Anos 90, Atmosférico, Relaxante, Retrô, Robôs, Ficção Científica, Surrealista, Jogador x Jogador (PvP), Personalização de Personagem"
Toxic Crusaders,"Dec 4, 2025",Indefinido,https://store.steampowered.com/app/2303850/Toxic_Crusaders/?snr=1_7_7_popularcomingsoon_150_8,"História em Quadrinhos, Câmera Lateral, Porradaria, Arcade, 2D, Engraçado, Controle, Boa Trama, Ação, Colorido, Gráficos Pixelados, Desenhado à Mão, Multijogador Local, Para Toda a Família, Comédia, Anos 90, Velha-Guarda, Local para 4 Jogadores, Trilha Sonora, Retrô"
OCTOPATH TRAVELER 0,"Dec 4, 2025",$49.99,https://store.steampowered.com/app/3014320/OCTOPATH_TRAVELER_0/?snr=1_7_7_popularcomingsoon_150_8,"RPG, JRPG, RPG de Grupos, Um Jogador, 2,5D, Anime, Violento, Personalização de Personagem, Estratégia, Controle, Em Turnos, Sombrio, Gráficos Pixelados, Drama, Fantasia, Medieval, Construção, Comovente, Boa Trama, Visão Superior"
Paralives,"Dec 8, 2025",Indefinido,https://store.steampowered.com/app/1118520/Paralives/?snr=1_7_7_popularcomingsoon_150_8,"Simulação, Simulador de Vida Real, Personalização de Personagem, Construção, Mundo Aberto, Indie, Um Jogador, Faça o que Quiser, Relaxante, Casual, Fofo, LGBTQIA+, Realístico, Para Toda a Família, Acesso Antecipado, Compatível com Mods, Multijogador, Para Adultos, Aconchegante, Conteúdo Sexual"
Cities: Skylines II - Bridges & Ports,Coming soon,Indefinido,https://store.steampowered.com/app/2427743/Cities_Skylines_II__Bridges__Ports/?snr=1_7_7_popularcomingsoon_150_8,"Simulação, Construção de Cidades, Construção, Um Jogador, Faça o que Quiser, Gerenciamento, Economia, Estratégia, Realístico, Compatível com Mods, Relaxante, Casual, Gerenciamento de Recursos, Transportes, Atmosférico, Multijogador, Acesso Antecipado, Mundo Aberto, Trilha Sonora Boa, Conteúdo Sexual"
Cities: Skylines II - Cold Wave Channel,Coming soon,Indefinido,https://store.steampowered.com/app/2427746/Cities_Skylines_II__Cold_Wave_Channel/?snr=1_7_7_popularcomingsoon_150_8,"Simulação, Construção de Cidades, Construção, Um Jogador, Faça o que Quiser, Gerenciamento, Economia, Estratégia, Realístico, Compatível com Mods, Relaxante, Casual, Gerenciamento de Recursos, Transportes, Atmosférico, Multijogador, Acesso Antecipado, Mundo Aberto, Trilha Sonora Boa, Conteúdo Sexual"
Metal Hunter,"Dec 31, 2025",Free,https://store.steampowered.com/app/3338560/Metal_Hunter/?snr=1_7_7_popularcomingsoon_150_8,"Aventura, RPG, Casual, Estratégia em Turnos, JRPG, Quebra-Cabeça, Exploração, Um Jogador, 2D, Visão Superior, Gráficos Pixelados, Drama, Pós-Apocalíptico, Tanques, Tática por Turnos, Boa Trama, Combate em Turnos, Conversas, Mundo Aberto, RPG de Grupos"
LlamaRPG: Farm to Fable,Q4 2025,Indefinido,https://store.steampowered.com/app/2778290/LlamaRPG_Farm_to_Fable/?snr=1_7_7_popularcomingsoon_150_8,"Exploração, Jogador X Ambiente (PvE), Jogador x Jogador (PvP), RPG, Estratégia em Turnos, JRPG, 2D, Visão Superior, Engraçado, Você Decide, Combate em Turnos, Gráficos Pixelados, Fantasia, Mágica, Aventura, Fabricação, Velha-Guarda, Retrô, Combate, Casual"
Shadows of the Afterland,2025,Indefinido,https://store.steampowered.com/app/2506100/Shadows_of_the_Afterland/?snr=1_7_7_popularcomingsoon_150_8,"Aventura, Apontar e Clicar, Protagonista Mulher, Velha-Guarda, Fantasia, Comédia, Gráficos Pixelados, Quebra-Cabeça, 2D, Sobrenatural, Boa Trama, Exploração, Fantasia Sombria, Casual, Humor Ácido, Colorido, Engraçado, Investigação, Detetive, Um Jogador"
Rogue Factory,2025,Indefinido,https://store.steampowered.com/app/3212630/Rogue_Factory/?snr=1_7_7_popularcomingsoon_150_8,"Automação, Roguelike de Ação, Sobrevivência, Gráficos Pixelados, Gerenciamento de Recursos, Construção, Um Jogador, Roguelite, Jogador X Ambiente (PvE), Roguelike, Construção de Bases, Ação, Gerenciamento, Mágica, Simulação, 2D, Visão Superior, Você Decide, Gerenciamento de Inventário, Fabricação"
Disco Samurai,2025,Indefinido,https://store.steampowered.com/app/2576410/Disco_Samurai/?snr=1_7_7_popularcomingsoon_150_8,"Ação, Ritmo, Cyberpunk, Porradaria, Combate, Espada, Pontos, Pontos, Pontos!, Hack and Slash, 2,5D, Isométrico, Protagonista Mulher, Gráficos Pixelados, Estilizado, Futurista, Moderno, Linear, Artes Marciais, Eventos Rápidos, Um Jogador, Arcade"
Flow Of War,Q4 2025,Indefinido,https://store.steampowered.com/app/2637210/Flow_Of_War/?snr=1_7_7_popularcomingsoon_150_8,"Estratégia, Estratégia em Tempo Real com Ação, Estratégia em Tempo Real (RTS), Batalha Automática, Defesa de Torres, Construção de Bases, Automação, Geração Procedural, Medieval, Tática em Tempo Real, Gráficos Pixelados, 2D, Visão Superior, Construção, Simulador Rural, Fantasia Sombria, Demônios, Mágica, Guerra, Mineração"
Saborus,2025,Indefinido,https://store.steampowered.com/app/2768030/Saborus/?snr=1_7_7_popularcomingsoon_150_8,"Ação, Aventura, Furtivo, Atmosférico, Terror, Sombrio, Mistério, Quebra-Cabeça, Terceira Pessoa, Um Jogador, Ação / Aventura, Indie, 3D, Plataforma 3D, Exploração, Sátira, Terror de Sobrevivência, Conspiração, Experimental, Político"
Sliding Hero,Q4 2025,Indefinido,https://store.steampowered.com/app/2966300/Sliding_Hero/?snr=1_7_7_popularcomingsoon_150_8,"Metroidvania, Mistério, Não Linear, Quebra-Cabeça, Sokoban, Lógica, Aventura, Fantasia Sombria, Exploração, Mundo Aberto, Atmosférico, Ação / Aventura, Indie, 2D, Retrô, Colete Tudo, Visão Superior, Gráficos Pixelados, Boa Trama, Gótico"
One Last Raid,2025,Indefinido,https://store.steampowered.com/app/3027910/One_Last_Raid/?snr=1_7_7_popularcomingsoon_150_8,"Um Jogador, Ação, Roguelike, RPG, RPG de Ação, Isométrico, Medieval, Fantasia, Roguelike de Ação, Hack and Slash, 3D, Visão Superior, Você Decide, Combate, Roguelite, Estilizado, Fantasia Sombria, Controle, Saques"
SHINONOME ABYSS The Maiden Exorcist,2025,Indefinido,https://store.steampowered.com/app/2948080/SHINONOME_ABYSS_The_Maiden_Exorcist/?snr=1_7_7_popularcomingsoon_150_8,"RPG, Calabouço Misterioso, Roguelike, Explorador de Calabouços, 2D, Controle, Visão Superior, Ação, Geração Procedural, Pontos, Pontos, Pontos!, Plataforma 2D, Aventura, JRPG, Ação / Aventura, Gráficos Pixelados, Terror, Difícil, Um Jogador, Retrô, Indie"
The Good Dog: Chasing Shadows,2025,Indefinido,https://store.steampowered.com/app/3208910/The_Good_Dog_Chasing_Shadows/?snr=1_7_7_popularcomingsoon_150_8,"Terror, Cachorros, Exploração, Sobrenatural, Mistério, Terror de Sobrevivência, Quebra-Cabeça, Jogador X Ambiente (PvE), Ação / Aventura, 3D, Terceira Pessoa, Você Decide, Vários Finais, Ação, Mundo Aberto, Boa Trama, Realístico, Aventura, Investigação, Sombrio"
Telegraphist 1920: Beats of War,2025,Indefinido,https://store.steampowered.com/app/2584510/Telegraphist_1920_Beats_of_War/?snr=1_7_7_popularcomingsoon_150_8,"Ritmo, Histórico, Primeira Guerra Mundial, Apontar e Clicar, Música, Editor de Níveis, Boa Trama, Simulação, Atmosférico, Estilizado, Guerra, Militar, Linear, Alta Rejogabilidade, Romance Visual, Jogo de Guerra, Educativo, Experimental, Indie, Aventura"
Generation Exile,2025,Indefinido,https://store.steampowered.com/app/2963240/Generation_Exile/?snr=1_7_7_popularcomingsoon_150_8,"Construção de Cidades, Simulador de Colônias, Construção, Gerenciamento, Natureza, Simulação, Espacial, Sobrevivência, Construção de Bases, 3D, Você Decide, Vários Finais, Geração Procedural, Boa Trama, Colorido, Ficção Científica, Atmosférico, Um Jogador, Gerenciamento de Recursos, Narrativa"
Food Wagon,2025,Indefinido,https://store.steampowered.com/app/3434130/Food_Wagon/?snr=1_7_7_popularcomingsoon_150_8,"Roguelike de Ação, Culinária, Ação / Aventura, Anime, Protagonista Mulher, 3D, Fofo, Ação, Controle, Jogador X Ambiente (PvE), Colorido, Estilizado, Roguelite, Fantasia, Aventura, Medieval, Combate, Um Jogador"
恋爱泡馍！青春老陕：Shannxi Love Story,2025,Indefinido,https://store.steampowered.com/app/3453470/Shannxi_Love_Story/?snr=1_7_7_popularcomingsoon_150_8,"RPG, Casual, Simulador de Encontros, Romance Visual, Jogo de Palavras, 2D, Anime, Fofo, Drama, Indie, Simulação, Comovente, Relaxante, Boa Trama, Um Jogador"
Chunky JUMP!,2025,Indefinido,https://store.steampowered.com/app/3606780/Chunky_JUMP/?snr=1_7_7_popularcomingsoon_150_8,"Aventura, Estratégia, Arcade, Terror, Terror de Sobrevivência, Plataforma, Apontar e Clicar, Romance Visual, Plataforma 2D, Colete Tudo, Plataforma de Precisão, Câmera Lateral, 2D, Desenho Animado, Colorido, Fofo, Primeira Pessoa, Gráficos Pixelados, Anos 90, Um Jogador"
Inkwellers,2025,Indefinido,https://store.steampowered.com/app/3061390/Inkwellers/?snr=1_7_7_popularcomingsoon_150_8,"Aventura, Indie, Quebra-Cabeça, Cooperativo, Campanha Cooperativa, 3D, Lógica, Cooperativo On-line, Multijogador, Primeira Pessoa, Casual, Cinematográfico, Fantasia, Mágica, Colorido, Estilizado, Atmosférico, Plataforma com Quebra-Cabeça, Sobrenatural, Conversas"
The Diner at the End of the Galaxy,2025,Indefinido,https://store.steampowered.com/app/2577420/The_Diner_at_the_End_of_the_Galaxy/?snr=1_7_7_popularcomingsoon_150_8,"Gerenciamento, Construção de Bases, Culinária, Diplomacia, Economia, Gerenciamento de Recursos, Simulador de Colônias, Construção, Agricultura, Exploração, Alienígenas, Estratégia, Espacial, Construção de Cidades, Simulador Político, 2D, Cartunizado, Isométrico, Gráficos Pixelados, Você Decide"
ADA: Tainted Soil,Q4 2025,Indefinido,https://store.steampowered.com/app/2535850/ADA_Tainted_Soil/?snr=1_7_7_popularcomingsoon_150_8,"Gráficos Pixelados, Atmosférico, Aventura, Boa Trama, RPG, Fantasia, 2D, Hack and Slash, Difícil, Ação, Mágica, Um Jogador, Exploração, Colorido, Visão Superior, RPG de Ação, Fabricação, Isométrico, Indie, Plataforma com Quebra-Cabeça"
Building Relationships,2025,Indefinido,https://store.steampowered.com/app/2666920/Building_Relationships/?snr=1_7_7_popularcomingsoon_150_8,"Exploração, LGBTQIA+, Romance, Engraçado, 3D, Um Jogador, Narrativa, Curta-Metragem, Aventura, Humor Pesado, Plataforma 3D, Humor Ácido, Comédia, Pesca, Linear, Comovente, Simulador de Encontros, Mundo Aberto, Colorido, Plataforma"
Nientum - Op.ZERO,2025,Indefinido,https://store.steampowered.com/app/2725250/Nientum__OpZERO/?snr=1_7_7_popularcomingsoon_150_8,"Acesso Antecipado, Protagonista Mulher, Boa Trama, Indie, Música, Casual, Ritmo, Corredor, Esportes, Ação, Fofo, Aventura, Romance Visual, Arcade, Ação / Aventura, Um Jogador, Atmosférico, Câmera Lateral, Enredo Rico, Anime"
Settler's Domain,Q4 2025,Indefinido,https://store.steampowered.com/app/3396920/Settlers_Domain/?snr=1_7_7_popularcomingsoon_150_8,"Simulador de Colônias, Construção de Cidades, Gerenciamento de Recursos, Sobrevivência, Simulação, Gráficos Pixelados, Estratégia, Exploração, Indie, Geração Procedural, Mundo Aberto, 2D, Visão Superior, Faça o que Quiser, Gerenciamento, Construção, Economia, Medieval, Casual, Um Jogador"
ULTRA MUSHROOM,2025,Indefinido,https://store.steampowered.com/app/2975130/ULTRA_MUSHROOM/?snr=1_7_7_popularcomingsoon_150_8,"Psicodélico, Gráficos Pixelados, Um Jogador, Boa Trama, Aventura, Gerenciamento, Anime, Casual, Agricultura, Paródia, Ritmo, Conversas, Relaxante, Ficção Interativa, Gerenciamento de Tempo, Música, Culinária, Comédia"
Curiosity,2025,Indefinido,https://store.steampowered.com/app/2984970/Curiosity/?snr=1_7_7_popularcomingsoon_150_8,"Aventura, Plataforma, Plataforma 3D, Exploração, Plataforma de Precisão, 3D, Fofo, Psicodélico, Terceira Pessoa, Gatos, Humor Pesado, Natureza, Terror, Parkour, Terror Psicológico, Sátira, Você Decide, Controle, Vários Finais, Física"
THYSIASTERY,2025,Indefinido,https://store.steampowered.com/app/3140180/THYSIASTERY/?snr=1_7_7_popularcomingsoon_150_8,"Explorador de Calabouços, Em Turnos, Roguelike, RPG de Grupos, Geração Procedural, Exploração, Sobrenatural, Gráficos Pixelados, Difícil, Roguelite, Sombrio, Retrô, Atmosférico, RPG, CRPG, JRPG, Indie, Movimento em Grade, Combate em Turnos, Roguelike Tradicional"
Dead Faces,2025,Indefinido,https://store.steampowered.com/app/2822770/Dead_Faces/?snr=1_7_7_popularcomingsoon_150_8,"Terror Psicológico, Atmosférico, Terror, Sombrio, Aventura, Surrealista, Quebra-Cabeça, 3D, Colete Tudo, Primeira Pessoa, Exploração, Realístico, Psicológico, Simulador de Caminhada, Terror de Sobrevivência, Você Decide, Mistério, Colorido, Simulador Imersivo, Combate"
