title,release_date,price,game_url,genres
Love n Life: Happy Student,Q2 2025,Indefinido,https://store.steampowered.com/app/3149980/Love_n_Life_Happy_Student/?snr=1_7_7_popularcomingsoon_150_7,"Conteúdo Sexual, Hentai, Nudez, Impróprio para o Local de Trabalho, Gerenciamento de Inventário, Simulação, Para Adultos, Simulador de Encontros, RPG, Anime, Simulador de Vida Real, Romance Visual, JRPG, Fofo, 2D, Gráficos Pixelados, Romance, Gerenciamento de Tempo, Terror Psicológico, Um Jogador"
GEX Trilogy,Q2 2025,Indefinido,https://store.steampowered.com/app/3183970/GEX_Trilogy/?snr=1_7_7_popularcomingsoon_150_7,"Plataforma 3D, Anos 90, Paródia, Comédia, Engraçado, Plataforma 2D, Colete Tudo, Boa Trama, Narração Dinâmica, Plataforma, Exploração, Câmera Lateral, 2D, Desenho Animado, Cartunizado, Narração, Memes, Retrô, Colorido, Terceira Pessoa"
Dungeons of Eternity,Q2 2025,Indefinido,https://store.steampowered.com/app/3189340/Dungeons_of_Eternity/?snr=1_7_7_popularcomingsoon_150_7,"RPG, RPG de Ação, Ação / Aventura, Explorador de Calabouços, Exploração, RV, Hack and Slash, Fantasia Sombria, Personalização de Personagem, Combate, Jogador X Ambiente (PvE), Multijogador, Cooperativo On-line, Ação, Um Jogador, Aventura, Fantasia, Indie"
Road Food Simulator,Q2 2025,Indefinido,https://store.steampowered.com/app/3207670/Road_Food_Simulator/?snr=1_7_7_popularcomingsoon_150_7,"Simulação, Cooperativo On-line, Gerenciamento, Culinária, Multijogador, Cooperativo, Tiro em Primeira Pessoa (FPS), Simulador Imersivo, Realístico, 3D, Acesso Antecipado, Casual, Personalização de Personagem, Um Jogador, EUA, Simulador de Vida Real"
Recharge,Q2 2025,Indefinido,https://store.steampowered.com/app/3225420/Recharge/?snr=1_7_7_popularcomingsoon_150_7,"Acesso Antecipado, Corrida, Arcade, Corrida com Combate, Direção, Jogador x Jogador (PvP), Controle, Multijogador, 3D, Um Jogador, Atmosférico, Realístico, Simulador Automobilístico, Primeira Pessoa, Física, Esportes, Ritmo Rápido, Estrada de Terra, Simulação, Cooperativo"
Projekt Z: Beyond Order,2º trimestre de 2025,Indefinido,https://store.steampowered.com/app/763310/Projekt_Z_Beyond_Order/?snr=1_7_7_popularcomingsoon_150_7,"Zumbis, Tiro em Primeira Pessoa (FPS), Campanha Cooperativa, Cooperativo On-line, Cooperativo, Ação, Tiro de Heróis, Terror, Atmosférico, Segunda Guerra Mundial, Pós-Apocalíptico, Indie, Jogador X Ambiente (PvE), Aventura, Fabricação, Primeira Pessoa, Realístico, Estratégia, Gerenciamento de Inventário, Baseado em Equipes"
Otherskin,2º trimestre de 2025,Indefinido,https://store.steampowered.com/app/1622630/Otherskin/?snr=1_7_7_popularcomingsoon_150_7,"Ação, Tiro em Terceira Pessoa, Ficção Científica, Metroidvania, Aventura, Exploração, Protagonista Mulher, 3D, Tiro, Combate, Ação / Aventura, Atmosférico, Realístico, Terceira Pessoa, Alienígenas, Controle, Linear, Física, Personalização de Armas, Manipulação de Tempo"
模拟江湖,2º trimestre de 2025,Indefinido,https://store.steampowered.com/app/1633850/Jianghu_Simulator/?snr=1_7_7_popularcomingsoon_150_7,"Acesso Antecipado, RPG, Estratégia, Mundo Aberto, Artes Marciais, Indie, Compatível com Mods, Faça o que Quiser, Estratégia em Tempo Real com Ação, Personalização de Personagem, Boa Trama, Um Jogador, Aventura, Anime, Visão Superior, Gerenciamento de Recursos, RPG de Estratégia, Terceira Pessoa, Gerenciamento, Combate"
Hell Clock,junho de 2025,Indefinido,https://store.steampowered.com/app/1782460/Hell_Clock/?snr=1_7_7_popularcomingsoon_150_7,"Ação, RPG, RPG de Ação, Explorador de Calabouços, Roguelike, Roguelike de Ação, Ação / Aventura, Tiro, Calabouço Misterioso, Tiro com Saques, Tiro em Terceira Pessoa, 3D, Desenhado à Mão, Roguelite, Terceira Pessoa, Atmosférico, Comovente, Demônios, Drama, Fantasia Sombria"
Dark Moon,2º trimestre de 2025,Indefinido,https://store.steampowered.com/app/1105330/Dark_Moon/?snr=1_7_7_popularcomingsoon_150_7,"Gerenciamento, Construção de Bases, Economia, Simulador de Colônias, Gerenciamento de Recursos, Você Decide, Sombrio, Exploração, Pós-Apocalíptico, História Alternativa, Estratégia, Estratégia em Tempo Real (RTS), Sobrevivência, Espacial, Ficção Científica, Um Jogador, Atmosférico, Indie, Ritmo Rápido, Anime"
Animal Shelter 2,2º trimestre de 2025,Indefinido,https://store.steampowered.com/app/2658510/Animal_Shelter_2/?snr=1_7_7_popularcomingsoon_150_7,"Simulação, Para Toda a Família, Multijogador, Fofo, Realístico, Gatos, Casual, Cachorros, Aventura, Simulador de Vida Real, Primeira Pessoa, Gerenciamento, Atmosférico, Relaxante, Indie, Mundo Aberto, Educativo, Um Jogador, Simulador Imersivo, Colorido"
Netherworld Covenant,2º trimestre de 2025,Indefinido,https://store.steampowered.com/app/2735580/Netherworld_Covenant/?snr=1_7_7_popularcomingsoon_150_7,"Acesso Antecipado, Roguelike de Ação, Ação, Isométrico, Fantasia Sombria, Roguelike, Soulslike, 3D, Aventura, Um Jogador, Explorador de Calabouços, RPG, RPG de Ação, Difícil, Atmosférico, Alta Rejogabilidade, Morte Permanente, Sombrio, Indie, Violência Detalhada"
Sol Cesto,2º trimestre de 2025,Indefinido,https://store.steampowered.com/app/2738490/Sol_Cesto/?snr=1_7_7_popularcomingsoon_150_7,"Explorador de Calabouços, Quebra-Cabeça, Apostas, Tático, Geração Procedural, Atmosférico, Fantasia, Mistério, Roguelike, Estratégia, Movimento em Grade, Em Turnos, Alta Rejogabilidade, Um Jogador, Roguelite, Montagem de Decks, Montagem de Decks Roguelike, 2D, Minimalista, Indie"
Granvir,2º trimestre de 2025,Indefinido,https://store.steampowered.com/app/2743460/Granvir/?snr=1_7_7_popularcomingsoon_150_7,"Roguelike de Ação, Tiro em Terceira Pessoa, Mechas, Roguelite, Tiro, Jogador X Ambiente (PvE), Roguelike, Robôs, Ação, 3D, Terceira Pessoa, Militar, Ficção Científica, Guerra, Futurista, Combate, Um Jogador, Indie, Simulação"
Another Farm Roguelike: Rebirth,2º trimestre de 2025,Indefinido,https://store.steampowered.com/app/2760790/Another_Farm_Roguelike_Rebirth/?snr=1_7_7_popularcomingsoon_150_7,"Montagem de Decks Roguelike, Estratégia em Turnos, Montagem de Decks, Simulador Rural, Estratégia, Gráficos Pixelados, Roguelike, Roguelite, Alta Rejogabilidade, Gerenciamento de Recursos, Geração Procedural, Simulação, Rural, 2D, Relaxante, Construção, Indie, Um Jogador, Capitalismo, Gerenciamento"
The Midnight Walkers,2º trimestre de 2025,Indefinido,https://store.steampowered.com/app/2795540/The_Midnight_Walkers/?snr=1_7_7_popularcomingsoon_150_7,"Zumbis, Tiro em Primeira Pessoa (FPS), Pós-Apocalíptico, Tiro com Saques, Jogador x Jogador (PvP), Jogador X Ambiente (PvE), Sobrevivência, Multijogador, Tiro, Terror de Sobrevivência, Baseado em Equipes, Ação, RPG, RPG de Ação, Exploração, Realístico, Simulação, Combate, Morte Permanente, Você Decide"
A Building Full of Cats 2,2º trimestre de 2025,Indefinido,https://store.steampowered.com/app/2810730/A_Building_Full_of_Cats_2/?snr=1_7_7_popularcomingsoon_150_7,"Gatos, Objetos Ocultos, Boa Trama, Do Bem, Casual, Relaxante, Aconchegante, Aventura, Quebra-Cabeça, Apontar e Clicar, Cartunizado, Colorido, Comovente, Exploração, Para Toda a Família, Fofo, Colete Tudo, Coleção de Criaturas, Um Jogador, Minimalista"
AFTERBLAST,Q2 2025,Indefinido,https://store.steampowered.com/app/1338490/AFTERBLAST/?snr=1_7_7_popularcomingsoon_150_7,"Tiro em Primeira Pessoa (FPS), Cooperativo On-line, Roguelike de Ação, Roguelite, Cooperativo, Ação, Roguelike, Tiro, Multijogador, Tiro com Saques, Indie, Primeira Pessoa, Chuva de Balas, Tiro de Tiozão, Um Jogador, Difícil, Arcade, Combate, Fantasia, Geração Procedural"
PaperKlay,Q2 2025,Indefinido,https://store.steampowered.com/app/1350720/PaperKlay/?snr=1_7_7_popularcomingsoon_150_7,"Aventura, Plataforma 3D, Plataforma, Colorido, Para Toda a Família, Exploração, Cartunizado, Um Jogador, Fofo, Indie, 3D, Física, Ação / Aventura, Controle, Colete Tudo"
Zefyr: A Thief's Melody,Q2 2025,Indefinido,https://store.steampowered.com/app/1344990/Zefyr_A_Thiefs_Melody/?snr=1_7_7_popularcomingsoon_150_7,"Aventura, Exploração, Plataforma 3D, Atmosférico, Coleção de Criaturas, Mistério, Mundo Aberto, Boa Trama, Colorido, Ação, Um Jogador, Metroidvania, Estilizado, Furtivo, Velha-Guarda, Robôs, Fantasia, Parkour, Ação / Aventura, Plataforma com Quebra-Cabeça"
Kagura Survivors x Summer Memories,Q2 2025,Indefinido,https://store.steampowered.com/app/3235000/Kagura_Survivors_x_Summer_Memories/?snr=1_7_7_popularcomingsoon_150_7,"Gratuito para Jogar, Ação, RPG, Conteúdo Sexual"
Broken Arrow,June 2025,Indefinido,https://store.steampowered.com/app/1604270/Broken_Arrow/?snr=1_7_7_popularcomingsoon_150_7,"Estratégia, Jogo de Guerra, Moderno, Estratégia em Tempo Real (RTS), Estratégia em Tempo Real com Ação, Tática em Tempo Real, Montagem de Decks, Tático, Guerra, Realístico, 3D, Jogador x Jogador (PvP), Inteligência Artificial, Multijogador, Combate Naval, Gerenciamento de Recursos, Militar, Um Jogador, Tanques, Difícil"
Drive Thru Simulator,Q2 2025,Indefinido,https://store.steampowered.com/app/3062060/Drive_Thru_Simulator/?snr=1_7_7_popularcomingsoon_150_7,"Simulador Imersivo, Casual, Simulação, Automação, Fabricação, Simulador de Vida Real, Direção, 3D, Primeira Pessoa, Culinária, Indie, Realístico, Gerenciamento de Recursos, Acesso Antecipado, Um Jogador"
Cities: Skylines II - Bridges & Ports,Coming soon,$41.76,https://store.steampowered.com/app/2427743/Cities_Skylines_II__Bridges__Ports/?snr=1_7_7_popularcomingsoon_150_7,"Simulação, Construção de Cidades, Construção, Um Jogador, Faça o que Quiser, Gerenciamento, Economia, Estratégia, Realístico, Compatível com Mods, Relaxante, Casual, Gerenciamento de Recursos, Transportes, Atmosférico, Multijogador, Acesso Antecipado, Mundo Aberto, Trilha Sonora Boa, Conteúdo Sexual"
Cities: Skylines II - Cold Wave Channel,Q2 2025,$41.76,https://store.steampowered.com/app/2427746/Cities_Skylines_II__Cold_Wave_Channel/?snr=1_7_7_popularcomingsoon_150_7,"Simulação, Construção de Cidades, Construção, Um Jogador, Faça o que Quiser, Gerenciamento, Economia, Estratégia, Realístico, Compatível com Mods, Relaxante, Casual, Gerenciamento de Recursos, Transportes, Atmosférico, Multijogador, Acesso Antecipado, Mundo Aberto, Trilha Sonora Boa, Conteúdo Sexual"
Sofia in Exchange for Lies,"Jul 3, 2025",Indefinido,https://store.steampowered.com/app/3326660/Sofia_in_Exchange_for_Lies/?snr=1_7_7_popularcomingsoon_150_7,"Aventura, Romance Visual, Escolha a sua Aventura, 3D, Baseado em Texto, Mistério, Investigação, Vários Finais, Boa Trama, Você Decide, Um Jogador, Simulação, Digitação, Simulador Imersivo"
Every Day We Fight,"Jul 10, 2025",Indefinido,https://store.steampowered.com/app/1546080/Every_Day_We_Fight/?snr=1_7_7_popularcomingsoon_150_7,"Estratégia, RPG, Tático, Guerra, Jogo de Guerra, Tiro em Terceira Pessoa, Ficção Científica, Tática por Turnos, Estratégia em Turnos, Combate em Turnos, Roguelike, Alienígenas, Personalização de Personagem, Em Turnos, Um Jogador, Compatível com Mods, Ação, Futurista, Morte Permanente, Atmosférico"
PATAPON 1+2 REPLAY,"Jul 10, 2025",Indefinido,https://store.steampowered.com/app/2383200/PATAPON_12_REPLAY/?snr=1_7_7_popularcomingsoon_150_7,"Ação, Ritmo, RPG de Ação, Ação / Aventura, Porradaria, Plataforma 2D, Estratégia em Tempo Real com Ação, Hack and Slash, RPG Tático, Câmera Lateral, 2D, Fofo, Fantasia, Tático, Atmosférico, Jogador X Ambiente (PvE), Personalização de Personagem, Combate, Um Jogador, Boa Trama"
Tony Hawk's™ Pro Skater™ 3 + 4,"Jul 11, 2025",$49.99,https://store.steampowered.com/app/2545710/Tony_Hawks_Pro_Skater_3__4/?snr=1_7_7_popularcomingsoon_150_8,"Esportes, Skate, Música, Arcade, Personalização de Personagem, Plataforma 3D, Terceira Pessoa, 3D, Um Jogador, Multijogador"
EDENS ZERO,"Jul 15, 2025",$59.99,https://store.steampowered.com/app/3125750/EDENS_ZERO/?snr=1_7_7_popularcomingsoon_150_8,"Ação, Anime, RPG, Boa Trama, Mundo Aberto, Atmosférico, RPG de Ação, Espacial, Ficção Científica, Luta Espetacular, Um Jogador"
Stronghold Crusader: Definitive Edition,"Jul 15, 2025",Indefinido,https://store.steampowered.com/app/3024040/Stronghold_Crusader_Definitive_Edition/?snr=1_7_7_popularcomingsoon_150_8,"Tática em Tempo Real, Construção de Cidades, Simulador de Colônias, Faça o que Quiser, Defesa de Torres, Construção, Economia, Medieval, Guerra, Construção de Bases, Jogador x Jogador (PvP), Estratégia em Tempo Real (RTS), Estratégia, 2D, Isométrico, Histórico, Mundo Aberto, Simulação, Atmosférico, Gerenciamento de Recursos"
Atomic Owl,"Jul 15, 2025",Indefinido,https://store.steampowered.com/app/2228490/Atomic_Owl/?snr=1_7_7_popularcomingsoon_150_8,"Plataforma 2D, Roguelike de Ação, Hack and Slash, Ação / Aventura, Ninja, 2D, Espada, Controle, Conversas, Linear, Ação, Colorido, Plataforma, Câmera Lateral, Gráficos Pixelados, Fantasia, Roguelite, Aventura, Corredor, Anos 90"
HUNTER×HUNTER NEN×IMPACT,"Jul 16, 2025",$59.99,https://store.steampowered.com/app/2456420/HUNTERxHUNTER_NENxIMPACT/?snr=1_7_7_popularcomingsoon_150_8,"Ação, Luta 2D, Jogador x Jogador (PvP), Multijogador, História em Quadrinhos, Um Jogador, Luta, Anime"
Neon Abyss 2,"Jul 17, 2025",Indefinido,https://store.steampowered.com/app/2235200/Neon_Abyss_2/?snr=1_7_7_popularcomingsoon_150_8,"Acesso Antecipado, Roguelike de Ação, Cooperativo On-line, Cyberpunk, Roguelike, Engraçado, Ação, Plataforma, Chuva de Balas, Gráficos Pixelados, Roguelite, Geração Procedural, Saques, RPG, Plataforma 2D, Cooperativo, Multijogador, Um Jogador, Tiro, Mitologia"
RoboCop: Rogue City - Unfinished Business,"Jul 17, 2025",Indefinido,https://store.steampowered.com/app/3527760/RoboCop_Rogue_City__Unfinished_Business/?snr=1_7_7_popularcomingsoon_150_8,"Ação, Tiro em Primeira Pessoa (FPS), Primeira Pessoa, Um Jogador, Tiro, Violência Detalhada, Boa Trama, Aventura, Cyberpunk, Atmosférico, Violento, Ficção Científica, RPG, RPG de Ação, Distópico, Robôs, Crime, Futurista, Para Adultos, Sombrio"
Shadow Labyrinth,"Jul 17, 2025",$29.99,https://store.steampowered.com/app/1859430/Shadow_Labyrinth/?snr=1_7_7_popularcomingsoon_150_8,"Ação, Aventura, Ação / Aventura, Metroidvania, Plataforma, Plataforma 2D, 2D, Ficção Científica, Sombrio, Um Jogador, Subterrâneo"
UnderMine 2,"Jul 22, 2025",Indefinido,https://store.steampowered.com/app/1869780/UnderMine_2/?snr=1_7_7_popularcomingsoon_150_8,"Roguelike de Ação, Roguelite, Ação / Aventura, Cooperativo, Roguelike, Ação, Gráficos Pixelados, Aventura, Explorador de Calabouços, 2D, Enredo Rico, Visão Superior, Você Decide, Humor Ácido, Geração Procedural, Mineração, Combate, Mistério, RPG, Retrô"
The Great Villainess: Strategy of Lily,"Jul 24, 2025",Indefinido,https://store.steampowered.com/app/2454960/The_Great_Villainess_Strategy_of_Lily/?snr=1_7_7_popularcomingsoon_150_8,"Tática por Turnos, RPG Tático, Batalha Automática, Romance, Guerra, Estratégia em Turnos, Protagonista Mulher, RPG de Estratégia, Grande Estratégia, Estratégia, Fofo, LGBTQIA+, Voxel, Boa Trama, Anime, Simulação, Tático, Atmosférico, Um Jogador, Indie"
Clutchtime™: Basketball Deckbuilder,"Jul 24, 2025",Indefinido,https://store.steampowered.com/app/2995450/Clutchtime_Basketball_Deckbuilder/?snr=1_7_7_popularcomingsoon_150_8,"Montagem de Decks Roguelike, Basquete, Cartas, Esportes, Montagem de Decks, Estratégia, Roguelike, Batalha com Cartas, Roguelite, 2D, Colorido, Minimalista, Tático, Jogador x Jogador (PvP), Jogador X Ambiente (PvE), Multijogador, Um Jogador, Multijogador Local, Alta Rejogabilidade, Simulação"
Total Chaos,"Jul 24, 2025",Indefinido,https://store.steampowered.com/app/2208350/Total_Chaos/?snr=1_7_7_popularcomingsoon_150_8,"Ação, Terror Psicológico, Aventura, Atmosférico, Terror, Ação / Aventura, Exploração, Tiro em Primeira Pessoa (FPS), Primeira Pessoa, Realístico, Fabricação, Sombrio, Saques, Mistério, Psicológico, Sobrenatural, Surrealista, Pós-Apocalíptico, RPG de Ação, 3D"
No Sleep For Kaname Date - From AI: THE SOMNIUM FILES,"Jul 25, 2025",Indefinido,https://store.steampowered.com/app/2752180/No_Sleep_For_Kaname_Date__From_AI_THE_SOMNIUM_FILES/?snr=1_7_7_popularcomingsoon_150_8,"Aventura, Ficção Interativa, Romance Visual, Escolha a sua Aventura, 3D, Anime, Psicodélico, Noir, Ficção Científica, Illuminati, Drama, Mistério, Filosófico, Detetive, Futurista, Crime, Investigação, Surrealista, Conspiração, Inteligência Artificial"
INTO EVIL,"Jul 29, 2025",Indefinido,https://store.steampowered.com/app/1893440/INTO_EVIL/?snr=1_7_7_popularcomingsoon_150_8,"Roguelike de Ação, Soulslike, Hack and Slash, Explorador de Calabouços, RPG, Morte Permanente, Roguelike, 2D, Visão Superior, Terror, Ação, Geração Procedural, Gráficos Pixelados, Fantasia Sombria, Furtivo, Atmosférico, Sombrio, Velha-Guarda, Combate, Local para 4 Jogadores"
Tales of the Shire: A The Lord of The Rings™ Game,"Jul 29, 2025",Indefinido,https://store.steampowered.com/app/2016460/Tales_of_the_Shire_A_The_Lord_of_The_Rings_Game/?snr=1_7_7_popularcomingsoon_150_8,"Casual, Simulador de Vida Real, Aconchegante, Indie, Natureza, Personalização de Personagem, 3D, Fofo, Terceira Pessoa, Simulador Rural, Culinária, Simulação, Boa Trama, Colorido, RPG, Fantasia, LGBTQIA+, Um Jogador, Político, Política"
hololive Holo's Hanafuda,"Jul 30, 2025",Indefinido,https://store.steampowered.com/app/3327640/hololive_Holos_Hanafuda/?snr=1_7_7_popularcomingsoon_150_8,"Fofo, Competitivo, Casual, Cartas, Tática por Turnos, 2D, Fantasia, Aventura, Jogador x Jogador (PvP), Protagonista Mulher, Um Jogador, Multijogador, Anime, Colorido, Comédia, Jogador X Ambiente (PvE), Personalização de Personagem, 3D"
Shadows of Chroma Tower,July 2025,Indefinido,https://store.steampowered.com/app/2713380/Shadows_of_Chroma_Tower/?snr=1_7_7_popularcomingsoon_150_8,"Um Jogador, Ação, RPG de Ação, Multijogador, Battle Royale, Explorador de Calabouços, Jogador X Ambiente (PvE), Cooperativo, Hack and Slash, Fabricação, Primeira Pessoa, Tiro de Extração, Cooperativo On-line, Fantasia, Saques, Medieval, Gerenciamento de Inventário, Estilizado, Personalização de Personagem, 3D"
Brickadia,July 2025,Indefinido,https://store.steampowered.com/app/2199420/Brickadia/?snr=1_7_7_popularcomingsoon_150_8,"Acesso Antecipado, Física, Faça o que Quiser, Construção, Multijogador, Casual, Combate, Lógica, 3D, Combate com Veículos, Jogador x Jogador (PvP), Arcade, Personalização de Personagem, Primeira Pessoa, Terceira Pessoa, Cooperativo, Cooperativo On-line, Um Jogador, Tiro em Primeira Pessoa (FPS), Desenvolvimento de Jogos"
GUG,July 2025,Indefinido,https://store.steampowered.com/app/2824790/GUG/?snr=1_7_7_popularcomingsoon_150_8,"Faça o que Quiser, Simulação, Estratégia, Tática por Turnos, Roguelike, Engraçado, Coleção de Criaturas, Geração Procedural, Morte Permanente, Exploração, Batalha com Cartas, Roguelite, Personalização de Personagem, 2D, Fofo, Batalha Automática, Jogador X Ambiente (PvE), Montagem de Decks, Baseado em Equipes, Natureza"
Hunters Inc,July 2025,Indefinido,https://store.steampowered.com/app/2937090/Hunters_Inc/?snr=1_7_7_popularcomingsoon_150_8,"Cooperativo, Cooperativo On-line, Jogador X Ambiente (PvE), Tiro em Primeira Pessoa (FPS), Primeira Pessoa, Fantasia, Caça, Baseado em Classes, Hack and Slash, Geração Procedural, Exploração, Tiro com Saques, Personalização de Personagem, Ação, Multijogador, Ação / Aventura, Combate, Acesso Antecipado, Violento"
The Necromancer's Tale,July 2025,Indefinido,https://store.steampowered.com/app/1315320/The_Necromancers_Tale/?snr=1_7_7_popularcomingsoon_150_8,"CRPG, Boa Trama, Zumbis, Você Decide, Enredo Rico, Conversas, Isométrico, Narrativa, História Alternativa, Atmosférico, Gótico, Mágica, Exploração, Mundo Aberto, Combate em Turnos, RPG, Aventura, Um Jogador, RPG de Grupos, Investigação"
ERA ONE,July 2025,Indefinido,https://store.steampowered.com/app/2509200/ERA_ONE/?snr=1_7_7_popularcomingsoon_150_8,"Exploração, Estratégia em Tempo Real com Ação, Tática em Tempo Real, Faça o que Quiser, Estratégia em Tempo Real (RTS), Jogador x Jogador (PvP), Protagonista Mulher, Estratégia, 3D, Combate com Veículos, Construção de Bases, Personalização de Armas, Boa Trama, Ação, Espacial, Furtivo, Ficção Científica, Cooperativo, Cooperativo On-line, Um Jogador"
Shattered Soul,Data não informada,Indefinido,https://store.steampowered.com/app/1331290/Shattered_Soul/?snr=1_7_7_popularcomingsoon_150_8,"Porradaria, Metroidvania, Indie, Jogo de Ação Focado em Personagem, Jogador X Ambiente (PvE), Protagonista Mulher, Ação / Aventura, Anime, 2,5D, Desenhado à Mão, Fantasia, Medieval, Hack and Slash, Ação, Luta, Cartunizado, 2D, Atmosférico, Aventura, Desenho Animado"
Demon Slayer -Kimetsu no Yaiba- The Hinokami Chronicles 2,"Aug 5, 2025",$59.99,https://store.steampowered.com/app/2928600/Demon_Slayer_Kimetsu_no_Yaiba_The_Hinokami_Chronicles_2/?snr=1_7_7_popularcomingsoon_150_8,Sem gênero
GRADIUS ORIGINS,"Aug 7, 2025",$35.99,https://store.steampowered.com/app/2897590/GRADIUS_ORIGINS/?snr=1_7_7_popularcomingsoon_150_8,"Ação, Arcade, Tiro, Plataforma 2D, 2D, Gráficos Pixelados, Anos 80, Anos 90, Retrô, Espacial, Um Jogador, Mandando Bala"
Static Dread: 15 Nights at the Old Lighthouse,"Aug 7, 2025",Indefinido,https://store.steampowered.com/app/3298940/Static_Dread_15_Nights_at_the_Old_Lighthouse/?snr=1_7_7_popularcomingsoon_150_8,"Simulação, Terror, Lovecraftiano, Sombrio, Boa Trama, Romance Visual, Primeira Pessoa, Psicodélico, Simulador de Vida Real, Casual, Noir, Terror de Sobrevivência, Você Decide, Distópico, Atmosférico, Simulador Imersivo, Terror Psicológico, Vários Finais, Um Jogador, Enredo Rico"
BREAK ARTS III,"Aug 8, 2025",Indefinido,https://store.steampowered.com/app/2522430/BREAK_ARTS_III/?snr=1_7_7_popularcomingsoon_150_8,"Ação, Corrida, Tiro, Mechas, Robôs, Fabricação, Ficção Científica, Futurista, Esportes, Terceira Pessoa, Personalização de Personagem, Abstrato, Tático, Controle, Cooperativo On-line, Um Jogador, Multijogador, Jogador x Jogador (PvP), Cooperativo, Combate com Veículos"
Swim Meet,"Aug 8, 2025",Indefinido,https://store.steampowered.com/app/467740/Swim_Meet/?snr=1_7_7_popularcomingsoon_150_8,"Escolha a sua Aventura, Romance Visual, Ficção Interativa, Simulador de Encontros, 2D, Fofo, Engraçado, Você Decide, Boa Trama, Casual, Anime, Colorido, Demônios, Mágica, Viagem no Tempo, Comédia, Drama, Aventura, Moderno, Sobrenatural"
EA SPORTS™ Madden NFL 26,"Aug 14, 2025",$69.99,https://store.steampowered.com/app/3230400/EA_SPORTS_Madden_NFL_26/?snr=1_7_7_popularcomingsoon_150_8,"Simulação, Esportes, Futebol Americano, Estratégia, Competitivo"
INAZUMA ELEVEN: Victory Road,"Aug 21, 2025",$69.99,https://store.steampowered.com/app/2799860/INAZUMA_ELEVEN_Victory_Road/?snr=1_7_7_popularcomingsoon_150_8,"Esportes, Futebol, RPG, Colete Tudo, Jogador x Jogador (PvP), Competitivo, Anime, 3D, Personalização de Personagem, Boa Trama, Montagem de Decks, Ação, Tático, Drama, Futebol Americano, Comovente, Um Jogador, Multijogador, Imersivo, JRPG"
Space Adventure Cobra - The Awakening,"Aug 26, 2025",Indefinido,https://store.steampowered.com/app/2878220/Space_Adventure_Cobra__The_Awakening/?snr=1_7_7_popularcomingsoon_150_8,"Câmera Lateral, Plataforma 2D, Plataforma, Ação / Aventura, Ação, 2D, Mechas, Metroidvania, Anime, Espacial, Piratas, Futurista, Ficção Científica, Aventura, Anos 80, Narração, Um Jogador, Exploração, Tiro de Heróis, Colorido"
STORY OF SEASONS: Grand Bazaar,"Aug 27, 2025",Indefinido,https://store.steampowered.com/app/2508780/STORY_OF_SEASONS_Grand_Bazaar/?snr=1_7_7_popularcomingsoon_150_8,"Simulador de Vida Real, Simulador Rural, Natureza, Romance, Agricultura, Fabricação, Anime, Relaxante, Aconchegante, Do Bem, Fofo, Personalização de Personagem, Colorido, Casual, Gatos, Para Toda a Família, Culinária, Gerenciamento de Tempo, Simulação, Gerenciamento de Inventário"
SUPER ROBOT WARS Y,"Aug 27, 2025",$59.99,https://store.steampowered.com/app/1909950/SUPER_ROBOT_WARS_Y/?snr=1_7_7_popularcomingsoon_150_8,"RPG, Simulação, Estratégia, JRPG, Estratégia em Turnos, Romance Visual, RPG Tático, Combate em Turnos, Tática por Turnos, 2D, Isométrico, Anime, Visão Superior, Ficção Científica, Mechas, Robôs, Enredo Rico, Boa Trama, Um Jogador"
METAL GEAR SOLID Δ: SNAKE EATER - Sneaking DLC Pack,"Aug 28, 2025",$79.99,https://store.steampowered.com/app/3364840/METAL_GEAR_SOLID_D_SNAKE_EATER__Sneaking_DLC_Pack/?snr=1_7_7_popularcomingsoon_150_8,Sem gênero
METAL GEAR SOLID Δ: SNAKE EATER,"Aug 28, 2025",$69.99,https://store.steampowered.com/app/2417610/METAL_GEAR_SOLID_D_SNAKE_EATER/?snr=1_7_7_popularcomingsoon_150_8,Sem gênero
The Knightling,"Aug 28, 2025",Indefinido,https://store.steampowered.com/app/1471650/The_Knightling/?snr=1_7_7_popularcomingsoon_150_8,"Ação / Aventura, Mundo Aberto, Boa Trama, Fofo, Plataforma 3D, Hack and Slash, Plataforma, Ação, 3D, Linear, Controle, Colorido, Fantasia, Medieval, Para Toda a Família, Aventura, Combate, Um Jogador, Indie"
SHINOBI: Art of Vengeance,"Aug 29, 2025",$26.99,https://store.steampowered.com/app/2361770/SHINOBI_Art_of_Vengeance/?snr=1_7_7_popularcomingsoon_150_8,"Ação, Plataforma, Plataforma 2D, 2D, Um Jogador, Ninja"
