title,release_date,price,game_url,genres
Belts of Iron,"28 May, 2026",Indefinido,https://store.steampowered.com/app/3427850/Belts_of_Iron/?snr=1_7_7_popularcomingsoon_150_1,"Acesso Antecipado, Automação, Construção de Bases, Mundo Aberto, Fabricação, Exploração, Simulação, Gerenciamento de Recursos, Estratégia, Faça o que Quiser, Construção de Cidades, 3D, Terceira Pessoa, Gerenciamento, Trens, Simulador Imersivo, Colorido, Estilizado, Construção, Sobrevivência"
Bounty Brawl: Most Wanted,"28 May, 2026",Indefinido,https://store.steampowered.com/app/3097510/Bounty_Brawl_Most_Wanted/?snr=1_7_7_popularcomingsoon_150_1,"Ação, Cooperativo On-line, Jogador X Ambiente (PvE), Roguelike de Ação, RPG, Engraçado, Ação / Aventura, Gráficos Pixelados, Roguelite, Inferno de Balas, Tiro em Terceira Pessoa, Cooperativo, Isométrico, Multijogador, Tiro, SHMUP com Visão Superior, Combate, Um Jogador, Aventura, Controle com Alavanca Dupla"
Beat The Champions,"28 May, 2026",Indefinido,https://store.steampowered.com/app/4008350/Beat_The_Champions/?snr=1_7_7_popularcomingsoon_150_1,"Esportes, Arcade, 3D, Cartunizado, Colorido, Anos 80, Anos 90, Futebol, Baseado em Equipes, Física, Jogador X Ambiente (PvE), Jogador x Jogador (PvP), Indie, Controle, Local para 4 Jogadores, Campanha Cooperativa, Cooperativo Local, Multijogador Local, Um Jogador, Estilizado"
STARDUST: Wish of Witch,"28 May, 2026",Indefinido,https://store.steampowered.com/app/3936730/STARDUST_Wish_of_Witch/?snr=1_7_7_popularcomingsoon_150_1,"Tática por Turnos, RPG Tático, JRPG, Batalha com Cartas, Estratégia em Turnos, RPG de Grupos, RPG de Estratégia, Protagonista Mulher, Anime, Estratégia, RPG, 2D, Boa Trama, Fofo, 2,5D, Isométrico, Indie, Combate em Turnos, Gráficos Pixelados, Fantasia"
Iris Odyssey,"28 May, 2026",Free,https://store.steampowered.com/app/3263400/Iris_Odyssey/?snr=1_7_7_popularcomingsoon_150_1,"Aventura, Romance Visual, Escolha a sua Aventura, 2D, Fofo, Anime, Fantasia Sombria, Fantasia, Comovente, Surrealista, Casual, Indie, Atmosférico, Mágica, Linear, Protagonista Mulher, Um Jogador, Gratuito para Jogar, LGBTQIA+"
Rock Island,"28 May, 2026",Indefinido,https://store.steampowered.com/app/3561030/Rock_Island/?snr=1_7_7_popularcomingsoon_150_1,"Incremental, Progressão Ociosa, Roguelite, Mineração, Estratégia, Casual, Gráficos Pixelados, Gerenciamento de Recursos, Engraçado, Um Jogador, Indie, Automação"
Mina the Hollower,"28 May, 2026",Indefinido,https://store.steampowered.com/app/1875580/Mina_the_Hollower/?snr=1_7_7_popularcomingsoon_150_1,"Ação / Aventura, Plataforma 2D, Protagonista Mulher, Plataforma, Visão Superior, 2D, Gótico, Ação, Controle, Gráficos Pixelados, Terror, Colorido, Fantasia Sombria, Fantasia, Aventura, Ciência, Atmosférico, Sobrenatural, Um Jogador, Combate"
Loli Ninja Village,"29 May, 2026",Indefinido,https://store.steampowered.com/app/4307340/Loli_Ninja_Village/?snr=1_7_7_popularcomingsoon_150_1,"RPG, JRPG, 2D, Exploração, Furtivo, Casual, História em Quadrinhos, Anime, Um Jogador, Fofo, Simulação, Aventura, Ninja, Desenho Animado, Protagonista Mulher, Colorido, Indie, Conteúdo Sexual, Engraçado"
"Control, I'm Not Coming Back","29 May, 2026",Free,https://store.steampowered.com/app/4515660/Control_Im_Not_Coming_Back/?snr=1_7_7_popularcomingsoon_150_1,"Boa Trama, Simulador de Caminhada, Filosófico, Espacial, Ficção Interativa, 3D, Primeira Pessoa, Psicológico, Abstrato, Aventura, Surrealista, Ficção Científica, Colorido, Gratuito para Jogar, Indie, Estilizado, Não Linear, Gráficos Pixelados, Minimalista, Escolha a sua Aventura"
Scam Center Simulator: UnderKingdom,"29 May, 2026",Indefinido,https://store.steampowered.com/app/3484850/Scam_Center_Simulator_UnderKingdom/?snr=1_7_7_popularcomingsoon_150_1,"Acesso Antecipado, Simulação, Gerenciamento de Tempo, Crime, Faça o que Quiser, Gerenciamento, Simulador Imersivo, Gerenciamento de Lojas, Automação, Construção de Bases, 3D, Construção, Física, Simulador de Vida Real, Estratégia, Exploração, Primeira Pessoa, Humor Ácido, Engraçado, Linear"
Don't Touch the Snail,"29 May, 2026",Indefinido,https://store.steampowered.com/app/4149320/Dont_Touch_the_Snail/?snr=1_7_7_popularcomingsoon_150_1,"Progressão Ociosa, Memes, Personalização de Personagem, 2D, Fofo, Casual, Engraçado, Gráficos Pixelados, Multijogador Assíncrono, Comédia, Paródia, Estilizado, Indie, Um Jogador, Desenvolvimento de Jogos, Cartunizado, Colorido, Terror Psicológico"
Starvester,"29 May, 2026",Indefinido,https://store.steampowered.com/app/4194800/Starvester/?snr=1_7_7_popularcomingsoon_150_1,"Incremental, Progressão Ociosa, Estratégia, Automação, Gerenciamento de Recursos, Casual, Mineração, Simulação, Construção, Economia, Gerenciamento, Relaxante, Ficção Científica, Espacial, 2D, Colorido, Um Jogador, Atmosférico, Minimalista, Experimental"
Trakonius,"29 May, 2026",Indefinido,https://store.steampowered.com/app/2418490/Trakonius/?snr=1_7_7_popularcomingsoon_150_1,"Indie, Ação, Roguelike de Ação, Hack and Slash, Roguelite, Mitologia, RPG de Ação, Roguelike, RPG, Trilha Sonora, Um Jogador, Boa Trama, Alta Rejogabilidade, Isométrico, Difícil, Soulslike, Roma, Acesso Antecipado, Morte Permanente"
Automaton Heart,"29 May, 2026",Indefinido,https://store.steampowered.com/app/3070020/Automaton_Heart/?snr=1_7_7_popularcomingsoon_150_1,"Aventura, Ação, Tiro em Terceira Pessoa, RPG, Tiro, RPG de Ação, 3D, Abstrato, Psicodélico, Estilizado, Terceira Pessoa, Anos 90, Atmosférico, Relaxante, Retrô, Robôs, Ficção Científica, Surrealista, Plataforma 3D, Mundo Aberto"
Escape From Crimson Manor: Trapped Together,"29 May, 2026",Indefinido,https://store.steampowered.com/app/2345430/Escape_From_Crimson_Manor_Trapped_Together/?snr=1_7_7_popularcomingsoon_150_1,"Quebra-Cabeça, Cooperativo, Fuja da Sala, Exploração, Aventura, Multijogador, Cooperativo On-line, 3D, Lógica, Atmosférico, Primeira Pessoa, Investigação, Mistério, Sombrio, Não Linear, Crime, Detetive, Terror, Gerenciamento de Inventário, Terror de Sobrevivência"
Frontier Legends,"29 May, 2026",Indefinido,https://store.steampowered.com/app/3032150/Frontier_Legends/?snr=1_7_7_popularcomingsoon_150_1,"Acesso Antecipado, Ação, Aventura, RPG, RPG de Ação, Ação / Aventura, Faça o que Quiser, Roguelike de Ação, Exploração, Tiro em Terceira Pessoa, 3D, Primeira Pessoa, Terceira Pessoa, Velho Oeste, Jogador x Jogador (PvP), Construção de Bases, Personalização de Personagem, Combate, Fabricação, Gerenciamento de Inventário"
Mike goes on hike,May 2026,Indefinido,https://store.steampowered.com/app/912000/Mike_goes_on_hike/?snr=1_7_7_popularcomingsoon_150_1,"Acesso Antecipado, Simulação, Aventura, Simulador de Caminhada, Sobrevivência, Exploração, Atmosférico, Um Jogador, Relaxante, Primeira Pessoa, Para Toda a Família, Boa Trama, Estilizado, Comovente, Comédia, Linear, Vários Finais, Você Decide, Multijogador, Cooperativo"
Reaper Actual,May 2026,Indefinido,https://store.steampowered.com/app/2995670/Reaper_Actual/?snr=1_7_7_popularcomingsoon_150_1,"Acesso Antecipado, Tiro com Saques, Tiro de Extração, Tiro em Primeira Pessoa (FPS), Jogador x Jogador (PvP), Tiro, Multijogador Massivo, Multijogador, MMORPG, 3D, Primeira Pessoa, Mundo Aberto, Combate com Veículos, Ação, Realístico, Militar, Tático, Moderno, Retrô, Violento"
Dreamstranded,May 2026,Indefinido,https://store.steampowered.com/app/3326670/Dreamstranded/?snr=1_7_7_popularcomingsoon_150_1,"Aconchegante, Fabricação, Construção, Sobrevivência, Pesca, Simulador de Vida Real, Simulador Rural, Relaxante, Culinária, Casual, Simulação, Estilizado, Um Jogador, Indie"
The Hand of the Crownbearer,"31 May, 2026",Indefinido,https://store.steampowered.com/app/4045680/The_Hand_of_the_Crownbearer/?snr=1_7_7_popularcomingsoon_150_1,"Aventura, Fantasia, Simulação, Simulador de Vida Real, Simulador de Encontros, Escolha a sua Aventura, 2D, Você Decide, Um Jogador"
Dancing Line,"31 May, 2026",Indefinido,https://store.steampowered.com/app/4395300/Dancing_Line/?snr=1_7_7_popularcomingsoon_150_1,"Casual, Ritmo, Música, 3D, Abstrato, Colorido, Um Jogador, Estilizado"
Where the forest ends,"31 May, 2026",Indefinido,https://store.steampowered.com/app/3583670/Where_the_forest_ends/?snr=1_7_7_popularcomingsoon_150_1,"Violência Detalhada, Violento, Ação, Sombrio, Tiro, Indie, Isométrico, Terror, Zumbis, Terror de Sobrevivência, Um Jogador, Atmosférico, Ação / Aventura, Realístico, Pós-Apocalíptico, Controle com Alavanca Dupla, SHMUP com Visão Superior, Sobrevivência, Terror Psicológico, Humor Ácido"
BrokenLore: FOLLOW,"31 May, 2026",Indefinido,https://store.steampowered.com/app/2846530/BrokenLore_FOLLOW/?snr=1_7_7_popularcomingsoon_150_1,"Terror Psicológico, Surrealista, Atmosférico, Terror, Thriller, Protagonista Mulher, Primeira Pessoa, Sombrio, Boa Trama, Ação, Demônios, Investigação, 3D, Psicológico, Aventura, Um Jogador, Narrativa"
Arcane Merchant,"1 Jun, 2026",Indefinido,https://store.steampowered.com/app/4086760/Arcane_Merchant/?snr=1_7_7_popularcomingsoon_150_1,"Simulação, Gerenciamento de Lojas, Relaxante, Gerenciamento, Fantasia, Casual, Simulador Imersivo, Um Jogador, RPG, Medieval, Economia, Automação, Simulador de Vida Real, Troca, Para Toda a Família, 3D, Estilizado, Atmosférico, Colorido, Colete Tudo"
Underchoice,"1 Jun, 2026",Indefinido,https://store.steampowered.com/app/3740010/Underchoice/?snr=1_7_7_popularcomingsoon_150_1,"Você Decide, Indie, Gráficos Pixelados, Gerenciamento de Inventário, Simulação, Boa Trama, Pós-Apocalíptico, Distópico, Quebra-Cabeça, Escolha a sua Aventura, Vários Finais, Gerenciamento de Recursos, Atmosférico, Um Jogador, Estratégia, Alta Rejogabilidade, Casual, Difícil, Aventura, Subterrâneo"
Starforged Legacy,"1 Jun, 2026",Indefinido,https://store.steampowered.com/app/3353390/Starforged_Legacy/?snr=1_7_7_popularcomingsoon_150_1,"Paraíso de Balas, Roguelike de Ação, Roguelite, Inferno de Balas, Roguelike, Arcade, Ficção Científica, Pontos, Pontos, Pontos!, Visão Superior, 3D, Ação, Casual, SHMUP com Visão Superior, Estratégia, Espacial, Alta Rejogabilidade, Sobrevivência, Combate, Um Jogador, Acesso Antecipado"
Focus Grove,"1 Jun, 2026",Indefinido,https://store.steampowered.com/app/4030830/Focus_Grove/?snr=1_7_7_popularcomingsoon_150_1,"Utilitários, Casual, Relaxante, Do Bem, Progressão Ociosa, Aconchegante, Simulador Rural, Simulação, Fofo, Gerenciamento, Construção, Personalização de Personagem, Gerenciamento de Recursos, Desenhado à Mão, Decoração, Animais, Um Jogador, Rural, Para Toda a Família, Companheiro de Área de Trabalho"
Lost in Art: a Miniature Realm,"1 Jun, 2026",Indefinido,https://store.steampowered.com/app/2900050/Lost_in_Art_a_Miniature_Realm/?snr=1_7_7_popularcomingsoon_150_1,"Mitologia, Quebra-Cabeça, Apontar e Clicar, Casual, Indie, Histórico, Enredo Rico, Aventura, Boa Trama, Exploração, Relaxante, 2D, Colorido, Desenhado à Mão, Aconchegante, Estilizado, Medieval, Um Jogador, Narrativa, Do Bem"
Tattoo Removal Simulator,"1 Jun, 2026",Indefinido,https://store.steampowered.com/app/3143910/Tattoo_Removal_Simulator/?snr=1_7_7_popularcomingsoon_150_1,"Simulação, Casual, Relaxante, Aconchegante, Primeira Pessoa, Um Jogador, 3D"
Sister Ray,"1 Jun, 2026",Indefinido,https://store.steampowered.com/app/3200290/Sister_Ray/?snr=1_7_7_popularcomingsoon_150_1,"RPG, Boa Trama, Câmera Lateral, Você Decide, Rico em Diálogos, Sobrevivência, Protagonista Mulher, Detetive, Aventura, Um Jogador, Apontar e Clicar, Anos 90, Atmosférico, Mundo Aberto, Colorido, Comovente, Investigação, Psicológico, Surrealista, Simulador de Vida Real"
Chef Knight,"1 Jun, 2026",Indefinido,https://store.steampowered.com/app/4304930/Chef_Knight/?snr=1_7_7_popularcomingsoon_150_1,"Estratégia, Incremental, Casual, Simulação, Gerenciamento de Recursos, Gerenciamento, Desenhado à Mão, Progressão Ociosa, 2D, Fantasia, Ação, Um Jogador, Culinária, Arcade, Fofo, Relaxante, Indie, Economia, Hentai, Capitalismo"
Freefall '95,"1 Jun, 2026",Indefinido,https://store.steampowered.com/app/4144510/Freefall_95/?snr=1_7_7_popularcomingsoon_150_1,"Arcade, Roguelite, Inferno de Balas, Pontos, Pontos, Pontos!, Ritmo Rápido, Física, Retrô, Indie, Anos 90, Velha-Guarda, Ação, Controle, Humor Ácido, Colorido, Roguelike, Boa Trama, 2D, Gráficos Pixelados, Um Jogador, Narrativa"
Banana of Doom,"1 Jun, 2026",Indefinido,https://store.steampowered.com/app/3898830/Banana_of_Doom/?snr=1_7_7_popularcomingsoon_150_1,"Acesso Antecipado, Casual, Cartas, Reúna a Galera, Fabricação, Em Grupos, Batalha com Cartas, Montagem de Decks, Baseado em Texto, Alta Rejogabilidade, Um Jogador, Multijogador, Desenho Animado, Colorido, Comédia, Arcade, Inteligência Artificial, Jogo de Palavras, Desenhado à Mão, 2D"
OddFauna : Secret of the Terrabeast,"2 Jun, 2026",Indefinido,https://store.steampowered.com/app/1525290/OddFauna__Secret_of_the_Terrabeast/?snr=1_7_7_popularcomingsoon_150_1,"Acesso Antecipado, Coleção de Criaturas, Construção de Bases, Faça o que Quiser, Simulador Imersivo, Natureza, Aconchegante, Casual, Simulador de Vida Real, Simulador Rural, Exploração, Fabricação, Relaxante, Fofo, Para Toda a Família, Desenhado à Mão, Estilizado, Colete Tudo, Mundo Aberto, Sobrevivência"
Battleship Command,"2 Jun, 2026",Indefinido,https://store.steampowered.com/app/3367430/Battleship_Command/?snr=1_7_7_popularcomingsoon_150_1,"Ação, Simulação, Estratégia, Simulador Imersivo, Jogo de Guerra, Naval, 3D, Guerra, Segunda Guerra Mundial, Combate Naval, Combate, Acesso Antecipado, Um Jogador, Histórico, Imersivo, Realístico"
Ourlands,"2 Jun, 2026",Indefinido,https://store.steampowered.com/app/2074470/Ourlands/?snr=1_7_7_popularcomingsoon_150_1,"Faça o que Quiser, Construção de Cidades, Construção, Design e Ilustração, Aconchegante, Relaxante, Desenhado à Mão, Natureza, Fofo, Editor de Níveis, Simulação, Colete Tudo, Minimalista, Visão Superior, Casual, Colorido, 2D, Atmosférico, Um Jogador, Indie"
Hobby Horse,"2 Jun, 2026",Indefinido,https://store.steampowered.com/app/3219140/Hobby_Horse/?snr=1_7_7_popularcomingsoon_150_1,"Corrida, Cavalos, Casual, Esportes, Simulação, Fofo, Ação, Indie, Personalização de Personagem, Ação / Aventura, Design e Ilustração, Educativo, Simulador de Vida Real, Primeira Pessoa, Um Jogador, Escolha a sua Aventura, Multijogador, Violento, Engraçado, Corredor"
Papa's Mocharia Deluxe,"2 Jun, 2026",Indefinido,https://store.steampowered.com/app/4656700/Papas_Mocharia_Deluxe/?snr=1_7_7_popularcomingsoon_150_1,"Casual, Estratégia, Culinária, Ação, Simulação, Gerenciamento de Tempo, Gerenciamento, 2D, Colorido, Indie, Para Toda a Família, Personalização de Personagem, Um Jogador"
Remorses,"2 Jun, 2026",Indefinido,https://store.steampowered.com/app/2292160/Remorses/?snr=1_7_7_popularcomingsoon_150_1,"Terror, Terror Psicológico, Terror de Sobrevivência, Sombrio, Primeira Pessoa, Indie, Um Jogador, Violência Detalhada, Violento, Ação"
Campsite Hustle! - Management Simulator,"2 Jun, 2026",Indefinido,https://store.steampowered.com/app/3708070/Campsite_Hustle__Management_Simulator/?snr=1_7_7_popularcomingsoon_150_1,"Simulação, Gerenciamento de Lojas, Gerenciamento, Construção, Fabricação, Natureza, Indie, Acesso Antecipado, Um Jogador, 3D, Mundo Aberto, Faça o que Quiser, Gerenciamento de Recursos, Automação, Construção de Bases, Primeira Pessoa, Direção, Simulador de Vida Real, Colorido, Fofo"
Fatekeeper,"2 Jun, 2026",Indefinido,https://store.steampowered.com/app/2186990/Fatekeeper/?snr=1_7_7_popularcomingsoon_150_1,"Acesso Antecipado, Ação, RPG, RPG de Ação, Hack and Slash, Primeira Pessoa, Simulador Imersivo, Fantasia Sombria, 3D, Atmosférico, Realístico, Fantasia, Mágica, Violência Detalhada, Física, Um Jogador, Combate, Furtivo, Exploração, Medieval"
PROHIBEAST,"2 Jun, 2026",Indefinido,https://store.steampowered.com/app/3503790/PROHIBEAST/?snr=1_7_7_popularcomingsoon_150_1,"Tática em Tempo Real, Estratégia, Furtivo, Estratégia em Tempo Real (RTS), Ação / Aventura, Um Jogador, Isométrico, Noir, Combate, 3D, Visão Superior, Crime, Distópico, SHMUP com Visão Superior, Sombrio, Tático"
Slots & Diapers,"3 Jun, 2026",Indefinido,https://store.steampowered.com/app/4409870/Slots__Diapers/?snr=1_7_7_popularcomingsoon_150_1,"Incremental, Progressão Ociosa, Capitalismo, Casual, Simulação, Arcade, Economia, Jogos de Azar, Gerenciamento, Gráficos Pixelados, Automação, Isométrico, Relaxante, Engraçado, Colorido, Estratégia, Fofo, Retrô, Vários Finais, Jogo de Divindade"
Blood West: Scavengers,"3 Jun, 2026",Indefinido,https://store.steampowered.com/app/4051310/Blood_West_Scavengers/?snr=1_7_7_popularcomingsoon_150_1,"Ação, RPG, Indie, Violência Detalhada, Violento"
The 7th Guest Remake,"4 Jun, 2026",Indefinido,https://store.steampowered.com/app/4491360/The_7th_Guest_Remake/?snr=1_7_7_popularcomingsoon_150_1,"Quebra-Cabeça, Aventura, Ficção Interativa, Mistério, Exploração, Remake, 3D, Atmosférico, Sobrenatural, Primeira Pessoa, Objetos Ocultos, Realístico, Sombrio, Noir, Fantasia Sombria, Gótico, Terror, Boa Trama, Controle, Um Jogador"
Pro Cycling Manager 26,"4 Jun, 2026",Indefinido,https://store.steampowered.com/app/3936530/Pro_Cycling_Manager_26/?snr=1_7_7_popularcomingsoon_150_1,"Esportes, Simulação, Ciclismo, Gerenciamento, Jogador x Jogador (PvP), 3D, Multijogador, Um Jogador, 2D, Bicicletas (e Motocicletas), Exploração, Realístico, Estratégia"
Modern Warships,"4 Jun, 2026",Free,https://store.steampowered.com/app/3144230/Modern_Warships/?snr=1_7_7_popularcomingsoon_150_1,"Combate Naval, Ação, Multijogador, Combate com Veículos, Moderno, Multijogador Massivo, Jogador x Jogador (PvP), Tiro, Tiro em Terceira Pessoa, 3D, Militar, Voo, Naval, Terceira Pessoa, Guerra, Arcade, Combate, Realístico, Baseado em Equipes, Futurista"
Sports Card Shop Simulator,"4 Jun, 2026",Indefinido,https://store.steampowered.com/app/4157170/Sports_Card_Shop_Simulator/?snr=1_7_7_popularcomingsoon_150_1,"Acesso Antecipado, Simulação, Gerenciamento, Economia, Um Jogador, Jogo de Cartas, Colete Tudo, Capitalismo, Esportes, 3D, Futebol, Gerenciamento de Lojas, Simulador de Vida Real, Personalização de Personagem, Troca, Casual, Simulador Imersivo, Primeira Pessoa, Simulador de Emprego, Organização"
The Brewline,"4 Jun, 2026",Indefinido,https://store.steampowered.com/app/3916860/The_Brewline/?snr=1_7_7_popularcomingsoon_150_1,"Simulação, Casual, Faça o que Quiser, Simulador Imersivo, Um Jogador, Primeira Pessoa, 3D, Mundo Aberto, Fabricação, Crime, Gerenciamento de Inventário, Gerenciamento de Recursos, Gerenciamento, Furtivo, Agricultura, Automação, Indie, Simulador de Vida Real, Exploração, Direção"
Alruna: End of History,"4 Jun, 2026",Indefinido,https://store.steampowered.com/app/3440260/Alruna_End_of_History/?snr=1_7_7_popularcomingsoon_150_1,"Aventura, Ação, Metroidvania, Plataforma, Ação / Aventura, Plataforma 2D, Quebra-Cabeça, Exploração, Plataforma de Precisão, Plataforma com Quebra-Cabeça, 2D, Colorido, Gráficos Pixelados, Atmosférico, Capitalismo, Cyberpunk, Distópico, Combate, Protagonista Mulher, Não Linear"
Swan Song,"Jun 4, 2026",Indefinido,https://store.steampowered.com/app/3265290/Swan_Song/?snr=1_7_7_popularcomingsoon_150_2,"Casual, Quebra-Cabeça, Plataforma com Quebra-Cabeça, 3D, Fofo, Isométrico, Visão Superior, Comovente, Relaxante, Indie, Movimento em Grade, Linear, Um Jogador, Colorido, Atmosférico, Protagonista Mulher, Música"
GOALS,"Jun 4, 2026",Free,https://store.steampowered.com/app/2753000/GOALS/?snr=1_7_7_popularcomingsoon_150_2,"Esportes, Gratuito para Jogar, Futebol, Multijogador, eSports, Competitivo, Jogador x Jogador (PvP), Tático, Gerenciamento, 3D, Protagonista Mulher, Realístico, Estilizado, Personalização de Personagem, Para Toda a Família, Baseado em Equipes, Controle, Gerenciamento de Inventário, Geração Procedural, Aventura"
Songs of Conquest - Yulan,"Jun 4, 2026",Indefinido,https://store.steampowered.com/app/4341060/Songs_of_Conquest__Yulan/?snr=1_7_7_popularcomingsoon_150_2,"Multijogador Local, Tática por Turnos, Tático, 4X, Estratégia em Turnos, Combate em Turnos, Estratégia, Fantasia, RPG de Estratégia, Gráficos Pixelados, Mágica, Atmosférico, Enredo Rico, Retrô, Boa Trama, RPG Tático, 2,5D, Velha-Guarda, Controle, Cooperativo"
There's Nothing Down There,"Jun 4, 2026",Indefinido,https://store.steampowered.com/app/4429870/Theres_Nothing_Down_There/?snr=1_7_7_popularcomingsoon_150_2,"Terror, Submarino, Aventura, Exploração, Primeira Pessoa, Linear, 3D, Simulador de Caminhada, Realístico, Furtivo, Indie, Um Jogador, Atmosférico, Natureza, Subterrâneo, Subaquático, Controle, Curta-Metragem"
Car Dealer Simulator - Up 2 You DLC,"Jun 4, 2026",Indefinido,https://store.steampowered.com/app/4046960/Car_Dealer_Simulator__Up_2_You_DLC/?snr=1_7_7_popularcomingsoon_150_2,"Simulação, Direção, Casual, Simulador Automobilístico, Troca, Simulador Imersivo, Simulador de Vida Real, Mundo Aberto, Primeira Pessoa, 3D, Indie, Gerenciamento, Realístico, Rico em Diálogos, Um Jogador, Para Toda a Família, Cinematográfico, Moderno, Gerenciamento de Inventário"
Medic: Pacific War,"Jun 4, 2026",Indefinido,https://store.steampowered.com/app/1281640/Medic_Pacific_War/?snr=1_7_7_popularcomingsoon_150_2,"Acesso Antecipado, Simulador Médico, Segunda Guerra Mundial, Simulação, Ação, Histórico, Militar, Um Jogador, Guerra, Cinematográfico, Realístico, 3D, Tiro, Tiro em Primeira Pessoa (FPS), Tático, Primeira Pessoa, Furtivo, Atmosférico, Ação / Aventura, Simulador de Vida Real"
Snacktorio,"Jun 4, 2026",Indefinido,https://store.steampowered.com/app/1902940/Snacktorio/?snr=1_7_7_popularcomingsoon_150_2,"Simulação, Automação, Gerenciamento de Recursos, Fabricação, Construção de Bases, Simulador Imersivo, Casual, Estratégia, Culinária, Educativo, Simulador Rural, Faça o que Quiser, Plataforma 2D, Gerenciamento, Gráficos Pixelados, 2D, Colorido, Construção, Ciência, Fofo"
House Flipper Remastered Collection,"Jun 4, 2026",Indefinido,https://store.steampowered.com/app/3710840/House_Flipper_Remastered_Collection/?snr=1_7_7_popularcomingsoon_150_2,"Simulação, Design e Ilustração, Decoração, Limpeza, Construção, Casual, Simulador Imersivo, Faça o que Quiser, Economia, 3D, Gerenciamento, Realístico, Para Toda a Família, Compatível com Mods, Um Jogador, Organização, Construção de Bases, Primeira Pessoa, Relaxante, Indie"
The Quiet Things,"Jun 4, 2026",Indefinido,https://store.steampowered.com/app/2288520/The_Quiet_Things/?snr=1_7_7_popularcomingsoon_150_2,"Boa Trama, Atmosférico, Simulador de Caminhada, Comovente, Indie, Protagonista Mulher, Aventura, Primeira Pessoa, Exploração, Narrativa, Mistério, LGBTQIA+, Um Jogador, Apontar e Clicar, Anos 90, Psicológico, Trilha Sonora, Sombrio, Ficção Interativa, Romance Visual"
Pronoun Palace,"Jun 4, 2026",Indefinido,https://store.steampowered.com/app/3618850/Pronoun_Palace/?snr=1_7_7_popularcomingsoon_150_2,"Soletração, Jogo de Palavras, Roguelike, LGBTQIA+, Casual, Um Jogador, Quebra-Cabeça, Roguelite, Distópico, Político, Estratégia, Estratégia em Turnos, 2D, Gráficos Pixelados, Cartunizado, Combate, Morte Permanente, Indie"
Comatose,"Jun 4, 2026",Indefinido,https://store.steampowered.com/app/3301370/Comatose/?snr=1_7_7_popularcomingsoon_150_2,"Aventura, Terror Psicológico, Ação, Terror de Sobrevivência, Terror, Gerenciamento de Recursos, Tiro, Tiro em Primeira Pessoa (FPS), Primeira Pessoa, Protagonista Mulher, Retrô, Violento, Acesso Antecipado, Velha-Guarda, Boa Trama, Vários Finais, Um Jogador"
You Know The Drill,"Jun 4, 2026",Indefinido,https://store.steampowered.com/app/3833760/You_Know_The_Drill/?snr=1_7_7_popularcomingsoon_150_2,"Incremental, Mineração, Casual, Progressão Ociosa, Roguelike, Relaxante, Simulação, Retrô, Robôs, Arcade, Subterrâneo, Minimalista, Estratégia, Aconchegante, Gráficos Pixelados, Destruição, 2D, Estilizado, Um Jogador, Abstrato"
Witch's Apocalyptic Journey,"Jun 5, 2026",Indefinido,https://store.steampowered.com/app/3709430/Witchs_Apocalyptic_Journey/?snr=1_7_7_popularcomingsoon_150_2,"Montagem de Decks Roguelike, Editor de Níveis, Cartas, JRPG, Gráficos Pixelados, Anime, Montagem de Decks, Batalha com Cartas, Mágica, Roguelike, Roguelite, Estratégia, Um Jogador, RPG, Fantasia, Cooperativo On-line, Multijogador, 2D, Vários Finais, Protagonista Mulher"
Deep Crafter,"Jun 5, 2026",Indefinido,https://store.steampowered.com/app/2752350/Deep_Crafter/?snr=1_7_7_popularcomingsoon_150_2,"Acesso Antecipado, Mundo Aberto, Automação, Subaquático, Exploração, Ficção Científica, 3D, Faça o que Quiser, Aventura, Construção de Bases, Simulador Imersivo, Construção, Sobrevivência, Gerenciamento de Recursos, Construção de Cidades, Inteligência Artificial, Estratégia, Simulação, Terceira Pessoa, Um Jogador"
Astral Lords,"Jun 5, 2026",Indefinido,https://store.steampowered.com/app/3324250/Astral_Lords/?snr=1_7_7_popularcomingsoon_150_2,"Inferno de Balas, Roguelike de Ação, Espacial, Estratégia, Construção de Bases, Defesa de Torres, Ficção Científica, RPG, Ação, 2,5D, Tiro, Militar, Um Jogador, Fabricação, Simulação, Aventura, Indie, Casual"
