title,release_date,price,game_url,genres
Red Recon: 1944,Q3 2026,Indefinido,https://store.steampowered.com/app/3170130/Red_Recon_1944/?snr=1_7_7_popularcomingsoon_150_21,"Tática em Tempo Real, RPG Tático, Estratégia, Furtivo, Estratégia em Tempo Real (RTS), RPG de Estratégia, Segunda Guerra Mundial, Histórico, Boa Trama, 3D, Isométrico, Personalização de Armas, Manipulação de Tempo, Realístico, Militar, Tático, Atmosférico, Guerra, Um Jogador"
The Devil's Due,Q3 2026,Indefinido,https://store.steampowered.com/app/3699850/The_Devils_Due/?snr=1_7_7_popularcomingsoon_150_21,"Montagem de Decks Roguelike, Cartas, Roguelite, Batalha com Cartas, Roguelike, Estratégia, Jogo de Cartas, Tática por Turnos, 2,5D, Humor Pesado, Desenhado à Mão, Demônios, Um Jogador, Indie"
ShatterRush,Q3 2026,Indefinido,https://store.steampowered.com/app/3668330/ShatterRush/?snr=1_7_7_popularcomingsoon_150_21,"Acesso Antecipado, Tiro em Primeira Pessoa (FPS), Jogador x Jogador (PvP), Mechas, Destruição, Multijogador, Parkour, Baseado em Equipes, Tiro em Arena, Tiro, Ficção Científica, Ritmo Rápido, Estilizado, Competitivo, 3D, Colorido, Ação, Primeira Pessoa, Futurista, Espacial"
FIEFDOM,October 2026,Indefinido,https://store.steampowered.com/app/3292770/FIEFDOM/?snr=1_7_7_popularcomingsoon_150_21,"Medieval, Multijogador, Primeira Pessoa, Ação, Fantasia Sombria, Jogador x Jogador (PvP), Hack and Slash, 3D, Combate Naval, Personalização de Personagem, Combate, Atmosférico, RPG, Realístico, Violência Detalhada, Baseado em Equipes, Terceira Pessoa, Cooperativo On-line, Controle, Boa Trama"
Steel Ark,October 2026,Indefinido,https://store.steampowered.com/app/3915840/Steel_Ark/?snr=1_7_7_popularcomingsoon_150_21,"Ação, Aventura, RPG, Construção de Bases, Automação, RPG de Ação, Gerenciamento de Recursos, Gerenciamento de Inventário, Exploração, Primeira Pessoa, Indie, Combate, Cooperativo, 3D, História Alternativa, Violento, Simulação, Atmosférico, Fabricação, Combate com Veículos"
Ten Thousand Coins: The Golden Merchant,2026,Indefinido,https://store.steampowered.com/app/1157900/Ten_Thousand_Coins_The_Golden_Merchant/?snr=1_7_7_popularcomingsoon_150_21,"Troca, Boa Trama, Gerenciamento de Recursos, Você Decide, Roguelite, Anime, Economia, Protagonista Mulher, Combate em Turnos, Fantasia, RPG, Estratégia, Gerenciamento, Isométrico, Mistério, Um Jogador, Desenhado à Mão, 2D, RPG de Estratégia, Raposa"
Rune Fencer Illyia,2026,Indefinido,https://store.steampowered.com/app/1104600/Rune_Fencer_Illyia/?snr=1_7_7_popularcomingsoon_150_21,"Ação, Aventura, Metroidvania, Ação / Aventura, Plataforma, Exploração, Hack and Slash, Câmera Lateral, Soulslike, 2D, Atmosférico, Sombrio, Fantasia Sombria, Fantasia, Difícil, Espada, Combate, Fofo, Mágica, Controle"
Octopus City Blues,2026,Indefinido,https://store.steampowered.com/app/1192230/Octopus_City_Blues/?snr=1_7_7_popularcomingsoon_150_21,"Exploração, Escolha a sua Aventura, Vários Finais, Boa Trama, Você Decide, Aventura, Ficção Interativa, Surrealista, Conspiração, Sombrio, Humor Ácido, Terror, Apontar e Clicar, Lovecraftiano, Cyberpunk, Um Jogador, Controle, Gráficos Pixelados, Simulação, 2D"
Spirit of Midnight,2026,Indefinido,https://store.steampowered.com/app/1141060/Spirit_of_Midnight/?snr=1_7_7_popularcomingsoon_150_21,"Relaxante, Fofo, Aventura, Apontar e Clicar, Mistério, Engraçado, Exploração, Para Toda a Família, Gatos, Quebra-Cabeça, Indie, Boa Trama, Casual, Paródia, Ficção Interativa, Sobrenatural, 2D, Cartunizado, Colorido, Estilizado"
Legends of Astravia,2026,Indefinido,https://store.steampowered.com/app/1233680/Legends_of_Astravia/?snr=1_7_7_popularcomingsoon_150_21,"Acesso Antecipado, Exploração, JRPG, RPG de Grupos, RPG, Linear, Boa Trama, Combate em Turnos, Colorido, Gráficos Pixelados, Mágica, Fantasia, Atmosférico, Drama, Aventura, Anos 90, Velha-Guarda, Retrô, Um Jogador, Nostalgia"
Keepsake County,2026,Indefinido,https://store.steampowered.com/app/1162860/Keepsake_County/?snr=1_7_7_popularcomingsoon_150_21,"Estilizado, Desenhado à Mão, Geração Procedural, Simulador Imersivo, Furtivo, Atmosférico, Assalto, Roguelike, 2,5D, Não Linear, 2D, Fofo, Crime, Desenho Animado, Capitalismo, Humor Pesado, Mundo Aberto, Tiro em Primeira Pessoa (FPS), 3D, Engraçado"
Orc Warchief: Strategy City Builder,2026,Indefinido,https://store.steampowered.com/app/1505940/Orc_Warchief_Strategy_City_Builder/?snr=1_7_7_popularcomingsoon_150_21,"Estratégia, Indie, Faça o que Quiser, Estratégia em Tempo Real (RTS), Construção de Bases, Tático, Um Jogador, Realístico, Guerra, Simulação, Construção, Gerenciamento, Construção de Cidades, Violento, Economia, Mitologia, Tempo Real, Histórico, Ação, Ação / Aventura"
Heart Of Muriet,2026,Indefinido,https://store.steampowered.com/app/1368160/Heart_Of_Muriet/?snr=1_7_7_popularcomingsoon_150_21,"Construção de Bases, Estratégia, Mágica, Atmosférico, Ação, Simulação, 4X, Medieval, Exploração, Estratégia em Tempo Real (RTS), Simulador de Colônias, Fantasia, Editor de Níveis, Construção, Gerenciamento, Um Jogador, Natureza, Gerenciamento de Recursos, Voxel, Sobrevivência"
Hello Again,2026,Indefinido,https://store.steampowered.com/app/2052710/Hello_Again/?snr=1_7_7_popularcomingsoon_150_21,"Quebra-Cabeça, Manipulação de Tempo, Colorido, Exploração, Viagem no Tempo, Apontar e Clicar, Mistério, Fofo, Natureza, Engraçado, Boa Trama, Aventura, 2D, Visão Superior, Detetive, Minimalista, Estilizado, Investigação, Indie, Um Jogador"
Orc Warchief: Prologue,2026,Free,https://store.steampowered.com/app/2003070/Orc_Warchief_Prologue/?snr=1_7_7_popularcomingsoon_150_21,"Exploração, Estratégia em Tempo Real com Ação, Tática em Tempo Real, Construção de Cidades, Simulador de Colônias, Estratégia, Estratégia em Tempo Real (RTS), RPG de Estratégia, 3D, Construção de Bases, Boa Trama, Fantasia Sombria, Economia, Fantasia, Gerenciamento, Construção, Fabricação, Sobrevivência, Gerenciamento de Recursos, Um Jogador"
Ending Tau,2026,Indefinido,https://store.steampowered.com/app/2087880/Ending_Tau/?snr=1_7_7_popularcomingsoon_150_21,"Roguelike de Ação, Exploração, Hack and Slash, Soulslike, Roguelite, Roguelike, Gráficos Pixelados, Personalização de Personagem, Estilizado, Visão Superior, História Alternativa, Ação, Controle, Atmosférico, Combate, Um Jogador, Indie, RPG, Geração Procedural, Alta Rejogabilidade"
Almost My Floor: Duality,2026,Indefinido,https://store.steampowered.com/app/2068190/Almost_My_Floor_Duality/?snr=1_7_7_popularcomingsoon_150_21,"Terror, Sátira, Detetive, Psicológico, Você Decide, Boa Trama, Thriller, Romance Visual, Furtivo, Terror Psicológico, Humor Ácido, Vários Finais, Sombrio, Mistério, Aventura, Ação / Aventura, Não Linear, Ação, Zumbis, Lovecraftiano"
Total World Liberation,2026,Indefinido,https://store.steampowered.com/app/2177230/Total_World_Liberation/?snr=1_7_7_popularcomingsoon_150_22,"Mundo Aberto, Sobrevivência, Construção de Bases, Automação, Estratégia em Turnos, Estratégia, Fabricação, Simulador de Colônias, Exploração, Tática por Turnos, Simulador Imersivo, Em Turnos, Combate em Turnos, Furtivo, Construção, Pós-Apocalíptico, Isométrico, 3D, Militar, Guerra"
Cosmic Holidays,2026,Indefinido,https://store.steampowered.com/app/2190640/Cosmic_Holidays/?snr=1_7_7_popularcomingsoon_150_22,"Aventura, Plataforma 2D, Exploração, Comovente, Relaxante, Natureza, Casual, Colorido, Estilizado, Atmosférico, Indie, Ficção Científica, Alienígenas, Um Jogador, Linear, Escolha a sua Aventura, Física, Câmera Lateral, Plataforma, 2D"
Battle Vision Network,2026,Indefinido,https://store.steampowered.com/app/2216850/Battle_Vision_Network/?snr=1_7_7_popularcomingsoon_150_22,"Ação, Estratégia, Quebra-Cabeça, Jogador x Jogador (PvP), Multijogador, Tática por Turnos, Combate em Turnos, Estratégia em Turnos, Batalha com Cartas, Competitivo, Casual, Jogo de Cartas, 2D, 3D, Indie, Fantasia, Colorido, Desenhado à Mão, Ficção Científica, Estilizado"
Music Power Up,2026,Indefinido,https://store.steampowered.com/app/2246370/Music_Power_Up/?snr=1_7_7_popularcomingsoon_150_22,"Produção de Áudio, Indie, Música, Desenvolvimento de Jogos, Retrô, Casual, 2D, Gráficos Pixelados, Velha-Guarda, Música Estilo 8 Bits, Um Jogador, Musical Procedural, Anos 80, Tutorial, Música Eletrônica, Simulação, Histórico, Utilitários, Narração, Aventura"
Bestiario,Q4 2026,Indefinido,https://store.steampowered.com/app/2760720/Bestiario/?snr=1_7_7_popularcomingsoon_150_22,"Um Jogador, JRPG, Anime, Romance Visual, Boa Trama, Velha-Guarda, RPG de Grupos, Comovente, Romance, Conversas, Combate em Turnos, Retrô, Você Decide, Narração Dinâmica, Gráficos Pixelados, RPG, Mitologia, LGBTQIA+, Vários Finais, Trilha Sonora"
Mononoke No Kuni,2026,Indefinido,https://store.steampowered.com/app/2597610/Mononoke_No_Kuni/?snr=1_7_7_popularcomingsoon_150_22,"RPG, Ação, Aventura, Roguelike de Ação, Construção de Cidades, JRPG, Faça o que Quiser, Plataforma 3D, Calabouço Misterioso, Exploração, Fofo, Terceira Pessoa, Voxel, Visão Superior, Fantasia, Relaxante, Retrô, Espada, Estrangeiro, Para Toda a Família"
Astromeda,2026,Indefinido,https://store.steampowered.com/app/2560210/Astromeda/?snr=1_7_7_popularcomingsoon_150_22,"Trilha Sonora Boa, RPG, Aventura, Boa Trama, Gráficos Pixelados, Você Decide, Vários Finais, Chuva de Balas, 2D, Comédia, Engraçado, Combate em Turnos, Espacial, Comovente, Mistério, RPG de Ação, Sombrio, Retrô, Indie, Terror Psicológico"
Button Man,2026,Indefinido,https://store.steampowered.com/app/2817960/Button_Man/?snr=1_7_7_popularcomingsoon_150_22,"Aventura, Ação, Câmera Lateral, Porradaria, Luta 2D, RPG de Ação, 2D, História em Quadrinhos, Noir, Detetive, Primeira Guerra Mundial, Você Decide, Controle, Vários Finais, Mundo Aberto, Boa Trama, Desenhado à Mão, Estilizado, Crime, Mistério"
Finch & Archie,Q4 2026,Indefinido,https://store.steampowered.com/app/2642500/Finch__Archie/?snr=1_7_7_popularcomingsoon_150_22,"Quebra-Cabeça, Cachorros, Mistério, Investigação, Ficção Interativa, Noir, Exploração, 3D, História em Quadrinhos, Terceira Pessoa, Detetive, Conversas, Linear, Narração, Boa Trama, Casual, Baseado em Texto, Desenhado à Mão, Estilizado, Lógica"
Tales of Anturia: Farathan,2026,Indefinido,https://store.steampowered.com/app/1558030/Tales_of_Anturia_Farathan/?snr=1_7_7_popularcomingsoon_150_22,"RPG, Mundo Aberto, Boa Trama, Você Decide, Um Jogador, Fantasia Sombria, Enredo Rico, Vários Finais, Não Linear, Medieval, Terceira Pessoa, RPG de Ação, Realístico, Espada, CRPG, Escolha a sua Aventura, Personalização de Personagem, Sombrio, Demônios, 3D"
Cozy Dungeons,2026,Indefinido,https://store.steampowered.com/app/2377600/Cozy_Dungeons/?snr=1_7_7_popularcomingsoon_150_22,"Construção, Aventura, Ação / Aventura, RPG, Relaxante, Casual, Aconchegante, Simulação, Explorador de Calabouços, Simulador de Vida Real, Um Jogador, Desenho Animado, Boa Trama, Colorido, Para Toda a Família, Fantasia, Fofo, Medieval, Personalização de Personagem, Estilizado"
Sigilfarer,2026,Indefinido,https://store.steampowered.com/app/2436870/Sigilfarer/?snr=1_7_7_popularcomingsoon_150_22,"Explorador de Calabouços, Um Jogador, Aventura, 3D, Exploração, RPG, Mundo Aberto, Personalização de Personagem, Fantasia, Geração Procedural, Roguelite, Roguelike, Mágica, Combate em Turnos, Gerenciamento de Inventário, Estratégia em Turnos, Tática por Turnos, RPG de Grupos, Montagem de Decks, Montagem de Decks Roguelike"
Changer Seven,2026,Indefinido,https://store.steampowered.com/app/2069330/Changer_Seven/?snr=1_7_7_popularcomingsoon_150_22,"Super-Heróis, Cinematográfico, Combate, Boa Trama, Ação, Um Jogador, Aventura, Ação / Aventura, Exploração, Terceira Pessoa, Comovente, Engraçado, Espada, Controle, Protagonista Mulher, 3D, Tutorial, Indie, Jogo de Ação Focado em Personagem, Plataforma 3D"
Alpine Lake,2026,Indefinido,https://store.steampowered.com/app/2341620/Alpine_Lake/?snr=1_7_7_popularcomingsoon_150_22,"RPG, Construção, Fabricação, Gerenciamento, Simulador Rural, Simulador de Vida Real, Natureza, Casual, Relaxante, Personalização de Personagem, 3D, Fofo, Visão Superior, Culinária, Simulação, Para Toda a Família, Gerenciamento de Recursos, Um Jogador, Mundo Aberto, Indie"
S: Lost Chapters,2026,Indefinido,https://store.steampowered.com/app/2506890/S_Lost_Chapters/?snr=1_7_7_popularcomingsoon_150_22,"Ação, Aventura, Exploração, Primeira Pessoa, Terror, Indie, Sombrio, Psicológico, Terror Psicológico, Sobrevivência, Terror de Sobrevivência, Violência Detalhada, Violento, Um Jogador, Mundo Aberto, Jump Scare"
VISK,2026,Indefinido,https://store.steampowered.com/app/2405640/VISK/?snr=1_7_7_popularcomingsoon_150_22,"Terror, Cooperativo On-line, Multijogador, Mundo Aberto, Cooperativo, Exploração, Primeira Pessoa, Atmosférico, Terror Psicológico, Mistério, Sobrenatural, Aventura, Sombrio, Surrealista, Vários Finais, 3D, Um Jogador, Indie, Simulador de Caminhada, Objetos Ocultos"
Above the Snow,2026,Indefinido,https://store.steampowered.com/app/2423760/Above_the_Snow/?snr=1_7_7_popularcomingsoon_150_22,"Simulador de Colônias, Simulação, Visão Superior, Neve, Natureza, Gerenciamento, Atmosférico, Gerenciamento de Recursos, Estratégia, Exploração, Boa Trama, Construção de Cidades, Construção, Um Jogador, 3D, Gerenciamento de Tempo, Estilizado, Simulador Imersivo, Você Decide, Aventura"
Bogdan's Cross,2026,Indefinido,https://store.steampowered.com/app/2503230/Bogdans_Cross/?snr=1_7_7_popularcomingsoon_150_22,"Aventura, Ação / Aventura, Ação, Medieval, Boa Trama, Exploração, Fé, Histórico, Câmera Lateral, Plataforma 3D, 3D, Colorido, Estilizado, Investigação, Um Jogador, Linear"
ノロワレサイクル,2026,Indefinido,https://store.steampowered.com/app/2183820/_/?snr=1_7_7_popularcomingsoon_150_22,"Aventura, Terror, Mistério, Romance Visual, Escolha a sua Aventura, Um Jogador, Plataforma 2D, 2D, Anime, Gráficos Pixelados, Moderno, Drama, Sombrio, Psicológico, Você Decide, Terror Psicológico, Sobrenatural, Baseado em Texto, Protagonista Mulher, Boa Trama"
Swordai,2026,Indefinido,https://store.steampowered.com/app/2321890/Swordai/?snr=1_7_7_popularcomingsoon_150_22,"Espada, Explorador de Calabouços, Tiro de Extração, Jogador x Jogador (PvP), Multijogador, Saques, Ação, Combate, Luta, Primeira Pessoa, Cooperativo, Realístico, Battle Royale, Medieval, RPG de Ação, Jogador X Ambiente (PvE), Fantasia Sombria, 3D, Um Jogador, Cooperativo On-line"
Rich Dad Simulator,2026,Indefinido,https://store.steampowered.com/app/2394250/Rich_Dad_Simulator/?snr=1_7_7_popularcomingsoon_150_22,"Casual, Simulação, Simulador Rural, Simulador de Vida Real, Faça o que Quiser, Escolha a sua Aventura, 3D, Primeira Pessoa, Comédia, Economia, Para Toda a Família, Indie, Engraçado, Gerenciamento, Relaxante, Personalização de Personagem, Um Jogador"
Ascent Quest,2026,Indefinido,https://store.steampowered.com/app/2412740/Ascent_Quest/?snr=1_7_7_popularcomingsoon_150_22,"RV, MMORPG, Fantasia, Luta Espetacular, Medieval, RPG, Exploração, Mundo Aberto, CRPG, Enredo Rico, Boa Trama, RPG de Ação, Personalização de Personagem, Espada, Arco e Flecha, Dragões, Narração, Colorido, Campanha Cooperativa, Cooperativo"
HyperCore : Rhythm Bullet Hell,2026,Indefinido,https://store.steampowered.com/app/1112390/HyperCore__Rhythm_Bullet_Hell/?snr=1_7_7_popularcomingsoon_150_22,"Ação, Multijogador, Indie, Ritmo, Mandando Bala, Música, Ritmo Rápido, Chuva de Balas, Difícil, Arcade, Musical Procedural, Corrida Contra o Tempo, Impiedoso, Multijogador Local, Colorido, Jogador x Jogador (PvP), Futurista, Um Jogador, Ficção Científica, Pontos, Pontos, Pontos!"
Let's Drive - learn driving simulator,2026,Indefinido,https://store.steampowered.com/app/1244600/Lets_Drive__learn_driving_simulator/?snr=1_7_7_popularcomingsoon_150_22,"Simulação, Educativo, Simulador Automobilístico, Simulador Imersivo, Casual, Indie, Um Jogador, Primeira Pessoa, Realístico, Simulador de Vida Real, Engraçado, Corrida, Direção, 3D, Ação, Aventura, Comédia, Humor Ácido, Para Toda a Família, Você Decide"
The Run: Got Next,2026,Indefinido,https://store.steampowered.com/app/2866670/The_Run_Got_Next/?snr=1_7_7_popularcomingsoon_150_22,"Esportes, Basquete, Multijogador, Roguelike, Estilizado, Baseado em Equipes, 3D, História em Quadrinhos, Arcade, Desenhado à Mão, Jogador x Jogador (PvP), Colorido, Controle"
Neverseas,2026,Free,https://store.steampowered.com/app/2953540/Neverseas/?snr=1_7_7_popularcomingsoon_150_22,"Aventura, Combate Naval, RPG, Piratas, Sobrevivência em Mundo Aberto, Faça o que Quiser, Geração Procedural, Grande Estratégia, Escolha a sua Aventura, Exploração, Terceira Pessoa, Realístico, Atmosférico, Navegação, Naval, Gerenciamento, Ação / Aventura, Multijogador, Ação, Jogador x Jogador (PvP)"
The Witch's Bakery,2026,Indefinido,https://store.steampowered.com/app/2967950/The_Witchs_Bakery/?snr=1_7_7_popularcomingsoon_150_22,"Aventura, Indie, Enredo Rico, Boa Trama, Comovente, 2D, Anime, Desenhado à Mão, RPG, Mágica, Protagonista Mulher, Do Bem, Colorido, Relaxante, Gerenciamento, Culinária, Fantasia, Gerenciamento de Tempo, LGBTQIA+, Um Jogador"
Fay Keeper,2026,Indefinido,https://store.steampowered.com/app/3088760/Fay_Keeper/?snr=1_7_7_popularcomingsoon_150_22,"RPG, Coleção de Criaturas, Combate em Turnos, Colete Tudo, Gráficos Pixelados, Difícil, Mitologia, Anime, Um Jogador, 2D, Aventura, Estratégia, RPG de Grupos, Fofo, Em Turnos, Exploração, Fantasia, Boa Trama, Retrô, JRPG"
Whirlight - No Time To Trip,2026,Indefinido,https://store.steampowered.com/app/2706980/Whirlight__No_Time_To_Trip/?snr=1_7_7_popularcomingsoon_150_22,"Aventura, Casual, Apontar e Clicar, Anos 90, Comédia, Surrealista, Cartunizado, Colorido, Engraçado, 2D, Para Toda a Família, Quebra-Cabeça, Boa Trama, Retrô, Atmosférico, Viagem no Tempo, Desenho Animado, Um Jogador, Ficção Científica, Protagonista Mulher"
Silent Planet - Elegy of a Dying World,Q4 2026,Indefinido,https://store.steampowered.com/app/2742920/Silent_Planet__Elegy_of_a_Dying_World/?snr=1_7_7_popularcomingsoon_150_22,"Ação, Aventura, Metroidvania, Terror, RPG, Protagonista Mulher, Ação / Aventura, Exploração, Gráficos Pixelados, Plataforma 2D, 2D, Atmosférico, Ficção Científica, Terror de Sobrevivência, Combate, Boa Trama, Câmera Lateral, Um Jogador, Retrô, Violento"
Soul Devourer,2026,Indefinido,https://store.steampowered.com/app/2530620/Soul_Devourer/?snr=1_7_7_popularcomingsoon_150_22,"Metroidvania, Ação, Anime, Terror, Sombrio, Combate, Boa Trama, Exploração, Aventura, Plataforma, Soulslike, 2D, Protagonista Mulher, Desenhado à Mão, Atmosférico, Zumbis, Câmera Lateral, Um Jogador, Não Linear, Indie"
ARCHETYPE BLUE,2026,Indefinido,https://store.steampowered.com/app/2541560/ARCHETYPE_BLUE/?snr=1_7_7_popularcomingsoon_150_22,"Colorido, Montagem de Decks Roguelike, Estratégia em Turnos, Cartas, Fantasia Sombria, Romance Visual, Engraçado, Lógica, Gerenciamento, Combate, Um Jogador, Baseado em Classes, RPG de Grupos, Montagem de Decks, Protagonista Mulher, Batalha com Cartas, Roguelike, Roguelite, Tática por Turnos, Estratégia"
Imperial Grace,2026,Indefinido,https://store.steampowered.com/app/1652580/Imperial_Grace/?snr=1_7_7_popularcomingsoon_150_22,"Otome, LGBTQIA+, Romance Visual, Você Decide, Estratégia, Romance, Boa Trama, Personalização de Personagem, Protagonista Mulher, Gerenciamento, Vários Finais, Escolha a sua Aventura, Político, Ficção Interativa, Gerenciamento de Recursos, Medieval, Aventura, RPG, Simulador de Encontros, Desenhado à Mão"
Dark Queen of Samobor,2026,Indefinido,https://store.steampowered.com/app/3106050/Dark_Queen_of_Samobor/?snr=1_7_7_popularcomingsoon_150_22,"Cinematográfico, Câmera Lateral, 2,5D, Ação / Aventura, Plataforma com Quebra-Cabeça, Atmosférico, Hack and Slash, Estilizado, Boa Trama, Fantasia Sombria, Um Jogador, Gótico, Narração, Mitologia, Medieval, Linear, Colorido, Enredo Rico, Mágica, Sombrio"
One Turn Kill,2026,Indefinido,https://store.steampowered.com/app/3151270/One_Turn_Kill/?snr=1_7_7_popularcomingsoon_150_22,"Estratégia, Cartas, Montagem de Decks, Gráficos Pixelados, Batalha com Cartas, Solitário, 2D, Ficção Científica, Jogador X Ambiente (PvE), Protagonista Mulher, Um Jogador"
Gunmetal Gothic,2026,Indefinido,https://store.steampowered.com/app/2248150/Gunmetal_Gothic/?snr=1_7_7_popularcomingsoon_150_22,"Acesso Antecipado, Tiro em Terceira Pessoa, RPG de Ação, Jogador X Ambiente (PvE), RPG, Cooperativo, Personalização de Personagem, Tiro, Cooperativo On-line, Terceira Pessoa, Multijogador, Steampunk, Ação, Um Jogador, Controle, Retrô, Estilizado, Gótico, Anos 90, Sombrio"
Food Devils,2026,Indefinido,https://store.steampowered.com/app/2861730/Food_Devils/?snr=1_7_7_popularcomingsoon_150_22,"Anime, RPG Tático, Roguelite, Personalização de Personagem, Fantasia Sombria, Escolha a sua Aventura, JRPG, Pós-Apocalíptico, RPG de Grupos, Estratégia, Boa Trama, Estratégia em Turnos, Tática por Turnos, Tático, Colorido, RPG de Estratégia, Construção de Bases, Movimento em Grade, Visão Superior, RPG"
Determinant,2026,Indefinido,https://store.steampowered.com/app/1445480/Determinant/?snr=1_7_7_popularcomingsoon_150_22,"Sobrevivência em Mundo Aberto, Sobrevivência, Fabricação, Construção de Bases, Física, Exploração, Ficção Científica, Aventura, Mundo Aberto, Tiro em Primeira Pessoa (FPS), 3D, Primeira Pessoa, Realístico, Futurista, Construção, Combate, Um Jogador, Simulação, Atmosférico, Mistério"
METRO PENGUIN EUTOPIA,2026,Indefinido,https://store.steampowered.com/app/2364190/METRO_PENGUIN_EUTOPIA/?snr=1_7_7_popularcomingsoon_150_22,"RPG, Aventura, RPG de Estratégia, 2D, Comédia, Pós-Apocalíptico, Subterrâneo, Atmosférico, Combate em Turnos, Vários Finais, Protagonista Mulher, Boa Trama, Você Decide, Um Jogador, Indie, Tática por Turnos, Exploração, Escolha a sua Aventura"
HARUKA: Beyond the Stars,2026,Indefinido,https://store.steampowered.com/app/2425200/HARUKA_Beyond_the_Stars/?snr=1_7_7_popularcomingsoon_150_22,"Ação, RPG, JRPG, RPG de Ação, Plataforma 3D, 3D, História em Quadrinhos, Ficção Científica, Pós-Apocalíptico, Espacial, Gatos, Futurista, Boa Trama, Um Jogador, Fofo"
Cyber Paradise,2026,Indefinido,https://store.steampowered.com/app/2431790/Cyber_Paradise/?snr=1_7_7_popularcomingsoon_150_22,"RPG, Ação, Boa Trama, Aventura, Roguelite, Plataforma 2D, Ação / Aventura, Cachorros, Atmosférico, Comovente, Gráficos Pixelados, Distópico, Cyberpunk, JRPG, Protagonista Mulher, LGBTQIA+, Roguelike de Ação, Controle, RPG de Ação, Narrativa"
BLACK BOX LSS - The Merciful Savior,2026,Indefinido,https://store.steampowered.com/app/2435810/BLACK_BOX_LSS__The_Merciful_Savior/?snr=1_7_7_popularcomingsoon_150_22,"Romance Visual, RPG, Drama, Simulador de Encontros, Gráficos Pixelados, Anime, Crime, 2D, Romance, Comovente, Boa Trama, Casual, Fantasia, Terror Psicológico, Mistério, Futurista, Um Jogador, Linear, Indie, Comédia"
HomeGrown,2026,Indefinido,https://store.steampowered.com/app/1894560/HomeGrown/?snr=1_7_7_popularcomingsoon_150_22,"Casual, Simulador Rural, Estratégia, Minimalista, Clique e Clique, Relaxante, Um Jogador, Gerenciamento de Recursos, Automação, Agricultura, Natureza, Fabricação, Faça o que Quiser, Gerenciamento, Fofo, Rural, 3D, Aconchegante, Estilizado, Para Toda a Família"
Dungeons of the Amber Griffin,2026,Indefinido,https://store.steampowered.com/app/1764280/Dungeons_of_the_Amber_Griffin/?snr=1_7_7_popularcomingsoon_150_22,"Explorador de Calabouços, RPG, Coleção de Criaturas, Subterrâneo, Velha-Guarda, Mágica, Quebra-Cabeça, RPG de Ação, Fantasia, Movimento em Grade, Soulslike, Retrô, Objetos Ocultos, Demônios, Fantasia Sombria, Boa Trama, Exploração, Medieval, CRPG, Combate"
Alice is Dead: Hearts and Diamonds,2026,Indefinido,https://store.steampowered.com/app/1826770/Alice_is_Dead_Hearts_and_Diamonds/?snr=1_7_7_popularcomingsoon_150_22,"Apontar e Clicar, Noir, Mistério, Romance Visual, Remake, Ficção Interativa, Detetive, Quebra-Cabeça, Psicodélico, Fantasia Sombria, Boa Trama, Investigação, Crime, Desenhado à Mão, Assassino, 2D, Enredo Rico, Colorido, Nostalgia, Fantasia"
Kritter: Defend Together,2026,Indefinido,https://store.steampowered.com/app/2103950/Kritter_Defend_Together/?snr=1_7_7_popularcomingsoon_150_22,"Roguelike de Ação, Ação, Cooperativo, Defesa de Torres, Mandando Bala, Cooperativo Local, Roguelite, Construção de Bases, Cooperativo On-line, Controle, SHMUP com Visão Superior, Controle com Alavanca Dupla, Hack and Slash, Tiro com Saques, Indie, Roguelike, Explorador de Calabouços, Personalização de Personagem, Isométrico, Ficção Científica"
Forgotten house,2026,Indefinido,https://store.steampowered.com/app/2111430/Forgotten_house/?snr=1_7_7_popularcomingsoon_150_22,"Gráficos Pixelados, Ação, Terror de Sobrevivência, Vários Finais, Furtivo, Atmosférico, Câmera Lateral, Objetos Ocultos, Terror, Terror Psicológico, Exploração, Quebra-Cabeça, Um Jogador, Plataforma com Quebra-Cabeça, Sombrio, Protagonista Mulher, Plataforma, 2D, Indie"
Tales of Meadows,2026,Indefinido,https://store.steampowered.com/app/2145170/Tales_of_Meadows/?snr=1_7_7_popularcomingsoon_150_22,"Medieval, Terceira Pessoa, Realístico, Combate, Luta Espetacular, Boa Trama, Um Jogador, Ação, Espada, Seis Graus de Liberdade, 3D, Ação / Aventura, Histórico, Militar, Narração, Furtivo, Aventura, Indie, Violento, Violência Detalhada"
