title,release_date,price,game_url,genres
Cyber Paradise,2026,Indefinido,https://store.steampowered.com/app/2431790/Cyber_Paradise/?snr=1_7_7_popularcomingsoon_150_20,"Ação / Aventura, Boa Trama, RPG, Cyberpunk, Ação, Gráficos Pixelados, Aventura, Roguelite, Atmosférico, Cachorros, Comovente, Plataforma 2D, Distópico, JRPG, Protagonista Mulher, LGBTQIA+, Roguelike de Ação, Estratégia, Simulação, Controle"
Surviving Deponia,2026,Indefinido,https://store.steampowered.com/app/2464520/Surviving_Deponia/?snr=1_7_7_popularcomingsoon_150_20,"Um Jogador, Aventura, Boa Trama, Construção de Bases, RPG, Fabricação, Cartunizado, Faça o que Quiser, Sobrevivência, Indie, Combate, JRPG, Ação, Construção, Exploração, Colorido, Isométrico, Engraçado, Simulação, Mundo Aberto"
Tales Of Wakana,2026,Indefinido,https://store.steampowered.com/app/2489950/Tales_Of_Wakana/?snr=1_7_7_popularcomingsoon_150_20,"Metroidvania, RPG de Ação, Gráficos Pixelados, Plataforma, Ação, Ação / Aventura, RPG, Explorador de Calabouços, Plataforma 2D, 2D, Memes, Colorido, Drama, Comédia, Retrô, Fantasia, Para Toda a Família, Comovente, Relaxante, Engraçado"
Psychotic Bathtub,2026,Indefinido,https://store.steampowered.com/app/2517080/Psychotic_Bathtub/?snr=1_7_7_popularcomingsoon_150_20,"Desenhado à Mão, Design e Ilustração, Estilizado, Terror Psicológico, Comédia, Você Decide, Vários Finais, Romance Visual, Boa Trama, Ficção Interativa, Sombrio, Humor Ácido, Apontar e Clicar, 2D, Atmosférico, Drama, Comovente, Exploração, Escolha a sua Aventura, Psicológico"
ARCHETYPE BLUE,2026,Indefinido,https://store.steampowered.com/app/2541560/ARCHETYPE_BLUE/?snr=1_7_7_popularcomingsoon_150_20,"Colorido, Montagem de Decks Roguelike, Estratégia em Turnos, Cartas, Fantasia Sombria, Romance Visual, Engraçado, Lógica, Gerenciamento, Combate, Um Jogador, Baseado em Classes, RPG de Grupos, Montagem de Decks, Protagonista Mulher, Batalha com Cartas, Roguelike, Roguelite, Tática por Turnos, Estratégia"
Machine Mind,2026,Indefinido,https://store.steampowered.com/app/2861590/Machine_Mind/?snr=1_7_7_popularcomingsoon_150_20,"Construção de Bases, Defesa de Torres, Sobrevivência, Fabricação, Estratégia, Gerenciamento de Recursos, Construção, RPG de Ação, Aventura, Exploração, Simulação, Faça o que Quiser, Gerenciamento, Mundo Aberto, Combate, Estratégia em Tempo Real com Ação, Pós-Apocalíptico, Ação / Aventura, Automação, Ação"
Graytail,2026,Indefinido,https://store.steampowered.com/app/2888960/Graytail/?snr=1_7_7_popularcomingsoon_150_20,"Gráficos Pixelados, Ação / Aventura, Boa Trama, Mistério, Metroidvania, Quebra-Cabeça, Exploração, Aventura, Retrô, Indie, Controle, RPG, 2D, Visão Superior, Ação, Anos 90, Um Jogador, Casual"
Card Cultivation,2026,Indefinido,https://store.steampowered.com/app/2963600/Card_Cultivation/?snr=1_7_7_popularcomingsoon_150_20,"Cartas, Gerenciamento, Sobrevivência, Estratégia, Roguelite, Batalha com Cartas, Jogo de Mesa, Roguelike, 2D, Solitário, Boa Trama, Você Decide, Simulação, Desenhado à Mão, Estilizado, Drama, Casual, Um Jogador, Narrativa, Acesso Antecipado"
Haunted Lands,2026,Indefinido,https://store.steampowered.com/app/2980900/Haunted_Lands/?snr=1_7_7_popularcomingsoon_150_20,"Plataforma 2D, Um Jogador, Mandando Bala, Difícil, Câmera Lateral, Ação, Aventura, Retrô, Plataforma, Gráficos Pixelados, Terror, Demônios, Velha-Guarda, Zumbis, Mágica, Tiro, Sombrio, Lobisomens, Sobrenatural, Combate"
Feudums,2026,Free,https://store.steampowered.com/app/473750/Feudums/?snr=1_7_7_popularcomingsoon_150_20,"Estratégia, Simulação, Grande Estratégia, Estratégia em Turnos, 4X, Medieval, Multijogador Massivo, Alta Rejogabilidade, Jogador x Jogador (PvP), Compatível com Mods, Construção de Cidades, Grade Hexagonal, Simulador Político, Diplomacia, Guerra, Economia, Colorido, Incremental, Multijogador, Um Jogador"
Folk Emerging,2026,Indefinido,https://store.steampowered.com/app/2275300/Folk_Emerging/?snr=1_7_7_popularcomingsoon_150_20,"4X, Estratégia em Turnos, Simulador de Colônias, Natureza, Histórico, Faça o que Quiser, Simulação, Estratégia, Exploração, Sobrevivência, Gerenciamento, Um Jogador, Gerenciamento de Recursos, Jogo de Tabuleiro, Diplomacia, Grade Hexagonal, História Alternativa, 2D, Economia, Educativo"
Dr. Emmerson's Nocturnes,2026,,https://store.steampowered.com/app/2361560/Dr_Emmersons_Nocturnes/?snr=1_7_7_popularcomingsoon_150_20,"Terror Psicológico, Lovecraftiano, Boa Trama, Terror, Romance Visual, Ficção Interativa, Atmosférico, Mistério, Apontar e Clicar, Narração, Aventura, Simulador de Caminhada, Casual, 3D, Baseado em Texto, Primeira Pessoa, Realístico, Escolha a sua Aventura, RV, Um Jogador"
World of Anterra,2026,Indefinido,https://store.steampowered.com/app/2402470/World_of_Anterra/?snr=1_7_7_popularcomingsoon_150_20,"RPG, Mundo Aberto, Gráficos Pixelados, RPG de Grupos, Faça o que Quiser, Cooperativo, Aventura, Exploração, Enredo Rico, Mistério, CRPG, 2D, Gerenciamento de Inventário, Fofo, Visão Superior, Atmosférico, Fantasia, Fabricação, Personalização de Personagem, Você Decide"
Soul Blade,2026,Indefinido,https://store.steampowered.com/app/2658410/Soul_Blade/?snr=1_7_7_popularcomingsoon_150_20,"Metroidvania, Plataforma 2D, Desenhado à Mão, Espada, Mitologia, Ninja, Soulslike, Artes Marciais, Exploração, RPG de Ação, Dragões, Mundo Aberto, Ação, Anime, Não Linear, Boa Trama, Um Jogador, Plataforma, RPG, História Alternativa"
Whirlight - No Time To Trip,2026,Indefinido,https://store.steampowered.com/app/2706980/Whirlight__No_Time_To_Trip/?snr=1_7_7_popularcomingsoon_150_20,"Aventura, Casual, Apontar e Clicar, Anos 90, Comédia, Surrealista, Cartunizado, Colorido, Engraçado, 2D, Para Toda a Família, Quebra-Cabeça, Boa Trama, Retrô, Atmosférico, Viagem no Tempo, Desenho Animado, Um Jogador, Ficção Científica, Protagonista Mulher"
Trade Tales,2026,Indefinido,https://store.steampowered.com/app/2734480/Trade_Tales/?snr=1_7_7_popularcomingsoon_150_20,"Simulador Rural, Gerenciamento de Lojas, Simulador de Vida Real, Aconchegante, Fabricação, Gerenciamento, Exploração, Automação, Pesca, RPG, Personalização de Personagem, Romance, 3D, Relaxante, Simulação, Gerenciamento de Tempo, Anime, Fofo, Colorido, Estilizado"
Ascent: Rivals,2026,Indefinido,https://store.steampowered.com/app/2748420/Ascent_Rivals/?snr=1_7_7_popularcomingsoon_150_20,"Corrida, Tiro, Corrida com Combate, Combate com Veículos, Direção, Esportes, Jogador x Jogador (PvP), Arcade, Multijogador, eSports, 3D, Ação, Terceira Pessoa, Controle, Distópico, Jatos, Espacial, Futurista, Indie, Combate"
GOALS,2026,,https://store.steampowered.com/app/2753000/GOALS/?snr=1_7_7_popularcomingsoon_150_20,"Esportes, Gratuito para Jogar, Futebol, eSports, Multijogador, Competitivo, Jogador x Jogador (PvP), Tático, Gerenciamento, Protagonista Mulher, 3D, Realístico, Estilizado, Personalização de Personagem, Para Toda a Família, Baseado em Equipes, Controle, Gerenciamento de Inventário, Geração Procedural, Um Jogador"
Bestiario,4º trimestre de 2026,Indefinido,https://store.steampowered.com/app/2760720/Bestiario/?snr=1_7_7_popularcomingsoon_150_20,"Um Jogador, JRPG, Anime, Romance Visual, Boa Trama, Velha-Guarda, RPG de Grupos, Comovente, Romance, Conversas, Combate em Turnos, Retrô, Você Decide, Narração Dinâmica, Gráficos Pixelados, RPG, Mitologia, LGBTQIA+, Vários Finais, Trilha Sonora"
Dawn Of Defense,4º trimestre de 2026,Indefinido,https://store.steampowered.com/app/2781660/Dawn_Of_Defense/?snr=1_7_7_popularcomingsoon_150_20,"Defesa de Torres, Estratégia em Tempo Real (RTS), Roguelite, Estratégia, Construção de Bases, 3D, Vikings, Tática em Tempo Real, Geração Procedural, Fantasia, Roguelike, Um Jogador, Grade Hexagonal, Estilizado, Construção, Jogador X Ambiente (PvE), Medieval, Mitologia, Estratégia em Tempo Real com Ação, Indie"
DearMyFriend,2026,Indefinido,https://store.steampowered.com/app/1953430/DearMyFriend/?snr=1_7_7_popularcomingsoon_150_20,"Gráficos Pixelados, RPG de Ação, Protagonista Mulher, Boa Trama, Exploração, RPG, Explorador de Calabouços, Ação, Ação / Aventura, Aventura, História em Quadrinhos, Um Jogador, JRPG, Distópico, Indie"
Tails of Fate,2026,Indefinido,https://store.steampowered.com/app/2014520/Tails_of_Fate/?snr=1_7_7_popularcomingsoon_150_20,"Metroidvania, RPG de Ação, Soulslike, Difícil, Gráficos Pixelados, Ação / Aventura, Fantasia, Velha-Guarda, RPG, Exploração, Ação, Aventura, Medieval, Indie, Plataforma 2D, Retrô, 2D, Um Jogador, Controle, Plataforma"
Dread Pilots,2026,Indefinido,https://store.steampowered.com/app/1766500/Dread_Pilots/?snr=1_7_7_popularcomingsoon_150_20,"Roguelike de Ação, Mandando Bala, RPG de Estratégia, Espacial, Você Decide, Explorador de Calabouços, Roguelite, Ficção Científica, RPG, Sobrevivência, Visão Superior, Ação, Narração Dinâmica, Colorido, Fabricação, Fantasia Sombria, Distópico, Saques, Combate com Veículos, 2,5D"
Keepsake County,2026,Indefinido,https://store.steampowered.com/app/1162860/Keepsake_County/?snr=1_7_7_popularcomingsoon_150_20,"Estilizado, Desenhado à Mão, Geração Procedural, Simulador Imersivo, Furtivo, Atmosférico, Assalto, Roguelike, 2,5D, Não Linear, 2D, Fofo, Crime, Desenho Animado, Capitalismo, Humor Pesado, Mundo Aberto, Tiro em Primeira Pessoa (FPS), 3D, Engraçado"
Legends of Astravia,2026,Indefinido,https://store.steampowered.com/app/1233680/Legends_of_Astravia/?snr=1_7_7_popularcomingsoon_150_20,"Acesso Antecipado, Exploração, JRPG, RPG de Grupos, RPG, Linear, Boa Trama, Combate em Turnos, Colorido, Gráficos Pixelados, Mágica, Fantasia, Atmosférico, Drama, Aventura, Anos 90, Velha-Guarda, Retrô, Um Jogador, Nostalgia"
Lead The Dragon,Q4 2026,Indefinido,https://store.steampowered.com/app/3836490/Lead_The_Dragon/?snr=1_7_7_popularcomingsoon_150_20,"Corrida, Um Jogador, Mundo Aberto, Ação / Aventura, Direção, Indie"
Just A Shadow Game,2026,Indefinido,https://store.steampowered.com/app/3040930/Just_A_Shadow_Game/?snr=1_7_7_popularcomingsoon_150_20,"Batalha com Cartas, Sombrio, Montagem de Decks, Roguelite, Psicológico, Cartas, Boa Trama, Estratégia, Difícil, Terror, Explorador de Calabouços, Demônios, Batalha Automática, Roguelike, Terror Psicológico, Construção de Bases, Alta Rejogabilidade, Você Decide, Combate em Turnos, Montagem de Decks Roguelike"
To The Grave: The Wildlands of Faenora,2026,Indefinido,https://store.steampowered.com/app/3053990/To_The_Grave_The_Wildlands_of_Faenora/?snr=1_7_7_popularcomingsoon_150_20,"RPG Tático, Tática por Turnos, Roguelite, RPG de Estratégia, Estratégia em Turnos, Gráficos Pixelados, RPG, JRPG, Estratégia, Roguelike, 2D, Fofo, Colorido, Fantasia, Medieval, Tático, Velha-Guarda, Retrô, Um Jogador, Acesso Antecipado"
ASCENDANT,2026,Indefinido,https://store.steampowered.com/app/1803110/ASCENDANT/?snr=1_7_7_popularcomingsoon_150_21,"Aventura, Tiro em Arena, Indie, Tiro de Extração, Jogador x Jogador (PvP), Baseado em Equipes, Tático, Ação, Multijogador Massivo, Tiro em Primeira Pessoa (FPS), Tiro, Multijogador, Primeira Pessoa, Distópico, Sobrevivência, Estratégia, Cooperativo On-line, Futurista, Ação / Aventura, Personalização de Armas"
Laws of Nadragia,2026,Indefinido,https://store.steampowered.com/app/1993410/Laws_of_Nadragia/?snr=1_7_7_popularcomingsoon_150_21,"Gráficos Pixelados, Aventura, Detetive, Investigação, Romance Visual, Boa Trama, Apontar e Clicar, Mistério, Crime, Engraçado, Isométrico, CRPG, Medieval, 2D, Steampunk, Você Decide, Vários Finais, Não Linear, Simulação, Fantasia"
Never's End,2026,Indefinido,https://store.steampowered.com/app/1999930/Nevers_End/?snr=1_7_7_popularcomingsoon_150_21,"Tática por Turnos, RPG Tático, RPG de Grupos, Fantasia Sombria, Estratégia em Turnos, Mundo Aberto, Você Decide, 2,5D, RPG, Morte Permanente, RPG de Estratégia, JRPG, Um Jogador, Estratégia, Exploração, Fantasia, Gráficos Pixelados, Isométrico, Movimento em Grade, Combate em Turnos"
The 9th Charnel,2026,Indefinido,https://store.steampowered.com/app/2005690/The_9th_Charnel/?snr=1_7_7_popularcomingsoon_150_21,"Terror de Sobrevivência, Terror, Boa Trama, Atmosférico, Quebra-Cabeça, Furtivo, Terror Psicológico, Linear, Primeira Pessoa, Um Jogador, Realístico, Tiro, Psicodélico, Lovecraftiano, Simulador de Caminhada, Demônios, Sombrio, Aventura, Ação, Tiro em Primeira Pessoa (FPS)"
Tales of Meadows,2026,Indefinido,https://store.steampowered.com/app/2145170/Tales_of_Meadows/?snr=1_7_7_popularcomingsoon_150_21,"Medieval, Terceira Pessoa, Realístico, Combate, Luta Espetacular, Boa Trama, Um Jogador, Ação, Espada, Seis Graus de Liberdade, 3D, Ação / Aventura, Histórico, Militar, Narração, Furtivo, Aventura, Indie, Violento, Violência Detalhada"
Just A Shadow Game,2026,Indefinido,https://store.steampowered.com/app/3040930/Just_A_Shadow_Game/?snr=1_7_7_popularcomingsoon_150_21,"Batalha com Cartas, Sombrio, Montagem de Decks, Roguelite, Psicológico, Cartas, Boa Trama, Estratégia, Difícil, Terror, Explorador de Calabouços, Demônios, Batalha Automática, Roguelike, Terror Psicológico, Construção de Bases, Alta Rejogabilidade, Você Decide, Combate em Turnos, Montagem de Decks Roguelike"
To The Grave: The Wildlands of Faenora,2026,Indefinido,https://store.steampowered.com/app/3053990/To_The_Grave_The_Wildlands_of_Faenora/?snr=1_7_7_popularcomingsoon_150_21,"RPG Tático, Tática por Turnos, Roguelite, RPG de Estratégia, Estratégia em Turnos, Gráficos Pixelados, RPG, JRPG, Estratégia, Roguelike, 2D, Fofo, Colorido, Fantasia, Medieval, Tático, Velha-Guarda, Retrô, Um Jogador, Acesso Antecipado"
Five Laps at Freddy's,2026,Indefinido,https://store.steampowered.com/app/3078140/Five_Laps_at_Freddys/?snr=1_7_7_popularcomingsoon_150_21,"Corrida, Acesso Antecipado, Arcade, 3D, Terror, LGBTQIA+, Corrida com Combate, Cartunizado, Colorido, Fofo, Terror Psicológico"
Elflock,2026,Indefinido,https://store.steampowered.com/app/3094690/Elflock/?snr=1_7_7_popularcomingsoon_150_21,"Aventura, Protagonista Mulher, Exploração, Terceira Pessoa, Cinematográfico, Boa Trama, Quebra-Cabeça, Fantasia, RPG, Mistério, Você Decide, Comovente, Alta Rejogabilidade, Drama, Medieval, Investigação, Realístico, Um Jogador, Escolha a sua Aventura, Vários Finais"
Danchi Days,2026,Indefinido,https://store.steampowered.com/app/3107530/Danchi_Days/?snr=1_7_7_popularcomingsoon_150_21,"Aventura, Comovente, Engraçado, Protagonista Mulher, Gráficos Pixelados, Fofo, Boa Trama, Do Bem, 2D, Comédia, Aconchegante, Cartunizado, Nostalgia, Relaxante, Exploração, Anime, Visão Superior, Um Jogador, JRPG, Controle"
Project TurboBlast,2026,Indefinido,https://store.steampowered.com/app/3148560/Project_TurboBlast/?snr=1_7_7_popularcomingsoon_150_21,"Corrida, Ação, Arcade, Estilizado, Plataforma 3D, História em Quadrinhos, 3D, Desenho Animado, Cartunizado, Colorido, Direção, Bicicletas (e Motocicletas), BMX, Destruição, Cyberpunk, Ciclismo, Gatos, Comédia, Jatos, Anime"
Office Party,2026,Indefinido,https://store.steampowered.com/app/3154460/Office_Party/?snr=1_7_7_popularcomingsoon_150_21,"Aventura, RPG, Simulação, Estratégia, Simulador de Vida Real, Quebra-Cabeça, Faça o que Quiser, RPG de Estratégia, Escolha a sua Aventura, Simulador Imersivo, 3D, Cinematográfico, Primeira Pessoa, Comédia, Drama, Engraçado, LGBTQIA+, Romance, Personalização de Personagem, Você Decide"
Dragon's Brew,2026,Indefinido,https://store.steampowered.com/app/3168560/Dragons_Brew/?snr=1_7_7_popularcomingsoon_150_21,"Gerenciamento, Simulação, Gráficos Pixelados, RPG, Fabricação, Simulador de Vida Real, Casual, Simulador Imersivo, Fofo, Para Toda a Família, Relaxante, Construção, Culinária, Gerenciamento de Recursos, 2D, Visão Superior, Aconchegante, Economia, Um Jogador, Gerenciamento de Lojas"
County of Fortune,2026,Indefinido,https://store.steampowered.com/app/3204330/County_of_Fortune/?snr=1_7_7_popularcomingsoon_150_21,"Acesso Antecipado, Estratégia, Simulação, Construção de Cidades, Construção, Economia, Histórico, Medieval, Política, Exploração, Gerenciamento, Gerenciamento de Recursos, Faça o que Quiser, Um Jogador, Estilizado, Colorido, 3D, Mundo Aberto, Natureza, Não Linear"
MARINES VS GOD,2026,Indefinido,https://store.steampowered.com/app/3209950/MARINES_VS_GOD/?snr=1_7_7_popularcomingsoon_150_21,"Tiro de Extração, Jogador x Jogador (PvP), Jogador X Ambiente (PvE), Tiro em Terceira Pessoa, Multijogador, Pós-Apocalíptico, Tiro, Cooperativo On-line, Sobrevivência, Ficção Científica, Atmosférico, Fabricação, Ação, Gerenciamento de Inventário, Terceira Pessoa, Futurista, Mundo Aberto, Combate, Realístico, Personalização de Personagem"
Lost Host,2026,Indefinido,https://store.steampowered.com/app/3273260/Lost_Host/?snr=1_7_7_popularcomingsoon_150_21,"Atmosférico, Mistério, Boa Trama, Sobrenatural, Sombrio, Comovente, Aventura, Plataforma 3D, Direção, Exploração, Indie, Terror, Ação / Aventura, Detetive, Física, Quebra-Cabeça, Controle, Um Jogador, 3D, Simulador Automobilístico"
You Sure You Wanna Drink This?,2026,Indefinido,https://store.steampowered.com/app/3371070/You_Sure_You_Wanna_Drink_This/?snr=1_7_7_popularcomingsoon_150_21,"Quebra-Cabeça, Fofo, Ficção Interativa, Protagonista Mulher, Combate em Turnos, Cartunizado, Apontar e Clicar, Casual, Jogo de Palavras, 2D, Detetive, Boa Trama, Relaxante, Um Jogador, Fantasia, Drama, Desenho Animado, Cachorros, Indie"
Dr.Mememe want to sleep,2026,Indefinido,https://store.steampowered.com/app/3386670/DrMememe_want_to_sleep/?snr=1_7_7_popularcomingsoon_150_21,"Isométrico, Fofo, Relaxante, Boa Trama, Colorido, Incremental, Casual, Automação, Clique e Clique, Um Jogador, Simulação, Protagonista Mulher, 3D, Baseado em Texto, Conversas, Anime, Para Toda a Família, Atmosférico, Apontar e Clicar, Humor Ácido"
Dicewood,2026,Indefinido,https://store.steampowered.com/app/3393850/Dicewood/?snr=1_7_7_popularcomingsoon_150_21,"Coleção de Criaturas, Dados, Fantasia Sombria, Mistério, Gatos, Roguelike, Montagem de Decks, Batalha com Cartas, Sombrio, Terror, Gráficos Pixelados, Estratégia, Fofo, Um Jogador, Sobrenatural, Cartas, Aventura, Combate em Turnos, Explorador de Calabouços, Casual"
Warfactory,2026,Indefinido,https://store.steampowered.com/app/3396160/Warfactory/?snr=1_7_7_popularcomingsoon_150_21,"Simulação, Automação, Estratégia em Tempo Real (RTS), Construção de Bases, Estratégia, 4X, Gerenciamento de Recursos, Jogo de Guerra, Jogador x Jogador (PvP), Gerenciamento, Construção, Um Jogador, Mechas, Simulador de Colônias, Robôs, Economia, Multijogador, Fabricação, Mineração, Indie"
HellSlave II: Judgment of the Archon,2026,Indefinido,https://store.steampowered.com/app/3399900/HellSlave_II_Judgment_of_the_Archon/?snr=1_7_7_popularcomingsoon_150_21,"RPG, Explorador de Calabouços, Fantasia Sombria, Combate em Turnos, Demônios, Indie, Velha-Guarda, Visão Superior, Desenhado à Mão, Um Jogador, Baseado em Classes, Linear, Gerenciamento de Tempo, Exploração, Enredo Rico, Estratégia em Turnos, Tática por Turnos, História em Quadrinhos, 2D, Ação"
Someone's Inside Me,2026,Indefinido,https://store.steampowered.com/app/3404880/Someones_Inside_Me/?snr=1_7_7_popularcomingsoon_150_21,"Multijogador, Terror, Estratégia, Humor Pesado, Sobrevivência, Terror Psicológico, Ação / Aventura, Cooperativo, Humor Ácido, Cooperativo On-line, Terror de Sobrevivência, Ficção Científica, 3D, Engraçado, Primeira Pessoa, Paródia, Gerenciamento de Tempo, Thriller, Battle Royale, Surrealista"
Machine Mind,2026,Indefinido,https://store.steampowered.com/app/2861590/Machine_Mind/?snr=1_7_7_popularcomingsoon_150_21,"Construção de Bases, Defesa de Torres, Sobrevivência, Fabricação, Estratégia, Gerenciamento de Recursos, Construção, RPG de Ação, Aventura, Exploração, Simulação, Faça o que Quiser, Gerenciamento, Mundo Aberto, Combate, Estratégia em Tempo Real com Ação, Pós-Apocalíptico, Ação / Aventura, Automação, Ação"
Graytail,2026,Indefinido,https://store.steampowered.com/app/2888960/Graytail/?snr=1_7_7_popularcomingsoon_150_21,"Gráficos Pixelados, Ação / Aventura, Boa Trama, Mistério, Metroidvania, Quebra-Cabeça, Exploração, Aventura, Retrô, Indie, Controle, RPG, 2D, Visão Superior, Ação, Anos 90, Um Jogador, Casual"
Card Cultivation,2026,Indefinido,https://store.steampowered.com/app/2963600/Card_Cultivation/?snr=1_7_7_popularcomingsoon_150_21,"Cartas, Gerenciamento, Sobrevivência, Estratégia, Roguelite, Batalha com Cartas, Jogo de Mesa, Roguelike, 2D, Solitário, Boa Trama, Você Decide, Simulação, Desenhado à Mão, Estilizado, Drama, Casual, Um Jogador, Narrativa, Acesso Antecipado"
Haunted Lands,2026,Indefinido,https://store.steampowered.com/app/2980900/Haunted_Lands/?snr=1_7_7_popularcomingsoon_150_21,"Plataforma 2D, Um Jogador, Mandando Bala, Difícil, Câmera Lateral, Ação, Aventura, Retrô, Plataforma, Gráficos Pixelados, Terror, Demônios, Velha-Guarda, Zumbis, Mágica, Tiro, Sombrio, Lobisomens, Sobrenatural, Combate"
Destiny Code,2026,Indefinido,https://store.steampowered.com/app/3412860/Destiny_Code/?snr=1_7_7_popularcomingsoon_150_21,"RPG, Montagem de Decks Roguelike, Cartas, Fofo, Aventura, Indie, Boa Trama, Fantasia, Ficção Científica, Acesso Antecipado, Romance, Casual, 2D, Gráficos Pixelados, Roguelite, Montagem de Decks, Batalha com Cartas, Estratégia, Simulador de Encontros, Um Jogador"
Okko The Exiled,2026,Indefinido,https://store.steampowered.com/app/3479420/Okko_The_Exiled/?snr=1_7_7_popularcomingsoon_150_21,"Câmera Lateral, Ação, Plataforma 2D, Plataforma, Ação / Aventura, Aventura, 2D, Controle, Boa Trama, Gráficos Pixelados, Fantasia Sombria, Indie, Fantasia, Retrô, Combate, Um Jogador"
DreadOut 3,2026,Indefinido,https://store.steampowered.com/app/3500810/DreadOut_3/?snr=1_7_7_popularcomingsoon_150_21,"Ação, Aventura, RPG, Ação / Aventura, Exploração, 3D, Terceira Pessoa, Atmosférico, Terror, Mistério, Sobrenatural, Terror de Sobrevivência, Surrealista, Protagonista Mulher, Não Linear, Mundo Aberto, Boa Trama, Um Jogador, Violência Detalhada, Sequência"
Steel Artery: Train City Builder,2026,Indefinido,https://store.steampowered.com/app/3602030/Steel_Artery_Train_City_Builder/?snr=1_7_7_popularcomingsoon_150_21,"Construção de Cidades, Simulador de Colônias, Trens, Construção de Bases, Gerenciamento de Recursos, Gráficos Pixelados, Estratégia, Gerenciamento, 2D, Fantasia, Construção, Simulação, Steampunk, Economia, Atmosférico, Um Jogador, Manipulação de Tempo, Indie, Sobrevivência, Faça o que Quiser"
Black Vultures: Prey of Greed,2026,,https://store.steampowered.com/app/3622280/Black_Vultures_Prey_of_Greed/?snr=1_7_7_popularcomingsoon_150_21,"Tiro em Primeira Pessoa (FPS), Multijogador, Militar, Primeira Pessoa, Realístico, Furtivo, Jogador x Jogador (PvP), Moderno, Tático, Cooperativo On-line, Atmosférico, Ação, Tiro, Sobrevivência, Estratégia, Cooperativo, Gratuito para Jogar, Competitivo, Acesso Antecipado, Saques"
DREADMOOR,4º trimestre de 2026,Indefinido,https://store.steampowered.com/app/3629430/DREADMOOR/?snr=1_7_7_popularcomingsoon_150_21,"Aventura, RPG, Simulação, Primeira Pessoa, Exploração, 3D, Atmosférico, Lovecraftiano, Navegação, Terror Psicológico, Pesca, Terror, Boa Trama, Mundo Aberto, Indie, Gerenciamento de Inventário, Um Jogador, Ação, Estilizado, Pós-Apocalíptico"
Infinite Alliance,2026,,https://store.steampowered.com/app/3720330/Infinite_Alliance/?snr=1_7_7_popularcomingsoon_150_21,"Indie, JRPG, RPG de Grupos, Aventura, Combate em Turnos, 2D, RPG, Exploração, RPG Tático, Gráficos Pixelados, Boa Trama, Drama, Comovente, Linear, Fantasia, Futurista, Enredo Rico, Um Jogador, Mechas, Mágica"
Eggspedition,2026,Indefinido,https://store.steampowered.com/app/3970880/Eggspedition/?snr=1_7_7_popularcomingsoon_150_21,"Terror de Sobrevivência, Terror, Sobrevivência, Ação, Dinossauros, Aventura, Cooperativo On-line, Exploração, Tiro em Primeira Pessoa (FPS), Cooperativo, Ação / Aventura, Tiro, Baseado em Equipes, Primeira Pessoa, Atmosférico, Tiro com Saques, Objetos Ocultos, Espacial, Coleção de Criaturas, 3D"
Eternity Breaker,2026,Indefinido,https://store.steampowered.com/app/4125860/Eternity_Breaker/?snr=1_7_7_popularcomingsoon_150_21,"RPG Tático, RPG, Tática por Turnos, Estratégia, Roguelite, Simulação, RPG de Estratégia, Estratégia em Turnos, JRPG, Roguelike, 2,5D, Gráficos Pixelados, Indie, Fantasia Sombria, Fantasia, Tático, Anos 90, Um Jogador"
Kromlech,2026,Indefinido,https://store.steampowered.com/app/2406680/Kromlech/?snr=1_7_7_popularcomingsoon_150_21,"Acesso Antecipado, Ação, RPG, RPG de Ação, Roguelike de Ação, Narração, Aventura, Soulslike, Metroidvania, Terceira Pessoa, Mundo Aberto, Ficção Interativa, Roguelite, Exploração, Escolha a sua Aventura, Drama, 3D, Realístico, Mistério, Fantasia Sombria"
They Killed Your Cat,2026,Indefinido,https://store.steampowered.com/app/3489420/They_Killed_Your_Cat/?snr=1_7_7_popularcomingsoon_150_21,"Tiro em Primeira Pessoa (FPS), Difícil, Tiro, Primeira Pessoa, Terror, Engraçado, Personalização de Armas, Ação, Minimalista, Realístico, Thriller, Zumbis, Física, Combate, Um Jogador, Sangue, Violência Detalhada, Violento, Indie, Casual"
