title,release_date,price,game_url,genres
Neon Inferno,"Oct 2, 2025",Indefinido,https://store.steampowered.com/app/2957720/Neon_Inferno/?snr=1_7_7_popularcomingsoon_150_7,"Câmera Lateral, Gráficos Pixelados, Cyberpunk, Tiro, Cooperativo, Arcade, Plataforma, 2D, Ação, Colorido, Noir, Cooperativo Local, Retrô, Plataforma de Precisão, Mandando Bala, Chuva de Balas, Parar o Tempo, Assassino, Futurista, Protagonista Mulher"
Éalú,"Oct 2, 2025",Indefinido,https://store.steampowered.com/app/3560370/al/?snr=1_7_7_popularcomingsoon_150_7,"Exploração, Quebra-Cabeça, Apontar e Clicar, 3D, FMV, Terceira Pessoa, Humor Ácido, Relaxante, Steampunk, Surrealista, Retrô, Boa Trama, Realístico, Filosófico, Atmosférico, Comovente, Mistério, Anos 80, Aventura, Cinematográfico"
Digimon Story Time Stranger,"Oct 2, 2025",$69.99,https://store.steampowered.com/app/1984270/Digimon_Story_Time_Stranger/?snr=1_7_7_popularcomingsoon_150_7,"RPG, JRPG, Coleção de Criaturas, RPG de Grupos, Colete Tudo, 3D, Anime, Fofo, Gráficos Pixelados, Viagem no Tempo, Fantasia, Comovente, História Alternativa, Moderno, Mitologia, Combate em Turnos, Personalização de Personagem, Boa Trama, Baseado em Equipes, Um Jogador"
Kingmakers,"Oct 8, 2025",Indefinido,https://store.steampowered.com/app/2109770/Kingmakers/?snr=1_7_7_popularcomingsoon_150_7,"Tiro em Terceira Pessoa, Estratégia, Medieval, Simulação, Defesa de Torres, Faça o que Quiser, Multijogador, Construção de Bases, Guerra, Ação, História Alternativa, Terceira Pessoa, Realístico, Combate, Histórico, RPG de Estratégia, Militar, Jogo de Guerra, Um Jogador, Construção"
Painkiller,"Oct 9, 2025",$39.99,https://store.steampowered.com/app/2300120/Painkiller/?snr=1_7_7_popularcomingsoon_150_7,"Tiro, Ação, Violência Detalhada, Ritmo Rápido, Gótico, Tiro em Primeira Pessoa (FPS), Primeira Pessoa, Terror, Velha-Guarda, Demônios, Realístico, Aventura, Violento, Atmosférico, Combate, Cooperativo On-line, Multijogador, Um Jogador, Tiro de Tiozão, Cooperativo"
Little Nightmares III - Ferryman Costumes Set,"Oct 9, 2025",Indefinido,https://store.steampowered.com/app/2088783/Little_Nightmares_III__Ferryman_Costumes_Set/?snr=1_7_7_popularcomingsoon_150_7,"Aventura, Terror, Cooperativo, Quebra-Cabeça, Multijogador, Atmosférico, Cooperativo On-line, Plataforma, Um Jogador, Campanha Cooperativa, Terror Psicológico, Sombrio, Ação, Furtivo, 2,5D, Boa Trama, Exploração, Trilha Sonora Boa, Indie, Cooperativo Local"
Little Nightmares III - Residents Costumes Pack,"Oct 9, 2025",Indefinido,https://store.steampowered.com/app/2088785/Little_Nightmares_III__Residents_Costumes_Pack/?snr=1_7_7_popularcomingsoon_150_7,"Aventura, Terror, Cooperativo, Quebra-Cabeça, Multijogador, Atmosférico, Cooperativo On-line, Plataforma, Um Jogador, Campanha Cooperativa, Terror Psicológico, Sombrio, Ação, Furtivo, 2,5D, Boa Trama, Exploração, Trilha Sonora Boa, Indie, Cooperativo Local"
Little Nightmares III - Dark Six Costumes Set,"Oct 9, 2025",$39.97,https://store.steampowered.com/app/2088786/Little_Nightmares_III__Dark_Six_Costumes_Set/?snr=1_7_7_popularcomingsoon_150_7,"Aventura, Terror, Cooperativo, Quebra-Cabeça, Multijogador, Atmosférico, Cooperativo On-line, Plataforma, Um Jogador, Campanha Cooperativa, Terror Psicológico, Sombrio, Ação, Furtivo, 2,5D, Boa Trama, Exploração, Trilha Sonora Boa, Indie, Cooperativo Local"
Little Nightmares III - Secrets of The Spiral - Expansion Pass,"Oct 9, 2025",Indefinido,https://store.steampowered.com/app/2170190/Little_Nightmares_III__Secrets_of_The_Spiral__Expansion_Pass/?snr=1_7_7_popularcomingsoon_150_7,"Aventura, Terror, Cooperativo, Quebra-Cabeça, Multijogador, Atmosférico, Cooperativo On-line, Plataforma, Um Jogador, Campanha Cooperativa, Terror Psicológico, Sombrio, Ação, Furtivo, 2,5D, Boa Trama, Exploração, Trilha Sonora Boa, Indie, Cooperativo Local"
Little Nightmares III,"Oct 9, 2025",$39.97,https://store.steampowered.com/app/1392860/Little_Nightmares_III/?snr=1_7_7_popularcomingsoon_150_7,"Aventura, Terror, Cooperativo, Quebra-Cabeça, Multijogador, Atmosférico, Cooperativo On-line, Plataforma, Um Jogador, Campanha Cooperativa, Terror Psicológico, Sombrio, Ação, Furtivo, Boa Trama, 2,5D, Exploração, Trilha Sonora Boa, Indie, Cooperativo Local"
Dreams of Another,"Oct 9, 2025",Indefinido,https://store.steampowered.com/app/3561230/Dreams_of_Another/?snr=1_7_7_popularcomingsoon_150_7,"Fantasia, Aventura, Ação / Aventura, Filosófico, Comovente, Abstrato, Drama, Mistério, Colorido, Exploração, Ação, RPG de Ação, RPG, Ficção Interativa, Tiro em Terceira Pessoa, Tiro, 3D, Psicológico, Estilizado, Cinematográfico"
Battlefield™ 6,"Oct 10, 2025",$69.99,https://store.steampowered.com/app/2807960/Battlefield_6/?snr=1_7_7_popularcomingsoon_150_7,"Ação, Tiro em Primeira Pessoa (FPS), Militar, Multijogador, Guerra, Tiro, Moderno, Um Jogador, Épico, Realístico, Battle Royale, Tático, Atmosférico, Combate, Violento, Boa Trama, Terror Psicológico, Terror"
Harbor,"Oct 10, 2025",Indefinido,https://store.steampowered.com/app/2714930/Harbor/?snr=1_7_7_popularcomingsoon_150_7,"Acesso Antecipado, Construção, Pós-Apocalíptico, Jogador x Jogador (PvP), Sobrevivência, Sobrevivência em Mundo Aberto, Tiro, Mundo Aberto, Multijogador, Primeira Pessoa, Exploração, Tiro em Primeira Pessoa (FPS), Tática em Tempo Real, Direção, Ação / Aventura, Ação, Realístico, Atmosférico, Aventura, Objetos Ocultos"
Burlesque,"Oct 10, 2025",Indefinido,https://store.steampowered.com/app/506640/Burlesque/?snr=1_7_7_popularcomingsoon_150_7,"Aventura, Indie, Casual, Nudez"
Keeper,"Oct 17, 2025",Indefinido,https://store.steampowered.com/app/3043580/Keeper/?snr=1_7_7_popularcomingsoon_150_7,"Aventura, Atmosférico, Cinematográfico, Psicodélico, Quebra-Cabeça, Terceira Pessoa, Surrealista, Boa Trama, Exploração, Colorido, Estilizado, Fantasia, Filosófico, Mistério, Natureza, Um Jogador, 3D, Linear"
Kumitantei: Old-School Slaughter,"Oct 20, 2025",Indefinido,https://store.steampowered.com/app/2759280/Kumitantei_OldSchool_Slaughter/?snr=1_7_7_popularcomingsoon_150_7,"Aventura, Anime, Terror, Anos 80, Batalha com Cartas, Exploração, Romance Visual, História Alternativa, Detetive, Protagonista Mulher, Mistério, Fofo, Cartas, Primeira Pessoa, Humor Pesado, Terror Psicológico, Gráficos Pixelados, RPG, Ação, Boa Trama"
NINJA GAIDEN 4,"Oct 21, 2025",$69.99,https://store.steampowered.com/app/2627260/NINJA_GAIDEN_4/?snr=1_7_7_popularcomingsoon_150_7,Sem gênero
Isopod: A Webbed Spin-off,"Oct 21, 2025",Indefinido,https://store.steampowered.com/app/2053910/Isopod_A_Webbed_Spinoff/?snr=1_7_7_popularcomingsoon_150_7,"Aventura, Plataforma 3D, Colete Tudo, Ritmo Rápido, Plataforma, Ação / Aventura, Física, Personalização de Personagem, Fofo, 3D, Boa Trama, Atmosférico, Engraçado, Ação, Exploração, Natureza, Colorido, Patinação (e Skate), Um Jogador, Terceira Pessoa"
Jurassic World Evolution 3,"Oct 21, 2025",$59.99,https://store.steampowered.com/app/2958130/Jurassic_World_Evolution_3/?snr=1_7_7_popularcomingsoon_150_7,"Simulação, Estratégia, Dinossauros, Ação, Sequência, Faça o que Quiser, Construção de Cidades, Atmosférico, Gerenciamento de Recursos, Gerenciamento, Economia, Sobrevivência, Ficção Científica, Construção de Bases, Mundo Aberto, Um Jogador, Construção, Violento, Inteligência Artificial, Multijogador"
Escape Simulator 2,"Oct 21, 2025",Indefinido,https://store.steampowered.com/app/2879840/Escape_Simulator_2/?snr=1_7_7_popularcomingsoon_150_7,"Casual, Fuja da Sala, Primeira Pessoa, Quebra-Cabeça, Cooperativo On-line, Um Jogador, Apontar e Clicar, Mistério, Aventura, Simulação, Multijogador, Cooperativo, Editor de Níveis, Objetos Ocultos, Exploração, Atmosférico, Lógica, Personalização de Personagem, Detetive, Investigação"
World In The Abyss,"Oct 22, 2025",Indefinido,https://store.steampowered.com/app/3676080/World_In_The_Abyss/?snr=1_7_7_popularcomingsoon_150_7,"Acesso Antecipado, Sobrevivência em Mundo Aberto, Sobrevivência, Cooperativo, Mundo Aberto, Fabricação, Construção de Bases, Aventura, Subaquático, Multijogador, Construção, Ação / Aventura, Tiro, Ação, Faça o que Quiser, Exploração, Pós-Apocalíptico, Tiro em Terceira Pessoa, Realístico, Terceira Pessoa"
Away From Home,"Oct 22, 2025",Indefinido,https://store.steampowered.com/app/1631980/Away_From_Home/?snr=1_7_7_popularcomingsoon_150_7,"RPG, Indie, Boa Trama, Ritmo, Estratégia, Tática por Turnos, Jogador X Ambiente (PvE), RPG de Ação, JRPG, 2D, Fofo, Visão Superior, Engraçado, Terror, Terror Psicológico, Você Decide, Controle, Linear, Vários Finais, Um Jogador"
Modulus,"Oct 22, 2025",Indefinido,https://store.steampowered.com/app/2779120/Modulus/?snr=1_7_7_popularcomingsoon_150_7,"Automação, Construção de Bases, Faça o que Quiser, Estratégia, Fabricação, Mundo Aberto, Simulação, Um Jogador, Construção, Gerenciamento, Sobrevivência, Quebra-Cabeça, Lógica, Atmosférico, Construção de Cidades, LEGO, 3D, Gerenciamento de Recursos, Futurista, Relaxante"
Utawarerumono: ZAN,"Oct 23, 2025",Indefinido,https://store.steampowered.com/app/3074840/Utawarerumono_ZAN/?snr=1_7_7_popularcomingsoon_150_8,"Porradaria, Musou, JRPG, Hack and Slash, Luta Espetacular, Anime, Cooperativo, Ficção Científica, Mitologia, Fantasia, Enredo Rico, Estrangeiro, 3D, RPG de Ação, Agricultura, Ação, Dinossauros, Aventura, Terceira Pessoa, RPG"
Double Dragon Revive,"Oct 23, 2025",$34.99,https://store.steampowered.com/app/3012220/Double_Dragon_Revive/?snr=1_7_7_popularcomingsoon_150_8,"Ação, Arcade, Porradaria, Plataforma 2D, Luta Espetacular, 3D, Realístico, Cinematográfico, Anos 80, Visão Superior, EUA, Distópico, Dragões, Basquete, Parkour, Guerra, Artes Marciais, Jogador X Ambiente (PvE), Pontos, Pontos, Pontos!, Multijogador"
FULL METAL SCHOOLGIRL,"Oct 23, 2025",Indefinido,https://store.steampowered.com/app/3696410/FULL_METAL_SCHOOLGIRL/?snr=1_7_7_popularcomingsoon_150_8,"Ação, Tiro em Terceira Pessoa, Tiro, Protagonista Mulher, Ficção Científica, Fofo, Roguelike de Ação, 3D, Violento, Violência Detalhada, Jogador X Ambiente (PvE), Um Jogador"
Effulgence RPG,"Oct 23, 2025",Indefinido,https://store.steampowered.com/app/3302080/Effulgence_RPG/?snr=1_7_7_popularcomingsoon_150_8,"RPG, Retrô, Aventura, Em Turnos, RPG de Grupos, Fabricação, Ficção Científica, Velha-Guarda, Atmosférico, Saques, Ambiente, Tática por Turnos, Indie, Gerenciamento de Inventário, Gerenciamento de Recursos, Minimalista, Um Jogador, Controle, 2,5D, Sombrio"
The HELL : City Builder of the Dead,"Oct 23, 2025",Indefinido,https://store.steampowered.com/app/2715410/The_HELL__City_Builder_of_the_Dead/?snr=1_7_7_popularcomingsoon_150_8,"Acesso Antecipado, Viagem no Tempo, Jogo de Divindade, Sobrevivência, Tática em Tempo Real, Construção de Cidades, Gerenciamento de Tempo, Simulação, Terror, Combate, Construção de Bases, Narração Dinâmica, Vários Finais, Construção, Detetive, Gerenciamento, Grande Estratégia, 3D, Demônios, Boa Trama"
Plants vs. Zombies™: Replanted,"Oct 23, 2025",$19.99,https://store.steampowered.com/app/3654560/Plants_vs_Zombies_Replanted/?snr=1_7_7_popularcomingsoon_150_8,"Estratégia, Defesa de Torres, Casual, Desenho Animado, Engraçado, Fofo, Zumbis, Cartunizado, Comédia, Retrô, Velha-Guarda, Cooperativo Local, Cooperativo, Multijogador Local, Jogador x Jogador (PvP), Um Jogador, Multijogador, Minijogos, Remake, Trilha Sonora Boa"
Vampires: Bloodlord Rising,"Oct 23, 2025",Indefinido,https://store.steampowered.com/app/2191500/Vampires_Bloodlord_Rising/?snr=1_7_7_popularcomingsoon_150_8,"Acesso Antecipado, Um Jogador, Boa Trama, Sobrevivência, Aventura, Simulação, Simulador de Vida Real, Faça o que Quiser, Atmosférico, Fantasia, 3D, Construção de Bases, Gótico, Construção, Jogador X Ambiente (PvE), Ação / Aventura, Ação, RPG de Ação, Mundo Aberto, Gerenciamento"
The Crazy Hyper-Dungeon Chronicles,"Oct 23, 2025",Indefinido,https://store.steampowered.com/app/2510490/The_Crazy_HyperDungeon_Chronicles/?snr=1_7_7_popularcomingsoon_150_8,"RPG, Explorador de Calabouços, Aventura, Fantasia, Boa Trama, Combate em Turnos, Exploração, Gráficos Pixelados, Um Jogador, 2D, Visão Superior, Engraçado, Retrô, Calabouço Misterioso, RPG de Ação, Protagonista Mulher, Colorido, Estratégia em Turnos, Combate, Eventos Rápidos"
MISERY,"Oct 23, 2025",Indefinido,https://store.steampowered.com/app/2119830/MISERY/?snr=1_7_7_popularcomingsoon_150_8,"Cooperativo On-line, Sobrevivência, Multijogador, Jogador X Ambiente (PvE), Terror, Fabricação, Cooperativo, Pós-Apocalíptico, Geração Procedural, Terror de Sobrevivência, Mundo Aberto, Construção, Exploração, Construção de Bases, Sobrevivência em Mundo Aberto, Roguelike de Ação, Aventura, Tiro, Simulador Imersivo, Atmosférico"
Once Upon A KATAMARI,"Oct 23, 2025",$39.99,https://store.steampowered.com/app/1880620/Once_Upon_A_KATAMARI/?snr=1_7_7_popularcomingsoon_150_8,"Ação, Aventura, 3D, Um Jogador, Histórico, Personalização de Personagem, Controle, Tutorial, Casual, Multijogador, Boa Trama"
Death Frame,"Oct 24, 2025",Indefinido,https://store.steampowered.com/app/3204110/Death_Frame/?snr=1_7_7_popularcomingsoon_150_8,"Aventura, Ação, Terror, Terror Psicológico, Simulação, Surrealista, Soulslike, Noir, Ficção Interativa, Psicodélico, Boa Trama, Thriller, Mistério, Plataforma, Sombrio, Comovente, Terror de Sobrevivência, Exploração, Psicológico, Atmosférico"
Swim Meet,"Oct 24, 2025",Indefinido,https://store.steampowered.com/app/467740/Swim_Meet/?snr=1_7_7_popularcomingsoon_150_8,"Escolha a sua Aventura, Romance Visual, Ficção Interativa, Simulador de Encontros, 2D, Fofo, Engraçado, Você Decide, Boa Trama, Casual, Anime, Colorido, Demônios, Mágica, Viagem no Tempo, Comédia, Drama, Aventura, Moderno, Sobrenatural"
Simon the Sorcerer Origins,"Oct 28, 2025",Indefinido,https://store.steampowered.com/app/1939890/Simon_the_Sorcerer_Origins/?snr=1_7_7_popularcomingsoon_150_8,"Aventura, Apontar e Clicar, Quebra-Cabeça, 2D, Anos 90, Atmosférico, Comédia, Engraçado, Boa Trama, Um Jogador, Narrativa, Fantasia, Mágica, Para Toda a Família, Desenhado à Mão, Colorido, Controle, FMV, Exploração, Desenho Animado"
Guild Wars 2: Visions of Eternity™ Expansion,"Oct 28, 2025",$24.99,https://store.steampowered.com/app/3845870/Guild_Wars_2_Visions_of_Eternity_Expansion/?snr=1_7_7_popularcomingsoon_150_8,"Aventura, Gratuito para Jogar, RPG, Multijogador Massivo"
The Outer Worlds 2,"Oct 29, 2025",$69.99,https://store.steampowered.com/app/1449110/The_Outer_Worlds_2/?snr=1_7_7_popularcomingsoon_150_8,"RPG, RPG de Ação, Exploração, Mundo Aberto, Primeira Pessoa, Um Jogador, Aventura, Ação, LGBTQIA+, Política, Político, Ficção Científica, Simulador Político, Você Decide, Boa Trama, Capitalismo, Protagonista Mulher, Terceira Pessoa"
Yunyun Syndrome!? Rhythm Psychosis,"Oct 30, 2025",Indefinido,https://store.steampowered.com/app/2914150/Yunyun_Syndrome_Rhythm_Psychosis/?snr=1_7_7_popularcomingsoon_150_8,"Ritmo, Terror Psicológico, Anime, Vários Finais, Fofo, Simulação, Um Jogador, Psicológico, Indie, Simulador Imersivo, Aventura, Música, Romance Visual"
DevilConnection,"Oct 30, 2025",Indefinido,https://store.steampowered.com/app/3054820/DevilConnection/?snr=1_7_7_popularcomingsoon_150_8,"Indie, Vários Finais, Escolha a sua Aventura, Ficção Interativa, Fantasia Sombria, Humor Ácido, Terror Psicológico, Para Adultos, Boa Trama, Demônios, Romance Visual, Comovente, Manipulação de Tempo, Anime, Mágica, Colete Tudo, Um Jogador, Aventura, Fantasia, Fofo"
DRAGON QUEST I & II HD-2D Remake,"Oct 30, 2025",$59.99,https://store.steampowered.com/app/2893570/DRAGON_QUEST_I__II_HD2D_Remake/?snr=1_7_7_popularcomingsoon_150_8,"RPG, 2,5D, Gráficos Pixelados, Anos 80, Atmosférico, Comovente, Fantasia, Enredo Rico, Mágica, Combate, Combate em Turnos, Um Jogador, Colorido, Fofo, Nostalgia, Velha-Guarda, RPG de Grupos, Remake, Em Turnos, JRPG"
ARC Raiders,"Oct 30, 2025",Indefinido,https://store.steampowered.com/app/1808500/ARC_Raiders/?snr=1_7_7_popularcomingsoon_150_8,"Tiro de Extração, Jogador X Ambiente (PvE), Jogador x Jogador (PvP), Tiro em Terceira Pessoa, Multijogador, Tiro, Sobrevivência, Cooperativo On-line, Pós-Apocalíptico, Ação, Fabricação, Atmosférico, Ficção Científica, Gerenciamento de Inventário, Realístico, Mundo Aberto, Terceira Pessoa, Futurista, Personalização de Personagem, Combate"
Welcome To The Dark Place,October 2025,Free,https://store.steampowered.com/app/1135700/Welcome_To_The_Dark_Place/?snr=1_7_7_popularcomingsoon_150_8,"Indie, Aventura, Gratuito para Jogar, Violento, Violência Detalhada, Terror Psicológico, Baseado em Texto, Mistério, Atmosférico, Exploração, Ficção Interativa, Terror, Hentai"
Age Of Warbots,October 2025,Indefinido,https://store.steampowered.com/app/3371630/Age_Of_Warbots/?snr=1_7_7_popularcomingsoon_150_8,"Acesso Antecipado, Faça o que Quiser, Simulação, Física, Jogo de Guerra, Estratégia, Ficção Científica, Robôs, Editor de Níveis, Combate, Futurista, Estratégia em Tempo Real (RTS), Ação, Tática em Tempo Real, Tático, Personalização de Personagem, Compatível com Mods, Tiro, Terceira Pessoa, Jogador X Ambiente (PvE)"
Tabletop Tavern,October 2025,Indefinido,https://store.steampowered.com/app/3337380/Tabletop_Tavern/?snr=1_7_7_popularcomingsoon_150_8,"Estratégia, Estratégia em Tempo Real (RTS), Tática em Tempo Real, Roguelite, Jogo de Guerra, Roguelike, Medieval, Histórico, Fantasia, Jogo de Mesa, Isométrico, Minimalista, Gerenciamento, Combate, 3D, Vários Finais, Não Linear, Gerenciamento de Recursos, Um Jogador, Atmosférico"
Pipkin,October 2025,Indefinido,https://store.steampowered.com/app/1915520/Pipkin/?snr=1_7_7_popularcomingsoon_150_8,"Coleção de Criaturas, JRPG, Fofo, Combate em Turnos, Colete Tudo, Gráficos Pixelados, Anime, Indie, RPG Maker, RPG, Aventura, Retrô, Atmosférico, RPG de Grupos, Visão Superior, Um Jogador, Boa Trama, Fantasia, Kickstarter"
绯红编年史 ~ Chronicle of Scarlet ~,October 2025,Indefinido,https://store.steampowered.com/app/3117660/__Chronicle_of_Scarlet/?snr=1_7_7_popularcomingsoon_150_8,"Estratégia, Aventura, JRPG, Tática por Turnos, RPG, 2D, Protagonista Mulher, Visão Superior, Boa Trama, Anime, Gráficos Pixelados, Vampiros, Gótico, Mitologia, Mágica, Drama, Combate, Um Jogador"
H9,October 2025,Indefinido,https://store.steampowered.com/app/3689990/H9/?snr=1_7_7_popularcomingsoon_150_8,"Indie, Violência Detalhada, Aventura, Fofo, Terror Psicológico, Romance Visual, Terror"
Retrace The Light,October 2025,Indefinido,https://store.steampowered.com/app/2179370/Retrace_The_Light/?snr=1_7_7_popularcomingsoon_150_8,"Ação, Aventura, RPG, Manipulação de Tempo, Visão Superior, 3D, Ação / Aventura, Exploração, Quebra-Cabeça, Terceira Pessoa, Ficção Científica, Fantasia, Estilizado, Robôs, Distópico, Futurista, Steampunk, Parar o Tempo, Corredor, Um Jogador"
Terminator 2D: NO FATE,"Oct 31, 2025",Indefinido,https://store.steampowered.com/app/1718460/Terminator_2D_NO_FATE/?snr=1_7_7_popularcomingsoon_150_8,Sem gênero
Mina the Hollower,"Oct 31, 2025",Indefinido,https://store.steampowered.com/app/1875580/Mina_the_Hollower/?snr=1_7_7_popularcomingsoon_150_8,"Plataforma 2D, Ação / Aventura, Protagonista Mulher, Plataforma, 2D, Visão Superior, Gótico, Ação, Controle, Terror, Gráficos Pixelados, Colorido, Fantasia Sombria, Fantasia, Ciência, Aventura, Atmosférico, Sobrenatural, Um Jogador, Combate"
Walk of Life,October 2025,Indefinido,https://store.steampowered.com/app/1910150/Walk_of_Life/?snr=1_7_7_popularcomingsoon_150_8,"Acesso Antecipado, Simulador de Vida Real, Reúna a Galera, Engraçado, Local para 4 Jogadores, Multijogador, Estratégia, Para Toda a Família, Casual, Jogo de Tabuleiro, Anos 90, Jogo de Mesa, Cartunizado, Gerenciamento de Tempo, 2D, Colorido, Fofo, Relaxante, Controle, Simulação"
There Are No Orcs,October 2025,Indefinido,https://store.steampowered.com/app/3480990/There_Are_No_Orcs/?snr=1_7_7_popularcomingsoon_150_8,"Estratégia em Tempo Real (RTS), Defesa de Torres, Construção de Cidades, Batalha Automática, Cartas, Jogo de Guerra, Estratégia, Construção de Bases, Roguelite, Medieval, Fantasia, Militar, Gráficos Pixelados, Guerra, Engraçado, Mágica, Montagem de Decks, 2D, Um Jogador, Indie"
Gambonanza,October 2025,Indefinido,https://store.steampowered.com/app/3509230/Gambonanza/?snr=1_7_7_popularcomingsoon_150_8,"Estratégia, Xadrez, Jogo de Tabuleiro, Roguelike, Roguelite, Tática por Turnos, 2D, Gráficos Pixelados, Estilizado, Anos 80, Mistério, Psicodélico, Retrô, Surrealista, Tático, Inteligência Artificial, Você Decide, Montagem de Decks, Geração Procedural, Jogador X Ambiente (PvE)"
Dice Legends,October 2025,Indefinido,https://store.steampowered.com/app/3112170/Dice_Legends/?snr=1_7_7_popularcomingsoon_150_8,"Montagem de Decks Roguelike, Explorador de Calabouços, Batalha com Cartas, Cartas, Roguelike, Montagem de Decks, Combate em Turnos, Só Mouse, Indie, Alta Rejogabilidade, Gráficos Pixelados, 2D, Fantasia, Um Jogador"
House Flipper 2 - Scooby-Doo DLC,October 2025,Indefinido,https://store.steampowered.com/app/3672960/House_Flipper_2__ScoobyDoo_DLC/?snr=1_7_7_popularcomingsoon_150_8,"Simulação, Casual, Relaxante, Construção, Cooperativo, Design e Ilustração, Para Toda a Família, Alta Rejogabilidade, Faça o que Quiser, Destruição, Cooperativo On-line, Colorido, Simulador Imersivo, 3D, Um Jogador, Indie, Construção de Bases, Primeira Pessoa, Educativo, Realístico"
Misty Valley: A Cozy Fishing Tale,October 2025,Indefinido,https://store.steampowered.com/app/3677310/Misty_Valley_A_Cozy_Fishing_Tale/?snr=1_7_7_popularcomingsoon_150_8,"Acesso Antecipado, Simulação, Pesca, Relaxante, Mundo Aberto, Naval, Agricultura, Fabricação, Exploração, Estilizado, Fofo, Colorido, Atmosférico, Natureza, Para Toda a Família, Simulador Imersivo, Simulador de Vida Real, Um Jogador, Primeira Pessoa, Tiro em Primeira Pessoa (FPS)"
Flesh Made Fear,"Oct 31, 2025",Indefinido,https://store.steampowered.com/app/3316350/Flesh_Made_Fear/?snr=1_7_7_popularcomingsoon_150_8,"Ação, Terror, Tiro em Terceira Pessoa, Retrô, Mistério, Zumbis, Velha-Guarda, Gráficos Pixelados, Anos 90, Atmosférico, Terror Psicológico, Thriller, Ação / Aventura, Terceira Pessoa, 3D, Indie, Controle, Um Jogador, Tiro, Combate"
Farming Simulator 25: Highlands Fishing Expansion,"Nov 4, 2025",$26.99,https://store.steampowered.com/app/3453970/Farming_Simulator_25_Highlands_Fishing_Expansion/?snr=1_7_7_popularcomingsoon_150_8,"Simulação, Simulador Rural, Realístico, 3D, Primeira Pessoa, Simulador Imersivo, Gerenciamento de Tempo, Economia, Multijogador, Terceira Pessoa, Construção, Gerenciamento, Atmosférico, Relaxante, Natureza, Cooperativo On-line, Rural, Física, Um Jogador, Compatível com Mods"
Cairn,"Nov 5, 2025",Indefinido,https://store.steampowered.com/app/1588550/Cairn/?snr=1_7_7_popularcomingsoon_150_8,"Aventura, Exploração, Atmosférico, Esportes, Mundo Aberto, Simulador de Caminhada, Um Jogador, Imersivo, Alta Rejogabilidade, Cinematográfico, Gerenciamento de Inventário, Difícil, Sobrevivência, Ação, Boa Trama, Gerenciamento de Recursos, Física, Simulação, Trilha Sonora, Terceira Pessoa"
Goodnight Universe,"Nov 11, 2025",Indefinido,https://store.steampowered.com/app/2416100/Goodnight_Universe/?snr=1_7_7_popularcomingsoon_150_8,"Aventura, Comovente, Cinematográfico, Boa Trama, Ficção Interativa, Apontar e Clicar, Estilizado, Ficção Científica, Primeira Pessoa, Colorido, Mistério, Drama, Cartunizado, Indie, Narrativa, Fofo, Simulador Imersivo, Linear, Um Jogador, 3D"
INAZUMA ELEVEN: Victory Road,"Nov 13, 2025",$69.99,https://store.steampowered.com/app/2799860/INAZUMA_ELEVEN_Victory_Road/?snr=1_7_7_popularcomingsoon_150_8,"Esportes, Futebol, RPG, Colete Tudo, Jogador x Jogador (PvP), Competitivo, Anime, 3D, Personalização de Personagem, Boa Trama, Montagem de Decks, Ação, Tático, Drama, Futebol Americano, Um Jogador, Comovente, Multijogador, Imersivo, JRPG"
Anno 117: Pax Romana,"Nov 13, 2025",$59.99,https://store.steampowered.com/app/3274580/Anno_117_Pax_Romana/?snr=1_7_7_popularcomingsoon_150_8,"Estratégia, Simulação, Construção de Cidades, Estratégia em Tempo Real (RTS), Faça o que Quiser, Escolha a sua Aventura, Exploração, Construção, Economia, Histórico, Gerenciamento, Político, Você Decide, Gerenciamento de Recursos, Boa Trama, Um Jogador, Multijogador, Cooperativo On-line, Roma"
Peace Island,"Nov 17, 2025",Indefinido,https://store.steampowered.com/app/1753870/Peace_Island/?snr=1_7_7_popularcomingsoon_150_8,"Acesso Antecipado, Aventura, RPG, Indie, Casual, Gatos, Mundo Aberto, Boa Trama, Exploração, História Alternativa, Bonito, Natureza, Protagonista Mulher"
SpongeBob SquarePants: Titans of the Tide,Coming soon,$35.99,https://store.steampowered.com/app/2479650/SpongeBob_SquarePants_Titans_of_the_Tide/?snr=1_7_7_popularcomingsoon_150_8,"Para Toda a Família, Boa Trama, Plataforma 3D, Ação, Plataforma com Quebra-Cabeça, Aventura, Colete Tudo, Plataforma, 3D, Terceira Pessoa, Engraçado, Narração, Comédia, Desenho Animado, Um Jogador"
Constance,"Nov 24, 2025",Indefinido,https://store.steampowered.com/app/2313700/Constance/?snr=1_7_7_popularcomingsoon_150_8,"Metroidvania, Plataforma, 2D, Ação, Um Jogador, Aventura, Desenhado à Mão, Indie, Comovente, Mistério, Exploração, Atmosférico, Não Linear, Boa Trama, Psicológico, Mundo Aberto, Fofo, Controle, Protagonista Mulher, Câmera Lateral"
