title,release_date,price,game_url,genres
Hoglands,Q4 2025,Indefinido,https://store.steampowered.com/app/2210240/Hoglands/?snr=1_7_7_popularcomingsoon_150_13,"Câmera Lateral, Exploração, Construção de Cidades, Faça o que Quiser, Defesa de Torres, Plataforma, Estratégia em Tempo Real (RTS), Personalização de Personagem, RPG, Estratégia, 2D, Construção de Bases, Mundo Aberto, Ação, Gerenciamento, Medieval, Fantasia, Atmosférico, Construção, Fabricação"
ENDALOR,2025,Indefinido,https://store.steampowered.com/app/2265990/ENDALOR/?snr=1_7_7_popularcomingsoon_150_13,"Acesso Antecipado, Sobrevivência em Mundo Aberto, Sobrevivência, Cooperativo On-line, Mundo Aberto, Multijogador, Ação, Construção, Medieval, Construção de Bases, RPG, Fabricação, Soulslike, Cooperativo, Aventura, Ação / Aventura, Faça o que Quiser, Exploração, Indie, Terceira Pessoa"
The Way of Wrath,2025,Indefinido,https://store.steampowered.com/app/969330/The_Way_of_Wrath/?snr=1_7_7_popularcomingsoon_150_14,"RPG, Personalização de Personagem, Você Decide, Boa Trama, Combate em Turnos, Dungeons & Dragons, CRPG, Aventura, Romance, Fantasia, Estratégia, Estratégia em Turnos, Mundo Aberto, Fantasia Sombria, Um Jogador, Campanha Cooperativa, Baseado em Classes, RPG de Estratégia, Combate, RPG de Grupos"
He Who Watches,2025,Indefinido,https://store.steampowered.com/app/1070500/He_Who_Watches/?snr=1_7_7_popularcomingsoon_150_14,"Sokoban, Tiro em Primeira Pessoa (FPS), Plataforma com Quebra-Cabeça, Explorador de Calabouços, Quebra-Cabeça, Arco e Flecha, Difícil, Plataforma, 3D, Primeira Pessoa, Enredo Rico, Controle, Linear, Vários Finais, Boa Trama, Estilizado, Fantasia Sombria, Lógica, Seis Graus de Liberdade, Atmosférico"
Flea Madness,2025,Indefinido,https://store.steampowered.com/app/1025560/Flea_Madness/?snr=1_7_7_popularcomingsoon_150_14,"Multijogador, Ação, Engraçado, Jogador X Ambiente (PvE), Terceira Pessoa, Aventura, Ação / Aventura, Jogador x Jogador (PvP), Cooperativo On-line, Alienígenas, Comédia, Baseado em Equipes, Indie, Personalização de Personagem, Colorido, Luta 3D, Ritmo Rápido, MOBA, Física, Competitivo"
Among Ripples: Shallow Waters,2025,Indefinido,https://store.steampowered.com/app/1096090/Among_Ripples_Shallow_Waters/?snr=1_7_7_popularcomingsoon_150_14,"Simulação, Estratégia, Natureza, Trilha Sonora Boa, Faça o que Quiser, Subaquático, Um Jogador, Estilizado, Colorido, Ciência, Gerenciamento, Relaxante, Atmosférico, Indie, Construção, Sequência, Simulador de Vida Real, Narração, Gerenciamento de Recursos"
Rune Fencer Illyia,2025,Indefinido,https://store.steampowered.com/app/1104600/Rune_Fencer_Illyia/?snr=1_7_7_popularcomingsoon_150_14,"Ação, Aventura, Metroidvania, Ação / Aventura, Plataforma, Exploração, Hack and Slash, Câmera Lateral, Soulslike, 2D, Atmosférico, Sombrio, Fantasia Sombria, Fantasia, Difícil, Espada, Combate, Fofo, Mágica, Controle"
Realms of Madness,2025,Indefinido,https://store.steampowered.com/app/2501920/Realms_of_Madness/?snr=1_7_7_popularcomingsoon_150_14,"Estratégia em Tempo Real (RTS), Estratégia, Tática em Tempo Real, Construção de Cidades, Fantasia Sombria, Combate Naval, Construção de Bases, Fantasia, Tático, Mágica, Medieval, Economia, Dragões, Mitologia, 2D, Combate, Histórico, Militar, Um Jogador, Subaquático"
Shadows of the Afterland,2025,Indefinido,https://store.steampowered.com/app/2506100/Shadows_of_the_Afterland/?snr=1_7_7_popularcomingsoon_150_14,"Apontar e Clicar, Comédia, Aventura, Atmosférico, Protagonista Mulher, Engraçado, Gráficos Pixelados, Quebra-Cabeça, 2D, Um Jogador, Sobrenatural, Drama, Boa Trama, Exploração, Humor Ácido, Investigação, Detetive, Indie, Casual, Baseado em Texto"
GARBAGE COUNTRY,2025,Indefinido,https://store.steampowered.com/app/2530870/GARBAGE_COUNTRY/?snr=1_7_7_popularcomingsoon_150_14,"Atmosférico, Exploração, Direção, Aventura, Visão Superior, Gráficos Pixelados, Pós-Apocalíptico, Simulador de Caminhada, Defesa de Torres, Ação, Plataforma, Corrida com Combate, SHMUP com Visão Superior, 3D, Estilizado, Voxel, Fabricação, Distópico, Mistério, Ficção Científica"
Mixtape,2025,Indefinido,https://store.steampowered.com/app/2582320/Mixtape/?snr=1_7_7_popularcomingsoon_150_14,"Aventura, Música, Narrativa, Um Jogador, Trilha Sonora, Em Grupos, Casual, Anos 80, Anos 90, Exploração, Indie, 3D, Colorido, Terceira Pessoa, Atmosférico, Boa Trama"
Evercore Heroes : Ascension,2025,Indefinido,https://store.steampowered.com/app/2586780/Evercore_Heroes__Ascension/?snr=1_7_7_popularcomingsoon_150_14,"Combate, Acesso Antecipado, Cooperativo On-line, Cooperativo, Baseado em Equipes, Explorador de Calabouços, Roguelite, Hack and Slash, Baseado em Classes, Jogador X Ambiente (PvE), Alta Rejogabilidade, Difícil, Multijogador, Ação, Roguelike de Ação, Roguelike, Mágica, Fantasia, Um Jogador, Isométrico"
爱之巢,2025,Indefinido,https://store.steampowered.com/app/2595110/Love_Nest/?snr=1_7_7_popularcomingsoon_150_14,"Simulador de Encontros, Terror Psicológico, Boa Trama, Fuja da Sala, Fofo, Ficção Interativa, Romance, Quebra-Cabeça, RPG, Exploração, Clique e Clique, Romance Visual, Narração Dinâmica, 2D, Vários Finais, Anime, Desenho Animado, Drama, Atmosférico, Comovente"
I Hate This Place,2025,Indefinido,https://store.steampowered.com/app/2604490/I_Hate_This_Place/?snr=1_7_7_popularcomingsoon_150_14,"Terror de Sobrevivência, História em Quadrinhos, Isométrico, Fabricação, Sobrevivência, Furtivo, Terror, Exploração, Aventura, Ação / Aventura, Quebra-Cabeça, Mistério, Estilizado, Sobrenatural, Psicodélico, Humor Ácido, Anos 80, Atmosférico, Demônios, Surrealista"
Park Ranger Simulator,2025,Indefinido,https://store.steampowered.com/app/2622690/Park_Ranger_Simulator/?snr=1_7_7_popularcomingsoon_150_14,"Simulação, Casual, Natureza, Multijogador, Cooperativo On-line, Faça o que Quiser, Exploração, 3D, Realístico, Primeira Pessoa, Caça, Gerenciamento, Estrada de Terra, Controle, Mundo Aberto, Física, Cooperativo, Um Jogador, Ação, Aventura"
Pompeii: The Legacy,2025,Indefinido,https://store.steampowered.com/app/2632240/Pompeii_The_Legacy/?snr=1_7_7_popularcomingsoon_150_14,"Construção de Cidades, Simulador de Colônias, Roma, Simulação, Estratégia, Narração, Economia, Boa Trama, Histórico, Simulador Imersivo, Simulador Político, Um Jogador, 3D, Isométrico, Construção de Bases, Personalização de Personagem, Você Decide, Compatível com Mods, Gerenciamento de Recursos"
Dungeons Deep,2025,Indefinido,https://store.steampowered.com/app/2636460/Dungeons_Deep/?snr=1_7_7_popularcomingsoon_150_14,"Ação, Aventura, RPG, Mitologia, RPG de Ação, Combate, Roguelike de Ação, Hack and Slash, Soulslike, Explorador de Calabouços, Ação / Aventura, Roguelike, Terceira Pessoa, Zumbis, Fantasia Sombria, Protagonista Mulher, Fantasia, Demônios, Cooperativo, Mágica"
Building Relationships,2025,Indefinido,https://store.steampowered.com/app/2666920/Building_Relationships/?snr=1_7_7_popularcomingsoon_150_14,"Exploração, Aventura, Comédia, Simulador de Encontros, Pesca, Mundo Aberto, Gráficos Pixelados, LGBTQIA+, Curta-Metragem, Romance, Um Jogador, Surrealista, Conversas, Engraçado, Retrô, Relaxante, Casual, Aconchegante, Fofo, 3D"
Extinction Day,Q4 2025,Indefinido,https://store.steampowered.com/app/2682380/Extinction_Day/?snr=1_7_7_popularcomingsoon_150_14,"Estratégia, Simulação, Simulador de Epidemias, Pós-Apocalíptico, Faça o que Quiser, Atmosférico, 3D, Destruição, Simulador Político, Gerenciamento, Jogo de Divindade, Gerenciamento de Recursos, Um Jogador, Sombrio, Acesso Antecipado, Difícil, Indie, Alta Rejogabilidade"
Island of Winds,2025,Indefinido,https://store.steampowered.com/app/1689340/Island_of_Winds/?snr=1_7_7_popularcomingsoon_150_14,"Aventura, Quebra-Cabeça, Exploração, Natureza, Atmosférico, Comovente, Coleção de Criaturas, Enredo Rico, Ação / Aventura, Mitologia, Boa Trama, Realístico, Terceira Pessoa, Fantasia, Protagonista Mulher, 3D, Linear, Um Jogador, Indie, Ação"
Project Haven,2025,Indefinido,https://store.steampowered.com/app/443190/Project_Haven/?snr=1_7_7_popularcomingsoon_150_14,"Combate em Turnos, Estratégia em Turnos, Morte Permanente, Compatível com Mods, Tática por Turnos, Atmosférico, Sombrio, Cooperativo, Em Turnos, Furtivo, Campanha Cooperativa, Boa Trama, Ação, Multijogador, Estratégia, Difícil, Tático, RPG, Um Jogador, Jogador x Jogador (PvP)"
UNYIELDER,2025,Indefinido,https://store.steampowered.com/app/789940/UNYIELDER/?snr=1_7_7_popularcomingsoon_150_14,"RPG, Tiro com Saques, Chuva de Balas, Tiro em Primeira Pessoa (FPS), Tiro, Roguelike, Roguelite, Estilizado, Duelo contra Chefões, Futurista, 3D, Primeira Pessoa, Um Jogador, Combate, Ação, Robôs, Ficção Científica, Mechas, Jogador X Ambiente (PvE), Atmosférico"
Sparkball,Q4 2025,Free,https://store.steampowered.com/app/672890/Sparkball/?snr=1_7_7_popularcomingsoon_150_14,"Esportes, MOBA, Jogador x Jogador (PvP), Baseado em Equipes, Cooperativo On-line, Multijogador, Competitivo, Estratégia, Ação, Tático, Gratuito para Jogar, Tática em Tempo Real, Cooperativo, 3D, Estilizado, Futurista, Ficção Científica, Combate, Colorido, Fantasia"
Arctic Awakening,2025,Indefinido,https://store.steampowered.com/app/1275550/Arctic_Awakening/?snr=1_7_7_popularcomingsoon_150_14,"Atmosférico, Simulador de Caminhada, Aventura, Boa Trama, Mistério, Indie, Você Decide, Exploração, Ficção Científica, Narrativa, Mundo Aberto, Sobrevivência, Robôs, Thriller, Escolha a sua Aventura, Primeira Pessoa, Um Jogador, 3D, Drama, Terror"
Dead Static Drive,2025,Indefinido,https://store.steampowered.com/app/1166940/Dead_Static_Drive/?snr=1_7_7_popularcomingsoon_150_14,"Indie, Ação, Aventura, Violento, Lovecraftiano, 3D, Sobrenatural, Isométrico, Terror de Sobrevivência, Controle, Protagonista Mulher, RPG de Ação, CRPG, Colorido, Fantasia Sombria, Demônios, Personalização de Personagem, Você Decide, RPG, Roguelike"
Legends of Astravia,2025,Indefinido,https://store.steampowered.com/app/1233680/Legends_of_Astravia/?snr=1_7_7_popularcomingsoon_150_14,"Exploração, JRPG, RPG de Grupos, RPG, Linear, Boa Trama, Combate em Turnos, Colorido, Gráficos Pixelados, Mágica, Fantasia, Atmosférico, Drama, Aventura, Anos 90, Velha-Guarda, Retrô, Um Jogador, Nostalgia, Indie"
Kromlech,2025,Indefinido,https://store.steampowered.com/app/2406680/Kromlech/?snr=1_7_7_popularcomingsoon_150_14,"Acesso Antecipado, Ação, RPG, RPG de Ação, Roguelike de Ação, Narração, Aventura, Soulslike, Metroidvania, Terceira Pessoa, Mundo Aberto, Ficção Interativa, Roguelite, Exploração, Escolha a sua Aventura, Drama, 3D, Realístico, Mistério, Fantasia Sombria"
Last Moon,2025,Indefinido,https://store.steampowered.com/app/1108600/Last_Moon/?snr=1_7_7_popularcomingsoon_150_14,"Aventura, Ação, Um Jogador, RPG, 2D, Fantasia, RPG de Ação, Gráficos Pixelados, Indie, Exploração, Fofo, Colorido, Atmosférico, Retrô, Soulslike, Desenhado à Mão, Mundo Aberto, Trilha Sonora Boa, Metroidvania, Controle"
Jupiter Moons: Mecha🦾,2025,Indefinido,https://store.steampowered.com/app/1288540/Jupiter_Moons_Mecha/?snr=1_7_7_popularcomingsoon_150_14,"Montagem de Decks Roguelike, Mechas, Montagem de Decks, Cartas, Gerenciamento de Inventário, Batalha com Cartas, Roguelite, Estratégia, Ficção Científica, RPG, Roguelike, Combate em Turnos, RPG Tático, Explorador de Calabouços, Personalização de Personagem, Um Jogador, RPG de Estratégia, Espacial, 2D, Estratégia em Turnos"
Barkour,2025,Indefinido,https://store.steampowered.com/app/1920290/Barkour/?snr=1_7_7_popularcomingsoon_150_14,"Ação / Aventura, Cachorros, Plataforma 3D, Tiro em Terceira Pessoa, Furtivo, Cartunizado, Combate, Um Jogador, Estilizado, Engraçado, Comédia, Futurista, Parkour, Ação, Personalização de Personagem, Aventura, Jogador X Ambiente (PvE), Exploração, Plataforma com Quebra-Cabeça, Terceira Pessoa"
Bytebond,2025,Indefinido,https://store.steampowered.com/app/1952690/Bytebond/?snr=1_7_7_popularcomingsoon_150_14,"Controle, Um Jogador, Ação, Aventura, Atmosférico, Multijogador, Ação / Aventura, Casual, Ficção Científica, Cooperativo On-line, Cooperativo, Fofo, Relaxante, Física, Quebra-Cabeça, Plataforma, Visão Superior, Para Toda a Família, 2,5D, Robôs"
SUFFOCATE,2025,Indefinido,https://store.steampowered.com/app/1965270/SUFFOCATE/?snr=1_7_7_popularcomingsoon_150_14,"Terror, Terror de Sobrevivência, Sobrenatural, Zumbis, Quebra-Cabeça, Conteúdo Sexual, Um Jogador, Sombrio, Terror Psicológico, Atmosférico, Furtivo, Primeira Pessoa, Boa Trama, Aventura, Ação, Exploração, Violento, Simulador de Caminhada, Simulador Imersivo, Fé"
Toroa: Skycall,2025,Indefinido,https://store.steampowered.com/app/2003490/Toroa_Skycall/?snr=1_7_7_popularcomingsoon_150_14,"Exploração, Relaxante, Voo, Atmosférico, Casual, Aventura, Comovente, Linear, Surrealista, Natureza, Estilizado, Simulador de Caminhada, 3D, RPG, Terceira Pessoa, Um Jogador, Boa Trama, Narração, Para Toda a Família, Cinematográfico"
Hello Again,2025,Indefinido,https://store.steampowered.com/app/2052710/Hello_Again/?snr=1_7_7_popularcomingsoon_150_14,"Quebra-Cabeça, Exploração, Viagem no Tempo, Mistério, Fofo, Engraçado, Boa Trama, Apontar e Clicar, Aventura, 2D, Visão Superior, Detetive, Manipulação de Tempo, Colorido, Minimalista, Estilizado, Investigação, Indie, Um Jogador, Para Toda a Família"
Salvus: Aries,2025,Indefinido,https://store.steampowered.com/app/2104400/Salvus_Aries/?snr=1_7_7_popularcomingsoon_150_14,"Otome, Romance, Romance Visual, Protagonista Mulher, Fantasia, Ficção Interativa, Simulação, Boa Trama, Anime, Aventura, Escolha a sua Aventura, Você Decide, Fofo, Narração, 2D, Clique e Clique, Colorido, Um Jogador, Indie, Conteúdo Sexual"
Título não disponível,Data não informada,Indefinido,https://store.steampowered.com/app/2173460/Echoes_of_the_Living/?snr=1_7_7_popularcomingsoon_150_14,Sem gênero
EbiTapes,2025,Indefinido,https://store.steampowered.com/app/2221850/EbiTapes/?snr=1_7_7_popularcomingsoon_150_14,"Aventura, Casual, Exploração, Fofo, Colorido, Do Bem, Música, Aconchegante, 2,5D, Desenhado à Mão, Atmosférico, Comovente, Engraçado, Não Linear, Um Jogador, Desenho Animado, Quebra-Cabeça, Ritmo, Natureza, Cartunizado"
Ascendance,2025,Indefinido,https://store.steampowered.com/app/2275750/Ascendance/?snr=1_7_7_popularcomingsoon_150_14,"Acesso Antecipado, Estratégia, 4X, Grande Estratégia, Estratégia em Tempo Real (RTS), Simulação, Espacial, Ficção Científica, Mundo Aberto, Gerenciamento de Recursos, Automação, Exploração, Futurista, Economia, Gerenciamento, Tático, Você Decide, Compatível com Mods, Diplomacia, 3D"
Clown Meat,2025,Indefinido,https://store.steampowered.com/app/2290870/Clown_Meat/?snr=1_7_7_popularcomingsoon_150_14,"Ação, Plataforma de Precisão, Plataforma 2D, Atmosférico, Boa Trama, Corrida, Plataforma, Surrealista, Distópico, Difícil, 2D, Humor Pesado, Desenho Animado, Terror, Vários Finais, Gráficos Pixelados, Psicodélico, LGBTQIA+, Filosófico, Humor Ácido"
Vessels of Decay,2025,Indefinido,https://store.steampowered.com/app/1425180/Vessels_of_Decay/?snr=1_7_7_popularcomingsoon_150_14,"Aventura, Gráficos Pixelados, Atmosférico, Ação / Aventura, Quebra-Cabeça, Hack and Slash, Ação, 2D, Colorido, Estilizado, Linear, RPG, Narração, Combate, Um Jogador, Luta 2D, RPG de Ação, Soulslike, Visão Superior, Pós-Apocalíptico"
Capital Command,2025,Indefinido,https://store.steampowered.com/app/1490930/Capital_Command/?snr=1_7_7_popularcomingsoon_150_14,"Espacial, Ficção Científica, Estratégia, Simulação, Estratégia em Tempo Real (RTS), Grande Estratégia, 4X, Guerra, Tático, Faça o que Quiser, Militar, Exploração, Compatível com Mods, Gerenciamento, Um Jogador, Futurista, Tempo Real com Pausa, Alta Rejogabilidade, Geração Procedural, Atmosférico"
Nanomon Virtual Pet,2025,Indefinido,https://store.steampowered.com/app/1498060/Nanomon_Virtual_Pet/?snr=1_7_7_popularcomingsoon_150_14,"Incremental, Fofo, Relaxante, Coleção de Criaturas, 2D, Anos 90, Do Bem, Simulação, Colete Tudo, Gráficos Pixelados, Casual, Colorido, Retrô, RPG, Exploração, Geração Procedural, Batalha Automática, Aconchegante, Um Jogador, Clique e Clique"
Tank Squad,2025,Indefinido,https://store.steampowered.com/app/1498130/Tank_Squad/?snr=1_7_7_popularcomingsoon_150_14,"Tanques, Segunda Guerra Mundial, Cooperativo, Combate com Veículos, Simulação, Ação, Guerra, Multijogador, Campanha Cooperativa, Militar, Tiro, Direção, Realístico, Gerenciamento, Simulador Imersivo, Tiro em Primeira Pessoa (FPS), Primeira Pessoa, Cooperativo On-line, Tático, Histórico"
Orc Warchief: Strategy City Builder,2025,Indefinido,https://store.steampowered.com/app/1505940/Orc_Warchief_Strategy_City_Builder/?snr=1_7_7_popularcomingsoon_150_14,"Estratégia, Indie, Faça o que Quiser, Construção de Bases, Estratégia em Tempo Real (RTS), Tático, Um Jogador, Realístico, Guerra, Simulação, Construção, Gerenciamento, Construção de Cidades, Violento, Economia, Mitologia, Tempo Real, Histórico, Ação, Ação / Aventura"
Neuroshima Hex,2025,Indefinido,https://store.steampowered.com/app/2324150/Neuroshima_Hex/?snr=1_7_7_popularcomingsoon_150_14,"Estratégia em Turnos, Jogo de Tabuleiro, Jogador x Jogador (PvP), Pós-Apocalíptico, Cartas, RPG, Steampunk, Jogo de Mesa, Tática por Turnos, RPG Tático, Multijogador, Estratégia, Sobrevivência, Enredo Rico, Militar, Tanques, Combate em Turnos, 2D, ATV, EUA"
The Lacerator,2025,Indefinido,https://store.steampowered.com/app/2339330/The_Lacerator/?snr=1_7_7_popularcomingsoon_150_14,"Terror de Sobrevivência, Terror, Assassino, Sobrevivência, Comédia, Vários Finais, Não Linear, Exploração, Gerenciamento de Inventário, Metroidvania, Anos 80, Sombrio, Retrô, Ação / Aventura, Quebra-Cabeça, Terceira Pessoa, Objetos Ocultos, Ação, 3D, Engraçado"
Finely Diced,2025,Indefinido,https://store.steampowered.com/app/2357970/Finely_Diced/?snr=1_7_7_popularcomingsoon_150_14,"Roguelite, Gerenciamento de Inventário, Montagem de Decks Roguelike, Gerenciamento de Recursos, Estratégia, Roguelike, Montagem de Decks, Só Mouse, Gerenciamento, Indie, Alta Rejogabilidade, Minimalista, Um Jogador, Difícil, Jogo de Tabuleiro, Estratégia em Turnos, Culinária, Gráficos Pixelados, Batalha com Cartas, Psicodélico"
Dream Channel Zero,2025,Indefinido,https://store.steampowered.com/app/2382810/Dream_Channel_Zero/?snr=1_7_7_popularcomingsoon_150_14,"Aventura, Surrealista, JRPG, 2D, RPG, Um Jogador, Indie, Gráficos Pixelados, Eventos Rápidos, Estilizado, Romance Visual, Boa Trama, Comédia, Fofo, Exploração, Terror"
Planetary Life,2025,Indefinido,https://store.steampowered.com/app/2471970/Planetary_Life/?snr=1_7_7_popularcomingsoon_150_14,"Acesso Antecipado, Jogo de Divindade, Faça o que Quiser, Simulação, Ciência, Natureza, Geração Procedural, Relaxante, Gerenciamento, Simulador de Vida Real, Simulador de Colônias, Fofo, Gerenciamento de Recursos, Engraçado, Para Toda a Família, Educativo, Atmosférico, Espacial, 3D, Colorido"
"Football, Tactics & Glory: World",4º trimestre de 2025,Indefinido,https://store.steampowered.com/app/2478710/Football_Tactics__Glory_World/?snr=1_7_7_popularcomingsoon_150_14,"Estratégia, Simulação, Estratégia em Turnos, Gerenciamento, RPG de Estratégia, Futebol, Tática por Turnos, Combate em Turnos, Visão Superior, Esportes, Tático, Jogador x Jogador (PvP), Você Decide, Jogador X Ambiente (PvE), Controle, Personalização de Personagem, Jogo de Mesa, Movimento em Grade, Baseado em Classes, Compatível com Mods"
Flower in Us,2025,Indefinido,https://store.steampowered.com/app/2482920/Flower_in_Us/?snr=1_7_7_popularcomingsoon_150_14,"Ficção Interativa, Quebra-Cabeça, Investigação, Romance Visual, Você Decide, Conversas, Vários Finais, Boa Trama, Mistério, RPG Maker, Aventura, Thriller, Drama, Anime, 2D, Câmera Lateral, Gráficos Pixelados, Indie, Simulação, Um Jogador"
Sword Hero,2025,Indefinido,https://store.steampowered.com/app/1739080/Sword_Hero/?snr=1_7_7_popularcomingsoon_150_14,"Física, Um Jogador, Mundo Aberto, Personalização de Personagem, Fantasia, Soulslike, Espada, Construção, Construção de Bases, Ação, Fabricação, Aventura, Combate, Exploração, Medieval, RPG, Terceira Pessoa, RPG de Ação, Jogador X Ambiente (PvE), Ação / Aventura"
Pool of Madness,2025,Free,https://store.steampowered.com/app/2873750/Pool_of_Madness/?snr=1_7_7_popularcomingsoon_150_15,"Acesso Antecipado, Lovecraftiano, Roguelite, Sombrio, Terror, Boa Trama, Geração Procedural, Bilhar, Terror Psicológico, Psicodélico, Roguelike, Multijogador, Cooperativo, Multijogador Local, Cooperativo Local, Cooperativo On-line, Atmosférico, Retrô, Ficção Interativa, Jogador x Jogador (PvP)"
Master of Command,2025,Indefinido,https://store.steampowered.com/app/2878450/Master_of_Command/?snr=1_7_7_popularcomingsoon_150_15,"Estratégia, Histórico, Grande Estratégia, Guerra, Estratégia em Turnos, Estratégia em Tempo Real (RTS), Em Turnos, Tático, Militar, Um Jogador, Tática em Tempo Real, RPG de Estratégia, Combate, EUA, Simulação, Jogo de Guerra, Indie, Ação, Trilha Sonora, Geração Procedural"
KILL THE WITCH,2025,Indefinido,https://store.steampowered.com/app/2878760/KILL_THE_WITCH/?snr=1_7_7_popularcomingsoon_150_15,"Plataforma 2D, Soulslike, Jogador X Ambiente (PvE), Plataforma, 2D, Fofo, Cyberpunk, Terror Psicológico, Boa Trama, Ação, Gráficos Pixelados, Anime, Ficção Científica, Comovente, Retrô, Sombrio, Combate, Um Jogador, Trilha Sonora, Indie"
The Backrooms Company,2025,Indefinido,https://store.steampowered.com/app/2886060/The_Backrooms_Company/?snr=1_7_7_popularcomingsoon_150_15,"Jogador X Ambiente (PvE), Terror, Primeira Pessoa, Cooperativo, Atmosférico, Cooperativo On-line, Ficção Científica, Terror de Sobrevivência, Exploração, Ação / Aventura, Ação, Terror Psicológico, Aventura, Engraçado, Personalização de Personagem, Objetos Ocultos, Coleção de Criaturas, Realístico, Explorador de Calabouços, Controle"
Active Matter,2025,Indefinido,https://store.steampowered.com/app/2887580/Active_Matter/?snr=1_7_7_popularcomingsoon_150_15,"Terror, Multijogador, Cooperativo On-line, Tiro em Primeira Pessoa (FPS), Atmosférico, Tiro, Jogador X Ambiente (PvE), Jogador x Jogador (PvP), Primeira Pessoa, 3D, Surrealista, Ação, Realístico, Multijogador Massivo, Ficção Científica, Saques, Sobrenatural, Combate, Gerenciamento de Inventário, Cooperativo"
AGRONOM,2025,Indefinido,https://store.steampowered.com/app/2893250/AGRONOM/?snr=1_7_7_popularcomingsoon_150_15,"Automação, Marte, Construção, Primeira Pessoa, Construção de Bases, Robôs, Fabricação, Mundo Aberto, Relaxante, Exploração, Simulador Rural, Inteligência Artificial, Aventura, Simulador Imersivo, Ficção Científica, Gerenciamento de Recursos, Estratégia, Um Jogador, 3D, Indie"
恋爱泡馍！青春老陕：Shannxi Love Story,2025,Indefinido,https://store.steampowered.com/app/3453470/Shannxi_Love_Story/?snr=1_7_7_popularcomingsoon_150_15,"RPG, Casual, Simulador de Encontros, Romance Visual, Jogo de Palavras, 2D, Anime, Fofo, Drama, Comovente, Indie, Simulação, Relaxante, Boa Trama, Um Jogador"
Lacey's Flash Games,2025,Indefinido,https://store.steampowered.com/app/3459340/Laceys_Flash_Games/?snr=1_7_7_popularcomingsoon_150_15,"Terror Psicológico, Um Jogador, Terror, Fofo, Apontar e Clicar, 2D, Sombrio, Boa Trama, Humor Ácido, Estilizado, Protagonista Mulher, Psicológico, Psicodélico, Ação, Ação / Aventura, Aventura, Você Decide, Mistério, Escolha a sua Aventura, Clique e Clique"
Harrowlands,2025,Indefinido,https://store.steampowered.com/app/3460400/Harrowlands/?snr=1_7_7_popularcomingsoon_150_15,"Acesso Antecipado, Construção de Bases, Construção de Cidades, Estratégia, Sobrevivência, Simulador de Colônias, Exploração, Geração Procedural, Gerenciamento, Enredo Rico, Fantasia, Simulação, Medieval, Visão Superior, RPG de Estratégia, Compatível com Mods, Pós-Apocalíptico, RPG Tático, Gerenciamento de Recursos, Fabricação"
Wall World 2,2025,Indefinido,https://store.steampowered.com/app/3467710/Wall_World_2/?snr=1_7_7_popularcomingsoon_150_15,"Roguelite, Mineração, Gráficos Pixelados, Defesa de Torres, Roguelike, Estratégia, Exploração, Geração Procedural, Ação / Aventura, Ação, Gerenciamento, Alienígenas, Mechas, Combate, Câmera Lateral, Ficção Científica, 2D, Gerenciamento de Recursos, Um Jogador, Aventura"
Military Incremental Complex,2025,Indefinido,https://store.steampowered.com/app/3469750/Military_Incremental_Complex/?snr=1_7_7_popularcomingsoon_150_15,"Incremental, Clique e Clique, Estratégia, Construção, Roguelike, Militar, Capitalismo, Simulação, Gerenciamento, Anos 90, Gerenciamento de Recursos, Economia, Casual, Automação, Gerenciamento de Inventário, Guerra, História Alternativa, Fabricação, Troca, Indie"
Ember and Blade,2025,Indefinido,https://store.steampowered.com/app/3470500/Ember_and_Blade/?snr=1_7_7_popularcomingsoon_150_15,"Roguelike de Ação, Roguelite, Soulslike, Hack and Slash, Difícil, RPG de Ação, Fantasia Sombria, Boa Trama, Alta Rejogabilidade, Controle, Isométrico, Estilizado, Mitologia, Atmosférico, RPG, Ação, Personalização de Personagem, Fantasia, Um Jogador, Aventura"
