title,release_date,price,game_url,genres
CASSETTE BOY,2025,Indefinido,https://store.steampowered.com/app/2334330/CASSETTE_BOY/?snr=1_7_7_popularcomingsoon_150_7,"Ação, Aventura, RPG de Ação, Ação / Aventura, Quebra-Cabeça, Soulslike, Exploração, 2,5D, Fofo, Gráficos Pixelados, Voxel, Anos 90, Ficção Científica, Velha-Guarda, Fantasia, Retrô, Saques, Gatos, Atmosférico, Controle"
Family Land - Farmer Simulator,2025,Indefinido,https://store.steampowered.com/app/2334600/Family_Land__Farmer_Simulator/?snr=1_7_7_popularcomingsoon_150_7,"Simulação, Casual, Simulador Rural, Simulador de Vida Real, Faça o que Quiser, Simulador Imersivo, Gerenciamento de Tempo, 3D, Primeira Pessoa, Realístico, Agricultura, EUA, Atmosférico, Construção, Capitalismo, Economia, Para Toda a Família, Gerenciamento, Moderno, Natureza"
Jupiter Moons: Mecha🦾,2025,Indefinido,https://store.steampowered.com/app/1288540/Jupiter_Moons_Mecha/?snr=1_7_7_popularcomingsoon_150_7,"Montagem de Decks Roguelike, Mechas, Montagem de Decks, Cartas, Gerenciamento de Inventário, Batalha com Cartas, Roguelite, Estratégia, Ficção Científica, RPG, Roguelike, Combate em Turnos, RPG Tático, Explorador de Calabouços, Personalização de Personagem, Um Jogador, RPG de Estratégia, Espacial, 2D, Estratégia em Turnos"
VUP-Simulator,2025,Indefinido,https://store.steampowered.com/app/1352140/VUPSimulator/?snr=1_7_7_popularcomingsoon_150_7,"Simulação, Gerenciamento de Tempo, Simulador de Vida Real, CRPG, Anime, RPG, Fofo, Desenho Animado, Compatível com Mods, Nudez, Baseado em Classes, Acesso Antecipado, Gerenciamento de Recursos, Você Decide, Um Jogador, Gerenciamento"
The Touhou Empires,2025,Indefinido,https://store.steampowered.com/app/1761210/The_Touhou_Empires/?snr=1_7_7_popularcomingsoon_150_7,"Estratégia, Estratégia em Tempo Real (RTS), Simulação, Tática em Tempo Real, 3D, Fofo, Visão Superior, Multijogador, Jogador x Jogador (PvP), Tático, Mágica, Protagonista Mulher, Indie, Um Jogador, Fé, Construção de Bases, Anime"
Last Moon,2025,Indefinido,https://store.steampowered.com/app/1108600/Last_Moon/?snr=1_7_7_popularcomingsoon_150_7,"Aventura, Ação, Um Jogador, RPG, 2D, Fantasia, RPG de Ação, Gráficos Pixelados, Indie, Exploração, Fofo, Colorido, Atmosférico, Retrô, Soulslike, Desenhado à Mão, Mundo Aberto, Trilha Sonora Boa, Metroidvania, Controle"
Eastern Tactics,2025,Indefinido,https://store.steampowered.com/app/1497910/Eastern_Tactics/?snr=1_7_7_popularcomingsoon_150_7,"Estratégia, RPG, Estratégia em Turnos, Tática por Turnos, RPG Tático, JRPG, RPG de Estratégia, Boa Trama, Indie, História Alternativa, Você Decide, Enredo Rico, Tático, Combate em Turnos, Estilizado, Anime, Drama, Retrô, Velha-Guarda, Um Jogador"
March March!,2025,Indefinido,https://store.steampowered.com/app/1607300/March_March/?snr=1_7_7_popularcomingsoon_150_7,"Tática por Turnos, Batalha Automática, Roguelike, Desenhado à Mão, Um Jogador, Estratégia, Aventura, Fofo, Combate em Turnos, Baseado em Classes, Fantasia, Tático, 2D, Roguelite, Estratégia em Turnos, Movimento em Grade, Você Decide, Gerenciamento de Tempo, Quebra-Cabeça, Multijogador"
The Way of Wrath,2025,Indefinido,https://store.steampowered.com/app/969330/The_Way_of_Wrath/?snr=1_7_7_popularcomingsoon_150_7,"RPG, Personalização de Personagem, Você Decide, Boa Trama, Combate em Turnos, Dungeons & Dragons, CRPG, Aventura, Romance, Fantasia, Estratégia, Estratégia em Turnos, Mundo Aberto, Fantasia Sombria, Um Jogador, Campanha Cooperativa, Baseado em Classes, RPG de Estratégia, Combate, RPG de Grupos"
Project: Mist,Q4 2025,Indefinido,https://store.steampowered.com/app/2383130/Project_Mist/?snr=1_7_7_popularcomingsoon_150_7,"Acesso Antecipado, Terror, Terror de Sobrevivência, Mundo Aberto, Pós-Apocalíptico, Sobrevivência em Mundo Aberto, Multijogador, Tiro, Ação, Construção, Fabricação, Simulação, Realístico, Atmosférico, Sombrio, Exploração, Ação / Aventura, Sobrevivência, Aventura, Culinária"
Half Sword,2025,Indefinido,https://store.steampowered.com/app/2397300/Half_Sword/?snr=1_7_7_popularcomingsoon_150_7,"Acesso Antecipado, Física, Violência Detalhada, Combate, Medieval, Sangue, Espada, Realístico, Histórico, Simulação, Ação, Luta, Faça o que Quiser, Um Jogador, Imersivo, Terceira Pessoa, Hack and Slash, Luta 3D, Primeira Pessoa, 3D"
Corsairs - Battle of the Caribbean,2025,Indefinido,https://store.steampowered.com/app/2397510/Corsairs__Battle_of_the_Caribbean/?snr=1_7_7_popularcomingsoon_150_7,"Estratégia, Estratégia em Tempo Real (RTS), Estratégia em Tempo Real com Ação, Visão Superior, Combate Naval, Piratas, Jogador X Ambiente (PvE), Jogador x Jogador (PvP), Histórico, Natureza, Retrô, Gerenciamento de Recursos, Um Jogador, Multijogador, Naval, Gerenciamento"
Alice's World,Q4 2025,Indefinido,https://store.steampowered.com/app/2439560/Alices_World/?snr=1_7_7_popularcomingsoon_150_7,"Aventura, Terror, Boa Trama, Fofo, Anime, Câmera Lateral, Atmosférico, Exploração, Indie, Quebra-Cabeça, 2D, Protagonista Mulher, Terror Psicológico, Um Jogador, Vários Finais, Romance Visual, Você Decide, Fantasia Sombria, Drama, Psicológico"
Pixel Piracy Online,2025,Indefinido,https://store.steampowered.com/app/2446520/Pixel_Piracy_Online/?snr=1_7_7_popularcomingsoon_150_7,"RPG, Plataforma 2D, Simulação, Faça o que Quiser, Aventura, Piratas, Multijogador Massivo, MMORPG, 2D, Gráficos Pixelados, Casual, Multijogador, Um Jogador"
Dragonscale Monastery,2025,Indefinido,https://store.steampowered.com/app/2446660/Dragonscale_Monastery/?snr=1_7_7_popularcomingsoon_150_7,"Acesso Antecipado, Estratégia, Construção de Cidades, Gerenciamento de Recursos, Construção, Construção de Bases, Sobrevivência, Coleção de Criaturas, Dragões, Fantasia, Fé, Difícil, Atmosférico, Indie, Mistério, Gerenciamento de Tempo, 3D, Fabricação, Gerenciamento de Inventário, Você Decide"
Bylina,2025,Indefinido,https://store.steampowered.com/app/2461440/Bylina/?snr=1_7_7_popularcomingsoon_150_7,"Ação, RPG, RPG de Ação, Humor Ácido, Ação / Aventura, Hack and Slash, Mitologia, Um Jogador, Visão Superior, Combate, Colorido, Violência Detalhada, Violento, Fabricação, 3D, Fantasia, Aventura, Comédia, Boa Trama, Trilha Sonora Boa"
Thalassophobia,2025,Indefinido,https://store.steampowered.com/app/2507690/Thalassophobia/?snr=1_7_7_popularcomingsoon_150_7,"Simulação, Terror, Realístico, Subaquático, Terror de Sobrevivência, Cooperativo On-line, RPG de Grupos, Primeira Pessoa, 3D, Simulador Imersivo, Casual, Objetos Ocultos, Natureza, Naval, Futurista, Investigação, Jogador X Ambiente (PvE), Inteligência Artificial, Ação, Luta 3D"
Adaptory,2025,Indefinido,https://store.steampowered.com/app/2201620/Adaptory/?snr=1_7_7_popularcomingsoon_150_7,"Simulação, Simulador de Colônias, Construção de Bases, Boa Trama, Indie, Sobrevivência, Geração Procedural, Gerenciamento de Recursos, Automação, 2D, Um Jogador, Ficção Científica, Colorido, Gerenciamento, Compatível com Mods, Construção, Exploração, Ciência, Física, Tutorial"
Hoglands,Q4 2025,Indefinido,https://store.steampowered.com/app/2210240/Hoglands/?snr=1_7_7_popularcomingsoon_150_7,"Câmera Lateral, Exploração, Construção de Cidades, Faça o que Quiser, Defesa de Torres, Plataforma, Estratégia em Tempo Real (RTS), Personalização de Personagem, RPG, Estratégia, 2D, Construção de Bases, Mundo Aberto, Ação, Gerenciamento, Medieval, Fantasia, Atmosférico, Construção, Fabricação"
Arcticide,2025,Indefinido,https://store.steampowered.com/app/2259590/Arcticide/?snr=1_7_7_popularcomingsoon_150_7,"Acesso Antecipado, Tiro em Primeira Pessoa (FPS), Sobrevivência, Exploração, Roguelike de Ação, Atmosférico, Pós-Apocalíptico, Geração Procedural, Um Jogador, Terror de Sobrevivência, Simulador Imersivo, Tático, Tiro, Personalização de Armas, Roguelike, Roguelite, Ficção Científica, Explorador de Calabouços, Furtivo, Ação"
Subliminal,Q4 2025,Indefinido,https://store.steampowered.com/app/2300840/Subliminal/?snr=1_7_7_popularcomingsoon_150_7,"RV, Thriller, Realístico, Mistério, Atmosférico, Um Jogador, Terror Psicológico, Terror, Explorador de Calabouços, Primeira Pessoa, Quebra-Cabeça, 3D, Fuja da Sala, Vários Finais, Aventura, Exploração, Terror de Sobrevivência, Surrealista, Simulador Imersivo, Boa Trama"
Full Fathom,2025,Indefinido,https://store.steampowered.com/app/2302470/Full_Fathom/?snr=1_7_7_popularcomingsoon_150_7,"Terror de Sobrevivência, Submarino, Subaquático, Exploração, Mundo Aberto, Terror Psicológico, Terror, Atmosférico, Sobrevivência, Gerenciamento de Recursos, Não Linear, Aventura, Pós-Apocalíptico, Ação / Aventura, Primeira Pessoa, Gerenciamento de Inventário, Anos 90, História Alternativa, Lovecraftiano, Thriller"
Mainland,2025,Indefinido,https://store.steampowered.com/app/2304360/Mainland/?snr=1_7_7_popularcomingsoon_150_8,"Estratégia, Medieval, RPG, Mundo Aberto, Campanha Cooperativa, Ação, Guerra, Simulação, Faça o que Quiser, Grande Estratégia, RPG de Estratégia, RPG de Ação, Jogo de Guerra, Tática em Tempo Real, Cooperativo, Terceira Pessoa, Militar, Histórico, Combate, Personalização de Personagem"
Bladesong,2025,Indefinido,https://store.steampowered.com/app/2305640/Bladesong/?snr=1_7_7_popularcomingsoon_150_8,"Gerenciamento de Lojas, Fabricação, Medieval, RPG, Boa Trama, 3D, Design e Ilustração, Atmosférico, Gerenciamento, Aventura, Física, Simulador Imersivo, Simulação, Baseado em Texto, Utilitários, Um Jogador, Espada, Histórico, Fantasia Sombria, Mágica"
Out of Action,2025,Indefinido,https://store.steampowered.com/app/1670780/Out_of_Action/?snr=1_7_7_popularcomingsoon_150_8,"Indie, Tiro em Primeira Pessoa (FPS), Jogador x Jogador (PvP), Cyberpunk, Tiro, Primeira Pessoa, Ação, Parar o Tempo, Personalização de Armas, Distópico, Ficção Científica, Sombrio, Futurista, Combate, Multijogador, Um Jogador, Anime, Personalização de Personagem, Jogador X Ambiente (PvE), Estilizado"
COP BASTARD,2025,Indefinido,https://store.steampowered.com/app/1742440/COP_BASTARD/?snr=1_7_7_popularcomingsoon_150_8,"Tiro de Tiozão, Tiro em Primeira Pessoa (FPS), Tiro, Noir, Primeira Pessoa, Parar o Tempo, Ação, Atmosférico, Crime, Cinematográfico, Anos 90, Velha-Guarda, Retrô, Combate, Um Jogador, Indie, Violento, Violência Detalhada, Político, Boa Trama"
Away From Life,4º trimestre de 2025,Indefinido,https://store.steampowered.com/app/1755080/Away_From_Life/?snr=1_7_7_popularcomingsoon_150_8,"Exploração, Tiro em Primeira Pessoa (FPS), Faça o que Quiser, Construção, Fabricação, Sobrevivência, Jogador x Jogador (PvP), Construção de Bases, Subaquático, Primeira Pessoa, Mundo Aberto, Ação, Simulação, Realístico, Aventura, Gerenciamento de Recursos, Cooperativo, Multijogador, Cooperativo On-line, Um Jogador"
Train Mechanic Simulator 2025,2025,Indefinido,https://store.steampowered.com/app/1773220/Train_Mechanic_Simulator_2025/?snr=1_7_7_popularcomingsoon_150_8,"Simulação, Trens, Casual, Simulador Imersivo, Transportes, Apontar e Clicar, Construção, Quebra-Cabeça, Primeira Pessoa, 3D, Realístico, EUA, Automação, Educativo, Economia, Atmosférico, Compatível com Mods, Lógica, Relaxante, Gerenciamento de Tempo"
Life After End,2025,Indefinido,https://store.steampowered.com/app/1792390/Life_After_End/?snr=1_7_7_popularcomingsoon_150_8,"Tiro com Saques, Tiro em Primeira Pessoa (FPS), Sobrevivência, Fabricação, Natureza, Jogador x Jogador (PvP), Jogador X Ambiente (PvE), Construção de Bases, Física, Tiro, Personalização de Personagem, 3D, Primeira Pessoa, Pós-Apocalíptico, Personalização de Armas, Baseado em Equipes, Mundo Aberto, Simulação, Ação, Realístico"
SysAdmin Odyssey - Back to the office,2025,Indefinido,https://store.steampowered.com/app/1794240/SysAdmin_Odyssey__Back_to_the_office/?snr=1_7_7_popularcomingsoon_150_8,"Automação, Simulação, Você Decide, Educativo, Simulador Imersivo, Software, Gerenciamento de Tempo, Faça o que Quiser, Primeira Pessoa, Realístico, 3D, Um Jogador, Gerenciamento, Atmosférico, Quebra-Cabeça, Relaxante, Engraçado, Construção, Indie, Aventura"
Duel Corp.,2025,Indefinido,https://store.steampowered.com/app/1804470/Duel_Corp/?snr=1_7_7_popularcomingsoon_150_8,"Acesso Antecipado, Soulslike, Gráficos Pixelados, Cooperativo On-line, Ação, RPG de Ação, Terceira Pessoa, Fantasia Sombria, RPG, Geração Procedural, Violento, Velha-Guarda, Atmosférico, Controle, Um Jogador, RPG de Grupos, Multijogador, Jogador X Ambiente (PvE), Multijogador Massivo, Jogador x Jogador (PvP)"
CarX Drift Racing Online 2,Q4 2025,Indefinido,https://store.steampowered.com/app/1826420/CarX_Drift_Racing_Online_2/?snr=1_7_7_popularcomingsoon_150_8,"Acesso Antecipado, Corrida, Simulação, Simulador Automobilístico, 3D, Primeira Pessoa, Esportes, Terceira Pessoa, Realístico, Anos 80, Anos 90, Atmosférico, Patinação (e Skate), Jogador x Jogador (PvP), Jogador X Ambiente (PvE), Controle, Gerenciamento de Inventário, Física, Multijogador, Um Jogador"
DuneCrawl,2025,Indefinido,https://store.steampowered.com/app/1833200/DuneCrawl/?snr=1_7_7_popularcomingsoon_150_8,"Cooperativo On-line, Campanha Cooperativa, Multijogador Local, Mundo Aberto, Cooperativo, Cooperativo Local, Local para 4 Jogadores, Tiro, Aventura, RPG, RPG de Ação, Ação / Aventura, Visão Superior, Explorador de Calabouços, Estilizado, Isométrico, Hack and Slash, Colorido, 3D, Combate com Veículos"
Queen's Loyalty,Q4 2025,Indefinido,https://store.steampowered.com/app/1841360/Queens_Loyalty/?snr=1_7_7_popularcomingsoon_150_8,"Ação, Aventura, RPG, Ação / Aventura, RPG de Ação, Exploração, 3D, Terceira Pessoa, Fantasia, Jogador X Ambiente (PvE), Física, Combate, Conteúdo Sexual, Um Jogador, Para Adultos, Impróprio para o Local de Trabalho, 2D, Fofo, Anime, Tiro em Terceira Pessoa"
Ultimate Sheep Raccoon,2025,Indefinido,https://store.steampowered.com/app/2923350/Ultimate_Sheep_Raccoon/?snr=1_7_7_popularcomingsoon_150_8,"Reúna a Galera, Multijogador, Engraçado, Corrida, Multijogador Local, Cooperativo On-line, Casual, Jogador x Jogador (PvP), Cooperativo, Local para 4 Jogadores, Plataforma, Competitivo, Para Toda a Família, Editor de Níveis, Fofo, Colorido, Física, Em Grupos, Ação, Controle"
Usual June,2025,Indefinido,https://store.steampowered.com/app/2702430/Usual_June/?snr=1_7_7_popularcomingsoon_150_8,"Ação, Ação / Aventura, 3D, Terceira Pessoa, Combate, Hack and Slash, Boa Trama, Colorido, Estilizado, Conspiração, Controle, Aventura, Humor Pesado, Engraçado, Mistério, Detetive, Sobrenatural, Você Decide, Conversas, LGBTQIA+"
ALARA Prime,2025,,https://store.steampowered.com/app/971700/ALARA_Prime/?snr=1_7_7_popularcomingsoon_150_8,"Tiro em Primeira Pessoa (FPS), Tiro em Arena, Jogador x Jogador (PvP), Primeira Pessoa, Competitivo, Gratuito para Jogar, Multijogador, Tático, Tiro, Baseado em Equipes, Ação, Ficção Científica, Realístico, Futurista, Combate, 3D, Furtivo, Violento, Controle, Cyberpunk"
星渊勇者 StarAbyss Heroes,4º trimestre de 2025,,https://store.steampowered.com/app/3956120/_StarAbyss_Heroes/?snr=1_7_7_popularcomingsoon_150_8,"RPG, Saques, RPG de Ação, Aventura, Ação, Hack and Slash, Conteúdo Sexual, 2D, Desenho Animado, Um Jogador, Gratuito para Jogar, Indie, Acesso Antecipado"
Recycling Center Simulator: E-Waste DLC,2025,Indefinido,https://store.steampowered.com/app/4028400/Recycling_Center_Simulator_EWaste_DLC/?snr=1_7_7_popularcomingsoon_150_8,"Simulação, Primeira Pessoa, Gerenciamento, Simulador de Vida Real, Gerenciamento de Tempo, Automação, Simulador Imersivo, Faça o que Quiser, Economia, Casual, Construção, 3D, Física, Capitalismo, Relaxante, Fabricação, Realístico, Gerenciamento de Recursos, Um Jogador, Aventura"
Título não disponível,Data não informada,Indefinido,https://store.steampowered.com/app/4055790/House_Party__Nocturnal_Temptations_Expansion_Pack/?snr=1_7_7_popularcomingsoon_150_8,Sem gênero
Heroines Through My Lens,4º trimestre de 2025,Indefinido,https://store.steampowered.com/app/4057050/Heroines_Through_My_Lens/?snr=1_7_7_popularcomingsoon_150_8,"FMV, RPG, Simulador de Encontros, Romance, Você Decide, Conteúdo Sexual, Simulação, Ficção Interativa, Aventura, Protagonista Mulher, Vários Finais, Romance Visual, Simulador Imersivo, Boa Trama, Escolha a sua Aventura, Comovente, Drama, Primeira Pessoa, Um Jogador"
Ethernia,2025,,https://store.steampowered.com/app/3746560/Ethernia/?snr=1_7_7_popularcomingsoon_150_8,"RPG, MMORPG, RPG de Grupos, Exploração, Fantasia, Jogador X Ambiente (PvE), Jogador x Jogador (PvP), Mundo Aberto, Escolha a sua Aventura, RPG Tático, Personalização de Personagem, Gráficos Pixelados, 2D, Visão Superior, Medieval, Você Decide, Enredo Rico, Combate, Multijogador Massivo, Colete Tudo"
Grow a Girlfriend,4º trimestre de 2025,Indefinido,https://store.steampowered.com/app/3766830/Grow_a_Girlfriend/?snr=1_7_7_popularcomingsoon_150_8,"Romance Visual, Terror Psicológico, Anime, Simulador de Encontros, Romance, Fofo, Terror, Vários Finais, Você Decide, Sombrio, Boa Trama, Psicológico, Para Adultos, Casual, 2D, Comovente, Um Jogador, Escolha a sua Aventura, Filosófico, Humor Ácido"
每日亲亲洛丽塔,4º trimestre de 2025,Indefinido,https://store.steampowered.com/app/3780110/_/?snr=1_7_7_popularcomingsoon_150_8,"RPG, Ficção Interativa, Jogo de Palavras, JRPG, Romance Visual, CRPG, 2D, Anime, Desenho Animado, Fofo, Cartunizado, Baseado em Texto, Primeira Pessoa, Drama, Comovente, Um Jogador, Plataforma 2D, Simulador Imersivo, Tiro em Primeira Pessoa (FPS), Conteúdo Sexual"
It Works: Electronics Repair Simulator,2025,Indefinido,https://store.steampowered.com/app/3787050/It_Works_Electronics_Repair_Simulator/?snr=1_7_7_popularcomingsoon_150_8,"Simulação, Casual, Educativo, Realístico, Gerenciamento, Simulador Imersivo, Para Toda a Família, 3D, Atmosférico, Engraçado, Relaxante, Um Jogador, Colorido, Indie, Economia, Simulador de Vida Real, Difícil, Quebra-Cabeça, Fabricação, Lógica"
DungeonBox,4º trimestre de 2025,Indefinido,https://store.steampowered.com/app/3788110/DungeonBox/?snr=1_7_7_popularcomingsoon_150_8,"Casual, Escolha a sua Aventura, 2D, Comédia, Você Decide, Multijogador, Cooperativo On-line, Reúna a Galera, Engraçado, Em Grupos, RPG de Grupos, Indie, Jogador x Jogador (PvP), Aventura, Fantasia, RPG, Jogo de Mesa"
100 Ruin Cats,2025,Indefinido,https://store.steampowered.com/app/3789580/100_Ruin_Cats/?snr=1_7_7_popularcomingsoon_150_8,"Gratuito para Jogar, Casual, Gatos, Objetos Ocultos, Apontar e Clicar, Quebra-Cabeça, Aconchegante, Do Bem, Relaxante, Fofo, Indie, Coleção de Criaturas, Desenhado à Mão, Minimalista, Cartunizado, Para Toda a Família, Um Jogador, Exploração, Colete Tudo, Pontos, Pontos, Pontos!"
Haunted Room! Urami-chan,4º trimestre de 2025,Indefinido,https://store.steampowered.com/app/3818090/Haunted_Room_Uramichan/?snr=1_7_7_popularcomingsoon_150_8,"Câmera Lateral, Ficção Interativa, Protagonista Mulher, Aventura, 2D, Fofo, Controle, Anime, Desenhado à Mão, Gatos, Comédia, Anos 80, Retrô, Um Jogador"
Megastore Simulator,4º trimestre de 2025,Indefinido,https://store.steampowered.com/app/3819640/Megastore_Simulator/?snr=1_7_7_popularcomingsoon_150_8,"Simulação, Gerenciamento, Simulador de Vida Real, Simulador Imersivo, Economia, Fabricação, Um Jogador, Primeira Pessoa, Troca, Construção, Capitalismo, Gerenciamento de Recursos, 3D, Realístico, Faça o que Quiser, Gerenciamento de Lojas, Gerenciamento de Inventário, Casual, Simulador de Emprego, Indie"
Touhou Hero of Ice Fairy DLC2 - Immortal Phoenix And Lunarian Princess,4º trimestre de 2025,Indefinido,https://store.steampowered.com/app/3858250/Touhou_Hero_of_Ice_Fairy_DLC2__Immortal_Phoenix_And_Lunarian_Princess/?snr=1_7_7_popularcomingsoon_150_8,"Chuva de Balas, Anime, Protagonista Mulher, Câmera Lateral, Roguelite, Indie, Plataforma, JRPG, Fofo, Alta Rejogabilidade, Boa Trama, RPG, 2D, Ação, Aventura, Um Jogador, Tiro, Ação / Aventura, Combate, Drama"
港警成雙：來自城寨 Dual Fire Walled City,4º trimestre de 2025,Indefinido,https://store.steampowered.com/app/3918200/_Dual_Fire_Walled_City/?snr=1_7_7_popularcomingsoon_150_8,"Cooperativo, Aventura, Tela Dividida, Crime, Boa Trama, Cooperativo Local, Cooperativo On-line, 3D, Terceira Pessoa, Ação / Aventura, Indie, Multijogador, Multijogador Local"
Holo ADV: SakuraSingularity.exe,dezembro de 2025,Indefinido,https://store.steampowered.com/app/3923980/Holo_ADV_SakuraSingularityexe/?snr=1_7_7_popularcomingsoon_150_8,"Anime, Romance Visual, Terror Psicológico, Terror, Aventura, Protagonista Mulher, 2,5D, 3D, Exploração, Primeira Pessoa, Boa Trama, Mistério, Um Jogador, Ação / Aventura, Indie, Casual, Câmera Lateral"
Sherpa's Caravan,2025,Indefinido,https://store.steampowered.com/app/3927750/Sherpas_Caravan/?snr=1_7_7_popularcomingsoon_150_8,"Relaxante, Natureza, Aventura, Terceira Pessoa, Mundo Aberto, Simulador Imersivo, Estrada de Terra, Simulação, Culinária, Fabricação, Direção, Seis Graus de Liberdade, Simulador de Vida Real, Exploração, Realístico, Cinematográfico, Indie, Escolha a sua Aventura, Simulador de Caminhada, Atmosférico"
Cave Crave VR,4º trimestre de 2025,Indefinido,https://store.steampowered.com/app/3929970/Cave_Crave_VR/?snr=1_7_7_popularcomingsoon_150_8,"Aventura, RV, Exploração, Imersivo, Atmosférico, Colete Tudo, Realístico, Sombrio, Comovente, Mistério, Psicológico, Sobrevivência, Simulação, Subterrâneo, Subaquático, Narração, Física, Um Jogador, Primeira Pessoa, Ação / Aventura"
Crônicas do Criador,4º trimestre de 2025,Indefinido,https://store.steampowered.com/app/3947460/Creator_Chronicles/?snr=1_7_7_popularcomingsoon_150_8,"Acesso Antecipado, Construção de Cidades, Gerenciamento, CRPG, Visão Superior, Gráficos Pixelados, Vários Finais, Construção, Economia, Fabricação, Troca, RPG, Pesca, Mineração, Simulação, Rural, 2D, Culinária, Fantasia, Um Jogador"
Inkwellers,2025,Indefinido,https://store.steampowered.com/app/3061390/Inkwellers/?snr=1_7_7_popularcomingsoon_150_8,"Aventura, Indie, Quebra-Cabeça, Cooperativo, Campanha Cooperativa, 3D, Lógica, Cooperativo On-line, Multijogador, Primeira Pessoa, Casual, Cinematográfico, Fantasia, Mágica, Colorido, Estilizado, Atmosférico, Plataforma com Quebra-Cabeça, Sobrenatural, Conversas"
Varthos - Heir to the Throne,Q4 2025,Indefinido,https://store.steampowered.com/app/3065870/Varthos__Heir_to_the_Throne/?snr=1_7_7_popularcomingsoon_150_8,"Acesso Antecipado, RPG de Ação, Hack and Slash, Roguelite, Morte Permanente, Multijogador, Cooperativo, Cooperativo On-line, Ação, Um Jogador, Fantasia, Ação / Aventura, Isométrico, Não Linear, Explorador de Calabouços, Aventura, Personalização de Personagem, Realístico, Saques, Mágica"
Order: The New Dawn,Q4 2025,Indefinido,https://store.steampowered.com/app/3080070/Order_The_New_Dawn/?snr=1_7_7_popularcomingsoon_150_8,"Simulador de Colônias, Simulador Espacial, Gerenciamento de Recursos, Construção de Bases, Exploração, Faça o que Quiser, Gráficos Pixelados, Construção, Sobrevivência, Gerenciamento, 4X, Estratégia, RPG, 2D, Pós-Apocalíptico, Simulação, Indie, Ficção Científica, Um Jogador, Cooperativo"
Chromatic Conundrum,2025,Indefinido,https://store.steampowered.com/app/3081690/Chromatic_Conundrum/?snr=1_7_7_popularcomingsoon_150_8,"Quebra-Cabeça, Plataforma, Primeira Pessoa, Atmosférico, Ficção Científica, Física, Plataforma com Quebra-Cabeça, Plataforma 3D, Aventura, Abstrato, Minimalista, Colorido, Estilizado, Futurista, 3D, Linear, Um Jogador, Indie"
Re:VER PROJECT -TOKYO-,2025,Indefinido,https://store.steampowered.com/app/3097730/ReVER_PROJECT_TOKYO/?snr=1_7_7_popularcomingsoon_150_8,"Aventura, Casual, Ação / Aventura, Simulador de Caminhada, Romance Visual, Simulador de Vida Real, Plataforma 2D, Colete Tudo, Objetos Ocultos, Exploração, Câmera Lateral, Simulador Imersivo, 2D, Fofo, Gráficos Pixelados, Fabricação, Sobrevivência, Furtivo, Sombrio, Distópico"
PIONER,2025,Indefinido,https://store.steampowered.com/app/3105890/PIONER/?snr=1_7_7_popularcomingsoon_150_8,"RPG, Mundo Aberto, Ação, MMORPG, Tiro em Primeira Pessoa (FPS), Ação / Aventura, Tiro com Saques, Primeira Pessoa, Cinematográfico, 3D, Realístico, Distópico, Atmosférico, Militar, Sobrevivência, Fabricação, Sombrio, Ficção Científica, Pós-Apocalíptico, Boa Trama"
Baking Bad,2025,Indefinido,https://store.steampowered.com/app/3107310/Baking_Bad/?snr=1_7_7_popularcomingsoon_150_8,"Ação, Roguelike de Ação, Memes, Tiro com Saques, Engraçado, Culinária, Tiro, Colete Tudo, Tiro em Primeira Pessoa (FPS), 3D, Desenho Animado, Cartunizado, História em Quadrinhos, Colorido, Primeira Pessoa, Estilizado, EUA, Crime, Direção, Economia"
FLS,2025,Free,https://store.steampowered.com/app/3114850/FLS/?snr=1_7_7_popularcomingsoon_150_8,"Esportes, Simulador de Vida Real, Simulador Imersivo, Simulação, Futebol, Personalização de Personagem, Mundo Aberto, Primeira Pessoa, Gratuito para Jogar, Você Decide, Indie, Realístico, Gerenciamento de Inventário, Tiro em Primeira Pessoa (FPS), Um Jogador, Gerenciamento de Tempo, Economia, Capitalismo, Gerenciamento, RV"
NOOK FALL: West Town,2025,Indefinido,https://store.steampowered.com/app/3119700/NOOK_FALL_West_Town/?snr=1_7_7_popularcomingsoon_150_8,"Romance Visual, Isométrico, Apontar e Clicar, Retrô, Estilizado, Ficção Interativa, Indie, Anos 80, Atmosférico, Drama, Minimalista, História Alternativa, Baseado em Texto, Desenhado à Mão, Exploração, Gerenciamento de Lojas, Casual, 2D, Um Jogador, RPG"
