title,release_date,price,game_url,genres
Rabona,2026,Indefinido,https://store.steampowered.com/app/3810050/Rabona/?snr=1_7_7_popularcomingsoon_150_15,"Simulação, Esportes, Futebol, Física, 3D, Jogador x Jogador (PvP), Plataforma 3D, Arcade, Multijogador, Tutorial, eSports, Terceira Pessoa, Controle, Baseado em Equipes, Cartunizado, Cooperativo, Cooperativo On-line, Indie, Cooperativo Local, Multijogador Local"
DERELIKT,2026,Indefinido,https://store.steampowered.com/app/3810510/DERELIKT/?snr=1_7_7_popularcomingsoon_150_15,"Aventura, Ação, Retrô, Ação / Aventura, Primeira Pessoa, Velha-Guarda, Tiro em Primeira Pessoa (FPS), 3D, Lovecraftiano, Futurista, Sombrio, Terror, Ficção Científica, Terror de Sobrevivência, Espacial, Controle, Gerenciamento de Inventário, Tiro de Tiozão, Anos 90, Combate"
ReStory: Chill Electronics Repairs,2026,Indefinido,https://store.steampowered.com/app/3812600/ReStory_Chill_Electronics_Repairs/?snr=1_7_7_popularcomingsoon_150_15,"Simulador de Emprego, Aconchegante, Economia, Gerenciamento, Construção, Um Jogador, Indie, Rico em Diálogos, Fabricação, Relaxante, Gerenciamento de Lojas, Simulação, Primeira Pessoa, Você Decide, 3D, Vários Finais, Não Linear, Colorido, Boa Trama, Atmosférico"
Título não disponível,Data não informada,Indefinido,https://store.steampowered.com/app/3816030/DayZ_Badlands/?snr=1_7_7_popularcomingsoon_150_15,Sem gênero
"CICADAMATA""",2026,Indefinido,https://store.steampowered.com/app/3817250/CICADAMATA/?snr=1_7_7_popularcomingsoon_150_15,"Ação, Primeira Pessoa, Plataforma 3D, Ritmo Rápido, Cyberpunk, Tiro, Protagonista Mulher, Anime, Ficção Científica, Pontos, Pontos, Pontos!, Parkour, Estilizado, 3D, Transumanismo, Abstrato, Minimalista, Plataforma de Precisão, Colete Tudo, Controle, Distópico"
Escola do Mal,2026,Indefinido,https://store.steampowered.com/app/3818020/Evil_School/?snr=1_7_7_popularcomingsoon_150_15,"FMV, Romance Visual, Ficção Interativa, Estratégia, RPG, Aventura, Você Decide, Crime, Cinematográfico, Mistério, Assassinos, Vários Finais, Battle Royale, Thriller, Boa Trama, Simulador Imersivo, Sobrevivência, Hack and Slash, Um Jogador, Educativo"
SuperWEIRD: Automation Roguelite,2026,Indefinido,https://store.steampowered.com/app/3818770/SuperWEIRD_Automation_Roguelite/?snr=1_7_7_popularcomingsoon_150_15,"Automação, Blocos que Caem, Sobrevivência em Mundo Aberto, Faça o que Quiser, Sobrevivência, Cooperativo, Pós-Apocalíptico, Defesa de Torres, Roguelite, Exploração, Gerenciamento de Recursos, 2,5D, Simulação, Construção, Estratégia, Fabricação, Aventura, Robôs, Programação, Multijogador"
Descent Of Lunaris,2026,Indefinido,https://store.steampowered.com/app/3824720/Descent_Of_Lunaris/?snr=1_7_7_popularcomingsoon_150_15,"RPG, Explorador de Calabouços, RPG de Grupos, Primeira Pessoa, JRPG, Jogador X Ambiente (PvE), RPG Tático, Baseado em Equipes, Combate em Turnos, 3D, 2D, Rico em Diálogos, Boa Trama, Baseado em Classes, Tático, Filosófico, Ficção Científica, Atmosférico, Futurista, Velha-Guarda"
组长！怨念请查收！,2026,Indefinido,https://store.steampowered.com/app/3826290/_/?snr=1_7_7_popularcomingsoon_150_15,"RPG, Aventura, Humor Ácido, Boa Trama, Anime, Moderno, Exploração, Gráficos Pixelados, Comédia, Enredo Rico, JRPG, 2D, Engraçado, CRPG, Plataforma 2D, Relaxante, Vários Finais, Estilizado, Um Jogador, Fantasia"
Lawn Mowing Simulator 2,2026,Indefinido,https://store.steampowered.com/app/3831210/Lawn_Mowing_Simulator_2/?snr=1_7_7_popularcomingsoon_150_15,"Simulação, Simulador Rural, Simulador Imersivo, Gerenciamento de Tempo, 3D, Primeira Pessoa, Realístico, Terceira Pessoa, Agricultura, Direção, Economia, Para Toda a Família, Gerenciamento, Natureza, Relaxante, Personalização de Personagem, Física, Um Jogador, Sequência"
DYNASTY WARRIORS 3: Complete Edition Remastered,2026,Indefinido,https://store.steampowered.com/app/3841510/DYNASTY_WARRIORS_3_Complete_Edition_Remastered/?snr=1_7_7_popularcomingsoon_150_15,"Luta Espetacular, RPG, Hack and Slash, Estratégia, Jogo de Guerra, Artes Marciais, RPG de Ação, Ação, 3D, Terceira Pessoa, Histórico, Espada, Controle, Vários Finais, Boa Trama, Musou, Tático, Guerra, Cinematográfico, Um Jogador"
Contact Protocol,2026,Indefinido,https://store.steampowered.com/app/3846690/Contact_Protocol/?snr=1_7_7_popularcomingsoon_150_15,"Gerenciamento de Tempo, Investigação, Você Decide, Boa Trama, Ficção Interativa, Simulador Imersivo, Espacial, Simulador de Emprego, Quebra-Cabeça, Gerenciamento, Apontar e Clicar, Capitalismo, Vários Finais, Simulação, Estilizado, Ficção Científica, Atmosférico, Desenhado à Mão, Sombrio, Um Jogador"
The Lantern of the Laughless Saint,2026,Indefinido,https://store.steampowered.com/app/3849000/The_Lantern_of_the_Laughless_Saint/?snr=1_7_7_popularcomingsoon_150_15,"Aventura, RPG, RPG de Ação, 3D, Primeira Pessoa, Estilizado, Terceira Pessoa, Atmosférico, Fantasia Sombria, Fantasia, Enredo Rico, Mitologia, Filosófico, Psicológico, Você Decide, Ação, Combate, Vários Finais, Mundo Aberto, Jogador X Ambiente (PvE)"
WakuWaku Park,2026,Indefinido,https://store.steampowered.com/app/3850800/WakuWaku_Park/?snr=1_7_7_popularcomingsoon_150_15,"Conteúdo Sexual, Nudez, Casual, Hentai, Simulador de Caminhada, Protagonista Mulher, Simulador de Vida Real, Corredor, 3D, Moderno, Um Jogador, Indie"
687 Days on Mars,2026,Indefinido,https://store.steampowered.com/app/3850980/687_Days_on_Mars/?snr=1_7_7_popularcomingsoon_150_15,"Simulação, Gerenciamento de Recursos, Aventura, Construção de Bases, Casual, Ficção Científica, Sobrevivência, Ação, Marte, Colorido, Simulador de Vida Real, Faça o que Quiser, Simulador Imersivo, Primeira Pessoa, Ação / Aventura, Simulador de Caminhada, Exploração, Simulador de Epidemias, Futurista, Simulador de Colônias"
ABYSS REBEL,2026,Indefinido,https://store.steampowered.com/app/3855320/ABYSS_REBEL/?snr=1_7_7_popularcomingsoon_150_15,"Estratégia em Turnos, Aventura, Estratégia, RPG de Grupos, Um Jogador, RPG Tático, Tática por Turnos, Fantasia Sombria, RPG, 3D, Mechas, Ficção Científica, Violento, Violência Detalhada, Combate em Turnos, Visão Superior, Estilizado, Lovecraftiano, Fantasia"
UGOMEKU NOTE,2026,Indefinido,https://store.steampowered.com/app/3861510/UGOMEKU_NOTE/?snr=1_7_7_popularcomingsoon_150_15,"RPG, JRPG, 2D, Engraçado, Um Jogador, Ritmo, Exploração, Desenhado à Mão, História em Quadrinhos, Comovente, Humor Ácido, Vários Finais"
Otterly Lost,2026,Indefinido,https://store.steampowered.com/app/3861710/Otterly_Lost/?snr=1_7_7_popularcomingsoon_150_15,"Casual, Subaquático, Fofo, Do Bem, Exploração, Aconchegante, Plataforma 3D, Relaxante, Mundo Aberto, Natureza, Personalização de Personagem, Atmosférico, Colete Tudo, Para Toda a Família, 3D, Terceira Pessoa, Um Jogador, Aventura, Plataforma, Indie"
侠影录,2026,Indefinido,https://store.steampowered.com/app/3863760/_/?snr=1_7_7_popularcomingsoon_150_15,"RPG, 3D, Visão Superior, Linear, Indie, Um Jogador, RPG de Ação, Plataforma 3D, Exploração, Boa Trama, Ação, Wuxia"
Sengoku Rance,Q4 2026,Indefinido,https://store.steampowered.com/app/3867170/Sengoku_Rance/?snr=1_7_7_popularcomingsoon_150_15,"RPG, Aventura, Estratégia, Combate em Turnos, Um Jogador, Conteúdo Sexual, Hentai"
The Mortal,Q4 2026,Indefinido,https://store.steampowered.com/app/3868160/The_Mortal/?snr=1_7_7_popularcomingsoon_150_15,"RPG, Boa Trama, Casual, Simulação, Vários Finais, Simulador Imersivo, Romance, Simulador de Encontros, Simulador de Vida Real, Quebra-Cabeça, Plataforma 3D, Exploração, CRPG, Visão Superior, Estilizado, Indie, Acesso Antecipado, Comovente, Atmosférico, RPG de Estratégia"
Watamari Part2 - A Fake Marriage?,2026,Indefinido,https://store.steampowered.com/app/3874910/Watamari_Part2__A_Fake_Marriage/?snr=1_7_7_popularcomingsoon_150_15,"Romance Visual, Aventura, Casual, LGBTQIA+, Anime, Romance, Indie, Um Jogador"
Westlanders,2026,Indefinido,https://store.steampowered.com/app/3886530/Westlanders/?snr=1_7_7_popularcomingsoon_150_15,"Acesso Antecipado, Simulação, Sobrevivência, Faça o que Quiser, Fabricação, Velho Oeste, Aventura, RPG, Gerenciamento, Primeira Pessoa, Construção de Bases, Personalização de Personagem, Construção, Economia, Um Jogador, Cooperativo On-line, Exploração, Ação, Realístico, Atmosférico"
Mixed Spirits: Bartender,2026,Indefinido,https://store.steampowered.com/app/3891400/Mixed_Spirits_Bartender/?snr=1_7_7_popularcomingsoon_150_15,"Simulador de Emprego, Aconchegante, Gerenciamento de Lojas, Simulação, Casual, Gerenciamento, Indie, Do Bem, Economia, Simulador de Passatempo, Simulador de Vida Real, Para Toda a Família, Estratégia, Apontar e Clicar, Gerenciamento de Recursos, Rico em Diálogos, Relaxante, Fofo, Um Jogador, 2D"
Next In Line: Supermarket,2026,Indefinido,https://store.steampowered.com/app/3894830/Next_In_Line_Supermarket/?snr=1_7_7_popularcomingsoon_150_15,"Gerenciamento de Lojas, Casual, Simulador de Emprego, Organização, Do Bem, Aconchegante, Fofo, Colorido, Relaxante, Para Toda a Família, Simulação, Gerenciamento, Troca, Simulador de Vida Real, Simulador Imersivo, Gerenciamento de Recursos, Estratégia, Capitalismo, Faça o que Quiser, Eventos Rápidos"
The Road of Dust and Sorrow,2026,Indefinido,https://store.steampowered.com/app/3895110/The_Road_of_Dust_and_Sorrow/?snr=1_7_7_popularcomingsoon_150_15,"Terror de Sobrevivência, Gráficos Pixelados, Protagonista Mulher, Atmosférico, Terror, Aconchegante, Retrô, Pós-Apocalíptico, Boa Trama, Zumbis, Exploração, Controle, Comovente, Indie, Ação, Gerenciamento de Inventário, 2D, Violento, Ação / Aventura, Linear"
Virtue and a Sledgehammer,2026,Indefinido,https://store.steampowered.com/app/3743260/Virtue_and_a_Sledgehammer/?snr=1_7_7_popularcomingsoon_150_16,"Ação, Aventura, Ação / Aventura, Simulador de Caminhada, 3D, Colorido, Estilizado, Terceira Pessoa, Atmosférico, Sombrio, Comovente, Combate, Controle, Protagonista Mulher, Um Jogador, Exploração, Violento"
"Pact, Passion, Puchimon!",Q4 2026,Indefinido,https://store.steampowered.com/app/3743810/Pact_Passion_Puchimon/?snr=1_7_7_popularcomingsoon_150_16,"Inferno de Balas, Ação, Casual, Combate, Anime, Indie, Fofo, Atmosférico, Fantasia, Um Jogador, Romance Visual, 2D, Comovente, Romance, Você Decide, Simulador de Encontros, Conteúdo Sexual"
Danganronpa 2x2,2026,Indefinido,https://store.steampowered.com/app/3751230/Danganronpa_2x2/?snr=1_7_7_popularcomingsoon_150_16,"Romance Visual, Detetive, Aventura, Simulador de Encontros, Anime, Mistério, Quebra-Cabeça, Investigação, Humor Pesado, Boa Trama, Um Jogador, LGBTQIA+, 2,5D, Sombrio, Terror Psicológico, Simulador de Caminhada, Comédia, Atmosférico, Terror, Memes"
The Severed Gods,2026,Indefinido,https://store.steampowered.com/app/3755930/The_Severed_Gods/?snr=1_7_7_popularcomingsoon_150_16,"Tática por Turnos, Roguelite, RPG, Estratégia, Em Turnos, Estratégia em Turnos, Fantasia Sombria, RPG de Grupos, Roguelike, 2,5D, Combate em Turnos, Geração Procedural, Explorador de Calabouços, Gráficos Pixelados, Fantasia, Alta Rejogabilidade, Atmosférico, Um Jogador, Comovente, Medieval"
Death at Fleming Manor,2026,Indefinido,https://store.steampowered.com/app/3758950/Death_at_Fleming_Manor/?snr=1_7_7_popularcomingsoon_150_16,"Investigação, Detetive, Mistério, Crime, Boa Trama, Lógica, Thriller, Conspiração, Desenhado à Mão, Atmosférico, Exploração, Aventura, Ficção Interativa, Simulador Médico, Um Jogador, Narrativa, Noir, Você Decide, Quebra-Cabeça, 2D"
Mexican Ninja,2026,Indefinido,https://store.steampowered.com/app/3764970/Mexican_Ninja/?snr=1_7_7_popularcomingsoon_150_16,"Porradaria, Roguelite, Um Jogador, Hack and Slash, Ninja, Roguelike de Ação, Câmera Lateral, Roguelike, Jogador X Ambiente (PvE), 2,5D, Boa Trama, Controle, Ação, Velha-Guarda, Humor Pesado, Colorido, Humor Ácido, Combate, Sátira, Retrô"
Car For Sale Together,2026,Indefinido,https://store.steampowered.com/app/3765640/Car_For_Sale_Together/?snr=1_7_7_popularcomingsoon_150_16,"Acesso Antecipado, Simulação, Corrida, Simulador Automobilístico, Simulador de Vida Real, Tiro em Primeira Pessoa (FPS), Simulador Imersivo, Tiro em Terceira Pessoa, 3D, Primeira Pessoa, Realístico, Cinematográfico, Terceira Pessoa, Para Toda a Família, Rico em Diálogos, Direção, Moderno, Mundo Aberto, Troca, Cooperativo"
Elevator,2026,Indefinido,https://store.steampowered.com/app/3769800/Elevator/?snr=1_7_7_popularcomingsoon_150_16,"Comédia, Cooperativo On-line, Multijogador, Terror, Cooperativo, Ação, Atmosférico, Colete Tudo, Não Linear, Surrealista, Primeira Pessoa, Engraçado, Estilizado, Fantasia, Física, Vários Finais, 3D, Um Jogador, Controle, Exploração"
Mondrayn,2026,Indefinido,https://store.steampowered.com/app/3780430/Mondrayn/?snr=1_7_7_popularcomingsoon_150_16,"RPG, Aventura, JRPG, 2D, Retrô, Gráficos Pixelados, Terror, Fantasia Sombria, Sombrio, Anime, Metroidvania, Atmosférico, Medieval, Pós-Apocalíptico, Vários Finais, Você Decide, Visão Superior, Exploração, Humor Ácido, Tática por Turnos"
HyperCore : Rhythm Bullet Hell,2026,Indefinido,https://store.steampowered.com/app/1112390/HyperCore__Rhythm_Bullet_Hell/?snr=1_7_7_popularcomingsoon_150_16,"Ação, Multijogador, Indie, Ritmo, Mandando Bala, Música, Ritmo Rápido, Inferno de Balas, Difícil, Arcade, Musical Procedural, Corrida Contra o Tempo, Multijogador Local, Colorido, Jogador x Jogador (PvP), Futurista, Um Jogador, Ficção Científica, Pontos, Pontos, Pontos!, Anos 80"
Greyskin,Q4 2026,Indefinido,https://store.steampowered.com/app/1123240/Greyskin/?snr=1_7_7_popularcomingsoon_150_16,"Hack and Slash, Explorador de Calabouços, RPG de Ação, Baseado em Classes, Personalização de Personagem, Saques, Fantasia Sombria, Gerenciamento de Inventário, Ação, Jogador X Ambiente (PvE), Exploração, Tiro com Saques, Geração Procedural, Isométrico, Um Jogador, Não Linear, Controle com Alavanca Dupla, RPG, Sombrio, Acesso Antecipado"
UN:Me,2026,Indefinido,https://store.steampowered.com/app/4167200/UNMe/?snr=1_7_7_popularcomingsoon_150_16,"Aventura, Ficção Interativa, 3D, Terror Psicológico, Psicológico, Protagonista Mulher, Investigação, Boa Trama, Vários Finais, Um Jogador, Terror, Mistério, Simulador Imersivo, Terceira Pessoa, Realístico, Abstrato, Cinematográfico"
Akina,2026,Indefinido,https://store.steampowered.com/app/4170840/Akina/?snr=1_7_7_popularcomingsoon_150_16,"Corrida, Direção, Simulador Automobilístico, Arcade, Atmosférico, 3D, Terceira Pessoa, Primeira Pessoa, Anos 90, Anime, Natureza, Relaxante, Casual, Mundo Aberto, Não Linear, Realístico, Jogador x Jogador (PvP), Cooperativo On-line, Multijogador, Jogador X Ambiente (PvE)"
PANLINE,2026,Indefinido,https://store.steampowered.com/app/4171660/PANLINE/?snr=1_7_7_popularcomingsoon_150_16,"Ação, Aventura, Parkour, Plataforma, Futurista, Primeira Pessoa, Exploração, 3D, Colorido, Protagonista Mulher, Um Jogador, Plataforma 3D, Atmosférico, Realístico, Acesso Antecipado, Não Linear, Mundo Aberto, Plataforma com Quebra-Cabeça, Indie, Cyberpunk"
Trees Hate You,2026,Indefinido,https://store.steampowered.com/app/4171850/Trees_Hate_You/?snr=1_7_7_popularcomingsoon_150_16,"Comédia, Engraçado, Paródia, Humor Ácido, Memes, Simulador de Caminhada, Humor Pesado, Surrealista, Aventura, Desenho Animado, 3D, Controle, Terceira Pessoa, Linear, Personalização de Personagem, Indie, Um Jogador, Cartunizado, Difícil, Visão Superior"
Dungeons of DUSK,2026,Indefinido,https://store.steampowered.com/app/4176460/Dungeons_of_DUSK/?snr=1_7_7_popularcomingsoon_150_16,"Explorador de Calabouços, RPG, Jogador X Ambiente (PvE), 2,5D, 3D, Primeira Pessoa, Subterrâneo, Controle, Desenhado à Mão, Lovecraftiano, Atmosférico, Anos 80, Anos 90, Velha-Guarda, Movimento em Grade, Combate, Um Jogador, Sobrevivência, Violência Detalhada, Terror"
Lured In,2026,Indefinido,https://store.steampowered.com/app/4178020/Lured_In/?snr=1_7_7_popularcomingsoon_150_16,"Pesca, Progressão Ociosa, Incremental, Gerenciamento de Lojas, Gerenciamento, Aconchegante, Construção, Capitalismo, Economia, Casual, Simulação, Natureza, Personalização de Personagem, Relaxante, Coleção de Criaturas, Minijogos, Um Jogador, 2D, Fofo, Saques"
Shadowstone,2026,Indefinido,https://store.steampowered.com/app/4180840/Shadowstone/?snr=1_7_7_popularcomingsoon_150_16,"Tática por Turnos, Roguelite, Roguelike, Jogador X Ambiente (PvE), Cartas, Estratégia em Turnos, Estratégia, 3D, Isométrico, Combate em Turnos, Tático, Fantasia Sombria, Baseado em Classes, Combate, Cooperativo, Cooperativo On-line, Multijogador, Um Jogador, Animais, Acesso Antecipado"
The Alley,2026,Indefinido,https://store.steampowered.com/app/4181410/The_Alley/?snr=1_7_7_popularcomingsoon_150_16,"Terror, Aventura, Terror Psicológico, Exploração, Simulação, Sombrio, Thriller, Boa Trama, Terror de Sobrevivência, Simulador de Caminhada, Protagonista Mulher, Mistério, Simulador Imersivo, Surrealista, Primeira Pessoa, Atmosférico, Quebra-Cabeça, Investigação, 3D, Um Jogador"
RadCity: A Post-Apocalyptic Adventure,Q4 2026,Indefinido,https://store.steampowered.com/app/4181440/RadCity_A_PostApocalyptic_Adventure/?snr=1_7_7_popularcomingsoon_150_16,"Pós-Apocalíptico, Aventura, Exploração, Atmosférico, Visão Superior, Sombrio, Um Jogador, Furtivo, Isométrico, 3D, Indie, Quebra-Cabeça, Realístico, Boa Trama, Sobrevivência, Narrativa"
Too Deep To Quit,2026,Indefinido,https://store.steampowered.com/app/4182190/Too_Deep_To_Quit/?snr=1_7_7_popularcomingsoon_150_16,"Multijogador, Aventura, Cooperativo On-line, Física, Exploração, Sobrevivência, Primeira Pessoa, 3D, Comédia, Engraçado, Cooperativo, Indie, Um Jogador, Ação, Ação / Aventura, Estilizado, Atmosférico, Geração Procedural, Terror de Sobrevivência, Roguelike de Ação"
Foxy Dumplings,2026,Indefinido,https://store.steampowered.com/app/4184130/Foxy_Dumplings/?snr=1_7_7_popularcomingsoon_150_16,"Culinária, Casual, Simulador de Vida Real, Fofo, Do Bem, Relaxante, 2D, Indie, Comovente, Gerenciamento de Lojas, Gerenciamento de Recursos, Gerenciamento de Tempo, Colorido, Desenhado à Mão, Estilizado, Personalização de Personagem, Um Jogador, Fabricação, Cartunizado, Aventura"
Kitman,Q4 2026,Indefinido,https://store.steampowered.com/app/4186890/Kitman/?snr=1_7_7_popularcomingsoon_150_16,"Esportes, Cooperativo On-line, Simulação, Cooperativo, Simulador de Emprego, Futebol, Multijogador, Primeira Pessoa, Gerenciamento, Engraçado, Simulador Imersivo, Gerenciamento de Lojas, Fabricação, Física, Um Jogador, Limpeza, Simulador de Vida Real, Ação, Comédia, Campanha Cooperativa"
Debauchery & Magic,December 2026,Indefinido,https://store.steampowered.com/app/4189120/Debauchery__Magic/?snr=1_7_7_popularcomingsoon_150_16,"Roguelike de Ação, RPG, Explorador de Calabouços, Pesca, Jogador X Ambiente (PvE), RPG de Ação, MMORPG, Personalização de Personagem, Aventura, Terceira Pessoa, Mundo Aberto, Gráficos Pixelados, Estilizado, Fantasia Sombria, Mágica, Mineração, Indie, Acesso Antecipado, Fabricação, Ação"
Fleshborn,2026,Indefinido,https://store.steampowered.com/app/4193300/Fleshborn/?snr=1_7_7_popularcomingsoon_150_16,"Casual, Progressão Ociosa, Incremental, Arcade, Simulação, Estratégia, Gráficos Pixelados, 2D, Relaxante, Colorido, Visão Superior, Ciência, Ficção Científica, Atmosférico, Futurista, Retrô, Gerenciamento de Recursos, Um Jogador, Terror"
GlagStone,Q4 2026,Indefinido,https://store.steampowered.com/app/4198840/GlagStone/?snr=1_7_7_popularcomingsoon_150_16,"Construção de Cidades, Simulador de Colônias, Boa Trama, Gerenciamento de Recursos, Mistério, Gerenciamento, Estratégia, Simulação, Construção, Atmosférico, Sobrevivência, Exploração, Retrô, Isométrico, Sombrio, Noir, 2D, Visão Superior, Um Jogador, Minimalista"
GemCraft - Legacy Collection,2026,Indefinido,https://store.steampowered.com/app/4207990/GemCraft__Legacy_Collection/?snr=1_7_7_popularcomingsoon_150_16,"Estratégia, Defesa de Torres, Difícil, Visão Superior, Tático, Casual, Fantasia, 2D, Estratégia em Tempo Real (RTS), Quebra-Cabeça, Ação, RPG, Mágica, Gerenciamento de Recursos, Medieval, Movimento em Grade, Fantasia Sombria, Minimalista, Indie, Um Jogador"
Defender of the Crown: The Legend Returns,2026,Indefinido,https://store.steampowered.com/app/4208140/Defender_of_the_Crown_The_Legend_Returns/?snr=1_7_7_popularcomingsoon_150_16,"RPG, Estratégia, Simulação, Roguelike, Estratégia em Tempo Real (RTS), RPG de Estratégia, Estratégia em Turnos, Tática em Tempo Real, Roguelite, 2D, Colorido, Gráficos Pixelados, Visão Superior, História Alternativa, Histórico, Medieval, Velha-Guarda, Político, Retrô, Tático"
Ore Factory Squad ⛏️,2026,Indefinido,https://store.steampowered.com/app/4210580/Ore_Factory_Squad/?snr=1_7_7_popularcomingsoon_150_16,"Simulação, Mineração, Faça o que Quiser, Cooperativo On-line, Automação, Cooperativo, Exploração, Construção, Gerenciamento, Simulador Imersivo, Economia, Primeira Pessoa, Atmosférico, Capitalismo, Construção de Bases, Fabricação, Transportes, Design e Ilustração, Gerenciamento de Recursos, Simulador de Colônias"
Forgotten Terror,2026,Indefinido,https://store.steampowered.com/app/4210670/Forgotten_Terror/?snr=1_7_7_popularcomingsoon_150_16,"Aventura, RPG, Mistério, Quebra-Cabeça, LGBTQIA+, Gráficos Pixelados, Exploração, Anime, Estilizado, Crime, Romance Visual, 2D, Um Jogador, Terror Psicológico, Terror, Indie, Comovente, Thriller, Vários Finais, Sobrenatural"
我的美味丈夫 My Tasty Husband,2026,Indefinido,https://store.steampowered.com/app/4214320/_My_Tasty_Husband/?snr=1_7_7_popularcomingsoon_150_16,"RPG, Ficção Interativa, Romance Visual, Fantasia, Terror Psicológico, Mistério, Surrealista, Protagonista Mulher, Vários Finais, Um Jogador"
Static Between Stations,2026,Indefinido,https://store.steampowered.com/app/4220770/Static_Between_Stations/?snr=1_7_7_popularcomingsoon_150_16,"Boa Trama, Você Decide, CRPG, Dados, Surrealista, RPG, Distópico, Exploração, Narrativa, Vários Finais, Um Jogador, Combate, Não Linear, Conspiração, Psicológico, Mundo Aberto, Mistério, Investigação, Atmosférico, Combate em Turnos"
DarkBazaar,2026,Indefinido,https://store.steampowered.com/app/4225250/DarkBazaar/?snr=1_7_7_popularcomingsoon_150_16,"Estratégia, Roguelike, Roguelite, 3D, Primeira Pessoa, Anos 90, Atmosférico, Jogos de Azar, Hacker, Terror, Capitalismo, Gerenciamento, Humor Pesado, Sombrio, Sobrevivência, Retrô, Economia, Você Decide, Vários Finais, Gerenciamento de Inventário"
Castlevania: Belmont's Curse,2026,Indefinido,https://store.steampowered.com/app/4231820/Castlevania_Belmonts_Curse/?snr=1_7_7_popularcomingsoon_150_16,Sem gênero
Crusader Kings III: Silk & Silver,Coming soon,$43.99,https://store.steampowered.com/app/4232910/Crusader_Kings_III_Silk__Silver/?snr=1_7_7_popularcomingsoon_150_16,"Estratégia, RPG, Simulação"
Sister Other Paranoia,2026,Indefinido,https://store.steampowered.com/app/4240150/Sister_Other_Paranoia/?snr=1_7_7_popularcomingsoon_150_16,"Terror Psicológico, Fofo, Romance Visual, Anime, Boa Trama, Escolha a sua Aventura, Sombrio, Vários Finais, Aventura, 2D, Violência Detalhada, Você Decide, Indie, Um Jogador, Engraçado"
Security 51,2026,Indefinido,https://store.steampowered.com/app/4246860/Security_51/?snr=1_7_7_popularcomingsoon_150_16,"Um Jogador, Simulação, Conspiração, Alienígenas, Gráficos Pixelados, Mistério, Apontar e Clicar, Terror, Ficção Científica, 2D, Simulador de Epidemias, Investigação, Detetive, Anos 90, Estratégia, Aventura, Quebra-Cabeça, Atmosférico, Casual, Exploração"
Misguided Remastered,2026,Indefinido,https://store.steampowered.com/app/4249080/Misguided_Remastered/?snr=1_7_7_popularcomingsoon_150_16,"Ação / Aventura, Quebra-Cabeça, Exploração, 3D, Realístico, Terceira Pessoa, Atmosférico, Sombrio, Terror, Terror Psicológico, Ação, Sobrenatural, Aventura, Terror de Sobrevivência, Você Decide, Combate, Um Jogador, Boa Trama, Protagonista Mulher, Linear"
Reshine,2026,Indefinido,https://store.steampowered.com/app/4253570/Reshine/?snr=1_7_7_popularcomingsoon_150_16,"Casual, Indie, Limpeza, Retrô, Relaxante, Um Jogador, Atmosférico, Colorido, Aconchegante, Para Toda a Família, Simulação, Curta-Metragem, 3D, Do Bem, Realístico, Velha-Guarda, Física, Organização"
We Are So Cooked,2026,Indefinido,https://store.steampowered.com/app/4258290/We_Are_So_Cooked/?snr=1_7_7_popularcomingsoon_150_16,"Casual, Engraçado, Cooperativo On-line, Física, Comédia, Reúna a Galera, Multijogador, Furtivo, Cooperativo, Faça o que Quiser, Exploração, Indie, 3D, Estilizado, Terceira Pessoa, Assalto, Um Jogador, Gratuito para Jogar"
Basement To The Sky,2026,Indefinido,https://store.steampowered.com/app/4258880/Basement_To_The_Sky/?snr=1_7_7_popularcomingsoon_150_16,"Simulador Imersivo, Simulador Espacial, Simulador de Vida Real, Fabricação, Física, Simulação, Educativo, Faça o que Quiser, 3D, Indie, Um Jogador, Primeira Pessoa, Mundo Aberto, Ficção Científica, Alta Rejogabilidade, Exploração, Construção, Voo, Estilizado, Lógica"
Milki Delivery,2026,Indefinido,https://store.steampowered.com/app/4259360/Milki_Delivery/?snr=1_7_7_popularcomingsoon_150_16,"Aventura, Exploração, Aconchegante, Desenhado à Mão, Simulador de Vida Real, Relaxante, Gerenciamento de Inventário, Gerenciamento de Recursos, Colorido, Fofo, Casual, Ciclismo, Natureza, Protagonista Mulher, Rico em Diálogos, Cartunizado, 2D, Gerenciamento, Simulação, Atmosférico"
