title,release_date,price,game_url,genres
Factory Planner,2025,Indefinido,https://store.steampowered.com/app/3679930/Factory_Planner/?snr=1_7_7_popularcomingsoon_150_8,"Exploração, Solitário, Faça o que Quiser, Automação, Fabricação, Gerenciamento, Estratégia, Cartas, Jogo de Mesa, Casual, 2D, Fofo, Simulação, Colorido, Ficção Científica, Gerenciamento de Recursos, Um Jogador, Indie, Acesso Antecipado"
Whimsy Bake＆Craft,Q4 2025,Indefinido,https://store.steampowered.com/app/3713000/Whimsy_BakeCraft/?snr=1_7_7_popularcomingsoon_150_8,"Casual, Simulação, Incremental, Anime, Plataforma 2D, Gráficos Pixelados, Simulador de Encontros, Apontar e Clicar, JRPG, Gerenciamento de Tempo, Clique e Clique, 2D, Visão Superior, Desenho Animado, Cartunizado, Fofo, Construção, Colorido, Fantasia, Relaxante"
CardVenture:JustAHead！,2025,Indefinido,https://store.steampowered.com/app/3720420/CardVentureJustAHead/?snr=1_7_7_popularcomingsoon_150_8,"Roguelike de Ação, Combate em Turnos, Cartas, Roguelite, Roguelike, RPG, Casual, Engraçado, Exploração, Estratégia em Turnos, Ação / Aventura, 2D, Visão Superior, Fofo, Ação, Relaxante, Fantasia, Montagem de Decks, Demônios, Aventura"
Pebbles Quest,2025,,https://store.steampowered.com/app/3002610/Pebbles_Quest/?snr=1_7_7_popularcomingsoon_150_8,"Aventura, Engraçado, Vários Finais, Escolha a sua Aventura, Comédia, Ficção Interativa, Medieval, Memes, Casual, Para Toda a Família, Desenhado à Mão, Apontar e Clicar, Um Jogador, Você Decide, 2D, Ação, Indie, Gratuito para Jogar"
One Last Raid,2025,Indefinido,https://store.steampowered.com/app/3027910/One_Last_Raid/?snr=1_7_7_popularcomingsoon_150_8,"Um Jogador, Ação, Roguelike, RPG, RPG de Ação, Isométrico, Medieval, Fantasia, Roguelike de Ação, Hack and Slash, 3D, Visão Superior, Você Decide, Combate, Roguelite, Estilizado, Fantasia Sombria, Controle, Saques"
Drive Thru Simulator,2025,Indefinido,https://store.steampowered.com/app/3062060/Drive_Thru_Simulator/?snr=1_7_7_popularcomingsoon_150_8,"Simulador Imersivo, Casual, Simulação, Automação, Fabricação, Simulador de Vida Real, Direção, 3D, Primeira Pessoa, Culinária, Indie, Realístico, Gerenciamento de Recursos, Um Jogador, Acesso Antecipado"
Alchemist: Journey of the Soul,2025,Indefinido,https://store.steampowered.com/app/3115240/Alchemist_Journey_of_the_Soul/?snr=1_7_7_popularcomingsoon_150_8,"Quebra-Cabeça, Mágica, Fofo, Relaxante, 3D, Boa Trama, Controle, Multijogador, Cooperativo, Fantasia, Linear, Casual, Colorido, Estilizado, Primeira Pessoa, Lógica, Detetive, Medieval, Exploração, Atmosférico"
NOOK FALL: West Town,2025,Indefinido,https://store.steampowered.com/app/3119700/NOOK_FALL_West_Town/?snr=1_7_7_popularcomingsoon_150_8,"Romance Visual, Isométrico, Apontar e Clicar, Retrô, Boa Trama, Estilizado, Ficção Interativa, Indie, Anos 80, Atmosférico, Drama, Minimalista, História Alternativa, Baseado em Texto, Desenhado à Mão, Exploração, Gerenciamento de Lojas, Casual, 2D, Um Jogador"
Echoes Below,Q4 2025,Indefinido,https://store.steampowered.com/app/3136340/Echoes_Below/?snr=1_7_7_popularcomingsoon_150_8,"Acesso Antecipado, Sobrevivência em Mundo Aberto, Construção de Bases, Tiro em Primeira Pessoa (FPS), Realístico, Tático, Fabricação, Faça o que Quiser, Tiro, Um Jogador, 3D, Primeira Pessoa, Militar, Sobrevivência, Estratégia, Exploração, Ação, Atmosférico, Mundo Aberto, Terror"
ユメザメの仮説,2025,Indefinido,https://store.steampowered.com/app/3155670/_/?snr=1_7_7_popularcomingsoon_150_8,"Simulador de Encontros, Escolha a sua Aventura, Vários Finais, Câmera Lateral, Aventura, Gráficos Pixelados, 2D, Fofo, Boa Trama, Manipulação de Tempo, Conversas, Você Decide, Atmosférico, Velha-Guarda, Um Jogador, Controle, Simulação, Psicológico, Ação / Aventura, Romance Visual"
Rogue Factory,2025,Indefinido,https://store.steampowered.com/app/3212630/Rogue_Factory/?snr=1_7_7_popularcomingsoon_150_8,"Automação, Roguelike de Ação, Sobrevivência, Gráficos Pixelados, Gerenciamento de Recursos, Construção, Um Jogador, Roguelite, Jogador X Ambiente (PvE), Roguelike, Construção de Bases, Ação, Gerenciamento, Mágica, Simulação, 2D, Visão Superior, Você Decide, Gerenciamento de Inventário, Fabricação"
DIGESTED,2025,Indefinido,https://store.steampowered.com/app/2605900/DIGESTED/?snr=1_7_7_popularcomingsoon_150_8,"Terror de Sobrevivência, Um Jogador, Terror, Curta-Metragem, Realístico, Sobrevivência, Indie, Ação, Ação / Aventura, Furtivo, Física, Exploração, Primeira Pessoa, Atmosférico, Imersivo, 3D, Aventura, Terror Psicológico, Cinematográfico"
NOOK FALL: West Town,2025,Indefinido,https://store.steampowered.com/app/3119700/NOOK_FALL_West_Town/?snr=1_7_7_popularcomingsoon_150_9,"Romance Visual, Isométrico, Apontar e Clicar, Retrô, Boa Trama, Estilizado, Ficção Interativa, Indie, Anos 80, Atmosférico, Drama, Minimalista, História Alternativa, Baseado em Texto, Desenhado à Mão, Exploração, Gerenciamento de Lojas, Casual, 2D, Um Jogador"
Echoes Below,4º trimestre de 2025,Indefinido,https://store.steampowered.com/app/3136340/Echoes_Below/?snr=1_7_7_popularcomingsoon_150_9,"Acesso Antecipado, Sobrevivência em Mundo Aberto, Construção de Bases, Tiro em Primeira Pessoa (FPS), Realístico, Tático, Fabricação, Faça o que Quiser, Tiro, Um Jogador, 3D, Primeira Pessoa, Militar, Sobrevivência, Estratégia, Exploração, Ação, Atmosférico, Mundo Aberto, Terror"
ユメザメの仮説,2025,Indefinido,https://store.steampowered.com/app/3155670/_/?snr=1_7_7_popularcomingsoon_150_9,"Simulador de Encontros, Escolha a sua Aventura, Vários Finais, Câmera Lateral, Aventura, Gráficos Pixelados, 2D, Fofo, Boa Trama, Manipulação de Tempo, Conversas, Você Decide, Atmosférico, Velha-Guarda, Um Jogador, Controle, Simulação, Psicológico, Ação / Aventura, Romance Visual"
Rogue Factory,2025,Indefinido,https://store.steampowered.com/app/3212630/Rogue_Factory/?snr=1_7_7_popularcomingsoon_150_9,"Automação, Roguelike de Ação, Sobrevivência, Gráficos Pixelados, Gerenciamento de Recursos, Construção, Um Jogador, Roguelite, Jogador X Ambiente (PvE), Roguelike, Construção de Bases, Ação, Gerenciamento, Mágica, Simulação, 2D, Visão Superior, Você Decide, Gerenciamento de Inventário, Fabricação"
LOVE Hotel Simulator 🏩,2025,Indefinido,https://store.steampowered.com/app/3426430/LOVE_Hotel_Simulator/?snr=1_7_7_popularcomingsoon_150_9,"Simulador Imersivo, Faça o que Quiser, Construção, Gerenciamento de Recursos, Gerenciamento, Física, Realístico, Você Decide, Moderno, Boa Trama, 3D, Casual, Primeira Pessoa, Mundo Aberto, Simulação, Estratégia, RPG, Gratuito para Jogar, Um Jogador, Simulador de Vida Real"
LOVE SHOP Simulator 💕🛒,2025,Indefinido,https://store.steampowered.com/app/3426440/LOVE_SHOP_Simulator/?snr=1_7_7_popularcomingsoon_150_9,"Simulação, Gerenciamento, Economia, Colete Tudo, Um Jogador, Capitalismo, Jogo de Cartas, Cartas, Simulador Imersivo, Troca, Casual, 3D, Relaxante, Gerenciamento de Lojas, Fofo, Realístico, Você Decide, Simulador de Vida Real, Indie, Conteúdo Sexual"
恋爱泡馍！青春老陕：Shannxi Love Story,2025,Indefinido,https://store.steampowered.com/app/3453470/Shannxi_Love_Story/?snr=1_7_7_popularcomingsoon_150_9,"RPG, Casual, Simulador de Encontros, Romance Visual, Jogo de Palavras, 2D, Anime, Fofo, Drama, Indie, Simulação, Comovente, Relaxante, Boa Trama, Um Jogador"
Holder of Place,Q4 2025,Indefinido,https://store.steampowered.com/app/3464970/Holder_of_Place/?snr=1_7_7_popularcomingsoon_150_9,"Batalha Automática, Roguelike, Estratégia, Batalha com Cartas, Atmosférico, Fantasia Sombria, Indie, Cartas, 2D, Ficção Científica, Espacial, Futurista, Um Jogador, Jogador X Ambiente (PvE), Tática por Turnos, Enredo Rico"
They Killed Your Cat,2025,Indefinido,https://store.steampowered.com/app/3489420/They_Killed_Your_Cat/?snr=1_7_7_popularcomingsoon_150_9,"Tiro em Primeira Pessoa (FPS), Difícil, Tiro, Primeira Pessoa, Terror, Engraçado, Personalização de Armas, Ação, Minimalista, Realístico, Thriller, Zumbis, Física, Combate, Um Jogador, Sangue, Violência Detalhada, Violento, Indie, Casual"
Blind Touch,2025,Indefinido,https://store.steampowered.com/app/3521660/Blind_Touch/?snr=1_7_7_popularcomingsoon_150_9,"Simulador de Caminhada, Quebra-Cabeça, Exploração, Simulação, Comovente, Imersivo, Educativo, Primeira Pessoa, Aventura, Indie, Atmosférico, Boa Trama, Linear, Um Jogador, Casual"
Moving Simulator,2025,Indefinido,https://store.steampowered.com/app/3525060/Moving_Simulator/?snr=1_7_7_popularcomingsoon_150_9,"Simulação, Física, Simulador de Vida Real, Direção, Gerenciamento, Economia, Faça o que Quiser, Transportes, Relaxante, Capitalismo, Mundo Aberto, Simulador Imersivo, Indie, Realístico, Primeira Pessoa, Gerenciamento de Recursos, Um Jogador, Casual, 3D, Gerenciamento de Inventário"
Townseek,2025,Indefinido,https://store.steampowered.com/app/1659360/Townseek/?snr=1_7_7_popularcomingsoon_150_9,"Aconchegante, Boa Trama, Troca, Colete Tudo, Do Bem, Aventura, Exploração, Mundo Aberto, Relaxante, 2D, Casual, Gerenciamento, Natureza, Faça o que Quiser, Fofo, Arcade, Desenho Animado, Um Jogador, Gerenciamento de Inventário, Gráficos Pixelados"
DEATHGRIP,2025,Indefinido,https://store.steampowered.com/app/1721590/DEATHGRIP/?snr=1_7_7_popularcomingsoon_150_9,"Corrida, Ação, Corrida com Combate, Arcade, Jogador x Jogador (PvP), Multijogador, Multijogador Assíncrono, Jogador X Ambiente (PvE), Competitivo, Indie, Um Jogador, Acesso Antecipado, Ritmo Rápido, Primeira Pessoa, Terceira Pessoa, Controle, Combate com Veículos, Combate, 3D, Ficção Científica"
Train Mechanic Simulator 2025,2025,Indefinido,https://store.steampowered.com/app/1773220/Train_Mechanic_Simulator_2025/?snr=1_7_7_popularcomingsoon_150_9,"Simulação, Trens, Casual, Simulador Imersivo, Transportes, Apontar e Clicar, Construção, Quebra-Cabeça, Primeira Pessoa, 3D, Realístico, EUA, Automação, Educativo, Economia, Atmosférico, Compatível com Mods, Lógica, Relaxante, Gerenciamento de Tempo"
Life After End,2025,Indefinido,https://store.steampowered.com/app/1792390/Life_After_End/?snr=1_7_7_popularcomingsoon_150_9,"Tiro com Saques, Tiro em Primeira Pessoa (FPS), Sobrevivência, Fabricação, Natureza, Jogador x Jogador (PvP), Jogador X Ambiente (PvE), Construção de Bases, Física, Tiro, Personalização de Personagem, 3D, Primeira Pessoa, Pós-Apocalíptico, Personalização de Armas, Baseado em Equipes, Mundo Aberto, Simulação, Ação, Realístico"
Everstorm,2025,,https://store.steampowered.com/app/1292510/Everstorm/?snr=1_7_7_popularcomingsoon_150_9,"Acesso Antecipado, Tiro de Extração, Battle Royale, MOBA, Roguelite, Explorador de Calabouços, Baseado em Classes, Multijogador, Estratégia, Jogador x Jogador (PvP), Gratuito para Jogar, Roguelike, Roguelike de Ação, Hack and Slash, RPG, Chuva de Balas, Cooperativo On-line, Visão Superior, Saques, Fantasia"
Queen's Loyalty,4º trimestre de 2025,Indefinido,https://store.steampowered.com/app/1841360/Queens_Loyalty/?snr=1_7_7_popularcomingsoon_150_9,"Ação, Aventura, RPG, Ação / Aventura, RPG de Ação, Exploração, 3D, Terceira Pessoa, Fantasia, Jogador X Ambiente (PvE), Física, Combate, Conteúdo Sexual, Um Jogador, Para Adultos, Impróprio para o Local de Trabalho, 2D, Fofo, Anime, Tiro em Terceira Pessoa"
U-Boot: The Board Game - Digital Edition,Q4 2025,Indefinido,https://store.steampowered.com/app/1897450/UBoot_The_Board_Game__Digital_Edition/?snr=1_7_7_popularcomingsoon_150_9,"Jogo de Tabuleiro, Segunda Guerra Mundial, Submarino, Tática em Tempo Real, Histórico, Gerenciamento de Tempo, Jogo de Guerra, Guerra, Militar, Gerenciamento, Jogo de Mesa, 3D, Simulação, Combate Naval, Realístico, Tático, Combate, Um Jogador, Estratégia, Indie"
Scrabdackle,4º trimestre de 2025,Indefinido,https://store.steampowered.com/app/1578720/Scrabdackle/?snr=1_7_7_popularcomingsoon_150_9,"Acesso Antecipado, Soulslike, Mundo Aberto, Metroidvania, Combate, Não Linear, Ação / Aventura, Velha-Guarda, Engraçado, Boa Trama, Exploração, Mágica, Desenho Animado, Ação, Desenhado à Mão, Aventura, Fofo, Visão Superior, Colorido, 2D"
March March!,2025,Indefinido,https://store.steampowered.com/app/1607300/March_March/?snr=1_7_7_popularcomingsoon_150_9,"Tática por Turnos, Batalha Automática, Roguelike, Desenhado à Mão, Um Jogador, Estratégia, Aventura, Fofo, Combate em Turnos, Baseado em Classes, Fantasia, Tático, 2D, Roguelite, Estratégia em Turnos, Movimento em Grade, Você Decide, Gerenciamento de Tempo, Quebra-Cabeça, Multijogador"
Enemy of the State,2025,Indefinido,https://store.steampowered.com/app/2012040/Enemy_of_the_State/?snr=1_7_7_popularcomingsoon_150_9,"Ação, Cooperativo, Cooperativo On-line, Visão Superior, SHMUP com Visão Superior, Atmosférico, Assalto, Tiro, Controle com Alavanca Dupla, Personalização de Personagem, Crime, Isométrico, Combate, Noir, Jogador X Ambiente (PvE), 3D, Detetive, Histórico, Um Jogador, Controle"
Nowhere Manor,Q4 2025,Indefinido,https://store.steampowered.com/app/2017120/Nowhere_Manor/?snr=1_7_7_popularcomingsoon_150_9,"Fantasia Sombria, Demônios, Desenhado à Mão, Gótico, Vários Finais, Romance Visual, Boa Trama, Atmosférico, Estilizado, Sombrio, Enredo Rico, Escolha a sua Aventura, Ficção Interativa, Você Decide, Psicodélico, Mistério, Indie, Distópico, Aventura, 2D"
Game Cafe,2025,Indefinido,https://store.steampowered.com/app/2051890/Game_Cafe/?snr=1_7_7_popularcomingsoon_150_9,"Acesso Antecipado, Casual, Cartas, Jogo de Mesa, Jogo de Tabuleiro, Multijogador, Jogador x Jogador (PvP), 3D, Primeira Pessoa"
SUMMER ROAD 10-Minute Auto Roguelite,2025,Indefinido,https://store.steampowered.com/app/2073980/SUMMER_ROAD_10Minute_Auto_Roguelite/?snr=1_7_7_popularcomingsoon_150_9,"Batalha Automática, Roguelite, Fofo, Roguelike de Ação, Curta-Metragem, Multijogador Assíncrono, RPG, Um Jogador, Visão Superior, Casual, Personalização de Personagem, Protagonista Mulher, 3D, Aventura, Controle, Você Decide, Atmosférico, Gerenciamento de Inventário, Hack and Slash, Incremental"
Jury Trial,2025,Indefinido,https://store.steampowered.com/app/1389140/Jury_Trial/?snr=1_7_7_popularcomingsoon_150_9,"Simulador Imersivo, Simulador Político, RPG de Estratégia, RPG, 2D, Boa Trama, Você Decide, Vários Finais, Conversas, Tático, Política, Político, Editor de Níveis, Crime, Investigação, Atmosférico, Drama, Conspiração, Um Jogador, Indie"
Detained: Too Good for School,2025,Indefinido,https://store.steampowered.com/app/1394650/Detained_Too_Good_for_School/?snr=1_7_7_popularcomingsoon_150_9,"Ação, Porradaria, RPG de Ação, Protagonista Mulher, Mundo Aberto, Crime, 2D, Desenhado à Mão, Boa Trama, Fofo, Aventura, RPG, Simulação, Indie, Acesso Antecipado, Anime, Um Jogador, Vários Finais, Kickstarter, Financiado Colaborativamente"
Food Industry,Q4 2025,Indefinido,https://store.steampowered.com/app/1153750/Food_Industry/?snr=1_7_7_popularcomingsoon_150_9,"Construção de Cidades, Simulador de Colônias, Automação, Pós-Apocalíptico, Agricultura, Estratégia, Gerenciamento, Gerenciamento de Recursos, Troca, Construção, Economia, Simulação, Relaxante, Acesso Antecipado, Fabricação, Gerenciamento de Tempo, Um Jogador, 3D, Faça o que Quiser, Isométrico"
I Am Jesus Christ,Q4 2025,Indefinido,https://store.steampowered.com/app/1198970/I_Am_Jesus_Christ/?snr=1_7_7_popularcomingsoon_150_9,"Simulação, Aventura, Indie, Casual, Ação, Ficção Interativa, Histórico, Realístico, Primeira Pessoa, Mundo Aberto, Um Jogador, Atmosférico, Boa Trama, Relaxante, Jogo de Divindade, Ação / Aventura, Fé, Simulador de Vida Real, Exploração, Simulador Imersivo"
Wrekless™,2025,Indefinido,https://store.steampowered.com/app/1931930/Wrekless/?snr=1_7_7_popularcomingsoon_150_9,"Acesso Antecipado, Esportes, Skate, Multijogador, Editor de Níveis, Cooperativo On-line, Personalização de Personagem, Patinação (e Skate), Indie, Jogador x Jogador (PvP), Construção, Arcade, 3D, Terceira Pessoa, Controle, Não Linear, Cartunizado, Física, Um Jogador, Colorido"
DearMyFriend,2025,Indefinido,https://store.steampowered.com/app/1953430/DearMyFriend/?snr=1_7_7_popularcomingsoon_150_9,"Gráficos Pixelados, RPG de Ação, Protagonista Mulher, Boa Trama, Exploração, RPG, Explorador de Calabouços, Ação, Ação / Aventura, Aventura, História em Quadrinhos, Um Jogador, JRPG, Distópico, Indie"
VICE Undercover,4º trimestre de 2025,Indefinido,https://store.steampowered.com/app/1953850/VICE_Undercover/?snr=1_7_7_popularcomingsoon_150_9,"Simulação, Retrô, Protagonista Mulher, História Alternativa, Aventura, Crime, Conspiração, Thriller, Investigação, Gerenciamento de Tempo, Simulador Imersivo, Anos 80, Vários Finais, Estilizado, Um Jogador, Apontar e Clicar, Quebra-Cabeça, Romance Visual, Exploração, Trilha Sonora"
Sugoi Adventure! DragonSlayer,dezembro de 2025,Indefinido,https://store.steampowered.com/app/1936310/Sugoi_Adventure_DragonSlayer/?snr=1_7_7_popularcomingsoon_150_9,"Romance Visual, Cartas, RPG, Hentai, Anime, Fantasia, Conteúdo Sexual, Escolha a sua Aventura, Nudez, Comédia, 2D, Humor Ácido, Engraçado, Você Decide, Vários Finais, Aventura, Simulação, Um Jogador, Protagonista Mulher"
DROSS,2025,Indefinido,https://store.steampowered.com/app/2083940/DROSS/?snr=1_7_7_popularcomingsoon_150_9,"Roguelite, Cooperativo On-line, Tiro com Saques, RPG de Ação, Saques, Tiro de Tiozão, Jogador X Ambiente (PvE), Roguelike, Terror, Roguelike de Ação, Geração Procedural, Ação, Estilizado, Tiro, Alienígenas, Ficção Científica, Cooperativo, Simulador Imersivo, Tiro em Arena, Primeira Pessoa"
The Third Shift,4º trimestre de 2025,Indefinido,https://store.steampowered.com/app/2079480/The_Third_Shift/?snr=1_7_7_popularcomingsoon_150_9,"Aventura, Terror, Quebra-Cabeça, Simulador de Caminhada, Retrô, Vários Finais, Gráficos Pixelados, Apontar e Clicar, Mistério, 2D, Investigação, Anos 90, Atmosférico, Velha-Guarda, Você Decide, Boa Trama, Um Jogador, Indie"
The Last Citadel,2025,Indefinido,https://store.steampowered.com/app/1892090/The_Last_Citadel/?snr=1_7_7_popularcomingsoon_150_9,"Ação, Tiro em Terceira Pessoa, Roguelike, Estilizado, Demônios, Saques, Espacial, Steampunk, Personalização de Personagem, Geração Procedural, Cooperativo, Multijogador, Cooperativo On-line, Um Jogador, Roguelike de Ação, Roguelite, Terceira Pessoa, Arcade"
ALARA Prime,2025,Free,https://store.steampowered.com/app/971700/ALARA_Prime/?snr=1_7_7_popularcomingsoon_150_9,"Tiro em Primeira Pessoa (FPS), Tiro em Arena, Jogador x Jogador (PvP), Primeira Pessoa, Competitivo, Gratuito para Jogar, Multijogador, Tático, Tiro, Baseado em Equipes, Ação, Ficção Científica, Realístico, Futurista, Combate, 3D, Furtivo, Violento, Controle, Cyberpunk"
Dead Weight,4º trimestre de 2025,Indefinido,https://store.steampowered.com/app/2646720/Dead_Weight/?snr=1_7_7_popularcomingsoon_150_9,"Estratégia, Combate em Turnos, RPG, Alta Rejogabilidade, Em Turnos, Estratégia em Turnos, Tático, Gráficos Pixelados, Aventura, Roguelike, Tática por Turnos, Faça o que Quiser, Roguelite, RPG Tático, Um Jogador, Fantasia Sombria, Piratas, Indie, Steampunk, Isométrico"
DODORI,2025,Indefinido,https://store.steampowered.com/app/2903240/DODORI/?snr=1_7_7_popularcomingsoon_150_9,"Ritmo, Música, Casual, Ação, Anime, Multijogador, Um Jogador, 2D, Competitivo, Arcade, Fofo, Difícil, 3D, Acesso Antecipado, Gráficos Pixelados, Fantasia, Jogador x Jogador (PvP), Jogador X Ambiente (PvE), Esportes, Exploração"
Angeline Era,2025,Indefinido,https://store.steampowered.com/app/2393920/Angeline_Era/?snr=1_7_7_popularcomingsoon_150_9,"Ação / Aventura, Hack and Slash, Não Linear, Visão Superior, Fantasia, 3D, Engraçado, Atmosférico, Mitologia, Natureza, Exploração, LGBTQIA+, Boa Trama, Aventura, Um Jogador, Controle, História Alternativa, Ação, Comédia, Indie"
Claire a la Mode,2025,Indefinido,https://store.steampowered.com/app/2292860/Claire_a_la_Mode/?snr=1_7_7_popularcomingsoon_150_9,"Casual, Arcade, Plataforma 2D, Cooperativo Local, Protagonista Mulher, Minijogos, Fofo, Colorido, Culinária, Boa Trama, Pontos, Pontos, Pontos!, Câmera Lateral, Um Jogador, Ação, Plataforma, Gráficos Pixelados, Para Toda a Família, Vários Finais, Retrô, Mágica"
Adaptory,2025,Indefinido,https://store.steampowered.com/app/2201620/Adaptory/?snr=1_7_7_popularcomingsoon_150_9,"Simulação, Simulador de Colônias, Construção de Bases, Boa Trama, Indie, Sobrevivência, Geração Procedural, Gerenciamento de Recursos, Automação, 2D, Um Jogador, Ficção Científica, Colorido, Gerenciamento, Compatível com Mods, Construção, Exploração, Ciência, Física, Tutorial"
Carnival Massacre,2025,Indefinido,https://store.steampowered.com/app/2304730/Carnival_Massacre/?snr=1_7_7_popularcomingsoon_150_9,"Terror de Sobrevivência, Terror, Retrô, Ação, Gerenciamento de Inventário, Protagonista Mulher, Aventura, Atmosférico, Exploração, Velha-Guarda, Gerenciamento de Recursos, Quebra-Cabeça, Ação / Aventura, Terceira Pessoa, Um Jogador, Tiro em Terceira Pessoa, Sobrevivência, Sombrio, Terror Psicológico, Zumbis"
Family Land - Farmer Simulator,2025,Indefinido,https://store.steampowered.com/app/2334600/Family_Land__Farmer_Simulator/?snr=1_7_7_popularcomingsoon_150_9,"Simulação, Casual, Simulador Rural, Simulador de Vida Real, Faça o que Quiser, Simulador Imersivo, Gerenciamento de Tempo, 3D, Primeira Pessoa, Realístico, Agricultura, EUA, Atmosférico, Construção, Capitalismo, Economia, Para Toda a Família, Gerenciamento, Moderno, Natureza"
ELDRIMAR,2025,Indefinido,https://store.steampowered.com/app/2349420/ELDRIMAR/?snr=1_7_7_popularcomingsoon_150_9,"Acesso Antecipado, Boa Trama, Soulslike, Enredo Rico, Fantasia Sombria, Sombrio, Fantasia, RPG de Ação, Atmosférico, Primeira Pessoa, Aventura, RPG, Demônios, Mundo Aberto, Mágica, CRPG, Ação / Aventura, Ação, Medieval, Zumbis"
Karting of Banban,2025,Indefinido,https://store.steampowered.com/app/3248310/Karting_of_Banban/?snr=1_7_7_popularcomingsoon_150_9,"Corrida, Arcade, 3D, Corrida com Combate, Terror, Ação, Cartunizado, Aventura, Colorido, Casual, Multijogador, Fofo, Multijogador Local, Física, Comédia, Direção, Estilizado, Ação / Aventura, Psicodélico, Para Toda a Família"
SpaceCraft,2025,Indefinido,https://store.steampowered.com/app/3276050/SpaceCraft/?snr=1_7_7_popularcomingsoon_150_9,"Acesso Antecipado, Espacial, Ficção Científica, Aventura, Mundo Aberto, Faça o que Quiser, Exploração, Simulação, Um Jogador, Multijogador, Simulador Espacial, Fabricação, Primeira Pessoa, Construção de Bases, Jogador x Jogador (PvP), Multijogador Massivo, Cooperativo, Automação, Jogador X Ambiente (PvE), Gerenciamento de Recursos"
Home Wars: Battlefield,Q4 2025,Indefinido,https://store.steampowered.com/app/3279330/Home_Wars_Battlefield/?snr=1_7_7_popularcomingsoon_150_9,"Jogador X Ambiente (PvE), Cooperativo On-line, Faça o que Quiser, Guerra, Construção de Bases, Um Jogador, Baseado em Classes, Tiro em Primeira Pessoa (FPS), Tiro, Tiro em Terceira Pessoa, Dinossauros, Combate com Veículos, Combate Naval, Jogo de Guerra, Tanques, Mechas, Atmosférico, Multijogador, Cooperativo, Militar"
Assassin Story,2025,Indefinido,https://store.steampowered.com/app/3290590/Assassin_Story/?snr=1_7_7_popularcomingsoon_150_9,"Batalha com Cartas, Tática por Turnos, Exploração, Sokoban, Roguelite, Estratégia, RPG, Explorador de Calabouços, Artes Marciais, Cartas, Roguelike, Protagonista Mulher, Steampunk, História Alternativa, Combate em Turnos, Montagem de Decks, Aventura, Casual, Estilizado, Tático"
Styx: Blades of Greed,Q4 2025,Indefinido,https://store.steampowered.com/app/3290690/Styx_Blades_of_Greed/?snr=1_7_7_popularcomingsoon_150_9,Sem gênero
The Sisterhood Pasture: Cozy Folklore Farming,2025,Indefinido,https://store.steampowered.com/app/3297080/The_Sisterhood_Pasture_Cozy_Folklore_Farming/?snr=1_7_7_popularcomingsoon_150_9,"Casual, Aconchegante, Simulador Rural, Protagonista Mulher, Simulador de Vida Real, Gráficos Pixelados, Simulador Imersivo, 2D, Fofo, Colorido, Drama, Simulação, Culinária, Romance, Gatos, Moderno, Boa Trama, Combate, Um Jogador, Multijogador"
Keep the Heroes Out,2025,Indefinido,https://store.steampowered.com/app/2592340/Keep_the_Heroes_Out/?snr=1_7_7_popularcomingsoon_150_10,"Jogo de Tabuleiro, Cartas, Jogo de Mesa, Estratégia em Turnos, Estratégia, 3D, Visão Superior, Engraçado, Montagem de Decks, Cartunizado, Colorido, Fantasia, Desenho Animado, Local para 4 Jogadores, Cooperativo, Campanha Cooperativa, Cooperativo Local, Multijogador Local, Multijogador, Cooperativo On-line"
DDS x Narcos,2025,Indefinido,https://store.steampowered.com/app/2593570/DDS_x_Narcos/?snr=1_7_7_popularcomingsoon_150_10,"Aventura, Indie, Simulação, Ação, Fabricação, Faça o que Quiser, Primeira Pessoa, Atmosférico, Realístico, Um Jogador, Troca, Estratégia, Para Adultos, Gerenciamento de Inventário, Crime, Gerenciamento de Recursos, Gerenciamento, Anos 80, Você Decide, Vários Finais"
Love Nest,2025,Indefinido,https://store.steampowered.com/app/2595110/Love_Nest/?snr=1_7_7_popularcomingsoon_150_10,"Simulador de Encontros, Terror Psicológico, Boa Trama, Fuja da Sala, Fofo, Romance, Ficção Interativa, Quebra-Cabeça, RPG, Exploração, Clique e Clique, Romance Visual, Narração Dinâmica, 2D, Vários Finais, Anime, Desenho Animado, Drama, Atmosférico, Comovente"
