title,release_date,price,game_url,genres
Tokyo Mafia Simulator,Q3 2025,Indefinido,https://store.steampowered.com/app/2850840/Tokyo_Mafia_Simulator/?snr=1_7_7_popularcomingsoon_150_7,"Acesso Antecipado, Crime, Exploração, Assalto, Economia, Tiro em Primeira Pessoa (FPS), Simulador Imersivo, Gerenciamento, Hacker, Jogador X Ambiente (PvE), Troca, Simulador de Vida Real, JRPG, Ação / Aventura, 3D, Primeira Pessoa, Mundo Aberto, Ação, Simulação, Colorido"
Rhythm Storm,Q3 2025,Indefinido,https://store.steampowered.com/app/2135960/Rhythm_Storm/?snr=1_7_7_popularcomingsoon_150_7,"Chuva de Balas, Roguelike de Ação, Tiro em Arena, 2D, Ritmo, Geração Procedural, Ação, SHMUP com Visão Superior, Estilizado, Roguelite, Mandando Bala, Roguelike, Arcade, Musical Procedural, Psicodélico, Visão Superior, Cyberpunk, Futurista, Retrô, Ficção Científica"
Frozen Ship,Q3 2025,Indefinido,https://store.steampowered.com/app/3423990/Frozen_Ship/?snr=1_7_7_popularcomingsoon_150_7,"Acesso Antecipado, Neve, Sobrevivência, Atmosférico, Aventura, Pós-Apocalíptico, Exploração, Economia, Geração Procedural, Gerenciamento de Recursos, Ação, Construção de Bases, Estratégia, Fabricação, Construção, Um Jogador, Distópico, Objetos Ocultos, Ação / Aventura, Gerenciamento"
Rain98,Q3 2025,Indefinido,https://store.steampowered.com/app/3498720/Rain98/?snr=1_7_7_popularcomingsoon_150_7,"Aventura, Casual, Simulação, Terror Psicológico, Fofo, Romance, Anime, Romance Visual, Apontar e Clicar, Escolha a sua Aventura, Plataforma 2D, 2D, Relaxante, Atmosférico, Vários Finais, Boa Trama, Você Decide, Um Jogador, Indie"
Day of the Shell,Q3 2025,Indefinido,https://store.steampowered.com/app/3008340/Day_of_the_Shell/?snr=1_7_7_popularcomingsoon_150_7,"Tática por Turnos, Exploração, Roguelite, RPG, Tático, Atmosférico, Isométrico, 3D, Natureza, Em Turnos, Estratégia, Estratégia em Turnos, Jogador X Ambiente (PvE), Um Jogador, Protagonista Mulher, Cartunizado, Colorido, Combate em Turnos"
Katanaut,Q3 2025,Indefinido,https://store.steampowered.com/app/3032830/Katanaut/?snr=1_7_7_popularcomingsoon_150_7,"Roguelike de Ação, Hack and Slash, Fantasia Sombria, Roguevania, Pós-Apocalíptico, Soulslike, Roguelite, Metroidvania, Roguelike, RPG de Ação, Gráficos Pixelados, Ritmo Rápido, Ação, Geração Procedural, Zumbis, Cyberpunk, Manipulação de Tempo, Difícil, Atmosférico, Um Jogador"
Flow Of War,Q3 2025,Indefinido,https://store.steampowered.com/app/2637210/Flow_Of_War/?snr=1_7_7_popularcomingsoon_150_7,"Estratégia, Estratégia em Tempo Real com Ação, Estratégia em Tempo Real (RTS), Batalha Automática, Defesa de Torres, Construção de Bases, Automação, Geração Procedural, Medieval, Tática em Tempo Real, Gráficos Pixelados, 2D, Visão Superior, Construção, Simulador Rural, Fantasia Sombria, Demônios, Mágica, Guerra, Mineração"
The Chronos Event,Q3 2025,Indefinido,https://store.steampowered.com/app/2477470/The_Chronos_Event/?snr=1_7_7_popularcomingsoon_150_7,"Roguelike de Ação, Ação, Roguelite, Um Jogador, Roguelike, Protagonista Mulher, Tiro, Difícil, Tiro com Saques, Chuva de Balas, Morte Permanente, Alta Rejogabilidade, Tiro em Terceira Pessoa, Atmosférico, Acesso Antecipado, Ritmo Rápido, Manipulação de Tempo, Viagem no Tempo, Terceira Pessoa, Aventura"
Mike goes on hike,Q3 2025,Indefinido,https://store.steampowered.com/app/912000/Mike_goes_on_hike/?snr=1_7_7_popularcomingsoon_150_7,"Simulação, Aventura, Simulador de Caminhada, Sobrevivência, Exploração, Atmosférico, Um Jogador, Relaxante, Primeira Pessoa, Para Toda a Família, Boa Trama, Estilizado, Comovente, Comédia, Linear, Vários Finais, Você Decide, Multijogador, Cooperativo, Indie"
Daymare Town,Q3 2025,Indefinido,https://store.steampowered.com/app/2619240/Daymare_Town/?snr=1_7_7_popularcomingsoon_150_7,"Exploração, Apontar e Clicar, Aventura, 2D, Humor Ácido, Boa Trama, Abstrato, Desenhado à Mão, Minimalista, Indie, Atmosférico, Um Jogador, Quebra-Cabeça, Objetos Ocultos, Estilizado, Fantasia Sombria, Distópico, Pós-Apocalíptico, Controle, Conversas"
Chaos Front,Q3 2025,Indefinido,https://store.steampowered.com/app/2770330/Chaos_Front/?snr=1_7_7_popularcomingsoon_150_7,"Tática por Turnos, RPG Tático, Em Turnos, Estratégia em Turnos, RPG de Grupos, RPG de Estratégia, Grande Estratégia, JRPG, Estratégia, RPG, 2D, Mechas, Combate em Turnos, Mundo Aberto, Gráficos Pixelados, Anime, Espacial, Ficção Científica, Guerra, Um Jogador"
AFTERBLAST,Q3 2025,Indefinido,https://store.steampowered.com/app/1338490/AFTERBLAST/?snr=1_7_7_popularcomingsoon_150_7,"Tiro em Primeira Pessoa (FPS), Cooperativo On-line, Roguelike de Ação, Roguelite, Cooperativo, Ação, Roguelike, Tiro, Multijogador, Tiro com Saques, Indie, Primeira Pessoa, Chuva de Balas, Tiro de Tiozão, Um Jogador, Difícil, Arcade, Combate, Fantasia, Geração Procedural"
One-Eyed Likho,Q3 2025,Indefinido,https://store.steampowered.com/app/2346840/OneEyed_Likho/?snr=1_7_7_popularcomingsoon_150_7,"Aventura, Psicológico, Terror, Mitologia, Simulador de Caminhada, Quebra-Cabeça, Ficção Interativa, Psicodélico, Exploração, Atmosférico, Estilizado, Thriller, Mistério, Filosófico, Um Jogador, Terror Psicológico, Sobrenatural, Vários Finais, Boa Trama, Indie"
Project: Mist,Q3 2025,Indefinido,https://store.steampowered.com/app/2383130/Project_Mist/?snr=1_7_7_popularcomingsoon_150_7,"Acesso Antecipado, Terror, Terror de Sobrevivência, Mundo Aberto, Pós-Apocalíptico, Sobrevivência em Mundo Aberto, Multijogador, Tiro, Ação, Construção, Fabricação, Simulação, Realístico, Atmosférico, Sombrio, Exploração, Ação / Aventura, Sobrevivência, Aventura, Culinária"
Isometria,Q3 2025,Indefinido,https://store.steampowered.com/app/2596940/Isometria/?snr=1_7_7_popularcomingsoon_150_7,"Atmosférico, Simulação, Sobrevivência em Mundo Aberto, Faça o que Quiser, Sobrevivência, Exploração, Geração Procedural, Fabricação, Alta Rejogabilidade, Simulador Rural, Ação / Aventura, Gráficos Pixelados, Isométrico, Indie, Aventura, 2,5D, Construção de Bases, Cooperativo On-line, Multijogador, Ação"
Dead Weight,Q3 2025,Indefinido,https://store.steampowered.com/app/2646720/Dead_Weight/?snr=1_7_7_popularcomingsoon_150_7,"Estratégia, RPG, Combate em Turnos, Alta Rejogabilidade, Em Turnos, Estratégia em Turnos, Tático, Aventura, Gráficos Pixelados, Roguelike, Tática por Turnos, Faça o que Quiser, Roguelite, RPG Tático, Um Jogador, Fantasia Sombria, Piratas, Indie, Steampunk, Isométrico"
Legends of Dragaea: Idle Dungeons,Q3 2025,Indefinido,https://store.steampowered.com/app/2712380/Legends_of_Dragaea_Idle_Dungeons/?snr=1_7_7_popularcomingsoon_150_7,"Automação, RPG, Indie, Incremental, Relaxante, Um Jogador, Aventura, Retrô, Gerenciamento de Inventário, Explorador de Calabouços, Batalha Automática, RPG de Grupos, Personalização de Personagem, JRPG, Saques, Primeira Pessoa, Fantasia, Gráficos Pixelados, Fabricação, Combate"
Smash it Wild,Q3 2025,Indefinido,https://store.steampowered.com/app/2432240/Smash_it_Wild/?snr=1_7_7_popularcomingsoon_150_7,"RPG, Vôlei, Tática por Turnos, Roguelite, Roguelike, RPG Tático, Baseado em Classes, Baseado em Equipes, Esportes, Estratégia em Turnos, Pontos, Pontos, Pontos!, Estratégia, Tático, Colorido, Visão Superior, Para Toda a Família, Gerenciamento, Um Jogador"
Delivery Driver Service,Q3 2025,Indefinido,https://store.steampowered.com/app/2791970/Delivery_Driver_Service/?snr=1_7_7_popularcomingsoon_150_7,"Incremental, Faça o que Quiser, Direção, Sobrevivência, Gerenciamento, Física, Simulador Automobilístico, Terceira Pessoa, Primeira Pessoa, Relaxante, Mundo Aberto, Simulação, Realístico, Atmosférico, Um Jogador, Multijogador, Cooperativo, Indie, Aventura, Cooperativo On-line"
Nihongo Quest,Q3 2025,Indefinido,https://store.steampowered.com/app/1556070/Nihongo_Quest/?snr=1_7_7_popularcomingsoon_150_7,"Exploração, Tática por Turnos, Educativo, Estratégia em Turnos, JRPG, RPG, 2D, Fofo, Visão Superior, Relaxante, Engraçado, Controle, Linear, Combate em Turnos, Anime, Cartunizado, Colorido, Gráficos Pixelados, Para Toda a Família, Editor de Níveis"
Ctrl Alt Deal,Q3 2025,Indefinido,https://store.steampowered.com/app/2146390/Ctrl_Alt_Deal/?snr=1_7_7_popularcomingsoon_150_7,"Estratégia, Simulação, Quebra-Cabeça, Estratégia em Turnos, Jogo de Tabuleiro, Cartas, Jogo de Mesa, Montagem de Decks, Geração Procedural, Boa Trama, Você Decide, Um Jogador, Engraçado, Sátira, Robôs, Cyberpunk, Isométrico, Atmosférico, Lógica, Controle"
Elation For The Wonder Box 6000,Q3 2025,Indefinido,https://store.steampowered.com/app/2154780/Elation_For_The_Wonder_Box_6000/?snr=1_7_7_popularcomingsoon_150_7,"Primeira Pessoa, Surrealista, Boa Trama, Humor Pesado, Aventura, Retrô, Indie, Ficção Interativa, Anos 90, Conversas, Mundo Aberto, Abstrato, Atmosférico, Investigação, Sátira, Capitalismo, Psicodélico, Um Jogador, Desenhado à Mão, Comédia"
Millennium Dream,Q3 2025,Indefinido,https://store.steampowered.com/app/3470560/Millennium_Dream/?snr=1_7_7_popularcomingsoon_150_8,"Aventura, Terror Psicológico, Simulador de Caminhada, Exploração, Atmosférico, Anos 90, Primeira Pessoa, Terror, Thriller, Simulador Imersivo, Cinematográfico, 3D, Linear, Comovente, Velha-Guarda, Relaxante, Simulação, Realístico, Ação, Casual"
Dawn Break,Q3 2025,Indefinido,https://store.steampowered.com/app/3470610/Dawn_Break/?snr=1_7_7_popularcomingsoon_150_8,"Ação, Protagonista Mulher, Conteúdo Sexual, Tiro em Terceira Pessoa, RPG, Zumbis, Nudez, Aventura, Ficção Científica, 3D, Para Adultos, Indie, Tiro, Combate, Um Jogador, Drama, Terceira Pessoa, Violência Detalhada, Terror, Violento"
There Are No Orcs,Q3 2025,Indefinido,https://store.steampowered.com/app/3480990/There_Are_No_Orcs/?snr=1_7_7_popularcomingsoon_150_8,"Estratégia em Tempo Real (RTS), Defesa de Torres, Construção de Cidades, Batalha Automática, Cartas, Jogo de Guerra, Estratégia, Construção de Bases, Roguelite, Medieval, Fantasia, Militar, Gráficos Pixelados, Guerra, Engraçado, Mágica, Montagem de Decks, 2D, Um Jogador, Indie"
Car Service Together,Q3 2025,Indefinido,https://store.steampowered.com/app/3501070/Car_Service_Together/?snr=1_7_7_popularcomingsoon_150_8,"Corrida, Simulação, Casual, Simulador Automobilístico, Tiro em Primeira Pessoa (FPS), Realístico, Automação, Direção, Para Toda a Família, Gerenciamento, Relaxante, Física, Gerenciamento de Recursos, Cooperativo, Multijogador, Cooperativo On-line, Um Jogador, Indie, Acesso Antecipado"
Astro Prospector,Q3 2025,Indefinido,https://store.steampowered.com/app/3503440/Astro_Prospector/?snr=1_7_7_popularcomingsoon_150_8,"Retrô, Relaxante, Espacial, Arcade, Clique e Clique, Chuva de Balas, Incremental, Casual, Gráficos Pixelados, Mineração, Gerenciamento, Tiro, Mandando Bala, Simulação, Ação, RPG de Estratégia, Estratégia, Simulador Espacial, Porradaria, Voo"
Idlemancer,Q3 2025,Indefinido,https://store.steampowered.com/app/3507960/Idlemancer/?snr=1_7_7_popularcomingsoon_150_8,"Incremental, Simulação, Batalha Automática, Clique e Clique, Multijogador Assíncrono, Jogador x Jogador (PvP), Mágica, RPG de Estratégia, Roguelike, 2D, Montagem de Decks, Gráficos Pixelados, Retrô, Tático, Um Jogador, Cartas, Roguelite, Gerenciamento de Recursos, Fofo, Multijogador"
Scribble Wolf,Q3 2025,Indefinido,https://store.steampowered.com/app/3539320/Scribble_Wolf/?snr=1_7_7_popularcomingsoon_150_8,"Dedução Social, Jogo de Mesa, Desenhado à Mão, Jogador x Jogador (PvP), Cooperativo, Multijogador, Casual, Mistério, Design e Ilustração, Jogo de Tabuleiro, Cooperativo On-line, Personalização de Personagem, Baseado em Equipes, Visão Superior, Terceira Pessoa, 3D, Plataforma 3D, Fabricação, Humor Pesado, Lobisomens"
Chill with You : Lo-Fi Story,Q3 2025,Indefinido,https://store.steampowered.com/app/3548580/Chill_with_You__LoFi_Story/?snr=1_7_7_popularcomingsoon_150_8,"Aventura, Casual, Romance Visual, Apontar e Clicar, Utilitários, Simulador de Vida Real, Educativo, Incremental, Simulador Imersivo, 3D, Fofo, Anime, Colorido, Cartunizado, Drama, Relaxante, Atmosférico, Baseado em Texto, Protagonista Mulher, Um Jogador"
Backseat Drivers,Q3 2025,Indefinido,https://store.steampowered.com/app/3558400/Backseat_Drivers/?snr=1_7_7_popularcomingsoon_150_8,"Casual, Corrida, Simulação, Direção, Cooperativo, Multijogador, Indie, Jogador x Jogador (PvP), Física, Cooperativo On-line, Combate com Veículos, Engraçado, Para Toda a Família, Relaxante, Terror Psicológico, 3D"
Sunken Engine,Q3 2025,Indefinido,https://store.steampowered.com/app/3604780/Sunken_Engine/?snr=1_7_7_popularcomingsoon_150_8,"Acesso Antecipado, Simulação, Lovecraftiano, Naval, Simulador de Vida Real, Gerenciamento de Tempo, Simulador Imersivo, Boa Trama, Mistério, Atmosférico, Você Decide, Um Jogador, Sombrio, Estilizado, Terror, Romance Visual, 3D, Thriller, Primeira Pessoa, Primeira Guerra Mundial"
Life in The Janitor's Room with A JK Girl,Q3 2025,Indefinido,https://store.steampowered.com/app/3606830/Life_in_The_Janitors_Room_with_A_JK_Girl/?snr=1_7_7_popularcomingsoon_150_8,"Impróprio para o Local de Trabalho, Conteúdo Sexual, Casual, Simulação, Para Adultos, Simulador de Encontros, Anime, História em Quadrinhos, Ficção Interativa, Conversas, Clique e Clique, Indie, 2D, Um Jogador, Romance, Relaxante"
Blade & Soul Heroes,September 2025,Free,https://store.steampowered.com/app/3616890/Blade__Soul_Heroes/?snr=1_7_7_popularcomingsoon_150_8,"Gratuito para Jogar, MMORPG, Ação, Baseado em Equipes, Estratégia em Turnos, Aventura, Anime, Boa Trama, RPG de Ação, Jogador X Ambiente (PvE), Jogador x Jogador (PvP), Multijogador Massivo, Combate em Turnos, Um Jogador, Terceira Pessoa, Colorido, Ação / Aventura, Fantasia, Artes Marciais, Estratégia"
Gun Center Simulator,Q3 2025,Indefinido,https://store.steampowered.com/app/3618200/Gun_Center_Simulator/?snr=1_7_7_popularcomingsoon_150_8,"Simulação, Realístico, Economia, Militar, Personalização de Armas, Construção, Primeira Pessoa, 3D, Simulador Imersivo, Gerenciamento, Relaxante, Casual, Um Jogador, Ação, Tiro, Atmosférico, Competitivo, Ação / Aventura, Indie, Guerra"
Super Movie Tycoon,Q3 2025,Indefinido,https://store.steampowered.com/app/3639380/Super_Movie_Tycoon/?snr=1_7_7_popularcomingsoon_150_8,"Simulação, Estratégia, Gerenciamento, Economia, Construção de Cidades, Filme, Capitalismo, Construção, Gerenciamento de Tempo, Gerenciamento de Recursos, Simulador Imersivo, Troca, Faça o que Quiser, Construção de Bases, Alta Rejogabilidade, Simulador de Vida Real, Sobrevivência, 3D, Relaxante, Um Jogador"
Cleaner Company,Q3 2025,Indefinido,https://store.steampowered.com/app/3644020/Cleaner_Company/?snr=1_7_7_popularcomingsoon_150_8,"Simulação, Cooperativo On-line, Casual, Cooperativo, Aventura, Faça o que Quiser, Simulador Imersivo, Física, Exploração, 3D, Primeira Pessoa, Realístico, Espacial, Relaxante, Engraçado, Simulador Espacial, Ficção Científica, Multijogador, Violência Detalhada, Baseado em Equipes"
Sakichan - Track Of Fury,Q3 2025,Indefinido,https://store.steampowered.com/app/3282110/Sakichan__Track_Of_Fury/?snr=1_7_7_popularcomingsoon_150_8,"Ação, Conteúdo Sexual, Nudez, Anime, Luta, Um Jogador, Protagonista Mulher, Fofo, Ritmo Rápido, Personalização de Personagem, Plataforma 3D, Corrida, Corrida com Combate, Para Adultos, Plataforma, 3D, Impróprio para o Local de Trabalho, Mechas, Estilizado, Hentai"
KuloNiku: Bowl Up!,Q3 2025,Indefinido,https://store.steampowered.com/app/3357960/KuloNiku_Bowl_Up/?snr=1_7_7_popularcomingsoon_150_8,"Culinária, Simulação, Gerenciamento, Aconchegante, Um Jogador, Simulador de Emprego, Fofo, 3D, Engraçado, Casual, Estilizado, Estratégia, Para Toda a Família, Colorido, Do Bem, Gerenciamento de Tempo, Boa Trama, Indie, Romance Visual, Simulador Imersivo"
Sure you wanna drink this?,Q3 2025,Indefinido,https://store.steampowered.com/app/3371070/Sure_you_wanna_drink_this/?snr=1_7_7_popularcomingsoon_150_8,"Clique e Clique, Quebra-Cabeça, Ficção Interativa, Fofo, Protagonista Mulher, Combate em Turnos, 2D, Apontar e Clicar, Detetive, Casual, Jogo de Palavras, Relaxante, Um Jogador, Cartunizado, Fantasia, Drama, Desenho Animado, Cachorros, Indie"
Banker Simulator,Q3 2025,Indefinido,https://store.steampowered.com/app/3393240/Banker_Simulator/?snr=1_7_7_popularcomingsoon_150_8,"Simulador Imersivo, Estratégia, Faça o que Quiser, Economia, Construção, Gerenciamento, Capitalismo, Fabricação, Simulador de Vida Real, Primeira Pessoa, 3D, Mundo Aberto, Casual, Simulação, Realístico, Multijogador, Gerenciamento de Recursos, Um Jogador, Indie, Acesso Antecipado"
Clawed,Q3 2025,Indefinido,https://store.steampowered.com/app/3394840/Clawed/?snr=1_7_7_popularcomingsoon_150_8,"Dinossauros, Ação / Aventura, Terror de Sobrevivência, Tiro, Cooperativo, Ação, Cooperativo On-line, Aventura, Terror, Tiro em Terceira Pessoa, Um Jogador, Realístico, Atmosférico, Thriller, Combate, Controle, Gerenciamento de Inventário, Jogador X Ambiente (PvE), Multijogador, 3D"
Settler's Domain,Q3 2025,Indefinido,https://store.steampowered.com/app/3396920/Settlers_Domain/?snr=1_7_7_popularcomingsoon_150_8,"Simulador de Colônias, Construção de Cidades, Gerenciamento de Recursos, Sobrevivência, Simulação, Gráficos Pixelados, Estratégia, Exploração, Indie, Geração Procedural, Mundo Aberto, 2D, Visão Superior, Faça o que Quiser, Gerenciamento, Construção, Economia, Medieval, Casual, Um Jogador"
Overlooting,Q3 2025,Indefinido,https://store.steampowered.com/app/3410180/Overlooting/?snr=1_7_7_popularcomingsoon_150_8,"Gerenciamento de Inventário, Explorador de Calabouços, Saques, Roguelite, RPG, Personalização de Personagem, Gráficos Pixelados, Alta Rejogabilidade, Roguelike, Combate em Turnos, Estratégia em Turnos, Medieval, Estratégia, RPG de Estratégia, Batalha Automática, Fantasia, Montagem de Decks, Montagem de Decks Roguelike, Em Turnos, Um Jogador"
Cozy Organizer,Q3 2025,Indefinido,https://store.steampowered.com/app/3415240/Cozy_Organizer/?snr=1_7_7_popularcomingsoon_150_8,"Casual, Aconchegante, Simulador de Emprego, Do Bem, Relaxante, Fofo, Faça o que Quiser, Simulação, Colorido, Simulador de Passatempo, Para Toda a Família, Apontar e Clicar, Desenhado à Mão, Quebra-Cabeça, Engraçado, Simulador Imersivo, Objetos Ocultos, Simulador de Vida Real, 2D, Um Jogador"
Lakeside Bar,Q3 2025,Indefinido,https://store.steampowered.com/app/3417120/Lakeside_Bar/?snr=1_7_7_popularcomingsoon_150_8,"Incremental, Simulador de Vida Real, Construção, Casual, Economia, Pesca, Clique e Clique, Capitalismo, Gerenciamento, Natureza, Construção de Bases, Simulador Rural, Estratégia, 2D, Fofo, Relaxante, Automação, Faça o que Quiser, Simulação, Gráficos Pixelados"
Quarantine Zone: The Last Check,September 2025,Indefinido,https://store.steampowered.com/app/3419520/Quarantine_Zone_The_Last_Check/?snr=1_7_7_popularcomingsoon_150_8,"Simulação, Zumbis, Pós-Apocalíptico, Você Decide, Um Jogador, Realístico, 3D, Atmosférico, Militar, Primeira Pessoa, Humor Ácido, Simulador Imersivo, Gerenciamento de Recursos, Gerenciamento, EUA, Construção de Bases, Simulador de Vida Real, Drama, Comovente, Construção"
Mushroom Hunter Simulator,Q3 2025,Indefinido,https://store.steampowered.com/app/3424910/Mushroom_Hunter_Simulator/?snr=1_7_7_popularcomingsoon_150_8,"Simulação, Caça, Natureza, Relaxante, Simulador Imersivo, Casual, Faça o que Quiser, Atmosférico, 3D, Simulador de Caminhada, Realístico, Primeira Pessoa, Mundo Aberto, Objetos Ocultos, Gerenciamento de Recursos, Fofo, Exploração, Aventura, Culinária, Um Jogador"
Cats Around Us: Black Cat,Q3 2025,Indefinido,https://store.steampowered.com/app/3426090/Cats_Around_Us_Black_Cat/?snr=1_7_7_popularcomingsoon_150_8,"Curta-Metragem, Gatos, Objetos Ocultos, Do Bem, Aconchegante, Desenhado à Mão, História em Quadrinhos, Relaxante, Casual, 2D, Fofo, Um Jogador, Arcade, Apontar e Clicar, Quebra-Cabeça, Minimalista, Desenho Animado, Para Toda a Família, Linear, Indie"
project; VIRAI: DOOMER’s LIFE ESCAPE,Q3 2025,Indefinido,https://store.steampowered.com/app/3434180/project_VIRAI_DOOMERs_LIFE_ESCAPE/?snr=1_7_7_popularcomingsoon_150_8,"Terror Psicológico, Boa Trama, Simulador de Vida Real, Terror, Anime, Protagonista Mulher, Romance Visual, Vários Finais, Você Decide, Atmosférico, 2D, Thriller, Drama, Simulação, Aventura, Casual, Sombrio, Comovente, Gerenciamento, Escolha a sua Aventura"
IDLE BOSS RUSH,Q3 2025,Indefinido,https://store.steampowered.com/app/3436030/IDLE_BOSS_RUSH/?snr=1_7_7_popularcomingsoon_150_8,"Clique e Clique, Incremental, Construção, Estratégia, Construção de Bases, Casual, RPG, Gerenciamento de Recursos, Economia, Gerenciamento, Duelo contra Chefões, Construção de Cidades, Gráficos Pixelados, Indie, Simulador de Colônias, Simulação, 2D, Automação, Fantasia, Um Jogador"
Village Tale,Q3 2025,Indefinido,https://store.steampowered.com/app/3447510/Village_Tale/?snr=1_7_7_popularcomingsoon_150_8,"Estratégia, Incremental, Automação, Simulador de Colônias, Simulador Rural, Clique e Clique, Simulação, Construção, Troca, Gerenciamento, Construção de Bases, Relaxante, Gráficos Pixelados, Para Toda a Família, Fabricação, Medieval, Construção de Cidades, Casual, Visão Superior, Fofo"
Fish Hunters: The Most Ridiculous Fishing Simulator 🐟,Q3 2025,Indefinido,https://store.steampowered.com/app/3468330/Fish_Hunters_The_Most_Ridiculous_Fishing_Simulator/?snr=1_7_7_popularcomingsoon_150_8,"Casual, Pesca, Multijogador, Cooperativo On-line, Fantasia, Faça o que Quiser, Colete Tudo, Gerenciamento, Exploração, Primeira Pessoa, Arcade, 3D, Engraçado, Simulação, Mundo Aberto, Colorido, Ação, Sobrevivência, Aventura, Desenho Animado"
Baki Hanma: Blood Arena,Q3 2025,Indefinido,https://store.steampowered.com/app/3469230/Baki_Hanma_Blood_Arena/?snr=1_7_7_popularcomingsoon_150_8,"Ação, Luta 2D, Arcade, 2D, Anime, Desenhado à Mão, Anos 80, Anos 90, Boxe, Artes Marciais, Esportes, Violento, Velha-Guarda, Retrô, Um Jogador, Sangue"
Military Incremental Complex,Q3 2025,Indefinido,https://store.steampowered.com/app/3469750/Military_Incremental_Complex/?snr=1_7_7_popularcomingsoon_150_8,"Incremental, Clique e Clique, Simulação, Automação, Capitalismo, Gerenciamento, Economia, Militar, Anos 90, Gerenciamento de Recursos, Casual, Gerenciamento de Inventário, Fabricação, Troca, Indie, Estratégia, Construção, Roguelike, Guerra, Um Jogador"
Knightica,Q3 2025,Indefinido,https://store.steampowered.com/app/3093400/Knightica/?snr=1_7_7_popularcomingsoon_150_8,"Batalha Automática, Estratégia, Roguelike, Tática por Turnos, Gerenciamento de Inventário, Tático, Combate, Fantasia, Em Turnos, Estratégia em Turnos, Montagem de Decks, Estratégia em Tempo Real com Ação, Estratégia em Tempo Real (RTS), Saques, Um Jogador, 2D, Aventura, Gerenciamento, Indie, Jogo de Guerra"
Business Simulator 2025,Q3 2025,Indefinido,https://store.steampowered.com/app/3098060/Business_Simulator_2025/?snr=1_7_7_popularcomingsoon_150_8,"Economia, Capitalismo, Gerenciamento, Simulador de Emprego, Simulação, Estratégia, Gerenciamento de Tempo, Simulador Imersivo, Simulador de Vida Real, Um Jogador, Tático, Automação, Indie, Casual, Tiro em Primeira Pessoa (FPS), 3D, Primeira Pessoa, Realístico, Direção, Acesso Antecipado"
Dice Legends,Q3 2025,Indefinido,https://store.steampowered.com/app/3112170/Dice_Legends/?snr=1_7_7_popularcomingsoon_150_8,"Montagem de Decks Roguelike, Explorador de Calabouços, Batalha com Cartas, Cartas, Roguelike, Montagem de Decks, Combate em Turnos, Só Mouse, Indie, Alta Rejogabilidade, Gráficos Pixelados, 2D, Fantasia, Um Jogador"
Jupiter Hell Classic,Q3 2025,Indefinido,https://store.steampowered.com/app/3126530/Jupiter_Hell_Classic/?snr=1_7_7_popularcomingsoon_150_8,"Roguelike Tradicional, Roguelike, Tática por Turnos, Movimento em Grade, Geração Procedural, Morte Permanente, Ficção Científica, Terror, Combate em Turnos, Estratégia, 2D, Explorador de Calabouços, RPG, Visão Superior, Demônios, Um Jogador, Gráficos Pixelados, RPG de Estratégia, Compatível com Mods, Indie"
"Spiritual Bond ~Breaking the curse, Intertwining fates~",Q3 2025,Indefinido,https://store.steampowered.com/app/3146610/Spiritual_Bond_Breaking_the_curse_Intertwining_fates/?snr=1_7_7_popularcomingsoon_150_8,"Quebra-Cabeça, Romance Visual, Soletração, Sombrio, Anime, Casual, Fofo, Nudez, Mistério, Aventura, Exploração, Conteúdo Sexual, Impróprio para o Local de Trabalho, Boa Trama, Jogo de Palavras, JRPG, Ficção Interativa, RPG, Um Jogador, Simulador de Encontros"
Agatha Christie - Death on the Nile,September 2025,Indefinido,https://store.steampowered.com/app/3150480/Agatha_Christie__Death_on_the_Nile/?snr=1_7_7_popularcomingsoon_150_8,"Detetive, Investigação, Quebra-Cabeça, Boa Trama, Baseado em Texto, Apontar e Clicar, 3D, Terceira Pessoa, Narração, Colorido, Realístico, Lógica, Thriller, Atmosférico, Crime, Drama, Mistério, Protagonista Mulher, Psicológico, Moderno"
Cat Island Petrichor,Q3 2025,Indefinido,https://store.steampowered.com/app/3181890/Cat_Island_Petrichor/?snr=1_7_7_popularcomingsoon_150_8,"Aventura, Simulador de Caminhada, Simulador de Vida Real, Exploração, Simulador Imersivo, 3D, Fofo, Terceira Pessoa, Comovente, Relaxante, Casual, RPG, Atmosférico, Boa Trama, Controle, Mundo Aberto, Um Jogador, Nudez, Conteúdo Sexual, Gatos"
