title,release_date,price,game_url,genres
Carnival Massacre,2025,Indefinido,https://store.steampowered.com/app/2304730/Carnival_Massacre/?snr=1_7_7_popularcomingsoon_150_7,"Terror de Sobrevivência, Terror, Retrô, Ação, Gerenciamento de Inventário, Protagonista Mulher, Aventura, Atmosférico, Exploração, Velha-Guarda, Gerenciamento de Recursos, Quebra-Cabeça, Ação / Aventura, Terceira Pessoa, Um Jogador, Tiro em Terceira Pessoa, Sobrevivência, Sombrio, Terror Psicológico, Zumbis"
Communite,2025,Free,https://store.steampowered.com/app/2446620/Communite/?snr=1_7_7_popularcomingsoon_150_7,"Acesso Antecipado, Casual, Simulação, Construção de Cidades, Faça o que Quiser, Relaxante, Atmosférico, Multijogador, Construção, Mundo Aberto, Do Bem, Aconchegante, Natureza, Exploração, Fofo, Multijogador Massivo, Cooperativo On-line, Multijogador Assíncrono, 2D, Para Toda a Família"
HYPERBEAT,Q4 2025,Indefinido,https://store.steampowered.com/app/2263360/HYPERBEAT/?snr=1_7_7_popularcomingsoon_150_7,"Ritmo, 3D, Colorido, Estilizado, Editor de Níveis, Um Jogador, Indie, Ação, Arcade"
Roots Devour,2025,Indefinido,https://store.steampowered.com/app/2612690/Roots_Devour/?snr=1_7_7_popularcomingsoon_150_7,"Aventura, Exploração, Atmosférico, Lovecraftiano, Gerenciamento de Recursos, Estratégia, Cartas, 2D, Terror Psicológico, Montagem de Decks, Estilizado, Sombrio, Terror de Sobrevivência, Vários Finais, Um Jogador, Boa Trama, Indie, Economia, Visão Superior, Roguelite"
Algolemeth,2025,Indefinido,https://store.steampowered.com/app/2731030/Algolemeth/?snr=1_7_7_popularcomingsoon_150_7,"RPG, Automação, Explorador de Calabouços, Lógica, RPG de Grupos, Fantasia, Tática por Turnos, RPG Tático, Velha-Guarda, Um Jogador, Minimalista, Indie, Gráficos Pixelados, 2D, Anos 80, Geração Procedural"
The World Well: Blood of Caro,2025,Indefinido,https://store.steampowered.com/app/2648900/The_World_Well_Blood_of_Caro/?snr=1_7_7_popularcomingsoon_150_7,"Romance Visual, Protagonista Mulher, Distópico, Vampiros, Aventura, Fantasia, 2D, Robôs, Ficção Interativa, História Alternativa, Indie, Violento, Violência Detalhada, Boa Trama, Drama, Um Jogador, Anime, LGBTQIA+"
Beyond the Curtains,2025,Indefinido,https://store.steampowered.com/app/2648940/Beyond_the_Curtains/?snr=1_7_7_popularcomingsoon_150_7,"Simulador de Vida Real, Atmosférico, Relaxante, Casual, Simulação, Indie, Fofo, Anime, Boa Trama, Um Jogador, Acesso Antecipado, Isométrico, Para Toda a Família, Compatível com Mods, Incremental, Conteúdo Sexual, Terror Psicológico, Nudez"
Free Stars: Children of Infinity,2025,Indefinido,https://store.steampowered.com/app/2853290/Free_Stars_Children_of_Infinity/?snr=1_7_7_popularcomingsoon_150_7,"Ação / Aventura, Boa Trama, Ficção Científica, Cooperativo On-line, RPG de Ação, Você Decide, Exploração, Tiro, SHMUP com Visão Superior, 2,5D, Multijogador Local, Colorido, Desenhado à Mão, Visão Superior, Anos 90, Alienígenas, Engraçado, Velha-Guarda, Retrô, Aventura"
Red Rocket Defencism,2025,Indefinido,https://store.steampowered.com/app/2854440/Red_Rocket_Defencism/?snr=1_7_7_popularcomingsoon_150_7,"Defesa de Torres, Estratégia, Construção de Cidades, Minimalista, Roguelite, Construção de Bases, Batalha Automática, Montagem de Decks, Estratégia em Tempo Real com Ação, Estratégia em Tempo Real (RTS), Tática em Tempo Real, Roguelike, Construção, Distópico, Colorido, Visão Superior, Ação, Simulação, Histórico, Estilizado"
GROWTH EXPERIMENT,2025,Indefinido,https://store.steampowered.com/app/2745510/GROWTH_EXPERIMENT/?snr=1_7_7_popularcomingsoon_150_7,"Um Jogador, Simulação, Indie, Atmosférico, Vários Finais, Escolha a sua Aventura, Romance Visual, Simulador Imersivo, Gerenciamento, Boa Trama, 2D, Aventura, Simulador de Encontros"
The Last Winter Knight,2025,Indefinido,https://store.steampowered.com/app/2768420/The_Last_Winter_Knight/?snr=1_7_7_popularcomingsoon_150_7,"Romance Visual, Gótico, Mistério, Romance, Escolha a sua Aventura, Atmosférico, Fantasia Sombria, Medieval, Boa Trama, Enredo Rico, Apontar e Clicar, Drama, Desenhado à Mão, Terror, Aventura, Neve, Fantasia, Sobrenatural, Um Jogador, 2D"
THRASHER,2025,Indefinido,https://store.steampowered.com/app/2702300/THRASHER/?snr=1_7_7_popularcomingsoon_150_7,"Ação, Arcade, Psicodélico, Atmosférico, Sombrio, RV, 3D, Ação / Aventura, Ficção Científica, Espacial, Colorido, Música, Estilizado, Fantasia Sombria, Corrida, Terror, Controle, Surrealista, Sobrevivência, Minimalista"
LlamaRPG: Farm to Fable,Q4 2025,Indefinido,https://store.steampowered.com/app/2778290/LlamaRPG_Farm_to_Fable/?snr=1_7_7_popularcomingsoon_150_7,"Exploração, Jogador X Ambiente (PvE), Jogador x Jogador (PvP), RPG, Estratégia em Turnos, JRPG, 2D, Visão Superior, Engraçado, Você Decide, Combate em Turnos, Gráficos Pixelados, Fantasia, Mágica, Aventura, Fabricação, Velha-Guarda, Retrô, Combate, Casual"
Dead Faces,2025,Indefinido,https://store.steampowered.com/app/2822770/Dead_Faces/?snr=1_7_7_popularcomingsoon_150_7,"Terror Psicológico, Primeira Pessoa, Você Decide, Boa Trama, Terror, Vários Finais, Exploração, Simulador Imersivo, Realístico, Simulador de Caminhada, Quebra-Cabeça, Narração, 3D, Surrealista, Objetos Ocultos, Detetive, Controle, Ação, Abstrato, Furtivo"
Category 6,2025,Indefinido,https://store.steampowered.com/app/2823820/Category_6/?snr=1_7_7_popularcomingsoon_150_7,"Sobrevivência em Mundo Aberto, Sobrevivência, Fabricação, Exploração, Mundo Aberto, Terror de Sobrevivência, Construção, Aventura, Pós-Apocalíptico, Atmosférico, Indie, Faça o que Quiser, Primeira Pessoa, Ação / Aventura, Pesca, Ação, RPG, Um Jogador, Morte Permanente, Estilizado"
NeuroSquad - Slay the Horde,2025,Indefinido,https://store.steampowered.com/app/2017040/NeuroSquad__Slay_the_Horde/?snr=1_7_7_popularcomingsoon_150_7,"Roguelike de Ação, Personalização de Armas, Roguelite, Chuva de Balas, Tiro em Arena, SHMUP com Visão Superior, Roguelike, Controle com Alavanca Dupla, RPG de Ação, Ficção Científica, Ação, Pontos, Pontos, Pontos!, Arcade, Controle, RPG, Visão Superior, Mandando Bala, Futurista, 3D, Um Jogador"
Flow Of War,Q4 2025,Indefinido,https://store.steampowered.com/app/2637210/Flow_Of_War/?snr=1_7_7_popularcomingsoon_150_7,"Estratégia, Estratégia em Tempo Real com Ação, Estratégia em Tempo Real (RTS), Batalha Automática, Defesa de Torres, Construção de Bases, Automação, Geração Procedural, Medieval, Tática em Tempo Real, Gráficos Pixelados, 2D, Visão Superior, Construção, Simulador Rural, Fantasia Sombria, Demônios, Mágica, Guerra, Mineração"
DRINKRIME,2025,Indefinido,https://store.steampowered.com/app/2568890/DRINKRIME/?snr=1_7_7_popularcomingsoon_150_7,"Aventura, Anos 90, Gráficos Pixelados, Romance Visual, Escolha a sua Aventura, Vários Finais, Boa Trama, Retrô, Baseado em Texto, Um Jogador"
Disco Samurai,2025,Indefinido,https://store.steampowered.com/app/2576410/Disco_Samurai/?snr=1_7_7_popularcomingsoon_150_7,"Ação, Ritmo, Cyberpunk, Porradaria, Combate, Espada, Pontos, Pontos, Pontos!, Hack and Slash, 2,5D, Isométrico, Protagonista Mulher, Gráficos Pixelados, Estilizado, Futurista, Moderno, Linear, Artes Marciais, Eventos Rápidos, Um Jogador, Arcade"
Montaro 2,Q4 2025,Indefinido,https://store.steampowered.com/app/2368490/Montaro_2/?snr=1_7_7_popularcomingsoon_150_7,"Ação, Comédia, Furtivo, Quebra-Cabeça, Memes, Exploração, Faça o que Quiser, Fofo, Casual, Indie, 2D, Gráficos Pixelados, Anime, Colorido, Um Jogador, Cachorros, Engraçado"
Lone Fungus: Melody of Spores,Q4 2025,Indefinido,https://store.steampowered.com/app/2463220/Lone_Fungus_Melody_of_Spores/?snr=1_7_7_popularcomingsoon_150_7,"Aventura, Metroidvania, Exploração, Ação / Aventura, Plataforma, Plataforma 2D, 2D, Gráficos Pixelados, Mágica, Ação, Indie, Velha-Guarda, Combate, Não Linear"
Containcorp,2025,Indefinido,https://store.steampowered.com/app/2483140/Containcorp/?snr=1_7_7_popularcomingsoon_150_7,"Simulação, Gerenciamento, Terror, Construção de Bases, Lovecraftiano, Simulador de Colônias, RPG Tático, Faça o que Quiser, Construção, Capitalismo, Economia, Construção de Cidades, Estratégia, Sobrevivência, Difícil, 2D, Visão Superior, Enredo Rico, Mundo Aberto, RPG"
Small Kingdoms,2025,Indefinido,https://store.steampowered.com/app/2533000/Small_Kingdoms/?snr=1_7_7_popularcomingsoon_150_7,"Grande Estratégia, Estratégia em Tempo Real (RTS), 4X, Estratégia, Medieval, Jogo de Guerra, Fantasia, Simulação, Tático, Guerra, Combate, Geração Procedural, Gerenciamento de Recursos, Um Jogador, Construção de Cidades, Militar, Simulador de Colônias, Histórico, Construção de Bases, Retrô"
Not Only Nine,Q4 2025,Indefinido,https://store.steampowered.com/app/2377160/Not_Only_Nine/?snr=1_7_7_popularcomingsoon_150_7,"Romance Visual, Comovente, Simulador de Caminhada, Trilha Sonora, Boa Trama, Atmosférico, Retrô, Gatos, Enredo Rico, Anime, JRPG, RPG, Ficção Científica, Aconchegante, Combate em Turnos, Do Bem, Comédia, Eventos Rápidos, Relaxante, Você Decide"
Claire a la Mode,2025,Indefinido,https://store.steampowered.com/app/2292860/Claire_a_la_Mode/?snr=1_7_7_popularcomingsoon_150_7,"Casual, Arcade, Plataforma 2D, Cooperativo Local, Protagonista Mulher, Minijogos, Fofo, Colorido, Culinária, Boa Trama, Pontos, Pontos, Pontos!, Câmera Lateral, Um Jogador, Ação, Plataforma, Gráficos Pixelados, Para Toda a Família, Vários Finais, Retrô, Mágica"
Family Land - Farmer Simulator,2025,Indefinido,https://store.steampowered.com/app/2334600/Family_Land__Farmer_Simulator/?snr=1_7_7_popularcomingsoon_150_8,"Simulação, Casual, Simulador Rural, Simulador de Vida Real, Faça o que Quiser, Simulador Imersivo, Gerenciamento de Tempo, 3D, Primeira Pessoa, Realístico, Agricultura, EUA, Atmosférico, Construção, Capitalismo, Economia, Para Toda a Família, Gerenciamento, Moderno, Natureza"
He Who Watches,2025,Indefinido,https://store.steampowered.com/app/1070500/He_Who_Watches/?snr=1_7_7_popularcomingsoon_150_8,"Sokoban, Tiro em Primeira Pessoa (FPS), Plataforma com Quebra-Cabeça, Explorador de Calabouços, Quebra-Cabeça, Arco e Flecha, Difícil, Plataforma, 3D, Primeira Pessoa, Enredo Rico, Controle, Linear, Vários Finais, Boa Trama, Estilizado, Fantasia Sombria, Lógica, Seis Graus de Liberdade, Atmosférico"
Black Gold: Oil Drilling Simulator,2025,Indefinido,https://store.steampowered.com/app/1473260/Black_Gold_Oil_Drilling_Simulator/?snr=1_7_7_popularcomingsoon_150_8,"Ação, Simulação, Economia, Construção, Gerenciamento, Faça o que Quiser, Sobrevivência, Primeira Pessoa, Realístico, Atmosférico, Histórico, Indie, Você Decide, Fabricação, Gerenciamento de Recursos, Um Jogador"
Nihongo Quest,2025,Indefinido,https://store.steampowered.com/app/1556070/Nihongo_Quest/?snr=1_7_7_popularcomingsoon_150_8,"Exploração, Tática por Turnos, Educativo, Estratégia em Turnos, JRPG, RPG, 2D, Fofo, Visão Superior, Relaxante, Engraçado, Controle, Linear, Combate em Turnos, Anime, Cartunizado, Colorido, Gráficos Pixelados, Para Toda a Família, Editor de Níveis"
Veterum,2025,Indefinido,https://store.steampowered.com/app/1864690/Veterum/?snr=1_7_7_popularcomingsoon_150_8,"Estratégia, Tática por Turnos, Estratégia em Turnos, RPG, RPG de Estratégia, 2D, RPG Tático, Isométrico, Desenhado à Mão, Indie, Fantasia, Um Jogador, Tático, Movimento em Grade, Combate em Turnos, Grade Hexagonal, Difícil, Fantasia Sombria, Ação, Aventura"
Bunker Builder Simulator,2025,Indefinido,https://store.steampowered.com/app/1868210/Bunker_Builder_Simulator/?snr=1_7_7_popularcomingsoon_150_8,"Simulação, Construção, Construção de Bases, Design e Ilustração, Um Jogador, Economia, Gerenciamento, Faça o que Quiser, 3D, Primeira Pessoa, Pós-Apocalíptico, Realístico, Relaxante, Indie, Casual, Para Toda a Família, Atmosférico, Alta Rejogabilidade, Destruição, Simulador Imersivo"
Daomei Village,Q4 2025,Indefinido,https://store.steampowered.com/app/1825030/Daomei_Village/?snr=1_7_7_popularcomingsoon_150_8,"Simulador Rural, Casual, Simulador de Vida Real, Construção de Bases, Simulador de Encontros, RPG, Agricultura, Fabricação, Faça o que Quiser, Construção, Gráficos Pixelados, Mundo Aberto, Simulação, Relaxante, Um Jogador, Fofo, Pesca, Indie, 2D, Educativo"
The Last Citadel,2025,Indefinido,https://store.steampowered.com/app/1892090/The_Last_Citadel/?snr=1_7_7_popularcomingsoon_150_8,"Ação, Tiro em Terceira Pessoa, Roguelike, Estilizado, Demônios, Saques, Espacial, Steampunk, Personalização de Personagem, Geração Procedural, Cooperativo, Multijogador, Cooperativo On-line, Um Jogador, Roguelike de Ação, Roguelite, Terceira Pessoa, Arcade"
Nientum - Op.ZERO,2025,Indefinido,https://store.steampowered.com/app/2725250/Nientum__OpZERO/?snr=1_7_7_popularcomingsoon_150_8,"Acesso Antecipado, 2D, Plataforma, Ritmo, Música, Protagonista Mulher, Romance Visual, Ação, Boa Trama, Indie, Corredor, Esportes, Fofo, Aventura, Arcade, Um Jogador, Atmosférico, Enredo Rico, Anime, RPG"
The Transylvania Adventure of Simon Quest,2025,Indefinido,https://store.steampowered.com/app/2749920/The_Transylvania_Adventure_of_Simon_Quest/?snr=1_7_7_popularcomingsoon_150_8,"Ação, Aventura, RPG de Ação, Ação / Aventura, Plataforma, Metroidvania, Plataforma 2D, Câmera Lateral, 2D, Gráficos Pixelados, Anos 90, Humor Pesado, Demônios, Cachorros, Gótico, Terror, Velha-Guarda, Retrô, Controle, Vários Finais"
Moves Of The Diamond Hand,2025,Indefinido,https://store.steampowered.com/app/2778210/Moves_Of_The_Diamond_Hand/?snr=1_7_7_popularcomingsoon_150_8,"Acesso Antecipado, RPG, Aventura, CRPG, Dados, RPG de Estratégia, Ficção Interativa, Primeira Pessoa, Atmosférico, Mistério, Estilizado, Exploração, Simulador Imersivo, Noir, Psicodélico, Distópico, Conspiração, Cyberpunk, Jogo de Tabuleiro, Enredo Rico"
PIGGY ONE SUPER SPARK,2025,Indefinido,https://store.steampowered.com/app/2780230/PIGGY_ONE_SUPER_SPARK/?snr=1_7_7_popularcomingsoon_150_8,"Gráficos Pixelados, Ação, Boa Trama, Anime, Plataforma 2D, Câmera Lateral, Indie, Aventura, Plataforma, Ação / Aventura, 2D, Fofo, Cyberpunk, Protagonista Mulher, Anos 90, Um Jogador, Ficção Científica, Linear, Pós-Apocalíptico, Futurista"
Delivery Driver Service,Q4 2025,Indefinido,https://store.steampowered.com/app/2791970/Delivery_Driver_Service/?snr=1_7_7_popularcomingsoon_150_8,"Incremental, Faça o que Quiser, Direção, Sobrevivência, Gerenciamento, Física, Simulador Automobilístico, Terceira Pessoa, Primeira Pessoa, Relaxante, Mundo Aberto, Simulação, Realístico, Atmosférico, Um Jogador, Multijogador, Cooperativo, Indie, Aventura, Cooperativo On-line"
Mousebusters,2025,Indefinido,https://store.steampowered.com/app/2823200/Mousebusters/?snr=1_7_7_popularcomingsoon_150_8,"Mandando Bala, Quebra-Cabeça, Apontar e Clicar, Ação / Aventura, RPG, 2D, Indie, Visão Superior, Terror, Boa Trama, Linear, Conversas, Do Bem, Casual, Gráficos Pixelados, Comédia, Drama, Aventura, Um Jogador, Simulador de Emprego"
Theropods,Q4 2025,Indefinido,https://store.steampowered.com/app/1091870/Theropods/?snr=1_7_7_popularcomingsoon_150_8,"Aventura, Protagonista Mulher, Apontar e Clicar, Gráficos Pixelados, Dinossauros, Indie, Quebra-Cabeça, Um Jogador, Colorido, 2D, Retrô, Trilha Sonora Boa, Velha-Guarda, Ficção Científica, Boa Trama"
ADA: Tainted Soil,Q4 2025,Indefinido,https://store.steampowered.com/app/2535850/ADA_Tainted_Soil/?snr=1_7_7_popularcomingsoon_150_8,"Gráficos Pixelados, Atmosférico, Aventura, Boa Trama, RPG, Fantasia, 2D, Hack and Slash, Difícil, Ação, Mágica, Um Jogador, Exploração, Colorido, Visão Superior, RPG de Ação, Fabricação, Isométrico, Indie, Plataforma com Quebra-Cabeça"
Isometria,Q4 2025,Indefinido,https://store.steampowered.com/app/2596940/Isometria/?snr=1_7_7_popularcomingsoon_150_8,"Atmosférico, Simulação, Sobrevivência em Mundo Aberto, Faça o que Quiser, Sobrevivência, Exploração, Geração Procedural, Fabricação, Alta Rejogabilidade, Simulador Rural, Ação / Aventura, Gráficos Pixelados, Isométrico, Indie, Aventura, 2,5D, Construção de Bases, Cooperativo On-line, Multijogador, Ação"
Slyders,2025,Indefinido,https://store.steampowered.com/app/2607870/Slyders/?snr=1_7_7_popularcomingsoon_150_8,"Roguelike de Ação, Tiro em Arena, Tiro de Tiozão, Chuva de Balas, Tiro em Primeira Pessoa (FPS), Roguelite, Jogador X Ambiente (PvE), Tiro, Roguelike, 3D, Primeira Pessoa, Mechas, Steampunk, Cyberpunk, Você Decide, Ação, Fantasia Sombria, Demônios, Fantasia, Retrô"
Jupiter Moons: Mecha🦾,2025,Indefinido,https://store.steampowered.com/app/1288540/Jupiter_Moons_Mecha/?snr=1_7_7_popularcomingsoon_150_8,"Montagem de Decks Roguelike, Mechas, Montagem de Decks, Cartas, Gerenciamento de Inventário, Batalha com Cartas, Roguelite, Estratégia, Ficção Científica, RPG, Roguelike, Combate em Turnos, RPG Tático, Explorador de Calabouços, Personalização de Personagem, Um Jogador, RPG de Estratégia, Espacial, 2D, Estratégia em Turnos"
Jury Trial,2025,Indefinido,https://store.steampowered.com/app/1389140/Jury_Trial/?snr=1_7_7_popularcomingsoon_150_8,"Simulador Imersivo, Simulador Político, RPG de Estratégia, RPG, 2D, Boa Trama, Você Decide, Vários Finais, Conversas, Tático, Política, Político, Editor de Níveis, Crime, Investigação, Atmosférico, Drama, Conspiração, Um Jogador, Indie"
Liegecraft,2025,Indefinido,https://store.steampowered.com/app/1503170/Liegecraft/?snr=1_7_7_popularcomingsoon_150_8,"Acesso Antecipado, RPG, Estratégia em Turnos, Medieval, Faça o que Quiser, 4X, Boa Trama, Você Decide, RPG de Estratégia, Estratégia, História Alternativa, Combate em Turnos, Diplomacia, Economia, Gerenciamento, Grade Hexagonal, Um Jogador, Visão Superior, Em Turnos, Estilizado"
Abyss Fantasia,2025,Indefinido,https://store.steampowered.com/app/1985940/Abyss_Fantasia/?snr=1_7_7_popularcomingsoon_150_8,"RPG, Aventura, Desenhado à Mão, Fantasia, Combate em Turnos, Estilizado, Vários Finais, Um Jogador, Indie, Cartas, Simulador Imersivo"
Rusty Seas,2025,Indefinido,https://store.steampowered.com/app/2050070/Rusty_Seas/?snr=1_7_7_popularcomingsoon_150_8,"Porradaria, Colete Tudo, Gráficos Pixelados, Arcade, Pontos, Pontos, Pontos!, Comédia, 2D, Isométrico, Ação, Enredo Rico, Protagonista Mulher, Boa Trama, Retrô, Aventura, Anos 90, Combate, Um Jogador, Conteúdo Sexual, Indie, Ficção Científica"
Unfriendly Friend,2025,Indefinido,https://store.steampowered.com/app/2938980/Unfriendly_Friend/?snr=1_7_7_popularcomingsoon_150_8,"Violência Detalhada, Terror Psicológico, Terror, JRPG, Violento, Boa Trama, Romance Visual, Sombrio, 2D, Indie, Estilizado, RPG, Atmosférico, Desenhado à Mão, Protagonista Mulher, Você Decide, Quebra-Cabeça, Anime, Comovente, Um Jogador"
SHINONOME ABYSS The Maiden Exorcist,2025,Indefinido,https://store.steampowered.com/app/2948080/SHINONOME_ABYSS_The_Maiden_Exorcist/?snr=1_7_7_popularcomingsoon_150_8,"RPG, Calabouço Misterioso, Roguelike, Explorador de Calabouços, 2D, Controle, Visão Superior, Ação, Geração Procedural, Pontos, Pontos, Pontos!, Plataforma 2D, Aventura, JRPG, Ação / Aventura, Gráficos Pixelados, Terror, Difícil, Um Jogador, Retrô, Indie"
Shadows of the Afterland,2025,Indefinido,https://store.steampowered.com/app/2506100/Shadows_of_the_Afterland/?snr=1_7_7_popularcomingsoon_150_8,"Aventura, Apontar e Clicar, Protagonista Mulher, Velha-Guarda, Fantasia, Comédia, Gráficos Pixelados, Quebra-Cabeça, 2D, Sobrenatural, Boa Trama, Exploração, Fantasia Sombria, Casual, Humor Ácido, Colorido, Engraçado, Investigação, Detetive, Um Jogador"
Generation Exile,2025,Indefinido,https://store.steampowered.com/app/2963240/Generation_Exile/?snr=1_7_7_popularcomingsoon_150_8,"Construção de Cidades, Simulador de Colônias, Construção, Gerenciamento, Natureza, Simulação, Espacial, Sobrevivência, Construção de Bases, 3D, Você Decide, Vários Finais, Geração Procedural, Boa Trama, Colorido, Ficção Científica, Atmosférico, Um Jogador, Gerenciamento de Recursos, Narrativa"
Sliding Hero,Q4 2025,Indefinido,https://store.steampowered.com/app/2966300/Sliding_Hero/?snr=1_7_7_popularcomingsoon_150_8,"Metroidvania, Mistério, Não Linear, Quebra-Cabeça, Sokoban, Lógica, Aventura, Fantasia Sombria, Exploração, Mundo Aberto, Atmosférico, Ação / Aventura, Indie, 2D, Retrô, Colete Tudo, Visão Superior, Gráficos Pixelados, Boa Trama, Gótico"
Decktamer,2025,Indefinido,https://store.steampowered.com/app/2870340/Decktamer/?snr=1_7_7_popularcomingsoon_150_8,"Montagem de Decks Roguelike, Estratégia, Combate em Turnos, Coleção de Criaturas, Montagem de Decks, Estratégia em Turnos, Cartas, Batalha com Cartas, 2D, Fantasia, Desenhado à Mão, Controle, Um Jogador"
Project Rebearth,Q4 2025,Indefinido,https://store.steampowered.com/app/2871870/Project_Rebearth/?snr=1_7_7_popularcomingsoon_150_8,"Casual, Estratégia, Construção de Cidades, Grande Estratégia, Exploração, 2,5D, Desenhado à Mão, Visão Superior, Construção, Gerenciamento, Pós-Apocalíptico, Construção de Bases, Mundo Aberto, Geração Procedural, Gerenciamento de Recursos, Multijogador Massivo, Troca, Multijogador, Um Jogador, Indie"
"Below, Rusted Gods",Q4 2025,Indefinido,https://store.steampowered.com/app/2895680/Below_Rusted_Gods/?snr=1_7_7_popularcomingsoon_150_8,"Mistério, Um Jogador, Terror, Simulador Imersivo, Exploração, Boa Trama, Terror Psicológico, Atmosférico, Realístico, Simulação, Psicológico, Thriller, Primeira Pessoa, Anos 80, Simulador de Caminhada, Experimental, Demônios, Sombrio, Anos 90, Aventura"
Fear The Timeloop,Q4 2025,Indefinido,https://store.steampowered.com/app/2918090/Fear_The_Timeloop/?snr=1_7_7_popularcomingsoon_150_8,"Terror Psicológico, Terror de Sobrevivência, Aventura, Sobrevivência, Terror, Quebra-Cabeça, Tiro em Terceira Pessoa, Tiro, Sombrio, Boa Trama, Ação, Atmosférico, Exploração, Ação / Aventura, Realístico, Terceira Pessoa, Um Jogador, Zumbis, 3D, Cinematográfico"
Hive Blight,2025,Indefinido,https://store.steampowered.com/app/2886620/Hive_Blight/?snr=1_7_7_popularcomingsoon_150_8,"Estratégia, Batalha Automática, Roguelite, Montagem de Decks, Tático, Batalha com Cartas, Cartas, Roguelike, Coleção de Criaturas, RPG Tático, Tática por Turnos, Natureza, Explorador de Calabouços, 2D, Desenho Animado, RPG de Grupos, RPG, Colorido, Fantasia, Cartunizado"
ULTRA MUSHROOM,2025,Indefinido,https://store.steampowered.com/app/2975130/ULTRA_MUSHROOM/?snr=1_7_7_popularcomingsoon_150_8,"Psicodélico, Gráficos Pixelados, Um Jogador, Boa Trama, Aventura, Gerenciamento, Anime, Casual, Agricultura, Paródia, Ritmo, Conversas, Relaxante, Ficção Interativa, Gerenciamento de Tempo, Música, Culinária, Comédia"
ChromaGun 2: Dye Hard,2025,Indefinido,https://store.steampowered.com/app/2982340/ChromaGun_2_Dye_Hard/?snr=1_7_7_popularcomingsoon_150_8,"Quebra-Cabeça, Ficção Científica, Primeira Pessoa, Aventura, Boa Trama, Narração, Ação / Aventura, Um Jogador, Tiro em Primeira Pessoa (FPS), Plataforma, Atmosférico, Humor Ácido, Para Toda a Família, Lógica, Paródia, Relaxante, Surrealista, Engraçado, Ação, Colorido"
Pebbles Quest,2025,Free,https://store.steampowered.com/app/3002610/Pebbles_Quest/?snr=1_7_7_popularcomingsoon_150_8,"Aventura, Engraçado, Vários Finais, Escolha a sua Aventura, Comédia, Ficção Interativa, Medieval, Memes, Casual, Para Toda a Família, Desenhado à Mão, Apontar e Clicar, Um Jogador, Você Decide, 2D, Ação, Indie, Gratuito para Jogar"
ZPF,2025,Indefinido,https://store.steampowered.com/app/3095410/ZPF/?snr=1_7_7_popularcomingsoon_150_8,"Ação, Aventura, Tiro, Chuva de Balas, Mandando Bala, Câmera Lateral, 2D, Gráficos Pixelados, Anos 90, Alienígenas, Fantasia, Futurista, Velha-Guarda, Retrô, Ficção Científica, Espacial, Um Jogador, Controle, Robôs, Ação / Aventura"
To The Grave: The Wildlands of Faenora,2025,Indefinido,https://store.steampowered.com/app/3053990/To_The_Grave_The_Wildlands_of_Faenora/?snr=1_7_7_popularcomingsoon_150_8,"RPG Tático, Tática por Turnos, Roguelite, RPG de Estratégia, Estratégia em Turnos, Gráficos Pixelados, RPG, JRPG, Estratégia, Roguelike, 2D, Fofo, Colorido, Fantasia, Medieval, Tático, Velha-Guarda, Retrô, Um Jogador, Acesso Antecipado"
UNDERGROUNDED,2025,Indefinido,https://store.steampowered.com/app/3076910/UNDERGROUNDED/?snr=1_7_7_popularcomingsoon_150_8,"RPG, Apontar e Clicar, Aventura, Boa Trama, Isométrico, Quebra-Cabeça, Atmosférico, Você Decide, Um Jogador, Exploração, 2D, Objetos Ocultos, Linear, Mistério, Colete Tudo, Detetive, Escolha a sua Aventura, Engraçado, Conversas, Histórico"
SPORTAL,2025,Indefinido,https://store.steampowered.com/app/3146440/SPORTAL/?snr=1_7_7_popularcomingsoon_150_8,"Esportes, Roguelike de Ação, Tiro em Arena, Tiro em Primeira Pessoa (FPS), Roguelite, Beisebol, Boliche, Futebol Americano, Golfe, Hóquei, Tênis, RPG, Morte Permanente, 3D, Primeira Pessoa, Ação, Personalização de Armas, Gráficos Pixelados, Fantasia, Medieval"
One Last Raid,2025,Indefinido,https://store.steampowered.com/app/3027910/One_Last_Raid/?snr=1_7_7_popularcomingsoon_150_8,"Um Jogador, Ação, Roguelike, RPG, RPG de Ação, Isométrico, Medieval, Fantasia, Roguelike de Ação, Hack and Slash, 3D, Visão Superior, Você Decide, Combate, Roguelite, Estilizado, Fantasia Sombria, Controle, Saques"
