title,release_date,price,game_url,genres
SWAT Commander,2025,Indefinido,https://store.steampowered.com/app/1619310/SWAT_Commander/?snr=1_7_7_popularcomingsoon_150_19,"Acesso Antecipado, Tiro em Primeira Pessoa (FPS), Tática em Tempo Real, Tiro, Tutorial, Primeira Pessoa, 3D, Personalização de Armas, Ação, Realístico, Tático, Furtivo, Crime, Cinematográfico, Moderno, Cooperativo, Combate, Multijogador, Cooperativo On-line, Um Jogador"
EDEN.schemata();,2025,Indefinido,https://store.steampowered.com/app/1630450/EDENschemata/?snr=1_7_7_popularcomingsoon_150_19,"Aventura, Steampunk, Mistério, Vários Finais, Desenhado à Mão, Exploração, Objetos Ocultos, Ficção Interativa, Fofo, Cyberpunk, Indie, Ficção Científica, História em Quadrinhos, Desenho Animado, Um Jogador, Romance Visual"
StarRupture,2025,Indefinido,https://store.steampowered.com/app/1631270/StarRupture/?snr=1_7_7_popularcomingsoon_150_19,"Acesso Antecipado, Sobrevivência, Construção de Bases, Sobrevivência em Mundo Aberto, Mundo Aberto, Cooperativo, Simulação, Aventura, Tiro, Exploração, Fabricação, Faça o que Quiser, Multijogador, Ficção Científica, Simulador de Colônias, Simulador Imersivo, Automação, Um Jogador, Ação, Cooperativo On-line"
Touhou: the Unreachable Oneiroborder,2025,Indefinido,https://store.steampowered.com/app/1651400/Touhou_the_Unreachable_Oneiroborder/?snr=1_7_7_popularcomingsoon_150_19,"Aventura, Ação, Tiro, JRPG, Mandando Bala, Chuva de Balas, Tiro em Terceira Pessoa, Protagonista Mulher, Voo, Fantasia, Fofo, Cartunizado, Anime, 2D, Terceira Pessoa, Combate, Indie, Um Jogador, Alta Rejogabilidade, RPG"
Imperial Grace,2025,Indefinido,https://store.steampowered.com/app/1652580/Imperial_Grace/?snr=1_7_7_popularcomingsoon_150_19,"Otome, LGBTQIA+, Romance Visual, Você Decide, Estratégia, Romance, Boa Trama, Personalização de Personagem, Protagonista Mulher, Gerenciamento, Vários Finais, Escolha a sua Aventura, Político, Ficção Interativa, Gerenciamento de Recursos, Medieval, Aventura, RPG, Simulador de Encontros, Desenhado à Mão"
Townseek,2025,Indefinido,https://store.steampowered.com/app/1659360/Townseek/?snr=1_7_7_popularcomingsoon_150_19,"Aconchegante, Boa Trama, Troca, Colete Tudo, Do Bem, Aventura, Exploração, Mundo Aberto, Relaxante, 2D, Casual, Gerenciamento, Natureza, Faça o que Quiser, Fofo, Arcade, Desenho Animado, Um Jogador, Gerenciamento de Inventário, Gráficos Pixelados"
Windswept,2025,Indefinido,https://store.steampowered.com/app/1660960/Windswept/?snr=1_7_7_popularcomingsoon_150_19,"Plataforma de Precisão, Plataforma 2D, Plataforma, Gráficos Pixelados, Aventura, Indie, Ação, Fofo, Cooperativo, Retrô, 2D, Um Jogador, Difícil, Ritmo Rápido, Cooperativo Local, Colorido, Kickstarter, Colete Tudo, Multijogador Local, Corredor"
K-pop Idol Stories: Road to Debut,2025,Indefinido,https://store.steampowered.com/app/1662160/Kpop_Idol_Stories_Road_to_Debut/?snr=1_7_7_popularcomingsoon_150_19,"Simulação, RPG, Boa Trama, Simulador de Vida Real, Romance Visual, Você Decide, Casual, Combate em Turnos, Música, Vários Finais, Um Jogador, Anime, Indie, Desenhado à Mão, Gerenciamento de Recursos, Escolha a sua Aventura, Ritmo, 2D, Gerenciamento, Relaxante"
Espiocracy,2025,Indefinido,https://store.steampowered.com/app/1670650/Espiocracy/?snr=1_7_7_popularcomingsoon_150_19,"Estratégia, Simulação, Grande Estratégia, Histórico, Estratégia em Tempo Real (RTS), Jogo de Guerra, Guerra, Tático, Militar, Multijogador, Segunda Guerra Mundial, Cooperativo, História Alternativa, Faça o que Quiser, Um Jogador, Mundo Aberto, Ação, Diplomacia, Tempo Real com Pausa, RPG de Estratégia"
Eternity Egg,2025,Indefinido,https://store.steampowered.com/app/1670690/Eternity_Egg/?snr=1_7_7_popularcomingsoon_150_19,"Plataforma 3D, Surrealista, Aventura, Fantasia, Estilizado, Plataforma, Retrô, Psicodélico, Colorido, Ação, Ação / Aventura, Terceira Pessoa, Não Linear, Fofo, Humor Ácido, Acesso Antecipado, Terror, Indie, 3D, Fantasia Sombria"
Out of Action,2025,Indefinido,https://store.steampowered.com/app/1670780/Out_of_Action/?snr=1_7_7_popularcomingsoon_150_19,"Indie, Tiro em Primeira Pessoa (FPS), Jogador x Jogador (PvP), Cyberpunk, Tiro, Primeira Pessoa, Parar o Tempo, Ação, Personalização de Armas, Distópico, Ficção Científica, Sombrio, Futurista, Combate, Multijogador, Um Jogador, Anime, Personalização de Personagem, Jogador X Ambiente (PvE), Estilizado"
Fragile Existence,2025,Indefinido,https://store.steampowered.com/app/1672320/Fragile_Existence/?snr=1_7_7_popularcomingsoon_150_19,"Estratégia, Simulação, Grande Estratégia, Espacial, 4X, Ficção Científica, Multijogador, Gerenciamento, Tático, Guerra, Faça o que Quiser, Estratégia em Tempo Real (RTS), Compatível com Mods, Cooperativo, Um Jogador, Tempo Real com Pausa, Atmosférico, Alta Rejogabilidade, Economia, Histórico"
Showa American Story,Q4 2025,Indefinido,https://store.steampowered.com/app/1687540/Showa_American_Story/?snr=1_7_7_popularcomingsoon_150_19,"Aventura, Ação, RPG, Ação / Aventura, RPG de Ação, Anos 80, JRPG, Protagonista Mulher, 3D, Terceira Pessoa, Zumbis, Humor Ácido, Retrô, Boa Trama, Motocicletas, Ficção Científica, EUA, Um Jogador, Comédia, Drama"
ExeKiller,2025,Indefinido,https://store.steampowered.com/app/1701840/ExeKiller/?snr=1_7_7_popularcomingsoon_150_19,"Ação, Pós-Apocalíptico, Velho Oeste, Combate com Veículos, Boa Trama, Exploração, Ação / Aventura, Tiro em Primeira Pessoa (FPS), Vários Finais, Investigação, Aventura, Direção, Ficção Científica, Um Jogador, Furtivo, Personalização de Personagem, Tiro, Primeira Pessoa, Conversas, 3D"
Cleared Hot,2025,Indefinido,https://store.steampowered.com/app/1710820/Cleared_Hot/?snr=1_7_7_popularcomingsoon_150_19,"Voo, Combate com Veículos, Anos 80, Um Jogador, Ação, Isométrico, Militar, Jogo de Guerra, Nostalgia, SHMUP com Visão Superior, Controle com Alavanca Dupla, Retrô, 3D, Visão Superior, Tiro, Controle, Tático, Física, Guerra, Anos 90"
Mars Tactics,2025,Indefinido,https://store.steampowered.com/app/1727760/Mars_Tactics/?snr=1_7_7_popularcomingsoon_150_19,"Estratégia, RPG, Estratégia em Turnos, Tático, Guerra, Em Turnos, Tática por Turnos, Ficção Científica, Combate em Turnos, Difícil, Personalização de Personagem, Ação, Futurista, Espacial, Um Jogador, Compatível com Mods, Alienígenas, Morte Permanente, Atmosférico, Grade Hexagonal"
Lair Land Story 2: Mist of Sea,2025,Indefinido,https://store.steampowered.com/app/1749810/Lair_Land_Story_2_Mist_of_Sea/?snr=1_7_7_popularcomingsoon_150_19,"Aventura, Simulador de Encontros, Simulação, Estratégia, 2D, JRPG, Romance Visual, RPG, Indie"
Jump Ship,2025,Indefinido,https://store.steampowered.com/app/1757300/Jump_Ship/?snr=1_7_7_popularcomingsoon_150_19,"Cooperativo, Tiro em Primeira Pessoa (FPS), Jogador X Ambiente (PvE), Espacial, Ficção Científica, Exploração, Ação, Primeira Pessoa, Aventura, Roguelike de Ação, Tiro, Sombrio, Acesso Antecipado, Indie, Multijogador, Naves Espaciais, Voo, Combate, Atmosférico, Sobrevivência em Mundo Aberto"
The Touhou Empires,2025,Indefinido,https://store.steampowered.com/app/1761210/The_Touhou_Empires/?snr=1_7_7_popularcomingsoon_150_19,"Estratégia, Estratégia em Tempo Real (RTS), Simulação, Tática em Tempo Real, 3D, Fofo, Visão Superior, Multijogador, Jogador x Jogador (PvP), Tático, Mágica, Protagonista Mulher, Indie, Um Jogador, Fé, Construção de Bases, Anime"
Train Mechanic Simulator 2025,2025,Indefinido,https://store.steampowered.com/app/1773220/Train_Mechanic_Simulator_2025/?snr=1_7_7_popularcomingsoon_150_19,"Simulação, Trens, Casual, Simulador Imersivo, Transportes, Apontar e Clicar, Construção, Quebra-Cabeça, Primeira Pessoa, 3D, Realístico, EUA, Automação, Educativo, Economia, Atmosférico, Compatível com Mods, Lógica, Relaxante, Gerenciamento de Tempo"
Farm Renovator,2025,Indefinido,https://store.steampowered.com/app/1779610/Farm_Renovator/?snr=1_7_7_popularcomingsoon_150_19,"Simulação, Simulador Rural, Agricultura, Primeira Pessoa, Relaxante, Gerenciamento de Recursos, Simulador Imersivo, Construção, Faça o que Quiser, EUA, Realístico, Estratégia, 3D, Gerenciamento, Boa Trama, Mundo Aberto, Fabricação, Casual, Exploração, Simulador Automobilístico"
Título não disponível,Data não informada,Indefinido,https://store.steampowered.com/app/532790/Vampire_The_Masquerade__Bloodlines_2/?snr=1_7_7_popularcomingsoon_150_19,Sem gênero
Mewgenics,2025,Indefinido,https://store.steampowered.com/app/686060/Mewgenics/?snr=1_7_7_popularcomingsoon_150_19,"Tática por Turnos, RPG, Roguelite, Estratégia em Turnos, Combate em Turnos, Humor Ácido, Fofo, História em Quadrinhos, Engraçado, 2D, Terror, Pós-Apocalíptico, Surrealista, Você Decide, Não Linear, Gatos, Cartunizado, Mágica, Ficção Científica, Tático"
The World Well: Blood of Caro,2025,Indefinido,https://store.steampowered.com/app/2648900/The_World_Well_Blood_of_Caro/?snr=1_7_7_popularcomingsoon_150_19,"Romance Visual, Protagonista Mulher, Distópico, Vampiros, Aventura, Fantasia, 2D, Robôs, Ficção Interativa, História Alternativa, Indie, Violento, Violência Detalhada, Boa Trama, Drama, Um Jogador, Anime"
Beyond the Curtains,2025,Indefinido,https://store.steampowered.com/app/2648940/Beyond_the_Curtains/?snr=1_7_7_popularcomingsoon_150_19,"Simulador de Vida Real, Atmosférico, Relaxante, Casual, Simulação, Indie, Fofo, Anime, Boa Trama, Um Jogador, Acesso Antecipado, Isométrico, Para Toda a Família, Compatível com Mods, Incremental, Conteúdo Sexual, Terror Psicológico, Nudez"
咒印链接：鲜血的呼唤,2025,Indefinido,https://store.steampowered.com/app/2652600/_/?snr=1_7_7_popularcomingsoon_150_19,"Montagem de Decks Roguelike, Roguelike, Lovecraftiano, RPG, Gerenciamento de Inventário, Chuva de Balas, Personalização de Armas, Porradaria, Roguelike de Ação, Um Jogador, Mod, Montagem de Decks, Mandando Bala, Ação, Roguelite, Indie, Gráficos Pixelados, Visão Superior, Alta Rejogabilidade, Terror"
Little Problems: A Cozy Detective Game,2025,Indefinido,https://store.steampowered.com/app/2653470/Little_Problems_A_Cozy_Detective_Game/?snr=1_7_7_popularcomingsoon_150_19,"Detetive, Aconchegante, Casual, Investigação, Quebra-Cabeça, Anime, Apontar e Clicar, Lógica, História em Quadrinhos, Ficção Interativa, Fofo, Narração, Gráficos Pixelados, 2D, Protagonista Mulher, Um Jogador, Para Toda a Família, Comédia, Mistério, Exploração"
Responding,2025,Indefinido,https://store.steampowered.com/app/2658040/Responding/?snr=1_7_7_popularcomingsoon_150_19,"Acesso Antecipado, Ação, Aventura, Casual, Simulação, Ação / Aventura, Faça o que Quiser, Crime, Detetive, Tiro, Exploração, Mundo Aberto, Simulador Imersivo, Simulador Médico, Investigação, Primeira Pessoa, Realístico, Terceira Pessoa, Personalização de Personagem, Personalização de Armas"
The Eastern Sacrifice,December 2025,Indefinido,https://store.steampowered.com/app/2660330/The_Eastern_Sacrifice/?snr=1_7_7_popularcomingsoon_150_19,"Incremental, Estratégia, RPG, Casual, Gerenciamento, Exploração, Aventura, Indie, Jogo de Palavras, Clique e Clique, Combate em Turnos, Construção, Simulação, Mitologia, Gerenciamento de Inventário, Gerenciamento de Recursos, 2D, Um Jogador, Automação, Jogo de Divindade"
Rancher: A new life,2025,Indefinido,https://store.steampowered.com/app/2665250/Rancher_A_new_life/?snr=1_7_7_popularcomingsoon_150_19,"Simulação, Simulador Imersivo, Simulador Rural, Casual, Simulador de Vida Real, Relaxante, Primeira Pessoa, Realístico, Construção, Agricultura, Natureza, Estrada de Terra, Direção, Cachorros, Culinária, Pesca, Moderno, Fabricação, Luta Livre, 3D"
Beyond Astra,2025,Indefinido,https://store.steampowered.com/app/2669060/Beyond_Astra/?snr=1_7_7_popularcomingsoon_150_19,"4X, Estratégia, Grande Estratégia, Gerenciamento, Construção de Cidades, Simulação, Jogo de Guerra, Construção de Bases, Geração Procedural, Tempo Real com Pausa, Exploração, Estratégia em Tempo Real (RTS), Guerra, Ficção Científica, Espacial, Diplomacia, Um Jogador, Construção, Visão Superior, 3D"
HYKE:Northern Light(s),2025,Indefinido,https://store.steampowered.com/app/2680380/HYKENorthern_Lights/?snr=1_7_7_popularcomingsoon_150_19,"RPG, Ação, Casual, Gráficos Pixelados, JRPG, Pós-Apocalíptico, Atmosférico, Fofo, Mágica, Protagonista Mulher, 2D, Fantasia, Visão Superior, Boa Trama, Relaxante, Plataforma 2D, Culinária, Jogador X Ambiente (PvE), Controle"
Pastel☆Parade,2025,Indefinido,https://store.steampowered.com/app/2685840/PastelParade/?snr=1_7_7_popularcomingsoon_150_19,"Casual, Música, Ritmo, Indie, Anime, Ação, Protagonista Mulher, Fofo, Um Jogador, 2D, Colorido, Romance Visual"
"Detective Instinct: Farewell, My Beloved",2025,Indefinido,https://store.steampowered.com/app/2689930/Detective_Instinct_Farewell_My_Beloved/?snr=1_7_7_popularcomingsoon_150_19,"Aventura, Detetive, Romance Visual, Mistério, Gráficos Pixelados, Um Jogador, Boa Trama, Casual, Ficção Interativa, Anime, Investigação, Noir, Velha-Guarda, Trens"
Welcome to Planet E1d0r4d0!,2025,Indefinido,https://store.steampowered.com/app/2692950/Welcome_to_Planet_E1d0r4d0/?snr=1_7_7_popularcomingsoon_150_19,"Simulador de Encontros, Culinária, Caça, Boa Trama, Romance Visual, Ação / Aventura, RPG, Você Decide, RPG de Ação, Protagonista Mulher, Câmera Lateral, Vários Finais, Cyberpunk, Ficção Interativa, CRPG, Metroidvania, Aventura, Plataforma 2D, Gráficos Pixelados, JRPG"
Kindergarten 3,2025,Indefinido,https://store.steampowered.com/app/2695570/Kindergarten_3/?snr=1_7_7_popularcomingsoon_150_19,"Humor Ácido, Humor Pesado, Escolha a sua Aventura, Quebra-Cabeça, Ficção Interativa, Gráficos Pixelados, Comédia, Engraçado, Aventura, Enredo Rico, Boa Trama, Você Decide, 2D, Desenho Animado, Colorido, Sátira, Fofo, Investigação, Memes, Mistério"
Kemono Teatime,2025,Indefinido,https://store.steampowered.com/app/2698470/Kemono_Teatime/?snr=1_7_7_popularcomingsoon_150_19,"Simulação, Aventura, Gráficos Pixelados, Vários Finais, Casual, Comovente, Escolha a sua Aventura, Fofo, Plataforma 2D, Romance Visual, Simulador Imersivo, Protagonista Mulher, Ficção Científica, História em Quadrinhos, Comédia, Distópico, Conversas, Pós-Apocalíptico, Culinária, Gatos"
Usual June,2025,Indefinido,https://store.steampowered.com/app/2702430/Usual_June/?snr=1_7_7_popularcomingsoon_150_19,"Ação, Ação / Aventura, 3D, Terceira Pessoa, Combate, Hack and Slash, Boa Trama, Colorido, Estilizado, Conspiração, Controle, Aventura, Humor Pesado, Engraçado, Mistério, Detetive, Sobrenatural, Você Decide, Conversas, LGBTQIA+"
ALL WILL FALL: Physics-Based Survival City Builder,2025,Indefinido,https://store.steampowered.com/app/2706020/ALL_WILL_FALL_PhysicsBased_Survival_City_Builder/?snr=1_7_7_popularcomingsoon_150_19,"Simulação, Física, Simulador de Colônias, Alta Rejogabilidade, Construção de Bases, Faça o que Quiser, Gerenciamento, Sobrevivência em Mundo Aberto, Sobrevivência, Estratégia, Um Jogador, Automação, Construção, Gerenciamento de Recursos, Pós-Apocalíptico, Construção de Cidades, Atmosférico, Economia, Político, 3D"
Delverium,2025,Indefinido,https://store.steampowered.com/app/2710040/Delverium/?snr=1_7_7_popularcomingsoon_150_19,"Sobrevivência em Mundo Aberto, Sobrevivência, Simulador Rural, Faça o que Quiser, Aventura, Multijogador, Geração Procedural, Gráficos Pixelados, Fabricação, Construção, Exploração, Mundo Aberto, Cooperativo, Cooperativo On-line, 2D, RPG, Um Jogador, Cooperativo Local, Ação, Atmosférico"
Duck Detective: The Ghost of Glamping,2025,Indefinido,https://store.steampowered.com/app/2714620/Duck_Detective_The_Ghost_of_Glamping/?snr=1_7_7_popularcomingsoon_150_19,"Casual, Aventura, Detetive, Investigação, Curta-Metragem, Fofo, Indie, Noir, Mistério, Um Jogador, Apontar e Clicar, Boa Trama, Ficção Interativa, Quebra-Cabeça, 2,5D, Aves, Engraçado, Aconchegante, Isométrico, Comédia"
Star Birds,2025,Indefinido,https://store.steampowered.com/app/2719750/Star_Birds/?snr=1_7_7_popularcomingsoon_150_19,"Colorido, Gerenciamento de Recursos, Construção de Bases, Estilizado, Automação, Minimalista, Casual, Construção, Fabricação, Roguelite, Relaxante, Simulação, Gerenciamento, Ciência, Espacial, Construção de Cidades, Colete Tudo, 3D, Estratégia, Um Jogador"
WorldShards,2025,Free,https://store.steampowered.com/app/2156390/WorldShards/?snr=1_7_7_popularcomingsoon_150_20,"Simulador Rural, Ação / Aventura, Exploração, Fabricação, Natureza, Aventura, Simulação, Relaxante, Multijogador, Cooperativo On-line, RPG, MMORPG, Personalização de Personagem, Mundo Aberto, RPG de Ação, Simulador Imersivo, Simulador de Vida Real, Mágica, Mistério, Cooperativo"
Vampire Rancher,2025,Indefinido,https://store.steampowered.com/app/2159260/Vampire_Rancher/?snr=1_7_7_popularcomingsoon_150_20,"RPG, Simulador Rural, Gráficos Pixelados, Simulador de Vida Real, Simulação, Fabricação, 2D, Fofo, Colete Tudo, Exploração, Gerenciamento de Tempo, Gerenciamento, Vampiros, Um Jogador, Agricultura, Acesso Antecipado, Pesca, Mundo Aberto, Indie"
Streets of Rogue 2,2025,Indefinido,https://store.steampowered.com/app/2165810/Streets_of_Rogue_2/?snr=1_7_7_popularcomingsoon_150_20,"Simulação, Mundo Aberto, RPG, Faça o que Quiser, Roguelike de Ação, Sobrevivência em Mundo Aberto, Multijogador, Construção de Bases, Exploração, Roguelike, Personalização de Personagem, Cooperativo On-line, Um Jogador, Geração Procedural, 2D, Sobrevivência, Cooperativo Local, Fabricação, Aventura, Colorido"
Sunkissed City,2025,Indefinido,https://store.steampowered.com/app/2175840/Sunkissed_City/?snr=1_7_7_popularcomingsoon_150_20,"Simulador de Vida Real, Simulador Rural, Mundo Aberto, Faça o que Quiser, Simulação, Exploração, Personalização de Personagem, RPG, Gráficos Pixelados, Casual, Colorido, Culinária, Fabricação, Pesca, Romance, Compatível com Mods, Cooperativo, Cooperativo Local, Multijogador Local, 2D"
Hotel Galactic,2025,Indefinido,https://store.steampowered.com/app/2183670/Hotel_Galactic/?snr=1_7_7_popularcomingsoon_150_20,"Casual, Gerenciamento de Tempo, Estilizado, Colorido, Simulador de Colônias, Construção de Bases, Fofo, Gerenciamento, Aconchegante, Atmosférico, Simulação, Um Jogador, Construção, Simulador Rural, Culinária, Faça o que Quiser, Fabricação, Simulador Imersivo, Relaxante, Para Toda a Família"
Gilded Destiny,2025,Indefinido,https://store.steampowered.com/app/2189430/Gilded_Destiny/?snr=1_7_7_popularcomingsoon_150_20,"Grande Estratégia, Histórico, Economia, Estratégia, Simulação, Simulador Político, Capitalismo, Gerenciamento, Diplomacia, Tempo Real com Pausa, Simulador Imersivo, Jogo de Guerra, História Alternativa, Político, Gerenciamento de Recursos, Alta Rejogabilidade, Guerra, Compatível com Mods, Transportes, Faça o que Quiser"
Vampires: Bloodlord Rising,2025,Indefinido,https://store.steampowered.com/app/2191500/Vampires_Bloodlord_Rising/?snr=1_7_7_popularcomingsoon_150_20,"Acesso Antecipado, Vampiros, Mundo Aberto, Aventura, RPG de Ação, Cooperativo, Simulação, Gótico, Cooperativo On-line, Um Jogador, Violento, Noir, Multijogador, Exploração, Simulador Imersivo, Terceira Pessoa, Boa Trama, Ação / Aventura, Faça o que Quiser, Simulador de Vida Real"
Remnant Protocol,2025,Indefinido,https://store.steampowered.com/app/2201470/Remnant_Protocol/?snr=1_7_7_popularcomingsoon_150_20,"Simulador Espacial, Estratégia, Roguelite, Roguelike de Ação, Roguelike, Voo, Naves Espaciais, Geração Procedural, Combate com Veículos, Construção de Bases, Gerenciamento, Ficção Científica, Ação, Jogador X Ambiente (PvE), Espacial, Tático, Futurista, 3D, Seis Graus de Liberdade, Um Jogador"
COPA CITY,2025,Indefinido,https://store.steampowered.com/app/2210520/COPA_CITY/?snr=1_7_7_popularcomingsoon_150_20,"Simulação, Gerenciamento, Futebol, Esportes, Estratégia, Gerenciamento de Recursos, Visão Superior, Economia, Construção, Construção de Cidades, Capitalismo, Simulador Imersivo, Gerenciamento de Tempo, Faça o que Quiser, Fabricação, Isométrico, Gerenciamento de Inventário, Grande Estratégia, Você Decide, 3D"
Tiny Lands 2,2025,Indefinido,https://store.steampowered.com/app/2213330/Tiny_Lands_2/?snr=1_7_7_popularcomingsoon_150_20,"Relaxante, Quebra-Cabeça, Apontar e Clicar, Objetos Ocultos, Fofo, Casual, Aventura, Não Linear, Para Toda a Família, Colete Tudo, Colorido, Tela Dividida, Realístico, Plataforma 3D, Visão 3D, Atmosférico, Engraçado, 3D, Cooperativo Local, Cinematográfico"
Sintopia,2025,Indefinido,https://store.steampowered.com/app/2213700/Sintopia/?snr=1_7_7_popularcomingsoon_150_20,"Acesso Antecipado, Gerenciamento, Jogo de Divindade, Simulador de Colônias, Estratégia, Simulação, Sátira, Automação, Construção de Cidades, Faça o que Quiser, Simulador Imersivo, Construção, 3D, Desenho Animado, Engraçado, Colorido, Anos 80, Agricultura, Capitalismo, Comédia"
Imperial Ambitions,2025,Indefinido,https://store.steampowered.com/app/2219390/Imperial_Ambitions/?snr=1_7_7_popularcomingsoon_150_20,"Estratégia, Grande Estratégia, Estratégia em Turnos, Histórico, Economia, Simulação, História Alternativa, Jogo de Guerra, Gerenciamento de Recursos, 4X, Um Jogador, Gerenciamento, Capitalismo, Exploração, Grade Hexagonal, Simulador de Colônias, 2D, Em Turnos, Tática por Turnos, Alta Rejogabilidade"
Nomad Drive,2025,Indefinido,https://store.steampowered.com/app/2223980/Nomad_Drive/?snr=1_7_7_popularcomingsoon_150_20,"Direção, Cooperativo On-line, Física, Simulação, Geração Procedural, Faça o que Quiser, Sobrevivência, Pós-Apocalíptico, Escolha a sua Aventura, Simulador Automobilístico, Multijogador, Exploração, Aventura, Fabricação, Simulador de Vida Real, Gerenciamento de Recursos, Primeira Pessoa, Natureza, Atmosférico, Mundo Aberto"
STAND-ALONE,2025,Indefinido,https://store.steampowered.com/app/2226730/STANDALONE/?snr=1_7_7_popularcomingsoon_150_20,"Ação, Roguelite, Gráficos Pixelados, Você Decide, Boa Trama, Roguelike, Plataforma, Um Jogador, Plataforma 2D, Montagem de Decks, Controle, Câmera Lateral, Roguelike de Ação, Futurista, Hack and Slash, Indie, Pós-Apocalíptico, Combate, Colorido, Fantasia"
Nuclear Sub,2025,Indefinido,https://store.steampowered.com/app/2233390/Nuclear_Sub/?snr=1_7_7_popularcomingsoon_150_20,"Submarino, Guerra Fria, Combate Naval, 3D, Realístico, Subaquático, Estratégia, Tática em Tempo Real, Tático, Jogo de Guerra, Estratégia em Tempo Real (RTS), Primeira Pessoa, Ação, Mundo Aberto, Gerenciamento, Anos 80, Simulação, Direção, Combate com Veículos, Ação / Aventura"
GLUM,2025,Indefinido,https://store.steampowered.com/app/2235550/GLUM/?snr=1_7_7_popularcomingsoon_150_20,"Acesso Antecipado, Engraçado, Aventura, Comédia, Um Jogador, Primeira Pessoa, Tiro de Tiozão, Arcade, Física, Jogo de Ação Focado em Personagem, Luta Espetacular, Ação, Tiro em Primeira Pessoa (FPS), Ritmo Rápido, Parkour, Ação / Aventura, Estilizado, Plataforma 3D, Combate, Simulador Imersivo"
UNBEATABLE,2025,Indefinido,https://store.steampowered.com/app/2240620/UNBEATABLE/?snr=1_7_7_popularcomingsoon_150_20,"Ritmo, Anime, Protagonista Mulher, Boa Trama, Música, Exploração, LGBTQIA+, Arcade, Aventura, Romance Visual, Desenhado à Mão, Colorido, Anos 90, Você Decide, 3D, Um Jogador, 2D, Ação / Aventura, Controle, Conversas"
Music Power Up,2025,Indefinido,https://store.steampowered.com/app/2246370/Music_Power_Up/?snr=1_7_7_popularcomingsoon_150_20,"Produção de Áudio, Indie, Música, Desenvolvimento de Jogos, Retrô, Casual, 2D, Gráficos Pixelados, Velha-Guarda, Música Estilo 8 Bits, Um Jogador, Musical Procedural, Anos 80, Tutorial, Música Eletrônica, Simulação, Histórico, Utilitários, Narração, Aventura"
ZWAARD,2025,Indefinido,https://store.steampowered.com/app/2251170/ZWAARD/?snr=1_7_7_popularcomingsoon_150_20,"Gráficos Pixelados, Ação / Aventura, Luta 2D, Atmosférico, Hack and Slash, Ação, Soulslike, Aventura, Exploração, 2D, Fantasia, Colorido, Futurista, Pós-Apocalíptico, Boa Trama, Metroidvania, Indie, Ficção Científica, Um Jogador, Difícil"
Permafrost,2025,Indefinido,https://store.steampowered.com/app/2254990/Permafrost/?snr=1_7_7_popularcomingsoon_150_20,"Acesso Antecipado, Ação / Aventura, Sobrevivência, Cooperativo On-line, Construção, Exploração, Fabricação, Cooperativo, Multijogador, Terceira Pessoa, Aventura, Ação, Mundo Aberto, Simulação, Atmosférico, Pós-Apocalíptico, RPG, Natureza, Arco e Flecha, Culinária"
Wish Upon A Llama,2025,Indefinido,https://store.steampowered.com/app/2262630/Wish_Upon_A_Llama/?snr=1_7_7_popularcomingsoon_150_20,"RPG, Simulação, Fofo, 2D, Boa Trama, Simulador de Vida Real, Relaxante, Simulador de Encontros, Simulador Rural, Personalização de Personagem, Romance, Visão Superior, Gráficos Pixelados, Mundo Aberto, Natureza, Protagonista Mulher, Um Jogador, Simulador Imersivo, Geração Procedural, Aconchegante"
Discounty,2025,Indefinido,https://store.steampowered.com/app/2274620/Discounty/?snr=1_7_7_popularcomingsoon_150_20,"RPG, Simulação, Simulador de Vida Real, Gráficos Pixelados, Um Jogador, Relaxante, Casual, 2D, Gerenciamento, Construção, Mundo Aberto, Gerenciamento de Lojas"
